symbol,name,price,marketCap,volume,industry
GEGGL,Great Elm Group Inc.  7.25% Notes due 2027,24.445,708826458.0,437,Technology
IRWD,Ironwood Pharmaceuticals Inc. Class A Common Stock,4.3,707837646.0,3501903,Health Care
VEL,Velocity Financial Inc. Common Stock,18.01,706987611.0,83494,Finance
AUROW,Aurora Innovation Inc. Warrant,0.3601,706229232.0,17795,Technology
SSYS,Stratasys Ltd. Ordinary Shares (Israel),8.19,705753094.0,559933,Technology
HIPO,Hippo Holdings Inc. Common Stock,27.08,705052632.0,220220,Finance
MNTN,MNTN Inc. Class A Common Stock,9.03,704503994.0,1309699,Consumer Discretionary
CCSI,Consensus Cloud Solutions Inc. Common Stock,38.26,703905567.0,148403,Technology
ACRS,Aclaris Therapeutics Inc. Common Stock,5.02,701111674.0,1841075,Health Care
TRON,Tron Inc. Common Stock,1.475,699713544.0,1183107,Consumer Discretionary
DGICA,Donegal Group Inc. Class A Common Stock,18.83,697644024.0,156216,Finance
NABL,N-able Inc. Common Stock,3.69,695115890.0,3253636,Technology
BHFAN,Brighthouse Financial Inc. Depositary shares each representing a 1/1000th interest in a share of 5.375% Non-Cumulative Preferred Stock Series C,12.09,694519541.0,172126,Finance
ORN,Orion Group Holdings Inc. Common,17.14,693814825.0,627340,Industrials
WASH,Washington Trust Bancorp Inc. Common Stock,36.37,693415617.0,187445,Finance
SXC,SunCoke Energy Inc. Common Stock,8.17,693250628.0,1299995,Industrials
PSTL,Postal Realty Trust Inc. Class A Common Stock,24.98,690043973.0,486449,Real Estate
EIKN,Eikon Therapeutics Inc. Common Stock,12.74,689726121.0,461237,Health Care
MEI,Methode Electronics Inc. Common Stock,19.42,688862473.0,1345639,Technology
SWBI,Smith & Wesson Brands Inc. Common Stock,15.4,688796847.0,775035,Industrials
TXO,TXO Partners L.P. Common Units Representing Limited Partner Interests,12.38,683902237.0,100563,Energy
CUBB,Customers Bancorp Inc 5.375% Subordinated Notes Due 2034,21.6,683067384.0,665,Finance
TCMD,Tactile Systems Technology Inc. Common Stock,30.27,682777990.0,246397,Health Care
SLRC,SLR Investment Corp. Common Stock,12.47,680296286.0,352870,Finance
AROW,Arrow Financial Corporation Common Stock,41.13,679838551.0,89263,Finance
IHRT,iHeartMedia Inc. Class A Common Stock,4.49,678674263.0,1094126,Consumer Discretionary
NMFC,New Mountain Finance Corporation Common Stock,7.17,677223636.0,675074,Finance
KELYB,Kelly Services Inc. Class B Common Stock,19.5,676049205.0,1556,Consumer Discretionary
NXP,Nuveen Select Tax Free Income Portfolio Common Stock,14.4,673907227.0,157507,Finance
FDMT,4D Molecular Therapeutics Inc. Common Stock,12.88,673318152.0,1523057,Health Care
FOF,Cohen & Steers Closed-End Opportunity Fund Inc. Common Stock,13.69,672707817.0,37253,Finance
NEWTG,NewtekOne Inc. 8.50% Fixed Rate Senior Notes due 2029,25.55,672523319.0,27573,Finance
PRME,Prime Medicine Inc. Common Stock,3.72,671896918.0,5294434,Health Care
BCAL,California BanCorp Common Stock,20.87,671279877.0,184588,Finance
DLY,DoubleLine Yield Opportunities Fund Common Shares of Beneficial Interest,14.0,671240906.0,254221,Finance
RSVR,Reservoir Media Inc. Common Stock,10.2,669749483.0,41192,Consumer Discretionary
TIPT,Tiptree Inc. Common Stock,17.82,669498737.0,308655,Finance
TCBX,Third Coast Bancshares Inc. Common Stock,40.31,668826382.0,104330,Finance
FBIOP,Fortress Biotech Inc. 9.375% Series A Cumulative Redeemable Perpetual Preferred Stock,20.08,667038966.0,5255,Health Care
VMO,Invesco Municipal Opportunity Trust Common Stock,9.89,666988375.0,313296,Finance
VRRM,Verra Mobility Corporation Class A Common Stock,4.39,666870207.0,5885631,Consumer Discretionary
RMT,Royce Micro-Cap Trust Inc. Common Stock,14.41,666737832.0,228170,Finance
NB,NioCorp Developments Ltd. Common Stock,4.57,665332809.0,3423502,Basic Materials
NEWTI,NewtekOne Inc. 8.00% Fixed Rate Senior Notes due 2028,25.268,665100556.0,73,Finance
ANGX,Angel Studios Inc. Class A Common Stock,3.56,663628016.0,2105018,Consumer Discretionary
PFIS,Peoples Financial Services Corp. Common Stock,66.29,663621301.0,60818,Finance
VTS,Vitesse Energy Inc. Common Stock,15.9,663227542.0,493056,Energy
NPB,Northpointe Bancshares Inc. Common Stock,19.16,662588093.0,149225,Finance
CASS,Cass Information Systems Inc Common Stock,51.32,660547367.0,73879,Consumer Discretionary
HIFS,Hingham Institution for Savings Common Stock,306.99,659230326.0,17389,Finance
CCOI,Cogent Communications Holdings Inc.,13.14,658020492.0,1978934,Consumer Discretionary
BALY,Bally's Corporation Common Stock,13.39,655424365.0,72865,Consumer Discretionary
KRT,Karat Packaging Inc. Common Stock,32.79,654610739.0,236823,Industrials
TRTX,TPG RE Finance Trust Inc. Common Stock,8.46,654027448.0,663786,Real Estate
BSTZ,BlackRock Science and Technology Term Trust Common Shares of Beneficial Interest,29.37,650775467.0,674634,Finance
EVH,Evolent Health Inc Class A Common Stock,5.77,649015757.0,2949018,Consumer Discretionary
MGRE,Affiliated Managers Group Inc. 6.750% Junior Subordinated Notes due 2064,22.81,648079157.0,21872,Finance
MSBI,Midland States Bancorp Inc. Common Stock,31.11,644904047.0,169776,Finance
RMR,The RMR Group Inc. Class A Common Stock,20.74,644876722.0,135631,Consumer Discretionary
BHB,Bar Harbor Bankshares Inc. Common Stock,38.35,642059688.0,183316,Finance
NCDL,Nuveen Churchill Direct Lending Corp. Common Stock,13.0,642031845.0,135601,Uncategorized
ACHV,Achieve Life Sciences Inc. Common Shares,6.23,639565925.0,2176270,Health Care
BTBT,Bit Digital Inc. Ordinary Shares,1.83,639018469.0,23048307,Finance
CNNE,Cannae Holdings Inc. Common Stock,14.49,636697932.0,482376,Consumer Discretionary
PHR,Phreesia Inc. Common Stock,10.29,636044338.0,1330714,Consumer Discretionary
CARS,Cars.com Inc. Common Stock ,11.14,635197965.0,967362,Technology
DNA,Ginkgo Bioworks Holdings Inc. Class A Common Stock,10.21,634402914.0,1317543,Health Care
MNPR,Monopar Therapeutics Inc. Common Stock,94.56,633463303.0,119951,Health Care
AMSF,AMERISAFE Inc. Common Stock,33.77,631626347.0,338534,Finance
RILYT,BRC Group Holdings Inc. 6.00% Senior Notes Due 2028,20.62,628849501.0,21249,Finance
LEGH,Legacy Housing Corporation Common Stock (TX),26.39,627596450.0,163746,Consumer Discretionary
FBRT,Franklin BSP Realty Trust Inc. Common Stock,8.15,627248523.0,1924339,Real Estate
XFLT,XAI Floating Rate & Alternative Income Trust Common Shares of Beneficial Interest,17.66,626374275.0,62800,Finance
VLGEA,Village Super Market Inc. Class A Common Stock,42.21,625108615.0,32960,Consumer Staples
TECX,Tectonic Therapeutic Inc. Common Stock,33.09,624381365.0,256854,Health Care
ILPT,Industrial Logistics Properties Trust Common Shares of Beneficial Interest,9.36,623988809.0,611539,Real Estate
FISN,Deep Fission Inc. Common Stock,11.05,623177159.0,277758,Utilities
ADV,Advantage Solutions Inc. Class A Common Stock,46.82,622485010.0,210171,Consumer Discretionary
CLDT,Chatham Lodging Trust (REIT) Common Shares of Beneficial Interest,13.33,622260663.0,333117,Real Estate
NUAI,New Era Energy & Digital Inc. Common Stock,6.14,621926298.0,8785958,Energy
NRIM,Northrim BanCorp Inc Common Stock,27.88,620184076.0,175996,Finance
NRDS,NerdWallet Inc. Class A Common Stock,9.39,617850572.0,910755,Technology
NTGR,NETGEAR Inc. Common Stock,22.96,616244173.0,287913,Utilities
BBOT,BridgeBio Oncology Therapeutics Inc. Common Stock  ,7.66,613620417.0,235837,Health Care
PACK,Ranpak Holdings Corp Class A Common Stock,7.17,613356754.0,487669,Consumer Discretionary
HY,Hyster-Yale Inc. Class A common stock,34.23,613261325.0,101262,Industrials
CSV,Carriage Services Inc. Common Stock,38.59,612513138.0,121553,Consumer Discretionary
GAIN,Gladstone Investment Corporation Business Development Company,15.38,612461852.0,210409,Finance
ACNB,ACNB Corporation Common Stock,59.93,612007797.0,104575,Finance
RGNX,REGENXBIO Inc. Common Stock,11.83,611582856.0,2544258,Health Care
NFBK,Northfield Bancorp Inc. Common Stock (Delaware),14.64,611422793.0,461295,Finance
RWT,Redwood Trust Inc. Common Stock,4.87,609800639.0,4097396,Real Estate
UHT,Universal Health Realty Income Trust Common Stock,43.88,608861240.0,204091,Real Estate
FEIM,Frequency Electronics Inc. Common Stock,61.77,607935831.0,289029,Industrials
PUBM,PubMatic Inc. Class A Common Stock,13.07,607014258.0,794736,Technology
BHFAM,Brighthouse Financial Inc. Depositary shares each representing a 1/1000th Interest in a Share of 4.625% Non-Cumulative Preferred Stock Series D,10.52,604329658.0,37185,Finance
RGR,Sturm Ruger & Company Inc. Common Stock,37.89,604127746.0,111179,Industrials
RRBI,Red River Bancshares Inc. Common Stock,91.665,603586159.0,113813,Consumer Discretionary
IIM,Invesco Value Municipal Income Trust Common Stock,12.77,601063966.0,84472,Finance
GOOD,Gladstone Commercial Corporation Real Estate Investment Trust,12.41,600730783.0,497423,Real Estate
ZSQR,Z Squared Inc. Common Stock,11.67,600205523.0,671015,Finance
KRNY,Kearny Financial Corp Common Stock,9.27,600131930.0,743840,Finance
CRMD,CorMedix Inc. Common Stock,7.64,599372447.0,1283626,Health Care
CERS,Cerus Corporation Common Stock,2.99,599103232.0,2341284,Technology
KE,Kimball Electronics Inc. Common Stock,24.9,598818233.0,163515,Technology
FTH,Faeth Therapeutics Inc. Common Stock,23.22,598582668.0,66793,Health Care
DNUT,Krispy Kreme Inc. Common Stock,3.47,598228000.0,4942485,Consumer Staples
BBCP,Concrete Pumping Holdings Inc. Common Stock,11.86,597665961.0,263282,Consumer Discretionary
SSSSL,SuRo Capital Corp. 6.00% Notes due 2026,25.0,597202675.0,3750,Finance
MLR,Miller Industries Inc. Common Stock,52.38,596907604.0,82601,Consumer Discretionary
TREE,LendingTree Inc. Common Stock,42.76,596631050.0,438052,Finance
TRAX,First Tracks Biotherapeutics Inc. Ordinary Shares ,17.01,593519401.0,331503,Health Care
CIVB,Civista Bancshares Inc. Common Stock,28.43,590870584.0,165328,Finance
EVGO,EVgo Inc. Class A Common Stock,1.88,590055606.0,4318631,Technology
UNTY,Unity Bancorp Inc. Common Stock,58.7,589400947.0,59639,Finance
IIIV,i3 Verticals Inc. Class A Common Stock,21.1,589354945.0,727788,Technology
PRTH,Priority Technology Holdings Inc. Common Stock,7.14,588015914.0,754983,Consumer Discretionary
BWB,Bridgewater Bancshares Inc. Common Stock,21.07,587502543.0,335744,Finance
WHFCL,WhiteHorse Finance Inc. 7.875% Notes due 2028,25.27,587352834.0,173,Uncategorized
IIIN,Insteel Industries Inc. Common Stock,30.22,587272724.0,253179,Industrials
GRNT,Granite Ridge Resources Inc. Common Stock,4.44,585618196.0,1148192,Energy
SLDP,Solid Power Inc. Class A Common Stock,2.6,584957599.0,5490568,Miscellaneous
SFIX,Stitch Fix Inc. Class A Common Stock,4.38,584405249.0,2053882,Consumer Discretionary
FLGT,Fulgent Genetics Inc. Common Stock,20.53,583064790.0,294625,Health Care
CLPT,ClearPoint Neuro Inc. Common Stock,19.43,582697209.0,878193,Health Care
MDXG,MiMedx Group Inc Common Stock,3.91,582377808.0,1300733,Health Care
MG,Mistras Group Inc Common Stock,18.23,580018095.0,305305,Consumer Discretionary
METCB,Ramaco Resources Inc. Class B Common Stock,8.7,578234555.0,55195,Energy
SFST,Southern First Bancshares Inc. Common Stock,61.0,576765065.0,125841,Finance
CTEV,Claritev Corporation Class A Common Stock,33.82,576556224.0,145984,Consumer Discretionary
ELMT,The Elmet Group Co. Common Stock,19.21,575913168.0,826033,Industrials
SMC,Summit Midstream Corporation Common Stock,28.31,575790097.0,69327,Utilities
CBNK,Capital Bancorp Inc. Common Stock,35.12,572781562.0,52456,Finance
RILYL,BRC Group Holdings Inc. Depositary Shares each representing 1/1000th in a share of 7.375% Series B Cumulative Perpetual Preferred Stock par value $0.0001,14.25,572774418.0,2301,Finance
BME,Blackrock Health Sciences Trust,42.91,572119802.0,77791,Finance
ALT,Altimmune Inc. Common Stock,2.94,571754013.0,3638896,Health Care
PROK,ProKidney Corp. Class A Ordinary Shares,1.89,570892693.0,1437847,Health Care
DC,Dakota Gold Corp. Common Stock,4.26,570533693.0,1850242,Basic Materials
VGM,Invesco Trust for Investment Grade Municipals Common Stock (DE),10.5,569435664.0,186410,Finance
XMAX,XMAX Inc. Common Stock,8.95,569240818.0,1410156,Consumer Discretionary
RILYP,BRC Group Holdings Inc. Depositary Shares each representing a 1/1000th fractional interest in a share of Series A Cumulative Perpetual Preferred Stock,14.15,568754948.0,26444,Finance
OCGN,Ocugen Inc. Common Stock,1.67,565331500.0,14239123,Health Care
FET,Forum Energy Technologies Inc. Common Stock,50.0,565214300.0,119525,Consumer Discretionary
RILYZ,BRC Group Holdings Inc. 5.25% Senior Notes due 2028,18.53,565110633.0,36319,Finance
NPCE,Neuropace Inc. Common Stock,16.53,563569605.0,161376,Health Care
GCBC,Greene County Bancorp Inc. Common Stock,33.1,563543554.0,83342,Finance
BDN,Brandywine Realty Trust Common Stock,3.24,562826378.0,2019520,Real Estate
ETD,Ethan Allen Interiors Inc. Common Stock,22.11,562618555.0,464638,Consumer Discretionary
CTNM,Contineum Therapeutics Inc. Class A Common Stock,15.0,560795655.0,449112,Health Care
CTKB,Cytek Biosciences Inc. Common Stock,4.34,560478828.0,1148540,Industrials
RFI,Cohen & Steers Total Return Realty Fund Inc. Common Stock,11.4,560180359.0,243725,Finance
TOI,The Oncology Institute Inc. Common Stock,5.6,559904425.0,2826075,Health Care
WNC,Wabash National Corporation Common Stock,13.75,559267046.0,662582,Industrials
BWBBP,Bridgewater Bancshares Inc. Depositary Shares Each Representing a 1/100th Interest in a Share of 5.875% Non-Cumulative Perpetual Preferred Stock Series A,20.0001,557670128.0,19227,Finance
MGR,Affiliated Managers Group Inc. 5.875% Junior Subordinated Notes due 2059,19.62,557444676.0,27866,Finance
VKQ,Invesco Municipal Trust Common Stock,10.06,556675281.0,365713,Finance
STRO,Sutro Biopharma Inc. Common Stock,33.35,552624141.0,465255,Health Care
MBUU,Malibu Boats Inc. Class A Common Stock,28.14,552586671.0,300735,Industrials
MYGN,Myriad Genetics Inc. Common Stock,5.85,552522029.0,1929286,Health Care
PKOH,Park-Ohio Holdings Corp. Common Stock,38.22,550298019.0,116381,Industrials
MLAB,Mesa Laboratories Inc. Common Stock,99.53,549896382.0,145427,Industrials
VELO,Velo3D Inc. Common stock,18.4,548338437.0,3368131,Technology
EBF,Ennis Inc. Common Stock,21.66,547960572.0,170301,Consumer Discretionary
ALTI,AlTi Global Inc. Class A Common Stock,3.61,547340402.0,219831,Finance
ANGO,AngioDynamics Inc. Common Stock,13.2,545409678.0,341093,Health Care
AHRT,AH Realty Trust Inc. Common Stock,7.18,545359743.0,839787,Finance
SWMR,Swarmer Inc Common Stock,48.4,542576390.0,998766,Technology
EVMN,Evommune Inc. Common Stock,15.05,542076499.0,10586922,Health Care
HBCP,Home Bancorp Inc. Common Stock,68.92,540514129.0,90381,Finance
NGS,Natural Gas Services Group Inc. Common Stock,42.77,538832071.0,104201,Energy
ACIC,American Coastal Insurance Corporation Common Stock,11.1,537950922.0,517403,Finance
OLP,One Liberty Properties Inc. Common Stock,24.64,537631199.0,115021,Real Estate
PACB,Pacific Biosciences of California Inc. Common Stock,1.73,537340920.0,8339230,Industrials
TLRY,Tilray Brands Inc. Common Stock ,4.61,537169186.0,3356439,Health Care
ARVN,Arvinas Inc. Common Stock,8.29,534880731.0,954960,Health Care
OOMA,Ooma Inc. Common Stock,19.44,534600000.0,494580,Technology
IQI,Invesco Quality Municipal Income Trust Common Stock,10.1,534126350.0,149541,Finance
KYTX,Kyverna Therapeutics Inc. Common Stock,8.78,533781961.0,1389651,Health Care
RYAM,Rayonier Advanced Materials Inc. Common Stock,7.91,533438923.0,671085,Basic Materials
ASIX,AdvanSix Inc. Common Stock ,19.73,531901780.0,370191,Industrials
BSRR,Sierra Bancorp Common Stock,40.66,531799621.0,51590,Finance
OSPN,OneSpan Inc. Common Stock,14.31,530512484.0,488755,Technology
XOMA,XOMA Royalty Corporation Common Stock,42.15,528604415.0,368111,Health Care
FBIZ,First Business Financial Services Inc. Common Stock,63.21,528572513.0,51391,Finance
CHCT,Community Healthcare Trust Incorporated Common Stock,18.49,528292453.0,151232,Real Estate
MRAM,Everspin Technologies Inc. Common Stock,22.53,528273910.0,1471518,Technology
CLFD,Clearfield Inc. Common Stock,38.75,526591575.0,165312,Utilities
STTK,Shattuck Labs Inc. Common Stock,6.85,525261541.0,2043313,Health Care
ITIC,Investors Title Company Common Stock,277.54,523994410.0,121972,Finance
RPD,Rapid7 Inc. Common Stock,7.82,522615433.0,1943798,Technology
PRTA,Prothena Corporation plc Ordinary Shares,9.97,521961773.0,420328,Health Care
AQST,Aquestive Therapeutics Inc. Common Stock,4.16,521942670.0,3293975,Health Care
MSBIP,Midland States Bancorp Inc. Depositary Shares Each Representing a 1/40th Interest in a Share of 7.750% Fixed-Rate Reset Non-Cumulative Perpetual Preferred Stock Series A,25.16,521561743.0,1994,Finance
IDR,Idaho Strategic Resources Inc. Common Stock,32.86,519511967.0,236092,Basic Materials
SSTK,Shutterstock Inc. Common Stock,14.13,519108138.0,338152,Technology
HUYA,HUYA Inc. American depositary shares each  representing one Class A ordinary share,2.32,518597247.0,445461,Technology
BWMN,Bowman Consulting Group Ltd. Common Stock,29.6,518228926.0,155031,Consumer Discretionary
OXM,Oxford Industries Inc. Common Stock,34.68,517804722.0,457168,Industrials
EGY,VAALCO Energy Inc.  Common Stock,4.95,516078352.0,1440443,Energy
VCV,Invesco California Value Municipal Income Trust Common Stock,10.77,515780954.0,100644,Finance
KIDS,OrthoPediatrics Corp. Common Stock,20.08,515754680.0,183148,Health Care
FIP,FTAI Infrastructure Inc. Common Stock ,4.36,515193100.0,2129796,Energy
TYG,Tortoise Energy Infrastructure Corporation Common Stock,42.89,511587760.0,201291,Finance
TRC,Tejon Ranch Co Common Stock,18.91,510650065.0,145326,Finance
KLC,KinderCare Learning Companies Inc. Common Stock,4.31,510425969.0,2606242,Consumer Discretionary
SD,SandRidge Energy Inc. Common Stock,13.8,509471974.0,377627,Energy
MNRO,Monro Inc. Common Stock,16.96,509228511.0,874633,Consumer Discretionary
MTW,Manitowoc Company Inc. (The) Common Stock,14.15,508120614.0,229279,Industrials
OVID,Ovid Therapeutics Inc. Common Stock,2.72,507661077.0,1552944,Health Care
HQL,abrdn Life Sciences Investors Shares of Beneficial Interest,19.76,507429607.0,203956,Finance
CABA,Cabaletta Bio Inc. Common Stock,3.11,507100416.0,5544125,Health Care
COFS,ChoiceOne Financial Services Inc. Common Stock,33.86,507054685.0,137378,Finance
TWI,Titan International Inc. (DE) Common Stock,7.85,505319886.0,689844,Industrials
FTHY,First Trust High Yield Opportunities 2027 Term Fund Common Stock,13.73,504893139.0,62051,Finance
GEMI,Gemini Space Station Inc. Class A Common Stock,4.23,504596417.0,1575315,Finance
AIOT,PowerFleet Inc. Common Stock,3.76,504520101.0,1890466,Telecommunications
OPENW,Opendoor Technologies Inc  Series K Warrants each whole warrant exercisable to purchase one share of Common Stock at an exercise price of $9.00 per warrant,0.522,503592522.0,1043098,Finance
LOCO,El Pollo Loco Holdings Inc. Common Stock,16.53,503426076.0,415153,Consumer Discretionary
ETO,Eaton Vance Tax-Advantage Global Dividend Opp Common Stock,30.69,502951955.0,27377,Finance
YORW,York Water Company (The) Common Stock,30.83,499733921.0,132825,Utilities
OBT,Orange County Bancorp Inc. Common Stock,37.24,499310345.0,177489,Finance
XRN,Chiron Real Estate Inc. Common Stock,37.56,497100215.0,86818,Real Estate
CBIO,Crescent Biopharma Inc. Common Stock,18.0,496294830.0,431807,Health Care
ASPN,Aspen Aerogels Inc. Common Stock,5.98,495607169.0,1972897,Consumer Discretionary
BXC,Bluelinx Holdings Inc. Common Stock,63.23,492080836.0,135824,Consumer Discretionary
STRZ,Starz Entertainment Corp. Common Shares,29.27,491416342.0,162197,Consumer Discretionary
SERV,Serve Robotics Inc. Common Stock,6.35,491320430.0,4342244,Consumer Discretionary
RZLT,Rezolute Inc. Common Stock (NV),5.1,491090888.0,1753940,Health Care
CRNC,Cerence Inc. Common Stock,10.85,490287728.0,815442,Technology
FRPH,FRP Holdings Inc. Common Stock,25.56,489992229.0,57052,Finance
TITN,Titan Machinery Inc. Common Stock,20.94,487947649.0,152969,Consumer Discretionary
WEAV,Weave Communications Inc. Common Stock,6.13,487737343.0,1341071,Technology
NRC,NRC Health Common Stock,21.64,487694101.0,78832,Health Care
GUT,Gabelli Utility Trust (The) Common Stock,6.6,484433591.0,277766,Finance
VITL,Vital Farms Inc. Common Stock,11.3,484187530.0,1781549,Consumer Staples
PDLB,Ponce Financial Group Inc. Common Stock,19.98,483274262.0,68206,Finance
CTGO,Contango Silver & Gold Inc. Common Stock,15.67,482184876.0,439608,Basic Materials
OIS,Oil States International Inc. Common Stock,8.0,481547320.0,788900,Consumer Discretionary
SGMT,Sagimet Biosciences Inc. Series A Common Stock,7.79,481046577.0,1353306,Health Care
CCCC,C4 Therapeutics Inc. Common Stock,4.35,480967416.0,3120901,Health Care
JOUT,Johnson Outdoors Inc. Class A Common Stock,45.8,479740894.0,52903,Consumer Discretionary
MOBI,Mobia Medical Inc. Common Stock,14.38,478120706.0,157981,Health Care
CYH,Community Health Systems Inc. Common Stock,3.39,477707654.0,1067162,Health Care
NVEC,NVE Corporation Common Stock,98.6,476944568.0,357216,Technology
BWFG,Bankwell Financial Group Inc. Common Stock,59.81,476875896.0,79593,Finance
WTI,W&T Offshore Inc. Common Stock,3.2,476088634.0,2127978,Energy
MRLN,Merlin Inc. Common Stock,4.9,472967855.0,2397637,Technology
FSTR,L.B. Foster Company Common Stock,44.94,470013079.0,115236,Industrials
EOLS,Evolus Inc. Common Stock,7.13,469544375.0,670053,Health Care
YEXT,Yext Inc. Common Stock,4.67,468158702.0,2272107,Technology
QMCO,Quantum Corporation Common Stock,11.85,466587825.0,1128380,Technology
CTRN,Citi Trends Inc. Common Stock,55.905,465680152.0,224837,Consumer Discretionary
BSVN,Bank7 Corp. Common stock,48.91,465590675.0,18455,Finance
PAYS,Paysign Inc. Common Stock,8.32,465136031.0,739030,Technology
BNED,Barnes & Noble Education Inc Common Stock,13.56,465055374.0,414733,Consumer Discretionary
RBB,RBB Bancorp Common Stock,27.34,463027178.0,301803,Finance
DIN,Dine Brands Global Inc. Common Stock,36.35,461106111.0,509856,Consumer Discretionary
CPS,Cooper-Standard Holdings Inc. Common Stock,25.95,460749620.0,267095,Consumer Discretionary
SPT,Sprout Social Inc Class A Common Stock,7.66,460408421.0,1654896,Technology
FVR,FrontView REIT Inc. Common Stock,20.31,460062689.0,116978,Real Estate
MGRB,Affiliated Managers Group Inc. 4.750% Junior Subordinated Notes due 2060,16.1,457434214.0,11232,Finance
LWAY,Lifeway Foods Inc. Common Stock,29.92,457234089.0,233852,Consumer Staples
FWRD,Forward Air Corporation Common Stock,14.43,456349414.0,647483,Industrials
GDYN,Grid Dynamics Holdings Inc. Class A Common Stock,5.44,454925734.0,12777262,Technology
ERII,Energy Recovery Inc. Common Stock,8.81,454113732.0,875562,Technology
KREF,KKR Real Estate Finance Trust Inc. Common Stock,7.06,453960944.0,1122564,Real Estate
WTBA,West Bancorporation Common Stock,26.64,453628611.0,124147,Finance
ACTG,Acacia Research Corporation (Acacia Tech) Common Stock,4.66,450105355.0,334137,Miscellaneous
ETB,Eaton Vance Tax-Managed Buy-Write Income Fund Eaton Vance Tax-Managed Buy-Write Income Fund Common Shares of Beneficial Interest,15.3,449382389.0,60861,Finance
IPI,Intrepid Potash Inc Common Stock,33.42,448931863.0,426268,Industrials
SRTA,Strata Critical Medical Inc. Class A Common Stock,5.18,448207633.0,1303291,Consumer Discretionary
CBK,Commercial Bancgroup Inc. Common Stock,32.67,447620458.0,89693,Finance
DCTH,Delcath Systems Inc. Common Stock,12.95,447055329.0,640667,Health Care
BMRC,Bank of Marin Bancorp Common Stock,27.59,446674016.0,274758,Finance
KELYA,Kelly Services Inc. Class A Common Stock,12.85,445499092.0,530147,Consumer Discretionary
BBBY,Bed Bath & Beyond Inc. Common Stock,6.01,444370355.0,2607865,Consumer Discretionary
PANL,Pangaea Logistics Solutions Ltd. Common Shares,6.775,443186103.0,701349,Consumer Discretionary
RR,Richtech Robotics Inc. Class B Common Stock,1.98,442720027.0,9010998,Industrials
EVN,Eaton Vance Municipal Income Trust Common Stock,11.15,442288867.0,70815,Finance
BLW,Blackrock Limited Duration Income Trust,12.38,442105312.0,129532,Consumer Discretionary
GBFH,GBank Financial Holdings Inc. Common Stock,30.52,441635143.0,74350,Finance
IMXI,International Money Express Inc. Common Stock,14.67,441486198.0,468992,Consumer Discretionary
AMCX,AMC Global Media Inc. Class A Common Stock,10.045,441253867.0,486497,Telecommunications
NEWT,NewtekOne Inc. Common Stock,15.22,439723303.0,470951,Finance
INV,Innventure Inc. Common Stock,5.23,439554032.0,2178875,Finance
GLAD,Gladstone Capital Corporation Common Stock,19.45,439435192.0,215843,Consumer Discretionary
RLGT,Radiant Logistics Inc. Common Stock,9.38,439281027.0,145668,Industrials
FRBA,First Bank Common Stock,17.46,438846676.0,101676,Finance
TASK,TaskUs Inc. Class A Common Stock,4.79,438659602.0,596890,Technology
SI,Shoulder Innovations Inc. Common Stock,21.09,437369186.0,122600,Health Care
VMD,Viemed Healthcare Inc. Common Shares,11.39,436656175.0,404761,Health Care
FBRX,Forte Biosciences Inc. Common Stock,21.32,436608378.0,474517,Health Care
EBS,Emergent BioSolutions Inc. Common Stock,8.46,436504664.0,695076,Health Care
BNTC,Benitec Biopharma Inc. Common Stock,12.7,436300042.0,98473,Health Care
IPSC,Century Therapeutics Inc. Common Stock,2.41,434655090.0,1868719,Health Care
QUAD,Quad Graphics Inc Class A Common Stock,8.42,434131184.0,179747,Consumer Discretionary
LDI,loanDepot Inc. Class A Common Stock,1.28,432414591.0,1683418,Finance
AIV,Apartment Investment and Management Company Common Stock,3.0,431568549.0,1340851,Real Estate
CBAN,Colony Bankcorp Inc. Common Stock,20.26,428694894.0,419854,Finance
CAL,Caleres Inc. Common Stock,12.76,428605133.0,724785,Consumer Discretionary
ASMB,Assembly Biosciences Inc. Common Stock,26.96,428464712.0,236147,Health Care
MPTI,M-tron Industries Inc. Common Stock,99.06,428082144.0,181466,Technology
CCRN,Cross Country Healthcare Inc. Common Stock $0.0001 Par Value,13.21,427114452.0,218803,Consumer Discretionary
PBFS,Pioneer Bancorp Inc. Common Stock,17.0,426305617.0,17427,Finance
SGU,Star Group L.P. Common Stock,12.98,426184450.0,17057,Consumer Discretionary
OPTX,Syntec Optics Holdings Inc. Class A Common Stock,10.58,426161109.0,500622,Technology
