symbol,name,price,marketCap,volume,industry
NVDA,NVIDIA Corporation Common Stock,194.97,4718274000000.0,148837799,Technology
GOOGL,Alphabet Inc. Class A Common Stock,353.65,4284823400000.0,34214056,Technology
GOOG,Alphabet Inc. Class C Capital Stock,351.28,4256108480000.0,25565777,Technology
AAPL,Apple Inc. Common Stock,281.74,4138015679440.0,66427169,Technology
MSFT,Microsoft Corporation Common Stock,368.57,2737898178853.0,51230088,Technology
AMZN,Amazon.com Inc. Common Stock,240.14,2583212259961.0,77619330,Consumer Discretionary
SPCX,Space Exploration Technologies Corp. Class A Common Stock,164.19,2149387312513.0,81443450,Technology
AVGO,Broadcom Inc. Common Stock,372.45,1771960744745.0,24285509,Technology
TSLA,Tesla Inc. Common Stock,411.84,1546757319033.0,57647170,Industrials
META,Meta Platforms Inc. Class A Common Stock,562.6,1428116950830.0,15011906,Technology
MU,Micron Technology Inc. Common Stock,1145.28,1293471387977.0,60694498,Technology
LLY,Eli Lilly and Company Common Stock,1229.93,1158276007482.0,3684985,Health Care
BRK/B,Berkshire Hathaway Inc.,496.0,1094330440016.0,5200703,Uncategorized
BRK/A,Berkshire Hathaway Inc.,743510.0,1093609527740.0,224,Uncategorized
WMT,Walmart Inc. Common Stock,114.6,911995871163.0,20367006,Consumer Discretionary
JPM,JP Morgan Chase & Co. Common Stock,329.39,882604265975.0,7981814,Finance
AMD,Advanced Micro Devices Inc. Common Stock,539.49,879692738734.0,26671612,Technology
INTC,Intel Corporation Common Stock,131.72,662024720000.0,106805539,Technology
V,Visa Inc.,341.65,647244977509.0,11710960,Consumer Discretionary
JNJ,Johnson & Johnson Common Stock,258.51,622289659173.0,8608401,Health Care
GOOGM,Alphabet Inc. Depositary Shares representing a 1/20th Interest in a Share of Series A Mandatory Convertible Preferred Stock,50.11,607132760000.0,4111786,Technology
GOOGN,Alphabet Inc. Depositary Shares representing a 1/20th Interest in a Share of Series B Mandatory Convertible Preferred Stock,49.91,604709560000.0,3561549,Technology
XOM,Exxon Mobil Corporation Common Stock,136.06,563961510862.0,11972712,Energy
AMAT,Applied Materials Inc. Common Stock,694.64,551515978455.0,14165323,Technology
LRCX,Lam Research Corporation Common Stock,410.91,513872129610.0,14049633,Technology
CAT,Caterpillar Inc. Common Stock,1033.19,475925568893.0,3146957,Industrials
CSCO,Cisco Systems Inc. Common Stock (DE),117.7,463906860071.0,22447209,Telecommunications
MA,Mastercard Incorporated Common Stock,509.64,450309675862.0,4812112,Consumer Discretionary
ABBV,AbbVie Inc. Common Stock,254.31,449313082309.0,9760537,Health Care
ORCL,Oracle Corporation Common Stock,147.76,425618394960.0,34310386,Technology
COST,Costco Wholesale Corporation Common Stock,946.68,419832514171.0,2450223,Consumer Discretionary
BAC,Bank of America Corporation Common Stock,57.88,410750666880.0,28920859,Finance
GE,GE Aerospace Common Stock,373.71,389905558092.0,6071499,Technology
UNH,UnitedHealth Group Incorporated Common Stock (DE),419.82,381257183687.0,5167420,Health Care
KLAC,KLA Corporation Common Stock,278.39,363653955712.0,14628660,Technology
KO,Coca-Cola Company (The) Common Stock,82.65,355738235284.0,15015800,Consumer Staples
HD,Home Depot Inc. (The) Common Stock,350.81,349798503212.0,5786522,Consumer Discretionary
PG,Procter & Gamble Company (The) Common Stock,148.45,345680518284.0,10387697,Consumer Discretionary
CVX,Chevron Corporation Common Stock,168.47,335524469910.0,8813702,Energy
MS,Morgan Stanley Common Stock,211.72,333942741455.0,5426409,Finance
MRK,Merck & Company Inc. Common Stock (new),129.38,319545882813.0,9584598,Health Care
NFLX,Netflix Inc. Common Stock,73.78,310672715396.0,42429923,Consumer Discretionary
SNDK,Sandisk Corporation Common Stock,2050.39,303641758906.0,11251099,Technology
GS,Goldman Sachs Group Inc. (The) Common Stock,1020.21,300969520978.0,1887195,Finance
GEV,GE Vernova Inc. Common Stock,1102.51,296266481687.0,3180547,Uncategorized
PM,Philip Morris International Inc Common Stock,182.87,285013656168.0,5039947,Health Care
PLTR,Palantir Technologies Inc. Class A Common Stock,115.7,277368995739.0,45017696,Technology
PANW,Palo Alto Networks Inc. Common Stock,332.0,270580000000.0,10334738,Technology
DELL,Dell Technologies Inc. Class C Common Stock ,414.61,268712054149.0,8818468,Technology
IBM,International Business Machines Corporation Common Stock,278.0,261288107840.0,6464237,Technology
TXN,Texas Instruments Incorporated Common Stock,285.48,259813289975.0,12982631,Technology
WFC,Wells Fargo & Company Common Stock,83.51,255556424644.0,16658293,Finance
RTX,RTX Corporation Common Stock,187.33,252274206567.0,3594352,Industrials
C,Citigroup Inc. Common Stock,142.49,243027660318.0,9526134,Finance
MRVL,Marvell Technology Inc. Common Stock,277.75,242975700000.0,31749269,Technology
CCZ,Comcast Holdings ZONES,66.25,236765672388.0,140,Telecommunications
LIN,Linde plc Ordinary Shares,511.06,236416120401.0,2314677,Basic Materials
AXP,American Express Company Common Stock,340.88,232591437890.0,2604917,Finance
WDC,Western Digital Corporation Common Stock,651.88,224691387556.0,11268908,Technology
GLW,Corning Incorporated Common Stock,255.69,220056485474.0,24307537,Industrials
ANET,Arista Networks Inc. Common Stock,164.1,206635145511.0,8535704,Telecommunications
APH,Amphenol Corporation Common Stock,166.42,204735616337.0,6196598,Technology
QCOM,QUALCOMM Incorporated Common Stock,188.72,198910880000.0,21599540,Technology
AMGN,Amgen Inc. Common Stock,360.55,194591818191.0,2461891,Health Care
ADI,Analog Devices Inc. Common Stock,391.78,190830960531.0,5169312,Technology
MCD,McDonald's Corporation Common Stock,267.18,189832955408.0,4521983,Consumer Discretionary
PEP,PepsiCo Inc. Common Stock,138.68,189543429924.0,10042384,Consumer Staples
CRWD,CrowdStrike Holdings Inc. Class A Common Stock,742.91,189118750426.0,4939840,Technology
TMUS,T-Mobile US Inc. Common Stock,173.97,188271154616.0,7760337,Telecommunications
TMO,Thermo Fisher Scientific Inc Common Stock,506.42,188196542305.0,2076446,Industrials
NEE,NextEra Energy Inc. Common Stock,88.66,184886373489.0,11131256,Technology
VZ,Verizon Communications Inc. Common Stock,44.1,184142147931.0,55387693,Telecommunications
DIS,Walt Disney Company (The) Common Stock,98.63,171272121749.0,10418122,Consumer Discretionary
BA,Boeing Company (The) Common Stock,214.69,169240627442.0,5848520,Industrials
DE,Deere & Company Common Stock,626.63,169150888628.0,1207651,Industrials
APP,Applovin Corporation Class A Common Stock,498.76,167553434400.0,5300337,Technology
TJX,TJX Companies Inc. (The) Common Stock,151.23,167064453369.0,7586046,Consumer Discretionary
UNP,Union Pacific Corporation Common Stock,272.7,161905593185.0,2828209,Industrials
ABT,Abbott Laboratories Common Stock,92.71,161483430293.0,10314406,Health Care
WELL,Welltower Inc. Common Stock,227.73,160757897699.0,2592780,Real Estate
SCHW,Charles Schwab Corporation (The) Common Stock,90.55,157478720159.0,9170706,Finance
GILD,Gilead Sciences Inc. Common Stock,126.33,156847522182.0,6897709,Health Care
UBER,Uber Technologies Inc. Common Stock,75.5,153687725482.0,26220793,Consumer Discretionary
T,AT&T Inc.,21.82,151612753380.0,84994878,Telecommunications
IBKR,Interactive Brokers Group Inc. Class A Common Stock,88.2,149618400044.0,4775106,Finance
BLK,BlackRock Inc. Common Stock,950.17,147498679328.0,884930,Finance
TBB,AT&T Inc. 5.350% Global Notes due 2066,20.55,146940421614.0,201721,Telecommunications
ISRG,Intuitive Surgical Inc. Common Stock,405.97,143779488967.0,2328654,Health Care
BKNG,Booking Holdings Inc. Common Stock,182.41,141345575511.0,8451437,Consumer Discretionary
SCCO,Southern Copper Corporation Common Stock,168.45,140542636836.0,1413283,Basic Materials
PFE,Pfizer Inc. Common Stock,24.37,138895454399.0,47527994,Health Care
DHR,Danaher Corporation Common Stock,192.78,136444021473.0,3522544,Industrials
CVS,CVS Health Corporation Common Stock,103.58,132160550459.0,4788393,Consumer Staples
PLD,Prologis Inc. Common Stock,138.89,129492424820.0,3343903,Real Estate
CRM,Salesforce Inc. Common Stock,157.93,129344670000.0,12664087,Technology
PGR,Progressive Corporation (The) Common Stock,219.86,128472214975.0,3572005,Finance
COP,ConocoPhillips Common Stock,104.2,126946235529.0,5906034,Energy
VRTX,Vertex Pharmaceuticals Incorporated Common Stock,499.65,126813876604.0,2055780,Health Care
SYK,Stryker Corporation Common Stock,330.52,126708399056.0,2810038,Health Care
COF,Capital One Financial Corporation Common Stock,202.28,124608420617.0,3174871,Finance
MO,Altria Group Inc.,74.05,123655445952.0,5519862,Health Care
LOW,Lowe's Companies Inc. Common Stock,219.65,123159301556.0,2373008,Consumer Discretionary
PH,Parker-Hannifin Corporation Common Stock,963.79,121520800854.0,570585,Industrials
SPGI,S&P Global Inc. Common Stock,408.56,120933760000.0,2577398,Finance
BMY,Bristol-Myers Squibb Company Common Stock,58.56,119583692224.0,11770947,Health Care
SBUX,Starbucks Corporation Common Stock,104.06,118597182000.0,6789199,Consumer Discretionary
VRT,Vertiv Holdings LLC Class A Common Stock,306.97,117909883248.0,6708655,Technology
LMT,Lockheed Martin Corporation Common Stock,502.07,115759070669.0,997489,Industrials
FTNT,Fortinet Inc. Common Stock,155.42,113868212929.0,6780275,Technology
SO,Southern Company (The) Common Stock,96.75,109164943069.0,4566947,Utilities
HWM,Howmet Aerospace Inc. Common Stock,268.57,107456866709.0,5271632,Industrials
PWR,Quanta Services Inc. Common Stock,714.45,107210473453.0,1422651,Industrials
EQIX,Equinix Inc. Common Stock REIT,1085.17,107024075202.0,478437,Real Estate
MDT,Medtronic plc. Ordinary Shares,80.93,103594057227.0,8597346,Health Care
NOW,ServiceNow Inc. Common Stock,99.97,103069070000.0,25023078,Technology
CDNS,Cadence Design Systems Inc. Common Stock,372.72,102802139520.0,2675784,Technology
NEM,Newmont Corporation,94.51,100894411726.0,7805986,Basic Materials
DUK,Duke Energy Corporation (Holding Company) Common Stock,128.33,100045582528.0,2818791,Utilities
PNC,PNC Financial Services Group Inc. (The) Common Stock,246.73,99078041653.0,2366685,Finance
MAR,Marriott International Class A Common Stock,374.88,98851590990.0,1487457,Consumer Discretionary
BNY,The Bank of New York Mellon Corporation Common Stock,143.8,98701306671.0,2536487,Finance
MNST,Monster Beverage Corporation,97.64,95492711860.0,5061892,Consumer Staples
CMI,Cummins Inc. Common Stock,691.09,95362864313.0,959299,Industrials
USB,U.S. Bancorp Common Stock,61.28,95053319507.0,7071302,Finance
GD,General Dynamics Corporation Common Stock,348.07,94128635189.0,1289178,Industrials
CEG,Constellation Energy Corporation Common Stock ,259.32,93663807137.0,3031614,Utilities
UPS,United Parcel Service Inc. Common Stock,108.01,91809178195.0,3077613,Industrials
WMB,Williams Companies Inc. (The) Common Stock,75.06,91798249771.0,13124968,Utilities
HOOD,Robinhood Markets Inc. Class A Common Stock,101.83,91698429954.0,20681638,Finance
ADP,Automatic Data Processing Inc. Common Stock,224.97,90582902569.0,2023996,Industrials
MCK,McKesson Corporation Common Stock,747.53,89856134244.0,1559898,Health Care
WM,Waste Management Inc. Common Stock,223.37,89699975724.0,1981078,Utilities
CSX,CSX Corporation Common Stock,48.01,89209246477.0,10034116,Industrials
ABNB,Airbnb Inc. Class A Common Stock,147.17,88700083518.0,5071715,Consumer Discretionary
FCX,Freeport-McMoRan Inc. Common Stock,61.62,88582438881.0,12286658,Basic Materials
DDOG,Datadog Inc. Class A Common Stock,248.57,88481024180.0,5300277,Technology
SNOW,Snowflake Inc. Common Stock,251.65,87221890000.0,8381869,Technology
HCA,HCA Healthcare Inc. Common Stock,392.33,87034408734.0,1225143,Health Care
CMCSA,Comcast Corporation Class A Common Stock,24.22,86557956003.0,135440134,Telecommunications
RCL,Royal Caribbean Cruises Ltd. Common Stock,321.44,86208593728.0,2071492,Consumer Discretionary
NET,Cloudflare Inc. Class A Common Stock,243.76,86160939438.0,3604559,Technology
SNPS,Synopsys Inc. Common Stock,447.26,85641042900.0,2442088,Technology
BX,Blackstone Inc. Common Stock,114.88,85342032228.0,5104530,Finance
SHW,Sherwin-Williams Company (The) Common Stock,344.3,84916644310.0,3913419,Consumer Discretionary
MMM,3M Company Common Stock,162.43,84718170204.0,5260367,Health Care
ELV,Elevance Health Inc. Common Stock,388.03,84265518311.0,1222771,Health Care
ADBE,Adobe Inc. Common Stock,206.43,82055925000.0,7527307,Technology
DASH,DoorDash Inc. Class A Common Stock,184.82,80529534200.0,5042785,Technology
MRSH,Marsh Common Stock,166.71,80319961262.0,2216400,Finance
EMR,Emerson Electric Company Common Stock,142.82,79993482000.0,2329241,Technology
KKR,KKR & Co. Inc. Common Stock,88.94,79856819373.0,5837965,Finance
EPD,Enterprise Products Partners L.P. Common Stock,36.66,79314579815.0,2583761,Utilities
CME,CME Group Inc. Class A Common Stock,218.58,79204506067.0,5083907,Finance
MCO,Moody's Corporation Common Stock,452.73,79091931000.0,848788,Finance
VLO,Valero Energy Corporation Common Stock,266.32,79079138502.0,3057850,Energy
AMT,American Tower Corporation (REIT) Common Stock,168.67,78582183948.0,3600289,Real Estate
ECL,Ecolab Inc. Common Stock,278.6,78408488057.0,1560446,Consumer Discretionary
BE,Bloom Energy Corporation Class A Common Stock,275.01,78224908139.0,17520568,Energy
ALAB,Astera Labs Inc. Common Stock,455.96,78155163866.0,6331439,Technology
FDX,FedEx Corporation Common Stock,325.4,77642638402.0,3053704,Consumer Discretionary
MDLZ,Mondelez International Inc. Class A Common Stock,60.15,77211533425.0,11090327,Consumer Staples
ITW,Illinois Tool Works Inc. Common Stock,267.47,76951119000.0,1121114,Industrials
COHR,Coherent Corp. Common Stock,391.22,76538015162.0,7860013,Technology
HLT,Hilton Worldwide Holdings Inc. Common Stock ,332.54,75702189625.0,2657463,Consumer Discretionary
MPC,Marathon Petroleum Corporation Common Stock,259.22,75675814525.0,2393247,Energy
AEP,American Electric Power Company Inc. Common Stock,137.97,75070171265.0,6770897,Utilities
ORLY,O'Reilly Automotive Inc. Common Stock,90.16,74716951523.0,8654878,Consumer Discretionary
TDG,Transdigm Group Incorporated Common Stock,1323.44,74024741086.0,450601,Industrials
CL,Colgate-Palmolive Company Common Stock,92.4,73937492244.0,4800269,Consumer Discretionary
SPG,Simon Property Group Inc. Common Stock,227.56,73795412375.0,1870581,Real Estate
CI,The Cigna Group Common Stock,278.74,73735762291.0,1370958,Health Care
INTU,Intuit Inc. Common Stock,266.4,72870256800.0,5402111,Technology
TER,Teradyne Inc. Common Stock,463.21,72511894860.0,5089148,Industrials
HON,Honeywell International Inc. Common Stock,227.8,72173090368.0,7773010,Industrials
KMI,Kinder Morgan Inc. Common Stock,32.27,71795127178.0,13111431,Utilities
NSC,Norfolk Southern Corporation Common Stock,316.65,71117690417.0,678972,Industrials
TRV,The Travelers Companies Inc. Common Stock,331.88,70572520713.0,1314809,Finance
NOC,Northrop Grumman Corporation Common Stock,496.02,70451444766.0,1149509,Industrials
URI,United Rentals Inc. Common Stock,1122.67,70331410147.0,350281,Consumer Discretionary
EOG,EOG Resources Inc. Common Stock,131.93,70269681963.0,3057751,Energy
AON,Aon plc Class A Ordinary Shares (Ireland),327.57,69961401184.0,1387364,Finance
CVNA,Carvana Co. Class A Common Stock,63.72,69890373353.0,13109501,Consumer Discretionary
HONA,Honeywell Aerospace Inc. Common Stock ,220.19,69786963553.0,8471203,Industrials
PSX,Phillips 66 Common Stock,174.05,69782740231.0,2680624,Energy
GM,General Motors Company Common Stock,77.34,69734786181.0,7110997,Industrials
ICE,Intercontinental Exchange Inc. Common Stock,122.91,69507140760.0,6593872,Finance
FIX,Comfort Systems USA Inc. Common Stock,1948.69,68598611625.0,595663,Industrials
MSI,Motorola Solutions Inc. Common Stock,412.6,68489777133.0,1329220,Technology
BRKRP,Bruker Corporation 6.375% Mandatory Convertible Preferred Stock Series A,440.74,68308363922.0,2334,Industrials
WBD,Warner Bros. Discovery Inc. Series A Common Stock ,27.13,68018618725.0,18484417,Consumer Discretionary
CIEN,Ciena Corporation Common Stock,478.93,67793940933.0,4077104,Utilities
CTAS,Cintas Corporation Common Stock,169.08,67655143839.0,1707725,Industrials
ROST,Ross Stores Inc. Common Stock,208.83,66988712101.0,3166989,Consumer Discretionary
DLR,Digital Realty Trust Inc. Common Stock,190.58,66970968821.0,2280027,Real Estate
LITE,Lumentum Holdings Inc. Common Stock,851.4,66238920000.0,5604176,Telecommunications
REGN,Regeneron Pharmaceuticals Inc. Common Stock,631.81,66238348808.0,734528,Health Care
APO,Apollo Global Management Inc. (New) Common Stock,114.83,66201506018.0,4843435,Finance
RSG,Republic Services Inc. Common Stock,214.68,66049326197.0,1065348,Utilities
ET,Energy Transfer LP Common Units ,19.06,65588495820.0,7692499,Utilities
BSX,Boston Scientific Corporation Common Stock,43.48,64626723183.0,21895446,Health Care
MPWR,Monolithic Power Systems Inc. Common Stock,1312.77,64496390100.0,1051066,Technology
GWW,W.W. Grainger Inc. Common Stock,1353.29,63893041812.0,445305,Industrials
TFC,Truist Financial Corporation Common Stock,50.58,63016573730.0,6096964,Finance
PCAR,PACCAR Inc. Common Stock,119.6,62943832988.0,2221844,Consumer Discretionary
ALL,Allstate Corporation (The) Common Stock,241.38,62136264083.0,1498590,Finance
NKE,Nike Inc. Common Stock,41.48,61427194129.0,27824724,Consumer Discretionary
SRE,DBA Sempra Common Stock,93.91,61389662028.0,5045061,Utilities
CARR,Carrier Global Corporation Common Stock ,73.43,61376016255.0,4463766,Industrials
DAL,Delta Air Lines Inc. Common Stock,93.17,61212162658.0,6427658,Consumer Discretionary
AFL,AFLAC Incorporated Common Stock,120.08,61118907272.0,1681811,Finance
D,Dominion Energy Inc. Common Stock,69.18,60840724780.0,3998975,Utilities
TGT,Target Corporation Common Stock,133.92,60825273719.0,4554372,Consumer Discretionary
APD,Air Products and Chemicals Inc. Common Stock,271.35,60424404146.0,1307381,Basic Materials
HPE,Hewlett Packard Enterprise Company Common Stock,44.41,58807878368.0,17151581,Technology
O,Realty Income Corporation Common Stock,63.04,58784329091.0,4912781,Real Estate
AJG,Arthur J. Gallagher & Co. Common Stock,227.12,58347128000.0,1543118,Finance
TRGP,Targa Resources Inc. Common Stock,271.35,58243623079.0,1087897,Utilities
KEYS,Keysight Technologies Inc. Common Stock,340.13,58126641518.0,2145687,Industrials
MPLX,MPLX LP Common Units Representing Limited Partner Interests,56.22,57048329682.0,940905,Energy
PSA,Public Storage Common Stock,324.45,56955817939.0,954461,Real Estate
SE,Sea Limited American Depositary Shares each representing one Class A Ordinary Share,92.95,56930436320.0,2744676,Consumer Discretionary
SOMN,Southern Company (The) 2025 Series A Corporate Units,50.32,56777053594.0,51586,Basic Materials
RKLB,Rocket Lab Corporation Common Stock,98.01,56734801225.0,42899449,Industrials
OKE,ONEOK Inc. Common Stock,88.73,55912982529.0,3621938,Utilities
F,Ford Motor Company Common Stock,14.02,55865390673.0,46333277,Industrials
BKR,Baker Hughes Company Class A Common Stock,56.31,55863388328.0,5859754,Consumer Discretionary
CTVA,Corteva Inc. Common Stock ,83.37,55759523400.0,3076428,Consumer Staples
MET,MetLife Inc. Common Stock,85.99,55329128626.0,2929689,Finance
CAH,Cardinal Health Inc. Common Stock,236.22,55324107068.0,1926695,Health Care
COR,Cencora Inc. Common Stock,281.65,54798122549.0,1009698,Health Care
VST,Vistra Corp. Common Stock,162.38,54751689154.0,2814761,Utilities
AME,AMETEK Inc.,237.72,54486137635.0,772539,Industrials
FAST,Fastenal Company Common Stock,47.4,54416861891.0,8366655,Consumer Discretionary
LHX,L3Harris Technologies Inc. Common Stock,289.38,53910032920.0,1316416,Industrials
ROK,Rockwell Automation Inc. Common Stock,482.33,53670765750.0,906307,Industrials
ETR,Entergy Corporation Common Stock,116.33,53265976912.0,3254805,Utilities
EW,Edwards Lifesciences Corporation Common Stock,91.18,52501444000.0,3606655,Health Care
CRWV,CoreWeave Inc. Class A Common Stock,95.51,52107423746.0,21976929,Technology
NUE,Nucor Corporation Common Stock,228.58,52057026351.0,2349826,Industrials
MDLN,Medline Inc. Class A Common Stock,39.61,52035188176.0,8384189,Health Care
AZO,AutoZone Inc. Common Stock,3153.62,51483966035.0,691083,Consumer Discretionary
FITB,Fifth Third Bancorp Common Stock,56.78,51460369695.0,6380194,Finance
EA,Electronic Arts Inc. Common Stock,205.05,51416591794.0,1432728,Consumer Discretionary
XEL,Xcel Energy Inc. Common Stock,81.98,51177618529.0,5801961,Utilities
LNG,Cheniere Energy Inc. Common Stock,243.97,51124369236.0,2186272,Utilities
HBANL,Huntington Bancshares Incorporated Depositary Shares Each Representing a 1/40th Interest in a Share of 6.875% Series J Non-Cumulative Perpetual Preferred Stock,25.11,50901249040.0,16873,Finance
FANG,Diamondback Energy Inc. Common Stock,180.54,50788302640.0,2387678,Energy
EBAY,eBay Inc. Common Stock,110.8,49307238855.0,2046930,Consumer Discretionary
HEI,Heico Corporation Common Stock,350.44,48942197032.0,609103,Industrials
OXY,Occidental Petroleum Corporation Common Stock,49.09,48826617472.0,9708727,Energy
DVN,Devon Energy Corporation Common Stock,41.99,48431396463.0,9788397,Energy
MCHP,Microchip Technology Incorporated Common Stock,89.06,48277580766.0,12608692,Technology
EXC,Exelon Corporation Common Stock,47.15,48244263895.0,8001965,Utilities
CBRS,Cerebras Systems Inc. Class A Common Stock,216.16,48171378563.0,13285407,Technology
STT,State Street Corporation Common Stock,170.18,47100213676.0,1901851,Finance
VIK,Viking Holdings Ltd Ordinary Shares,104.95,46785244793.0,2378220,Consumer Discretionary
HUM,Humana Inc. Common Stock,388.9,46691917350.0,1231151,Health Care
DHI,D.R. Horton Inc. Common Stock,164.23,46572279843.0,2075233,Consumer Discretionary
XYZ,Block Inc. Class A Common Stock,78.02,46436021620.0,7056327,Technology
PCG,Pacific Gas & Electric Co. Common Stock,17.24,46202653802.0,11258376,Utilities
TTWO,Take-Two Interactive Software Inc. Common Stock,247.15,45887515760.0,3795109,Consumer Discretionary
CRDO,Credo Technology Group Holding Ltd Ordinary Shares,245.68,45813889981.0,10111493,Technology
ODFL,Old Dominion Freight Line Inc. Common Stock,219.69,45688552092.0,1179673,Industrials
KDP,Keurig Dr Pepper Inc. Common Stock,33.5,45578742279.0,16023236,Consumer Staples
WAB,Westinghouse Air Brake Technologies Corporation Common Stock,268.3,45524431932.0,980251,Industrials
BTSGU,BrightSpring Health Services Inc. Tangible Equity Unit,228.96,45170345438.0,8999,Health Care
GFS,GlobalFoundries Inc. Ordinary Shares,81.0,45069797736.0,2918148,Technology
UAL,United Airlines Holdings Inc. Common Stock,135.19,43878716718.0,4159766,Consumer Discretionary
RKT,Rocket Companies Inc. Class A Common Stock,15.5,43856160691.0,35609365,Finance
YUM,Yum! Brands Inc.,158.24,43614299004.0,2240274,Consumer Discretionary
NDAQ,Nasdaq Inc. Common Stock,76.845,43458982622.0,5682152,Finance
VTR,Ventas Inc. Common Stock,89.3,43414956264.0,3631393,Real Estate
LYV,Live Nation Entertainment Inc. Common Stock,182.56,43001472186.0,2712074,Consumer Discretionary
BDX,Becton Dickinson and Company Common Stock,155.19,42761118866.0,2396596,Health Care
HBANM,Huntington Bancshares Incorporated Depositary Shares each representing a 1/1000th interest in a share of Huntington Series I Preferred Stock,20.9,42367029268.0,15731,Finance
CMG,Chipotle Mexican Grill Inc. Common Stock,32.97,42291739980.0,17337898,Consumer Discretionary
IDXX,IDEXX Laboratories Inc. Common Stock,535.93,42275764582.0,799335,Health Care
ED,Consolidated Edison Inc. Common Stock,112.29,41382200574.0,1676909,Utilities
ADSK,Autodesk Inc. Common Stock,195.24,41195640000.0,2588492,Technology
AXON,Axon Enterprise Inc. Common Stock,510.6,41155420516.0,1847996,Industrials
PEG,Public Service Enterprise Group Incorporated Common Stock,82.43,41076633167.0,3176187,Utilities
RVMD,Revolution Medicines Inc. Common Stock,192.62,40950330510.0,5314980,Health Care
MCHPP,Microchip Technology Incorporated Depositary Shares Each Representing a 1/20th Interest in a Share of 7.50% Series A Mandatory Convertible Preferred Stock,75.14,40731837174.0,104731,Technology
MSCI,MSCI Inc. Common Stock,558.0,40622400000.0,901874,Consumer Discretionary
TKO,TKO Group Holdings Inc. Class A Common Stock,211.62,40446145067.0,1758848,Consumer Discretionary
HBANZ,Huntington Bancshares Incorporated Depositary Shares Each Representing a 1/1000th Interest in a Share of 5.50% Series L Non-Cumulative Perpetual Preferred Stock,19.9,40339898681.0,7033,Finance
AMP,Ameriprise Financial Inc. Common Stock,446.79,40165118160.0,865676,Finance
CCL,Carnival Corporation Ltd. Common Shares,29.19,39980057784.0,19283544,Consumer Discretionary
COIN,Coinbase Global Inc. Class A Common Stock,151.65,39946295438.0,7141116,Finance
SYY,Sysco Corporation Common Stock,83.4,39880429507.0,3334468,Consumer Discretionary
CBRE,CBRE Group Inc Common Stock Class A,136.09,39849408236.0,1671887,Finance
AIG,American International Group Inc. New Common Stock,75.12,39829091322.0,3606712,Finance
VMC,Vulcan Materials Company (Holding Company) Common Stock,303.82,39422129161.0,1448301,Industrials
JBL,Jabil Inc. Common Stock,373.58,39413669527.0,1526267,Technology
ALNY,Alnylam Pharmaceuticals Inc. Common Stock,293.52,39188610427.0,1367343,Health Care
PYPL,PayPal Holdings Inc. Common Stock,44.38,39147841779.0,16684304,Industrials
NTRA,Natera Inc. Common Stock,272.31,38998980672.0,1784306,Health Care
RBLX,Roblox Corporation Class A Common Stock,54.34,38906285003.0,16926892,Technology
IRM,Iron Mountain Incorporated (Delaware)Common Stock REIT,129.97,38669282790.0,1211467,Real Estate
WEC,WEC Energy Group Inc. Common Stock,118.44,38578949302.0,1833826,Utilities
PRU,Prudential Financial Inc. Common Stock,109.2,37892400000.0,1711487,Finance
A,Agilent Technologies Inc. Common Stock,132.83,37515435122.0,1921595,Industrials
PPLC,PPL Corporation Corporate Units,49.3,37090872847.0,117830,Utilities
ADM,Archer-Daniels-Midland Company Common Stock,76.87,37047998230.0,3019456,Consumer Staples
HSY,The Hershey Company Common Stock,181.58,36832299488.0,1354037,Consumer Staples
