symbol,name,price,marketCap,volume,industry
SAIC,Science Applications International Corporation Common Stock,91.7,4138183864.0,798163,Technology
HGTY,Hagerty Inc. Class A Common Stock,12.09,4135554352.0,268402,Finance
SPHR,Sphere Entertainment Co. Class A Common Stock,116.32,4129606598.0,525596,Consumer Discretionary
REGCO,Regency Centers Corporation 5.875% Series B Cumulative Redeemable Preferred Stock,22.57,4128201082.0,3079,Real Estate
MMS,Maximus Inc. Common Stock,75.65,4126599774.0,788601,Real Estate
LMND,Lemonade Inc. Common Stock,55.17,4122910760.0,3052808,Finance
WHD,Cactus Inc. Class A Common Stock,51.56,4116935244.0,2160562,Consumer Discretionary
UCB,United Community Banks Inc. Common Stock,34.33,4106320332.0,1013529,Finance
ACIW,ACI Worldwide Inc. Common Stock,39.8,4102902639.0,2684432,Technology
LIF,Life360 Inc. Common Stock,52.15,4088587014.0,663434,Technology
ALHC,Alignment Healthcare Inc. Common Stock,20.42,4085873372.0,2604766,Health Care
ASO,Academy Sports and Outdoors Inc. Common Stock,61.14,4076894682.0,925724,Consumer Discretionary
DAN,Dana Incorporated Common Stock ,34.88,4075287326.0,1372210,Consumer Discretionary
KAI,Kadant Inc Common Stock,345.54,4069816768.0,196307,Industrials
OXLCO,Oxford Lane Capital Corp. Preferred Stock Shares 6.00% Series 2029,23.44,4069184000.0,4798,Finance
INDB,Independent Bank Corp. Common Stock,82.04,4067318821.0,251192,Finance
OSCR,Oscar Health Inc. Class A Common Stock,13.66,4067237680.0,5882514,Health Care
CNO,CNO Financial Group Inc. Common Stock,43.07,4060541056.0,569349,Finance
SMG,Scotts Miracle-Gro Company (The) Common Stock,69.85,4054076747.0,722696,Industrials
TFSL,TFS Financial Corporation Common Stock,14.44,4051442338.0,809420,Finance
UNMA,Unum Group 6.250% Junior Subordinated Notes due 2058,23.78,4050048847.0,100683,Finance
RCB,Ready Capital Corporation 6.20% Senior Notes due 2026,24.62,4045737437.0,2579,Real Estate
SMR,NuScale Power Corporation Class A Common Stock,13.33,4035318665.0,26875448,Industrials
CUZ,Cousins Properties Incorporated Common Stock,23.97,4026528300.0,1529221,Real Estate
JOE,St. Joe Company (The) Common Stock,69.73,4026526077.0,202059,Real Estate
AZZ,AZZ Inc.,134.4,4012601510.0,90306,Industrials
HGV,Hilton Grand Vacations Inc. Common Stock ,46.9,4011971062.0,1477710,Consumer Discretionary
IRT,Independence Realty Trust Inc. Common Stock,16.9,4010036529.0,3940085,Real Estate
KBH,KB Home Common Stock,63.47,4009629090.0,550300,Consumer Discretionary
WSC,WillScot Holdings Corporation Class A Common Stock,22.17,4009542890.0,1617574,Industrials
USAC,USA Compression Partners LP Common Units Representing Limited Partner Interests,27.6,4001237081.0,134067,Utilities
GFF,Griffon Corporation Common Stock,85.8,3996493043.0,377224,Industrials
CALM,Cal-Maine Foods Inc. Common Stock,83.85,3995791757.0,713023,Consumer Staples
HRB,H&R Block Inc. Common Stock,31.49,3991664150.0,2714783,Consumer Discretionary
GPI,Group 1 Automotive Inc. Common Stock,334.38,3987548042.0,153992,Consumer Discretionary
FRPT,Freshpet Inc. Common Stock,81.26,3986386203.0,1409118,Consumer Staples
TPH,Tri Pointe Homes Inc. Common Stock,46.3,3979646911.0,5480490,Consumer Discretionary
CBT,Cabot Corporation Common Stock,75.81,3958919799.0,386946,Industrials
VISN,Vistance Networks Inc. Common Stock,17.82,3947997959.0,10435043,Technology
BTU,Peabody Energy Corporation Common Stock ,32.29,3931238819.0,3410480,Energy
WHR,Whirlpool Corporation Common Stock,69.13,3907137662.0,7894750,Consumer Discretionary
GPOR,Gulfport Energy Corporation Common Shares,202.0,3901997438.0,325778,Energy
CVLT,Commvault Systems Inc. Common Stock,88.58,3895251200.0,1498376,Technology
FULT,Fulton Financial Corporation Common Stock,21.64,3892930548.0,1742606,Finance
COLD,Americold Realty Trust Inc. Common Stock,13.58,3868323825.0,7904496,Real Estate
LGND,Ligand Pharmaceuticals Incorporated Common Stock,196.17,3860963012.0,256610,Health Care
BANF,BancFirst Corporation Common Stock,115.59,3853096941.0,118571,Finance
TDW,Tidewater Inc. Common Stock,77.61,3846596615.0,635472,Consumer Discretionary
VKTX,Viking Therapeutics Inc. Common Stock,32.97,3809825106.0,2292413,Health Care
CORT,Corcept Therapeutics Incorporated Common Stock,35.78,3806062436.0,1576997,Health Care
KRC,Kilroy Realty Corporation Common Stock,32.02,3794467789.0,1905615,Real Estate
RNST,Renasant Corporation Common Stock,39.93,3794203783.0,559001,Finance
FIBK,First Interstate BancSystem Inc. Common Stock (DE),36.79,3785345689.0,792680,Finance
SOUN,SoundHound AI Inc Class A Common Stock,8.98,3772460832.0,43472206,Technology
AVNT,Avient Corporation Common Stock,41.11,3766692568.0,901065,Industrials
ASBA,Associated Banc-Corp 6.625% Fixed-Rate Reset Subordinated Notes due 2033,24.89,3755921285.0,14611,Finance
OII,Oceaneering International Inc. Common Stock,37.57,3734222925.0,1160511,Energy
ICUI,ICU Medical Inc. Common Stock,150.82,3723787276.0,235626,Health Care
BKU,BankUnited Inc. Common Stock,49.48,3718054413.0,638526,Finance
BNL,Broadstone Net Lease Inc. Common Stock,19.41,3715528718.0,1477042,Real Estate
PI,Impinj Inc. Common Stock,122.83,3713357991.0,336975,Technology
ENVA,Enova International Inc. Common Stock,148.36,3710530927.0,280074,Finance
KTB,Kontoor Brands Inc. Common Stock ,66.68,3706982048.0,912315,Industrials
ACMR,ACM Research Inc. Class A Common Stock,57.04,3700552765.0,4074470,Technology
PJT,PJT Partners Inc. Class A Common Stock,151.84,3690820584.0,215568,Finance
NTRSO,Northern Trust Corporation Depositary Shares Each Representing a 1/1000th Interest in a Share of Series E Non-Cumulative Perpetual Preferred Stock,19.84,3686823612.0,39442,Finance
AAOI,Applied Optoelectronics Inc. Common Stock,53.69,3665868209.0,5388300,Technology
AB,AllianceBernstein Holding L.P.  Units,39.64,3658152308.0,294157,Finance
DTB,DTE Energy Company 2020 Series G 4.375% Junior Subordinated Debentures due 2080,17.6016,3657678732.0,4600,Utilities
LRN,Stride Inc. Common Stock,85.86,3655943699.0,1132867,Real Estate
EXPO,Exponent Inc. Common Stock,73.1,3646756221.0,373657,Consumer Discretionary
CDP,COPT Defense Properties Common Shares of Beneficial Interest,32.17,3641890422.0,1029826,Real Estate
MHO,M/I Homes Inc. Common Stock,141.07,3635050709.0,163049,Consumer Discretionary
WSFS,WSFS Financial Corporation Common Stock,66.38,3629389495.0,355641,Finance
CCC,CCC Intelligent Solutions Holdings Inc. Common Stock,5.97,3624542578.0,20888973,Technology
PII,Polaris Inc. Common Stock,63.85,3619699216.0,594454,Consumer Discretionary
DTG,DTE Energy Company 2021 Series E 4.375% Junior Subordinated Debentures,17.41,3617863531.0,8726,Utilities
ADMA,ADMA Biologics Inc Common Stock,15.18,3612806073.0,7477345,Health Care
BKD,Brookdale Senior Living Inc. Common Stock,15.17,3607310905.0,3634034,Health Care
LUNR,Intuitive Machines Inc. Class A Common Stock,17.67,3590722043.0,14694395,Industrials
OTTR,Otter Tail Corporation Common Stock,85.58,3590382670.0,302700,Utilities
CORZW,Core Scientific Inc. Tranche 1 Warrants,11.57,3587409241.0,284253,Finance
INSW,International Seaways Inc. Common Stock ,72.51,3582289696.0,861145,Consumer Discretionary
GPK,Graphic Packaging Holding Company,12.1,3570989655.0,4326827,Consumer Discretionary
CATY,Cathay General Bancorp Common Stock,52.42,3566479306.0,438872,Finance
FUL,H. B. Fuller Company Common Stock,65.87,3562835118.0,407989,Industrials
DORM,Dorman Products Inc. Common Stock,116.55,3562076158.0,598134,Consumer Discretionary
HIMS,Hims & Hers Health Inc. Class A Common Stock,15.6,3555844750.0,29360133,Health Care
CRGY,Crescent Energy Company Class A Common Stock,10.82,3553091368.0,10616953,Energy
RELY,Remitly Global Inc. Common Stock,16.84,3547419860.0,4153850,Real Estate
LEGN,Legend Biotech Corporation American Depositary Shares,19.28,3540755766.0,1726171,Health Care
YETI,YETI Holdings Inc. Common Stock,45.17,3514592464.0,924268,Consumer Discretionary
WK,Workiva Inc. Class A Common Stock,61.69,3506128942.0,1517865,Technology
RH,RH Common Stock,186.61,3504106410.0,639774,Consumer Discretionary
ARQT,Arcutis Biotherapeutics Inc. Common Stock,28.57,3499601925.0,3378420,Health Care
NAN,Nuveen New York Quality Municipal Income Fund Common Stock,11.57,3497793806.0,74015,Finance
MPT,Medical Properties Trust Inc. common stock,5.81,3494715000.0,4303911,Real Estate
SEI,Solaris Energy Infrastructure Inc. Class A Common Stock,50.96,3488597054.0,4240820,Consumer Discretionary
WSBC,WesBanco Inc. Common Stock,36.28,3484525189.0,553722,Finance
FIZZ,National Beverage Corp. Common Stock,37.13,3476559947.0,225398,Consumer Staples
LBRDP,Liberty Broadband Corporation Series A Cumulative Redeemable Preferred Stock,24.09,3456860316.0,4341,Telecommunications
GNW,Genworth Financial Inc Common Stock,8.65,3454641905.0,4044009,Finance
HP,Helmerich & Payne Inc. Common Stock,34.59,3453793790.0,1177459,Energy
LASR,nLIGHT Inc. Common Stock,62.95,3447234348.0,2448048,Technology
FULTP,Fulton Financial Corporation Depositary Shares Each Representing a 1/40th Interest in a Share of Fixed Rate Non-Cumulative Perpetual Preferred Stock Series A,19.15,3444991682.0,9735,Finance
BHF,Brighthouse Financial Inc. Common Stock,60.21,3443054601.0,1476881,Finance
HNGE,Hinge Health Inc. Class A Common Stock,43.67,3437676809.0,1375860,Technology
LCID,Lucid Group Inc. Common Stock,10.59,3432943960.0,7595908,Industrials
FLY,Firefly Aerospace Inc. Common Stock,21.53,3428676657.0,2942476,Industrials
CNS,Cohen & Steers Inc Common Stock,67.14,3424646303.0,287994,Finance
BOX,Box Inc. Class A Common Stock,23.9,3423144850.0,2707355,Technology
HAYW,Hayward Holdings Inc. Common Stock,15.78,3422101911.0,4041692,Industrials
BFH,Bread Financial Holdings Inc. Common Stock,79.27,3417735245.0,1376670,Real Estate
ARLP,Alliance Resource Partners L.P. Common Units representing Limited Partners Interests,26.57,3412332598.0,204670,Energy
CVSA,Covista Inc. Common Shares,98.76,3408061731.0,383492,Real Estate
CAR,Avis Budget Group Inc. Common Stock,96.54,3403870264.0,639173,Consumer Discretionary
DX,Dynex Capital Inc. Common Stock,14.03,3397632459.0,4072990,Real Estate
TGNA,TEGNA Inc,21.05,3390245408.0,1978003,Industrials
SYRE,Spyre Therapeutics Inc. Common Stock,43.15,3389008077.0,534871,Health Care
GRBK,Green Brick Partners Inc. Common Stock,77.69,3384572464.0,347643,Consumer Discretionary
CALX,Calix Inc Common Stock,51.47,3376826415.0,1053024,Consumer Discretionary
BSM,Black Stone Minerals L.P. Common units representing limited partner interests,14.84,3369347978.0,393805,Energy
GEF,Greif Inc. Class A Common Stock,72.76,3367770451.0,158312,
CII,BlackRock Enhanced Large Cap Core Fund Inc. Common Stock,22.61,3363519469.0,85921,Finance
COLM,Columbia Sportswear Company Common Stock,62.09,3345961304.0,545544,Consumer Discretionary
MTRN,Materion Corporation,161.26,3343921708.0,248074,Industrials
QLYS,Qualys Inc. Common Stock,93.68,3342120748.0,1067116,Technology
IPAR,Interparfums Inc. Common Stock,104.2,3341144658.0,259066,Consumer Discretionary
DNLI,Denali Therapeutics Inc. Common Stock,21.42,3336562962.0,1655006,Health Care
APAM,Artisan Partners Asset Management Inc. Class A Common Stock,41.33,3330625993.0,594400,Finance
KNSA,Kiniksa Pharmaceuticals International plc Class A Ordinary Shares,43.49,3328523546.0,814329,Health Care
MCHB,Mechanics Bancorp Class A Common Stock,15.02,3322629023.0,161867,Finance
PBH,Prestige Consumer Healthcare Inc. Common Stock,70.21,3322248033.0,448647,Health Care
CBU,Community Financial System Inc. Common Stock,63.0,3317673807.0,193002,Finance
BXMT,Blackstone Mortgage Trust Inc. Common Stock,19.64,3314026929.0,815739,Real Estate
KFY,Korn Ferry Common Stock,62.93,3284627826.0,615897,Consumer Discretionary
LCII,LCI Industries,135.51,3279072335.0,224890,Consumer Discretionary
COCO,The Vita Coco Company Inc. Common Stock,57.41,3277087552.0,1041481,Consumer Staples
BLLN,BillionToOne Inc. Class A Common Stock,71.41,3268347152.0,339821,Health Care
WDFC,WD-40 Company Common Stock,242.15,3265708029.0,181184,Industrials
VERA,Vera Therapeutics Inc. Class A Common Stock,42.35,3264836756.0,1953603,Health Care
USLM,United States Lime & Minerals Inc. Common Stock,113.97,3264032304.0,55391,Industrials
FGN,F&G Annuities & Life Inc. 7.950% Senior Notes due 2053,25.85,3259647466.0,25891,Finance
PLMR,Palomar Holdings Inc. Common stock,121.85,3252145428.0,317702,Finance
UAA,Under Armour Inc. Class A Common Stock,7.62,3245281808.0,5858160,Consumer Discretionary
CAKE,Cheesecake Factory Incorporated (The) Common Stock,65.08,3244829642.0,1042831,Consumer Discretionary
AVA,Avista Corporation Common Stock,39.77,3236154179.0,1415339,Utilities
RWTN,Redwood Trust Inc. 9.125% Senior Notes Due 2029,25.0,3230586600.0,1485,Real Estate
TARS,Tarsus Pharmaceuticals Inc. Common Stock,75.87,3228836918.0,501542,Health Care
GBDC,Golub Capital BDC Inc. Common Stock,12.26,3227177499.0,4054762,Finance
SBCF,Seacoast Banking Corporation of Florida Common Stock,32.9,3218546102.0,599252,Finance
RWTO,Redwood Trust Inc. 9.00% Senior Notes Due 2029,24.9,3217664254.0,4138,Real Estate
RNG,RingCentral Inc. Class A Common Stock,37.14,3215013515.0,3231671,Technology
PVH,PVH Corp. Common Stock,70.12,3211685044.0,515620,Industrials
FHB,First Hawaiian Inc. Common Stock,25.89,3203100056.0,1481511,Finance
SUPN,Supernus Pharmaceuticals Inc. Common Stock,55.75,3196668763.0,1249216,Health Care
MARA,MARA Holdings Inc. Common Stock,8.45,3195657783.0,50163674,Technology
DIOD,Diodes Incorporated Common Stock,69.63,3194447401.0,376521,Technology
PTEN,Patterson-UTI Energy Inc. Common Stock,8.41,3192227432.0,8533520,Energy
CPK,Chesapeake Utilities Corporation Common Stock,134.62,3183855080.0,106908,Utilities
FG,F&G Annuities & Life Inc. Common Stock,23.59,3175674878.0,437484,Finance
FSK,FS KKR Capital Corp. Common Stock,11.29,3161950029.0,18791493,Finance
SYNA,Synaptics Incorporated Common Stock $0.001 Par Value,81.48,3155699297.0,398441,Technology
UA,Under Armour Inc. Class C Common Stock,7.38,3143068207.0,2393189,Consumer Discretionary
EWTX,Edgewise Therapeutics Inc. Common Stock,29.66,3140057752.0,729304,Health Care
SXI,Standex International Corporation Common Stock,258.79,3136206913.0,159958,Industrials
WRBY,Warby Parker Inc. Class A Common Stock,25.65,3133527453.0,14178691,Health Care
ALMS,Alumis Inc. Common Stock,29.98,3129714222.0,1057567,Health Care
AAP,Advance Auto Parts Inc.,52.0,3125200000.0,1810356,Consumer Discretionary
HWKN,Hawkins Inc. Common Stock,149.49,3124653883.0,140550,Consumer Discretionary
PAY,Paymentus Holdings Inc. Class A Common Stock,24.83,3121518125.0,841744,Real Estate
BOH,Bank of Hawaii Corporation Common Stock,78.69,3120629553.0,405529,Finance
PRK,Park National Corporation Common Stock,171.62,3100554367.0,53940,Finance
FBK,FB Financial Corporation Common Stock,57.97,3099220082.0,218595,Finance
NATL,NCR Atleos Corporation Common Stock,41.87,3094366174.0,403262,Miscellaneous
CNK,Cinemark Holdings Inc Cinemark Holdings Inc. Common Stock,26.72,3086861053.0,4477762,Consumer Discretionary
FFBC,First Financial Bancorp. Common Stock,29.4,3074831134.0,498540,Finance
SFNC,Simmons First National Corporation Class A Common Stock,21.22,3070907493.0,2023743,Finance
DJT,Trump Media & Technology Group Corp. Common Stock,10.96,3068774091.0,2401345,Technology
BATRA,Atlanta Braves Holdings Inc. Series A Common Stock,48.76,3068141083.0,71969,Consumer Discretionary
TR,Tootsie Roll Industries Inc. Common Stock,41.98,3063978727.0,103740,Consumer Staples
PRVA,Privia Health Group Inc. Common Stock,24.91,3063968087.0,2550600,Health Care
VCYT,Veracyte Inc. Common Stock,38.75,3063155454.0,1927232,Health Care
CPRX,Catalyst Pharmaceuticals Inc. Common Stock,24.88,3058060189.0,1521555,Health Care
KMT,Kennametal Inc. Common Stock,40.11,3056333547.0,1250145,Industrials
AMBA,Ambarella Inc. Ordinary Shares,70.9,3052279457.0,1463889,Technology
CSQ,Calamos Strategic Total Return Common Stock,19.14,3041109085.0,129181,Finance
CON,Concentra Group Holdings Parent Inc. Common Stock,23.64,3029943575.0,1005088,Health Care
OPLN,OPENLANE Inc. Common Stock,28.49,3028408054.0,1296688,Consumer Discretionary
NMIH,NMI Holdings Inc. Common Stock,39.77,3023817576.0,543779,Finance
BULL,Webull Corporation Class A Ordinary Shares,6.01,3022559964.0,8812850,Finance
QTWO,Q2 Holdings Inc. Common Stock,48.4,3020371605.0,2797812,Technology
MGEE,MGE Energy Inc,82.355,3011219902.0,128315,Energy
BANC,Banc of California Inc. Common Stock,19.78,2992786968.0,2209155,Finance
BCC,Boise Cascade L.L.C. Common Stock,83.64,2987793684.0,502673,Consumer Discretionary
WU,Western Union Company (The) Common Stock,9.53,2987224330.0,11056767,Real Estate
TWST,Twist Bioscience Corporation Common Stock,48.71,2986493102.0,836259,Health Care
ITGR,Integer Holdings Corporation Common Stock,86.77,2985525499.0,761498,Health Care
EEFT,Euronet Worldwide Inc. Common Stock,70.93,2982229223.0,1011500,Finance
FLNC,Fluence Energy Inc. Class A Common Stock,16.2,2979751423.0,6742612,Miscellaneous
CURB,Curbline Properties Corp. Common Stock,28.2,2971375880.0,750254,Finance
APLE,Apple Hospitality REIT Inc. Common Shares,12.57,2962231367.0,2628950,Real Estate
LXP,LXP Industrial Trust Common Stock (Maryland REIT),49.99,2953261030.0,608602,Real Estate
CARG,CarGurus Inc. Class A Common Stock ,31.01,2951815448.0,1916426,Technology
BEAM,Beam Therapeutics Inc. Common Stock,28.92,2945682605.0,3040793,Health Care
BELFB,Bel Fuse Inc. Class B Common Stock,232.12,2937783374.0,146185,
CHEF,The Chefs' Warehouse Inc. Common Stock,72.09,2933647257.0,355799,Consumer Discretionary
DBD,Diebold Nixdorf Incorporated Common stock,83.05,2921120806.0,205039,Miscellaneous
MSGE,Madison Square Garden Entertainment Corp. Class A Common Stock,61.73,2918168401.0,323594,Consumer Discretionary
IAC,IAC Inc. Common Stock,37.93,2917119075.0,1352499,Technology
UPST,Upstart Holdings Inc. Common stock,29.67,2909478059.0,4391303,Finance
BKV,BKV Corporation Common Stock,30.0,2909170350.0,548377,Energy
POWWP,Outdoor Holding Company 8.75% Series A Cumulative Redeemable Perpetual Preferred Stock,24.69,2895858546.0,16290,Industrials
RGTIW,Rigetti Computing Inc. Warrants,8.7695,2894163691.0,256130,Technology
PFS,Provident Financial Services Inc Common Stock,22.15,2893285806.0,640029,Finance
SEZL,Sezzle Inc. Common Stock,84.7,2892767739.0,4467541,Finance
HAE,Haemonetics Corporation Common Stock,62.24,2892376824.0,1045973,Health Care
ZIONP,Zions Bancorporation N.A. Depositary Shares (Each representing 1/40th Interest in a Share of Series A Floating-Rate Non-Cumulative Perpetual Preferred Stock),19.5516,2891463229.0,10707,Finance
TDC,Teradata Corporation Common Stock,30.97,2886404000.0,1650800,Technology
AWR,American States Water Company Common Stock,73.76,2882722987.0,234654,Utilities
GBTG,Global Business Travel Group Inc. Class A Common Stock,5.5,2879393732.0,1461190,Consumer Discretionary
ATRO,Astronics Corporation Common Stock,80.2,2857455504.0,930502,Industrials
ASH,Ashland Inc. Common Stock,62.27,2849624088.0,718755,Consumer Discretionary
CXT,Crane NXT Co. Common Stock,49.46,2840094049.0,1135568,Industrials
HTGC,Hercules Capital Inc. Common Stock,15.43,2834420593.0,3813058,Finance
WOR,Worthington Enterprises Inc. Common Shares,57.2,2834064433.0,116903,Industrials
MGRC,McGrath RentCorp Common Stock,114.93,2828617739.0,266777,Consumer Discretionary
TXG,10x Genomics Inc. Class A Common Stock,22.13,2827157381.0,3712838,Industrials
DBRG,DigitalBridge Group Inc.,15.41,2815012889.0,1635794,Real Estate
VRDN,Viridian Therapeutics Inc. Common Stock,29.49,2814584816.0,1780204,Health Care
PHIN,PHINIA Inc. Common Stock,74.13,2810650959.0,570302,Consumer Discretionary
FCPT,Four Corners Property Trust Inc. Common Stock,25.58,2807278174.0,703084,Real Estate
IDYA,IDEAYA Biosciences Inc. Common Stock,31.9,2801267461.0,788786,Health Care
DKL,Delek Logistics Partners L.P. Common Units representing Limited Partner Interests,52.29,2796490168.0,159884,Energy
SLG,SL Green Realty Corp Common Stock,39.32,2792946116.0,1023237,Real Estate
FTAIM,FTAI Aviation Ltd. 9.500% Fixed-Rate Reset Series D Cumulative Perpetual Redeemable Preferred Shares,27.2248,2792527369.0,244,Industrials
BKE,Buckle Inc. (The) Common Stock,54.47,2786501418.0,349990,Consumer Discretionary
CTRI,Centuri Holdings Inc. Common Stock,31.43,2786242910.0,2786748,Utilities
KD,Kyndryl Holdings Inc. Common Stock,12.31,2775254934.0,4192523,Technology
BATRK,Atlanta Braves Holdings Inc. Series C Common Stock,43.98,2767367614.0,846571,Consumer Discretionary
APLS,Apellis Pharmaceuticals Inc. Common Stock,21.64,2766239231.0,2222094,Health Care
TVTX,Travere Therapeutics Inc. Common Stock,29.72,2741418866.0,809943,Health Care
TRN,Trinity Industries Inc. Common Stock,34.22,2732115218.0,656722,Industrials
AKR,Acadia Realty Trust Common Stock,20.77,2721688089.0,1014880,Real Estate
OLN,Olin Corporation Common Stock,23.91,2717055864.0,2071380,Industrials
CVBF,CVB Financial Corporation Common Stock,19.98,2713138166.0,994689,Finance
VRNS,Varonis Systems Inc. Common Stock,23.09,2711867993.0,2673880,Technology
BELFA,Bel Fuse Inc. Class A Common Stock,214.0,2708450982.0,76146,
LFST,LifeStance Health Group Inc. Common Stock,6.96,2707441956.0,10746745,Health Care
TPB,Turning Point Brands Inc. Common Stock,141.86,2705377588.0,275491,Consumer Discretionary
UCTT,Ultra Clean Holdings Inc. Common Stock,59.47,2705292560.0,4641796,Technology
POWI,Power Integrations Inc. Common Stock,48.46,2689723840.0,811071,Technology
NMRK,Newmark Group Inc. Class A Common Stock,14.89,2686340740.0,1084865,Finance
FSLY,Fastly Inc. Class A Common Stock,17.96,2683224000.0,9406119,Technology
NMFCZ,New Mountain Finance Corporation 8.250% Notes due 2028,25.22,2682423436.0,9054,
UE,Urban Edge Properties Common Shares of Beneficial Interest,21.29,2681605092.0,1052335,Finance
LQDA,Liquidia Corporation Common Stock,30.79,2678590922.0,2139119,Health Care
SHOO,Steven Madden Ltd. Common Stock,36.86,2678171558.0,2128381,Consumer Discretionary
HE,Hawaiian Electric Industries Inc. Common Stock,15.5,2675617378.0,3191671,Utilities
CLSK,CleanSpark Inc. Common Stock,10.44,2670060412.0,18919833,Finance
PLUG,Plug Power Inc. Common Stock,1.91,2660427286.0,111000152,Energy
CWT,California Water Service Group Common Stock,44.59,2657177895.0,751673,Utilities
CRVL,CorVel Corp. Common Stock,51.92,2655834529.0,259288,Finance
NSA,National Storage Affiliates Trust Common Shares of Beneficial Interest,34.47,2652837638.0,1815234,Real Estate
VC,Visteon Corporation Common Stock,98.73,2647887853.0,549357,Consumer Discretionary
TOWN,TowneBank Common Stock,35.42,2642945829.0,334850,Finance
VSH,Vishay Intertechnology Inc. Common Stock,19.45,2641197968.0,1355257,Technology
BWIN,The Baldwin Insurance Group Inc. Class A Common Stock,18.49,2636361260.0,3667552,Finance
NAVN,Navan Inc. Class A Common Stock,10.59,2633140648.0,1474838,Technology
HUBG,Hub Group Inc. Class A Common Stock,43.02,2630824000.0,1194999,Industrials
FTAIN,FTAI Aviation Ltd. 8.25% Fixed - Rate Reset Series C Cumulative Perpetual Redeemable Preferred Shares,25.625,2628431203.0,3196,Industrials
ABM,ABM Industries Incorporated Common Stock,44.78,2624035098.0,315365,Consumer Discretionary
ALG,Alamo Group Inc. Common Stock,216.5,2622990162.0,134766,Industrials
GDV,Gabelli Dividend & Income Trust Common Shares of Beneficial Interest,29.07,2621779433.0,184475,Finance
CLMT,Calumet Inc. Common Stock,30.22,2621715581.0,1721733,Energy
NSIT,Insight Enterprises Inc. Common Stock,84.56,2621064209.0,366013,Consumer Discretionary
TRMK,Trustmark Corporation Common Stock,44.49,2618227068.0,647941,Finance
DYN,Dyne Therapeutics Inc. Common Stock,16.19,2616202424.0,1769422,Health Care
BBT,Beacon Financial Corporation Common stock,31.05,2605370134.0,905646,Finance
MFAO,MFA Financial Inc. 9.000% Senior Notes due 2029,25.36,2603678283.0,6740,Real Estate
CC,Chemours Company (The) Common Stock,17.32,2599477535.0,2995561,Industrials
DAVE,Dave Inc. Class A Common Stock,192.33,2597240091.0,827933,Finance
MFAN,MFA Financial Inc. 8.875% Senior Notes due 2029,25.22,2589304664.0,7293,Real Estate
LMAT,LeMaitre Vascular Inc. Common Stock,113.69,2579170658.0,1266751,Health Care
HIW,Highwoods Properties Inc. Common Stock,23.42,2574586268.0,1169523,Real Estate
CALY,Callaway Golf Company Common Stock,13.99,2572532082.0,3396248,Consumer Discretionary
KWR,Quaker Houghton Common Stock,148.13,2567844660.0,277537,Industrials
ACLS,Axcelis Technologies Inc. Common Stock,83.58,2565839220.0,964131,Technology
VRRM,Verra Mobility Corporation Class A Common Stock,16.95,2565585205.0,2662314,Consumer Discretionary
IRON,Disc Medicine Inc. Common Stock,67.91,2563613501.0,907190,Health Care
NOG,Northern Oil and Gas Inc. Common Stock,26.25,2562078173.0,2696293,Energy
RXO,RXO Inc. Common Stock,15.58,2558141912.0,1613116,Consumer Discretionary
BRSL,Brightstar Lottery PLC Trading under the Legal Name to begin at the market open on July 21 2025. Ordinary Shares,13.77,2540565000.0,2159208,Consumer Discretionary
XRAY,DENTSPLY SIRONA Inc. Common Stock,12.71,2536305526.0,6881109,Health Care
NGVT,Ingevity Corporation Common Stock ,70.52,2536183537.0,729995,Industrials
NESR,National Energy Services Reunited Corp Ordinary Shares,25.14,2533552861.0,1308187,Energy
BWNB,Babcock & Wilcox Enterprises Inc. 6.50% Senior Notes due 2026,25.0,2527438550.0,5380,Industrials
ADPT,Adaptive Biotechnologies Corporation Common Stock,16.46,2512868994.0,1449343,Health Care
TBBK,The Bancorp Inc Common Stock,57.18,2511209912.0,554890,Finance
RHI,Robert Half Inc. Common Stock,24.75,2503304001.0,3916025,Consumer Discretionary
FBNC,First Bancorp Common Stock,60.18,2495383499.0,163845,Finance
NHC,National HealthCare Corporation Common Stock,160.17,2485078073.0,83984,Health Care
WSBCO,WesBanco Inc. Depositary Shares each representing 1/40th interest in a share of 7.375% Fixed-Rate Reset Non-Cumulative Perpetual Preferred Stock Series B,25.82,2479890860.0,3342,Finance
WAFD,WaFd Inc. Common Stock,32.58,2471627422.0,614444,Finance
RUM,Rumble Inc. Class A Common Stock,5.68,2470018563.0,1621979,Technology
