symbol,name,price,marketCap,volume,industry
BFRI,Biofrontera Inc. Common Stock,0.8103,9438636.0,13823102,Health Care
CALC,CalciMedica Inc. Common Stock,0.6528,9406477.0,326527,Health Care
DAIC,CID HoldCo Inc. Common Stock,0.3211,9399664.0,127857,Technology
EDSA,Edesa Biotech Inc. Common Shares,1.12,9333882.0,59663,Health Care
WKHS,Workhorse Group Inc. Common Stock,4.3,9330002.0,74921,Industrials
AMST,Amesite Inc. Common Stock,2.04,9328335.0,43352,Technology
HWH,HWH International Inc. Common Stock,1.44,9326016.0,12054,Health Care
BRTX,BioRestorative Therapies Inc. Common Stock (NV),1.045,9275673.0,63191,Health Care
XELB,Xcel Brands Inc. Common Stock,1.56,9194351.0,21203,Miscellaneous
IMG,CIMG Inc. Common Stock,0.593,9181743.0,312337,Consumer Discretionary
BLIN,Bridgeline Digital Inc. Common Stock,0.75,9168299.0,42445,Technology
TNON,Tenon Medical Inc. Common Stock,0.82,9107284.0,45484627,Health Care
IPST,Heritage Distilling Holding Company Inc. Common Stock,0.9491,9072752.0,27778,Consumer Staples
PRSO,Peraso Inc. Common Stock,0.87,9036612.0,191106,Technology
GRDX,GridAI Technologies Corp. Common Stock,2.68,9009900.0,196524,Health Care
MNTS,Momentus Inc. Class A Common Stock,6.44,8997833.0,32619687,Industrials
PULM,Pulmatrix Inc. Common Stock,2.46,8984621.0,7962,Health Care
YCBD,cbdMD Inc. Common Stock,0.8523,8945367.0,495085,Consumer Discretionary
MTR,Mesa Royalty Trust Common Stock,4.79,8926596.0,2942,Energy
XHLD,TEN Holdings Inc. Common Stock,2.97,8829308.0,204208,Real Estate
SCKT,Socket Mobile Inc. Common Stock,1.1,8774108.0,10561,Technology
ICU,SeaStar Medical Holding Corporation Common Stock,2.43,8759453.0,602937,Health Care
BIVI,BioVie Inc. Class A Common Stock,1.16,8746767.0,54946,Health Care
MYSE,Myseum Inc. Common Stock,2.0,8528658.0,46805,Telecommunications
TVGNW,Tevogen Bio Holdings Inc. Warrant,0.0423,8519951.0,209471,Health Care
CURX,Curanex Pharmaceuticals Inc Common Stock,0.3,8502244.0,120435,Health Care
CWD,CaliberCos Inc. Class A Common Stock,1.3,8494615.0,138096,Finance
RVYL,Ryvyl Inc. Common Stock,6.69,8473761.0,22873,Consumer Discretionary
AGPU,Axe Compute Inc. Common Stock,2.44,8280179.0,27352,Health Care
DSS,DSS Inc. Common Stock,0.91,8274191.0,71243,Consumer Discretionary
PRHI,Presurance Holdings Inc. Common Stock,0.6744,8243111.0,4565,Finance
KPRX,Kiora Pharmaceuticals Inc.  Common Stock,2.22,8165016.0,86263,Health Care
CYCU,Cycurion Inc. Common Stock,1.94,8125083.0,84404,Technology
ETS,Elite Express Holding Inc. Class A Common Stock,0.4859,8122631.0,45332,Industrials
TULP,Bloomia Holdings Inc. Common Stock,4.53,8032229.0,8040,Consumer Staples
BBGI,Beasley Broadcast Group Inc. Class A Common Stock,4.39,7919534.0,24117,Consumer Discretionary
BFRG,Bullfrog AI Holdings Inc. Common Stock,0.5185,7907024.0,354658,Health Care
XPON,Expion360 Inc. Common Stock,0.816,7879899.0,411497,Miscellaneous
MSN,Emerson Radio Corporation Common Stock,0.3737,7863639.0,161106,Consumer Staples
SRTAW,Strata Critical Medical Inc. Warrants,0.091,7859354.0,42988,Consumer Discretionary
PMCB,PharmaCyte  Biotech Inc. Common Stock,0.7755,7859041.0,113524,Health Care
CJMB,Callan JMB Inc. Common Stock,1.69,7812916.0,84826,Real Estate
TBH,Brag House Holdings Inc. Common Stock,0.3718,7789717.0,81523,Consumer Discretionary
TGL,Treasure Global Inc. Common Stock,4.6,7708335.0,76186,Real Estate
CXAI,CXApp Inc. Class A Common Stock,0.237,7559335.0,1763487,Technology
MKZR,MacKenzie Realty Capital Inc. Common Stock,4.065,7530335.0,8046,Real Estate
SKYQ,Sky Quarry Inc. Common Stock,0.2947,7507883.0,368733,Industrials
ALZN,Alzamend Neuro Inc. Common Stock,1.97,7489160.0,64835,Health Care
BOXL,Boxlight Corporation Class A Common Stock,1.79,7458334.0,1537759,Real Estate
NWTG,Newton Golf Company Inc. Common Stock,1.55,7366318.0,11986,Consumer Discretionary
SOWG,Sow Good Inc. Common Stock,0.5991,7323158.0,81869,Consumer Staples
BKYI,BIO-key International Inc. Common Stock,0.6711,7272454.0,156402,Technology
QNCX,Quince Therapeutics Inc. Common Stock,0.13,7238594.0,32042983,Health Care
RSVRW,Reservoir Media Inc. Warrant,0.11,7216024.0,4401,Consumer Discretionary
MITQ,Moving iMage Technologies Inc. Common Stock,0.705,7007511.0,18568,Consumer Discretionary
HYFM,Hydrofarm Holdings Group Inc. Common Stock,1.5,7000506.0,34317,Consumer Discretionary
DAVEW,Dave Inc. Warrants,0.5147,6950551.0,4034,Finance
INBS,Intelligent Bio Solutions Inc. Common Stock,5.71,6944171.0,46310,Health Care
SSKN,Strata Skin Sciences Inc. Common Stock,1.16,6830311.0,1072530,Health Care
TOVX,Theriva Biologics Inc. Common Stock,0.19,6780786.0,994344,Health Care
OLOX,Olenox Industries Inc. Common Stock,1.09,6738119.0,244228,Consumer Discretionary
JCTC,Jewett-Cameron Trading Company Common Shares,1.9,6688215.0,25278,Consumer Discretionary
RMSG,Real Messenger Corporation Ordinary Shares,0.698,6680754.0,34494,Technology
CELZ,Creative Medical Technology Holdings Inc. Common Stock,1.9,6639869.0,14795,Finance
IPDN,Professional Diversity Network Inc. Common Stock,1.35,6590650.0,151478,Technology
MSS,Maison Solutions Inc. Class A Common Stock,0.261,6584939.0,108208,Consumer Staples
BMRA,Biomerica Inc. Common Stock,2.17,6553545.0,10007,Health Care
ATER,Aterian Inc. Common Stock,0.65,6517580.0,51466,Consumer Discretionary
NVNO,enVVeno Medical Corporation Common Stock,9.9,6490499.0,125412,Health Care
JTAI,Jet.AI Inc. Common Stock,0.1421,6462459.0,26517927,Consumer Discretionary
KLTOW,Klotho Neurosciences Inc. Warrant,0.0874,6427110.0,164,Health Care
SONM,Sonim Technologies Inc. Common Stock,6.23,6408757.0,17212,Utilities
WALDW,Waldencast plc Warrant ,0.0497,6363648.0,5279,Consumer Discretionary
AMPGR,Amplitech Group Inc. Series A Right,0.2516,6335615.0,5000,Telecommunications
AMPGZ,Amplitech Group Inc. Series B Right,0.25,6295325.0,11582,Telecommunications
MGRX,Mangoceuticals Inc. Common Stock,0.379,6173454.0,194668,Health Care
LUCY,Innovative Eyewear Inc. Common Stock,1.14,6099209.0,130563,Health Care
SQFTP,Presidio Property Trust Inc. 9.375% Series D Cumulative Redeemable Perpetual Preferred Stock $0.01 par value per share,4.22,6072998.0,5785,Real Estate
MBIO,Mustang Bio Inc. Common Stock,0.8267,6034154.0,111212,Health Care
TCRT,Alaunos Therapeutics Inc. Common Stock,2.69,6003620.0,9348,Health Care
OLB,The OLB Group Inc. Common Stock,0.431,5790233.0,231397,Real Estate
RIME,Algorhythm Holdings Inc. Common Stock,0.955,5498987.0,320933,Consumer Staples
ASTC,Astrotech Corporation (DE) Common Stock,3.1,5452754.0,3776,Industrials
ACXP,Acurx Pharmaceuticals Inc. Common Stock,2.14,5449974.0,17691,Health Care
VEEAW,Veea Inc. Warrant,0.1073,5382240.0,194,Finance
APVO,Aptevo Therapeutics Inc. Common Stock,6.9,5293432.0,14787,Health Care
EEIQ,EpicQuest Education Group International Limited Common Stock,0.22,5207767.0,16374,Real Estate
MOBXW,Mobix Labs Inc Warrants,0.0776,5145884.0,9228,Technology
PCSA,Processa Pharmaceuticals Inc. Common Stock,2.26,5120638.0,46597,Health Care
GNPX,Genprex Inc. Common Stock,2.2,5101567.0,216685,Health Care
VIVS,VivoSim Labs Inc. Common Stock,1.95,5085526.0,379256,Health Care
ASBP,Aspire Biopharma Holdings Inc. Common Stock,1.44,4984060.0,143231,Health Care
SNOA,Sonoma Pharmaceuticals Inc. Common Stock,2.91,4950131.0,27618,Health Care
NUWE,Nuwellis Inc. Common Stock,2.63,4928336.0,48466,Health Care
CAPS,Capstone Holding Corp. Common Stock,0.542,4925627.0,114711,Health Care
DCOY,Decoy Therapeutics Inc. Common Stock,0.77,4915816.0,115556,Health Care
GNLN,Greenlane Holdings Inc. Class A Common Stock,1.015,4902006.0,98732,Consumer Discretionary
XBIO,Xenetic Biosciences Inc. Common Stock,2.13,4879949.0,25555,Health Care
ULY,Urgent.ly Inc. Common Stock,2.21,4841988.0,56814,Technology
BTMWW,Bitcoin Depot Inc. Warrant,0.0653,4789237.0,460208,Finance
NCPL,Netcapital Inc. Common Stock,0.6067,4761320.0,83613,Finance
LMFA,LM Funding America Inc. Common Stock,0.3342,4720073.0,132831,Finance
BLUWW,Blue Water Acquisition Corp. III Warrant.,0.65,4709250.0,8531,
EZRA,Reliance Global Group Inc. Common Stock,0.252,4670584.0,380601509,Finance
FLYE,Fly-E Group Inc. Common Stock,2.86,4668624.0,336434,Industrials
SILO,Silo Pharma Inc. Common Stock,0.2846,4664509.0,77602,Consumer Discretionary
BEATW,Heartbeam Inc. Warrant,0.1344,4629215.0,4422,Health Care
APRE,Aprea Therapeutics Inc. Common stock,0.66,4615933.0,278724,Health Care
GOVX,GeoVax Labs Inc. Common Stock,2.66,4607511.0,20221,Health Care
CYCN,Cyclerion Therapeutics Inc. Common Stock,1.17,4592617.0,82754,Health Care
DRMA,Dermata Therapeutics Inc. Common Stock,1.61,4564902.0,202419,Health Care
FLDDW,Fold Holdings Inc. Warrant,0.092,4522817.0,5030,Finance
KIDZ,Classover Holdings Inc. Class B Common Stock,0.1605,4498579.0,601538,Real Estate
IPW,iPower Inc. Common Stock,4.26,4472284.0,47040,Consumer Discretionary
SDOT,Sadot Group Inc. Common Stock,2.88,4461350.0,13125,Consumer Discretionary
NDRA,ENDRA Life Sciences Inc. Common Stock,3.8,4432476.0,6803,Health Care
VSTD,Vestand Inc. Class A Common Stock,0.3088,4392674.0,20635,Consumer Discretionary
SLE,Super League Enterprise Inc. Common Stock,4.57,4376556.0,18132,Consumer Discretionary
AMODW,Alpha Modus Holdings Inc. Warrant,0.104,4363836.0,5865,Miscellaneous
PDYNW,Palladyne AI Corp Warrants,0.0975,4359169.0,45976,Technology
SXTP,60 Degrees Pharmaceuticals Inc. Common Stock,4.11,4346785.0,88289,Health Care
WHLRP,Wheeler Real Estate Investment Trust Inc. Class B Preferred Stock,6.23,4328965.0,20896,Real Estate
BTOG,Bit Origin Limited Class A Ordinary Shares,2.91,4297610.0,191306,Finance
IVDA,Iveda Solutions Inc. Common Stock,0.377,4265575.0,1577694,Technology
SHPH,Shuttle Pharmaceuticals Holdings Inc. Common Stock,1.59,4264743.0,98813,Health Care
FFAIW,Faraday Future Intelligent Electric Inc. Warrant,0.0213,4223774.0,79035,Industrials
AEVAW,Aeva Technologies Inc. Warrants,0.0694,4169546.0,31608,Consumer Discretionary
ABP,Abpro Holdings Inc Common Stock,1.52,4128743.0,12594210,Health Care
CTNT,Cheetah Net Supply Chain Service Inc. Class A Common Stock,1.25,4093234.0,9115,Consumer Discretionary
BIAF,bioAffinity Technologies Inc. Common Stock,0.9,4048838.0,149180,Health Care
POLA,Polar Power Inc. Common Stock,1.52,4041188.0,55629,Miscellaneous
INDP,Indaptus Therapeutics Inc. Common Stock,1.8,4036183.0,13801,Health Care
MTNB,Matinas Biopharma Holdings Inc. Common Stock,0.63,4035900.0,38946,Health Care
REVB,Revelation Biosciences Inc. Common Stock,1.52,3987139.0,211617,Health Care
MSAIW,MultiSensor AI Holdings Inc. Warrant,0.0495,3966602.0,21438,Technology
DRCT,Direct Digital Holdings Inc. Class A Common Stock,1.64,3896771.0,186433,Consumer Discretionary
OUSTZ,Ouster Inc. Warrants,0.0641,3846335.0,11799,Industrials
SBLX,StableX Technologies Inc. Common Stock,2.62,3814655.0,22999,Consumer Discretionary
GBR,New Concept Energy Inc Common Stock,0.7401,3798144.0,28287,Energy
TRUG,TruGolf Holdings Inc. Class A Common Stock,0.7331,3707612.0,245982,Consumer Discretionary
GWAV,Greenwave Technology Solutions Inc. Common Stock,4.36,3617191.0,41640,Industrials
SUNE,SUNation Energy Inc. Common Stock,1.05,3576945.0,414494,Utilities
GRI,GRI Bio Inc. Common Stock,2.45,3540321.0,79335,Health Care
FEED,ENvue Medical Inc. Common Stock,3.25,3536572.0,6122453,Health Care
TWAV,TaoWeave Inc. Common Stock,1.1,3527931.0,28102,Technology
SQFT,Presidio Property Trust Inc. Class A Common Stock,2.44,3511402.0,4656,Real Estate
AQB,AquaBounty Technologies Inc. Common Stock,0.9,3489926.0,19421,Consumer Staples
FUSEW,Fusemachines Inc. Warrants,0.12,3472592.0,36,Technology
HCWB,HCW Biologics Inc. Common Stock,1.05,3443803.0,36672,Health Care
ADIL,Adial Pharmaceuticals Inc Common Stock,3.09,3433515.0,102202,Health Care
ESLAW,Estrella Immunopharma Inc. Warrant,0.09,3417384.0,5065,Health Care
ONFO,Onfolio Holdings Inc. Common Stock,0.581,3409404.0,41093,Technology
STAI,ScanTech AI Systems Inc. Common stock,0.9001,3402968.0,1731390,Industrials
MEHA,Functional Brands Inc. Common Stock,0.203,3313675.0,598258,Health Care
SHFS,SHF Holdings Inc. Class A Common Stock,1.06,3265941.0,328177,Finance
LIDRW,AEye Inc. Warrant,0.0713,3212421.0,5594,Consumer Discretionary
RKDA,Arcadia Biosciences Inc. Common Stock,1.83,3165688.0,16114,Consumer Staples
SGLY,Singularity Future Technology Ltd. Common Stock,0.4275,3117968.0,79643,Industrials
GIPR,Generation Income Properties Inc. Common Stock,0.571,3110678.0,53057,Real Estate
PW,Power REIT (MD) Common Stock,0.9106,3086625.0,8223,Real Estate
ALBT,Avalon GloboCare Corp. Common Stock,0.7076,3008722.0,138332,Health Care
OGEN,Oragenics Inc. Common Stock,0.6941,2960466.0,118300,Health Care
ARTL,Artelo Biosciences Inc. Common Stock,1.45,2927182.0,13695,Health Care
CMCT,Creative Media & Community Trust Corporation Common stock,3.02,2860031.0,16888,Real Estate
WORX,SCWorx Corp. Common Stock,0.1789,2831421.0,278584,Consumer Discretionary
DFNSW,T3 Defense Inc. Warrants,0.17,2829780.0,71788,
VAVX,VanEck Avalanche ETF Common Shares of Beneficial Interest,18.8134,2819602.0,7061,
AMIX,Autonomix Medical Inc. Common Stock,0.4,2763071.0,515207,Health Care
XXII,22nd Century Group Inc. Common Stock,5.36,2734549.0,25077,Health Care
SDSTW,Stardust Power Inc. Warrant,0.2752,2716102.0,22924,Industrials
ZEOWW,Zeo Energy Corporation Warrants,0.0469,2699604.0,79,Miscellaneous
LYRA,Lyra Therapeutics Inc. Common Stock,1.52,2697821.0,100340,Health Care
CDT,CDT Equity Inc. Common Stock,1.16,2672048.0,224109,Health Care
CNSP,CNS Pharmaceuticals Inc. Common Stock,4.27,2648638.0,31120,Health Care
TALKW,Talkspace Inc. Warrant,0.0156,2584236.0,8350,Health Care
BCGWW,Binah Capital Group Inc. Warrants,0.155,2573381.0,500,Finance
BBLG,Bone Biologics Corp Common Stock,1.42,2549269.0,13052,Health Care
AMPGW,Amplitech Group Inc. Warrants,0.1008,2538275.0,11363,Telecommunications
BFRGW,Bullfrog AI Holdings Inc. Warrants,0.165,2516218.0,1087,Health Care
ASNS,Actelis Networks Inc. Common Stock,0.3087,2487626.0,2350450,Telecommunications
AUUD,Auddia Inc. Common Stock,0.8,2481138.0,30352,Technology
JAGX,Jaguar Health Inc. Common Stock,0.661,2469394.0,283180,Health Care
CDIO,Cardio Diagnostics Holdings Inc. Common stock,1.34,2446908.0,88239,Health Care
ERNA,Ernexa Therapeutics Inc. Common Stock,0.3086,2423602.0,1232646,Health Care
ACON,Aclarion Inc. Common Stock,2.76,2358064.0,50408,Health Care
KITTW,Nauticus Robotics Inc. Warrant,0.0831,2331414.0,38123,Industrials
TIVC,Tivic Health Systems Inc. Common Stock,0.9112,2301489.0,35491,Health Care
XWEL,XWELL Inc. Common Stock,0.3906,2252474.0,6070976,Consumer Discretionary
ENVB,Enveric Biosciences Inc. Common Stock,2.11,2239835.0,79608,Health Care
ENSC,Ensysce Biosciences Inc. Common Stock,0.608,2208443.0,7714274,Health Care
AEMD,Aethlon Medical Inc. Common Stock,2.23,2170265.0,27433,Health Care
VSEEW,VSee Health Inc. Warrant,0.0538,2164419.0,50,Health Care
NVVE,Nuvve Holding Corp. Common Stock,1.46,2150637.0,118101,Industrials
FRGT,Freight Technologies Inc. Ordinary Shares,1.3,2033520.0,44297,Consumer Discretionary
RCKTW,Rocket Pharmaceuticals Inc. Warrant,0.0186,2012933.0,5317,Health Care
NXPLW,NextPlat Corp Warrants,0.0759,1996549.0,1540,Telecommunications
ELAB,PMGC Holdings Inc. Common Stock,1.68,1992136.0,110911,Health Care
BIVIW,BioVie Inc. Warrant,0.262,1975563.0,3113,Health Care
RMCOW,Royalty Management Holding Corporation Warrant,0.1282,1941042.0,48997,Miscellaneous
EDBL,Edible Garden AG Incorporated Common Stock,3.76,1927624.0,546688,Consumer Staples
ONCO,Onconetix Inc. Common Stock,1.19,1850468.0,104043,Health Care
RAINW,Rain Enhancement Technologies Holdco Inc. Warrants,0.22,1801543.0,43,Technology
TRNR,Interactive Strength Inc. Common Stock,0.3427,1800231.0,209641,Technology
TDOG,21Shares Dogecoin ETF Common Shares of Beneficial Interest,19.4587,1771072.0,1034,
GCTK,GlucoTrack Inc. Common Stock,1.75,1769738.0,31844,Health Care
SABSW,SAB Biotherapeutics Inc. Warrant,0.0368,1751932.0,400,Health Care
WHLR,Wheeler Real Estate Investment Trust Inc. Common Stock,2.515,1747568.0,553464,Real Estate
BNAIW,Brand Engagement Network Inc. Warrant,0.302,1745111.0,182103,Technology
SOBR,SOBR Safe Inc. Common Stock,0.8766,1653491.0,102172,Consumer Discretionary
HCTI,Healthcare Triangle Inc. Common Stock,0.15,1613809.0,5814431,Technology
AERTW,Aeries Technology Inc. Warrant,0.0319,1542487.0,2730,Consumer Discretionary
VGASW,Verde Clean Fuels Inc. Warrant,0.034,1514687.0,63956,Industrials
BJDX,Bluejay Diagnostics Inc. Common Stock,3.12,1415023.0,64102,Health Care
OSRHW,OSR Holdings Inc. Warrant,0.0551,1414571.0,21608,Health Care
NXGLW,NexGel Inc Warrant,0.1698,1382704.0,2688,Health Care
SCLXW,Scilex Holding Company Warrant,0.16,1358603.0,4466,Health Care
HOLOW,MicroCloud Hologram Inc. Warrant,0.0902,1313972.0,45182,Technology
NRXPW,NRX Pharmaceuticals Inc. Warrant,0.0438,1296706.0,6134,Health Care
DTSTW,Data Storage Corporation Warrant,0.1699,1273971.0,14,Technology
CXAIW,CXApp Inc. Warrant,0.0376,1199287.0,20289,Technology
BIAFW,bioAffinity Technologies Inc. Warrant,0.2643,1189009.0,324,Health Care
MAPSW,WM Technology Inc. Warrants ,0.0071,1116238.0,23060,Technology
KUST,Kustom Entertainment Inc. Common Stock,1.37,1097378.0,123822,Technology
BTBDW,BT Brands Inc. Warrant,0.1302,1021382.0,4012,Consumer Discretionary
UK,Ucommune International Ltd Ordinary Shares,0.4775,1012239.0,57912,Real Estate
IVDAW,Iveda Solutions Inc. Warrant,0.089,1006993.0,4029,Technology
DAICW,CID HoldCo Inc. Warrants,0.0338,989438.0,57429,Technology
FOXXW,Foxx Development Holdings Inc. Warrant,0.1266,870567.0,1899,Telecommunications
AREB,American Rebel Holdings Inc. Common Stock,1.02,867916.0,1288926,Industrials
XBPEW,XBP Europe Holdings Inc. Warrant,0.072,846115.0,134,Technology
SEATW,Vivid Seats Inc. Warrant,0.0749,803326.0,77955,Consumer Discretionary
AIMDW,Ainos Inc. Warrants,0.1115,778568.0,208,Health Care
MYPSW,PLAYSTUDIOS Inc. Warrant,0.0061,769234.0,364,Technology
BFRIW,Biofrontera Inc. Warrants,0.0634,738504.0,300,Health Care
STSSW,Sharps Technology Inc. Warrant,0.025,724885.0,55203,Finance
BZFDW,BuzzFeed Inc. Warrant,0.0172,639975.0,40875,Consumer Discretionary
JSPRW,Japer Therapeutics Inc. Warrants,0.0217,607254.0,64796,Health Care
WGSWW,GeneDx Holdings Corp. Warrant,0.0191,552078.0,20635,Technology
CINGW,Cingulate Inc. Warrants,0.0702,522729.0,24796,Health Care
ORGNW,Origin Materials Inc. Warrants,0.0033,512214.0,100,Industrials
DFLIW,Dragonfly Energy Holdings Corp. Warrant,0.0377,455367.0,15430,Miscellaneous
ADTX,Aditxt Inc. Common Stock,0.703,393289.0,337025,Health Care
KIDZW,Classover Holdings Inc. Warrants,0.0138,386794.0,48184,Real Estate
RMSGW,Real Messenger Corporation Warrants,0.04,382851.0,6407,Technology
NIXXW,Nixxy Inc. Warrant,0.015,373134.0,1477,Technology
ONFOW,Onfolio Holdings Inc. Warrant,0.0604,354437.0,314,Technology
CELUW,Celularity Inc. Warrant,0.0121,348937.0,2300,Health Care
GIPRW,Generation Income Properties Inc Warrant,0.0599,326322.0,12455,Real Estate
LUCYW,Innovative Eyewear Inc. Series A Warrants 8/16/27,0.055,294260.0,1555,Health Care
BNZIW,Banzai International Inc. Warrant,0.0245,291998.0,12868,Technology
NCPLW,Netcapital Inc. Warrants,0.0317,248778.0,1,Finance
LRHC,La Rosa Holdings Corp. Common Stock,1.53,248675.0,405454,Finance
KTTAW,Pasithea Therapeutics Corp. Warrant,0.0105,242456.0,200,Health Care
MYSEW,Myseum Inc. Series A Warrant,0.0437,186351.0,30,Telecommunications
EZRAW,Reliance Global Group Inc. Series A Warrants,0.01,185341.0,766962,Finance
BENFW,Beneficient Warrant,0.0108,150423.0,141789,Finance
LNZAW,LanzaTech Global Inc. Warrant,0.0136,137108.0,10620,Industrials
TNONW,Tenon Medical Inc. Warrant,0.0116,128835.0,19048,Health Care
SHFSW,SHF Holdings Inc. Warrants,0.0395,121703.0,551,Finance
LTRYW,Sports Entertainment Gaming Global Corporation Warrants,0.0101,117774.0,31987,Technology
CYCUW,Cycurion Inc. Warrant,0.0274,114756.0,27451,Technology
ICUCW,SeaStar Medical Holding Corporation Warrant,0.0246,88676.0,1298,Health Care
FGIWW,FGI Industries Ltd. Warrant,0.04,76806.0,5707,Industrials
SXTPW,60 Degrees Pharmaceuticals Inc. Warrant,0.07,74033.0,1952,Health Care
ASBPW,Aspire Biopharma Holdings Inc. Warrant,0.0182,62993.0,3006,Health Care
COEPW,Coeptis Therapeutics Holdings Inc. Warrants,0.0106,61080.0,22504,Health Care
PIIIW,P3 Health Partners Inc. Warrant,0.0075,54042.0,13240,Health Care
XOSWW,Xos Inc. Warrants,0.0045,51004.0,47868,Consumer Discretionary
DRMAW,Dermata Therapeutics Inc. Warrant,0.0165,46783.0,11104,Health Care
ABPWW,Abpro Holdings Inc. Warrant,0.0155,42102.0,17802,Health Care
EDBLW,Edible Garden AG Incorporated Warrant,0.0798,40911.0,27074,Consumer Staples
SQFTW,Presidio Property Trust Inc. Series A Common Stock Purchase Warrants,0.0275,39575.0,23044,Real Estate
MNTSW,Momentus Inc. Warrant,0.0249,34790.0,379090,Industrials
CDIOW,Cardio Diagnostics Holdings Inc. Warrant,0.0174,31773.0,201,Health Care
AUUDW,Auddia Inc. Warrants,0.0094,29153.0,31012,Technology
ACONW,Aclarion Inc. Warrant,0.033,28194.0,2874,Health Care
REVBW,Revelation Biosciences Inc. Warrant,0.0095,24920.0,4000,Health Care
CDTTW,CDT Equity Inc. Warrant,0.0087,20040.0,5000,Health Care
NVVEW,Nuvve Holding Corp. Warrant,0.012,17676.0,17499,Industrials
APLMW,Apollomics Inc. Warrant,0.0142,15668.0,2100,Health Care
KPLTW,Katapult Holdings Inc. Warrant,0.0032,14859.0,157729,Consumer Discretionary
AREBW,American Rebel Holdings Inc. Warrants,0.0122,10381.0,6638,Industrials
CTBB,Qwest Corporation 6.5% Notes due 2056,19.6,20.0,38951,Telecommunications
CTDD,Qwest Corporation 6.75% Notes due 2057,19.76,20.0,13348,Telecommunications
BTO,John Hancock Financial Opportunities Fund Common Stock,39.69,0.0,23867,Finance
NMS,Nuveen Minnesota Quality Municipal Income Fund ,12.11,0.0,7073,Finance
CAPNU,Cayson Acquisition Corp Unit,11.7578,0.0,3,
CAPNR,Cayson Acquisition Corp Right,0.1831,0.0,1353,Finance
NMT,Nuveen Massachusetts Quality Municipal Income Fund Common Stock,11.73,0.0,96052,Finance
VLT,Invesco High Income Trust II,11.04,0.0,25264,Finance
RTAC,Renatus Tactical Acquisition Corp I Class A Ordinary Shares,10.64,0.0,91525,Finance
BTA,BlackRock Long-Term Municipal Advantage Trust Common Shares of Beneficial Interest,9.68,0.0,30118,Finance
VSECU,VSE Corporation Tangible Equity Units,53.46,0.0,686036,
BRW,Saba Capital Income & Opportunities Fund SBI,6.54,0.0,497891,Finance
BHK,Blackrock Core Bond Trust,9.61,0.0,284816,Finance
BHV,BlackRock Virginia Municipal Bond Trust,10.76,0.0,8704,Finance
BLZR,Trailblazer Acquisition Corp. Class A Ordinary Shares,10.1043,0.0,1113,Finance
BSL,Blackstone Senior Floating Rate 2027 Term Fund Common Shares of Beneficial Interest,13.25,0.0,91520,Finance
VFL,abrdn National Municipal Income Fund Common Stock,10.42,0.0,3999,Finance
BOE,Blackrock Enhanced Global Dividend Trust Common Shares of Beneficial Interest,12.06,0.0,140347,Finance
VNME,Vendome Acquisition Corporation I Class A Ordinary Shares,10.12,0.0,139,Finance
VNMEU,Vendome Acquisition Corporation I Unit,10.24,0.0,1869,Finance
BNCWW,CEA Industries Inc. Warrant,0.05,0.0,704,
VNMEW,Vendome Acquisition Corporation I Warrant,0.29,0.0,104,Finance
NEWTO,NewtekOne Inc. 8.50% Fixed Rate Senior Notes due 2031,25.71,0.0,20,
NEWTH,NewtekOne Inc. 8.625% Fixed Rate Senior Notes due 2029,25.2501,0.0,5255,Finance
NHIC,NewHold Investment Corp III Class A Ordinary Shares,10.44,0.0,8,
RWAYI,Runway Growth Finance Corp. 7.25% Notes due 2031,25.4215,0.0,26602,Finance
NFJ,Virtus Dividend Interest & Premium Strategy Fund Common Shares of Beneficial Interest,13.62,0.0,134883,Finance
MXF,Mexico Fund Inc. (The) Common Stock,22.66,0.0,35336,Finance
RWTP,Redwood Trust Inc. 9.125% Senior Notes Due 2030,25.24,0.0,7891,Real Estate
RWTQ,Redwood Trust Inc. 9.500% Senior Notes Due 2030,25.09,0.0,16542,Real Estate
MXE,Mexico Equity and Income Fund Inc. (The) Common Stock,14.02,0.0,1502,Finance
CAEP,Cantor Equity Partners III Inc. Class A Ordinary Shares,10.23,0.0,45232,
NMI,Nuveen Municipal Income Fund Inc. Common Stock,10.16,0.0,47267,Finance
NML,Neuberger Energy Infrastructure and Income Fund Inc. Common Stock,9.52,0.0,175036,Finance
NMPAR,NMP Acquisition Corp. Right,0.2295,0.0,1324,Finance
BDCI,BTC Development Corp. Class A Ordinary Shares,10.085,0.0,898,Finance
BDCIU,BTC Development Corp. Unit,10.21,0.0,1,Finance
BGB,Blackstone Strategic Credit 2027 Term Fund Common Shares of Beneficial Interest,11.61,0.0,162440,Finance
BGH,Barings Global Short Duration High Yield Fund Common Shares of Beneficial Interests,14.88,0.0,103787,Finance
BGMS,Bio Green Med Solution Inc. Common Stock,1.01,0.0,190997,
BGMSP,Bio Green Med Solution Inc. 6% Convertible Preferred Stock,3.72,0.0,256,
BIT,BlackRock Multi-Sector Income Trust Common Shares of Beneficial Interest,13.33,0.0,165433,Finance
BGY,Blackrock Enhanced International Dividend Trust,6.17,0.0,300614,Finance
RTACU,Renatus Tactical Acquisition Corp I Unit,11.0296,0.0,771,Finance
NHS,Neuberger High Yield Strategies Fund Inc. Common Stock,7.53,0.0,227094,Finance
NIM,Nuveen Select Maturities Municipal Fund Common Stock,9.7,0.0,19207,Finance
NKX,Nuveen California AMT-Free Quality Municipal Income Fund,13.02,0.0,176107,Finance
NPAC,New Providence Acquisition Corp. III Class A Ordinary Shares,10.34,0.0,78437,
NPACU,New Providence Acquisition Corp. III Units,10.46,0.0,21189,Finance
NPACW,New Providence Acquisition Corp. III Warrants,0.5,0.0,18261,
NPCT,Nuveen Core Plus Impact Fund Common Shares of Beneficial Interest,10.47,0.0,104209,Finance
BBCQ,Bleichroeder Acquisition Corp. II Class A Ordinary Shares,9.94,0.0,500715,
BGT,BlackRock Floating Rate Income Trust,11.37,0.0,99190,Finance
BLZRU,Trailblazer Acquisition Corp. Unit,10.22,0.0,754,
BLZRW,Trailblazer Acquisition Corp. Warrant,0.5,0.0,10171,Finance
BLRK,Bluerock Acquisition Corp. Class A Ordinary Shares,9.91,0.0,872,
BLRKU,Bluerock Acquisition Corp. Unit,10.02,0.0,10168,
BLRKW,Bluerock Acquisition Corp. Warrants,0.29,0.0,27883,
BKN,BlackRock Investment Quality Municipal Trust Inc. (The),11.44,0.0,51386,Finance
BPAC,Blueport Acquisition Ltd Class A Ordinary Shares,9.98,0.0,2,
BPACR,Blueport Acquisition Ltd Rights,0.2,0.0,100,
