symbol,name,price,marketCap,volume,industry
NVDA,NVIDIA Corporation Common Stock,219.51,5312142000000.0,203384312,Technology
GOOGL,Alphabet Inc. Class A Common Stock,387.66,4696888560000.0,24852956,Technology
GOOG,Alphabet Inc. Class C Capital Stock,383.47,4646122520000.0,16837632,Technology
AAPL,Apple Inc. Common Stock,304.99,4479496706440.0,42965348,Technology
MSFT,Microsoft Corporation Common Stock,419.09,3113182700099.0,31393617,Technology
AMZN,Amazon.com Inc. Common Stock,268.46,2887853599189.0,36591854,Consumer Discretionary
AVGO,Broadcom Inc. Common Stock,414.57,1962851389041.0,16865562,Technology
TSLA,Tesla Inc. Common Stock,417.85,1569329219497.0,42637800,Industrials
META,Meta Platforms Inc. Class A Common Stock,607.38,1541787546384.0,13476569,Technology
BRK/B,Berkshire Hathaway Inc.,479.98,1058985331853.0,3294035,Uncategorized
BRK/A,Berkshire Hathaway Inc.,718387.0,1056656760238.0,226,Uncategorized
LLY,Eli Lilly and Company Common Stock,1041.65,980964935560.0,2705469,Health Care
WMT,Walmart Inc. Common Stock,121.34,967371319471.0,53006625,Consumer Discretionary
MU,Micron Technology Inc. Common Stock,762.1,859446120267.0,42461662,Technology
JPM,JP Morgan Chase & Co. Common Stock,303.0,811891959654.0,7874402,Finance
AMD,Advanced Micro Devices Inc. Common Stock,449.59,733101741288.0,27252574,Technology
XOM,Exxon Mobil Corporation Common Stock,155.29,643668844787.0,17061725,Energy
V,Visa Inc.,331.12,627296229922.0,7034529,Consumer Discretionary
INTC,Intel Corporation Common Stock,118.5,595581000000.0,102452819,Technology
JNJ,Johnson & Johnson Common Stock,231.73,557824388690.0,5239043,Health Care
ORCL,Oracle Corporation Common Stock,189.77,545787249420.0,12119748,Technology
COST,Costco Wholesale Corporation Common Stock,1050.45,466034810643.0,2149873,Consumer Discretionary
CSCO,Cisco Systems Inc. Common Stock (DE),118.2,465877577403.0,22700587,Telecommunications
MA,Mastercard Incorporated Common Stock,499.62,441456165635.0,2474942,Consumer Discretionary
CAT,Caterpillar Inc. Common Stock,865.95,398888632665.0,1860742,Industrials
CVX,Chevron Corporation Common Stock,191.01,380415082789.0,9051171,Energy
ABBV,AbbVie Inc. Common Stock,214.5,378977060105.0,3814060,Health Care
LRCX,Lam Research Corporation Common Stock,302.24,377972579040.0,9162404,Technology
NFLX,Netflix Inc. Common Stock,89.3,376024308550.0,28614099,Consumer Discretionary
BAC,Bank of America Corporation Common Stock,51.49,365403452620.0,27461930,Finance
KO,Coca-Cola Company (The) Common Stock,81.17,349368089026.0,15708459,Consumer Staples
UNH,UnitedHealth Group Incorporated Common Stock (DE),382.48,347347071642.0,4732462,Health Care
AMAT,Applied Materials Inc. Common Stock,427.36,339157112761.0,5682863,Technology
PG,Procter & Gamble Company (The) Common Stock,143.4,333921093445.0,6297295,Consumer Discretionary
PLTR,Palantir Technologies Inc. Class A Common Stock,137.415,329426625319.0,24312157,Technology
MS,Morgan Stanley Common Stock,200.51,316261378657.0,5817427,Finance
GE,GE Aerospace Common Stock,301.76,314837444034.0,4928296,Technology
HD,Home Depot Inc. (The) Common Stock,313.78,312533558527.0,4516593,Consumer Discretionary
PM,Philip Morris International Inc Common Stock,188.46,293726000117.0,3644126,Health Care
GS,Goldman Sachs Group Inc. (The) Common Stock,988.17,291517483210.0,2452321,Finance
MRK,Merck & Company Inc. Common Stock (new),115.88,286203253210.0,7402738,Health Care
GEV,GE Vernova Inc. Common Stock,1043.82,280495305181.0,1633673,Uncategorized
TXN,Texas Instruments Incorporated Common Stock,298.39,271562587906.0,5663743,Technology
KLAC,KLA Corporation Common Stock,1842.18,240639406636.0,820900,Technology
LIN,Linde plc Ordinary Shares,514.51,238012088811.0,1655675,Basic Materials
IBM,International Business Machines Corporation Common Stock,252.97,237762779282.0,25707843,Technology
RTX,RTX Corporation Common Stock,175.98,236989349659.0,3596351,Industrials
WFC,Wells Fargo & Company Common Stock,75.92,232329586384.0,9433387,Finance
SNDK,Sandisk Corporation Common Stock,1542.24,228389948378.0,13746112,Technology
CCZ,Comcast Holdings ZONES,63.9,228367191933.0,3,Telecommunications
QCOM,QUALCOMM Incorporated Common Stock,213.41,224934140000.0,28163737,Technology
C,Citigroup Inc. Common Stock,125.22,213572346305.0,6834944,Finance
AXP,American Express Company Common Stock,309.7,211316499397.0,1992692,Finance
TMUS,T-Mobile US Inc. Common Stock,190.9,206592880475.0,3774666,Telecommunications
PANW,Palo Alto Networks Inc. Common Stock,252.92,206382720000.0,6323615,Technology
PEP,PepsiCo Inc. Common Stock,148.85,203443463688.0,6123151,Consumer Staples
MCD,McDonald's Corporation Common Stock,284.18,201911555011.0,5116313,Consumer Discretionary
VZ,Verizon Communications Inc. Common Stock,48.27,201554228586.0,15841950,Telecommunications
ADI,Analog Devices Inc. Common Stock,384.21,187143711638.0,5303481,Technology
ANET,Arista Networks Inc. Common Stock,148.59,187104913294.0,11620570,Telecommunications
NEE,NextEra Energy Inc. Common Stock,89.69,187034275189.0,12490635,Technology
AMGN,Amgen Inc. Common Stock,337.42,182108365813.0,2001113,Health Care
DIS,Walt Disney Company (The) Common Stock,103.58,179867853298.0,8611237,Consumer Discretionary
T,AT&T Inc.,25.34,176070906079.0,35792628,Telecommunications
TJX,TJX Companies Inc. (The) Common Stock,157.46,174121513852.0,5854976,Consumer Discretionary
BA,Boeing Company (The) Common Stock,219.61,173119074911.0,6412817,Industrials
WDC,Western Digital Corporation Common Stock,486.46,167674069446.0,5046849,Technology
TMO,Thermo Fisher Scientific Inc Common Stock,449.37,166995537727.0,2012918,Industrials
MRVL,Marvell Technology Inc. Common Stock,190.69,166959234559.0,21506122,Technology
GLW,Corning Incorporated Common Stock,191.89,165147792239.0,14408259,Industrials
BLK,BlackRock Inc. Common Stock,1063.75,165130155799.0,624824,Finance
CRWD,CrowdStrike Holdings Inc. Class A Common Stock,648.23,164998209008.0,2646091,Technology
DELL,Dell Technologies Inc. Class C Common Stock ,252.8,164210862954.0,5075029,Technology
APP,Applovin Corporation Class A Common Stock,485.89,163229886600.0,3203681,Technology
CRM,Salesforce Inc. Common Stock,176.31,162734130000.0,10949109,Technology
GILD,Gilead Sciences Inc. Common Stock,130.5,162024868557.0,4920772,Health Care
UNP,Union Pacific Corporation Common Stock,265.44,157595235259.0,2308852,Industrials
SCHW,Charles Schwab Corporation (The) Common Stock,90.41,157235241188.0,8077912,Finance
ISRG,Intuitive Surgical Inc. Common Stock,439.8,155760817912.0,2088412,Health Care
APH,Amphenol Corporation Common Stock,124.86,153607072803.0,8587147,Technology
ABT,Abbott Laboratories Common Stock,87.77,152878876893.0,8524184,Health Care
WELL,Welltower Inc. Common Stock,216.01,152484580345.0,4191491,Real Estate
TBB,AT&T Inc. 5.350% Global Notes due 2066,21.0,150158095080.0,77829,Telecommunications
UBER,Uber Technologies Inc. Common Stock,73.61,149840443347.0,13238714,Consumer Discretionary
SCCO,Southern Copper Corporation Common Stock,179.12,147964770144.0,1350016,Basic Materials
PFE,Pfizer Inc. Common Stock,25.95,147900576186.0,20181558,Health Care
COP,ConocoPhillips Common Stock,120.55,146865342544.0,5754523,Energy
DE,Deere & Company Common Stock,531.35,143521504291.0,3212523,Industrials
IBKR,Interactive Brokers Group Inc. Class A Common Stock,83.83,142205334192.0,4839113,Finance
HON,Honeywell International Inc. Common Stock,223.8,141811568032.0,4732474,Industrials
PLD,Prologis Inc. Common Stock,144.63,134844044940.0,2789646,Real Estate
VRT,Vertiv Holdings LLC Class A Common Stock,323.4,124220791094.0,5221328,Technology
BKNG,Booking Holdings Inc. Common Stock,159.68,123732588660.0,7470508,Consumer Discretionary
MO,Altria Group Inc.,73.71,123087682932.0,6477385,Health Care
SPGI,S&P Global Inc. Common Stock,415.73,123056080000.0,2062584,Finance
DHR,Danaher Corporation Common Stock,173.33,122677882778.0,4237927,Industrials
LOW,Lowe's Companies Inc. Common Stock,217.41,121763390099.0,3267043,Consumer Discretionary
BMY,Bristol-Myers Squibb Company Common Stock,59.55,121605342759.0,8451148,Health Care
LMT,Lockheed Martin Corporation Common Stock,522.79,120536348626.0,1639665,Industrials
SYK,Stryker Corporation Common Stock,313.5,120183598887.0,2890759,Health Care
CVS,CVS Health Corporation Common Stock,93.32,119069536289.0,6479007,Consumer Staples
SBUX,Starbucks Corporation Common Stock,104.13,118676961000.0,8342778,Consumer Discretionary
PGR,Progressive Corporation (The) Common Stock,198.97,116265426242.0,3437930,Finance
COF,Capital One Financial Corporation Common Stock,186.66,116157170875.0,3725556,Finance
NEM,Newmont Corporation,108.33,115647990924.0,5300544,Basic Materials
VRTX,Vertex Pharmaceuticals Incorporated Common Stock,433.54,110034800486.0,1395241,Health Care
PH,Parker-Hannifin Corporation Common Stock,864.73,109030683160.0,732987,Industrials
PWR,Quanta Services Inc. Common Stock,716.91,107579621420.0,938048,Industrials
EQIX,Equinix Inc. Common Stock REIT,1078.42,106358361528.0,535000,Real Estate
SO,Southern Company (The) Common Stock,94.24,106332860308.0,3741072,Utilities
CME,CME Group Inc. Class A Common Stock,289.29,104826935494.0,2443721,Finance
HWM,Howmet Aerospace Inc. Common Stock,259.89,103983933757.0,1633519,Industrials
CEG,Constellation Energy Corporation Common Stock ,285.83,103238955707.0,2366014,Utilities
NOW,ServiceNow Inc. Common Stock,99.69,102780390000.0,26474070,Technology
MDT,Medtronic plc. Ordinary Shares,78.15,100335609937.0,9226490,Health Care
CDNS,Cadence Design Systems Inc. Common Stock,358.46,98869003360.0,1757243,Technology
ADBE,Adobe Inc. Common Stock,244.1,98665220000.0,4131044,Technology
MAR,Marriott International Class A Common Stock,370.56,97712456139.0,908575,Consumer Discretionary
DUK,Duke Energy Corporation (Holding Company) Common Stock,124.66,97184464411.0,2206019,Utilities
SNPS,Synopsys Inc. Common Stock,503.98,96543430367.0,1423274,Technology
BNY,The Bank of New York Mellon Corporation Common Stock,138.98,95392959674.0,3011322,Finance
FTNT,Fortinet Inc. Common Stock,129.46,94848660699.0,4266227,Technology
WMB,Williams Companies Inc. (The) Common Stock,77.52,94806825503.0,4178717,Utilities
FDX,FedEx Corporation Common Stock,388.91,92796553476.0,939414,Consumer Discretionary
MCK,McKesson Corporation Common Stock,766.5,92136405092.0,1640876,Health Care
GD,General Dynamics Corporation Common Stock,338.71,91597408639.0,612370,Industrials
CMCSA,Comcast Corporation Class A Common Stock,25.08,89631442468.0,27771398,Telecommunications
FCX,Freeport-McMoRan Inc. Common Stock,62.31,89574355188.0,10184458,Basic Materials
ADP,Automatic Data Processing Inc. Common Stock,220.075,88611958407.0,2248980,Industrials
CMI,Cummins Inc. Common Stock,638.78,88144656218.0,1613306,Industrials
BX,Blackstone Inc. Common Stock,118.57,88083258716.0,4672563,Finance
PNC,PNC Financial Services Group Inc. (The) Common Stock,218.37,87689668690.0,1608821,Finance
BE,Bloom Energy Corporation Class A Common Stock,307.88,87574578080.0,13931632,Energy
WM,Waste Management Inc. Common Stock,217.75,87443119998.0,1698128,Utilities
HCA,HCA Healthcare Inc. Common Stock,392.56,87085431888.0,2356512,Health Care
ICE,Intercontinental Exchange Inc. Common Stock,151.49,85669487868.0,4175051,Finance
AMT,American Tower Corporation (REIT) Common Stock,183.78,85621828221.0,2929368,Real Estate
EPD,Enterprise Products Partners L.P. Common Stock,39.47,85394066156.0,4777258,Utilities
CSX,CSX Corporation Common Stock,45.9,85288573490.0,12087359,Industrials
KKR,KKR & Co. Inc. Common Stock,94.76,85082439889.0,3846833,Finance
BSX,Boston Scientific Corporation Common Stock,57.15,84945198480.0,12841379,Health Care
USB,U.S. Bancorp Common Stock,54.56,84693474087.0,6126688,Finance
ELV,Elevance Health Inc. Common Stock,389.82,84654238972.0,1253965,Health Care
MNST,Monster Beverage Corporation,86.32,84421660055.0,4306894,Consumer Staples
INTU,Intuit Inc. Common Stock,307.07,83995006590.0,22353573,Technology
UPS,United Parcel Service Inc. Common Stock,98.25,83513116912.0,4478415,Industrials
CIEN,Ciena Corporation Common Stock,587.23,83033398287.0,1550156,Utilities
ABNB,Airbnb Inc. Class A Common Stock,134.25,80913135913.0,4173981,Consumer Discretionary
MRSH,Marsh Common Stock,165.12,79553908005.0,2087376,Finance
MMM,3M Company Common Stock,151.6,79069596768.0,2834762,Health Care
MDLZ,Mondelez International Inc. Class A Common Stock,61.5,78944460609.0,5378306,Consumer Staples
NOC,Northrop Grumman Corporation Common Stock,551.58,78342824692.0,799530,Industrials
MCO,Moody's Corporation Common Stock,445.37,77806139000.0,1046695,Finance
DDOG,Datadog Inc. Class A Common Stock,218.04,77613559610.0,4179201,Technology
MPWR,Monolithic Power Systems Inc. Common Stock,1561.25,76704212500.0,450120,Technology
ORLY,O'Reilly Automotive Inc. Common Stock,92.34,76523550395.0,4694964,Consumer Discretionary
SHW,Sherwin-Williams Company (The) Common Stock,309.34,76294263000.0,2114002,Consumer Discretionary
EMR,Emerson Electric Company Common Stock,134.9,75557490000.0,3638124,Technology
APO,Apollo Global Management Inc. (New) Common Stock,130.9,75466142452.0,3235616,Finance
NET,Cloudflare Inc. Class A Common Stock,212.65,75164597425.0,2794366,Technology
LITE,Lumentum Holdings Inc. Common Stock,964.5,75038100000.0,5781962,Telecommunications
CI,The Cigna Group Common Stock,282.02,74603428576.0,1158419,Health Care
EOG,EOG Resources Inc. Common Stock,139.98,74557341629.0,2494478,Energy
KMI,Kinder Morgan Inc. Common Stock,33.5,74531662860.0,10482865,Utilities
COHR,Coherent Corp. Common Stock,378.0,73951663338.0,4366230,Technology
HLT,Hilton Worldwide Holdings Inc. Common Stock ,322.76,73475788547.0,981675,Consumer Discretionary
RKLB,Rocket Lab Corporation Common Stock,125.45,72618924739.0,30826485,Industrials
MPC,Marathon Petroleum Corporation Common Stock,248.43,72525818233.0,2623977,Energy
CL,Colgate-Palmolive Company Common Stock,90.44,72369121196.0,4645493,Consumer Discretionary
ITW,Illinois Tool Works Inc. Common Stock,249.93,71904861000.0,1090143,Industrials
VLO,Valero Energy Corporation Common Stock,241.09,71587524412.0,3610742,Energy
CVNA,Carvana Co. Class A Common Stock,64.39,70625253299.0,9346672,Consumer Discretionary
AEP,American Electric Power Company Inc. Common Stock,129.61,70521453198.0,5244852,Utilities
ECL,Ecolab Inc. Common Stock,250.18,70410034250.0,1472035,Consumer Discretionary
ROST,Ross Stores Inc. Common Stock,217.19,69967356264.0,3791907,Consumer Discretionary
NSC,Norfolk Southern Corporation Common Stock,311.44,69947555671.0,783018,Industrials
RCL,Royal Caribbean Cruises Ltd. Common Stock,260.32,69816516673.0,3395914,Consumer Discretionary
PSX,Phillips 66 Common Stock,174.05,69782740231.0,2718401,Energy
GM,General Motors Company Common Stock,77.21,69617569706.0,6362611,Industrials
DASH,DoorDash Inc. Class A Common Stock,159.27,69396920853.0,4162772,Technology
AON,Aon plc Class A Ordinary Shares (Ireland),324.22,69245918405.0,946462,Finance
CTAS,Cintas Corporation Common Stock,172.36,68967592809.0,1863765,Industrials
ET,Energy Transfer LP Common Units ,20.01,68857597133.0,6658372,Utilities
HOOD,Robinhood Markets Inc. Class A Common Stock,75.92,68366343927.0,16266446,Finance
DLR,Digital Realty Trust Inc. Common Stock,194.27,68267657219.0,1774845,Real Estate
WBD,Warner Bros. Discovery Inc. Series A Common Stock ,27.1,67943404624.0,15192662,Consumer Discretionary
TDG,Transdigm Group Incorporated Common Stock,1209.32,67641600594.0,469706,Industrials
REGN,Regeneron Pharmaceuticals Inc. Common Stock,642.59,67368513573.0,1178558,Health Care
SPG,Simon Property Group Inc. Common Stock,204.9,66447002969.0,1143326,Real Estate
MSI,Motorola Solutions Inc. Common Stock,400.24,66438071740.0,1589712,Technology
NKE,Nike Inc. Common Stock,44.39,65736575395.0,18428076,Consumer Discretionary
TRV,The Travelers Companies Inc. Common Stock,307.23,65330829030.0,1552547,Finance
BKR,Baker Hughes Company Class A Common Stock,65.8,65278120263.0,6403792,Consumer Discretionary
APD,Air Products and Chemicals Inc. Common Stock,290.19,64619708270.0,1272959,Basic Materials
FIX,Comfort Systems USA Inc. Common Stock,1835.33,64608064840.0,277914,Industrials
RSG,Republic Services Inc. Common Stock,208.09,64021819864.0,1764080,Utilities
CBRS,Cerebras Systems Inc. Class A Common Stock,281.86,60664316566.0,5452856,Technology
D,Dominion Energy Inc. Common Stock,68.29,60058009471.0,9778518,Utilities
AFL,AFLAC Incorporated Common Stock,117.81,59963511540.0,2851793,Finance
SRE,DBA Sempra Common Stock,91.55,59846912562.0,1886802,Utilities
TFC,Truist Financial Corporation Common Stock,47.89,59665158480.0,7088412,Finance
CRWV,CoreWeave Inc. Class A Common Stock,107.58,58692457823.0,31898655,Technology
OXY,Occidental Petroleum Corporation Common Stock,58.83,58514359460.0,14021558,Energy
GWW,W.W. Grainger Inc. Common Stock,1239.26,58509329852.0,188586,Industrials
URI,United Rentals Inc. Common Stock,932.18,58397867504.0,303743,Consumer Discretionary
OKE,ONEOK Inc. Common Stock,92.62,58353642752.0,2844463,Utilities
O,Realty Income Corporation Common Stock,62.23,58029010142.0,3807507,Real Estate
TRGP,Targa Resources Inc. Common Stock,270.24,58005368347.0,1242832,Utilities
SOMN,Southern Company (The) 2025 Series A Corporate Units,51.31,57894090221.0,37930,Basic Materials
KEYS,Keysight Technologies Inc. Common Stock,337.55,57890667187.0,2226804,Industrials
MSTR,Strategy Inc Common Stock Class A,164.85,57771331699.0,10526965,Technology
PCAR,PACCAR Inc. Common Stock,109.34,57544136279.0,3370484,Consumer Discretionary
SNOW,Snowflake Inc. Common Stock,165.54,57376376388.0,4503986,Technology
TGT,Target Corporation Common Stock,126.15,57294333559.0,9959871,Consumer Discretionary
LHX,L3Harris Technologies Inc. Common Stock,306.33,57067732340.0,883468,Industrials
AZO,AutoZone Inc. Common Stock,3438.18,56650272988.0,293444,Consumer Discretionary
FANG,Diamondback Energy Inc. Common Stock,200.97,56535533298.0,1495881,Energy
MPLX,MPLX LP Common Units Representing Limited Partner Interests,55.62,56439489451.0,1715214,Energy
TER,Teradyne Inc. Common Stock,353.44,55328261737.0,3586998,Industrials
ALL,Allstate Corporation (The) Common Stock,214.44,55201344229.0,2193278,Finance
SE,Sea Limited American Depositary Shares each representing one Class A Ordinary Share,88.96,54486623077.0,3119781,Consumer Discretionary
F,Ford Motor Company Common Stock,13.67,54470748252.0,72523170,Industrials
MET,MetLife Inc. Common Stock,84.3,54241720470.0,4190171,Finance
PSA,Public Storage Common Stock,304.99,53539697683.0,605547,Real Estate
AJG,Arthur J. Gallagher & Co. Common Stock,207.41,53283629000.0,1351911,Finance
BRKRP,Bruker Corporation 6.375% Mandatory Convertible Preferred Stock Series A,342.49,53081026364.0,10059,Industrials
CTVA,Corteva Inc. Common Stock ,79.04,52863532800.0,3626407,Consumer Staples
EBAY,eBay Inc. Common Stock,117.13,52124159631.0,4758299,Consumer Discretionary
CARR,Carrier Global Corporation Common Stock ,62.18,51972772583.0,11117995,Industrials
COR,Cencora Inc. Common Stock,265.44,51644287766.0,1301819,Health Care
NUE,Nucor Corporation Common Stock,226.44,51569660718.0,998297,Industrials
ETR,Entergy Corporation Common Stock,112.27,51406956313.0,3262656,Utilities
AME,AMETEK Inc.,223.17,51151233956.0,1046818,Industrials
NDAQ,Nasdaq Inc. Common Stock,90.41,51130543547.0,1980852,Finance
ALAB,Astera Labs Inc. Common Stock,297.84,51052140552.0,7004354,Technology
COIN,Coinbase Global Inc. Class A Common Stock,193.56,50985855226.0,5674280,Finance
HBANL,Huntington Bancshares Incorporated Depositary Shares Each Representing a 1/40th Interest in a Share of 6.875% Series J Non-Cumulative Perpetual Preferred Stock,25.03,50739078593.0,17335,Finance
ADSK,Autodesk Inc. Common Stock,240.19,50714977838.0,1992732,Technology
EA,Electronic Arts Inc. Common Stock,201.87,50619202075.0,1331369,Consumer Discretionary
LNG,Cheniere Energy Inc. Common Stock,240.45,50386746661.0,2047574,Utilities
VST,Vistra Corp. Common Stock,149.08,50267162329.0,4621401,Utilities
XEL,Xcel Energy Inc. Common Stock,80.2,50066418712.0,6243272,Utilities
FAST,Fastenal Company Common Stock,43.53,49973966205.0,8230103,Consumer Discretionary
DAL,Delta Air Lines Inc. Common Stock,75.65,49701621821.0,8298232,Consumer Discretionary
MCHP,Microchip Technology Incorporated Common Stock,91.11,49302851578.0,8596078,Technology
ROK,Rockwell Automation Inc. Common Stock,440.25,48988357808.0,521539,Industrials
MDLN,Medline Inc. Class A Common Stock,37.1,48737830884.0,16483201,Health Care
EW,Edwards Lifesciences Corporation Common Stock,83.2,47906560000.0,3727232,Health Care
CAH,Cardinal Health Inc. Common Stock,200.61,46984036572.0,2063241,Health Care
EXC,Exelon Corporation Common Stock,45.35,46402489240.0,7847190,Utilities
GFS,GlobalFoundries Inc. Ordinary Shares,81.35,45264543776.0,11010378,Technology
HPE,Hewlett Packard Enterprise Company Common Stock,33.97,45073233403.0,11649828,Technology
HBANM,Huntington Bancshares Incorporated Depositary Shares each representing a 1/1000th interest in a share of Huntington Series I Preferred Stock,22.06,44718500749.0,18284,Finance
FITB,Fifth Third Bancorp Common Stock,49.16,44554275700.0,4218805,Finance
TTWO,Take-Two Interactive Software Inc. Common Stock,238.08,44086572564.0,4202812,Consumer Discretionary
PCG,Pacific Gas & Electric Co. Common Stock,16.44,44058679148.0,14679210,Utilities
IDXX,IDEXX Laboratories Inc. Common Stock,553.07,43627819151.0,430734,Health Care
WAB,Westinghouse Air Brake Technologies Corporation Common Stock,255.16,43294871605.0,1013291,Industrials
ODFL,Old Dominion Freight Line Inc. Common Stock,207.69,43192932696.0,1154276,Industrials
ON,ON Semiconductor Corporation Common Stock,109.61,42956508766.0,6802543,Technology
VTR,Ventas Inc. Common Stock,88.0,42782935624.0,5385443,Real Estate
STT,State Street Corporation Common Stock,153.69,42536325302.0,1572146,Finance
YUM,Yum! Brands Inc.,154.32,42533863893.0,1891458,Consumer Discretionary
MSCI,MSCI Inc. Common Stock,582.34,42394352000.0,446406,Consumer Discretionary
CMG,Chipotle Mexican Grill Inc. Common Stock,32.8,42073675200.0,17572976,Consumer Discretionary
HEI,Heico Corporation Common Stock,301.2,42022941779.0,626928,Industrials
MCHPP,Microchip Technology Incorporated Depositary Shares Each Representing a 1/20th Interest in a Share of 7.50% Series A Mandatory Convertible Preferred Stock,77.59,41986700186.0,28885,Technology
AIG,American International Group Inc. New Common Stock,78.62,41684813095.0,4013690,Finance
HBANZ,Huntington Bancshares Incorporated Depositary Shares Each Representing a 1/1000th Interest in a Share of 5.50% Series L Non-Cumulative Perpetual Preferred Stock,20.45,41454820504.0,7570,Finance
KR,Kroger Company (The) Common Stock,67.07,41089359563.0,7865666,Consumer Staples
ARES,Ares Management Corporation Class A Common Stock,123.99,40897807148.0,1558648,Finance
DHI,D.R. Horton Inc. Common Stock,144.14,40875165418.0,2376260,Consumer Discretionary
XYZ,Block Inc. Class A Common Stock,68.65,40859175650.0,8496799,Technology
AMP,Ameriprise Financial Inc. Common Stock,450.57,40504929138.0,796144,Finance
BDX,Becton Dickinson and Company Common Stock,146.25,40297787449.0,1986179,Health Care
CCI,Crown Castle Inc. Common Stock,92.04,40171040515.0,2863110,Real Estate
ALNY,Alnylam Pharmaceuticals Inc. Common Stock,300.51,40121863312.0,650366,Health Care
ED,Consolidated Edison Inc. Common Stock,107.4,39580090317.0,1732020,Utilities
RKT,Rocket Companies Inc. Class A Common Stock,13.87,39244190244.0,24249108,Finance
KDP,Keurig Dr Pepper Inc. Common Stock,28.78,39156901575.0,9058627,Consumer Staples
PEG,Public Service Enterprise Group Incorporated Common Stock,78.48,39108263629.0,2150807,Utilities
LYV,Live Nation Entertainment Inc. Common Stock,165.98,39096101849.0,2203491,Consumer Discretionary
PYPL,PayPal Holdings Inc. Common Stock,44.3,39077273340.0,10925182,Industrials
HSY,The Hershey Company Common Stock,190.39,38619349595.0,1572397,Consumer Staples
CBRE,CBRE Group Inc Common Stock Class A,131.04,38370684512.0,2518638,Finance
IRM,Iron Mountain Incorporated (Delaware)Common Stock REIT,127.33,37883817632.0,1342616,Real Estate
BTSGU,BrightSpring Health Services Inc. Tangible Equity Unit,194.71,37757851275.0,103033,Health Care
EME,EMCOR Group Inc. Common Stock,849.2,37738684078.0,259335,Industrials
JBL,Jabil Inc. Common Stock,356.41,37602189507.0,1024401,Technology
VIK,Viking Holdings Ltd Ordinary Shares,83.9,37401448672.0,4190143,Consumer Discretionary
CCL,Carnival Corporation Ltd. Common Shares,26.18,37385454927.0,34181792,Consumer Discretionary
ASTS,AST SpaceMobile Inc. Class A Common Stock,96.23,37349227564.0,24819897,Consumer Discretionary
TRI,Thomson Reuters Corporation Common Shares,85.56,37321739243.0,1335132,Consumer Discretionary
HIG,The Hartford Insurance Group Inc. Common Stock,136.02,37287274136.0,1828860,Finance
SATS,EchoStar  Corporation Common Stock,128.44,37223644399.0,9041069,Consumer Discretionary
ADM,Archer-Daniels-Midland Company Common Stock,77.12,37168487362.0,3411779,Consumer Staples
SYY,Sysco Corporation Common Stock,77.0,36820060816.0,3771139,Consumer Discretionary
TKO,TKO Group Holdings Inc. Class A Common Stock,191.63,36625530569.0,1158974,Consumer Discretionary
WEC,WEC Energy Group Inc. Common Stock,112.11,36517105761.0,2456987,Utilities
PPLC,PPL Corporation Corporate Units,48.47,36466422046.0,102203,Utilities
HUM,Humana Inc. Common Stock,303.68,36460276320.0,939326,Health Care
PRU,Prudential Financial Inc. Common Stock,104.24,36171280000.0,1391319,Finance
EQT,EQT Corporation Common Stock,57.74,36115099720.0,5672376,Energy
CRDO,Credo Technology Group Holding Ltd Ordinary Shares,193.39,35670773897.0,6775176,Technology
UI,Ubiquiti Inc. Common Stock,586.31,35484703656.0,130126,Technology
STRF,Strategy Inc 10.00% Series A Perpetual Strife Preferred Stock,100.75,35307623104.0,53579,Technology
HAL,Halliburton Company Common Stock,41.96,35053288961.0,11767197,Energy
STRC,Strategy Inc Variable Rate Series A Perpetual Stretch Preferred Stock,99.32,34806482647.0,1971214,Technology
