symbol,name,price,marketCap,volume,industry
NWE,NorthWestern Energy Group Inc. Common Stock,67.34,4135149333.0,357371,Utilities
REGCO,Regency Centers Corporation 5.875% Series B Cumulative Redeemable Preferred Stock,22.59,4131733093.0,2010,Real Estate
OXLCO,Oxford Lane Capital Corp. Preferred Stock Shares 6.00% Series 2029,23.75,4123000000.0,388,Finance
CGON,CG Oncology Inc. Common stock,51.08,4120428423.0,757378,Health Care
MDU,MDU Resources Group Inc. Common Stock (Holding Company),20.12,4112182359.0,1846111,Industrials
RCC,Ready Capital Corporation 5.75% Senior Notes due 2026,25.012,4110153727.0,20661,Real Estate
HGTY,Hagerty Inc. Class A Common Stock,12.0,4104768588.0,101286,Finance
MMS,Maximus Inc. Common Stock,75.07,4094961600.0,1171045,Real Estate
PAGP,Plains GP Holdings L.P. Class A Units representing Limited Partner Interests,20.69,4094305286.0,2371779,Energy
FULT,Fulton Financial Corporation Common Stock,22.72,4087217285.0,1685228,Finance
KRC,Kilroy Realty Corporation Common Stock,34.54,4086278947.0,1451578,Real Estate
PBF,PBF Energy Inc. Class A Common Stock,35.26,4084782850.0,2168603,Energy
LBRT,Liberty Energy Inc. Class A common stock,25.17,4078836909.0,3556816,Energy
CNO,CNO Financial Group Inc. Common Stock,42.71,4072548498.0,952393,Finance
ACMR,ACM Research Inc. Class A Common Stock,62.64,4063860891.0,1136980,Technology
RSI,Rush Street Interactive Inc. Class A Common Stock,17.7,4060606064.0,2240706,Consumer Discretionary
RCB,Ready Capital Corporation 6.20% Senior Notes due 2026,24.6864,4056648768.0,2707,Real Estate
NHI,National Health Investors Inc. Common Stock,85.1,4054036520.0,233854,Real Estate
ZETA,Zeta Global Holdings Corp. Class A Common Stock,16.97,4036911029.0,6909471,Technology
TEX,Terex Corporation Common Stock,61.54,4036378630.0,2229198,Industrials
FTDR,Frontdoor Inc. Common Stock,55.72,4018147448.0,611063,Consumer Discretionary
BANF,BancFirst Corporation Common Stock,120.39,4013100967.0,78029,Finance
HGV,Hilton Grand Vacations Inc. Common Stock ,46.91,4012826493.0,606402,Consumer Discretionary
FIBK,First Interstate BancSystem Inc. Common Stock (DE),39.0,4012733946.0,981566,Finance
IRT,Independence Realty Trust Inc. Common Stock,16.77,4009924708.0,1623118,Real Estate
GPOR,Gulfport Energy Corporation Common Shares,207.24,4003217570.0,309519,Energy
AEO,American Eagle Outfitters Inc. Common Stock,23.56,3993702861.0,3475796,Consumer Discretionary
UNMA,Unum Group 6.250% Junior Subordinated Notes due 2058,23.37,3980220419.0,7672,Finance
KAI,Kadant Inc Common Stock,337.93,3980185161.0,95335,Industrials
AZZ,AZZ Inc.,133.27,3978864608.0,191925,Industrials
ACLX,Arcellx Inc. Common Stock,68.8,3978213525.0,639738,Health Care
DORM,Dorman Products Inc. Common Stock,130.05,3974671852.0,158909,Consumer Discretionary
JOE,St. Joe Company (The) Common Stock,68.69,3966471766.0,161237,Real Estate
LUNR,Intuitive Machines Inc. Class A Common Stock,19.45,3952435978.0,13395906,Industrials
PJT,PJT Partners Inc. Class A Common Stock,162.18,3942158076.0,386124,Finance
TERN,Terns Pharmaceuticals Inc. Common Stock,37.98,3940860631.0,1261884,Health Care
WSC,WillScot Holdings Corporation Class A Common Stock,21.64,3937304710.0,1198956,Industrials
FLY,Firefly Aerospace Inc. Common Stock,24.71,3935095225.0,2959035,Industrials
CALM,Cal-Maine Foods Inc. Common Stock,82.49,3930982255.0,1003769,Consumer Staples
ACAD,ACADIA Pharmaceuticals Inc. Common Stock,23.22,3928401791.0,1549531,Health Care
RNST,Renasant Corporation Common Stock,41.31,3925333290.0,574372,Finance
ENVA,Enova International Inc. Common Stock,158.74,3924814276.0,213920,Finance
GPK,Graphic Packaging Holding Company,13.28,3919234927.0,8620144,Consumer Discretionary
QLYS,Qualys Inc. Common Stock,109.15,3913934318.0,1153500,Technology
GRAL,GRAIL Inc. Common Stock ,100.4,3913815189.0,527103,Health Care
EXPO,Exponent Inc. Common Stock,78.34,3908165285.0,774055,Consumer Discretionary
ADMA,ADMA Biologics Inc Common Stock,16.37,3896023413.0,1101584,Health Care
CBT,Cabot Corporation Common Stock,74.59,3895209442.0,489556,Industrials
ASO,Academy Sports and Outdoors Inc. Common Stock,58.37,3892187481.0,843665,Consumer Discretionary
RH,RH Common Stock,206.95,3886044808.0,779963,Consumer Discretionary
PII,Polaris Inc. Common Stock,69.0,3881134977.0,581121,Consumer Discretionary
BKD,Brookdale Senior Living Inc. Common Stock,16.28,3869029782.0,6062442,Health Care
SMG,Scotts Miracle-Gro Company (The) Common Stock,66.62,3866608345.0,813938,Industrials
CVLT,Commvault Systems Inc. Common Stock,87.86,3863589642.0,687346,Technology
WK,Workiva Inc. Class A Common Stock,68.74,3858242088.0,902049,Technology
WSFS,WSFS Financial Corporation Common Stock,70.46,3852467367.0,844611,Finance
SKT,Tanger Inc. Common Stock,33.63,3850971435.0,823324,Real Estate
KBH,KB Home Common Stock,60.48,3820739993.0,594120,Consumer Discretionary
EOSE,Eos Energy Enterprises Inc. Class A Common Stock,13.24,3816331124.0,20232171,Miscellaneous
BKU,BankUnited Inc. Common Stock,50.6,3802214093.0,749773,Finance
UPST,Upstart Holdings Inc. Common stock,38.85,3779579903.0,3526706,Finance
USAC,USA Compression Partners LP Common Units Representing Limited Partner Interests,26.72,3767131785.0,442160,Utilities
ASBA,Associated Banc-Corp 6.625% Fixed-Rate Reset Subordinated Notes due 2033,24.96,3766484342.0,10624,Finance
FG,F&G Annuities & Life Inc. Common Stock,27.87,3751846496.0,363926,Finance
DAN,Dana Incorporated Common Stock ,32.1,3750479449.0,1065639,Consumer Discretionary
ICUI,ICU Medical Inc. Common Stock,151.86,3748916188.0,242428,Health Care
CORZW,Core Scientific Inc. Tranche 1 Warrants,12.09,3748641117.0,255564,Finance
LCII,LCI Industries,154.37,3735446804.0,210137,Consumer Discretionary
APAM,Artisan Partners Asset Management Inc. Class A Common Stock,46.23,3730630400.0,504968,Finance
LRN,Stride Inc. Common Stock,87.51,3726201178.0,1505615,Real Estate
FSK,FS KKR Capital Corp. Common Stock,13.3,3724883559.0,2800503,Finance
MHO,M/I Homes Inc. Common Stock,141.77,3707074121.0,250138,Consumer Discretionary
NTRSO,Northern Trust Corporation Depositary Shares Each Representing a 1/1000th Interest in a Share of Series E Non-Cumulative Perpetual Preferred Stock,19.6,3706700432.0,35337,Finance
SOUN,SoundHound AI Inc Class A Common Stock,8.81,3701044535.0,24453488,Technology
XMTR,Xometry Inc. Class A Common Stock,72.1,3694955998.0,1563548,Real Estate
KTB,Kontoor Brands Inc. Common Stock ,66.45,3694195517.0,450962,Industrials
CATY,Cathay General Bancorp Common Stock,54.22,3688945211.0,342490,Finance
LQDA,Liquidia Corporation Common Stock,42.4,3688608479.0,1029911,Health Care
CALX,Calix Inc Common Stock,55.57,3682983605.0,2548534,Consumer Discretionary
LGND,Ligand Pharmaceuticals Incorporated Common Stock,186.93,3679103920.0,250106,Health Care
ERAS,Erasca Inc. Common Stock,12.01,3677603778.0,2712190,Health Care
BNL,Broadstone Net Lease Inc. Common Stock,19.35,3661330316.0,1446328,Real Estate
DTG,DTE Energy Company 2021 Series E 4.375% Junior Subordinated Debentures,17.55,3644836861.0,30246,Utilities
BHF,Brighthouse Financial Inc. Common Stock,63.7,3641806523.0,420790,Finance
COLD,Americold Realty Trust Inc. Common Stock,12.75,3631894607.0,4571866,Real Estate
YETI,YETI Holdings Inc. Common Stock,46.67,3631304634.0,1207083,Consumer Discretionary
WSBC,WesBanco Inc. Common Stock,37.78,3628593210.0,350350,Finance
SEI,Solaris Energy Infrastructure Inc. Class A Common Stock,52.96,3625512166.0,2054165,Consumer Discretionary
RYN,Rayonier Inc. REIT Common Stock,22.4,3615933798.0,2518312,Real Estate
OTTR,Otter Tail Corporation Common Stock,86.27,3615189210.0,253895,Utilities
DTB,DTE Energy Company 2020 Series G 4.375% Junior Subordinated Debentures due 2080,17.4,3613684409.0,11071,Utilities
AB,AllianceBernstein Holding L.P.  Units,39.71,3613341997.0,795044,Finance
UNF,Unifirst Corporation Common Stock,199.84,3611614995.0,187138,Consumer Discretionary
CDP,COPT Defense Properties Common Shares of Beneficial Interest,31.87,3608021631.0,1349766,Real Estate
HAYW,Hayward Holdings Inc. Common Stock,16.62,3604267032.0,1744391,Industrials
LCID,Lucid Group Inc. Common Stock,11.09,3595028188.0,5282234,Industrials
CCC,CCC Intelligent Solutions Holdings Inc. Common Stock,5.58,3582469680.0,20234822,Technology
AVNT,Avient Corporation Common Stock,39.01,3571897128.0,552947,Industrials
FLNC,Fluence Energy Inc. Class A Common Stock,19.4,3568344296.0,7055631,Miscellaneous
HP,Helmerich & Payne Inc. Common Stock,35.71,3565625216.0,1977252,Energy
BFH,Bread Financial Holdings Inc. Common Stock,77.9,3557038718.0,575873,Real Estate
GNW,Genworth Financial Inc Common Stock,8.88,3546499435.0,3661366,Finance
FUL,H. B. Fuller Company Common Stock,65.56,3546067563.0,284720,Industrials
ATGE,Adtalem Global Education Inc. Common Stock,102.62,3541264630.0,379574,Real Estate
QTWO,Q2 Holdings Inc. Common Stock,56.44,3529193482.0,657300,Technology
CBU,Community Financial System Inc. Common Stock,66.77,3516207621.0,230619,Finance
BOX,Box Inc. Class A Common Stock,24.52,3511946097.0,2074499,Technology
NAN,Nuveen New York Quality Municipal Income Fund Common Stock,11.54,3488724332.0,146912,Finance
KFY,Korn Ferry Common Stock,66.62,3477227169.0,426769,Consumer Discretionary
MCHB,Mechanics Bancorp Class A Common Stock,15.66,3464205759.0,436315,Finance
LBRDP,Liberty Broadband Corporation Series A Cumulative Redeemable Preferred Stock,24.1082,3459471974.0,3021,Telecommunications
CII,BlackRock Enhanced Large Cap Core Fund Inc. Common Stock,23.18,3448314078.0,100017,Finance
GEF,Greif Inc. Class A Common Stock,74.22,3435348033.0,235109,
BSM,Black Stone Minerals L.P. Common units representing limited partner interests,15.13,3428059037.0,382725,Energy
BULL,Webull Corporation Class A Ordinary Shares,6.79,3414838961.0,9730419,Finance
FRPT,Freshpet Inc. Common Stock,69.92,3412678923.0,971867,Consumer Staples
SBCF,Seacoast Banking Corporation of Florida Common Stock,34.76,3400506459.0,818285,Finance
COLM,Columbia Sportswear Company Common Stock,62.83,3385839084.0,1312024,Consumer Discretionary
SYNA,Synaptics Incorporated Common Stock $0.001 Par Value,87.36,3383430174.0,729200,Technology
CRGY,Crescent Energy Company Class A Common Stock,10.3,3382332818.0,3777988,Energy
VERA,Vera Therapeutics Inc. Class A Common Stock,43.85,3380474421.0,532564,Health Care
DX,Dynex Capital Inc. Common Stock,13.92,3370993858.0,6726305,Real Estate
FHB,First Hawaiian Inc. Common Stock,27.2,3365172712.0,1359230,Finance
PI,Impinj Inc. Common Stock,111.75,3364695501.0,1538740,Technology
KNSA,Kiniksa Pharmaceuticals International plc Class A Ordinary Shares,44.35,3361541912.0,403774,Health Care
PLMR,Palomar Holdings Inc. Common stock,126.54,3353524106.0,406282,Finance
SPHR,Sphere Entertainment Co. Class A Common Stock,94.92,3352029654.0,522103,Consumer Discretionary
TDW,Tidewater Inc. Common Stock,67.61,3350965045.0,669295,Consumer Discretionary
OSCR,Oscar Health Inc. Class A Common Stock,12.66,3350899440.0,15433736,Health Care
FULTP,Fulton Financial Corporation Depositary Shares Each Representing a 1/40th Interest in a Share of Fixed Rate Non-Cumulative Perpetual Preferred Stock Series A,18.5851,3343368925.0,16804,Finance
TGNA,TEGNA Inc,20.74,3340317804.0,7421965,Industrials
AVA,Avista Corporation Common Stock,40.99,3335427705.0,620792,Utilities
UAA,Under Armour Inc. Class A Common Stock,7.86,3331770385.0,17580003,Consumer Discretionary
COCO,The Vita Coco Company Inc. Common Stock,58.41,3326347750.0,550648,Consumer Staples
GBDC,Golub Capital BDC Inc. Common Stock,12.62,3321939644.0,2348054,Finance
AAP,Advance Auto Parts Inc.,55.3,3319230149.0,1805711,Consumer Discretionary
VKTX,Viking Therapeutics Inc. Common Stock,29.3,3311964879.0,2669525,Health Care
OII,Oceaneering International Inc. Common Stock,33.16,3308545997.0,1407748,Energy
PTEN,Patterson-UTI Energy Inc. Common Stock,8.7,3299405609.0,8905566,Energy
BCC,Boise Cascade L.L.C. Common Stock,89.02,3297574358.0,324111,Consumer Discretionary
ARQT,Arcutis Biotherapeutics Inc. Common Stock,26.88,3292590121.0,883714,Health Care
FIZZ,National Beverage Corp. Common Stock,35.14,3290232064.0,168825,Consumer Staples
RWTN,Redwood Trust Inc. 9.125% Senior Notes Due 2029,25.45,3288737159.0,1815,Real Estate
MPT,Medical Properties Trust Inc. common stock,5.46,3284190000.0,4109573,Real Estate
CNS,Cohen & Steers Inc Common Stock,64.3,3279784886.0,288315,Finance
FBK,FB Financial Corporation Common Stock,61.31,3277784771.0,195224,Finance
BXMT,Blackstone Mortgage Trust Inc. Common Stock,19.51,3272290011.0,1047314,Real Estate
AAOI,Applied Optoelectronics Inc. Common Stock,47.91,3271218958.0,5954420,Technology
RWTO,Redwood Trust Inc. 9.00% Senior Notes Due 2029,25.29,3268061405.0,4671,Real Estate
FGN,F&G Annuities & Life Inc. 7.950% Senior Notes due 2053,25.9,3265952393.0,19358,Finance
GRBK,Green Brick Partners Inc. Common Stock,74.77,3257362377.0,146014,Consumer Discretionary
UA,Under Armour Inc. Class C Common Stock,7.66,3246992513.0,5775317,Consumer Discretionary
DNLI,Denali Therapeutics Inc. Common Stock,20.84,3246217186.0,1250555,Health Care
HYMC,Hycroft Mining Holding Corporation Class A Common Stock,38.76,3218063884.0,3541313,Basic Materials
IPAR,Interparfums Inc. Common Stock,100.05,3208076036.0,279214,Consumer Discretionary
EWTX,Edgewise Therapeutics Inc. Common Stock,30.25,3202520129.0,909304,Health Care
WDFC,WD-40 Company Common Stock,237.26,3199760013.0,196911,Industrials
BANC,Banc of California Inc. Common Stock,21.0,3177377469.0,2742356,Finance
WU,Western Union Company (The) Common Stock,9.98,3172092152.0,10942318,Real Estate
CAKE,Cheesecake Factory Incorporated (The) Common Stock,63.49,3164448898.0,1092340,Consumer Discretionary
CXT,Crane NXT Co. Common Stock,55.0,3158212145.0,913343,Industrials
LEGN,Legend Biotech Corporation American Depositary Shares,17.19,3156929026.0,4598562,Health Care
DJT,Trump Media & Technology Group Corp. Common Stock,11.27,3155573358.0,2862338,Technology
SFNC,Simmons First National Corporation Class A Common Stock,21.76,3149054998.0,1118112,Finance
BOH,Bank of Hawaii Corporation Common Stock,79.12,3147796479.0,540465,Finance
OPLN,OPENLANE Inc. Common Stock,29.59,3144327703.0,571348,Consumer Discretionary
SXI,Standex International Corporation Common Stock,259.1,3139963720.0,169385,Industrials
ARLP,Alliance Resource Partners L.P. Common Units representing Limited Partners Interests,24.42,3136212346.0,387315,Energy
NMRK,Newmark Group Inc. Class A Common Stock,17.29,3119330517.0,1248966,Finance
PAY,Paymentus Holdings Inc. Class A Common Stock,24.83,3114389829.0,584494,Real Estate
KMT,Kennametal Inc. Common Stock,40.71,3102052822.0,2515374,Industrials
PBH,Prestige Consumer Healthcare Inc. Common Stock,65.35,3092279006.0,364134,Health Care
PFS,Provident Financial Services Inc Common Stock,23.65,3089219382.0,541596,Finance
USLM,United States Lime & Minerals Inc. Common Stock,107.77,3086468030.0,108327,Industrials
NMIH,NMI Holdings Inc. Common Stock,39.94,3070105044.0,833864,Finance
FFBC,First Financial Bancorp. Common Stock,31.16,3069936982.0,847727,Finance
CSQ,Calamos Strategic Total Return Common Stock,19.31,3068119981.0,205717,Finance
EEFT,Euronet Worldwide Inc. Common Stock,72.79,3060432330.0,736552,Finance
SLG,SL Green Realty Corp Common Stock,43.04,3056954133.0,888841,Real Estate
HTGC,Hercules Capital Inc. Common Stock,16.8,3052863660.0,2787420,Finance
CPK,Chesapeake Utilities Corporation Common Stock,128.99,3050701729.0,90218,Utilities
PVH,PVH Corp. Common Stock,66.58,3049543500.0,944184,Industrials
MARA,MARA Holdings Inc. Common Stock,8.06,3048165885.0,67582694,Technology
LXP,LXP Industrial Trust Common Stock (Maryland REIT),51.32,3036031925.0,416260,Real Estate
CNK,Cinemark Holdings Inc Cinemark Holdings Inc. Common Stock,25.82,3033227790.0,2120365,Consumer Discretionary
INSW,International Seaways Inc. Common Stock ,61.02,3014636840.0,367238,Consumer Discretionary
TPH,Tri Pointe Homes Inc. Common Stock,35.06,3013529605.0,825974,Consumer Discretionary
GT,The Goodyear Tire & Rubber Company Common Stock,10.52,3010412763.0,11432966,Consumer Discretionary
VRNS,Varonis Systems Inc. Common Stock,25.61,3007836263.0,8125417,Technology
CPRX,Catalyst Pharmaceuticals Inc. Common Stock,24.45,3005207862.0,973046,Health Care
ITGR,Integer Holdings Corporation Common Stock,85.46,2994383886.0,694152,Health Care
LASR,nLIGHT Inc. Common Stock,54.59,2989428484.0,1428800,Technology
NATL,NCR Atleos Corporation Common Stock,40.14,2966512019.0,287652,Miscellaneous
CON,Concentra Group Holdings Parent Inc. Common Stock,23.14,2965858474.0,703035,Health Care
KWR,Quaker Houghton Common Stock,170.97,2964625784.0,122105,Industrials
VRRM,Verra Mobility Corporation Class A Common Stock,18.55,2959920492.0,1346025,Consumer Discretionary
BKV,BKV Corporation Common Stock,30.44,2951838182.0,644269,Energy
WRBY,Warby Parker Inc. Class A Common Stock,24.14,2949058586.0,3085519,Health Care
RHI,Robert Half Inc. Common Stock,29.12,2946547706.0,2826219,Consumer Discretionary
SUPN,Supernus Pharmaceuticals Inc. Common Stock,51.3,2941508655.0,654417,Health Care
HWKN,Hawkins Inc. Common Stock,140.71,2941133506.0,83366,Consumer Discretionary
ZIONP,Zions Bancorporation N.A. Depositary Shares (Each representing 1/40th Interest in a Share of Series A Floating-Rate Non-Cumulative Perpetual Preferred Stock),19.8999,2938041812.0,5125,Finance
PLUG,Plug Power Inc. Common Stock,2.1,2925077121.0,87454696,Energy
TWST,Twist Bioscience Corporation Common Stock,47.47,2910466589.0,1071288,Health Care
VCYT,Veracyte Inc. Common Stock,36.73,2903476124.0,766321,Health Care
BELFB,Bel Fuse Inc. Class B Common Stock,229.32,2903320307.0,112516,
CVBF,CVB Financial Corporation Common Stock,21.22,2903088423.0,1006147,Finance
HE,Hawaiian Electric Industries Inc. Common Stock,16.8,2900023997.0,1955644,Utilities
WOR,Worthington Enterprises Inc. Common Shares,58.47,2896988591.0,141060,Industrials
APLS,Apellis Pharmaceuticals Inc. Common Stock,22.83,2888570727.0,3236736,Health Care
APLE,Apple Hospitality REIT Inc. Common Shares,12.2,2886223442.0,1464358,Real Estate
BRSL,Brightstar Lottery PLC Trading under the Legal Name to begin at the market open on July 21 2025. Ordinary Shares,14.27,2882991431.0,1551890,Consumer Discretionary
MGRC,McGrath RentCorp Common Stock,116.93,2877841053.0,214475,Consumer Discretionary
MGEE,MGE Energy Inc,78.73,2876939772.0,110970,Energy
GBTG,Global Business Travel Group Inc. Class A Common Stock,5.49,2874158470.0,1732250,Consumer Discretionary
POWWP,Outdoor Holding Company 8.75% Series A Cumulative Redeemable Perpetual Preferred Stock,24.49,2868044153.0,24047,Industrials
MSGE,Madison Square Garden Entertainment Corp. Class A Common Stock,60.7,2866964615.0,388124,Consumer Discretionary
NSIT,Insight Enterprises Inc. Common Stock,92.27,2858487415.0,438019,Consumer Discretionary
PHIN,PHINIA Inc. Common Stock,74.21,2852830838.0,388742,Consumer Discretionary
ASH,Ashland Inc. Common Stock,62.24,2848251216.0,501266,Consumer Discretionary
SPSC,SPS Commerce Inc. Common Stock,75.48,2846282415.0,801043,Technology
PRK,Park National Corporation Common Stock,176.92,2844566113.0,58990,Finance
IDYA,IDEAYA Biosciences Inc. Common Stock,32.39,2839514955.0,630071,Health Care
CC,Chemours Company (The) Common Stock,18.93,2837454651.0,2897661,Industrials
TR,Tootsie Roll Industries Inc. Common Stock,38.86,2836260442.0,116941,Consumer Staples
HIW,Highwoods Properties Inc. Common Stock,25.8,2835263704.0,991558,Real Estate
DIOD,Diodes Incorporated Common Stock,61.11,2834607577.0,278165,Technology
IAC,IAC Inc. Common Stock,36.52,2827854767.0,1369872,Technology
DKL,Delek Logistics Partners L.P. Common Units representing Limited Partner Interests,52.87,2827508801.0,66987,Energy
VRDN,Viridian Therapeutics Inc. Common Stock,29.6,2825083437.0,1152411,Health Care
ABM,ABM Industries Incorporated Common Stock,46.77,2814507521.0,400453,Consumer Discretionary
DBRG,DigitalBridge Group Inc.,15.4,2813186145.0,3042585,Real Estate
RELY,Remitly Global Inc. Common Stock,13.45,2811667772.0,2785675,Real Estate
AMBA,Ambarella Inc. Ordinary Shares,65.25,2809044212.0,653887,Technology
OLN,Olin Corporation Common Stock,24.56,2802824752.0,2837429,Industrials
TARS,Tarsus Pharmaceuticals Inc. Common Stock,65.5,2780416378.0,664886,Health Care
IRON,Disc Medicine Inc. Common Stock,73.54,2776146913.0,532132,Health Care
ATRO,Astronics Corporation Common Stock,77.72,2769095284.0,586995,Industrials
BATRA,Atlanta Braves Holdings Inc. Series A Common Stock,44.0,2768626080.0,52180,Consumer Discretionary
BEAM,Beam Therapeutics Inc. Common Stock,27.28,2768236472.0,1077325,Health Care
TOWN,TowneBank Common Stock,36.99,2760095037.0,569557,Finance
FTAIM,FTAI Aviation Ltd. 9.500% Fixed-Rate Reset Series D Cumulative Perpetual Redeemable Preferred Shares,26.891,2758288526.0,1712,Industrials
DRVN,Driven Brands Holdings Inc. Common Stock,16.77,2757897236.0,1159666,Consumer Discretionary
AKR,Acadia Realty Trust Common Stock,21.0,2751727104.0,1082811,Real Estate
DYN,Dyne Therapeutics Inc. Common Stock,16.99,2745477405.0,1860479,Health Care
CALY,Callaway Golf Company Common Stock,14.92,2743543864.0,1838389,Consumer Discretionary
XRAY,DENTSPLY SIRONA Inc. Common Stock,13.7,2733861975.0,4956490,Health Care
ALMS,Alumis Inc. Common Stock,26.12,2726755686.0,1168553,Health Care
TBBK,The Bancorp Inc Common Stock,62.05,2725088755.0,591100,Finance
CHEF,The Chefs' Warehouse Inc. Common Stock,66.89,2721456373.0,309973,Consumer Discretionary
CARG,CarGurus Inc. Class A Common Stock ,28.51,2721370846.0,938212,Technology
RUM,Rumble Inc. Class A Common Stock,6.25,2717890144.0,3188858,Technology
AWR,American States Water Company Common Stock,70.1,2713881263.0,261163,Utilities
NAVN,Navan Inc. Class A Common Stock,10.89,2707733868.0,2643234,Technology
CURB,Curbline Properties Corp. Common Stock,25.66,2703745959.0,934905,Finance
IMNM,Immunome Inc. Common Stock,24.5,2703132726.0,856940,Health Care
VC,Visteon Corporation Common Stock,99.06,2702943433.0,492582,Consumer Discretionary
TVTX,Travere Therapeutics Inc. Common Stock,30.07,2690432873.0,806215,Health Care
HAE,Haemonetics Corporation Common Stock,57.69,2680932182.0,1491994,Health Care
NMFCZ,New Mountain Finance Corporation 8.250% Notes due 2028,25.18,2678168998.0,3519,
FCPT,Four Corners Property Trust Inc. Common Stock,25.24,2677510008.0,380412,Real Estate
BKE,Buckle Inc. (The) Common Stock,52.32,2676514672.0,392384,Consumer Discretionary
BELFA,Bel Fuse Inc. Class A Common Stock,211.24,2674417328.0,37794,
TRMK,Trustmark Corporation Common Stock,44.42,2663345687.0,260539,Finance
PRVA,Privia Health Group Inc. Common Stock,21.63,2660523072.0,534671,Health Care
HURN,Huron Consulting Group Inc. Common Stock,154.06,2656220560.0,413902,Consumer Discretionary
SHOO,Steven Madden Ltd. Common Stock,36.53,2654194439.0,2513632,Consumer Discretionary
BBT,Beacon Financial Corporation Common stock,31.61,2652359096.0,825103,Finance
LFST,LifeStance Health Group Inc. Common Stock,6.81,2649091914.0,1496279,Health Care
GLOB,Globant S.A. Common Shares,60.14,2648899858.0,1315964,Technology
CTRI,Centuri Holdings Inc. Common Stock,29.88,2648836722.0,1320438,Utilities
VSH,Vishay Intertechnology Inc. Common Stock,19.48,2641261935.0,2530216,Technology
WGS,GeneDx Holdings Corp. Class A Common Stock,91.24,2637254792.0,745341,Technology
TDC,Teradata Corporation Common Stock,28.29,2636628000.0,1422077,Technology
SYRE,Spyre Therapeutics Inc. Common Stock,33.96,2635028735.0,679524,Health Care
GDV,Gabelli Dividend & Income Trust Common Shares of Beneficial Interest,29.21,2634405822.0,244085,Finance
RXO,RXO Inc. Common Stock,16.05,2633995546.0,3654059,Consumer Discretionary
CECO,CECO Environmental Corp. Common Stock,73.78,2629595267.0,213499,Industrials
SAM,Boston Beer Company Inc. (The) Common Stock,246.71,2629525969.0,155756,Consumer Staples
NGVT,Ingevity Corporation Common Stock ,73.09,2628611099.0,239783,Industrials
UE,Urban Edge Properties Common Shares of Beneficial Interest,20.86,2625307640.0,883921,Finance
ACLS,Axcelis Technologies Inc. Common Stock,85.47,2623860709.0,635773,Technology
CWT,California Water Service Group Common Stock,43.99,2621423091.0,295757,Utilities
FTAIN,FTAI Aviation Ltd. 8.25% Fixed - Rate Reset Series C Cumulative Perpetual Redeemable Preferred Shares,25.55,2620738234.0,9978,Industrials
AMR,Alpha Metallurgical Resources Inc. Common Stock,203.46,2616093563.0,233498,Energy
TENB,Tenable Holdings Inc. Common Stock,21.87,2610059097.0,3636160,Technology
CLSK,CleanSpark Inc. Common Stock,10.19,2606122183.0,38242750,Finance
MFAO,MFA Financial Inc. 9.000% Senior Notes due 2029,25.2711,2594551035.0,3626,Real Estate
MFAN,MFA Financial Inc. 8.875% Senior Notes due 2029,25.18,2585197916.0,4896,Real Estate
HUBG,Hub Group Inc. Class A Common Stock,42.17,2578843517.0,1581178,Industrials
CUBI,Customers Bancorp Inc Common Stock,75.47,2578664771.0,332203,Finance
FBNC,First Bancorp Common Stock,61.76,2560898719.0,175361,Finance
BL,BlackLine Inc. Common Stock,43.02,2559116457.0,1179895,Technology
MTRN,Materion Corporation,150.26,2551095197.0,106609,Industrials
DBD,Diebold Nixdorf Incorporated Common stock,70.97,2545492061.0,231639,Miscellaneous
TNET,TriNet Group Inc. Common Stock,52.9,2540806097.0,409810,Real Estate
WAFD,WaFd Inc. Common Stock,33.42,2535352622.0,466353,Finance
POWI,Power Integrations Inc. Common Stock,45.79,2533842858.0,1108097,Technology
HNGE,Hinge Health Inc. Class A Common Stock,32.16,2531616354.0,1065755,Technology
NSA,National Storage Affiliates Trust Common Shares of Beneficial Interest,32.86,2528930804.0,843012,Real Estate
NOG,Northern Oil and Gas Inc. Common Stock,25.88,2525965071.0,1518743,Energy
ALG,Alamo Group Inc. Common Stock,208.3,2523643652.0,92898,Industrials
BWIN,The Baldwin Insurance Group Inc. Class A Common Stock,17.69,2522294791.0,1876561,Finance
OI,O-I Glass Inc. Common Stock,16.42,2522021854.0,1545699,Consumer Discretionary
NHC,National HealthCare Corporation Common Stock,162.55,2522004375.0,52113,Health Care
MLYS,Mineralys Therapeutics Inc. Common Stock,31.74,2511902203.0,1308882,Health Care
