symbol,name,price,marketCap,volume,industry
EVER,EverQuote Inc. Class A Common Stock,18.63,659004169.0,450704,Technology
CTGO,Contango Silver & Gold Inc. Common Stock,21.4,658503915.0,271474,Basic Materials
PKE,Park Aerospace Corp. Common Stock,32.99,657352076.0,243615,Industrials
SIBN,SI-BONE Inc. Common Stock,14.81,656812881.0,770984,Health Care
BZH,Beazer Homes USA Inc. Common Stock,24.01,656285138.0,645169,Consumer Discretionary
PSTL,Postal Realty Trust Inc. Class A Common Stock,23.7,654685435.0,332855,Real Estate
GAIN,Gladstone Investment Corporation Business Development Company,16.44,654673137.0,207170,Finance
WTI,W&T Offshore Inc. Common Stock,4.39,653134094.0,6019728,Energy
SMC,Summit Midstream Corporation Common Stock,32.04,651653646.0,76044,Utilities
ASPI,ASP Isotopes Inc. Common Stock,5.17,650920821.0,5079408,Industrials
DGICA,Donegal Group Inc. Class A Common Stock,17.56,650591029.0,110477,Finance
RILYT,BRC Group Holdings Inc. 6.00% Senior Notes Due 2028,21.28,648977564.0,29302,Finance
CWBC,Community West Bancshares Common Stock,23.74,644166050.0,172869,Finance
TRTX,TPG RE Finance Trust Inc. Common Stock,8.3,641658135.0,510778,Real Estate
DJCO,Daily Journal Corp. (S.C.) Common Stock,465.41,641205596.0,54145,Consumer Discretionary
NCDL,Nuveen Churchill Direct Lending Corp. Common Stock,12.98,641044104.0,142627,Uncategorized
VMO,Invesco Municipal Opportunity Trust Common Stock,9.5,640686508.0,213676,Finance
SLDB,Solid Biosciences Inc. Common Stock,6.5,639922439.0,742813,Health Care
RILYL,BRC Group Holdings Inc. Depositary Shares each representing 1/1000th in a share of 7.375% Series B Cumulative Perpetual Preferred Stock par value $0.0001,17.22,639388794.0,4688,Finance
METCB,Ramaco Resources Inc. Class B Common Stock,9.78,637410160.0,26405,Energy
TIPT,Tiptree Inc. Common Stock,16.96,637188472.0,138259,Finance
TLRY,Tilray Brands Inc. Common Stock ,5.46,636213396.0,2458877,Health Care
RILYP,BRC Group Holdings Inc. Depositary Shares each representing a 1/1000th fractional interest in a share of Series A Cumulative Perpetual Preferred Stock,17.11,635304429.0,13204,Finance
MNTN,MNTN Inc. Class A Common Stock,8.14,635067831.0,719439,Consumer Discretionary
ACRS,Aclaris Therapeutics Inc. Common Stock,4.54,634073107.0,480847,Health Care
IRWD,Ironwood Pharmaceuticals Inc. Class A Common Stock,3.85,633761613.0,2077152,Health Care
CRMD,CorMedix Inc. Common Stock,8.06,632322241.0,1386630,Health Care
BHFAM,Brighthouse Financial Inc. Depositary shares each representing a 1/1000th Interest in a Share of 4.625% Non-Cumulative Preferred Stock Series D,10.99,631329177.0,60003,Finance
GEMI,Gemini Space Station Inc. Class A Common Stock,5.29,631043746.0,1644490,Finance
TCBX,Third Coast Bancshares Inc. Common Stock,37.92,629171332.0,73163,Finance
BSTZ,BlackRock Science and Technology Term Trust Common Shares of Beneficial Interest,28.38,628839215.0,144712,Finance
BH,Biglari Holdings Inc. Class B Common Stock,273.95,628527868.0,54950,Consumer Discretionary
RGR,Sturm Ruger & Company Inc. Common Stock,39.34,627246913.0,98945,Industrials
CLYM,Climb Bio Inc. Common Stock,10.91,624712306.0,604122,Health Care
RMR,The RMR Group Inc. Class A Common Stock,20.08,624355090.0,142846,Consumer Discretionary
GOOD,Gladstone Commercial Corporation Real Estate Investment Trust,12.89,623966140.0,498026,Real Estate
CSTL,Castle Biosciences Inc. Common Stock,20.54,622977214.0,327295,Health Care
KELYB,Kelly Services Inc. Class B Common Stock,17.96,622658652.0,1035,Consumer Discretionary
ELA,Envela Corporation Common Stock,23.97,622344520.0,67388,Consumer Discretionary
ZVRA,Zevra Therapeutics Inc. Common Stock,10.49,620117231.0,2441562,Health Care
RMT,Royce Micro-Cap Trust Inc. Common Stock,13.33,616767196.0,49664,Finance
SABR,Sabre Corporation Common Stock,1.56,616688706.0,4405219,Technology
WASH,Washington Trust Bancorp Inc. Common Stock,32.33,616390622.0,208919,Finance
EGY,VAALCO Energy Inc.  Common Stock,5.87,611995945.0,1481428,Energy
HPP,Hudson Pacific Properties Inc. Common Stock,11.28,611850031.0,1110486,Finance
MOV,Movado Group Inc. Common Stock,27.5,611248908.0,178079,Consumer Discretionary
INN,Summit Hotel Properties Inc. Common Stock,5.64,611179040.0,716354,Real Estate
BCAL,California BanCorp Common Stock,19.0,611131656.0,145480,Finance
NPB,Northpointe Bancshares Inc. Common Stock,17.62,609332056.0,169174,Finance
HIFS,Hingham Institution for Savings Common Stock,283.57,608938218.0,26905,Finance
AROW,Arrow Financial Corporation Common Stock,36.76,607606738.0,61988,Finance
AIV,Apartment Investment and Management Company Common Stock,4.22,607073092.0,576996,Real Estate
VELO,Velo3D Inc. Common stock,20.33,605854371.0,3917973,Technology
SWIM,Latham Group Inc. Common Stock,5.16,605843799.0,1122494,Industrials
RILYZ,BRC Group Holdings Inc. 5.25% Senior Notes due 2028,19.845,605214275.0,19868,Finance
EIKN,Eikon Therapeutics Inc. Common Stock,11.16,604187088.0,185209,Health Care
HUYA,HUYA Inc. American depositary shares each  representing one Class A ordinary share,2.7,603539899.0,1674035,Technology
MLAB,Mesa Laboratories Inc. Common Stock,109.11,602812346.0,134234,Industrials
CABA,Cabaletta Bio Inc. Common Stock,3.69,601672197.0,3601496,Health Care
SUJA,Suja Life Inc. Class A Common Stock,15.55,600618937.0,86573,Consumer Staples
SSSSL,SuRo Capital Corp. 6.00% Notes due 2026,25.12,600069248.0,200,Finance
RRBI,Red River Bancshares Inc. Common Stock,91.11,599931653.0,71404,Consumer Discretionary
GYRE,Gyre Therapeutics Inc. Common Stock,6.18,599635030.0,97452,Health Care
PD,PagerDuty Inc. Common Stock,7.05,599150560.0,1626343,Technology
CARE,Carter Bankshares Inc. Common Stock,26.95,598883170.0,265136,Finance
MAMA,Mama's Creations Inc. Common Stock,14.71,598799970.0,456044,Consumer Staples
CASS,Cass Information Systems Inc Common Stock,46.5,598508429.0,68582,Consumer Discretionary
SSTK,Shutterstock Inc. Common Stock,16.28,598094868.0,265615,Technology
PFIS,Peoples Financial Services Corp. Common Stock,59.57,596348181.0,52289,Finance
HY,Hyster-Yale Inc. Class A common stock,33.27,596062060.0,82952,Industrials
CNNE,Cannae Holdings Inc. Common Stock,13.54,594954451.0,386512,Consumer Discretionary
BALY,Bally's Corporation Common Stock,12.15,594727859.0,142835,Consumer Discretionary
NFBK,Northfield Bancorp Inc. Common Stock (Delaware),14.2,593046698.0,229999,Finance
ALOY,REalloys Inc. Common Stock,9.66,591322391.0,2061872,Technology
WHFCL,WhiteHorse Finance Inc. 7.875% Notes due 2028,25.43,591071728.0,577,Uncategorized
SDHC,Smith Douglas Homes Corp. Class A Common Stock,11.63,590608081.0,98376,Consumer Discretionary
IDR,Idaho Strategic Resources Inc. Common Stock,37.35,590498234.0,298731,Basic Materials
EVGO,EVgo Inc. Class A Common Stock,1.88,590055606.0,5108378,Technology
GDYN,Grid Dynamics Holdings Inc. Class A Common Stock,7.05,589563681.0,1691475,Technology
FEIM,Frequency Electronics Inc. Common Stock,59.89,589433008.0,137383,Industrials
ASIX,AdvanSix Inc. Common Stock ,21.83,588515756.0,299027,Industrials
ARVN,Arvinas Inc. Common Stock,9.1,587142902.0,782375,Health Care
AMSF,AMERISAFE Inc. Common Stock,31.3,585428032.0,158135,Finance
PAR,PAR Technology Corporation Common Stock,14.19,585283564.0,730721,Miscellaneous
TRAX,First Tracks Biotherapeutics Inc. Ordinary Shares ,16.76,584796306.0,307285,Health Care
UHT,Universal Health Realty Income Trust Common Stock,42.12,584440188.0,52814,Real Estate
KE,Kimball Electronics Inc. Common Stock,24.21,582224474.0,137639,Technology
BHB,Bar Harbor Bankshares Inc. Common Stock,34.76,581955535.0,122288,Finance
OXM,Oxford Industries Inc. Common Stock,39.03,581578966.0,333588,Industrials
CLFD,Clearfield Inc. Common Stock,42.78,581357099.0,178088,Utilities
CADL,Candel Therapeutics Inc. Common Stock,7.93,581032995.0,1671810,Health Care
RYAM,Rayonier Advanced Materials Inc. Common Stock,8.61,580645907.0,861540,Basic Materials
ILPT,Industrial Logistics Properties Trust Common Shares of Beneficial Interest,8.68,578656288.0,493816,Real Estate
MGR,Affiliated Managers Group Inc. 5.875% Junior Subordinated Notes due 2059,20.3513,578222418.0,12219,Finance
TCMD,Tactile Systems Technology Inc. Common Stock,25.63,578116944.0,420612,Health Care
DNUT,Krispy Kreme Inc. Common Stock,3.33,574092000.0,1680078,Consumer Staples
TDUP,ThredUp Inc. Class A Common Stock,4.44,572941356.0,1976563,Consumer Discretionary
MSBI,Midland States Bancorp Inc. Common Stock,27.58,571727856.0,143725,Finance
ALT,Altimmune Inc. Common Stock,2.93,569809271.0,3062783,Health Care
ONT,Onterris Inc. Common Stock,15.76,569554218.0,996749,Consumer Discretionary
IIM,Invesco Value Municipal Income Trust Common Stock,12.01,565291952.0,87761,Finance
SD,SandRidge Energy Inc. Common Stock,15.31,565218545.0,373852,Energy
MCS,Marcus Corporation (The) Common Stock,18.32,562943061.0,155319,Consumer Discretionary
INV,Innventure Inc. Common Stock,6.69,562259364.0,2473972,Finance
TASK,TaskUs Inc. Class A Common Stock,6.12,560458615.0,702256,Technology
AMWD,American Woodmark Corporation Common Stock,38.43,559909536.0,340784,Basic Materials
ACNB,ACNB Corporation Common Stock,54.76,559211529.0,33487,Finance
CBIO,Crescent Biopharma Inc. Common Stock,20.23,557780245.0,249480,Health Care
PRAA,PRA Group Inc. Common Stock,14.62,557619783.0,414022,Finance
ORN,Orion Group Holdings Inc. Common,13.72,555375694.0,497693,Industrials
UNTY,Unity Bancorp Inc. Common Stock,55.3,555261881.0,46556,Finance
NPCE,Neuropace Inc. Common Stock,16.28,555046169.0,215115,Health Care
RFI,Cohen & Steers Total Return Realty Fund Inc. Common Stock,11.26,553300951.0,189612,Finance
TYG,Tortoise Energy Infrastructure Corporation Common Stock,46.38,553216141.0,185052,Finance
BWBBP,Bridgewater Bancshares Inc. Depositary Shares Each Representing a 1/100th Interest in a Share of 5.875% Non-Cumulative Perpetual Preferred Stock Series A,19.75,550696498.0,240,Finance
IIIV,i3 Verticals Inc. Class A Common Stock,19.68,549692196.0,271830,Technology
CERS,Cerus Corporation Common Stock,2.74,549010989.0,1912132,Technology
MG,Mistras Group Inc Common Stock,17.2,547246913.0,142191,Consumer Discretionary
XMAX,XMAX Inc. Common Stock,8.6,546980004.0,3619362,Consumer Discretionary
LEGH,Legacy Housing Corporation Common Stock (TX),22.97,546263375.0,66108,Consumer Discretionary
NRIM,Northrim BanCorp Inc Common Stock,24.49,544774319.0,107991,Finance
BWMN,Bowman Consulting Group Ltd. Common Stock,31.08,544140373.0,96356,Consumer Discretionary
ADV,Advantage Solutions Inc. Class A Common Stock,40.83,542846282.0,196332,Consumer Discretionary
PHR,Phreesia Inc. Common Stock,8.78,542375395.0,1207527,Consumer Discretionary
IPI,Intrepid Potash Inc Common Stock,40.34,541888430.0,128860,Industrials
PANL,Pangaea Logistics Solutions Ltd. Common Shares,8.28,541635562.0,599337,Consumer Discretionary
FBIOP,Fortress Biotech Inc. 9.375% Series A Cumulative Redeemable Perpetual Preferred Stock,16.3,541470874.0,10699,Health Care
VGM,Invesco Trust for Investment Grade Municipals Common Stock (DE),9.98,541235041.0,129754,Finance
KYTX,Kyverna Therapeutics Inc. Common Stock,8.9,541077387.0,822553,Health Care
GOGO,Gogo Inc. Common Stock,4.0,540954092.0,1423175,Consumer Discretionary
FFIC,Flushing Financial Corporation Common Stock,15.95,540443835.0,340615,Finance
RIGL,Rigel Pharmaceuticals Inc. Common Stock,29.19,540075715.0,214879,Health Care
SFST,Southern First Bancshares Inc. Common Stock,57.07,539606267.0,252731,Finance
NRDS,NerdWallet Inc. Class A Common Stock,8.2,539550021.0,874759,Technology
TECX,Tectonic Therapeutic Inc. Common Stock,28.52,538149185.0,103180,Health Care
MDXG,MiMedx Group Inc Common Stock,3.61,537694089.0,1474683,Health Care
CTNM,Contineum Therapeutics Inc. Class A Common Stock,14.37,537242237.0,155858,Health Care
CARS,Cars.com Inc. Common Stock ,9.57,534991968.0,795970,Technology
APPS,Digital Turbine Inc. Common Stock,4.46,534753701.0,3149867,Miscellaneous
OIS,Oil States International Inc. Common Stock,8.88,534517525.0,813243,Consumer Discretionary
FIP,FTAI Infrastructure Inc. Common Stock ,4.52,534099269.0,961970,Energy
NGS,Natural Gas Services Group Inc. Common Stock,42.36,533666741.0,74454,Energy
KRT,Karat Packaging Inc. Common Stock,26.72,533430892.0,169571,Industrials
CIVB,Civista Bancshares Inc. Common Stock,25.65,533092876.0,72821,Finance
PRME,Prime Medicine Inc. Common Stock,2.95,532821480.0,1996253,Health Care
KRNY,Kearny Financial Corp Common Stock,8.21,531508430.0,337387,Finance
AQST,Aquestive Therapeutics Inc. Common Stock,4.23,530654003.0,1350242,Health Care
PACK,Ranpak Holdings Corp Class A Common Stock,6.18,528667328.0,614968,Consumer Discretionary
MLR,Miller Industries Inc. Common Stock,46.39,528647265.0,77945,Consumer Discretionary
PROK,ProKidney Corp. Class A Ordinary Shares,1.75,528604346.0,876739,Health Care
VKQ,Invesco Municipal Trust Common Stock,9.54,527900813.0,370028,Finance
MBUU,Malibu Boats Inc. Class A Common Stock,26.86,527451244.0,327271,Industrials
MSBIP,Midland States Bancorp Inc. Depositary Shares Each Representing a 1/40th Interest in a Share of 7.750% Fixed-Rate Reset Non-Cumulative Perpetual Preferred Stock Series A,25.43,527158789.0,1507,Finance
ACIC,American Coastal Insurance Corporation Common Stock,10.85,525834910.0,391032,Finance
TRC,Tejon Ranch Co Common Stock,19.45,525232351.0,70925,Finance
ALTI,AlTi Global Inc. Class A Common Stock,3.46,524597726.0,189514,Finance
BWB,Bridgewater Bancshares Inc. Common Stock,18.81,524486133.0,101760,Finance
XOMA,XOMA Royalty Corporation Common Stock,41.82,524465875.0,52228,Health Care
BME,Blackrock Health Sciences Trust,39.24,523187626.0,37753,Finance
OPENW,Opendoor Technologies Inc  Series K Warrants each whole warrant exercisable to purchase one share of Common Stock at an exercise price of $9.00 per warrant,0.5412,522115465.0,206679,Finance
AHRT,AH Realty Trust Inc. Common Stock,6.86,521054017.0,1396318,Finance
OOMA,Ooma Inc. Common Stock,18.87,519110077.0,196369,Technology
BDN,Brandywine Realty Trust Common Stock,2.98,517661298.0,1386913,Real Estate
MAX,MediaAlpha Inc. Class A Common Stock,8.27,515637990.0,487172,Consumer Discretionary
CBNK,Capital Bancorp Inc. Common Stock,31.55,513888135.0,48239,Finance
CCSI,Consensus Cloud Solutions Inc. Common Stock,27.93,513854744.0,230094,Technology
CTKB,Cytek Biosciences Inc. Common Stock,3.96,511404645.0,723811,Industrials
HBCP,Home Bancorp Inc. Common Stock,65.16,511025836.0,80538,Finance
TREE,LendingTree Inc. Common Stock,36.59,510540929.0,172137,Finance
OLP,One Liberty Properties Inc. Common Stock,23.38,510138694.0,37355,Real Estate
IQI,Invesco Quality Municipal Income Trust Common Stock,9.64,509799803.0,87976,Finance
IIIN,Insteel Industries Inc. Common Stock,26.21,509345404.0,172256,Industrials
STRO,Sutro Biopharma Inc. Common Stock,30.62,507386842.0,364728,Health Care
EBF,Ennis Inc. Common Stock,20.04,506869035.0,164562,Consumer Discretionary
CHCT,Community Healthcare Trust Incorporated Common Stock,17.72,506292172.0,212464,Real Estate
BSRR,Sierra Bancorp Common Stock,38.5,503548584.0,78590,Finance
VCV,Invesco California Value Municipal Income Trust Common Stock,10.5,502850513.0,53206,Finance
DNA,Ginkgo Bioworks Holdings Inc. Class A Common Stock,8.08,502054412.0,660039,Health Care
SRTA,Strata Critical Medical Inc. Class A Common Stock,5.8,501854106.0,1307109,Consumer Discretionary
ETD,Ethan Allen Interiors Inc. Common Stock,19.72,501801805.0,399229,Consumer Discretionary
CLDT,Chatham Lodging Trust (REIT) Common Shares of Beneficial Interest,10.69,499022242.0,443302,Real Estate
FTHY,First Trust High Yield Opportunities 2027 Term Fund Common Stock,13.56,498641731.0,48523,Finance
CPS,Cooper-Standard Holdings Inc. Common Stock,28.01,497325505.0,122454,Consumer Discretionary
XRN,Chiron Real Estate Inc. Common Stock,37.45,495644384.0,306435,Real Estate
ETO,Eaton Vance Tax-Advantage Global Dividend Opp Common Stock,30.19,494757886.0,12469,Finance
ANGO,AngioDynamics Inc. Common Stock,11.96,494174223.0,342727,Health Care
FLGT,Fulgent Genetics Inc. Common Stock,17.38,493602828.0,459603,Health Care
PRTA,Prothena Corporation plc Ordinary Shares,9.41,492643960.0,388757,Health Care
MNRO,Monro Inc. Common Stock,16.38,491722031.0,936829,Consumer Discretionary
ANGX,Angel Studios Inc. Class A Common Stock,2.62,488400394.0,1283841,Consumer Discretionary
YORW,York Water Company (The) Common Stock,29.8,483038302.0,109619,Utilities
CTRN,Citi Trends Inc. Common Stock,38.23,481225018.0,280875,Consumer Discretionary
FBIZ,First Business Financial Services Inc. Common Stock,57.22,478483139.0,34387,Finance
MGRB,Affiliated Managers Group Inc. 4.750% Junior Subordinated Notes due 2060,16.74,475617935.0,8957,Finance
OSPN,OneSpan Inc. Common Stock,12.82,475273937.0,423237,Technology
SCVL,Shoe Carnival Inc. Common Stock,17.27,474651806.0,609317,Consumer Discretionary
TWI,Titan International Inc. (DE) Common Stock,7.37,474421345.0,445103,Industrials
PUBM,PubMatic Inc. Class A Common Stock,10.21,474186348.0,534036,Technology
MEC,Mayville Engineering Company Inc. Common Stock,23.13,474026359.0,433502,Industrials
KIDS,OrthoPediatrics Corp. Common Stock,18.43,473374439.0,162770,Health Care
COFS,ChoiceOne Financial Services Inc. Common Stock,31.61,473360856.0,100439,Finance
RPD,Rapid7 Inc. Common Stock,7.08,473160775.0,2259103,Technology
CVGW,Calavo Growers Inc. Common Stock,26.46,472948130.0,313452,Consumer Discretionary
BBNX,Beta Bionics Inc. Common Stock,10.61,472799584.0,841553,Health Care
MATV,Mativ Holdings Inc. Common Stock,8.57,472356358.0,334110,Basic Materials
ACHV,Achieve Life Sciences Inc. Common Shares,4.6,472231662.0,841613,Health Care
IMMX,Immix Biopharma Inc. Common Stock,8.67,471747072.0,5932579,Health Care
PRTH,Priority Technology Holdings Inc. Common Stock,5.68,467777366.0,213245,Consumer Discretionary
BBW,Build-A-Bear Workshop Inc. Common Stock,37.16,467490600.0,294671,Consumer Discretionary
STTK,Shattuck Labs Inc. Common Stock,6.09,466984349.0,1014892,Health Care
RBBN,Ribbon Communications Inc. Common Stock,2.65,466768528.0,849671,Technology
GLOO,Gloo Holdings Inc. Class A Common Stock,5.76,465817674.0,73703,Technology
GUT,Gabelli Utility Trust (The) Common Stock,6.32,463881863.0,310749,Finance
ITIC,Investors Title Company Common Stock,244.01,460689904.0,36892,Finance
UPB,Upstream Bio Inc. Common Stock,8.46,460393082.0,597570,Health Care
MVST,Microvast Holdings Inc. Common Stock,1.38,459757190.0,5507509,Miscellaneous
IMXI,International Money Express Inc. Common Stock,15.23,458339113.0,320429,Consumer Discretionary
SFIX,Stitch Fix Inc. Class A Common Stock,3.35,457350442.0,2314405,Consumer Discretionary
OCGN,Ocugen Inc. Common Stock,1.35,457004506.0,4141814,Health Care
FPI,Farmland Partners Inc. Common Stock,10.47,456672094.0,253187,Real Estate
OBT,Orange County Bancorp Inc. Common Stock,33.99,455734657.0,48891,Finance
OVID,Ovid Therapeutics Inc. Common Stock,2.44,455401849.0,727911,Health Care
FDMT,4D Molecular Therapeutics Inc. Common Stock,8.69,454280647.0,555199,Health Care
ASPN,Aspen Aerogels Inc. Common Stock,5.47,453339668.0,1615512,Consumer Discretionary
ETB,Eaton Vance Tax-Managed Buy-Write Income Fund Eaton Vance Tax-Managed Buy-Write Income Fund Common Shares of Beneficial Interest,15.34,450557245.0,26134,Finance
FBRX,Forte Biosciences Inc. Common Stock,22.0,450533974.0,227737,Health Care
PDLB,Ponce Financial Group Inc. Common Stock,18.61,450136838.0,68786,Finance
JOUT,Johnson Outdoors Inc. Class A Common Stock,42.93,449678528.0,70783,Consumer Discretionary
CLNE,Clean Energy Fuels Corp. Common Stock,2.03,447056007.0,995888,Utilities
TOI,The Oncology Institute Inc. Common Stock,4.47,446923711.0,2195604,Health Care
WEAV,Weave Communications Inc. Common Stock,5.61,446363212.0,1680846,Technology
CAL,Caleres Inc. Common Stock,13.16,445363865.0,1053633,Consumer Discretionary
ERII,Energy Recovery Inc. Common Stock,8.62,444320133.0,648327,Technology
BRCC,BRC Inc. Class A Common Stock,1.78,444114082.0,2373655,Consumer Staples
ACTG,Acacia Research Corporation (Acacia Tech) Common Stock,4.58,442378225.0,155685,Miscellaneous
BLZE,Backblaze Inc. Class A Common Stock,7.37,442200000.0,918129,Technology
HQL,abrdn Life Sciences Investors Shares of Beneficial Interest,17.21,441946536.0,121153,Finance
BLW,Blackrock Limited Duration Income Trust,12.37,441748200.0,149001,Consumer Discretionary
CATX,Perspective Therapeutics Inc. Common Stock,3.87,441358782.0,918687,Health Care
OPTX,Syntec Optics Holdings Inc. Class A Common Stock,10.94,440661865.0,4996977,Technology
AIOT,PowerFleet Inc. Common Stock,3.28,440003069.0,1242697,Telecommunications
DDD,3D Systems Corporation Common Stock,2.99,439371688.0,3389310,Technology
KLC,KinderCare Learning Companies Inc. Common Stock,3.71,439368989.0,933686,Consumer Discretionary
FRPH,FRP Holdings Inc. Common Stock,22.9,438999298.0,74012,Finance
FULC,Fulcrum Therapeutics Inc. Common Stock,6.59,438947353.0,402638,Health Care
ABAT,American Battery Technology Company Common Stock,3.21,437890253.0,5294395,Basic Materials
CRNC,Cerence Inc. Common Stock,9.69,437869869.0,544473,Technology
PKOH,Park-Ohio Holdings Corp. Common Stock,30.31,436408502.0,131900,Industrials
TITN,Titan Machinery Inc. Common Stock,18.7,435881423.0,187627,Consumer Discretionary
GETY,Getty Images Holdings Inc. Class A Common Stock,1.04,435717614.0,5346800,Consumer Discretionary
ALIT,Alight Inc. Class A Common Stock,0.8082,434198969.0,24234437,Consumer Discretionary
GLAD,Gladstone Capital Corporation Common Stock,19.15,432657271.0,148014,Consumer Discretionary
SGMT,Sagimet Biosciences Inc. Series A Common Stock,7.0,432262649.0,776521,Health Care
EVH,Evolent Health Inc Class A Common Stock,3.84,431927297.0,3241286,Consumer Discretionary
EBS,Emergent BioSolutions Inc. Common Stock,8.37,431860998.0,554618,Health Care
REPL,Replimune Group Inc. Common Stock,5.22,431029071.0,4557579,Health Care
LOCO,El Pollo Loco Holdings Inc. Common Stock,14.14,430637914.0,343713,Consumer Discretionary
NRC,NRC Health Common Stock,19.04,429098692.0,75455,Health Care
ELMT,The Elmet Group Co. Common Stock,14.66,426934003.0,409362,Industrials
ALMU,Aeluma Inc. Common Stock,23.31,426697359.0,1703007,Technology
VREX,Varex Imaging Corporation Common Stock,10.13,426473000.0,298510,Technology
NUAI,New Era Energy & Digital Inc. Common Stock,4.21,426434807.0,3631830,Energy
GCBC,Greene County Bancorp Inc. Common Stock,25.0,425637125.0,9362,Finance
BMRC,Bank of Marin Bancorp Common Stock,26.24,424817912.0,86985,Finance
EOLS,Evolus Inc. Common Stock,6.45,424763144.0,531641,Health Care
SES,SES AI Corporation Class A Common Stock,1.15,424675869.0,9357001,Miscellaneous
GTN,Gray Media Inc. Common Stock,4.13,424309819.0,1545368,Industrials
MGRD,Affiliated Managers Group Inc. 4.200% Junior Subordinated Notes due 2061,14.93,424192101.0,11800,Finance
BBBY,Bed Bath & Beyond Inc. Common Stock,5.73,423667576.0,3197251,Consumer Discretionary
NVEC,NVE Corporation Common Stock,87.56,423542255.0,137782,Technology
GBFH,GBank Financial Holdings Inc. Common Stock,29.22,422823685.0,68946,Finance
NPWR,NET Power Inc. Class A Common Stock,1.88,422551960.0,582752,Energy
LDI,loanDepot Inc. Class A Common Stock,1.25,422279874.0,1400845,Finance
CCRN,Cross Country Healthcare Inc. Common Stock $0.0001 Par Value,13.05,421941226.0,4060757,Consumer Discretionary
CCAP,Crescent Capital BDC Inc. Common stock,11.44,421517691.0,214023,Finance
CMCO,Columbus McKinnon Corporation Common Stock,14.66,421319106.0,554725,Industrials
ASMB,Assembly Biosciences Inc. Common Stock,26.5,421154112.0,63899,Health Care
BWFG,Bankwell Financial Group Inc. Common Stock,52.77,420744709.0,45907,Finance
MNPR,Monopar Therapeutics Inc. Common Stock,62.68,419897206.0,158037,Health Care
MTW,Manitowoc Company Inc. (The) Common Stock,11.69,419783037.0,165984,Industrials
ZSQR,Z Squared Inc. Common Stock,8.16,419680983.0,283983,Finance
ATNI,ATN International Inc. Common Stock,27.25,419128244.0,59658,Telecommunications
CBAN,Colony Bankcorp Inc. Common Stock,19.79,418749850.0,433012,Finance
SGU,Star Group L.P. Common Stock,12.75,418632646.0,15607,Consumer Discretionary
EVN,Eaton Vance Municipal Income Trust Common Stock,10.55,418488570.0,74839,Finance
MOBI,Mobia Medical Inc. Common Stock,12.57,415883365.0,63682,Health Care
NATH,Nathan's Famous Inc. Common Stock,101.11,413985290.0,9251,Consumer Discretionary
GEVO,Gevo Inc. Common Stock,1.7,413799259.0,2923702,Industrials
KREF,KKR Real Estate Finance Trust Inc. Common Stock,6.41,412165673.0,823890,Real Estate
BSVN,Bank7 Corp. Common stock,43.26,411806432.0,13592,Finance
LAND,Gladstone Land Corporation Common Stock,9.53,411091541.0,554527,Real Estate
LXEO,Lexeo Therapeutics Inc. Common Stock,5.23,410668146.0,666247,Health Care
DDT,Dillard's Capital Trust I,26.23,409635772.0,5822,Consumer Discretionary
IPSC,Century Therapeutics Inc. Common Stock,2.27,409405416.0,499198,Health Care
OSS,One Stop Systems Inc. Common Stock,16.51,408936471.0,1086767,Technology
BYND,Beyond Meat Inc. Common Stock,0.7885,406347476.0,25964366,Consumer Staples
LAB,Standard BioTools Inc. Common Stock,1.04,405982844.0,1953190,Industrials
ZUMZ,Zumiez Inc. Common Stock,23.48,405164353.0,132419,Consumer Discretionary
WTBA,West Bancorporation Common Stock,23.79,405098523.0,32990,Finance
LYEL,Lyell Immunopharma Inc. Common Stock,17.3,403679705.0,69810,Health Care
RBB,RBB Bancorp Common Stock,23.76,402396699.0,48239,Finance
ENTA,Enanta Pharmaceuticals Inc. Common Stock,13.83,402153995.0,141629,Health Care
SPT,Sprout Social Inc Class A Common Stock,6.69,402106049.0,1067339,Technology
FVR,FrontView REIT Inc. Common Stock,17.73,401620456.0,107072,Real Estate
PLAY,Dave & Buster's Entertainment Inc. Common Stock,11.56,401587522.0,1493429,Consumer Discretionary
CTEV,Claritev Corporation Class A Common Stock,23.55,401475431.0,228702,Consumer Discretionary
PNRG,PrimeEnergy Resources Corporation Common Stock,247.97,401215460.0,40282,Energy
LTBR,Lightbridge Corporation Common Stock,11.41,401027966.0,665929,Consumer Discretionary
BMBL,Bumble Inc. Class A Common Stock,3.06,399119374.0,2990015,Technology
