symbol,name,price,marketCap,volume,industry
SNDA,Sonida Senior Living Inc. Common Stock,34.67,650742171.0,34427,Health Care
ALRS,Alerus Financial Corporation Common Stock,25.59,649916984.0,152286,Finance
DSP,Viant Technology Inc. Class A Common Stock,10.4,649309502.0,192397,Technology
HY,Hyster-Yale Inc. Class A common stock,36.6,649056860.0,66943,Industrials
ALTI,AlTi Global Inc. Class A Common Stock,4.42,648207909.0,67640,Finance
PRME,Prime Medicine Inc. Common Stock,3.59,648033262.0,1889107,Health Care
SSTK,Shutterstock Inc. Common Stock,18.22,647180832.0,216494,Technology
MAMA,Mama's Creations Inc. Common Stock,15.84,643948795.0,502093,Consumer Staples
REPL,Replimune Group Inc. Common Stock,7.775,642002113.0,783700,Health Care
AIOT,PowerFleet Inc. Common Stock,4.78,639681688.0,3062404,Telecommunications
TALK,Talkspace Inc. Common Stock,3.86,639432639.0,619582,Health Care
KOP,Koppers Holdings Inc. Common Stock,32.5,637452595.0,112335,Basic Materials
REPX,Riley Exploration Permian Inc. Common Stock,29.0,637098274.0,341487,Energy
ASPI,ASP Isotopes Inc. Common Stock,5.73,635113899.0,3656928,Industrials
ASST,Strive Inc. Class A Common Stock,10.145,632762327.0,5158196,Technology
MNRO,Monro Inc. Common Stock,21.04,631613646.0,609209,Consumer Discretionary
PLAY,Dave & Buster's Entertainment Inc. Common Stock,18.2,631180823.0,561381,Consumer Discretionary
CEVA,CEVA Inc. Common Stock,22.95,630386125.0,207431,Technology
ETD,Ethan Allen Interiors Inc. Common Stock,24.61,626234403.0,301052,Consumer Discretionary
IVR,INVESCO MORTGAGE CAPITAL INC Common Stock,8.82,625739936.0,2266722,Real Estate
IDR,Idaho Strategic Resources Inc. Common Stock,40.13,625721969.0,372551,Basic Materials
SD,SandRidge Energy Inc. Common Stock,17.01,625521419.0,340472,Energy
TREE,LendingTree Inc. Common Stock,45.71,624887514.0,538701,Finance
RIGL,Rigel Pharmaceuticals Inc. Common Stock,34.41,624587747.0,226902,Health Care
PGC,Peapack-Gladstone Financial Corporation Common Stock,35.5,623309675.0,156566,Finance
BWMN,Bowman Consulting Group Ltd. Common Stock,35.77,621436824.0,57232,Consumer Discretionary
PURR,Hyperliquid Strategies Inc Common Stock,4.89,621155003.0,3140601,Finance
AMBQ,Ambiq Micro Inc. Common Stock,29.69,619782105.0,278822,Technology
KE,Kimball Electronics Inc. Common Stock,25.59,619639689.0,242447,Technology
BCAL,California BanCorp Common Stock,19.17,619625220.0,210916,Finance
FRGE,Forge Global Holdings Inc. Common Stock,44.65,618161658.0,245529,Finance
EVER,EverQuote Inc. Class A Common Stock,17.14,616284486.0,848983,Technology
BLMN,Bloomin' Brands Inc. Common Stock,7.23,616119568.0,2142311,Consumer Discretionary
DNA,Ginkgo Bioworks Holdings Inc. Class A Common Stock,10.15,614990723.0,1367843,Health Care
KFRC,Kforce Inc. Common Stock,33.88,614617080.0,170563,Consumer Discretionary
BXC,Bluelinx Holdings Inc. Common Stock,78.11,614339680.0,52183,Consumer Discretionary
MGTX,MeiraGTx Holdings plc Ordinary Shares,7.63,614145483.0,320672,Health Care
RGR,Sturm Ruger & Company Inc. Common Stock,38.43,612737643.0,154172,Industrials
RRBI,Red River Bancshares Inc. Common Stock,90.62,612283908.0,47533,Consumer Discretionary
BBNX,Beta Bionics Inc. Common Stock,13.87,610621632.0,1096694,Health Care
EMBC,Embecta Corp. Common Stock,10.3,609964496.0,1351105,Health Care
CPS,Cooper-Standard Holdings Inc. Common Stock,34.58,609887771.0,139694,Consumer Discretionary
TCMD,Tactile Systems Technology Inc. Common Stock,27.3,609761389.0,164713,Health Care
MGR,Affiliated Managers Group Inc. 5.875% Junior Subordinated Notes due 2059,21.37,607165786.0,18185,Finance
LBRX,LB Pharmaceuticals Inc Common Stock,23.97,606419475.0,134161,Health Care
WRLD,World Acceptance Corporation Common Stock,120.35,606332567.0,40462,Finance
CASS,Cass Information Systems Inc Common Stock,46.32,606063803.0,57594,Real Estate
LPTH,LightPath Technologies Inc. Class A Common Stock,11.33,603664405.0,2849909,Technology
YEXT,Yext Inc. Common Stock,4.91,602098555.0,1818019,Technology
MNTN,MNTN Inc. Class A Common Stock,8.22,601895337.0,795796,Consumer Discretionary
TCBX,Third Coast Bancshares Inc. Common Stock,43.29,601474637.0,53491,Finance
PROK,ProKidney Corp. Class A Ordinary Shares,1.99,598660414.0,1144139,Health Care
SSSSL,SuRo Capital Corp. 6.00% Notes due 2026,25.04,598158199.0,2140,Finance
CRMD,CorMedix Inc. Common Stock,7.58,597220961.0,1336654,Health Care
CLNE,Clean Energy Fuels Corp. Common Stock,2.72,596498717.0,1035022,Utilities
GDYN,Grid Dynamics Holdings Inc. Class A Common Stock,7.03,595926478.0,2137302,Technology
CTO,CTO Realty Growth Inc. Common Stock,18.38,595002709.0,116205,Real Estate
HSTM,HealthStream Inc. Common Stock,19.99,593066059.0,409079,Technology
DSGN,Design Therapeutics Inc. Common Stock,10.38,591283798.0,121241,Health Care
NGVC,Natural Grocers by Vitamin Cottage Inc. Common Stock,25.65,590798835.0,265208,Consumer Staples
OXM,Oxford Industries Inc. Common Stock,39.66,590037327.0,214063,Industrials
IIM,Invesco Value Municipal Income Trust Common Stock,12.53,589767541.0,155017,Finance
UHT,Universal Health Realty Income Trust Common Stock,42.45,588935084.0,60606,Real Estate
WHFCL,WhiteHorse Finance Inc. 7.875% Notes due 2028,25.33,588747419.0,1778,
VREX,Varex Imaging Corporation Common Stock,14.04,588548825.0,366222,Technology
NTGR,NETGEAR Inc. Common Stock,20.72,588505084.0,774805,Utilities
BHB,Bar Harbor Bankshares Inc. Common Stock,35.2,587437770.0,62479,Finance
AROW,Arrow Financial Corporation Common Stock,35.65,586173449.0,66069,Finance
BTBT,Bit Digital Inc. Ordinary Shares,1.81,585851444.0,34403768,Finance
MBUU,Malibu Boats Inc. Class A Common Stock,31.42,584491650.0,126353,Industrials
HPK,HighPeak Energy Inc. Common Stock,4.65,583979982.0,242239,Energy
AHH,Armada Hoffler Properties Inc. Common Stock,7.25,581112092.0,506367,Finance
NPB,Northpointe Bancshares Inc. Common Stock,16.88,580075444.0,128476,Finance
EBS,Emergent BioSolutions Inc. Common Stock,11.03,579295203.0,561681,Health Care
RDVT,Red Violet Inc. Common Stock ,41.32,577314321.0,153913,Technology
SFIX,Stitch Fix Inc. Class A Common Stock,4.3,577055674.0,942045,Consumer Discretionary
PANL,Pangaea Logistics Solutions Ltd. Common Shares,8.87,576316613.0,721550,Consumer Discretionary
NFBK,Northfield Bancorp Inc. Common Stock (Delaware),13.77,575606586.0,530447,Finance
KLC,KinderCare Learning Companies Inc. Common Stock,4.86,575028172.0,355636,Consumer Discretionary
NRIM,Northrim BanCorp Inc Common Stock,25.88,571706488.0,153285,Finance
ORN,Orion Group Holdings Inc. Common,14.3,570583985.0,341912,Industrials
CTKB,Cytek Biosciences Inc. Common Stock,4.46,570277142.0,919685,Industrials
MAX,MediaAlpha Inc. Class A Common Stock,8.73,568950163.0,674372,Real Estate
RFI,Cohen & Steers Total Return Realty Fund Inc. Common Stock,11.57,568533926.0,339263,Finance
LE,Lands' End Inc. Common Stock,18.6,568249865.0,178994,Consumer Discretionary
VGM,Invesco Trust for Investment Grade Municipals Common Stock (DE),10.47,567808705.0,262628,Finance
IBTA,Ibotta Inc. Class A Common Stock,21.34,567277080.0,225712,Consumer Discretionary
RMR,The RMR Group Inc. Class A Common Stock,17.63,565185661.0,211353,Consumer Discretionary
FFIC,Flushing Financial Corporation Common Stock,16.65,562410993.0,330822,Finance
VLGEA,Village Super Market Inc. Class A Common Stock,38.11,562254742.0,56938,Consumer Staples
EHAB,Enhabit Inc. Common Stock,11.09,561232462.0,219241,Health Care
BME,Blackrock Health Sciences Trust,42.09,561186728.0,38154,Finance
BDN,Brandywine Realty Trust Common Stock,3.23,561047896.0,2150156,Real Estate
GOGO,Gogo Inc. Common Stock,4.19,560849693.0,1288271,Consumer Discretionary
UNTY,Unity Bancorp Inc. Common Stock,55.6,558193086.0,76509,Finance
CTNM,Contineum Therapeutics Inc. Class A Common Stock,15.27,557804686.0,263614,Health Care
SCVL,Shoe Carnival Inc. Common Stock,20.35,557080599.0,273673,Consumer Discretionary
ZEUS,Olympic Steel Inc. Common Stock,49.74,556969669.0,61984,Industrials
GOOD,Gladstone Commercial Corporation Real Estate Investment Trust,11.5,556613283.0,434996,Real Estate
PACB,Pacific Biosciences of California Inc. Common Stock,1.84,555509673.0,4766825,Industrials
WOLF,Wolfspeed Inc. Common Stock New,14.89,554720666.0,2089913,Technology
CLMB,Climb Global Solutions Inc. Common Stock,120.18,554443940.0,74919,Technology
CABO,Cable One Inc. Common Stock,98.37,554332361.0,117077,Telecommunications
GAIN,Gladstone Investment Corporation Business Development Company,13.94,552671527.0,121303,Finance
PFIS,Peoples Financial Services Corp. Common Stock,55.22,551901536.0,19369,Finance
BWBBP,Bridgewater Bancshares Inc. Depositary Shares Each Representing a 1/100th Interest in a Share of 5.875% Non-Cumulative Perpetual Preferred Stock Series A,19.9886,551380174.0,3287,Finance
ABAT,American Battery Technology Company Common Stock,4.18,550544644.0,4686898,Basic Materials
NHPAP,National Healthcare Properties Inc. 7.375% Series A Cumulative Redeemable Perpetual Preferred Stock,19.35,550056529.0,7191,Real Estate
CRSR,Corsair Gaming Inc. Common Stock,5.16,549928084.0,920127,Technology
RMT,Royce Micro-Cap Trust Inc. Common Stock,11.88,549676991.0,234492,Finance
MGPI,MGP Ingredients Inc.,25.8,549393327.0,216418,Consumer Staples
FET,Forum Energy Technologies Inc. Common Stock,48.25,548986474.0,243312,Consumer Discretionary
TYG,Tortoise Energy Infrastructure Corporation Common Stock,45.95,548087143.0,100521,Finance
VOR,Vor Biopharma Inc. Common Stock,13.17,546816293.0,681257,Health Care
MSBIP,Midland States Bancorp Inc. Depositary Shares Each Representing a 1/40th Interest in a Share of 7.750% Fixed-Rate Reset Non-Cumulative Perpetual Preferred Stock Series A,25.342,546163714.0,618,Finance
VKQ,Invesco Municipal Trust Common Stock,9.87,546161533.0,204479,Finance
MOV,Movado Group Inc. Common Stock,24.58,544150909.0,142319,Consumer Discretionary
BWB,Bridgewater Bancshares Inc. Common Stock,19.72,543970915.0,118658,Finance
CBNK,Capital Bancorp Inc. Common Stock,32.87,543040767.0,50508,Finance
ACNB,ACNB Corporation Common Stock,52.26,542710275.0,41582,Finance
SLS,SELLAS Life Sciences Group Inc. Common Stock,3.81,542704931.0,4055081,Health Care
OIS,Oil States International Inc. Common Stock,9.08,542489730.0,512682,Consumer Discretionary
SMC,Summit Midstream Corporation Common Stock,28.86,542176110.0,48201,Utilities
FFWM,First Foundation Inc. Common Stock,6.54,542063983.0,523382,Finance
NHPBP,National Healthcare Properties Inc. 7.125% Series B Cumulative Redeemable Perpetual Preferred Stock,19.0,540107186.0,7366,Real Estate
VCV,Invesco California Value Municipal Income Trust Common Stock,11.26,539247312.0,167203,Finance
RYAM,Rayonier Advanced Materials Inc. Common Stock,8.04,538724968.0,645415,Basic Materials
ATEX,Anterix Inc. Common Stock,28.7,537167138.0,294435,Telecommunications
ACIC,American Coastal Insurance Corporation Common Stock,10.98,535443016.0,204944,Finance
MITK,Mitek Systems Inc. Common Stock,11.81,535185373.0,1148217,Technology
SLDB,Solid Biosciences Inc. Common Stock,6.86,534464240.0,1962528,Health Care
FTK,Flotek Industries Inc. Common Stock,17.78,534428093.0,247144,Industrials
KROS,Keros Therapeutics Inc. Common Stock,17.53,534070190.0,235793,Health Care
RILYT,BRC Group Holdings Inc. 6.00% Senior Notes Due 2028,17.51,534003626.0,10692,Finance
IQI,Invesco Quality Municipal Income Trust Common Stock,10.08,533068674.0,134705,Finance
LVWR,LiveWire Group Inc. Common Stock,2.61,532410601.0,79639,Consumer Discretionary
GRPN,Groupon Inc. Common Stock,13.01,530219987.0,738178,Consumer Discretionary
CCAP,Crescent Capital BDC Inc. Common stock,14.33,530102855.0,263002,Finance
APPS,Digital Turbine Inc. Common Stock,4.42,529957704.0,3981388,Miscellaneous
KRNY,Kearny Financial Corp Common Stock,8.18,529566255.0,302601,Finance
DNUT,Krispy Kreme Inc. Common Stock,3.09,529317000.0,1770596,Consumer Staples
ALT,Altimmune Inc. Common Stock,4.69,529189570.0,3708787,Health Care
CODI,D/B/A Compass Diversified Holdings Shares of Beneficial Interest,7.03,528908841.0,1356864,Consumer Discretionary
MTW,Manitowoc Company Inc. (The) Common Stock,14.86,527098198.0,382343,Industrials
LXEO,Lexeo Therapeutics Inc. Common Stock,7.2,525508754.0,994638,Health Care
EU,enCore Energy Corp. Common Shares,2.8,524298695.0,2797197,Basic Materials
MAGN,Magnera Corporation Common Stock,14.58,523422000.0,602740,Basic Materials
ANRO,Alto Neuroscience Inc. Common Stock,16.84,523157081.0,314506,Health Care
GOSS,Gossamer Bio Inc. Common Stock,2.26,523091118.0,5773535,Health Care
AUROW,Aurora Innovation Inc. Warrant,0.27,522550167.0,60629,Technology
KRT,Karat Packaging Inc. Common Stock,25.97,521984145.0,78295,Industrials
RGNX,REGENXBIO Inc. Common Stock,10.31,521924017.0,925435,Health Care
SWBI,Smith & Wesson Brands Inc. Common Stock,11.71,521021754.0,398995,Industrials
STEX,Streamex Corp. Common Stock,3.04,520659776.0,2448461,Health Care
FTHY,First Trust High Yield Opportunities 2027 Term Fund Common Stock,14.14,519970064.0,100643,Finance
FDMT,4D Molecular Therapeutics Inc. Common Stock,9.08,518786481.0,617901,Health Care
PACK,Ranpak Holdings Corp Class A Common Stock,6.14,518067842.0,899272,Consumer Discretionary
FEIM,Frequency Electronics Inc. Common Stock,52.9,517237526.0,99170,Industrials
DIN,Dine Brands Global Inc. Common Stock,35.76,515791476.0,336186,Consumer Discretionary
JOUT,Johnson Outdoors Inc. Class A Common Stock,49.33,515649154.0,47607,Consumer Discretionary
EBF,Ennis Inc. Common Stock,20.36,514962752.0,119018,Consumer Discretionary
UMAC,Unusual Machines Inc. Common Stock,13.93,513676398.0,2503765,Technology
LXRX,Lexicon Pharmaceuticals Inc. Common Stock,1.2,512501480.0,1730792,Health Care
FMNB,Farmers National Banc Corp. Common Stock,13.59,511706757.0,355538,Finance
BLND,Blend Labs Inc. Class A Common Stock,1.97,511701432.0,2851697,Technology
CHCT,Community Healthcare Trust Incorporated Common Stock,17.96,511346775.0,235019,Real Estate
BSTZ,BlackRock Science and Technology Term Trust Common Shares of Beneficial Interest,23.06,510959560.0,135147,Finance
ITIC,Investors Title Company Common Stock,270.39,510381134.0,9504,Finance
EGY,VAALCO Energy Inc.  Common Stock,4.89,509822857.0,728541,Energy
MSBI,Midland States Bancorp Inc. Common Stock,23.64,509482684.0,111616,Finance
FPI,Farmland Partners Inc. Common Stock,11.81,508982125.0,585202,Real Estate
NPCE,Neuropace Inc. Common Stock,15.26,508276021.0,95850,Health Care
ASIX,AdvanSix Inc. Common Stock ,18.86,506655700.0,317532,Industrials
MLR,Miller Industries Inc. Common Stock,44.26,505954472.0,36636,Consumer Discretionary
ANGI,Angi Inc. Class A Common Stock,11.69,504430222.0,859688,Consumer Discretionary
MLAB,Mesa Laboratories Inc. Common Stock,90.81,501708269.0,61497,Industrials
IHRT,iHeartMedia Inc. Class A Common Stock,3.34,501529457.0,405198,Consumer Discretionary
WEST,Westrock Coffee Company Common Stock,5.15,498648287.0,253431,Consumer Staples
MGRB,Affiliated Managers Group Inc. 4.750% Junior Subordinated Notes due 2060,17.55,498631706.0,13433,Finance
RSVR,Reservoir Media Inc. Common Stock,7.59,497905662.0,31286,Consumer Discretionary
BSRR,Sierra Bancorp Common Stock,36.9,497502700.0,42709,Finance
FBIZ,First Business Financial Services Inc. Common Stock,59.66,496625232.0,37186,Finance
ETO,Eaton Vance Tax-Advantage Global Dividend Opp Common Stock,30.23,495413412.0,32250,Finance
PKE,Park Aerospace Corp. Common Stock,24.85,495156080.0,408661,Industrials
GBFH,GBank Financial Holdings Inc. Common Stock,34.4,494538287.0,47142,Finance
LYEL,Lyell Immunopharma Inc. Common Stock,23.25,493323545.0,76034,Health Care
BLW,Blackrock Limited Duration Income Trust,13.73,490315504.0,74637,Consumer Discretionary
LEGH,Legacy Housing Corporation Common Stock (TX),20.5,489308904.0,100931,Consumer Discretionary
HLLY,Holley Inc. Common Stock,4.02,488846661.0,858424,Consumer Discretionary
GMRE,Global Medical REIT Inc. Common Stock,36.44,488564126.0,67675,Real Estate
INN,Summit Hotel Properties Inc. Common Stock,4.49,488525582.0,544405,Real Estate
RILYZ,BRC Group Holdings Inc. 5.25% Senior Notes due 2028,15.98,487343115.0,18827,Finance
SBC,SBC Medical Group Holdings Incorporated Common Stock,4.75,487240479.0,38518,Health Care
WEAV,Weave Communications Inc. Common Stock,6.24,486880724.0,1461267,Technology
PSTL,Postal Realty Trust Inc. Class A Common Stock,18.67,486589414.0,518377,Real Estate
ORGO,Organogenesis Holdings Inc. Class A Common Stock,3.83,486073504.0,676269,Health Care
HBCP,Home Bancorp Inc. Common Stock,62.07,485892898.0,45223,Finance
AVR,Anteris Technologies Global Corp. Common Stock,5.61,485249023.0,692620,Health Care
CARE,Carter Bankshares Inc. Common Stock,21.96,485031486.0,157460,Finance
OLP,One Liberty Properties Inc. Common Stock,22.4,484851629.0,72735,Real Estate
LAB,Standard BioTools Inc. Common Stock,1.26,484552422.0,882086,Industrials
NUS,Nu Skin Enterprises Inc. Common Stock,9.9,482625752.0,411238,Health Care
ZVRA,Zevra Therapeutics Inc. Common Stock,8.57,482469875.0,523902,Health Care
LTBR,Lightbridge Corporation Common Stock,14.79,482291044.0,688285,Consumer Discretionary
AQST,Aquestive Therapeutics Inc. Common Stock,3.94,480692265.0,2562508,Health Care
SFST,Southern First Bancshares Inc. Common Stock,58.69,480622798.0,39387,Finance
CIVB,Civista Bancshares Inc. Common Stock,24.87,480311301.0,77792,Finance
ULH,Universal Logistics Holdings Inc. Common Stock,18.23,479996957.0,36589,Industrials
GTN,Gray Media Inc. Common Stock,4.7,479807269.0,1850100,Industrials
CWBC,Community West Bancshares Common Stock,25.04,479776491.0,134358,Finance
MCS,Marcus Corporation (The) Common Stock,15.59,478827440.0,139685,Consumer Discretionary
PRTA,Prothena Corporation plc Ordinary Shares,8.86,476933641.0,356096,Health Care
NPWR,NET Power Inc. Class A Common Stock,2.14,475384049.0,528042,Energy
OBT,Orange County Bancorp Inc. Common Stock,35.56,475321274.0,100568,Finance
MYGN,Myriad Genetics Inc. Common Stock,5.07,472593571.0,992828,Health Care
TCI,Transcontinental Realty Investors Inc. Common Stock,54.62,471879440.0,1025,Real Estate
MG,Mistras Group Inc Common Stock,14.94,471329406.0,112880,Consumer Discretionary
MSB,Mesabi Trust Common Stock,35.79,469565158.0,25508,Industrials
SIGA,SIGA Technologies Inc. Common Stock,6.53,467621802.0,236963,Health Care
TECX,Tectonic Therapeutic Inc. Common Stock,24.83,464725232.0,266589,Health Care
KREF,KKR Real Estate Finance Trust Inc. Common Stock,7.22,464070142.0,946537,Real Estate
YORW,York Water Company (The) Common Stock,32.08,463064534.0,83876,Utilities
DHIL,Diamond Hill Investment Group Inc. Class A Common Stock,171.0,462605616.0,10973,Finance
IPI,Intrepid Potash Inc Common Stock,34.38,461617922.0,132123,Industrials
KYTX,Kyverna Therapeutics Inc. Common Stock,8.08,461589554.0,517097,Health Care
IMXI,International Money Express Inc. Common Stock,15.53,461531892.0,94501,Real Estate
PRTH,Priority Technology Holdings Inc. Common Stock,5.63,460936928.0,233051,Real Estate
GEVO,Gevo Inc. Common Stock,1.9,460386731.0,1590716,Industrials
NGS,Natural Gas Services Group Inc. Common Stock,36.57,459645295.0,67686,Energy
SPT,Sprout Social Inc Class A Common Stock,7.75,458717455.0,1927147,Technology
GETY,Getty Images Holdings Inc. Class A Common Stock,1.1,457446199.0,1508151,Real Estate
PTLO,Portillo's Inc. Class A Common Stock,6.06,456770373.0,1231896,Consumer Discretionary
FWDI,Forward Industries Inc. Common Stock,5.45,455849129.0,564737,Industrials
FRPH,FRP Holdings Inc. Common Stock,23.82,455331734.0,43539,Finance
ETB,Eaton Vance Tax-Managed Buy-Write Income Fund Eaton Vance Tax-Managed Buy-Write Income Fund Common Shares of Beneficial Interest,15.49,454962955.0,26400,Finance
CION,CION Investment Corporation Common Stock,8.78,453670915.0,479009,Finance
OCGN,Ocugen Inc. Common Stock,1.38,452485956.0,2738211,Health Care
WNC,Wabash National Corporation Common Stock,11.15,451760503.0,702946,Industrials
SABR,Sabre Corporation Common Stock,1.14,450168768.0,4524241,Technology
CLFD,Clearfield Inc. Common Stock,32.51,450156802.0,120219,Utilities
NATR,Nature's Sunshine Products Inc. Common Stock,25.71,449810925.0,135132,Health Care
LWLG,Lightwave Logic Inc. Common Stock,3.35,448109259.0,1612552,Industrials
COFS,ChoiceOne Financial Services Inc. Common Stock,29.78,447406739.0,126959,Finance
CVGW,Calavo Growers Inc. Common Stock,25.03,447388197.0,256378,Consumer Discretionary
GUT,Gabelli Utility Trust (The) Common Stock,6.08,446266096.0,156224,Finance
TRC,Tejon Ranch Co Common Stock,16.58,445901774.0,70480,Finance
GLOO,Gloo Holdings Inc. Class A Common Stock,5.51,445527844.0,19235,Technology
DVLT,Datavault AI Inc. Common Stock,0.7651,444810911.0,63838211,Technology
BMRC,Bank of Marin Bancorp Common Stock,27.61,444374280.0,102762,Finance
VSTM,Verastem Inc. Common Stock,6.65,444060440.0,1141241,Health Care
VNDA,Vanda Pharmaceuticals Inc. Common Stock,7.51,443815691.0,619973,Health Care
WTBA,West Bancorporation Common Stock,26.19,443679159.0,74922,Finance
MGRD,Affiliated Managers Group Inc. 4.200% Junior Subordinated Notes due 2061,15.56,442091700.0,6923,Finance
VHI,Valhi Inc. Common Stock,15.6,441515771.0,15224,Basic Materials
ANGO,AngioDynamics Inc. Common Stock,10.67,439789509.0,370725,Health Care
EVN,Eaton Vance Municipal Income Trust Common Stock,11.07,439115494.0,42447,Finance
LENZ,LENZ Therapeutics Inc. Common Stock,14.01,438372466.0,1346820,Health Care
PRAA,PRA Group Inc. Common Stock,11.23,438143414.0,396873,Finance
TITN,Titan Machinery Inc. Common Stock,18.7,437022254.0,114284,Consumer Discretionary
KOPN,Kopin Corporation Common Stock,2.36,436023284.0,2009515,Technology
SGU,Star Group L.P. Common Stock,13.23,434989898.0,20586,Consumer Discretionary
HQL,abrdn Life Sciences Investors Shares of Beneficial Interest,16.93,434756237.0,130562,Finance
CYH,Community Health Systems Inc. Common Stock,3.13,433566395.0,1378621,Health Care
HVT,Haverty Furniture Companies Inc. Common Stock,26.58,432372262.0,54433,Consumer Discretionary
OSPN,OneSpan Inc. Common Stock,11.35,431607846.0,969035,Technology
CYRX,CryoPort Inc. Common Stock,8.61,431093263.0,330262,Health Care
CCSI,Consensus Cloud Solutions Inc. Common Stock,22.68,431050977.0,268182,Technology
MEC,Mayville Engineering Company Inc. Common Stock,21.21,430952628.0,139371,Industrials
FRBA,First Bank Common Stock,17.145,430929339.0,63529,Finance
EB,Eventbrite Inc. Class A Common Stock,4.41,430747438.0,906694,Technology
CTGO,Contango ORE Inc. Common Stock,28.67,429019256.0,254748,Basic Materials
GLAD,Gladstone Capital Corporation Common Stock,18.9,427009004.0,243147,Consumer Discretionary
BSVN,Bank7 Corp. Common stock,45.06,425969753.0,5479,Finance
PRTC,PureTech Health plc American Depositary Shares,17.609,425581426.0,556,Health Care
ASMB,Assembly Biosciences Inc. Common Stock,26.9,425481066.0,69864,Health Care
DMAC,DiaMedica Therapeutics Inc. Common Stock,8.14,423910353.0,112028,Health Care
ZUMZ,Zumiez Inc. Common Stock,25.01,423908946.0,127309,Consumer Discretionary
HCKT,Hackett Group Inc (The). Common Stock,15.62,423783330.0,184046,Consumer Discretionary
CAL,Caleres Inc. Common Stock,12.47,422677658.0,440317,Consumer Discretionary
GBLI,Global Indemnity Group LLC Class A Common Stock ,29.27,419262134.0,10029,Finance
KIDS,OrthoPediatrics Corp. Common Stock,16.71,419042184.0,129025,Health Care
CERS,Cerus Corporation Common Stock,2.18,418750752.0,698504,Technology
HPP,Hudson Pacific Properties Inc. Common Stock,7.72,418558382.0,1602670,Finance
OPAL,OPAL Fuels Inc. Class A Common Stock,2.41,417882466.0,129772,Utilities
ABSI,Absci Corporation Common Stock,2.76,415025426.0,2631865,Health Care
CZNC,Citizens & Northern Corp Common Stock,23.31,414961660.0,42048,Finance
MCI,Barings Corporate Investors Common Stock,20.44,414149536.0,17348,Finance
NATH,Nathan's Famous Inc. Common Stock,100.92,413207353.0,41906,Consumer Discretionary
ISTR,Investar Holding Corporation Common Stock,29.96,412422439.0,112403,Finance
GLSI,Greenwich LifeSciences Inc. Common Stock,29.73,411895444.0,175867,Health Care
GCBC,Greene County Bancorp Inc. Common Stock,24.19,411878969.0,5192,Finance
DDT,Dillard's Capital Trust I,26.2777,410272837.0,6712,Consumer Discretionary
XPOF,Xponential Fitness Inc. Class A Common Stock,8.38,409840660.0,147013,Consumer Discretionary
SAJ,Saratoga Investment Corp 8.00% Notes due 2027,26.0968,408888081.0,5293,Finance
VKI,Invesco Advantage Municipal Income Trust II Common Shares of Beneficial Interest (DE),9.18,407647264.0,211726,Finance
LAND,Gladstone Land Corporation Common Stock,10.93,407326485.0,644429,Real Estate
NAGE,Niagen Bioscience Inc. Common Stock,5.1,407011309.0,881641,Health Care
TCPC,BlackRock TCP Capital Corp. Common Stock,4.79,406388567.0,762695,Finance
BGS,B&G Foods Inc. Common Stock,5.08,406283414.0,2367095,Consumer Staples
BAND,Bandwidth Inc. Class A Common Stock,13.29,405631811.0,171545,Technology
LEO,BNY Mellon Strategic Municipals Inc. Common Stock,6.51,405513460.0,216857,Finance
PDLB,Ponce Financial Group Inc. Common Stock,16.87,404898979.0,64756,Finance
SRTA,Strata Critical Medical Inc. Class A Common Stock,4.68,404195342.0,439967,Consumer Discretionary
BNTC,Benitec Biopharma Inc. Common Stock,11.79,403865354.0,300229,Health Care
JACK,Jack In The Box Inc. Common Stock,21.36,403636161.0,446736,Consumer Discretionary
TRDA,Entrada Therapeutics Inc. Common Stock,10.55,403212898.0,146694,Health Care
SAZ,Saratoga Investment Corp 8.50% Notes due 2028,25.68,402357604.0,4616,Finance
MCFT,MasterCraft Boat Holdings Inc. Common Stock,24.66,401585733.0,149571,Industrials
SOR,Source Capital Inc. Cmn Shs of BI,48.11,401453077.0,18963,Finance
ENTA,Enanta Pharmaceuticals Inc. Common Stock,13.83,401326159.0,220999,Health Care
NC,NACCO Industries Inc. Common Stock,53.79,401270979.0,12362,Energy
SAY,Saratoga Investment Corp 8.125% Notes due 2027,25.6,401104154.0,12771,Finance
CLPT,ClearPoint Neuro Inc. Common Stock,14.11,401052876.0,437745,Health Care
CDZI,CADIZ Inc. Common Stock,4.82,400590581.0,611547,Utilities
ACTG,Acacia Research Corporation (Acacia Tech) Common Stock,4.15,400310569.0,199678,Miscellaneous
