symbol,name,price,marketCap,volume,industry
CRK,Comstock Resources Inc. Common Stock,14.11,4144048190.0,2062382,Energy
SMR,NuScale Power Corporation Class A Common Stock,11.33,4140901497.0,30832532,Industrials
SLM,SLM Corporation Common Stock,21.95,4139616240.0,1632133,Finance
KNSA,Kiniksa Pharmaceuticals International plc Class A Ordinary Shares,53.65,4127724558.0,767625,Health Care
COLD,Americold Realty Trust Inc. Common Stock,14.44,4119819391.0,2226249,Real Estate
SKT,Tanger Inc. Common Stock,35.8,4112555466.0,772129,Real Estate
REGCO,Regency Centers Corporation 5.875% Series B Cumulative Redeemable Preferred Stock,22.42,4105030032.0,1351,Real Estate
AZZ,AZZ Inc.,137.07,4095693955.0,176936,Industrials
FULT,Fulton Financial Corporation Common Stock,21.4,4090258740.0,1253014,Finance
FHI,Federated Hermes Inc. Common Stock,53.86,4088655491.0,698539,Finance
BDC,Belden Inc Common Stock,104.79,4080945952.0,517691,Industrials
TNL,Travel   Leisure Co. Common  Stock,65.27,4074258876.0,681189,Consumer Discretionary
VNT,Vontier Corporation Common Stock ,28.92,4071936000.0,2413163,Industrials
KBR,KBR Inc. Common Stock,32.1,4069957620.0,1180770,Industrials
PDI,PIMCO Dynamic Income Fund Common Stock,16.69,4057172100.0,2082476,Finance
CLSK,CleanSpark Inc. Common Stock,15.76,4044151631.0,20583724,Finance
CBT,Cabot Corporation Common Stock,78.34,4044021808.0,418082,Industrials
TREX,Trex Company Inc. Common Stock,38.87,4038543596.0,1381324,Basic Materials
TDW,Tidewater Inc. Common Stock,81.2,4038128942.0,709414,Consumer Discretionary
EE,Excelerate Energy Inc. Class A Common Stock,35.29,4018091803.0,222106,Utilities
RXO,RXO Inc. Common Stock,24.36,4017458800.0,4157465,Consumer Discretionary
VSCO,Victorias Secret & Co. Common Stock ,50.55,4014967517.0,2704667,Consumer Discretionary
SLGN,Silgan Holdings Inc. Common Stock,37.99,4014774006.0,696933,Industrials
PLNT,Planet Fitness Inc. Common Stock,50.48,4010271383.0,2754726,Consumer Discretionary
ENVA,Enova International Inc. Common Stock,160.91,4004228615.0,181596,Finance
PVH,PVH Corp. Common Stock,86.71,3995080615.0,892132,Industrials
BRC,Brady Corporation Common Stock,84.56,3983857522.0,261883,Consumer Discretionary
UCB,United Community Banks Inc. Common Stock,33.28,3983171479.0,572964,Finance
THO,Thor Industries Inc. Common Stock,75.52,3972044860.0,889123,Industrials
KRC,Kilroy Realty Corporation Common Stock,34.14,3969758471.0,1209012,Real Estate
BLLN,BillionToOne Inc. Class A Common Stock,86.15,3962510947.0,725433,Health Care
AMRX,Amneal Pharmaceuticals Inc. Class A Common Stock,12.42,3962263077.0,1653633,Health Care
HP,Helmerich & Payne Inc. Common Stock,39.61,3958265009.0,914119,Energy
IRT,Independence Realty Trust Inc. Common Stock,16.79,3957649511.0,3061580,Real Estate
ATMU,Atmus Filtration Technologies Inc. Common Stock,48.43,3955395688.0,912042,Consumer Discretionary
TPC,Tutor Perini Corporation Common Stock,74.88,3939788961.0,489191,Consumer Discretionary
UNMA,Unum Group 6.250% Junior Subordinated Notes due 2058,23.09,3932532712.0,9241,Finance
MWA,MUELLER WATER PRODUCTS Common Stock,25.12,3930553504.0,1445855,Industrials
POWI,Power Integrations Inc. Common Stock,70.48,3927144472.0,1035302,Technology
BNL,Broadstone Net Lease Inc. Common Stock,20.41,3913955388.0,2047388,Real Estate
CRNX,Crinetics Pharmaceuticals Inc. Common Stock,37.09,3910777315.0,740812,Health Care
HGV,Hilton Grand Vacations Inc. Common Stock ,48.97,3906036665.0,696025,Consumer Discretionary
GFF,Griffon Corporation Common Stock,84.64,3882151648.0,291577,Industrials
IRTC,iRhythm Holdings Inc. Common Stock,117.87,3873492031.0,234236,Health Care
FRMI,Fermi Inc. Common Stock,6.06,3863699888.0,12179987,Real Estate
HHH,Howard Hughes Holdings Inc. Common Stock,64.52,3846978482.0,295914,Real Estate
SKY,Champion Homes Inc. Common Stock,69.55,3846255561.0,935302,Consumer Discretionary
NVST,Envista Holdings Corporation Common Stock,23.63,3845260820.0,3594178,Health Care
OII,Oceaneering International Inc. Common Stock,38.48,3838197182.0,607163,Energy
CATY,Cathay General Bancorp Common Stock,57.25,3837780944.0,359199,Finance
KTB,Kontoor Brands Inc. Common Stock ,69.38,3834796267.0,1224173,Industrials
CPRX,Catalyst Pharmaceuticals Inc. Common Stock,31.28,3828077430.0,2344031,Health Care
CVCO,Cavco Industries Inc. Common Stock When Issued,491.49,3814534003.0,132290,Consumer Discretionary
GPI,Group 1 Automotive Inc. Common Stock,320.11,3808730561.0,257965,Consumer Discretionary
INDB,Independent Bank Corp. Common Stock,78.66,3801410473.0,298292,Finance
RNST,Renasant Corporation Common Stock,41.17,3798843180.0,816099,Finance
MMSI,Merit Medical Systems Inc. Common Stock,63.63,3795838424.0,444659,Health Care
PII,Polaris Inc. Common Stock,66.27,3769846287.0,1433107,Consumer Discretionary
HGTY,Hagerty Inc. Class A Common Stock,10.95,3759730702.0,113104,Finance
BANF,BancFirst Corporation Common Stock,111.31,3738500737.0,78069,Finance
ASBA,Associated Banc-Corp 6.625% Fixed-Rate Reset Subordinated Notes due 2033,24.75,3734795171.0,8042,Finance
WSFS,WSFS Financial Corporation Common Stock,71.69,3731037658.0,308448,Finance
LRN,Stride Inc. Common Stock,87.65,3727302226.0,417756,Real Estate
FLNC,Fluence Energy Inc. Class A Common Stock,20.19,3720618995.0,7025962,Miscellaneous
OPLN,OPENLANE Inc. Common Stock,35.05,3713411015.0,1125160,Consumer Discretionary
NHI,National Health Investors Inc. Common Stock,76.55,3710461097.0,318416,Real Estate
CNS,Cohen & Steers Inc Common Stock,72.15,3708070534.0,257163,Finance
STUB,StubHub Holdings Inc. Class A Common Stock,9.84,3694303042.0,8049912,Consumer Discretionary
CII,BlackRock Enhanced Large Cap Core Fund Inc. Common Stock,24.79,3687821656.0,63471,Finance
BETA,Beta Technologies Inc. Class A Common Stock,15.97,3685173623.0,1453542,Industrials
JOE,St. Joe Company (The) Common Stock,64.03,3675946036.0,128800,Real Estate
AMBA,Ambarella Inc. Ordinary Shares,83.64,3668574522.0,649604,Technology
DAN,Dana Incorporated Common Stock ,33.86,3664860768.0,838574,Consumer Discretionary
TWST,Twist Bioscience Corporation Common Stock,58.835,3663732759.0,2027403,Health Care
CDP,COPT Defense Properties Common Shares of Beneficial Interest,32.31,3663207090.0,1528004,Real Estate
FG,F&G Annuities & Life Inc. Common Stock,27.59,3655260874.0,783924,Finance
ACAD,ACADIA Pharmaceuticals Inc. Common Stock,21.32,3650748748.0,1664517,Health Care
CALM,Cal-Maine Foods Inc. Common Stock,76.92,3644207149.0,597409,Consumer Staples
OTTR,Otter Tail Corporation Common Stock,86.67,3638766281.0,159023,Utilities
BILL,BILL Holdings Inc. Common Stock,36.45,3630300699.0,2663330,Technology
ITRI,Itron Inc. Common Stock,81.85,3629175552.0,655593,Industrials
KAI,Kadant Inc Common Stock,306.9,3624016988.0,92063,Industrials
WAY,Waystar Holding Corp. Common Stock,18.835,3612795802.0,1495024,Technology
WING,Wingstop Inc. Common Stock,132.65,3612398155.0,1148503,Consumer Discretionary
UCTT,Ultra Clean Holdings Inc. Common Stock,80.58,3612268604.0,530102,Technology
RGTIW,Rigetti Computing Inc. Warrants,10.865,3611513038.0,1158489,Technology
ERAS,Erasca Inc. Common Stock,11.605,3608975610.0,3109645,Health Care
VCYT,Veracyte Inc. Common Stock,45.19,3605829718.0,1114961,Health Care
BHF,Brighthouse Financial Inc. Common Stock,62.71,3602425177.0,622478,Finance
SOUN,SoundHound AI Inc Class A Common Stock,8.32,3600643363.0,23231685,Technology
CVBF,CVB Financial Corporation Common Stock,20.32,3585569583.0,2202290,Finance
FULTP,Fulton Financial Corporation Depositary Shares Each Representing a 1/40th Interest in a Share of Fixed Rate Non-Cumulative Perpetual Preferred Stock Series A,18.69,3572286722.0,3938,Finance
AB,AllianceBernstein Holding L.P.  Units,38.17,3565225069.0,376272,Finance
VKTX,Viking Therapeutics Inc. Common Stock,30.68,3562121127.0,2004743,Health Care
QLYS,Qualys Inc. Common Stock,100.85,3558991357.0,665922,Technology
BFAM,Bright Horizons Family Solutions Inc. Common Stock,67.55,3553580896.0,812410,Consumer Discretionary
DORM,Dorman Products Inc. Common Stock,118.7,3547087054.0,206557,Consumer Discretionary
SEZL,Sezzle Inc. Common Stock,105.45,3545969154.0,400794,Finance
DOCS,Doximity Inc. Class A Common Stock,19.39,3545888991.0,3779725,Technology
GNW,Genworth Financial Inc Common Stock,9.25,3542835618.0,2317905,Finance
RNG,RingCentral Inc. Class A Common Stock,42.22,3540510261.0,1760543,Technology
ORKA,Oruka Therapeutics Inc. Common Stock,58.69,3539717208.0,1288097,Health Care
AAP,Advance Auto Parts Inc.,58.62,3536498173.0,8649166,Consumer Discretionary
BOX,Box Inc. Class A Common Stock,25.4,3531428904.0,1468547,Technology
OGN,Organon & Co. Common Stock ,13.42,3524103568.0,3498706,Health Care
VECO,Veeco Instruments Inc. Common Stock,57.74,3524073424.0,920017,Technology
VRNS,Varonis Systems Inc. Common Stock,30.66,3520201839.0,1655649,Technology
EWTX,Edgewise Therapeutics Inc. Common Stock,32.69,3517215366.0,639860,Health Care
BULL,Webull Corporation Class A Ordinary Shares,6.61,3515321376.0,33988716,Finance
RUM,Rumble Inc. Class A Common Stock,8.06,3513181427.0,2870478,Technology
BMI,Badger Meter Inc. Common Stock,120.24,3509272937.0,460900,Industrials
DTB,DTE Energy Company 2020 Series G 4.375% Junior Subordinated Debentures due 2080,16.8,3494875658.0,13684,Utilities
BBWI,Bath & Body Works Inc.,17.32,3487945212.0,5071007,Consumer Discretionary
LEU,Centrus Energy Corp. Class A Common Stock,177.15,3485035457.0,807593,Industrials
DTG,DTE Energy Company 2021 Series E 4.375% Junior Subordinated Debentures,16.74,3482393960.0,90999,Utilities
GPGI,GPGI Inc. Class A Common Stock,11.96,3466737955.0,1993203,Finance
BFH,Bread Financial Holdings Inc. Common Stock,85.78,3466118036.0,569048,Consumer Discretionary
NTRSO,Northern Trust Corporation Depositary Shares Each Representing a 1/1000th Interest in a Share of Series E Non-Cumulative Perpetual Preferred Stock,18.69,3458533252.0,30815,Finance
KFY,Korn Ferry Common Stock,66.64,3457755478.0,300188,Consumer Discretionary
FOUR,Shift4 Payments Inc. Class A Common Stock,43.53,3453188062.0,1225435,Consumer Discretionary
SMG,Scotts Miracle-Gro Company (The) Common Stock,59.33,3451934322.0,965379,Industrials
ABG,Asbury Automotive Group Inc Common Stock,185.38,3451553144.0,262409,Consumer Discretionary
RUN,Sunrun Inc. Common Stock,14.445,3445844451.0,8254655,Miscellaneous
BATRA,Atlanta Braves Holdings Inc. Series A Common Stock,53.49,3431052985.0,61998,Consumer Discretionary
OSIS,OSI Systems Inc. Common Stock (DE),207.86,3426133515.0,351045,Technology
APLE,Apple Hospitality REIT Inc. Common Shares,14.51,3425340209.0,1584778,Real Estate
ANF,Abercrombie & Fitch Company Common Stock,76.49,3422049777.0,1263973,Consumer Discretionary
FIBK,First Interstate BancSystem Inc. Common Stock (DE),35.2,3419429341.0,815118,Finance
NAN,Nuveen New York Quality Municipal Income Fund Common Stock,11.25,3401052750.0,41340,Finance
ALHC,Alignment Healthcare Inc. Common Stock,16.37,3384232683.0,3201258,Health Care
AVA,Avista Corporation Common Stock,40.92,3381564556.0,777026,Utilities
OPCH,Option Care Health Inc. Common Stock,21.52,3379231886.0,2786291,Health Care
GBDC,Golub Capital BDC Inc. Common Stock,12.97,3378622498.0,1004861,Finance
BKU,BankUnited Inc. Common Stock,46.33,3367343810.0,477957,Finance
SKYW,SkyWest Inc. Common Stock,84.75,3361208815.0,295592,Consumer Discretionary
WOLF,Wolfspeed Inc. Common Stock New,69.5,3359566130.0,9321404,Technology
YETI,YETI Holdings Inc. Common Stock,43.99,3332608629.0,1726433,Consumer Discretionary
WSBC,WesBanco Inc. Common Stock,34.62,3329770987.0,717297,Finance
CBU,Community Financial System Inc. Common Stock,63.16,3319369316.0,247314,Finance
FHB,First Hawaiian Inc. Common Stock,27.27,3317367494.0,1371240,Finance
FIZZ,National Beverage Corp. Common Stock,35.39,3313640090.0,261251,Consumer Staples
BELFB,Bel Fuse Inc. Class B Common Stock,260.4,3312992903.0,308542,Uncategorized
MCHB,Mechanics Bancorp Class A Common Stock,14.96,3312160157.0,546159,Finance
NATL,NCR Atleos Corporation Common Stock,44.82,3306811398.0,351466,Miscellaneous
NSA,National Storage Affiliates Trust Common Shares of Beneficial Interest,42.78,3303152162.0,546667,Real Estate
MHO,M/I Homes Inc. Common Stock,128.96,3300100457.0,199554,Consumer Discretionary
ASO,Academy Sports and Outdoors Inc. Common Stock,51.03,3291850078.0,1006295,Consumer Discretionary
MMED,MiniMed Group Inc. Common Stock,11.72,3291210259.0,617890,Health Care
ICUI,ICU Medical Inc. Common Stock,131.31,3281907646.0,276406,Health Care
MSGE,Madison Square Garden Entertainment Corp. Class A Common Stock,69.37,3281564083.0,375891,Consumer Discretionary
CON,Concentra Group Holdings Parent Inc. Common Stock,25.59,3274541950.0,613699,Health Care
LIF,Life360 Inc. Common Stock,40.03,3243698591.0,535627,Technology
MMS,Maximus Inc. Common Stock,61.39,3225452885.0,613853,Consumer Discretionary
CC,Chemours Company (The) Common Stock,21.44,3224098081.0,3318856,Industrials
FFBC,First Financial Bancorp. Common Stock,30.68,3219233194.0,971466,Finance
INOD,Innodata Inc. Common Stock,98.53,3217532424.0,1829943,Technology
GPOR,Gulfport Energy Corporation Common Shares,179.05,3217464221.0,309064,Energy
CSQ,Calamos Strategic Total Return Common Stock,20.2,3209529964.0,392954,Finance
BATRK,Atlanta Braves Holdings Inc. Series C Common Stock,50.01,3207832488.0,236711,Consumer Discretionary
RWTN,Redwood Trust Inc. 9.125% Senior Notes Due 2029,24.78,3202157438.0,16024,Real Estate
CVI,CVR Energy Inc. Common Stock,31.84,3200894272.0,745185,Energy
BKD,Brookdale Senior Living Inc. Common Stock,13.38,3195007470.0,2802900,Health Care
ARLP,Alliance Resource Partners L.P. Common Units representing Limited Partners Interests,24.83,3194598029.0,334882,Energy
HWKN,Hawkins Inc. Common Stock,152.63,3185109703.0,188295,Consumer Discretionary
CHEF,The Chefs' Warehouse Inc. Common Stock,78.08,3183917272.0,550472,Consumer Discretionary
RWTO,Redwood Trust Inc. 9.00% Senior Notes Due 2029,24.44,3158221460.0,2546,Real Estate
FGN,F&G Annuities & Life Inc. 7.950% Senior Notes due 2053,25.01,3153724685.0,28852,Finance
CRVL,CorVel Corp. Common Stock,61.54,3147920973.0,292720,Finance
COLM,Columbia Sportswear Company Common Stock,61.37,3138510405.0,459533,Consumer Discretionary
ELF,e.l.f. Beauty Inc. Common Stock,53.12,3136854936.0,9799848,Consumer Discretionary
TXG,10x Genomics Inc. Class A Common Stock,24.68,3133278745.0,4060731,Industrials
AVNT,Avient Corporation Common Stock,34.12,3129150898.0,730702,Industrials
LBRDP,Liberty Broadband Corporation Series A Cumulative Redeemable Preferred Stock,21.7999,3128236164.0,9088,Telecommunications
TNGX,Tango Therapeutics Inc.,21.62,3127289371.0,2578597,Health Care
EXTR,Extreme Networks Inc. Common Stock,23.9,3125596303.0,1458403,Telecommunications
BKV,BKV Corporation Common Stock,28.55,3122987744.0,679825,Energy
PTRN,Pattern Group Inc. Series A Common Stock,17.61,3114611757.0,746262,Consumer Discretionary
CNK,Cinemark Holdings Inc Cinemark Holdings Inc. Common Stock,26.6,3106554389.0,1278519,Consumer Discretionary
SFNC,Simmons First National Corporation Class A Common Stock,21.34,3095670220.0,974609,Finance
BOH,Bank of Hawaii Corporation Common Stock,78.12,3095193848.0,328995,Finance
MZTI,The Marzetti Company Common Stock,112.77,3092378940.0,322233,Consumer Staples
GEO,Geo Group Inc (The) REIT,23.11,3087918543.0,1465263,Consumer Discretionary
DAVE,Dave Inc. Class A Common Stock,240.9,3086740351.0,428547,Finance
MPT,Medical Properties Trust Inc. common stock,5.16,3086196000.0,3447241,Real Estate
TDC,Teradata Corporation Common Stock,32.77,3083657000.0,2109117,Technology
FUL,H. B. Fuller Company Common Stock,56.37,3071448763.0,1165181,Industrials
LXP,LXP Industrial Trust Common Stock (Maryland REIT),51.99,3064941099.0,224146,Real Estate
DNLI,Denali Therapeutics Inc. Common Stock,19.3,3063097924.0,1351571,Health Care
IAC,IAC Inc. Common Stock,41.17,3062226823.0,895542,Technology
NHC,National HealthCare Corporation Common Stock,196.0,3061449636.0,148930,Health Care
FSK,FS KKR Capital Corp. Common Stock,10.93,3061126113.0,3252234,Finance
PRK,Park National Corporation Common Stock,169.05,3059143845.0,56203,Finance
SXI,Standex International Corporation Common Stock,252.36,3057321716.0,114395,Industrials
ITGR,Integer Holdings Corporation Common Stock,90.0,3055935510.0,532278,Health Care
RDW,Redwire Corporation Common Stock,15.35,3053402475.0,44693414,Industrials
CPK,Chesapeake Utilities Corporation Common Stock,127.02,3049084742.0,115349,Utilities
PLMR,Palomar Holdings Inc. Common stock,115.0,3047945165.0,192929,Finance
TR,Tootsie Roll Industries Inc. Common Stock,40.54,3047439678.0,83526,Consumer Staples
CTRI,Centuri Holdings Inc. Common Stock,30.18,3046208099.0,1066870,Utilities
HYMC,Hycroft Mining Holding Corporation Class A Common Stock,33.29,3041394407.0,2192254,Basic Materials
USLM,United States Lime & Minerals Inc. Common Stock,105.88,3036856089.0,172774,Industrials
BXMT,Blackstone Mortgage Trust Inc. Common Stock,17.98,3032929690.0,2563394,Real Estate
UNFI,United Natural Foods Inc. Common Stock,49.9,3031523054.0,474111,Consumer Discretionary
CURB,Curbline Properties Corp. Common Stock,28.69,3027923779.0,507534,Finance
SLG,SL Green Realty Corp Common Stock,42.53,3024924262.0,563409,Real Estate
NIC,Nicolet Bankshares Inc. Common Stock,142.31,3024358601.0,145580,Finance
SHOO,Steven Madden Ltd. Common Stock,41.35,3022082779.0,1016377,Consumer Discretionary
KN,Knowles Corporation Common Stock,35.23,3014302052.0,663631,Consumer Staples
PLAB,Photronics Inc. Common Stock,51.06,3010824078.0,1065459,Technology
CAKE,Cheesecake Factory Incorporated (The) Common Stock,60.57,3009442437.0,734396,Consumer Discretionary
APAM,Artisan Partners Asset Management Inc. Class A Common Stock,37.12,3008864125.0,806772,Finance
KBH,KB Home Common Stock,48.02,3008368773.0,911951,Consumer Discretionary
WRBY,Warby Parker Inc. Class A Common Stock,24.5,3006523282.0,2049160,Health Care
BELFA,Bel Fuse Inc. Class A Common Stock,236.1,3003831123.0,123090,Uncategorized
CWK,Cushman & Wakefield Ltd. Common Shares,12.82,3003732474.0,3031717,Finance
RCUS,Arcus Biosciences Inc. Common Stock,23.87,3002205377.0,405618,Health Care
AWR,American States Water Company Common Stock,76.29,2990007497.0,264132,Utilities
BTU,Peabody Energy Corporation Common Stock ,24.41,2973968648.0,3763127,Energy
GPK,Graphic Packaging Holding Company,10.04,2970709365.0,4663543,Consumer Discretionary
PATK,Patrick Industries Inc. Common Stock,90.21,2967297647.0,708373,Consumer Discretionary
SBCF,Seacoast Banking Corporation of Florida Common Stock,30.5,2966026546.0,655215,Finance
HAYW,Hayward Holdings Inc. Common Stock,13.67,2965884101.0,2214876,Industrials
OLN,Olin Corporation Common Stock,26.02,2963619949.0,1557773,Industrials
BHE,Benchmark Electronics Inc. Common Stock,82.44,2957702848.0,469924,Technology
GEF,Greif Inc. Class A Common Stock,64.1,2957337279.0,197853,Uncategorized
VC,Visteon Corporation Common Stock,110.75,2956362826.0,429581,Consumer Discretionary
BSM,Black Stone Minerals L.P. Common units representing limited partner interests,13.9,2953740701.0,237279,Energy
PAY,Paymentus Holdings Inc. Class A Common Stock,23.48,2953533633.0,932093,Consumer Discretionary
WT,WisdomTree Inc. Common Stock,19.18,2933413501.0,1795466,Finance
AEHR,Aehr Test Systems Common Stock,91.3,2931100495.0,1987325,Industrials
IPAR,Interparfums Inc. Common Stock,91.16,2919470196.0,260571,Consumer Discretionary
NN,NextNav Inc. Common Stock,21.38,2917021756.0,1842211,Industrials
AKR,Acadia Realty Trust Common Stock,21.82,2913344017.0,1588611,Real Estate
GRAL,GRAIL Inc. Common Stock ,67.86,2912320001.0,502596,Health Care
ADEA,Adeia Inc. Common Stock,26.36,2907343224.0,1224569,Technology
PFS,Provident Financial Services Inc Common Stock,22.3,2905995220.0,1070424,Finance
BWIN,The Baldwin Insurance Group Inc. Class A Common Stock,20.37,2904102521.0,891635,Finance
POWWP,Outdoor Holding Company 8.75% Series A Cumulative Redeemable Perpetual Preferred Stock,24.745,2902309426.0,1746,Industrials
PARR,Par Pacific Holdings Inc.  Common Stock,57.8,2898339211.0,1381916,Energy
QTWO,Q2 Holdings Inc. Common Stock,46.29,2897773581.0,486326,Technology
HTGC,Hercules Capital Inc. Common Stock,15.47,2894724587.0,2489173,Finance
CECO,CECO Environmental Corp. Common Stock,80.68,2894236141.0,409966,Industrials
LFST,LifeStance Health Group Inc. Common Stock,7.46,2893244863.0,2055158,Health Care
BANC,Banc of California Inc. Common Stock,18.81,2891563243.0,1975184,Finance
DYN,Dyne Therapeutics Inc. Common Stock,17.37,2871500637.0,1773524,Health Care
GRBK,Green Brick Partners Inc. Common Stock,66.53,2870522208.0,286279,Consumer Discretionary
NMIH,NMI Holdings Inc. Common Stock,37.76,2868698604.0,494924,Finance
SUPN,Supernus Pharmaceuticals Inc. Common Stock,49.38,2866001423.0,529477,Health Care
CLMT,Calumet Inc. Common Stock,32.87,2864526722.0,719510,Energy
ATRO,Astronics Corporation Common Stock,79.89,2863285961.0,703978,Industrials
DBRG,DigitalBridge Group Inc.,15.7,2863246397.0,2822924,Real Estate
CALY,Callaway Golf Company Common Stock,15.88,2854550100.0,2863760,Consumer Discretionary
PRVA,Privia Health Group Inc. Common Stock,22.64,2852920147.0,671697,Health Care
BRZE,Braze Inc. Class A Common Stock,23.41,2849742655.0,2669742,Technology
BEAM,Beam Therapeutics Inc. Common Stock,27.67,2846667851.0,1980839,Health Care
ALMS,Alumis Inc. Common Stock,22.17,2826497197.0,874194,Health Care
NSIT,Insight Enterprises Inc. Common Stock,93.57,2826180514.0,435388,Consumer Discretionary
UE,Urban Edge Properties Common Shares of Beneficial Interest,22.38,2820327466.0,1137339,Finance
NTCT,NetScout Systems Inc. Common Stock,39.44,2819771280.0,487410,Technology
HIW,Highwoods Properties Inc. Common Stock,25.55,2817467408.0,1256106,Real Estate
HAE,Haemonetics Corporation Common Stock,61.94,2814924187.0,1182675,Health Care
ZIONP,Zions Bancorporation N.A. Depositary Shares (Each representing 1/40th Interest in a Share of Series A Floating-Rate Non-Cumulative Perpetual Preferred Stock),19.11,2810924623.0,6218,Finance
WK,Workiva Inc. Class A Common Stock,50.02,2807089187.0,1086150,Technology
GIGGU,GigCapital7 Corp. Unit,17.99,2803333127.0,63927,Technology
WHR,Whirlpool Corporation Common Stock,43.21,2801007058.0,2763743,Consumer Discretionary
BW,Babcock & Wilcox Enterprises Inc. Common Stock,20.54,2797804771.0,2528627,Industrials
MGEE,MGE Energy Inc,75.99,2793120508.0,418943,Energy
RHI,Robert Half Inc. Common Stock,27.18,2780339749.0,1694847,Consumer Discretionary
WDFC,WD-40 Company Common Stock,206.49,2778405959.0,94629,Industrials
TENB,Tenable Holdings Inc. Common Stock,25.17,2775545560.0,5016510,Technology
EOSE,Eos Energy Enterprises Inc. Class A Common Stock,8.17,2773829601.0,34066256,Miscellaneous
AEO,American Eagle Outfitters Inc. Common Stock,16.55,2772533222.0,5808356,Consumer Discretionary
ARCB,ArcBest Corporation Common Stock,124.41,2769836870.0,227191,Industrials
FTAIM,FTAI Aviation Ltd. 9.500% Fixed-Rate Reset Series D Cumulative Perpetual Redeemable Preferred Shares,27.0,2769740244.0,1982,Industrials
EXPO,Exponent Inc. Common Stock,57.06,2768073551.0,358417,Consumer Discretionary
KALU,Kaiser Aluminum Corporation Common Stock,169.38,2767771844.0,185578,Industrials
DX,Dynex Capital Inc. Common Stock,12.85,2764689155.0,6217824,Real Estate
UPST,Upstart Holdings Inc. Common stock,28.85,2761278766.0,3814622,Finance
GPCR,Structure Therapeutics Inc. American Depositary Shares,38.79,2756980476.0,500381,Health Care
DKL,Delek Logistics Partners L.P. Common Units representing Limited Partner Interests,51.79,2753581285.0,23878,Energy
FCPT,Four Corners Property Trust Inc. Common Stock,24.99,2742632433.0,936770,Real Estate
PHIN,PHINIA Inc. Common Stock,73.82,2732857592.0,255685,Consumer Discretionary
TARS,Tarsus Pharmaceuticals Inc. Common Stock,63.48,2731160917.0,293744,Health Care
TRN,Trinity Industries Inc. Common Stock,34.3,2727038753.0,503298,Industrials
KD,Kyndryl Holdings Inc. Common Stock,12.07,2721147607.0,3919321,Technology
WTTR,Select Water Solutions Inc. Class A common stock,19.64,2713164108.0,2062527,Energy
FBK,FB Financial Corporation Common Stock,52.59,2709618867.0,325715,Finance
UNIT,Uniti Group Inc. Common Stock,11.12,2700110050.0,1316155,Real Estate
MGRC,McGrath RentCorp Common Stock,109.68,2693934934.0,188746,Consumer Discretionary
SHAK,Shake Shack Inc. Class A Common Stock,62.83,2687962964.0,1983787,Consumer Discretionary
WOR,Worthington Enterprises Inc. Common Shares,54.54,2686258293.0,153910,Industrials
VISN,Vistance Networks Inc. Common Stock,11.9,2684278609.0,4422319,Technology
KMT,Kennametal Inc. Common Stock,35.22,2684119828.0,1308146,Industrials
NMFCZ,New Mountain Finance Corporation 8.250% Notes due 2028,25.17,2677105388.0,8348,Uncategorized
CCC,CCC Intelligent Solutions Holdings Inc. Common Stock,4.54,2664710033.0,7155478,Technology
WU,Western Union Company (The) Common Stock,8.5,2655698384.0,6474220,Consumer Discretionary
LCII,LCI Industries,109.18,2651458354.0,293208,Consumer Discretionary
NESR,National Energy Services Reunited Corp Ordinary Shares,26.29,2651274334.0,2151138,Energy
TALO,Talos Energy Inc. Common Stock,15.88,2650781990.0,2956663,Energy
RH,RH Common Stock,139.08,2628718953.0,1037009,Consumer Discretionary
ARQT,Arcutis Biotherapeutics Inc. Common Stock,21.01,2628001688.0,1428075,Health Care
WAFD,WaFd Inc. Common Stock,35.45,2619346616.0,460282,Finance
GDV,Gabelli Dividend & Income Trust Common Shares of Beneficial Interest,29.03,2618171894.0,134696,Finance
RLAY,Relay Therapeutics Inc. Common Stock,13.66,2617067014.0,10420573,Health Care
FTAIN,FTAI Aviation Ltd. 8.25% Fixed - Rate Reset Series C Cumulative Perpetual Redeemable Preferred Shares,25.43,2608684978.0,9972,Industrials
TRMK,Trustmark Corporation Common Stock,44.46,2605602620.0,301490,Finance
IMNM,Immunome Inc. Common Stock,22.96,2600229046.0,1586536,Health Care
IDYA,IDEAYA Biosciences Inc. Common Stock,29.54,2595411577.0,642492,Health Care
KLRA,Kailera Therapeutics Inc. Common Stock,21.08,2591760135.0,362124,Health Care
