symbol,name,price,marketCap,volume,industry
HWH,HWH International Inc. Common Stock,1.306,8458178.0,8502,Health Care
MGRX,Mangoceuticals Inc. Common Stock,0.519,8453886.0,1732707,Health Care
EVTV,Envirotech Vehicles Inc. Common Stock,1.75,8451651.0,722801,Consumer Discretionary
IMG,CIMG Inc. Common Stock,0.537,8314665.0,63414,Consumer Discretionary
ETS,Elite Express Holding Inc. Class A Common Stock,0.494,8258036.0,18004,Industrials
SQFTP,Presidio Property Trust Inc. 9.375% Series D Cumulative Redeemable Perpetual Preferred Stock $0.01 par value per share,5.7,8202864.0,9904,Real Estate
DSS,DSS Inc. Common Stock,0.8989,8173264.0,12350,Consumer Discretionary
IPDN,Professional Diversity Network Inc. Common Stock,1.67,8152878.0,225077,Technology
GRDX,GridAI Technologies Corp. Common Stock,2.42,8135805.0,231831,Health Care
CALC,CalciMedica Inc. Common Stock,0.552,7954006.0,143178,Health Care
ALZN,Alzamend Neuro Inc. Common Stock,2.08,7907336.0,48874,Health Care
XWEL,XWELL Inc. Common Stock,1.36,7842716.0,21459081,Consumer Discretionary
TGL,Treasure Global Inc. Common Stock,4.63,7758607.0,21547,Real Estate
KPRX,Kiora Pharmaceuticals Inc.  Common Stock,2.1,7723664.0,27243,Health Care
QNCX,Quince Therapeutics Inc. Common Stock,0.1385,7711886.0,30361939,Health Care
NWTG,Newton Golf Company Inc. Common Stock,1.62,7698990.0,8800,Consumer Discretionary
MKZR,MacKenzie Realty Capital Inc. Common Stock,3.9,7668960.0,21124,Real Estate
MYSE,Myseum Inc. Common Stock,1.79,7633149.0,5446,Telecommunications
WKHS,Workhorse Group Inc. Common Stock,3.5,7594188.0,61180,Industrials
BBGI,Beasley Broadcast Group Inc. Class A Common Stock,4.2,7576775.0,16480,Consumer Discretionary
CJMB,Callan JMB Inc. Common Stock,1.63,7535534.0,34621,Real Estate
MBIO,Mustang Bio Inc. Common Stock,1.03,7518059.0,18409,Health Care
CYCU,Cycurion Inc. Common Stock,1.78,7454973.0,88098,Technology
YHGJ,Yunhong Green CTI Ltd. Common Stock,2.65,7350737.0,2599,Industrials
ASBP,Aspire Biopharma Holdings Inc. Common Stock,1.45,7285006.0,185374,Health Care
KLTOW,Klotho Neurosciences Inc. Warrant,0.0975,7169830.0,27313,Health Care
LIMN,Liminatus Pharma Inc. Class A Common Stock,0.2299,7141759.0,1869668,
SCKT,Socket Mobile Inc. Common Stock,0.8951,7139731.0,44276,Technology
PMCB,PharmaCyte  Biotech Inc. Common Stock,0.704,7134449.0,66169,Health Care
TOVX,Theriva Biologics Inc. Common Stock,0.197,7030605.0,2234803,Health Care
DAIC,CID HoldCo Inc. Common Stock,0.24,7025597.0,416970,Technology
TCRT,Alaunos Therapeutics Inc. Common Stock,3.14,7007943.0,9818,Health Care
BKYI,BIO-key International Inc. Common Stock,0.6389,6923515.0,109055,Technology
RMSG,Real Messenger Corporation Ordinary Shares,0.718,6872180.0,67153,Technology
AGPU,Axe Compute Inc. Common Stock,2.02,6854902.0,109038,Health Care
NVNO,enVVeno Medical Corporation Common Stock,10.4,6818302.0,12190,Health Care
TULP,Bloomia Holdings Inc. Common Stock,3.83,6791046.0,5314,Consumer Staples
XPON,Expion360 Inc. Common Stock,0.6969,6729781.0,114115,Miscellaneous
IVF,INVO Fertility Inc. Common Stock,0.9578,6667337.0,212409,Health Care
MNTS,Momentus Inc. Class A Common Stock,4.76,6650572.0,326332,Industrials
MSS,Maison Solutions Inc. Class A Common Stock,0.261,6584939.0,434185,Consumer Staples
JCTC,Jewett-Cameron Trading Company Common Shares,1.87,6582611.0,71534,Consumer Discretionary
RENX,RenX Enterprises Corp. Common Stock,0.1414,6555445.0,5089186,Finance
MBRX,Moleculin Biotech Inc. Common Stock,2.41,6491410.0,168120,Health Care
HYFM,Hydrofarm Holdings Group Inc. Common Stock,1.39,6487136.0,7110,Consumer Discretionary
CELZ,Creative Medical Technology Holdings Inc. Common Stock,1.84,6430189.0,21667,Finance
DAVEW,Dave Inc. Warrants,0.47,6346919.0,24422,Finance
MITQ,Moving iMage Technologies Inc. Common Stock,0.6381,6345978.0,20650,Consumer Discretionary
RVYL,Ryvyl Inc. Common Stock,6.11,6339681.0,12169,Consumer Discretionary
IPST,IP Strategy Holdings Inc. Common Stock,0.659,6299593.0,63950,Consumer Staples
ALBT,Avalon GloboCare Corp. Common Stock,1.09,6278117.0,326767909,Health Care
INBS,Intelligent Bio Solutions Inc. Common Stock,3.91,6270792.0,115333,Health Care
SILO,Silo Pharma Inc. Common Stock,0.3798,6224808.0,1042454,Consumer Discretionary
BOXL,Boxlight Corporation Class A Common Stock,1.49,6208334.0,141283,Real Estate
BMRA,Biomerica Inc. Common Stock,2.05,6191137.0,57815,Health Care
SOWG,Sow Good Inc. Common Stock,0.461,6144424.0,20208,Consumer Staples
CAPS,Capstone Holding Corp. Common Stock,0.6701,6089784.0,41170,Health Care
CXAI,CXApp Inc. Class A Common Stock,0.189,6028331.0,1515891,Technology
ATER,Aterian Inc. Common Stock,0.599,6006201.0,32999,Consumer Discretionary
LUCY,Innovative Eyewear Inc. Common Stock,1.12,5992205.0,55400,Health Care
FLDDW,Fold Holdings Inc. Warrant,0.121,5948488.0,16839,Finance
VIVS,VivoSim Labs Inc. Common Stock,2.23,5815755.0,184056,Health Care
SOPA,Society Pass Incorporated Common Stock,0.7608,5786283.0,458549,Real Estate
OLOX,Olenox Industries Inc. Common Stock,0.936,5786128.0,189927,Consumer Discretionary
AMPGZ,Amplitech Group Inc. Series B Right,0.2252,5670829.0,4108,Telecommunications
APVO,Aptevo Therapeutics Inc. Common Stock,7.35,5638655.0,26818,Health Care
CTNT,Cheetah Net Supply Chain Service Inc Class A Common Stock,1.71,5599544.0,49072,Consumer Discretionary
SONM,DNA X Inc. Common Stock,5.39,5544655.0,10167,Utilities
XBIO,Xenetic Biosciences Inc. Common Stock,2.42,5544356.0,13246,Health Care
WHLRP,Wheeler Real Estate Investment Trust Inc. Class B Preferred Stock,7.0,5535173.0,4137,Real Estate
EZRA,Reliance Global Group Inc. Common Stock,0.3018,5475002.0,15438125,Finance
MOBXW,Mobix Labs Inc Warrants,0.0521,5370318.0,31994,Technology
TBH,Brag House Holdings Inc. Common Stock,0.2563,5369834.0,515223,Consumer Discretionary
LMFA,LM Funding America Inc. Common Stock,0.38,5366929.0,139751,Finance
FCUV,Focus Universal Inc. Common Stock,5.3045,5233017.0,11526,Industrials
JTAI,Jet.AI Inc. Common Stock,0.1149,5225451.0,14894080,Consumer Discretionary
CYCN,Cyclerion Therapeutics Inc. Common Stock,1.31,5142161.0,28365,Health Care
SNOA,Sonoma Pharmaceuticals Inc. Common Stock,2.93,5070696.0,7339,Health Care
PCSA,Processa Pharmaceuticals Inc. Common Stock,2.23,5052665.0,34711,Health Care
WORX,SCWorx Corp. Common Stock,0.317,5017106.0,463866,Consumer Discretionary
ASTC,Astrotech Corporation (DE) Common Stock,2.835,4986632.0,4721,Industrials
SUNE,SUNation Energy Inc. Common Stock,1.45,4939590.0,169030,Utilities
GNPX,Genprex Inc. Common Stock,2.13,4939244.0,625198,Health Care
BEATW,Heartbeam Inc. Warrant,0.1213,4866241.0,200,Health Care
XHLD,TEN Holdings Inc. Common Stock,1.61,4786258.0,42247,Real Estate
BIAF,bioAffinity Technologies Inc. Common Stock,1.04,4678657.0,91479,Health Care
AMIX,Autonomix Medical Inc. Common Stock,0.4099,4676690.0,256158,Health Care
INDP,Indaptus Therapeutics Inc. Common Stock,2.063,4625914.0,7991,Health Care
WALDW,Waldencast plc Warrant ,0.0361,4622288.0,25202,Consumer Discretionary
NDRA,ENDRA Life Sciences Inc. Common Stock,3.92,4572449.0,4459349,Health Care
DCOY,Decoy Therapeutics Inc. Common Stock,0.683,4360393.0,67826,Health Care
POLA,Polar Power Inc. Common Stock,1.64,4360229.0,59258,Miscellaneous
ULY,Urgent.ly Inc. Common Stock,1.98,4338071.0,13827,Technology
MEHA,Functional Brands Inc. Common Stock,0.2564,4185352.0,4124461,Health Care
NCPL,Netcapital Inc. Common Stock,0.5325,4179006.0,77809,Finance
ACXP,Acurx Pharmaceuticals Inc. Common Stock,1.64,4176616.0,40682,Health Care
FFAIW,Faraday Future Intelligent Electric Inc. Warrant,0.0202,4148746.0,40255,Industrials
BNBX,BNB Plus Corp. Common Stock,0.7578,4128092.0,149816,Consumer Discretionary
SQFT,Presidio Property Trust Inc. Class A Common Stock,2.86,4115823.0,1333,Real Estate
ELAB,PMGC Holdings Inc. Common Stock,1.26,4093443.0,160073,Health Care
GBR,New Concept Energy Inc Common Stock,0.796,4085019.0,83174,Energy
SDOT,Sadot Group Inc. Common Stock,2.19,4049485.0,20279,Consumer Discretionary
VEEAW,Veea Inc. Warrant,0.08,4032605.0,1209,Finance
EEIQ,EpicQuest Education Group International Limited Common Stock,2.72,4024183.0,99407,Real Estate
TRUG,TruGolf Holdings Inc. Class A Common Stock,0.795,4020668.0,52556,Consumer Discretionary
AQB,AquaBounty Technologies Inc. Common Stock,1.02,3955249.0,98521,Consumer Staples
RMCOW,Royalty Management Holding Corporation Warrant,0.26,3936591.0,14346,Miscellaneous
BTOG,Bit Origin Limited Class A Ordinary Shares,2.66,3928400.0,11406,Finance
MTNB,Matinas Biopharma Holdings Inc. Common Stock,0.6015,3853324.0,76157,Health Care
VAVX,VanEck Avalanche ETF Common Shares of Beneficial Interest,19.1358,3828978.0,2051,
HCTI,Healthcare Triangle Inc. Common Stock,5.02,3800060.0,14398271,Technology
OGEN,Oragenics Inc. Common Stock,0.8798,3752512.0,655940,Health Care
VEEE,Twin Vee PowerCats Co. Common Stock,0.434,3741210.0,545042,Industrials
GRI,GRI Bio Inc. Common Stock,2.58,3728175.0,52368,Health Care
BLUWW,Blue Water Acquisition Corp. III Warrant.,0.51,3694950.0,58995,
VSTD,Vestand Inc. Class A Common Stock,0.2544,3618835.0,555554,Consumer Discretionary
MSAIW,MultiSensor AI Holdings Inc. Warrant,0.0447,3581962.0,2196,Technology
SHPH,Shuttle Pharmaceuticals Holdings Inc. Common Stock,1.09,3547320.0,41276,Health Care
DRMA,Dermata Therapeutics Inc. Common Stock,1.25,3544179.0,107609,Health Care
AMPGR,Amplitech Group Inc. Series A Right,0.14,3525382.0,28909,Telecommunications
SBLX,StableX Technologies Inc. Common Stock,2.41,3508900.0,177709,Consumer Discretionary
REVB,Revelation Biosciences Inc. Common Stock,1.33,3488747.0,124286,Health Care
FLYE,Fly-E Group Inc. Common Stock,2.12,3460658.0,27522,Industrials
ZEOWW,Zeo Energy Corporation Warrants,0.06,3453651.0,5666,Miscellaneous
SLE,Super League Enterprise Inc. Common Stock,3.6,3447616.0,17975,Consumer Discretionary
RKDA,Arcadia Biosciences Inc. Common Stock,1.97,3407871.0,13801,Consumer Staples
PDYNW,Palladyne AI Corp Warrants,0.0745,3330852.0,56226,Technology
IVDA,Iveda Solutions Inc. Common Stock,0.297,3308503.0,691341,Technology
GWAV,Greenwave Technology Solutions Inc. Common Stock,3.92,3252154.0,14352,Industrials
GNLN,Greenlane Holdings Inc. Class A Common Stock,0.6592,3249568.0,63181,Consumer Discretionary
ENVB,Enveric Biosciences Inc. Common Stock,2.32,3225577.0,117894,Health Care
JAGX,Jaguar Health Inc. Common Stock,0.8537,3189292.0,369738,Health Care
AMODW,Alpha Modus Holdings Inc. Warrant,0.0759,3184761.0,2724,Miscellaneous
LIDRW,AEye Inc. Warrant,0.07,3153850.0,22148,Consumer Discretionary
TALKW,Talkspace Inc. Warrant,0.019,3147466.0,81771,Health Care
SXTP,60 Degrees Pharmaceuticals Inc. Common Stock,2.96,3130532.0,14150,Health Care
SGLY,Singularity Future Technology Ltd. Common Stock,0.4247,3097546.0,41146,Industrials
SRTAW,Strata Critical Medical Inc. Warrants,0.0352,3040102.0,7000,Consumer Discretionary
PW,Power REIT (MD) Common Stock,0.895,3033747.0,8214,Real Estate
NUWE,Nuwellis Inc. Common Stock,1.6,2998227.0,54543,Health Care
DFNSW,T3 Defense Inc. Warrants,0.1204,2937497.0,2773,Consumer Discretionary
GOVX,GeoVax Labs Inc. Common Stock,1.6,2914523.0,45040,Health Care
CDT,CDT Equity Inc. Common Stock,0.6573,2905899.0,187124,Health Care
SHFS,SHF Holdings Inc. Class A Common Stock,0.9418,2901757.0,14734,Finance
ONFO,Onfolio Holdings Inc. Common Stock,0.49,2872975.0,45587,Technology
TWAV,TaoWeave Inc. Common Stock,0.8951,2870774.0,73985,Technology
IPW,iPower Inc. Common Stock,2.16,2856550.0,109915,Consumer Discretionary
ADIL,Adial Pharmaceuticals Inc Common Stock,2.53,2811260.0,62003,Health Care
RCKTW,Rocket Pharmaceuticals Inc. Warrant,0.0257,2781311.0,3500,Health Care
AEVAW,Aeva Technologies Inc. Warrants,0.0458,2751660.0,23920,Consumer Discretionary
AUUD,Auddia Inc. Common Stock,0.8568,2657299.0,332179,Technology
KIDZ,Classover Holdings Inc. Class B Common Stock,0.0944,2645893.0,14110299,Real Estate
ARTL,Artelo Biosciences Inc. Common Stock,1.24,2634717.0,19378,Health Care
AEMD,Aethlon Medical Inc. Common Stock,2.0,2630220.0,23885,Health Care
FUSEW,Fusemachines Inc. Warrants,0.09,2604444.0,10802,Technology
BFRGW,Bullfrog AI Holdings Inc. Warrants,0.1692,2580267.0,332,Health Care
XXII,22nd Century Group Inc. Common Stock,4.94,2520274.0,15253,Health Care
FEED,ENvue Medical Inc. Common Stock,2.26,2459278.0,290396,Health Care
GIPR,Generation Income Properties Inc. Common Stock,0.44,2397020.0,285493,Real Estate
GPACW,General Purpose Acquisition Corp. Warrant,0.24,2368694.0,5350,Industrials
VSEEW,VSee Health Inc. Warrant,0.0588,2365574.0,500,Health Care
ERNA,Ernexa Therapeutics Inc. Common Stock,0.298,2340354.0,826081,Health Care
ACON,Aclarion Inc. Common Stock,2.68,2289714.0,63616,Health Care
BIVIW,BioVie Inc. Warrant,0.3,2263071.0,19187,Health Care
DRCT,Direct Digital Holdings Inc. Class A Common Stock,0.92,2185994.0,296991,Consumer Discretionary
TIVC,Tivic Health Systems Inc. Common Stock,0.837,2114076.0,25870,Health Care
BRTX,BioRestorative Therapies Inc. Common Stock (NV),0.2314,2093300.0,5042327,Health Care
BBLG,Bone Biologics Corp Common Stock,1.15,2064549.0,11166,Health Care
CMCT,Creative Media & Community Trust Corporation Common stock,2.17,2055055.0,80826,Real Estate
LYRA,Lyra Therapeutics Inc. Common Stock,1.12,1987868.0,124062,Health Care
SDSTW,Stardust Power Inc. Warrant,0.2,1973912.0,3554,Industrials
CNSP,CNS Pharmaceuticals Inc. Common Stock,3.07,1904290.0,5340,Health Care
AREB,American Rebel Holdings Inc. Common Stock,0.1746,1856708.0,6853211,Industrials
FRGT,Freight Technologies Inc. Ordinary Shares,1.18,1845810.0,740772,Consumer Discretionary
UGRO,urban-gro Inc. Common Stock,2.44,1833958.0,9380,Consumer Discretionary
KITTW,Nauticus Robotics Inc. Warrant,0.0649,1820803.0,11966,Industrials
TDOG,21Shares Dogecoin ETF Common Shares of Beneficial Interest,19.5398,1808291.0,1475,
HCWB,HCW Biologics Inc. Common Stock,0.5496,1802585.0,897851,Health Care
VGASW,Verde Clean Fuels Inc. Warrant,0.04,1781985.0,12100,Industrials
NVVE,Nuvve Holding Corp. Common Stock,1.18,1738186.0,153762,Industrials
GCTK,GlucoTrack Inc. Common Stock,1.64,1658498.0,16097,Health Care
PFSA,Profusa Inc. Common Stock,1.22,1658436.0,12406929,Health Care
RAINW,Rain Enhancement Technologies Holdco Inc. Warrants,0.2,1637767.0,977,Technology
EDBL,Edible Garden AG Incorporated Common Stock,3.18,1630278.0,17894,Consumer Staples
WHLR,Wheeler Real Estate Investment Trust Inc. Common Stock,2.05,1621015.0,844618,Real Estate
ASNS,Actelis Networks Inc. Common Stock,0.183,1602971.0,892039,Telecommunications
BNAIW,Brand Engagement Network Inc. Warrant,0.273,1577534.0,18205,Technology
IVDAW,Iveda Solutions Inc. Warrant,0.1387,1545082.0,1531,Technology
SOBR,SOBR Safe Inc. Common Stock,0.818,1542957.0,215546,Consumer Discretionary
COCHW,Envoy Medical Inc Warrant,0.052,1504618.0,1503,Health Care
OUSTZ,Ouster Inc. Warrants,0.024,1440125.0,12889,Industrials
ENSC,Ensysce Biosciences Inc. Common Stock,0.395,1434761.0,1062124,Health Care
SABSW,SAB Biotherapeutics Inc. Warrant,0.0299,1423445.0,10744,Health Care
OSRHW,OSR Holdings Inc. Warrant,0.0551,1414571.0,52,Health Care
CXAIW,CXApp Inc. Warrant,0.0438,1397042.0,43702,Technology
NXGLW,NexGel Inc Warrant,0.1669,1359089.0,84,Health Care
HOLOW,MicroCloud Hologram Inc. Warrant,0.09,1311058.0,2777,Technology
SWAGW,Stran & Company Inc. Warrant,0.0702,1283829.0,2,Consumer Discretionary
NRXPW,NRX Pharmaceuticals Inc. Warrant,0.04,1274894.0,5134,Health Care
SCLXW,Scilex Holding Company Warrant,0.1427,1211704.0,759,Health Care
UK,Ucommune International Ltd Ordinary Shares,0.53,1123533.0,72944,Real Estate
MAPSW,WM Technology Inc. Warrants ,0.007,1100517.0,2844,Technology
BTBDW,BT Brands Inc. Warrant,0.14,1098260.0,3878,Consumer Discretionary
NXPLW,NextPlat Corp Warrants,0.04,1052199.0,11883,Telecommunications
ONCO,Onconetix Inc. Common Stock,0.66,1026310.0,76287,Health Care
TRNR,Interactive Strength Inc. Common Stock,1.95,1024351.0,227836,Technology
AERTW,Aeries Technology Inc. Warrant,0.02,1004194.0,43683,Consumer Discretionary
KUST,Kustom Entertainment Inc. Common Stock,1.2,961207.0,846008,Technology
BJDX,Bluejay Diagnostics Inc. Common Stock,2.06,934278.0,41617,Health Care
FOXXW,Foxx Development Holdings Inc. Warrant,0.125,875649.0,16070,Telecommunications
DAICW,CID HoldCo Inc. Warrants,0.0274,802089.0,24345,Technology
BFRIW,Biofrontera Inc. Warrants,0.0679,790921.0,201,Health Care
STSSW,Sharps Technology Inc. Warrant,0.0231,669794.0,1034,Finance
JSPRW,Japer Therapeutics Inc. Warrants,0.023,643633.0,18304,Health Care
BZFDW,BuzzFeed Inc. Warrant,0.016,595326.0,5300,Consumer Discretionary
ORGNW,Origin Materials Inc. Warrants,0.0037,574301.0,28563,Industrials
BTMWW,Bitcoin Depot Inc. Warrant,0.0543,568925.0,76382,Finance
DTSTW,Data Storage Corporation Warrant,0.0749,561627.0,107495,Technology
ERNAW,Ernexa Therapeutics Inc. Warrants,0.07,549748.0,42,
WGSWW,GeneDx Holdings Corp. Warrant,0.015,439331.0,86706,Technology
ONFOW,Onfolio Holdings Inc. Warrant,0.07,410425.0,26913,Technology
DFLIW,Dragonfly Energy Holdings Corp. Warrant,0.0326,393766.0,44451,Miscellaneous
RMSGW,Real Messenger Corporation Warrants,0.0399,381894.0,799,Technology
HSCSW,HeartSciences Inc. Warrant,0.1094,347696.0,301,Health Care
NIXXW,Nixxy Inc. Warrant,0.0138,343283.0,900,Technology
KIDZW,Classover Holdings Inc. Warrants,0.0121,339145.0,14668,Real Estate
LUCYW,Innovative Eyewear Inc. Series A Warrants 8/16/27,0.0548,293190.0,200,Health Care
CINGW,Cingulate Inc. Warrants,0.0391,291150.0,54777,Health Care
CELUW,Celularity Inc. Warrant,0.0098,282610.0,900,Health Care
ADTX,Aditxt Inc. Common Stock,0.4794,268197.0,177255,Health Care
NCPLW,Netcapital Inc. Warrants,0.0283,222096.0,1296,Finance
GIPRW,Generation Income Properties Inc Warrant,0.0401,218456.0,3333,Real Estate
MYSEW,Myseum Inc. Series A Warrant,0.0432,184219.0,126,Telecommunications
LRHC,La Rosa Holdings Corp. Common Stock,1.06,172285.0,217138,Finance
SRZNW,Surrozen Inc. Warrant,0.019,162857.0,1200,Health Care
BNZIW,Banzai International Inc. Warrant,0.0133,158513.0,31758,Technology
BENFW,Beneficient Warrant,0.0096,136452.0,186787,Finance
AREBW,American Rebel Holdings Inc. Warrants,0.0127,135053.0,73883,Industrials
LNZAW,LanzaTech Global Inc. Warrant,0.0132,133076.0,2853,Industrials
SHFSW,SHF Holdings Inc. Warrants,0.0358,110303.0,500,Finance
LTRYW,Sports Entertainment Gaming Global Corporation Warrants,0.0087,109998.0,28639,Technology
ASBPW,Aspire Biopharma Holdings Inc. Warrant,0.0209,105005.0,9,Health Care
CYCUW,Cycurion Inc. Warrant,0.0208,87114.0,20000,Technology
ICUCW,SeaStar Medical Holding Corporation Warrant,0.02,72094.0,28,Health Care
FGIWW,FGI Industries Ltd. Warrant,0.0369,70853.0,1048,Industrials
CDIOW,Cardio Diagnostics Holdings Inc. Warrant,0.0385,70303.0,159417,Health Care
COEPW,Coeptis Therapeutics Holdings Inc. Warrants,0.0119,68570.0,20312,Health Care
EDBLW,Edible Garden AG Incorporated Warrant,0.1056,54138.0,264,Consumer Staples
DRMAW,Dermata Therapeutics Inc. Warrant,0.0188,53304.0,250,Health Care
SXTPW,60 Degrees Pharmaceuticals Inc. Warrant,0.0456,48227.0,295,Health Care
XOSWW,Xos Inc. Warrants,0.0042,47604.0,5248,Consumer Discretionary
PIIIW,P3 Health Partners Inc. Warrant,0.0059,42513.0,1000,Health Care
SQFTW,Presidio Property Trust Inc. Series A Common Stock Purchase Warrants,0.0219,31516.0,109,Real Estate
CDTTW,CDT Equity Inc. Warrant,0.0066,29178.0,4100,Health Care
ACONW,Aclarion Inc. Warrant,0.034,29049.0,1408,Health Care
REVBW,Revelation Biosciences Inc. Warrant,0.01,26231.0,156,Health Care
KPLTW,Katapult Holdings Inc. Warrant,0.004,18573.0,8200,Consumer Discretionary
MNTSW,Momentus Inc. Warrant,0.0127,17744.0,53119,Industrials
NVVEW,Nuvve Holding Corp. Warrant,0.0115,16940.0,3021,Industrials
APLMW,Apollomics Inc. Warrant,0.0129,14233.0,35010,Health Care
CTDD,Qwest Corporation 6.75% Notes due 2057,20.08,20.0,18602,Telecommunications
CTBB,Qwest Corporation 6.5% Notes due 2056,19.74,20.0,45458,Telecommunications
DMIIR,Drugs Made In America Acquisition II Corp. Right,0.13,0.0,542,Finance
DMII,Drugs Made In America Acquisition II Corp. Ordinary Shares,9.98,0.0,1393300,Finance
DMAAR,Drugs Made In America Acquisition Corp. Rights,0.0901,0.0,141344,Finance
DMAA,Drugs Made In America Acquisition Corp. Ordinary Shares,10.48,0.0,300406,
ATII,Archimedes Tech SPAC Partners II Co. Ordinary Shares,10.55,0.0,7,
CGCT,Cartesian Growth Corporation III Class A Ordinary Shares,10.29,0.0,1410,Finance
RWTQ,Redwood Trust Inc. 9.500% Senior Notes Due 2030,24.87,0.0,15808,Real Estate
SAAQU,Space Asset Acquisition Corp. Units,10.18,0.0,14925,Finance
LDP,Cohen & Steers Limited Duration Preferred and Income Fund Inc.,21.44,0.0,52589,Finance
ARTCU,Art Technology Acquisition Corp. Units,9.94,0.0,153812,
LATA,Galata Acquisition Corp. II Class A Ordinary Shares,10.02,0.0,7,Finance
ACP,abrdn Income Credit Strategies Fund Common Shares,5.59,0.0,548720,Finance
CGO,Calamos Global Total Return Fund Common Stock,12.76,0.0,33424,Finance
TWOD,Two Harbors Investments Corp 9.375% Senior Notes due 2030,25.65,0.0,9375,Real Estate
XELLL,Xcel Energy Inc. 6.25% Junior Subordinated Notes Series due 2085,25.09,0.0,161909,Utilities
LCCCR,Lakeshore Acquisition III Corp. Rights,0.25,0.0,2,Finance
SABA,Saba Capital Income & Opportunities Fund II Shares of Beneficial Interest,8.08,0.0,112848,
LATAW,Galata Acquisition Corp. II Warrant,0.4,0.0,23483,Finance
LCCC,Lakeshore Acquisition III Corp. Ordinary Shares,10.2899,0.0,100,Finance
USA,Liberty All-Star Equity Fund Common Stock,5.98,0.0,810869,Finance
HSPT,Horizon Space Acquisition II Corp. Ordinary share,11.8,0.0,3349,Finance
CICC,CION Investment Corporation 7.50% Notes due 2031,25.345,0.0,4027,Finance
ZKPW,Lafayette Digital Acquisition Corp. I Warrant,0.3197,0.0,12480,Finance
HPS,John Hancock Preferred Income Fund III Preferred Income Fund III,14.83,0.0,56079,Finance
EMIS,Emmis Acquisition Corp. Class A Ordinary Shares,10.05,0.0,43,Health Care
ARCIU,Archimedes Tech SPAC Partners III Co. Units,10.045,0.0,283,Finance
ZKP,Lafayette Digital Acquisition Corp. I Class A Ordinary Shares,9.9,0.0,146,Finance
EMF,Templeton Emerging Markets Fund Common Stock,20.79,0.0,64556,Finance
OIMAU,OneIM Acquisition Corp. Units,10.11,0.0,621,Finance
UTF,Cohen & Steers Infrastructure Fund Inc Common Stock,26.95,0.0,251653,Finance
CIF,MFS Intermediate High Income Fund Common Stock,1.7,0.0,22738,Finance
CIK,Credit Suisse Asset Management Income Fund Inc. Common Stock,2.72,0.0,485145,Finance
OFSSO,OFS Capital Corporation 7.50% Notes due 2028,25.54,0.0,413,
KTN,Structured Products Corp 8.205% CorTS 8.205% Corporate Backed Trust Securities (CorTS),25.8681,0.0,726,Finance
CGCTW,Cartesian Growth Corporation III Warrant,0.7,0.0,29108,Finance
UYSC,UY Scuti Acquisition Corp. Ordinary Shares,10.31,0.0,10577,Finance
CIMO,Chimera Investment Corporation 9.250% Senior Notes due 2029,25.32,0.0,8306,Real Estate
UTG,Reaves Utility Income Fund Common Shares of Beneficial Interest,41.8,0.0,243210,Finance
EVG,Eaton Vance Short Diversified Income Fund Eaton Vance Short Duration Diversified Income Fund Common Shares of Beneficial Interest,10.92,0.0,27152,Finance
EURKR,Eureka Acquisition Corp Right,0.27,0.0,2,
EURK,Eureka Acquisition Corp Class A Ordinary Share,11.1,0.0,10050,
CIMP,Chimera Investment Corporation 8.875% Senior Notes due 2030,25.22,0.0,49154,Real Estate
PLMK,Plum Acquisition Corp. IV Class A Ordinary Shares,10.52,0.0,663,
XSLLU,Xsolla SPAC 1 Units,9.89,0.0,42688,Finance
PHK,Pimco High Income Fund,4.91,0.0,510264,Finance
KVAC,Keen Vision Acquisition Corporation Ordinary Shares,11.85,0.0,1100,
KVACW,Keen Vision Acquisition Corporation Warrant,0.0803,0.0,1109,
RWTP,Redwood Trust Inc. 9.125% Senior Notes Due 2030,24.78,0.0,6322,Real Estate
OACC,Oaktree Acquisition Corp. III Life Sciences Class A Ordinary Share,10.59,0.0,42,Finance
OCCIM,OFS Credit Company Inc. 7.875% Series F Term Preferred Stock,25.22,0.0,2182,
CCXIU,Churchill Capital Corp XI Units,10.185,0.0,5180,Finance
ACAAU,Averin Capital Acquisition Corp. Units,10.005,0.0,121289,Finance
IRHOU,Iron Horse Acquisitions II Corp. Units,10.03,0.0,200,Finance
IRHOR,Iron Horse Acquisitions Corp. II Rights,0.1202,0.0,500,
AWF,Alliancebernstein Global High Income Fund,10.47,0.0,337464,Finance
TVC,Tennessee Valley Authority Common Stock,24.46,0.0,2924,Utilities
IRHO,Iron Horse Acquisitions II Corp. Common Stock,9.88,0.0,1,
TVE,Tennessee Valley Authority,24.49,0.0,17479,Utilities
HPI,John Hancock Preferred Income Fund Common Shares of Beneficial Interest,16.17,0.0,77539,Finance
AFJK,Aimei Health Technology Co. Ltd Ordinary Share,32.31,0.0,9901,
IPODW,Dune Acquisition Corporation II Warrants,0.3399,0.0,245948,Finance
NXJ,Nuveen New Jersey Qualified Municipal Fund ,12.58,0.0,71758,Finance
IPOD,Dune Acquisition Corporation II Class A Ordinary Shares,10.39,0.0,136,Finance
NZF,Nuveen Municipal Credit Income Fund ,12.92,0.0,404795,Finance
PMTRU,Perimeter Acquisition Corp. I Unit,10.75,0.0,3808,Finance
PMTRW,Perimeter Acquisition Corp. I Warrant,0.6,0.0,745,Finance
PMTV,PennyMac Mortgage Investment Trust 9.00% Senior Notes due 2030,25.47,0.0,16651,Real Estate
EICC,Eagle Point Income Company Inc. 8.00% Series C Term Preferred Stock due 2029,25.06,0.0,70194,
BACQU,Inflection Point Acquisition Corp. IV Unit,11.15,0.0,1,Finance
BACQR,Inflection Point Acquisition Corp. IV Right,0.7718,0.0,111034,Finance
TSI,TCW Strategic Income Fund Inc. Common Stock,4.61,0.0,129809,Finance
CCXIW,Churchill Capital Corp XI Warrants,0.7,0.0,7915,
HEQ,John Hancock Diversified Income Fund Common Shares of Beneficial Interest,11.49,0.0,38220,Finance
TSUI,21shares Sui ETF Common Shares of Beneficial Interest Shares,18.6239,0.0,6646,
OPP,RiverNorth/DoubleLine Strategic Opportunity Fund Inc. Common Stock,7.88,0.0,84640,Finance
EEA,The European Equity Fund Inc. Common Stock,11.115,0.0,14570,Finance
CCXI,Churchill Capital Corp XI Class A Ordinary Shares,10.1885,0.0,289,
TVACU,Texas Ventures Acquisition III Corp Unit,11.1,0.0,2865,Finance
TVACW,Texas Ventures Acquisition III Corp Warrants,0.89,0.0,23231,
TVAI,Thayer Ventures Acquisition Corporation II Class A Ordinary Shares,10.18,0.0,8,
