symbol,name,price,marketCap,volume,industry
CLRO,ClearOne Inc. Common Stock,3.12,8347285.0,2341,Utilities
WHLRP,Wheeler Real Estate Investment Trust Inc. Class B Preferred Stock,8.0,8340904.0,17213,Real Estate
ACXP,Acurx Pharmaceuticals Inc. Common Stock,1.93,8294634.0,70302,Health Care
NXL,Nexalin Technology Inc. Common Stock,0.399,8212077.0,1866085,Health Care
ORGN,Origin Materials Inc. Common Stock,1.49,8199127.0,127463,Industrials
YCBD,cbdMD Inc. Common Stock,0.779,8177879.0,133166,Consumer Discretionary
ENVB,Enveric Biosciences Inc. Common Stock,2.22,8173782.0,118408,Health Care
VVOS,Vivos Therapeutics Inc. Common Stock,0.5848,8125562.0,256443,Health Care
TNON,Tenon Medical Inc. Common Stock,0.7148,8074651.0,37223,Health Care
ACON,Aclarion Inc. Common Stock,3.26,8026935.0,15910,Health Care
HWH,HWH International Inc. Common Stock,1.07,7999748.0,19658,Health Care
CYCU,Cycurion Inc. Common Stock,0.9014,7743045.0,522666,Technology
VSEE,VSee Health Inc. Common Stock,0.1596,7548988.0,1069291,Health Care
ELAB,PMGC Holdings Inc. Common Stock,1.66,7542627.0,199460,Health Care
BMRA,Biomerica Inc. Common Stock,2.44,7540256.0,12129,Health Care
MGRX,Mangoceuticals Inc. Common Stock,0.438,7519331.0,203075,Health Care
SLE,Super League Enterprise Inc. Common Stock,4.97,7468479.0,106521,Consumer Discretionary
POLA,Polar Power Inc. Common Stock,2.05,7462326.0,317287,Miscellaneous
CNSP,CNS Pharmaceuticals Inc. Common Stock,5.05,7380317.0,16331,Health Care
JCTC,Jewett-Cameron Trading Company Common Shares,2.075,7304234.0,8336,Consumer Discretionary
BIAF,bioAffinity Technologies Inc. Common Stock,1.62,7287854.0,246435,Health Care
NVNO,enVVeno Medical Corporation Common Stock,10.9,7277592.0,13457,Health Care
ASBP,Aspire Biopharma Holdings Inc. Common Stock,5.59,7240358.0,139724,Health Care
BTBD,BT Brands Inc. Common Stock,1.16,7174280.0,111885,Consumer Discretionary
QSIAW,Quantum-Si Incorporated Warrant,0.0327,7120757.0,8699,Industrials
PCSA,Processa Pharmaceuticals Inc. Common Stock,2.565,7054194.0,129377,Health Care
MTR,Mesa Royalty Trust Common Stock,3.711,6915782.0,6599,Energy
IPDN,Professional Diversity Network Inc. Common Stock,0.6548,6891136.0,179194,Technology
SCKT,Socket Mobile Inc. Common Stock,0.8301,6840819.0,15339,Technology
TGL,Treasure Global Inc. Common Stock,4.07,6820201.0,57158,Consumer Discretionary
DAVEW,Dave Inc. Warrants,0.53,6791085.0,5550,Finance
XBIO,Xenetic Biosciences Inc. Common Stock,2.94,6735705.0,9983,Health Care
GDC,GD Culture Group Limited Common Stock,0.1105,6713948.0,32090191,Industrials
NDRA,ENDRA Life Sciences Inc. Common Stock,5.35,6638018.0,15670,Health Care
BTM,Bitcoin Depot Inc. Class A Common Stock,0.581,6593512.0,1370785,Finance
OLB,The OLB Group Inc. Common Stock,0.444,6511229.0,235536,Consumer Discretionary
NCPL,Netcapital Inc. Common Stock,0.82,6435277.0,140868044,Finance
LUCY,Innovative Eyewear Inc. Common Stock,0.991,6346094.0,117760,Health Care
INBS,Intelligent Bio Solutions Inc. Common Stock,2.63,6290555.0,124494,Health Care
APVO,Aptevo Therapeutics Inc. Common Stock,5.04,6280369.0,17383,Health Care
HSCS,HeartSciences Inc. Common Stock,1.94,6178318.0,7007,Health Care
VSTD,Vestand Inc. Class A Common Stock,0.4322,6148036.0,96865,Consumer Discretionary
MITQ,Moving iMage Technologies Inc. Common Stock,0.616,6123700.0,28122,Consumer Discretionary
SILO,Silo Pharma Inc. Common Stock,0.376,6116239.0,221231,Consumer Discretionary
BCAB,BioAtla Inc. Common Stock,3.615,5989787.0,26426,Health Care
XPON,Expion360 Inc. Common Stock,0.5218,5968504.0,208437,Miscellaneous
CDT,CDT Equity Inc. Common Stock,1.22,5927187.0,325475,Health Care
INHD,Inno Holdings Inc. Common Stock,1.3,5876907.0,60124,Industrials
SONM,DNA X Inc. Common Stock,3.94,5863776.0,40763,Utilities
RNAZ,TransCode Therapeutics Inc. Common Stock,6.115,5811097.0,4743,Health Care
MSS,Maison Solutions Inc. Class A Common Stock,0.985,5795839.0,333184,Consumer Staples
SNGX,Soligenix Inc. Common Stock,0.39,5781428.0,742749,Health Care
RTB,RTB Digital Inc. Common Stock,4.495,5758135.0,35546,Consumer Discretionary
FBLG,FibroBiologics Inc. Common Stock,1.05,5669068.0,69234,Health Care
FEED,ENvue Medical Inc. Common Stock,0.93,5665411.0,136090,Health Care
FLDDW,Fold Holdings Inc. Warrant,0.11,5586169.0,111791,Finance
BNCWZ,CEA Industries Inc. Warrant,0.1302,5585038.0,2555,Industrials
VIVK,Vivakor Inc. Common Stock,1.3,5584341.0,87465,Uncategorized
EXYNW,Exyn Technologies Inc. Warrant,0.72,5499300.0,106,Uncategorized
XHLD,TEN Holdings Inc. Common Stock,1.38,5488871.0,11699,Consumer Discretionary
TWAV,TaoWeave Inc. Common Stock,1.58,5460715.0,72902,Technology
DAIC,CID HoldCo Inc. Common Stock,0.1785,5401335.0,144912,Technology
UGRO,urban-gro Inc. Common Stock,4.07,5361118.0,91357,Consumer Discretionary
CTNT,Cheetah Net Supply Chain Service Inc Class A Common Stock,1.8,5326904.0,146520,Consumer Discretionary
TOIIW,The Oncology Institute Inc. Warrant,0.053,5299095.0,4266,Health Care
ISPC,iSpecimen Inc. Common Stock,3.57,5130650.0,79172,Health Care
XAIR,Beyond Air Inc. Common Stock,0.402,5102459.0,106551,Health Care
DSS,DSS Inc. Common Stock,0.5069,5090552.0,34223,Consumer Discretionary
SUNE,SUNation Energy Inc. Common Stock,1.23,5071420.0,329477,Utilities
BNZI,Banzai International Inc. Class A Common Stock,3.48,5068209.0,959347,Technology
SMTK,SmartKem Inc. Common Stock,0.236,5061306.0,145871,Technology
PULM,Pulmatrix Inc. Common Stock,1.37,5003630.0,24880,Health Care
DRMA,Dermata Therapeutics Inc. Common Stock,1.24,4987457.0,42977,Health Care
DFNSW,T3 Defense Inc. Warrants,0.0819,4936156.0,194650,Consumer Discretionary
ADIL,Adial Pharmaceuticals Inc Common Stock,2.3,4930328.0,172738,Health Care
BRTX,BioRestorative Therapies Inc. Common Stock (NV),0.193,4917287.0,1514399,Health Care
AQB,AquaBounty Technologies Inc. Common Stock,0.9495,4887270.0,24331,Consumer Staples
NXGL,NexGel Inc Common Stock,0.535,4885114.0,73525,Health Care
HCTI,Healthcare Triangle Inc. Common Stock,2.365,4795707.0,82482,Technology
OLOX,Olenox Industries Inc. Common Stock,4.97,4775892.0,11448,Consumer Discretionary
ENSC,Ensysce Biosciences Inc. Common Stock,0.3231,4747790.0,726537,Health Care
BEATW,Heartbeam Inc. Warrant,0.0842,4673676.0,33483,Health Care
ONFO,Onfolio Holdings Inc. Common Stock,0.7,4663756.0,181450,Technology
SQFT,Presidio Property Trust Inc. Class A Common Stock,3.24,4655977.0,13207,Real Estate
HYFM,Hydrofarm Holdings Group Inc. Common Stock,0.97,4621674.0,2484,Consumer Discretionary
MKZR,MacKenzie Realty Capital Inc. Common Stock,2.321,4564014.0,7542,Real Estate
AMIX,Autonomix Medical Inc. Common Stock,0.399,4552328.0,1070354,Health Care
CJMB,Callan JMB Inc. Common Stock,0.799,4496267.0,101568,Consumer Discretionary
CDIO,Cardio Diagnostics Holdings Inc. Common stock,1.51,4468798.0,120057,Health Care
ALZN,Alzamend Neuro Inc. Common Stock,1.17,4451547.0,375239,Health Care
PGYWW,Pagaya Technologies Ltd. Warrants,0.0521,4423185.0,39308,Finance
EEIQ,EpicQuest Education Group International Limited Common Stock,2.96,4379258.0,6113,Real Estate
NWTG,Newton Golf Company Inc. Common Stock,0.95,4362460.0,27181,Consumer Discretionary
MTNB,Matinas Biopharma Holdings Inc. Common Stock,0.6699,4291507.0,96070,Health Care
RENX,RenX Enterprises Corp. Common Stock,1.62,4234481.0,694825,Finance
MVSTW,Microvast Holdings Inc. Warrants,0.0127,4231099.0,47150,Miscellaneous
REVB,Revelation Biosciences Inc. Common Stock,1.08,4221094.0,17996,Health Care
ASTC,Astrotech Corporation (DE) Common Stock,2.39,4203898.0,23672,Industrials
CXAIW,CXApp Inc. Warrant,0.0599,4198348.0,467518,Technology
CAPS,Capstone Holding Corp. Common Stock,0.3313,4182962.0,3214638,Health Care
LMFA,LM Funding America Inc. Common Stock,0.238,4129843.0,635658,Finance
MBIO,Mustang Bio Inc. Common Stock,0.6113,4115345.0,36345,Health Care
ALBT,Avalon GloboCare Corp. Common Stock,0.34,4096201.0,309932,Health Care
GBR,New Concept Energy Inc Common Stock,0.7949,4079374.0,52846,Energy
SXTP,60 Degrees Pharmaceuticals Inc. Common Stock,1.49,3962339.0,59872,Health Care
GRI,GRI Bio Inc. Common Stock,2.2,3895844.0,24438,Health Care
SOBR,SOBR Safe Inc. Common Stock,1.38,3873079.0,214754,Consumer Discretionary
SNYR,Synergy CHC Corp. Common Stock,0.2495,3717521.0,588860,Health Care
GIPR,Generation Income Properties Inc. Common Stock,0.558,3659572.0,12896182,Real Estate
IPST,IP Strategy Holdings Inc. Common Stock,5.29,3629363.0,73552,Consumer Staples
SHPH,Shuttle Pharmaceuticals Holdings Inc. Common Stock,0.6125,3583915.0,121115,Health Care
VEEE,Twin Vee PowerCats Co. Common Stock,6.7,3546511.0,68191,Industrials
VIVS,VivoSim Labs Inc. Common Stock,1.34,3494669.0,248944,Health Care
EVGOW,EVgo Inc. Warrants,0.0111,3483839.0,35415,Technology
IVDA,Iveda Solutions Inc. Common Stock,0.3116,3471143.0,274628,Technology
ESLAW,Estrella Immunopharma Inc. Warrant,0.0802,3451345.0,259,Health Care
DCOY,Decoy Therapeutics Inc. Common Stock,6.43,3420554.0,27491,Health Care
NVVE,Nuvve Holding Corp. Common Stock,0.3563,3364801.0,281338,Industrials
FFAIW,Faraday Future Intelligent Electric Inc. Warrant,0.011,3342946.0,65509,Industrials
BFRGW,Bullfrog AI Holdings Inc. Warrants,0.18,3337497.0,61,Health Care
MEHA,Functional Brands Inc. Common Stock,0.0765,3269847.0,16295256,Health Care
BOXL,Boxlight Corporation Class A Common Stock,0.792,3169352.0,749327,Real Estate
ARTL,Artelo Biosciences Inc. Common Stock,1.33,3103608.0,302220,Health Care
BCGWW,Binah Capital Group Inc. Warrants,0.18,3025824.0,792,Finance
GWAV,Greenwave Technology Solutions Inc. Common Stock,3.55,2945190.0,7568,Industrials
SGLY,Singularity Future Technology Ltd. Common Stock,0.4,2917397.0,107932,Industrials
KIDZ,Classover Holdings Inc. Class B Common Stock,0.3672,2917059.0,396890,Real Estate
GCTK,GlucoTrack Inc. Common Stock,0.462,2891787.0,192744,Health Care
ZEOWW,Zeo Energy Corporation Warrants,0.0497,2881295.0,3397,Miscellaneous
FLYE,Fly-E Group Inc. Common Stock,1.74,2840352.0,11678,Industrials
VBIO,Valion Bio Inc. Common Stock,0.8787,2812564.0,50985,Health Care
BLUWW,Blue Water Acquisition Corp. III Warrant.,0.3852,2790774.0,8760,Uncategorized
AEMD,Aethlon Medical Inc. Common Stock,2.1,2761731.0,244401,Health Care
BNBX,BNB Plus Corp. Common Stock,0.3826,2753659.0,137111,Consumer Discretionary
ZNB,Zeta Network Group Class A Ordinary Shares,1.718,2715809.0,8646,Consumer Discretionary
XXII,22nd Century Group Inc. Common Stock,0.5988,2668043.0,169727,Health Care
IPW,iPower Inc. Common Stock,0.5041,2666648.0,809183,Consumer Discretionary
OGEN,Oragenics Inc. Common Stock,0.59,2662055.0,48379,Health Care
NUWE,Nuwellis Inc. Common Stock,0.9965,2626493.0,20104,Health Care
BTOG,Bit Origin Limited Class A Ordinary Shares,1.765,2606626.0,27956,Finance
DRCT,Direct Digital Holdings Inc. Class A Common Stock,3.43,2549872.0,7906,Consumer Discretionary
BIVIW,BioVie Inc. Warrant,0.33,2488807.0,1100,Health Care
SDOT,Sadot Group Inc. Common Stock,0.1811,2425949.0,649803,Consumer Discretionary
RMCOW,Royalty Management Holding Corporation Warrant,0.16,2425529.0,52,Miscellaneous
TRNR,Interactive Strength Inc. Common Stock,1.0,2330936.0,12985329,Technology
SHFS,SHF Holdings Inc. Class A Common Stock,0.44,2214572.0,114903,Finance
BBLG,Bone Biologics Corp Common Stock,1.23,2208170.0,22991,Health Care
IVF,INVO Fertility Inc. Common Stock,1.58,2199706.0,44189,Health Care
FRGT,Freight Technologies Inc. Ordinary Shares,3.79,2168354.0,35218,Consumer Discretionary
EZRA,Reliance Global Group Inc. Common Stock,3.82,2123018.0,282239,Finance
AMODW,Alpha Modus Holdings Inc. Warrant,0.0386,2090947.0,7900,Miscellaneous
GNLN,Greenlane Holdings Inc. Class A Common Stock,3.285,2074343.0,30919,Consumer Discretionary
OSRHW,OSR Holdings Inc. Warrant,0.0581,2039600.0,840,Health Care
BJDX,Bluejay Diagnostics Inc. Common Stock,1.95,2017694.0,97734,Health Care
UK,Ucommune International Ltd Class A Ordinary Shares,2.96,2006735.0,128918,Consumer Discretionary
KUST,Kustom Entertainment Inc. Common Stock,3.14,1968340.0,6904,Technology
PDYNW,Palladyne AI Corp Warrants,0.041,1937013.0,76791,Technology
SNOA,Sonoma Pharmaceuticals Inc. Common Stock,1.06,1932208.0,165442,Health Care
PW,Power REIT (MD) Common Stock,0.5131,1884244.0,68151,Real Estate
RKDA,Arcadia Biosciences Inc. Common Stock,0.9059,1863331.0,1230867,Consumer Staples
RAINW,Rain Enhancement Technologies Holdco Inc. Warrants,0.2267,1856408.0,3625,Technology
HOLOW,MicroCloud Hologram Inc. Warrant,0.08,1832989.0,30634,Technology
PFSA,Profusa Inc. Common Stock,0.3701,1724765.0,349357,Health Care
FCUV,Focus Universal Inc. Common Stock,0.8179,1692874.0,141823,Industrials
TRUG,TruGolf Holdings Inc. Class A Common Stock,1.52,1692803.0,289609,Consumer Discretionary
VGASW,Verde Clean Fuels Inc. Warrant,0.0379,1688431.0,74509,Industrials
BZFDW,BuzzFeed Inc. Warrant,0.0395,1486730.0,228260,Consumer Discretionary
STSSW,Sharps Technology Inc. Warrant,0.035,1481276.0,3200,Finance
EDBL,Edible Garden AG Incorporated Common Stock,0.2671,1460854.0,5706813,Consumer Staples
ONCO,Onconetix Inc. Common Stock,1.22,1398678.0,1334643,Health Care
WHLR,Wheeler Real Estate Investment Trust Inc. Common Stock,1.29,1344971.0,42222607,Real Estate
MOBXW,Mobix Labs Inc Warrants,0.0998,1341102.0,67698,Technology
LIDRW,AEye Inc. Warrant,0.0282,1306078.0,3004,Consumer Discretionary
SABSW,SAB Biotherapeutics Inc. Warrant,0.0161,1231072.0,250,Health Care
SDSTW,Stardust Power Inc. Warrant,0.1151,1217727.0,3008,Industrials
AERTW,Aeries Technology Inc. Warrant,0.0219,1099593.0,40172,Consumer Discretionary
RCKTW,Rocket Pharmaceuticals Inc. Warrant,0.0098,1070097.0,1500,Health Care
ADTX,Aditxt Inc. Common Stock,1.22,995424.0,316040,Health Care
USGOW,U.S. GoldMining Inc. Warrant,0.07,934809.0,346751,Basic Materials
BIAFW,bioAffinity Technologies Inc. Warrant,0.2001,900185.0,780,Health Care
BNAIW,Brand Engagement Network Inc. Warrant,0.112,728861.0,8619,Technology
XBPEW,XBP Europe Holdings Inc. Warrant,0.0591,695492.0,13925,Technology
SEATW,Vivid Seats Inc. Warrant,0.0606,665837.0,5383,Consumer Discretionary
DFLIW,Dragonfly Energy Holdings Corp. Warrant,0.048,615136.0,4477,Miscellaneous
FOXXW,Foxx Development Holdings Inc. Warrant,0.075,528089.0,10103,Telecommunications
NXGLW,NexGel Inc Warrant,0.057,520470.0,20,Health Care
AIMDW,Ainos Inc. Warrants,0.06,511473.0,40,Technology
DAICW,CID HoldCo Inc. Warrants,0.016,484153.0,4221,Technology
RMSGW,Real Messenger Corporation Warrants,0.0488,467079.0,4781,Technology
ONFOW,Onfolio Holdings Inc. Warrant,0.0665,443057.0,297,Technology
JSPRW,Japer Therapeutics Inc. Warrants,0.015,419952.0,36,Health Care
CINGW,Cingulate Inc. Warrants,0.029,390602.0,12087,Health Care
BFRIW,Biofrontera Inc. Warrants,0.0304,389222.0,370,Health Care
TALKW,Talkspace Inc. Warrant,0.0022,368528.0,587427,Health Care
LUCYW,Innovative Eyewear Inc. Series A Warrants 8/16/27,0.0517,331073.0,20016,Health Care
IVDAW,Iveda Solutions Inc. Warrant,0.027,300773.0,50,Technology
MYPSW,PLAYSTUDIOS Inc. Warrant,0.0023,295217.0,22052,Technology
GIPRW,Generation Income Properties Inc Warrant,0.0439,287913.0,3634,Real Estate
PIIIW,P3 Health Partners Inc. Warrant,0.0385,278932.0,2812037,Health Care
WGSWW,GeneDx Holdings Corp. Warrant,0.0088,261255.0,32396,Technology
NCPLW,Netcapital Inc. Warrants,0.031,243285.0,38938,Finance
MYSEW,Myseum.AI Inc. Series A Warrant,0.0427,216674.0,2195,Telecommunications
CYCUW,Cycurion Inc. Warrant,0.0228,195852.0,3900,Technology
CELUW,Celularity Inc. Warrant,0.0067,193938.0,1400,Health Care
HSCSW,HeartSciences Inc. Warrant,0.0596,189808.0,1,Health Care
ERNAW,Ernexa Therapeutics Inc. Warrants,0.1601,186730.0,176851,Uncategorized
TVGNW,Tevogen Bio Holdings Inc. Warrant,0.0417,174619.0,235492,Health Care
MNTSW,Momentus Inc. Warrant,0.0162,161877.0,368735,Industrials
BENFW,Beneficient Warrant,0.0113,160615.0,12990,Finance
KTTAW,Pasithea Therapeutics Corp. Warrant,0.0046,153706.0,2100,Health Care
SHFSW,SHF Holdings Inc. Warrants,0.0298,149987.0,340,Finance
LTRYW,Sports Entertainment Gaming Global Corporation Warrants,0.0116,146664.0,364853,Technology
LNZAW,LanzaTech Global Inc. Warrant,0.0143,144275.0,372,Industrials
NRXPW,NRX Pharmaceuticals Inc. Warrant,0.0035,126801.0,51068,Health Care
KIDZW,Classover Holdings Inc. Warrants,0.0146,115983.0,24549,Real Estate
KITTW,Nauticus Robotics Inc. Warrant,0.0216,108063.0,25527,Industrials
SXTPW,60 Degrees Pharmaceuticals Inc. Warrant,0.04,106372.0,114,Health Care
ACONW,Aclarion Inc. Warrant,0.0397,97751.0,21116,Health Care
TNONW,Tenon Medical Inc. Warrant,0.0071,80204.0,7002,Health Care
FGIWW,FGI Industries Ltd. Warrant,0.0401,77444.0,2,Industrials
LRHC,La Rosa Holdings Corp. Common Stock,1.42,75970.0,1945300,Finance
ICUCW,SeaStar Medical Holding Corporation Warrant,0.0188,75144.0,32,Health Care
REVBW,Revelation Biosciences Inc. Warrant,0.019,74260.0,41,Health Care
BTMWW,Bitcoin Depot Inc. Warrant,0.0025,28371.0,771367,Finance
APLMW,Apollomics Inc. Warrant,0.0127,27890.0,25312,Health Care
SQFTW,Presidio Property Trust Inc. Series A Common Stock Purchase Warrants,0.018,25867.0,698,Real Estate
XOSWW,Xos Inc. Warrants,0.002,24245.0,17000,Consumer Discretionary
ASBPW,Aspire Biopharma Holdings Inc. Warrant,0.0171,22149.0,500,Health Care
BNZIW,Banzai International Inc. Warrant,0.0115,16748.0,245399,Technology
KPLTW,Katapult Holdings Inc. Warrant,0.0018,8577.0,1500,Consumer Discretionary
ORGNW,Origin Materials Inc. Warrants,0.0008,4402.0,361513,Industrials
PNI,Pimco New York Municipal Income Fund II Common Shares of Beneficial Interest,6.96,0.0,74756,Finance
POLE,Andretti Acquisition Corp. II Class A Ordinary Shares,10.7398,0.0,4737,Uncategorized
POLEW,Andretti Acquisition Corp. II Warrant,0.2302,0.0,11,Uncategorized
LPCV,Launchpad Cadenza Acquisition Corp I Class A Ordinary Share,9.98,0.0,1,Uncategorized
LPCVW,Launchpad Cadenza Acquisition Corp I Warrant,0.4,0.0,1,Uncategorized
GLO,Clough Global Opportunities Fund Common Stock,5.82,0.0,109374,Finance
LOKV,Live Oak Acquisition Corp. V Class A Ordinary Shares,10.52,0.0,132005,Uncategorized
SCII,SC II Acquisition Corp. Class A ordinary share,10.01,0.0,901,Uncategorized
LOKVU,Live Oak Acquisition Corp. V Units,12.23,0.0,1394,Finance
GJT,Synthetic Fixed-Income Securities Inc. Floating Rate Structured Repackaged Asset-Backed Trust Securities Certificates Series 2006-3,22.9526,0.0,16,Finance
GJR,Synthetic Fixed-Income Securities Inc. STRATS Trust for Procter&Gamble Securities Series 2006-1,24.75,0.0,591,Finance
LWAC,LightWave Acquisition Corp. Class A Ordinary Shares,10.2,0.0,11512,Finance
LWACW,LightWave Acquisition Corp. Warrants,0.1807,0.0,14,Finance
GIGGW,GigCapital7 Corp. Warrant,0.365,0.0,146577,Finance
BHK,Blackrock Core Bond Trust,8.85,0.0,379597,Finance
SCIIU,SC II Acquisition Corp. Units,10.18,0.0,1,Uncategorized
OTGA,OTG Acquisition Corp. I Class A Ordinary Share ,10.15,0.0,65,Finance
LPAAU,Launch One Acquisition Corp. Unit,10.74,0.0,100,Finance
IRHO,Iron Horse Acquisitions II Corp. Common Stock,10.02,0.0,6735,Uncategorized
RDAG,Republic Digital Acquisition Company Class A Ordinary Shares,10.29,0.0,248,Finance
RCS,PIMCO Strategic Income Fund Inc.,5.39,0.0,108259,Finance
IRHOR,Iron Horse Acquisitions Corp. II Rights,0.17,0.0,91817,Uncategorized
ITHAW,ITHAX Acquisition Corp III Warrants,0.2398,0.0,105,Uncategorized
ITHA,ITHAX Acquisition Corp III Class A Ordinary Shares,9.97,0.0,104,Uncategorized
IPODW,Dune Acquisition Corporation II Warrants,0.2999,0.0,50,Finance
IPOD,Dune Acquisition Corporation II Class A Ordinary Shares,10.38,0.0,4308,Finance
ISD,PGIM High Yield Bond Fund Inc.,12.95,0.0,75256,Finance
IPFXW,Inflection Point Acquisition Corp. VI Warrant,0.65,0.0,166649,Finance
IPEXR,Inflection Point Acquisition Corp. V Rights,0.6,0.0,31053,Finance
BHV,BlackRock Virginia Municipal Bond Trust,11.33,0.0,1558,Finance
GAINI,Gladstone Investment Corporation 7.875% Notes due 2030,25.55,0.0,4322,Finance
VNMEW,Vendome Acquisition Corporation I Warrant,0.2501,0.0,5000,Finance
VNMEU,Vendome Acquisition Corporation I Unit,10.28,0.0,5200,Finance
BDCIW,BTC Development Corp. Warrant,0.4061,0.0,100,Finance
BEAG,Bold Eagle Acquisition Corp. Class A Ordinary Shares,10.58,0.0,10677,Uncategorized
BEAGR,Bold Eagle Acquisition Corp. Right,0.21,0.0,19,Uncategorized
BEAGU,Bold Eagle Acquisition Corp. Units,10.79,0.0,2801,Uncategorized
NPACW,New Providence Acquisition Corp. III Warrants,0.3,0.0,27097,Finance
NMZ,Nuveen Municipal High Income Opportunity Fund Common Stock $0.01 par value per share,10.01,0.0,677668,Finance
BCV,Bancroft Fund Ltd.,25.26,0.0,15252,Finance
NMT,Nuveen Massachusetts Quality Municipal Income Fund Common Stock,12.655,0.0,7177,Finance
GIG,GigCapital7 Corp. Class A Ordinary Share,5.15,0.0,236211,Finance
NMI,Nuveen Municipal Income Fund Inc. Common Stock,10.6999,0.0,7147,Finance
NML,Neuberger Energy Infrastructure and Income Fund Inc. Common Stock,10.39,0.0,135384,Finance
NMP,NMP Acquisition Corp. Class A Ordinary Shares,10.24,0.0,7,Finance
NMPAR,NMP Acquisition Corp. Right,0.1601,0.0,2581,Finance
NMS,Nuveen Minnesota Quality Municipal Income Fund ,12.18,0.0,1896,Finance
NMPAU,NMP Acquisition Corp. Units,10.3,0.0,1017,Finance
GHY,PGIM Global High Yield Fund Inc.,11.87,0.0,50792,Finance
GJH,Synthetic Fixed-Income Securities Inc 6.375% (STRATS) Cl A-1,9.74,0.0,13402,Finance
BACCU,Blue Acquisition Corp. Unit,10.5,0.0,2,Finance
BHAVR,BHAV Acquisition Corp Rights,0.21,0.0,2100,Finance
BHAVU,BHAV Acquisition Corp Units,10.1,0.0,2300,Uncategorized
BACCR,Blue Acquisition Corp. Right ,0.3232,0.0,3803,Finance
BACC,Blue Acquisition Corp. Class A Ordinary Shares,10.35,0.0,426,Finance
VFL,abrdn National Municipal Income Fund Common Stock,10.0,0.0,18913,Finance
VGI,Virtus Global Multi-Sector Income Fund Common Shares of Beneficial Interest,7.35,0.0,58981,Finance
BDCI,BTC Development Corp. Class A Ordinary Shares,10.04,0.0,9625,Finance
VNME,Vendome Acquisition Corporation I Class A Ordinary Shares,10.17,0.0,5204,Finance
BBN,BlackRock Taxable Municipal Bond Trust Common Shares of Beneficial Interest,15.59,0.0,367269,Finance
BCAR,D. Boral ARC Acquisition I Corp. Class A Ordinary Shares,10.7,0.0,183677,Finance
BCARU,D. Boral ARC Acquisition I Corp. Units,10.68,0.0,1000,Finance
BCARW,D. Boral ARC Acquisition I Corp. Warrant,1.76,0.0,134009,Finance
BAYA,Bayview Acquisition Corp Ordinary Shares,12.02,0.0,819,Uncategorized
BAYAR,Bayview Acquisition Corp Right,0.1498,0.0,51849,Uncategorized
BAYAU,Bayview Acquisition Corp Unit,11.85,0.0,2,Uncategorized
VLT,Invesco High Income Trust II,10.44,0.0,12878,Finance
KF,Korea Fund Inc. (The) New Common Stock,67.2,0.0,19044,Finance
SIMAU,SIM Acquisition Corp. I Unit,13.01,0.0,15619,Finance
SIMAW,SIM Acquisition Corp. I Warrant,0.1419,0.0,30,Finance
FSHP,Flag Ship Acquisition Corp. Ordinary Shares,10.98,0.0,6044,Uncategorized
FSHPR,Flag Ship Acquisition Corp. Right,0.0818,0.0,664,Uncategorized
FSHPU,Flag Ship Acquisition Corp. Unit,12.015,0.0,7445,Uncategorized
GAING,Gladstone Investment Corporation 7.125% Notes due 2031,25.23,0.0,14174,Finance
OXLCG,Oxford Lane Capital Corp. 7.95% Notes due 2032,25.3,0.0,10237,Finance
OXLCI,Oxford Lane Capital Corp. 8.75% Notes due 2030,25.74,0.0,12118,Uncategorized
IRHOU,Iron Horse Acquisitions II Corp. Units,10.17,0.0,747,Finance
NCA,Nuveen California Municipal Value Fund,9.32,0.0,36340,Finance
NKX,Nuveen California AMT-Free Quality Municipal Income Fund,12.42,0.0,104963,Finance
NMAI,Nuveen Multi-Asset Income Fund Common Shares of Beneficial Interest,13.91,0.0,126737,Finance
BPAC,Blueport Acquisition Ltd Class A Ordinary Shares,10.07,0.0,1018,Uncategorized
QADRW,QDRO Acquisition Corp. Warrant,0.251,0.0,350,Finance
HCICR,Hennessy Capital Investment Corp. VIII Share Rights,0.17,0.0,25800,Uncategorized
BIXIW,Bitcoin Infrastructure Acquisition Corp Ltd. Warrant,0.3,0.0,6195,Uncategorized
BKHA,Black Hawk Acquisition Corporation Class A Ordinary Shares,11.85,0.0,521,Health Care
BNCWW,CEA Industries Inc. Warrant,0.027,0.0,2100,Uncategorized
UTF,Cohen & Steers Infrastructure Fund Inc Common Stock,26.9,0.0,224324,Finance
NBXG,Neuberger Next Generation Connectivity Fund Inc. Common Stock,15.48,0.0,118257,Finance
BUI,BlackRock Utility Infrastructure & Power Opportunities Trust,28.1,0.0,52215,Finance
BRUNW,Boost Run Inc. Warrant,14.35,0.0,140870,Technology
BRW,Saba Capital Income & Opportunities Fund SBI,6.75,0.0,239950,Finance
BSL,Blackstone Senior Floating Rate 2027 Term Fund Common Shares of Beneficial Interest,13.05,0.0,16271,Finance
CAIIU,Collective Acquisition Corp. II Units,9.975,0.0,29010,Uncategorized
BWG,BrandywineGLOBAL Global Income Opportunities Fund Inc.,7.79,0.0,92047,Finance
NBH,Neuberger Municipal Fund Inc. Common Stock,10.25,0.0,29340,Finance
OXSQH,Oxford Square Capital Corp. 7.75% Notes due 2030,25.02,0.0,1131,Finance
FIGX,FIGX Capital Acquisition Corp. Class A Ordinary Share,10.22,0.0,2023,Uncategorized
KKRT,KKR & Co. Inc. 6.875% Subordinated Notes due 2065,24.62,0.0,82186,Finance
RTACU,Renatus Tactical Acquisition Corp I Unit,10.72,0.0,150,Finance
RTACW,Renatus Tactical Acquisition Corp I Warrant,0.8111,0.0,6405,Finance
HPF,John Hancock Pfd Income Fund II Pfd Income Fund II,15.8,0.0,30196,Finance
HPI,John Hancock Preferred Income Fund Common Shares of Beneficial Interest,15.92,0.0,52415,Finance
HPS,John Hancock Preferred Income Fund III Preferred Income Fund III,14.4082,0.0,48793,Finance
HVIIR,Hennessy Capital Investment Corp. VII Rights,0.4499,0.0,4020,Finance
HVMC,Highview Merger Corp. Class A Ordinary Share,10.12,0.0,7,Uncategorized
PML,Pimco Municipal Income Fund II Common Shares of Beneficial Interest,7.38,0.0,235759,Finance
PMTR,Perimeter Acquisition Corp. I Class A Ordinary Shares,10.4,0.0,101873,Finance
KIO,KKR Income Opportunities Fund Common Shares,11.26,0.0,59264,Finance
RTAC,Renatus Tactical Acquisition Corp I Class A Ordinary Shares,10.42,0.0,67481,Finance
VACHW,Voyager Acquisition Corp Warrants,0.16,0.0,225,Finance
BIT,BlackRock Multi-Sector Income Trust Common Shares of Beneficial Interest,12.38,0.0,312695,Finance
BIXI,Bitcoin Infrastructure Acquisition Corp Ltd. Class A Ordinary Shares,9.98,0.0,1742,Uncategorized
