symbol,name,price,marketCap,volume,industry
NVDA,NVIDIA Corporation Common Stock,184.89,4492827000000.0,359303190,Technology
AAPL,Apple Inc. Common Stock,272.95,4007217163000.0,32292484,Technology
GOOGL,Alphabet Inc. Class A Common Stock,307.38,3718375860000.0,36149536,Technology
GOOG,Alphabet Inc. Class C Capital Stock,307.15,3715593550000.0,22204911,Technology
MSFT,Microsoft Corporation Common Stock,401.72,2983023712411.0,34284221,Technology
AMZN,Amazon.com Inc. Common Stock,207.92,2232004747290.0,47633480,Consumer Discretionary
META,Meta Platforms Inc. Class A Common Stock,657.01,1661943235403.0,10612545,Technology
TSLA,Tesla Inc. Common Stock,408.58,1533168660023.0,53469915,Industrials
AVGO,Broadcom Inc. Common Stock,321.7,1525267781138.0,32858547,Technology
BRK/B,Berkshire Hathaway Inc.,502.67,1109046536861.0,4565658,
BRK/A,Berkshire Hathaway Inc.,753250.0,1107935840500.0,249,
WMT,Walmart Inc. Common Stock,124.42,991648173661.0,18630415,Consumer Discretionary
LLY,Eli Lilly and Company Common Stock,1022.02,964130150388.0,2663899,Health Care
JPM,JP Morgan Chase & Co. Common Stock,306.13,825642520959.0,7004475,Finance
XOM,Exxon Mobil Corporation Common Stock,148.54,618931043309.0,15606610,Energy
V,Visa Inc.,316.7,606800147210.0,8714679,Real Estate
JNJ,Johnson & Johnson Common Stock,243.47,586738093948.0,7162710,Health Care
MU,Micron Technology Inc. Common Stock,415.56,467716628501.0,35303269,Technology
MA,Mastercard Incorporated Common Stock,514.77,459078223333.0,4843570,Real Estate
COST,Costco Wholesale Corporation Common Stock,986.74,437983702610.0,1803800,Consumer Discretionary
ORCL,Oracle Corporation Common Stock,150.31,432004618210.0,20511716,Technology
ABBV,AbbVie Inc. Common Stock,224.69,397289895306.0,5317669,Health Care
BAC,Bank of America Corporation Common Stock,52.3,381920517265.0,52355180,Finance
PG,Procter & Gamble Company (The) Common Stock,163.75,380555112169.0,7018407,Consumer Discretionary
HD,Home Depot Inc. (The) Common Stock,375.09,373406402909.0,2884742,Consumer Discretionary
CVX,Chevron Corporation Common Stock,184.16,367470200862.0,7121501,Energy
GE,GE Aerospace Common Stock,340.84,357477631514.0,4715778,Technology
NFLX,Netflix Inc. Common Stock,84.59,357152696269.0,79070797,Consumer Discretionary
CAT,Caterpillar Inc. Common Stock,752.93,350328790883.0,3305638,Industrials
KO,Coca-Cola Company (The) Common Stock,80.5,346208207055.0,12811807,Consumer Staples
AMD,Advanced Micro Devices Inc. Common Stock,203.68,332082080502.0,34885642,Technology
PLTR,Palantir Technologies Inc. Class A Common Stock,135.94,324987776453.0,44962701,Technology
CSCO,Cisco Systems Inc. Common Stock (DE),78.1,308486646580.0,19606400,Telecommunications
LRCX,Lam Research Corporation Common Stock,239.07,298543682970.0,10694584,Technology
AMAT,Applied Materials Inc. Common Stock,375.72,298175099229.0,7709386,Technology
MRK,Merck & Company Inc. Common Stock (new),119.3,294956365958.0,10311673,Health Care
PM,Philip Morris International Inc Common Stock,187.5,291877421063.0,4869209,Health Care
MS,Morgan Stanley Common Stock,177.49,281829307963.0,6891227,Finance
GS,Goldman Sachs Group Inc. (The) Common Stock,929.0,278633586719.0,2216971,Finance
WFC,Wells Fargo & Company Common Stock,86.3,266290355818.0,18745170,Finance
RTX,RTX Corporation Common Stock,197.63,265276313408.0,5753482,Industrials
UNH,UnitedHealth Group Incorporated Common Stock (DE),286.66,259667698809.0,10202726,Health Care
MCD,McDonald's Corporation Common Stock,334.53,237649657708.0,2421035,Consumer Discretionary
GEV,GE Vernova Inc. Common Stock,876.46,236231794017.0,2793296,
TMUS,T-Mobile US Inc. Common Stock,213.15,234862042818.0,6626114,Telecommunications
LIN,Linde plc Ordinary Shares,498.51,232778711094.0,1945576,Basic Materials
CCZ,Comcast Holdings ZONES,64.38,231629325094.0,5,Telecommunications
AXP,American Express Company Common Stock,335.32,230235408157.0,3197748,Finance
PEP,PepsiCo Inc. Common Stock,167.58,229023048302.0,7218506,Consumer Staples
INTC,Intel Corporation Common Stock,45.46,227072700000.0,71195224,Technology
IBM,International Business Machines Corporation Common Stock,242.01,227013706112.0,7334549,Technology
VZ,Verizon Communications Inc. Common Stock,48.89,206202578974.0,23687985,Telecommunications
AMGN,Amgen Inc. Common Stock,379.33,204484541158.0,2589387,Health Care
C,Citigroup Inc. Common Stock,116.19,203253375656.0,14755491,Finance
ABT,Abbott Laboratories Common Stock,116.26,202023012443.0,7840564,Health Care
KLAC,KLA Corporation Common Stock,1524.31,199801388913.0,1184003,Technology
TMO,Thermo Fisher Scientific Inc Common Stock,520.12,195413275647.0,1551098,Industrials
TXN,Texas Instruments Incorporated Common Stock,212.63,192972521076.0,6040754,Technology
T,AT&T Inc.,27.46,192235849939.0,33835938,Telecommunications
NEE,NextEra Energy Inc. Common Stock,91.99,191663185468.0,20010889,Technology
DIS,Walt Disney Company (The) Common Stock,105.55,186983920273.0,9561885,Consumer Discretionary
CRM,Salesforce Inc. Common Stock,199.47,186903390000.0,26569162,Technology
APH,Amphenol Corporation Common Stock,148.47,182501540657.0,7755545,Technology
BA,Boeing Company (The) Common Stock,229.41,180166477293.0,4606824,Industrials
ISRG,Intuitive Surgical Inc. Common Stock,506.88,180008414531.0,1570325,Health Care
GILD,Gilead Sciences Inc. Common Stock,143.77,178479029311.0,7987246,Health Care
TJX,TJX Companies Inc. (The) Common Stock,158.69,176220023306.0,5986043,Consumer Discretionary
SCCO,Southern Copper Corporation Common Stock,215.7,175189777731.0,1852692,Basic Materials
SCHW,Charles Schwab Corporation (The) Common Stock,97.52,173286873810.0,9895717,Finance
ADI,Analog Devices Inc. Common Stock,354.35,172995143033.0,4661589,Technology
BLK,BlackRock Inc. Common Stock,1090.27,169156381555.0,725414,Finance
DE,Deere & Company Common Stock,619.46,167530130404.0,1421720,Industrials
ANET,Arista Networks Inc. Common Stock,130.25,163664062257.0,6347671,Telecommunications
TBB,AT&T Inc. 5.350% Global Notes due 2066,22.63,161813223412.0,95044,Telecommunications
UNP,Union Pacific Corporation Common Stock,265.45,157515763057.0,3821916,Industrials
QCOM,QUALCOMM Incorporated Common Stock,145.59,155344530000.0,8640502,Technology
PFE,Pfizer Inc. Common Stock,27.1,154082674659.0,30497076,Health Care
UBER,Uber Technologies Inc. Common Stock,74.8,153947075528.0,22383678,Real Estate
HON,Honeywell International Inc. Common Stock,240.88,153121562857.0,3039392,Industrials
APP,Applovin Corporation Class A Common Stock,444.93,150065100540.0,5874730,Technology
LOW,Lowe's Companies Inc. Common Stock,264.39,148309955716.0,3428229,Consumer Discretionary
DHR,Danaher Corporation Common Stock,209.36,148046695572.0,2839634,Industrials
SYK,Stryker Corporation Common Stock,386.06,147740789871.0,1060510,Health Care
LMT,Lockheed Martin Corporation Common Stock,641.63,147626384391.0,1268711,Industrials
WELL,Welltower Inc. Common Stock,208.45,145446514879.0,2192719,Real Estate
NEM,Newmont Corporation,127.47,138671325804.0,7226896,Basic Materials
COP,ConocoPhillips Common Stock,110.7,135312944126.0,7204880,Energy
BKNG,Booking Holdings Inc. Common Stock,4250.26,134619955570.0,754863,Consumer Discretionary
PLD,Prologis Inc. Common Stock,142.66,132610886940.0,3221681,Real Estate
SPGI,S&P Global Inc. Common Stock,437.49,130722012000.0,2513492,Finance
COF,Capital One Financial Corporation Common Stock,208.47,129654079193.0,4740266,Finance
GLW,Corning Incorporated Common Stock,150.3,128949600783.0,17533545,Industrials
PH,Parker-Hannifin Corporation Common Stock,1014.97,128105990439.0,459884,Industrials
MDT,Medtronic plc. Ordinary Shares,97.03,124575358057.0,7910673,Health Care
BMY,Bristol-Myers Squibb Company Common Stock,61.1,124428543376.0,10671999,Health Care
PGR,Progressive Corporation (The) Common Stock,211.73,124157886778.0,3087825,Finance
VRTX,Vertex Pharmaceuticals Incorporated Common Stock,480.13,121969435645.0,1305275,Health Care
PANW,Palo Alto Networks Inc. Common Stock,149.4,121910400000.0,12112941,Technology
MCK,McKesson Corporation Common Stock,974.45,119357901499.0,599926,Health Care
HCA,HCA Healthcare Inc. Common Stock,525.88,117598442536.0,1062214,Health Care
CEG,Constellation Energy Corporation Common Stock ,323.56,117125592793.0,3958061,Utilities
MO,Altria Group Inc.,69.47,116617312717.0,6468400,Health Care
NOW,ServiceNow Inc. Common Stock,109.3,114327800000.0,26468526,Technology
CME,CME Group Inc. Class A Common Stock,316.45,114110808943.0,2477651,Finance
BSX,Boston Scientific Corporation Common Stock,75.75,112404323292.0,13021370,Health Care
SBUX,Starbucks Corporation Common Stock,98.08,111738825003.0,6245384,Consumer Discretionary
CMCSA,Comcast Corporation Class A Common Stock,30.85,110993548915.0,25474882,Telecommunications
INTU,Intuit Inc. Common Stock,394.42,109806528000.0,9730246,Technology
SO,Southern Company (The) Common Stock,96.35,107853350888.0,5711749,Utilities
ADBE,Adobe Inc. Common Stock,259.04,106335920000.0,6197488,Technology
HWM,Howmet Aerospace Inc. Common Stock,260.31,104368707800.0,1617484,Industrials
NOC,Northrop Grumman Corporation Common Stock,710.9,100892080369.0,587974,Industrials
DUK,Duke Energy Corporation (Holding Company) Common Stock,129.23,100497159978.0,3737803,Utilities
CVS,CVS Health Corporation Common Stock,78.01,99245185025.0,6319185,Consumer Staples
VRT,Vertiv Holdings LLC Class A Common Stock,259.23,99180999823.0,8555334,Technology
UPS,United Parcel Service Inc. Common Stock,116.63,99030732904.0,5312552,Industrials
FCX,Freeport-McMoRan Inc. Common Stock,68.38,98275845818.0,17720961,Basic Materials
SNDK,Sandisk Corporation Common Stock,651.9,96221073647.0,23614433,Technology
CRWD,CrowdStrike Holdings Inc. Class A Common Stock,381.1,96074715484.0,6192273,Technology
WDC,Western Digital Corporation Common Stock,282.25,95693453485.0,10828582,Technology
GD,General Dynamics Corporation Common Stock,350.72,94831096276.0,1005016,Industrials
NKE,Nike Inc. Common Stock,63.95,94670518558.0,10507257,Consumer Discretionary
WM,Waste Management Inc. Common Stock,233.9,94340239176.0,2454797,Utilities
EQIX,Equinix Inc. Common Stock REIT,948.02,93147636843.0,612282,Real Estate
MAR,Marriott International Class A Common Stock,350.57,92895635096.0,1471698,Consumer Discretionary
ICE,Intercontinental Exchange Inc. Common Stock,162.89,92504663003.0,3209622,Finance
WMB,Williams Companies Inc. (The) Common Stock,74.77,91336273809.0,6609772,Utilities
FDX,FedEx Corporation Common Stock,387.68,91152413307.0,1786978,Consumer Discretionary
PNC,PNC Financial Services Group Inc. (The) Common Stock,222.82,89879109063.0,2653249,Finance
MRSH,Marsh Common Stock,185.29,89703382838.0,2768880,Finance
SHW,Sherwin-Williams Company (The) Common Stock,360.5,89322803504.0,1222767,Consumer Discretionary
USB,U.S. Bancorp Common Stock,57.26,88964621451.0,10932137,Finance
ADP,Automatic Data Processing Inc. Common Stock,218.36,87921423323.0,3862766,Industrials
MMM,3M Company Common Stock,166.17,87521739000.0,3473472,Health Care
BX,Blackstone Inc. Common Stock,117.95,87100280234.0,9112443,Finance
ECL,Ecolab Inc. Common Stock,306.76,86496947868.0,1187911,Consumer Discretionary
RCL,Royal Caribbean Cruises Ltd. Common Stock,318.94,86282296959.0,2450136,Consumer Discretionary
AMT,American Tower Corporation (REIT) Common Stock,185.01,86230352548.0,2918220,Real Estate
EMR,Emerson Electric Company Common Stock,152.72,85828640000.0,2676336,Technology
MCO,Moody's Corporation Common Stock,479.47,85010031000.0,1744513,Finance
BK,The Bank of New York Mellon Corporation Common Stock,121.61,84804626970.0,3565463,Finance
MNST,Monster Beverage Corporation,86.66,84668658579.0,9466474,Consumer Staples
PWR,Quanta Services Inc. Common Stock,565.05,84542457791.0,1082156,Industrials
ITW,Illinois Tool Works Inc. Common Stock,290.28,83629668000.0,1416884,Industrials
KKR,KKR & Co. Inc. Common Stock,93.62,83457825273.0,15499919,Finance
ABNB,Airbnb Inc. Class A Common Stock,136.97,83375550827.0,7277319,Consumer Discretionary
SNPS,Synopsys Inc. Common Stock,426.0,81557240346.0,3915050,Technology
REGN,Regeneron Pharmaceuticals Inc. Common Stock,770.79,81487769267.0,772709,Health Care
CMI,Cummins Inc. Common Stock,588.11,81256490445.0,797741,Industrials
CDNS,Cadence Design Systems Inc. Common Stock,297.6,81140937600.0,3284288,Technology
DELL,Dell Technologies Inc. Class C Common Stock ,121.45,80483652527.0,14213339,Technology
CSX,CSX Corporation Common Stock,42.65,79310097477.0,10894170,Industrials
CTAS,Cintas Corporation Common Stock,198.28,79290119009.0,2107637,Industrials
DASH,DoorDash Inc. Class A Common Stock,180.41,78374858164.0,5539604,Technology
CL,Colgate-Palmolive Company Common Stock,97.55,78191010131.0,5800185,Consumer Discretionary
MSI,Motorola Solutions Inc. Common Stock,471.95,78182723518.0,920334,Technology
EPD,Enterprise Products Partners L.P. Common Stock,35.98,77836291379.0,4892682,Utilities
CVNA,Carvana Co. Class A Common Stock,353.9,77449481905.0,3202847,Consumer Discretionary
CI,The Cigna Group Common Stock,288.82,77151278177.0,1215703,Health Care
ORLY,O'Reilly Automotive Inc. Common Stock,91.33,77092026722.0,9821843,Consumer Discretionary
MDLZ,Mondelez International Inc. Class A Common Stock,59.94,76833829400.0,10716552,Consumer Staples
TDG,Transdigm Group Incorporated Common Stock,1314.26,74220944908.0,372864,Industrials
KMI,Kinder Morgan Inc. Common Stock,33.06,73552099485.0,12412316,Utilities
GM,General Motors Company Common Stock,80.79,73031562844.0,6402170,Industrials
HLT,Hilton Worldwide Holdings Inc. Common Stock ,317.83,72875753995.0,1160761,Consumer Discretionary
HOOD,Robinhood Markets Inc. Class A Common Stock,79.45,71529501586.0,22617136,Finance
AEP,American Electric Power Company Inc. Common Stock,132.1,71447800583.0,3811375,Utilities
WBD,Warner Bros. Discovery Inc. Series A Common Stock ,28.8,71365665859.0,18300761,Consumer Discretionary
COR,Cencora Inc. Common Stock,366.65,71324674555.0,1024478,Health Care
ELV,Elevance Health Inc. Common Stock,323.05,71298642674.0,2164508,Health Care
AON,Aon plc Class A Ordinary Shares (Ireland),330.27,70761832394.0,1061993,Finance
NSC,Norfolk Southern Corporation Common Stock,313.01,70293289545.0,1138580,Industrials
RSG,Republic Services Inc. Common Stock,224.59,69354508212.0,1190231,Utilities
MRVL,Marvell Technology Inc. Common Stock,79.29,69076395584.0,12312520,Technology
APO,Apollo Global Management Inc. (New) Common Stock,114.4,66400342351.0,6778912,Finance
LHX,L3Harris Technologies Inc. Common Stock,355.16,66335457567.0,1553031,Industrials
TRV,The Travelers Companies Inc. Common Stock,306.24,66220695108.0,1018528,Finance
SPG,Simon Property Group Inc. Common Stock,202.6,66142834156.0,1103159,Real Estate
ROST,Ross Stores Inc. Common Stock,203.5,65821042848.0,2641253,Consumer Discretionary
SE,Sea Limited American Depositary Shares each representing one Class A Ordinary Share,110.9,65655010681.0,6274616,Consumer Discretionary
PCAR,PACCAR Inc. Common Stock,124.08,65252982487.0,3847005,Consumer Discretionary
EOG,EOG Resources Inc. Common Stock,121.13,64985214547.0,5120363,Energy
MDLN,Medline Inc. Class A Common Stock,48.89,64795657337.0,3061844,Health Care
TFC,Truist Financial Corporation Common Stock,51.5,64332168583.0,6013013,Finance
ET,Energy Transfer LP Common Units ,18.69,64299479407.0,9710350,Utilities
BKR,Baker Hughes Company Class A Common Stock,64.9,64136549499.0,7247432,Consumer Discretionary
VLO,Valero Energy Corporation Common Stock,203.79,62157893953.0,2343014,Energy
SRE,DBA Sempra Common Stock,95.2,62135280799.0,4950865,Utilities
APD,Air Products and Chemicals Inc. Common Stock,276.23,61504269090.0,1524407,Basic Materials
O,Realty Income Corporation Common Stock,66.6,61265723949.0,6310720,Real Estate
NET,Cloudflare Inc. Class A Common Stock,174.66,61180108279.0,4094784,Technology
PSX,Phillips 66 Common Stock,152.46,61097433594.0,2476153,Energy
AZO,AutoZone Inc. Common Stock,3660.0,60638224860.0,128171,Consumer Discretionary
DLR,Digital Realty Trust Inc. Common Stock,176.37,60603455858.0,1992740,Real Estate
MPC,Marathon Petroleum Corporation Common Stock,201.07,60442140453.0,2021157,Energy
SOMN,Southern Company (The) 2025 Series A Corporate Units,53.7,60111312327.0,136745,Basic Materials
VST,Vistra Corp. Common Stock,176.82,59911123142.0,7740146,Utilities
AFL,AFLAC Incorporated Common Stock,113.97,59733263120.0,1901804,Finance
MPLX,MPLX LP Common Units Representing Limited Partner Interests,58.66,59661041816.0,1484728,Energy
SNOW,Snowflake Inc. Common Stock,173.06,59221132000.0,16623218,Technology
FTNT,Fortinet Inc. Common Stock,79.2,58896929678.0,5868361,Technology
AJG,Arthur J. Gallagher & Co. Common Stock,225.22,57904062000.0,2313541,Finance
F,Ford Motor Company Common Stock,14.41,57488337992.0,61416066,Industrials
MPWR,Monolithic Power Systems Inc. Common Stock,1180.13,56536487910.0,644527,Technology
D,Dominion Energy Inc. Common Stock,63.35,55671069724.0,5044703,Utilities
ALL,Allstate Corporation (The) Common Stock,212.76,55218845744.0,1265680,Finance
ZTS,Zoetis Inc. Class A Common Stock,129.76,54775291520.0,3637522,Health Care
AME,AMETEK Inc.,236.96,54258437786.0,1105118,Industrials
URI,United Rentals Inc. Common Stock,858.09,54058079959.0,437437,Consumer Discretionary
CAH,Cardinal Health Inc. Common Stock,227.13,53447326714.0,1167122,Health Care
PSA,Public Storage Common Stock,303.95,53345184566.0,1200530,Real Estate
CTVA,Corteva Inc. Common Stock ,78.82,53008341680.0,3239161,Consumer Staples
OKE,ONEOK Inc. Common Stock,84.02,52914420929.0,5339368,Utilities
IDXX,IDEXX Laboratories Inc. Common Stock,660.71,52608395504.0,414348,Health Care
KEYS,Keysight Technologies Inc. Common Stock,306.03,52489580093.0,2710022,Industrials
CARR,Carrier Global Corporation Common Stock ,62.76,52457562034.0,4943900,Industrials
FAST,Fastenal Company Common Stock,45.68,52448826313.0,5984036,Consumer Discretionary
GWW,W.W. Grainger Inc. Common Stock,1105.52,52371825492.0,366149,Industrials
TER,Teradyne Inc. Common Stock,332.7,52086164565.0,4912002,Industrials
TGT,Target Corporation Common Stock,114.79,51977648722.0,5924322,Consumer Discretionary
HBANL,Huntington Bancshares Incorporated Depositary Shares Each Representing a 1/40th Interest in a Share of 6.875% Series J Non-Cumulative Perpetual Preferred Stock,25.51,51780003894.0,11707,Finance
OXY,Occidental Petroleum Corporation Common Stock,51.43,50723694118.0,11325611,Energy
RBLX,Roblox Corporation Class A Common Stock,71.4,50601611756.0,8925240,Technology
FIX,Comfort Systems USA Inc. Common Stock,1438.23,50589692788.0,457617,Industrials
NDAQ,Nasdaq Inc. Common Stock,88.59,50358441203.0,8282280,Finance
EA,Electronic Arts Inc. Common Stock,201.07,50318514073.0,1518146,Consumer Discretionary
BDX,Becton Dickinson and Company Common Stock,176.66,50302487978.0,3326928,Health Care
LNG,Cheniere Energy Inc. Common Stock,232.51,50044237768.0,3473133,Utilities
RKT,Rocket Companies Inc. Class A Common Stock,17.77,50038365513.0,22147447,Finance
EXC,Exelon Corporation Common Stock,48.8,49917158148.0,8521188,Utilities
EW,Edwards Lifesciences Corporation Common Stock,85.9,49847770000.0,3707890,Health Care
TRGP,Targa Resources Inc. Common Stock,231.22,49701154734.0,1135671,Utilities
CMG,Chipotle Mexican Grill Inc. Common Stock,38.05,49557195150.0,11729534,Consumer Discretionary
MET,MetLife Inc. Common Stock,75.94,49516970660.0,4335081,Finance
ADSK,Autodesk Inc. Common Stock,233.45,49491400000.0,4040290,Technology
XEL,Xcel Energy Inc. Common Stock,83.47,49375824852.0,4863300,Utilities
PCG,Pacific Gas & Electric Co. Common Stock,18.88,49302602654.0,19458112,Utilities
BRKRP,Bruker Corporation 6.375% Mandatory Convertible Preferred Stock Series A,321.44,48839961327.0,1895,Industrials
CRWV,CoreWeave Inc. Class A Common Stock,97.63,48650738697.0,26853201,Technology
LITE,Lumentum Holdings Inc. Common Stock,677.0,48337800000.0,5452084,Telecommunications
CIEN,Ciena Corporation Common Stock,341.16,48261672649.0,2609791,Utilities
ETR,Entergy Corporation Common Stock,105.73,47894615466.0,1975863,Utilities
FANG,Diamondback Energy Inc. Common Stock,166.98,47844047026.0,2523567,Energy
COIN,Coinbase Global Inc. Class A Common Stock,181.06,47813450099.0,12722583,Finance
BE,Bloom Energy Corporation Class A Common Stock,168.57,47292012603.0,10805312,Energy
HSY,The Hershey Company Common Stock,231.5,46922955388.0,1426210,Consumer Staples
COHR,Coherent Corp. Common Stock,250.14,46896710459.0,7883337,Technology
FITB,Fifth Third Bancorp Common Stock,51.97,46867534573.0,8885103,Finance
HBANM,Huntington Bancshares Incorporated Depositary Shares each representing a 1/1000th interest in a share of Huntington Series I Preferred Stock,23.08,46847608384.0,6871,Finance
CCL,Carnival Corporation Common Stock,32.7,46603820779.0,15701735,Consumer Discretionary
CUK,Carnival Plc ADS ADS,32.58,46432797584.0,1651941,Consumer Discretionary
ROK,Rockwell Automation Inc. Common Stock,411.3,46212807560.0,905635,Industrials
DHI,D.R. Horton Inc. Common Stock,158.97,46054148703.0,1733951,Consumer Discretionary
DAL,Delta Air Lines Inc. Common Stock,70.51,46052246221.0,7265073,Consumer Discretionary
UI,Ubiquiti Inc. Common Stock,760.84,46046640907.0,85664,Technology
YUM,Yum! Brands Inc.,165.71,45807236842.0,1611475,Consumer Discretionary
WAB,Westinghouse Air Brake Technologies Corporation Common Stock,263.41,44915933018.0,777623,Industrials
HBANZ,Huntington Bancshares Incorporated Depositary Shares Each Representing a 1/1000th Interest in a Share of 5.50% Series L Non-Cumulative Perpetual Preferred Stock,22.07,44797518069.0,38904,Finance
MSTR,Strategy Inc Common Stock Class A,133.4,44522611247.0,18074661,Technology
TRI,Thomson Reuters Corporation Common Shares,99.9,44439764451.0,4319876,Consumer Discretionary
AMP,Ameriprise Financial Inc. Common Stock,486.98,44402347959.0,557457,Finance
CBRE,CBRE Group Inc Common Stock Class A,150.0,44273783100.0,1772712,Finance
ALNY,Alnylam Pharmaceuticals Inc. Common Stock,331.24,43930090219.0,880307,Health Care
AXON,Axon Enterprise Inc. Common Stock,550.19,43673238209.0,2088878,Industrials
TKO,TKO Group Holdings Inc. Class A Common Stock,223.81,43661073462.0,2030722,Consumer Discretionary
HEI,Heico Corporation Common Stock,312.98,43615817088.0,2920324,Industrials
AIG,American International Group Inc. New Common Stock,80.35,43112568922.0,3916214,Finance
PEG,Public Service Enterprise Group Incorporated Common Stock,85.85,42852368840.0,4046192,Utilities
SYY,Sysco Corporation Common Stock,89.12,42682299439.0,3031881,Consumer Discretionary
KR,Kroger Company (The) Common Stock,67.18,42514806569.0,5172360,Consumer Staples
MSCI,MSCI Inc. Common Stock,572.87,42091074441.0,602629,Real Estate
PYPL,PayPal Holdings Inc. Common Stock,45.53,41917856597.0,48007732,Industrials
ODFL,Old Dominion Freight Line Inc. Common Stock,198.37,41345390041.0,2221057,Industrials
KDP,Keurig Dr Pepper Inc. Common Stock,30.33,41208341569.0,15557905,Consumer Staples
DDOG,Datadog Inc. Class A Common Stock,116.46,41061010393.0,7091927,Technology
VTR,Ventas Inc. Common Stock,86.44,41055993963.0,2079421,Real Estate
MLM,Martin Marietta Materials Inc. Common Stock,678.46,40919310729.0,444625,Industrials
MCHP,Microchip Technology Incorporated Common Stock,74.97,40568925286.0,9959379,Technology
EL,Estee Lauder Companies Inc. (The) Common Stock,111.9,40477256112.0,3538760,Consumer Discretionary
VMC,Vulcan Materials Company (Holding Company) Common Stock,308.99,40348032852.0,945669,Industrials
NUE,Nucor Corporation Common Stock,175.61,40189869107.0,1372750,Industrials
ED,Consolidated Edison Inc. Common Stock,110.76,40011766233.0,2713260,Utilities
TTWO,Take-Two Interactive Software Inc. Common Stock,213.29,39496073010.0,2230025,Consumer Discretionary
EBAY,eBay Inc. Common Stock,87.9,39379200000.0,4957092,Real Estate
NRG,NRG Energy Inc. Common Stock,181.34,38929625648.0,2365571,Utilities
HIG,The Hartford Insurance Group Inc. Common Stock,141.07,38916024445.0,1285996,Finance
RKLB,Rocket Lab Corporation Common Stock,72.65,38806457592.0,18240226,Industrials
ARES,Ares Management Corporation Class A Common Stock,118.08,38596704981.0,3808354,Finance
GEHC,GE HealthCare Technologies Inc. Common Stock ,83.92,38246520447.0,2286022,Health Care
WEC,WEC Energy Group Inc. Common Stock,115.79,37693276290.0,2029263,Utilities
CCI,Crown Castle Inc. Common Stock,86.4,37676485670.0,2194809,Real Estate
UAL,United Airlines Holdings Inc. Common Stock,116.43,37657003684.0,5461210,Consumer Discretionary
LVS,Las Vegas Sands Corp. Common Stock,55.95,37593404952.0,5593637,Consumer Discretionary
RMD,ResMed Inc. Common Stock,257.06,37448089761.0,927980,Health Care
EQT,EQT Corporation Common Stock,59.74,37294128760.0,9819186,Energy
LYV,Live Nation Entertainment Inc. Common Stock,157.91,37077571503.0,1861889,Consumer Discretionary
IR,Ingersoll Rand Inc. Common Stock,94.53,37019648973.0,2929859,Industrials
STT,State Street Corporation Common Stock,132.27,36867380469.0,1918797,Finance
KMB,Kimberly-Clark Corporation Common Stock,110.38,36637591311.0,5375208,Consumer Discretionary
WDAY,Workday Inc. Class A Common Stock,139.11,36585930000.0,10045963,Technology
KVUE,Kenvue Inc. Common Stock,19.0,36417909710.0,35203727,Consumer Discretionary
ROP,Roper Technologies Inc. Common Stock,352.15,36245924407.0,1835320,Technology
HBANP,Huntington Bancshares Incorporated Depositary Shares 4.500% Series H Non-Cumulative Perpetual Preferred Stock,17.8,36130304560.0,37520,Finance
MCHPP,Microchip Technology Incorporated Depositary Shares Each Representing a 1/20th Interest in a Share of 7.50% Series A Mandatory Convertible Preferred Stock,66.74,36115380467.0,241445,Technology
CPRT,Copart Inc. (DE) Common Stock,37.15,35961856961.0,11260938,Consumer Discretionary
PRU,Prudential Financial Inc. Common Stock,102.31,35603880000.0,1538545,Finance
HBAN,Huntington Bancshares Incorporated Common Stock,17.54,35602558538.0,19498683,Finance
OTIS,Otis Worldwide Corporation Common Stock ,91.46,35552401899.0,4191119,Technology
TPL,Texas Pacific Land Corporation Common Stock,512.54,35335304087.0,684578,Energy
