symbol,name,price,marketCap,volume,industry
NVDA,NVIDIA Corporation Common Stock,190.04,4617972000000.0,196050449,Technology
AAPL,Apple Inc. Common Stock,274.62,4031734666800.0,44547018,Technology
GOOG,Alphabet Inc. Class C Capital Stock,324.4,3924266800000.0,26072735,Technology
GOOGL,Alphabet Inc. Class A Common Stock,324.32,3923299040000.0,39583945,Technology
MSFT,Microsoft Corporation Common Stock,413.6,3071240185834.0,45334715,Technology
AMZN,Amazon.com Inc. Common Stock,208.72,2231261885816.0,90992078,Consumer Discretionary
META,Meta Platforms Inc. Class A Common Stock,677.22,1713065551330.0,14809246,Technology
AVGO,Broadcom Inc. Common Stock,343.94,1630713710428.0,30056667,Technology
TSLA,Tesla Inc. Common Stock,417.32,1565964915563.0,54342346,Industrials
BRK/A,Berkshire Hathaway Inc.,747806.0,1099928402444.0,274,
BRK/B,Berkshire Hathaway Inc.,498.08,1098919567668.0,4567309,
WMT,Walmart Inc. Common Stock,129.02,1028310941695.0,27185327,Consumer Discretionary
LLY,Eli Lilly and Company Common Stock,1044.67,987614049425.0,3420806,Health Care
JPM,JP Morgan Chase & Co. Common Stock,322.1,876840685220.0,11473239,Finance
XOM,Exxon Mobil Corporation Common Stock,151.21,637677612493.0,21290161,Energy
V,Visa Inc.,325.58,623814309847.0,8508995,Real Estate
JNJ,Johnson & Johnson Common Stock,238.64,574954183141.0,9377504,Health Care
MA,Mastercard Incorporated Common Stock,535.33,480724117310.0,4108063,Real Estate
ORCL,Oracle Corporation Common Stock,156.59,450053909690.0,49803873,Technology
COST,Costco Wholesale Corporation Common Stock,997.59,442799685719.0,1861124,Consumer Discretionary
MU,Micron Technology Inc. Common Stock,383.5,431632801594.0,30781098,Technology
BAC,Bank of America Corporation Common Stock,56.41,411933773976.0,31962497,Finance
ABBV,AbbVie Inc. Common Stock,223.26,394586292940.0,6767144,Health Care
HD,Home Depot Inc. (The) Common Stock,381.0,379289875785.0,3638453,Consumer Discretionary
CVX,Chevron Corporation Common Stock,182.6,367669043612.0,12015724,Energy
PG,Procter & Gamble Company (The) Common Stock,157.33,365635027771.0,11438509,Consumer Discretionary
AMD,Advanced Micro Devices Inc. Common Stock,216.0,351656972640.0,38723758,Technology
CAT,Caterpillar Inc. Common Stock,742.12,347297017784.0,2494430,Industrials
NFLX,Netflix Inc. Common Stock,81.47,343979550361.0,42151184,Consumer Discretionary
CSCO,Cisco Systems Inc. Common Stock (DE),86.78,342875986177.0,22904692,Telecommunications
PLTR,Palantir Technologies Inc. Class A Common Stock,142.91,340616887064.0,57841305,Technology
KO,Coca-Cola Company (The) Common Stock,77.97,335396441645.0,23402019,Consumer Staples
GE,GE Aerospace Common Stock,316.74,332201223465.0,4705499,Technology
WFC,Wells Fargo & Company Common Stock,94.61,296988788519.0,20543213,Finance
MRK,Merck & Company Inc. Common Stock (new),117.65,292009951360.0,16154726,Health Care
MS,Morgan Stanley Common Stock,182.35,289810552861.0,6625943,Finance
LRCX,Lam Research Corporation Common Stock,229.28,286318214880.0,9972563,Technology
PM,Philip Morris International Inc Common Stock,181.83,283043623731.0,5383723,Health Care
GS,Goldman Sachs Group Inc. (The) Common Stock,943.62,283018541550.0,2322590,Finance
IBM,International Business Machines Corporation Common Stock,296.34,276999430946.0,4625536,Technology
RTX,RTX Corporation Common Stock,196.19,263046047301.0,4612833,Industrials
AMAT,Applied Materials Inc. Common Stock,330.57,262044564245.0,7455918,Technology
INTC,Intel Corporation Common Stock,50.24,250948800000.0,94646121,Technology
UNH,UnitedHealth Group Incorporated Common Stock (DE),275.7,249739707534.0,10361077,Health Care
AXP,American Express Company Common Stock,359.66,247752385518.0,2219643,Finance
CCZ,Comcast Holdings ZONES,64.38,234593928232.0,194,Telecommunications
MCD,McDonald's Corporation Common Stock,325.6,231877456360.0,2673873,Consumer Discretionary
PEP,PepsiCo Inc. Common Stock,166.47,227506067853.0,10315351,Consumer Staples
C,Citigroup Inc. Common Stock,123.77,221457472499.0,12886202,Finance
TMUS,T-Mobile US Inc. Common Stock,197.66,221084019695.0,4727039,Telecommunications
GEV,GE Vernova Inc. Common Stock,801.54,216038646575.0,3103412,
LIN,Linde plc Ordinary Shares,456.34,213087474716.0,3610617,Basic Materials
TMO,Thermo Fisher Scientific Inc Common Stock,546.76,205422138339.0,2107562,Industrials
AMGN,Amgen Inc. Common Stock,375.82,202371805775.0,2843673,Health Care
TXN,Texas Instruments Incorporated Common Stock,218.77,198779458085.0,9244080,Technology
VZ,Verizon Communications Inc. Common Stock,47.02,198256326493.0,26948765,Telecommunications
ABT,Abbott Laboratories Common Stock,111.07,193136507153.0,11719825,Health Care
T,AT&T Inc.,27.11,192194975809.0,33056298,Telecommunications
BA,Boeing Company (The) Common Stock,244.71,192182287862.0,4695341,Industrials
SCHW,Charles Schwab Corporation (The) Common Stock,107.21,190505391112.0,10177775,Finance
DIS,Walt Disney Company (The) Common Stock,107.13,189782921638.0,10509704,Consumer Discretionary
KLAC,KLA Corporation Common Stock,1440.16,188771292098.0,1639201,Technology
GILD,Gilead Sciences Inc. Common Stock,151.68,188186285217.0,7430008,Health Care
NEE,NextEra Energy Inc. Common Stock,89.48,186351914524.0,6528769,Technology
CRM,Salesforce Inc. Common Stock,194.03,181806110000.0,12101954,Technology
ANET,Arista Networks Inc. Common Stock,141.74,178491065822.0,6796127,Telecommunications
APH,Amphenol Corporation Common Stock,144.2,176508804254.0,9317085,Technology
ISRG,Intuitive Surgical Inc. Common Stock,492.84,175022386003.0,2207780,Health Care
TJX,TJX Companies Inc. (The) Common Stock,156.24,173499378923.0,4337622,Consumer Discretionary
SCCO,Southern Copper Corporation Common Stock,208.28,169163314352.0,1742062,Basic Materials
BLK,BlackRock Inc. Common Stock,1079.9,167547466629.0,799421,Finance
TBB,AT&T Inc. 5.350% Global Notes due 2066,22.33,159668107768.0,34626,Telecommunications
DE,Deere & Company Common Stock,585.67,158391779088.0,1101810,Industrials
ADI,Analog Devices Inc. Common Stock,322.97,157812377327.0,3162464,Technology
APP,Applovin Corporation Class A Common Stock,460.38,155587722900.0,10215575,Technology
LOW,Lowe's Companies Inc. Common Stock,276.89,155321848929.0,2470058,Consumer Discretionary
PFE,Pfizer Inc. Common Stock,27.05,153798389282.0,49269633,Health Care
UBER,Uber Technologies Inc. Common Stock,73.91,153572443460.0,17943960,Real Estate
DHR,Danaher Corporation Common Stock,216.66,153037696320.0,3559596,Industrials
HON,Honeywell International Inc. Common Stock,239.84,152271347967.0,3005228,Industrials
UNP,Union Pacific Corporation Common Stock,254.34,150864540508.0,3412118,Industrials
QCOM,QUALCOMM Incorporated Common Stock,138.93,148238310000.0,11014245,Technology
LMT,Lockheed Martin Corporation Common Stock,638.29,146857916390.0,1589070,Industrials
COF,Capital One Financial Corporation Common Stock,222.76,141616017850.0,3039609,Finance
BKNG,Booking Holdings Inc. Common Stock,4237.05,136576285846.0,677572,Consumer Discretionary
SYK,Stryker Corporation Common Stock,356.08,136173412580.0,2336541,Health Care
WELL,Welltower Inc. Common Stock,197.25,135378206482.0,2933757,Real Estate
SPGI,S&P Global Inc. Common Stock,444.19,134500732000.0,3914273,Finance
COP,ConocoPhillips Common Stock,108.7,134322573775.0,6335359,Energy
NEM,Newmont Corporation,120.73,131748179696.0,7400795,Basic Materials
MDT,Medtronic plc. Ordinary Shares,101.65,130316744243.0,8888506,Health Care
PLD,Prologis Inc. Common Stock,137.28,127514861760.0,2047220,Real Estate
BMY,Bristol-Myers Squibb Company Common Stock,60.77,123712711451.0,14011724,Health Care
PH,Parker-Hannifin Corporation Common Stock,978.87,123549573742.0,490853,Industrials
INTU,Intuit Inc. Common Stock,437.5,121800000000.0,3718399,Technology
VRTX,Vertex Pharmaceuticals Incorporated Common Stock,470.87,119468585953.0,1794696,Health Care
PGR,Progressive Corporation (The) Common Stock,201.53,118176634971.0,3459318,Finance
MCK,McKesson Corporation Common Stock,962.32,117872128658.0,785347,Health Care
PANW,Palo Alto Networks Inc. Common Stock,166.0,115702000000.0,20900683,Technology
CMCSA,Comcast Corporation Class A Common Stock,31.61,115183505303.0,24313225,Telecommunications
HCA,HCA Healthcare Inc. Common Stock,497.54,113535593006.0,597656,Health Care
SBUX,Starbucks Corporation Common Stock,98.98,112764160876.0,7149910,Consumer Discretionary
GLW,Corning Incorporated Common Stock,131.39,112648582430.0,15637315,Industrials
CME,CME Group Inc. Class A Common Stock,307.24,110789713824.0,2350593,Finance
BSX,Boston Scientific Corporation Common Stock,74.12,109878603931.0,21131920,Health Care
ADBE,Adobe Inc. Common Stock,266.9,109562450000.0,6570822,Technology
NOW,ServiceNow Inc. Common Stock,103.87,108648020000.0,23083611,Technology
MO,Altria Group Inc.,64.4,108106447949.0,8078398,Health Care
CRWD,CrowdStrike Holdings Inc. Class A Common Stock,408.04,102866247458.0,2822195,Technology
UPS,United Parcel Service Inc. Common Stock,117.92,100041629834.0,5219801,Industrials
NOC,Northrop Grumman Corporation Common Stock,698.02,99064129890.0,693894,Industrials
CEG,Constellation Energy Corporation Common Stock ,272.15,98615042793.0,4175042,Utilities
SO,Southern Company (The) Common Stock,89.38,98416750867.0,4422909,Utilities
GD,General Dynamics Corporation Common Stock,360.1,97367352216.0,807358,Industrials
BX,Blackstone Inc. Common Stock,131.42,97047213467.0,8577131,Finance
WDC,Western Digital Corporation Common Stock,285.99,96961455313.0,8033480,Technology
ICE,Intercontinental Exchange Inc. Common Stock,169.48,96247101023.0,3332250,Finance
CVS,CVS Health Corporation Common Stock,75.77,96184899388.0,10718239,Consumer Staples
KKR,KKR & Co. Inc. Common Stock,107.29,95633307359.0,11737587,Finance
RCL,Royal Caribbean Cruises Ltd. Common Stock,348.03,94912295645.0,1971957,Consumer Discretionary
DUK,Duke Energy Corporation (Holding Company) Common Stock,121.72,94656924185.0,4280565,Utilities
PNC,PNC Financial Services Group Inc. (The) Common Stock,240.95,94490578768.0,2272773,Finance
USB,U.S. Bancorp Common Stock,60.35,94208441791.0,7112674,Finance
WM,Waste Management Inc. Common Stock,230.5,92860855256.0,2276378,Utilities
NKE,Nike Inc. Common Stock,62.41,92390728119.0,12907499,Consumer Discretionary
FCX,Freeport-McMoRan Inc. Common Stock,63.61,91339549283.0,14741342,Basic Materials
ADP,Automatic Data Processing Inc. Common Stock,226.62,91247265770.0,3376525,Industrials
HWM,Howmet Aerospace Inc. Common Stock,225.15,90524318289.0,3053339,Industrials
MMM,3M Company Common Stock,170.28,90457001173.0,4694424,Health Care
EMR,Emerson Electric Company Common Stock,160.01,89893618000.0,3058156,Technology
CVNA,Carvana Co. Class A Common Stock,411.61,89542735929.0,1656297,Consumer Discretionary
SHW,Sherwin-Williams Company (The) Common Stock,360.6,89390400788.0,1761529,Consumer Discretionary
BK,The Bank of New York Mellon Corporation Common Stock,127.61,88988721714.0,3614611,Finance
MAR,Marriott International Class A Common Stock,331.21,88880798022.0,2356522,Consumer Discretionary
SNDK,Sandisk Corporation Common Stock,583.4,86090733067.0,15190148,Technology
FDX,FedEx Corporation Common Stock,364.6,85725778714.0,1483055,Consumer Discretionary
ITW,Illinois Tool Works Inc. Common Stock,290.58,84297258000.0,1887996,Industrials
EQIX,Equinix Inc. Common Stock REIT,857.74,84218126544.0,436662,Real Estate
SNPS,Synopsys Inc. Common Stock,438.9,83969560613.0,2043869,Technology
MRSH,Marsh Common Stock,171.14,83843143149.0,5415081,Finance
CMI,Cummins Inc. Common Stock,601.38,83012241829.0,1355757,Industrials
WMB,Williams Companies Inc. (The) Common Stock,67.85,82859700126.0,9726605,Utilities
REGN,Regeneron Pharmaceuticals Inc. Common Stock,780.28,82491050226.0,586791,Health Care
ECL,Ecolab Inc. Common Stock,288.16,81617185768.0,1965662,Consumer Discretionary
AMT,American Tower Corporation (REIT) Common Stock,173.71,81321749881.0,2502056,Real Estate
DASH,DoorDash Inc. Class A Common Stock,186.24,80269164179.0,6403677,Technology
MCO,Moody's Corporation Common Stock,449.47,80185448000.0,1887860,Finance
DELL,Dell Technologies Inc. Class C Common Stock ,120.91,80125800141.0,5014425,Technology
CDNS,Cadence Design Systems Inc. Common Stock,291.0,79210491000.0,2723161,Technology
MNST,Monster Beverage Corporation,80.9,79041016374.0,6098745,Consumer Staples
CI,The Cigna Group Common Stock,294.4,78641840230.0,1730923,Health Care
ORLY,O'Reilly Automotive Inc. Common Stock,92.72,78265331410.0,6278088,Consumer Discretionary
CTAS,Cintas Corporation Common Stock,194.76,77882507455.0,1540882,Industrials
MDLZ,Mondelez International Inc. Class A Common Stock,60.73,77846487478.0,12254111,Consumer Staples
HOOD,Robinhood Markets Inc. Class A Common Stock,86.56,77833788501.0,41135054,Finance
APO,Apollo Global Management Inc. (New) Common Stock,133.95,77747603653.0,6151074,Finance
VRT,Vertiv Holdings LLC Class A Common Stock,202.0,77232339226.0,7625977,Technology
PWR,Quanta Services Inc. Common Stock,514.56,76729070815.0,1083406,Industrials
EPD,Enterprise Products Partners L.P. Common Stock,35.16,76062368118.0,4758047,Utilities
CL,Colgate-Palmolive Company Common Stock,94.16,75899074939.0,5679761,Consumer Discretionary
CSX,CSX Corporation Common Stock,40.72,75826216848.0,11657968,Industrials
ABNB,Airbnb Inc. Class A Common Stock,121.31,74672340900.0,4914686,Consumer Discretionary
TDG,Transdigm Group Incorporated Common Stock,1300.1,73421279256.0,432800,Industrials
HLT,Hilton Worldwide Holdings Inc. Common Stock ,314.03,72991615179.0,2086380,Consumer Discretionary
GM,General Motors Company Common Stock,80.68,72932126380.0,9759988,Industrials
ELV,Elevance Health Inc. Common Stock,327.5,72783194883.0,1966518,Health Care
COR,Cencora Inc. Common Stock,363.27,70667160850.0,1154347,Health Care
MSI,Motorola Solutions Inc. Common Stock,422.59,70384476605.0,1153444,Technology
TFC,Truist Financial Corporation Common Stock,54.78,70077112917.0,11304046,Finance
MRVL,Marvell Technology Inc. Common Stock,82.35,69841035000.0,13768113,Technology
RSG,Republic Services Inc. Common Stock,224.08,69367011264.0,1562941,Utilities
KMI,Kinder Morgan Inc. Common Stock,30.99,68945324486.0,11712378,Utilities
NSC,Norfolk Southern Corporation Common Stock,305.72,68599476549.0,1228150,Industrials
WBD,Warner Bros. Discovery Inc. Series A Common Stock ,27.21,67425686390.0,16492450,Consumer Discretionary
PCAR,PACCAR Inc. Common Stock,127.26,66837506726.0,3069256,Consumer Discretionary
AON,Aon plc Class A Ordinary Shares (Ireland),310.34,66703010140.0,3883334,Finance
LHX,L3Harris Technologies Inc. Common Stock,350.6,65580728158.0,810771,Industrials
TRV,The Travelers Companies Inc. Common Stock,292.82,65317429766.0,1650870,Finance
AEP,American Electric Power Company Inc. Common Stock,121.1,64678847583.0,2653936,Utilities
SE,Sea Limited American Depositary Shares each representing one Class A Ordinary Share,108.86,64447290015.0,6581205,Consumer Discretionary
SPG,Simon Property Group Inc. Common Stock,196.57,64174219694.0,1384694,Real Estate
FTNT,Fortinet Inc. Common Stock,85.93,63901681405.0,9897037,Technology
EOG,EOG Resources Inc. Common Stock,113.87,63769761506.0,3371418,Energy
APD,Air Products and Chemicals Inc. Common Stock,286.37,63762001011.0,1032617,Basic Materials
PSX,Phillips 66 Common Stock,157.5,63460078763.0,2118522,Energy
ROST,Ross Stores Inc. Common Stock,194.5,62910038496.0,1902209,Consumer Discretionary
MDLN,Medline Inc. Class A Common Stock,47.37,62781147230.0,1334278,Health Care
ET,Energy Transfer LP Common Units ,18.05,61972632715.0,12005670,Utilities
VLO,Valero Energy Corporation Common Stock,201.38,61422820964.0,1948396,Energy
MPC,Marathon Petroleum Corporation Common Stock,204.26,61401062361.0,2004796,Energy
NET,Cloudflare Inc. Class A Common Stock,173.75,60861352419.0,4660601,Technology
AZO,AutoZone Inc. Common Stock,3634.29,60212266182.0,115987,Consumer Discretionary
SNOW,Snowflake Inc. Common Stock,175.95,60210090000.0,8821547,Technology
AFL,AFLAC Incorporated Common Stock,113.2,59329695404.0,2346931,Finance
BDX,Becton Dickinson and Company Common Stock,207.39,59192953292.0,3676328,Health Care
DLR,Digital Realty Trust Inc. Common Stock,172.13,59126922146.0,2249072,Real Estate
BKR,Baker Hughes Company Class A Common Stock,59.55,58849484171.0,8811919,Consumer Discretionary
O,Realty Income Corporation Common Stock,63.09,58036854714.0,4741908,Real Estate
MPWR,Monolithic Power Systems Inc. Common Stock,1206.18,57784465260.0,659405,Technology
SRE,DBA Sempra Common Stock,87.48,57096579457.0,3696305,Utilities
GWW,W.W. Grainger Inc. Common Stock,1190.15,56590843431.0,249992,Industrials
ZTS,Zoetis Inc. Class A Common Stock,127.3,56100246142.0,3175981,Health Care
MPLX,MPLX LP Common Units Representing Limited Partner Interests,55.01,55948754012.0,2663261,Energy
AJG,Arthur J. Gallagher & Co. Common Stock,217.79,55928472000.0,3456420,Finance
SOMN,Southern Company (The) 2025 Series A Corporate Units,50.58,55693882959.0,23248,Basic Materials
RKT,Rocket Companies Inc. Class A Common Stock,19.61,55219603135.0,23179999,Finance
URI,United Rentals Inc. Common Stock,876.52,55219135808.0,663241,Consumer Discretionary
CARR,Carrier Global Corporation Common Stock ,65.32,54597322372.0,8375293,Industrials
F,Ford Motor Company Common Stock,13.59,54149335512.0,59743705,Industrials
AME,AMETEK Inc.,233.41,53731885997.0,834033,Industrials
FAST,Fastenal Company Common Stock,46.52,53413296849.0,9492437,Consumer Discretionary
D,Dominion Energy Inc. Common Stock,62.36,53250031954.0,3374667,Utilities
CAH,Cardinal Health Inc. Common Stock,225.76,53124943772.0,1419960,Health Care
ALL,Allstate Corporation (The) Common Stock,199.94,52320640698.0,2159011,Finance
TGT,Target Corporation Common Stock,115.52,52308197407.0,4505764,Consumer Discretionary
OKE,ONEOK Inc. Common Stock,83.13,52308019333.0,4036622,Utilities
VST,Vistra Corp. Common Stock,152.97,51830135205.0,5080560,Utilities
CMG,Chipotle Mexican Grill Inc. Common Stock,39.59,51562926570.0,17171393,Consumer Discretionary
RBLX,Roblox Corporation Class A Common Stock,73.45,51556428563.0,19537268,Technology
ADSK,Autodesk Inc. Common Stock,242.53,51416360000.0,1524161,Technology
IDXX,IDEXX Laboratories Inc. Common Stock,639.79,51088082421.0,518219,Health Care
CBRE,CBRE Group Inc Common Stock Class A,170.98,50882450627.0,1005480,Finance
PSA,Public Storage Common Stock,288.89,50689510114.0,983552,Real Estate
EA,Electronic Arts Inc. Common Stock,200.87,50268463330.0,4441167,Consumer Discretionary
MET,MetLife Inc. Common Stock,76.28,50260255520.0,3109942,Finance
AMP,Ameriprise Financial Inc. Common Stock,539.11,50086398935.0,679827,Finance
BRKRP,Bruker Corporation 6.375% Mandatory Convertible Preferred Stock Series A,328.21,49868602872.0,359,Industrials
CTVA,Corteva Inc. Common Stock ,73.62,49747389840.0,4262433,Consumer Staples
NDAQ,Nasdaq Inc. Common Stock,86.3,49276905868.0,7114193,Finance
DAL,Delta Air Lines Inc. Common Stock,75.0,48972207600.0,7609170,Consumer Discretionary
TER,Teradyne Inc. Common Stock,310.01,48550140013.0,5339828,Industrials
CRWV,CoreWeave Inc. Class A Common Stock,96.79,48232151986.0,25368907,Technology
FANG,Diamondback Energy Inc. Common Stock,165.96,47551790899.0,1738422,Energy
CCL,Carnival Corporation Common Stock,32.81,46760592042.0,18330527,Consumer Discretionary
HSY,The Hershey Company Common Stock,230.54,46750082026.0,2482383,Consumer Staples
TRGP,Targa Resources Inc. Common Stock,217.7,46731169383.0,1469768,Utilities
CUK,Carnival Plc ADS ADS,32.57,46418545651.0,1618445,Consumer Discretionary
LNG,Cheniere Energy Inc. Common Stock,215.65,46415379444.0,1413615,Utilities
ROK,Rockwell Automation Inc. Common Stock,410.66,46140898499.0,1161333,Industrials
OXY,Occidental Petroleum Corporation Common Stock,46.66,45969918850.0,6813390,Energy
COHR,Coherent Corp. Common Stock,242.46,45456849836.0,5916351,Technology
FIX,Comfort Systems USA Inc. Common Stock,1283.65,45276838618.0,356115,Industrials
XEL,Xcel Energy Inc. Common Stock,76.43,45211384850.0,4240266,Utilities
COIN,Coinbase Global Inc. Class A Common Stock,167.25,45097927892.0,10568175,Finance
HEI,Heico Corporation Common Stock,322.49,44941098002.0,389797,Industrials
ARES,Ares Management Corporation Class A Common Stock,137.25,44862785897.0,3820903,Finance
EW,Edwards Lifesciences Corporation Common Stock,76.8,44567040000.0,6110848,Health Care
DHI,D.R. Horton Inc. Common Stock,153.5,44469471133.0,3053207,Consumer Discretionary
EXC,Exelon Corporation Common Stock,43.97,44422465195.0,7164208,Utilities
KR,Kroger Company (The) Common Stock,70.1,44362726116.0,16069707,Consumer Staples
NUE,Nucor Corporation Common Stock,193.08,44188029880.0,1365781,Industrials
YUM,Yum! Brands Inc.,158.9,44119034528.0,2068276,Consumer Discretionary
ETR,Entergy Corporation Common Stock,98.15,43833486128.0,1912664,Utilities
PCG,Pacific Gas & Electric Co. Common Stock,16.35,43746943145.0,13477130,Utilities
VMC,Vulcan Materials Company (Holding Company) Common Stock,327.32,43249087825.0,1093575,Industrials
UI,Ubiquiti Inc. Common Stock,712.38,43098744229.0,202951,Technology
ALNY,Alnylam Pharmaceuticals Inc. Common Stock,320.0,42276421760.0,1391867,Health Care
MSCI,MSCI Inc. Common Stock,559.39,42032306721.0,937553,Real Estate
MLM,Martin Marietta Materials Inc. Common Stock,695.73,41957488599.0,445349,Industrials
WAB,Westinghouse Air Brake Technologies Corporation Common Stock,244.74,41840061702.0,1023272,Industrials
SYY,Sysco Corporation Common Stock,86.47,41413133219.0,3888640,Consumer Discretionary
ODFL,Old Dominion Freight Line Inc. Common Stock,196.11,41006294872.0,2303153,Industrials
LITE,Lumentum Holdings Inc. Common Stock,577.15,40919935000.0,5892616,Telecommunications
TKO,TKO Group Holdings Inc. Class A Common Stock,209.39,40848005774.0,790687,Consumer Discretionary
CIEN,Ciena Corporation Common Stock,289.68,40802799635.0,4300240,Utilities
WDAY,Workday Inc. Class A Common Stock,154.56,40649280000.0,9162669,Technology
PEG,Public Service Enterprise Group Incorporated Common Stock,81.18,40521319772.0,1635066,Utilities
RKLB,Rocket Lab Corporation Common Stock,75.84,40510416295.0,16369866,Industrials
KEYS,Keysight Technologies Inc. Common Stock,235.93,40466185117.0,1371854,Industrials
AIG,American International Group Inc. New Common Stock,74.9,40414246445.0,4006756,Finance
MCHP,Microchip Technology Incorporated Common Stock,74.41,40265889430.0,11649439,Technology
RMD,ResMed Inc. Common Stock,275.96,40201411540.0,1479215,Health Care
HBANL,Huntington Bancshares Incorporated Depositary Shares Each Representing a 1/40th Interest in a Share of 6.875% Series J Non-Cumulative Perpetual Preferred Stock,25.4,40000000061.0,27729,Finance
DDOG,Datadog Inc. Class A Common Stock,114.01,39979972093.0,10242369,Technology
PRU,Prudential Financial Inc. Common Stock,102.2,39828959972.0,1883273,Finance
MSTR,Strategy Inc Common Stock Class A,138.44,39781251073.0,34199099,Technology
TRI,Thomson Reuters Corporation Common Shares,89.31,39728882514.0,2959606,Consumer Discretionary
EBAY,eBay Inc. Common Stock,87.36,39486720000.0,4814988,Real Estate
CPRT,Copart Inc. (DE) Common Stock,40.3,39011112665.0,5431482,Consumer Discretionary
IR,Ingersoll Rand Inc. Common Stock,98.39,38874911764.0,4794503,Industrials
VTR,Ventas Inc. Common Stock,82.75,38870391186.0,4303993,Real Estate
HIG,The Hartford Insurance Group Inc. Common Stock,139.38,38838277699.0,1376941,Finance
KDP,Keurig Dr Pepper Inc. Common Stock,28.51,38733204894.0,12899909,Consumer Staples
LVS,Las Vegas Sands Corp. Common Stock,57.18,38661369967.0,4677971,Consumer Discretionary
ED,Consolidated Edison Inc. Common Stock,106.68,38504610661.0,1294264,Utilities
PYPL,PayPal Holdings Inc. Common Stock,41.15,37885345903.0,26003207,Industrials
TTWO,Take-Two Interactive Software Inc. Common Stock,205.03,37885203925.0,4128049,Consumer Discretionary
ROP,Roper Technologies Inc. Common Stock,351.71,37857160505.0,1966119,Technology
SYM,Symbotic Inc. Class A Common Stock,62.54,37659823872.0,2502279,Industrials
UAL,United Airlines Holdings Inc. Common Stock,116.2,37618354322.0,4824686,Consumer Discretionary
STT,State Street Corporation Common Stock,134.28,37506073906.0,1711671,Finance
ASTS,AST SpaceMobile Inc. Class A Common Stock,102.12,37480013980.0,11563630,Consumer Discretionary
BE,Bloom Energy Corporation Class A Common Stock,155.17,36699373853.0,11358844,Energy
MTB,M&T Bank Corporation Common Stock,236.25,36309447011.0,1150766,Finance
WEC,WEC Energy Group Inc. Common Stock,111.32,36211756133.0,1744169,Utilities
CCI,Crown Castle Inc. Common Stock,83.08,36179596151.0,3556138,Real Estate
A,Agilent Technologies Inc. Common Stock,127.5,36062053718.0,2233376,Industrials
GEHC,GE HealthCare Technologies Inc. Common Stock ,79.08,36040691574.0,3170991,Health Care
CTSH,Cognizant Technology Solutions Corporation Class A Common Stock,74.6,36005426886.0,5498025,Technology
FITB,Fifth Third Bancorp Common Stock,54.33,35912769410.0,7886146,Finance
EL,Estee Lauder Companies Inc. (The) Common Stock,99.01,35814594527.0,4714663,Consumer Discretionary
HBANM,Huntington Bancshares Incorporated Depositary Shares each representing a 1/1000th interest in a share of Huntington Series I Preferred Stock,22.73,35795275645.0,17218,Finance
MCHPP,Microchip Technology Incorporated Depositary Shares Each Representing a 1/20th Interest in a Share of 7.50% Series A Mandatory Convertible Preferred Stock,65.75,35579656364.0,63685,Technology
PAYX,Paychex Inc. Common Stock,98.09,35211117171.0,4298585,Industrials
EQT,EQT Corporation Common Stock,56.13,35028880710.0,9426172,Energy
IBKR,Interactive Brokers Group Inc. Class A Common Stock,78.42,34925454055.0,3906715,Finance
KVUE,Kenvue Inc. Common Stock,18.18,34829283451.0,91501674,Consumer Discretionary
KMB,Kimberly-Clark Corporation Common Stock,104.7,34749209245.0,3897053,Consumer Discretionary
EME,EMCOR Group Inc. Common Stock,776.24,34749054271.0,404305,Industrials
LYV,Live Nation Entertainment Inc. Common Stock,147.91,34720577548.0,2937977,Consumer Discretionary
