symbol,name,price,marketCap,volume,industry
CSAI,Cloudastructure Inc. Class A Common Stock,0.313,7822380.0,1380700,Technology
TGL,Treasure Global Inc. Common Stock,4.0,7819328.0,42197,Consumer Discretionary
MSN,Emerson Radio Corporation Common Stock,0.3687,7758426.0,27800,Consumer Staples
WGRX,Wellgistics Health Inc. Common Stock,2.93,7756290.0,12967,Health Care
MTVA,MetaVia Inc. Common Stock,1.49,7694911.0,91783,Health Care
EXYNW,Exyn Technologies Inc. Warrant,0.9999,7637152.0,1303,Technology
IMNN,Imunon Inc. Common Stock,1.8,7563812.0,64012,Health Care
CURX,Curanex Pharmaceuticals Inc Common Stock,0.266,7545040.0,52328,Health Care
BOLT,Bolt Biotherapeutics Inc. Common Stock,3.905,7503719.0,79113,Health Care
NVNO,enVVeno Medical Corporation Common Stock,11.05,7377742.0,820,Health Care
YCBD,cbdMD Inc. Common Stock,0.7,7348543.0,265497,Consumer Discretionary
XHLD,TEN Holdings Inc. Common Stock,1.64,7343007.0,283176,Consumer Discretionary
AIDX,20/20 Biolabs Inc. Common Stock,0.597,7313965.0,99771,Health Care
ACXP,Acurx Pharmaceuticals Inc. Common Stock,1.68,7220200.0,162666,Health Care
DTST,Data Storage Corporation Common Stock,3.33,7216570.0,20626,Technology
ACON,Aclarion Inc. Common Stock,2.89,7115903.0,33870,Health Care
NXL,Nexalin Technology Inc. Common Stock,0.3427,7053330.0,211951,Health Care
SILO,Silo Pharma Inc. Common Stock,6.19,6986096.0,354931,Consumer Discretionary
BTBD,BT Brands Inc. Common Stock,1.11,6865044.0,92452,Consumer Discretionary
VVOS,Vivos Therapeutics Inc. Common Stock,0.493,6850038.0,149078,Health Care
AUUD,Auddia Inc. Common Stock,1.26,6758703.0,199744,Technology
XAIR,Beyond Air Inc. Common Stock,0.4646,6695175.0,347324,Health Care
AMST,Amesite Inc. Common Stock,1.14,6672403.0,43805,Technology
POLA,Polar Power Inc. Common Stock,1.8,6552286.0,65967,Miscellaneous
XBIO,Xenetic Biosciences Inc. Common Stock,2.85,6529510.0,5295,Health Care
BNZI,Banzai International Inc. Class A Common Stock,3.01,6460005.0,146296,Technology
CYCU,Cycurion Inc. Common Stock,0.601,6408120.0,803609,Technology
BCAB,BioAtla Inc. Common Stock,3.83,6356092.0,20945,Health Care
NXTC,NextCure Inc. Common Stock,1.75,6321168.0,119020,Health Care
DFNSW,T3 Defense Inc. Warrants,0.0662,6277910.0,1532,Consumer Discretionary
HCWB,HCW Biologics Inc. Common Stock,0.876,6273167.0,475141,Health Care
MGRX,Mangoceuticals Inc. Common Stock,0.365,6266109.0,502843,Health Care
NDRA,ENDRA Life Sciences Inc. Common Stock,5.0,6203755.0,20006,Health Care
CDIO,Cardio Diagnostics Holdings Inc. Common stock,2.08,6155696.0,22904,Health Care
LABT,Lakewood-Amedex Biotherapeutics Inc. Common Stock,3.48,6092746.0,290496,Health Care
ESLAW,Estrella Immunopharma Inc. Warrant,0.1412,6076433.0,1042,Health Care
CNSP,CNS Pharmaceuticals Inc. Common Stock,4.15,6065013.0,11183,Health Care
PULM,Pulmatrix Inc. Common Stock,1.63,5953225.0,25506,Health Care
SNOA,Sonoma Pharmaceuticals Inc. Common Stock,1.23,5886535.0,589870,Health Care
MTR,Mesa Royalty Trust Common Stock,3.15,5870309.0,9790,Energy
DSS,DSS Inc. Common Stock,0.577,5794533.0,64490,Consumer Discretionary
CWD,CaliberCos Inc. Class A Common Stock,0.647,5719625.0,14377,Finance
APVO,Aptevo Therapeutics Inc. Common Stock,4.55,5669778.0,9434,Health Care
MITQ,Moving iMage Technologies Inc. Common Stock,0.569,5656470.0,112382,Consumer Discretionary
OLB,The OLB Group Inc. Common Stock,0.3834,5622534.0,125776,Consumer Discretionary
AQB,AquaBounty Technologies Inc. Common Stock,1.09,5610452.0,11380,Consumer Staples
WALDW,Waldencast plc Warrant ,0.0435,5579304.0,56487,Consumer Discretionary
ADIL,Adial Pharmaceuticals Inc Common Stock,2.59,5551978.0,67025,Health Care
ENVB,Enveric Biosciences Inc. Common Stock,1.375,5539156.0,184888,Health Care
GNPX,Genprex Inc. Common Stock,0.505,5518243.0,270889,Health Care
ELAB,PMGC Holdings Inc. Common Stock,1.21,5497939.0,334020,Health Care
BMRA,Biomerica Inc. Common Stock,1.77,5469776.0,3632,Health Care
FLDDW,Fold Holdings Inc. Warrant,0.1074,5454132.0,17048,Finance
LIMN,Liminatus Pharma Inc. Class A Common Stock,0.1075,5440321.0,1450868,Uncategorized
VSEE,VSee Health Inc. Common Stock,0.1109,5389676.0,1512209,Health Care
PCSA,Processa Pharmaceuticals Inc. Common Stock,1.94,5369982.0,44195,Health Care
INBS,Intelligent Bio Solutions Inc. Common Stock,2.22,5309898.0,24328,Health Care
TNON,Tenon Medical Inc. Common Stock,0.4465,5290879.0,1397722,Health Care
XPON,Expion360 Inc. Common Stock,0.4617,5281062.0,122468,Miscellaneous
LUCY,Innovative Eyewear Inc. Common Stock,0.821,5257461.0,68192,Health Care
DRMA,Dermata Therapeutics Inc. Common Stock,1.3,5228786.0,186582,Health Care
WHLRP,Wheeler Real Estate Investment Trust Inc. Class B Preferred Stock,9.465,5192385.0,5736,Real Estate
ORGN,Origin Materials Inc. Common Stock,0.9417,5181959.0,107237,Industrials
SMTK,SmartKem Inc. Common Stock,0.2401,5149236.0,557079,Technology
DCOY,Decoy Therapeutics Inc. Common Stock,9.59,5101573.0,12830305,Health Care
OLOX,Olenox Industries Inc. Common Stock,5.27,5064175.0,8778,Consumer Discretionary
FFAIW,Faraday Future Intelligent Electric Inc. Warrant,0.0145,5055758.0,430437,Industrials
EEIQ,EpicQuest Education Group International Limited Common Stock,3.05,5022200.0,23747,Real Estate
RENX,RenX Enterprises Corp. Common Stock,1.92,5018644.0,258967,Finance
RNAZ,TransCode Therapeutics Inc. Common Stock,5.24,4979582.0,15311,Health Care
SLE,Super League Enterprise Inc. Common Stock,3.05,4907294.0,27490,Consumer Discretionary
NXGL,NexGel Inc Common Stock,0.5222,4817421.0,183763,Health Care
SCKT,Socket Mobile Inc. Common Stock,0.58,4779756.0,40293,Technology
SXTP,60 Degrees Pharmaceuticals Inc. Common Stock,1.78,4733533.0,159950,Health Care
MBIO,Mustang Bio Inc. Common Stock,0.6996,4709791.0,35996,Health Care
ENSC,Ensysce Biosciences Inc. Common Stock,0.2967,4558953.0,604009,Health Care
CTNT,Cheetah Net Supply Chain Service Inc Class A Common Stock,1.54,4557462.0,14545808,Consumer Discretionary
TWAV,TaoWeave Inc. Common Stock,1.31,4527555.0,120832,Technology
NCPL,Netcapital Inc. Common Stock,0.5764,4523529.0,140690,Finance
CJMB,Callan JMB Inc. Common Stock,0.791,4466079.0,48178,Consumer Discretionary
ALZN,Alzamend Neuro Inc. Common Stock,1.16,4413500.0,58598,Health Care
NWTG,Newton Golf Company Inc. Common Stock,0.9607,4411595.0,69358,Consumer Discretionary
FBLG,FibroBiologics Inc. Common Stock,0.7949,4291754.0,230988,Health Care
RMSG,Real Messenger Corporation Ordinary Shares,0.481,4267086.0,238626,Technology
MTNB,Matinas Biopharma Holdings Inc. Common Stock,0.664,4253711.0,58416,Health Care
CXAIW,CXApp Inc. Warrant,0.0581,4072187.0,4079,Technology
REVB,Revelation Biosciences Inc. Common Stock,1.04,4064757.0,38311,Health Care
ISPC,iSpecimen Inc. Common Stock,2.79,4009668.0,76788,Health Care
BGMS,Bio Green Med Solution Inc. Common Stock,0.722,3985047.0,439324,Health Care
EVGOW,EVgo Inc. Warrants,0.0124,3891856.0,1605079,Technology
HYFM,Hydrofarm Holdings Group Inc. Common Stock,0.8101,3859812.0,10437,Consumer Discretionary
ARTL,Artelo Biosciences Inc. Common Stock,1.1,3834094.0,766215,Health Care
HCTI,Healthcare Triangle Inc. Common Stock,1.88,3812232.0,283003,Technology
BIAF,bioAffinity Technologies Inc. Common Stock,0.8036,3811524.0,176877,Health Care
IVDA,Iveda Solutions Inc. Common Stock,0.335,3731813.0,573766,Technology
GOVX,GeoVax Labs Inc. Common Stock,1.28,3702490.0,110478,Health Care
PW,Power REIT (MD) Common Stock,9.88,3628203.0,8027,Real Estate
FLYE,Fly-E Group Inc. Common Stock,2.21,3607573.0,3109,Industrials
GBR,New Concept Energy Inc Common Stock,0.7,3592354.0,63089,Energy
CAPS,Capstone Holding Corp. Common Stock,0.2465,3558451.0,91075,Consumer Discretionary
IVF,INVO Fertility Inc. Common Stock,1.99,3554210.0,3364877,Health Care
ONCO,Onconetix Inc. Common Stock,0.9543,3522791.0,119646,Health Care
TOIIW,The Oncology Institute Inc. Warrant,0.035,3499403.0,4033,Health Care
SQFT,Presidio Property Trust Inc. Class A Common Stock,2.41,3463242.0,3027,Real Estate
VEEAW,Veea Inc. Warrant,0.0625,3444810.0,2327,Finance
COCHW,Envoy Medical Inc Warrant,0.0446,3428898.0,5242,Health Care
ALBT,Avalon GloboCare Corp. Common Stock,0.28,3373342.0,178394,Health Care
CETX,Cemtrex Inc. Common Stock,3.03,3369914.0,47141,Technology
BIVIW,BioVie Inc. Warrant,0.44,3318409.0,1000,Health Care
PGYWW,Pagaya Technologies Ltd. Warrants,0.0399,3308685.0,229682,Finance
GRI,GRI Bio Inc. Common Stock,1.86,3293759.0,29627,Health Care
FEED,ENvue Medical Inc. Common Stock,0.54,3289594.0,176855,Health Care
NVVE,Nuvve Holding Corp. Common Stock,0.3454,3261865.0,108280,Industrials
MKZR,MacKenzie Realty Capital Inc. Common Stock,1.65,3244560.0,34106,Real Estate
AMIX,Autonomix Medical Inc. Common Stock,5.84,3172884.0,15345,Health Care
VSTD,Vestand Inc. Class A Common Stock,0.2195,3122383.0,131334,Consumer Discretionary
VIVK,Vivakor Inc. Common Stock,0.336,3075472.0,1459515,Uncategorized
BOXL,Boxlight Corporation Class A Common Stock,4.6,3067975.0,139365,Real Estate
SNYR,Synergy CHC Corp. Common Stock,0.204,3039576.0,257756,Health Care
CELZ,Creative Medical Technology Holdings Inc. Common Stock,0.8102,2995040.0,1357960,Finance
CDT,CDT Equity Inc. Common Stock,0.583,2832418.0,830314,Health Care
MSS,Maison Solutions Inc. Class A Common Stock,0.6545,2799096.0,76584,Consumer Staples
VIVS,VivoSim Labs Inc. Common Stock,1.06,2764440.0,706301,Health Care
BLUWW,Blue Water Acquisition Corp. III Warrant.,0.38,2753100.0,1529,Uncategorized
FCUV,Focus Universal Inc. Common Stock,3.79,2663654.0,145796,Industrials
OGEN,Oragenics Inc. Common Stock,0.59,2662055.0,44791,Health Care
VEEE,Twin Vee PowerCats Co. Common Stock,4.98,2636063.0,11948,Industrials
RMCOW,Royalty Management Holding Corporation Warrant,0.172,2607444.0,47461,Miscellaneous
GWAV,Greenwave Technology Solutions Inc. Common Stock,3.11,2580152.0,13764,Industrials
LMFA,LM Funding America Inc. Common Stock,0.1475,2559461.0,1306951,Finance
BNBX,BNB Plus Corp. Common Stock,0.3495,2515431.0,1711088,Consumer Discretionary
BBLG,Bone Biologics Corp Common Stock,1.38,2477459.0,17738,Health Care
ZEOWW,Zeo Energy Corporation Warrants,0.04,2318949.0,199,Miscellaneous
FRGT,Freight Technologies Inc. Ordinary Shares,4.02,2299943.0,67520,Industrials
FUSEW,Fusemachines Inc. Warrants,0.0758,2193594.0,96,Technology
SGLY,Singularity Future Technology Ltd. Common Stock,0.3005,2191694.0,51643,Industrials
VBNB,VanEck BNB ETF Common Shares of Beneficial Interest,21.7797,2177426.0,2938,Finance
HUMAW,Humacyte Inc. Warrant,0.0094,2086980.0,113607,Health Care
ONFO,Onfolio Holdings Inc. Common Stock,0.294,2069856.0,61234,Technology
DRCT,Direct Digital Holdings Inc. Class A Common Stock,2.64,2063664.0,5725,Consumer Discretionary
DAIC,CID HoldCo Inc. Common Stock,1.68,2033443.0,66573,Technology
XXII,22nd Century Group Inc. Common Stock,3.9,2013679.0,18129,Health Care
AEMD,Aethlon Medical Inc. Common Stock,0.8483,2010946.0,217509,Health Care
BFRGW,Bullfrog AI Holdings Inc. Warrants,0.106,1965415.0,10213,Health Care
GCTK,GlucoTrack Inc. Common Stock,0.312,1952895.0,107334,Health Care
SOBR,SOBR Safe Inc. Common Stock,0.681,1911280.0,62299,Consumer Discretionary
IPST,IP Strategy Holdings Inc. Common Stock,2.64,1904966.0,24049,Consumer Staples
SHPH,Shuttle Pharmaceuticals Holdings Inc. Common Stock,3.25,1901669.0,697976,Health Care
EVLVW,Evolv Technologies Holdings Inc. Warrant,0.0105,1888650.0,46505,Technology
BZFDW,BuzzFeed Inc. Warrant,0.0231,1880491.0,8668,Consumer Discretionary
HOLOW,MicroCloud Hologram Inc. Warrant,0.08,1832989.0,6881,Technology
BTOG,Bit Origin Limited Class A Ordinary Shares,1.23,1816516.0,21189862,Finance
EZRA,Reliance Global Group Inc. Common Stock,3.26,1811791.0,84452,Finance
JAGX,Jaguar Health Inc. Common Stock,2.96,1785277.0,34627,Health Care
VBIO,Valion Bio Inc. Common Stock,0.55,1760453.0,107806,Health Care
LRHC,La Rosa Holdings Corp. Common Stock,1.08,1745367.0,95823,Finance
VSEEW,VSee Health Inc. Warrant,0.0354,1720420.0,1,Health Care
ILLRW,Triller Group Inc. Warrant,0.0802,1583685.0,47642,Finance
SHFS,SHF Holdings Inc. Class A Common Stock,0.2448,1580379.0,293808,Finance
RKDA,Arcadia Biosciences Inc. Common Stock,0.719,1568653.0,156103,Consumer Staples
GNLN,Greenlane Holdings Inc. Class A Common Stock,2.48,1566018.0,3316,Consumer Discretionary
BEATW,Heartbeam Inc. Warrant,0.028,1554191.0,171,Health Care
TRUG,TruGolf Holdings Inc. Class A Common Stock,1.38,1536887.0,194759,Consumer Discretionary
MVSTW,Microvast Holdings Inc. Warrants,0.0045,1499208.0,298141,Miscellaneous
BJDX,Bluejay Diagnostics Inc. Common Stock,1.44,1489990.0,2832751,Health Care
IPW,iPower Inc. Common Stock,2.2,1454728.0,407507,Consumer Discretionary
BNCWZ,CEA Industries Inc. Warrant,0.035,1444235.0,16940,Industrials
PDYNW,Palladyne AI Corp Warrants,0.0304,1436224.0,55303,Technology
MOBXW,Mobix Labs Inc Warrants,0.0901,1369401.0,3086,Technology
VGASW,Verde Clean Fuels Inc. Warrant,0.0305,1358763.0,10893,Industrials
TRNR,Interactive Strength Inc. Common Stock,0.58,1351943.0,551602,Technology
UK,Ucommune International Ltd Class A Ordinary Shares,1.95,1322004.0,27738,Consumer Discretionary
SKYAW,SkyAI Inc. Warrant,0.0298,1261201.0,4473,Health Care
SDSTW,Stardust Power Inc. Warrant,0.1107,1171176.0,3387,Industrials
NUWE,Nuwellis Inc. Common Stock,3.18,1158458.0,317806,Health Care
GIPR,Generation Income Properties Inc. Common Stock,0.166,1088690.0,1021676,Real Estate
BNAIW,Brand Engagement Network Inc. Warrant,0.1625,1057499.0,2115,Technology
ZNB,Zeta Network Group Class A Ordinary Shares,0.6539,1033683.0,74320,Consumer Discretionary
AIMDW,Ainos Inc. Warrants,0.1193,1016978.0,1,Technology
SCLXW,Scilex Holding Company Warrant,0.1183,1004517.0,285,Health Care
EDBL,Edible Garden AG Incorporated Common Stock,0.1634,893686.0,285088,Consumer Staples
LIDRW,AEye Inc. Warrant,0.0175,810509.0,21557,Consumer Discretionary
KIDZ,KIDZ AI Inc. Class B Common Stock,0.718,808839.0,374895,Real Estate
KUST,Kustom Entertainment Inc. Common Stock,1.27,796112.0,33822762,Technology
BNCWW,CEA Industries Inc. Warrant,0.0185,763381.0,43,Industrials
WHLR,Wheeler Real Estate Investment Trust Inc. Common Stock,1.29,707679.0,383259,Real Estate
FOXXW,Foxx Development Holdings Inc. Warrant,0.0795,559775.0,414,Telecommunications
PFSA,Profusa Inc. Common Stock,0.1145,533601.0,1467197,Health Care
RCKTW,Rocket Pharmaceuticals Inc. Warrant,0.0048,524129.0,6729,Health Care
DFLIW,Dragonfly Energy Holdings Corp. Warrant,0.039,499798.0,6384,Miscellaneous
SEATW,Vivid Seats Inc. Warrant,0.0408,448286.0,37,Consumer Discretionary
SWAGW,Stran & Company Inc. Warrant,0.0222,416697.0,500,Consumer Discretionary
NXGLW,NexGel Inc Warrant,0.0386,356094.0,6,Health Care
RMSGW,Real Messenger Corporation Warrants,0.04,354851.0,2894,Technology
IVDAW,Iveda Solutions Inc. Warrant,0.031,345332.0,18141,Technology
MYSEW,Myseum.AI Inc. Series A Warrant,0.055,285804.0,109,Telecommunications
BFRIW,Biofrontera Inc. Warrants,0.0222,284234.0,18883,Health Care
MNTSW,Momentus Inc. Warrant,0.015,282537.0,270412,Industrials
CINGW,Cingulate Inc. Warrants,0.0191,257259.0,200,Health Care
LUCYW,Innovative Eyewear Inc. Series A Warrants 8/16/27,0.0386,247184.0,30357,Health Care
BTBDW,BT Brands Inc. Warrant,0.0391,241823.0,6,Consumer Discretionary
TVGNW,Tevogen Bio Holdings Inc. Warrant,0.0568,239659.0,1352,Health Care
HSCSW,HeartSciences Inc. Warrant,0.0743,236623.0,7,Health Care
EDBLW,Edible Garden AG Incorporated Warrant,0.039,213303.0,200,Consumer Staples
NIXXW,Nixxy Inc. Warrant,0.0071,203328.0,311,Technology
CYCUW,Cycurion Inc. Warrant,0.019,202586.0,237,Technology
NCPLW,Netcapital Inc. Warrants,0.0245,192274.0,1166,Finance
SHFSW,SHF Holdings Inc. Warrants,0.0256,165268.0,5393,Finance
KTTAW,Pasithea Therapeutics Corp. Warrant,0.0047,157048.0,14877,Health Care
BENFW,Beneficient Warrant,0.0108,153508.0,6254,Finance
KITTW,Nauticus Robotics Inc. Warrant,0.022,150484.0,42101,Industrials
LNZAW,LanzaTech Global Inc. Warrant,0.0147,148311.0,895,Industrials
LTRYW,Sports Entertainment Gaming Global Corporation Warrants,0.0101,127699.0,84385,Technology
WGSWW,GeneDx Holdings Corp. Warrant,0.0042,124690.0,17142,Technology
AERTW,Aeries Technology Inc. Warrant,0.0216,123970.0,5830,Consumer Discretionary
TNONW,Tenon Medical Inc. Warrant,0.0099,117312.0,2222,Health Care
PIIIW,P3 Health Partners Inc. Warrant,0.015,108675.0,70243,Health Care
CELUW,Celularity Inc. Warrant,0.0033,95522.0,23358,Health Care
SXTPW,60 Degrees Pharmaceuticals Inc. Warrant,0.0302,80310.0,302,Health Care
ONFOW,Onfolio Holdings Inc. Warrant,0.0111,78148.0,19694,Technology
ICUCW,SeaStar Medical Holding Corporation Warrant,0.0173,69148.0,16162,Health Care
ACONW,Aclarion Inc. Warrant,0.0279,68697.0,15612,Health Care
XOSWW,Xos Inc. Warrants,0.0047,64478.0,198215,Consumer Discretionary
MSAIW,MultiSensor AI Holdings Inc. Warrant,0.029,58564.0,122,Technology
CDTTW,CDT Equity Inc. Warrant,0.0114,55385.0,44,Health Care
CDIOW,Cardio Diagnostics Holdings Inc. Warrant,0.0182,53862.0,2500,Health Care
DRMAW,Dermata Therapeutics Inc. Warrant,0.0126,50679.0,57,Health Care
ASBPW,Aspire Biopharma Holdings Inc. Warrant,0.022,28495.0,1534,Health Care
SQFTW,Presidio Property Trust Inc. Series A Common Stock Purchase Warrants,0.0173,24861.0,112,Real Estate
BNZIW,Banzai International Inc. Warrant,0.0098,21033.0,7691,Technology
APLMW,Apollomics Inc. Warrant,0.0083,18227.0,109307,Health Care
DAICW,CID HoldCo Inc. Warrants,0.014,16945.0,12354,Technology
KIDZW,KIDZ AI Inc. Warrants,0.0146,16447.0,4773,Real Estate
GUG,Guggenheim Active Allocation Fund Common Shares of Beneficial Interest,15.95,0.0,87483,Finance
GPAC,General Purpose Acquisition Corp. Class A Ordinary Shares,10.0,0.0,108,Uncategorized
MACI,Melar Acquisition Corp. I Class A Ordinary Shares,10.88,0.0,11,Uncategorized
APMCU,AmperCap Acquisition Company Unit,10.05,0.0,233662,Finance
APUR,Aperture AC Class A Ordinary Shares,9.9,0.0,1105,Finance
APXT,Apex Treasury Corporation Class A Ordinary Share,10.05,0.0,1678,Technology
LCCC,Lakeshore Acquisition III Corp. Ordinary Shares,10.41,0.0,17,Finance
APXTU,Apex Treasury Corporation Units,10.27,0.0,100,Finance
APXTW,Apex Treasury Corporation Warrants,0.3,0.0,252,Finance
HACQ,HCM IV Acquisition Corp. Class A Ordinary Share,10.03,0.0,25029,Finance
LPAAW,Launch One Acquisition Corp. Warrant,0.152,0.0,29,Finance
VFL,abrdn National Municipal Income Fund Common Stock,10.38,0.0,38934,Finance
MCGAU,Yorkville Acquisition Corp. Unit,10.31,0.0,17,Finance
APMCR,AmperCap Acquisition Company Right,0.17,0.0,454750,Finance
HCIC,Hennessy Capital Investment Corp. VIII Class A Ordinary Shares,9.93,0.0,322,Uncategorized
GUACU,Berto Acquisition Corp. II Unit,10.135,0.0,5001,Uncategorized
VNMEW,Vendome Acquisition Corporation I Warrant,0.3,0.0,2,Finance
CLM,Cornerstone Strategic Investment Fund Inc. Common Shares,7.45,0.0,1160961,Finance
RNGT,Range Capital Acquisition Corp II Class A Ordinary Shares,10.09,0.0,7,Finance
RNGTW,Range Capital Acquisition Corp II Warrants,0.3545,0.0,5551,Finance
ARCLR,ARC Group Acquisition I Corp Right,0.2319,0.0,150,Finance
HEQ,John Hancock Diversified Income Fund Common Shares of Beneficial Interest,11.35,0.0,33287,Finance
ARCLU,ARC Group Acquisition I Corp Unit,10.21,0.0,1,Finance
ARCLW,ARC Group Acquisition I Corp Warrants,0.12,0.0,11,Finance
HFRO,Highland Opportunities and Income Fund Common Shares of Beneficial Interest,7.24,0.0,194746,Finance
HERZ,Herzfeld Credit Income Fund Inc. Common Stock,16.58,0.0,8055,Finance
UYSC,UY Scuti Acquisition Corp. Ordinary Shares,10.7,0.0,6,Finance
VBF,Invesco Bond Fund Common Stock,15.14,0.0,47985,Finance
APMC,AmperCap Acquisition Company Ordinary Shares,9.91,0.0,100708,Finance
MCGAW,Yorkville Acquisition Corp. Warrant,0.3095,0.0,7460,Uncategorized
VNMEU,Vendome Acquisition Corporation I Unit,10.3,0.0,21,Finance
GSRF,GSR IV Acquisition Corp. Class A ordinary share,10.16,0.0,9,Uncategorized
GSHR,Gesher Acquisition Corp. II Class A Ordinary Shares,10.44,0.0,10,Uncategorized
VHCP,Vine Hill Capital Investment Corp. II Class A Ordinary Shares,9.99,0.0,96507,Uncategorized
LPAA,Launch One Acquisition Corp. Class A Ordinary shares,10.83,0.0,206,Uncategorized
GRF,Eagle Capital Growth Fund Inc. Common Stock,10.195,0.0,6792,Finance
LKSPR,Lake Superior Acquisition Corp. Rights,1.05,0.0,1077,Uncategorized
VHCPU,Vine Hill Capital Investment Corp. II Units,10.1,0.0,50800,Finance
AOMD,Angel Oak Mortgage REIT Inc. 9.750% Senior Notes due 2030,24.94,0.0,14508,Finance
LKSP,Lake Superior Acquisition Corp. Class A Ordinary Shares,10.145,0.0,450196,Uncategorized
APAC,StoneBridge Acquisition II Corporation Class A Ordinary Shares,10.16,0.0,129,Uncategorized
APACU,StoneBridge Acquisition II Corporation Units,10.39,0.0,48,Finance
VNME,Vendome Acquisition Corporation I Class A Ordinary Shares,10.18,0.0,6,Finance
VLT,Invesco High Income Trust II,10.4,0.0,17028,Finance
LPBB,Launch Two Acquisition Corp. Class A Ordinary Shares,10.72,0.0,9535,Uncategorized
LPBBU,Launch Two Acquisition Corp. Unit,10.86,0.0,575,Finance
LPBBW,Launch Two Acquisition Corp. Warrant,0.3303,0.0,19553,Finance
VHCPW,Vine Hill Capital Investment Corp. II Warrants,0.4555,0.0,26705,Uncategorized
MBAV,M3-Brigade Acquisition V Corp. Class A Ordinary shares,10.82,0.0,640417,Uncategorized
CIMP,Chimera Investment Corporation 8.875% Senior Notes due 2030,25.19,0.0,12723,Real Estate
CIMO,Chimera Investment Corporation 9.250% Senior Notes due 2029,25.3076,0.0,8225,Real Estate
CIK,Credit Suisse Asset Management Income Fund Inc. Common Stock,2.46,0.0,516906,Finance
AOMN,Angel Oak Mortgage REIT Inc. 9.500% Senior Notes due 2029,25.33,0.0,2734,Finance
AOD,abrdn Total Dynamic Dividend Fund Common Shares of Beneficial Interest,10.33,0.0,440889,Finance
LPCV,Launchpad Cadenza Acquisition Corp I Class A Ordinary Share,9.99,0.0,316,Uncategorized
LPCVW,Launchpad Cadenza Acquisition Corp I Warrant,0.3901,0.0,32,Uncategorized
GSRFR,GSR IV Acquisition Corp. Rights,2.4,0.0,7697,Uncategorized
LWACW,LightWave Acquisition Corp. Warrants,0.3099,0.0,15,Finance
ANSCW,Agriculture & Natural Solutions Acquisition Corporation Warrant,0.2022,0.0,100,Uncategorized
GPAT,GP-Act III Acquisition Corp. Class A Ordinary Share,10.87,0.0,6458,Uncategorized
GPATW,GP-Act III Acquisition Corp. Warrants,0.202,0.0,6637,Uncategorized
ANSC,Agriculture & Natural Solutions Acquisition Corporation Class A Ordinary Shares,11.42,0.0,425,Uncategorized
GOF,Guggenheim Strategic Opportunities Fund Common Shares of Beneficial Interest,10.81,0.0,851910,Finance
GTEN,Gores Holdings X Inc. Class A ordinary shares,10.43,0.0,859,Uncategorized
VGI,Virtus Global Multi-Sector Income Fund Common Shares of Beneficial Interest,7.45,0.0,28896,Finance
LWAC,LightWave Acquisition Corp. Class A Ordinary Shares,10.2,0.0,8,Finance
DMII,Drugs Made In America Acquisition II Corp. Ordinary Shares,10.07,0.0,1760,Finance
DMIIR,Drugs Made In America Acquisition II Corp. Right,0.0722,0.0,402,Finance
DMO,Western Asset Mortgage Opportunity Fund Inc. Common Stock,10.66,0.0,48153,Finance
BWG,BrandywineGLOBAL Global Income Opportunities Fund Inc.,7.94,0.0,67317,Finance
BTT,BlackRock Municipal 2030 Target Term Trust,22.63,0.0,164252,Finance
BUI,BlackRock Utility Infrastructure & Power Opportunities Trust,29.0,0.0,101960,Finance
PMTR,Perimeter Acquisition Corp. I Class A Ordinary Shares,10.39,0.0,28088,Finance
PMTV,PennyMac Mortgage Investment Trust 9.00% Senior Notes due 2030,25.25,0.0,10605,Real Estate
PEO,Adams Natural Resources Fund Inc. Common Stock,24.64,0.0,67666,Finance
PFD,Flaherty & Crumrine Preferred and Income Fund Incorporated,11.56,0.0,19812,Finance
LCCCR,Lakeshore Acquisition III Corp. Rights,0.2,0.0,19207,Finance
PFLA,PennantPark Floating Rate Capital Ltd. 7.375% Notes Due 2031,25.3,0.0,15512,Finance
PFN,PIMCO Income Strategy Fund II,7.1,0.0,672081,Finance
METCZ,Ramaco Resources Inc. 8.375% Senior Notes due 2029,25.505,0.0,5676,Energy
MEVO,M Evo Global Acquisition Corp II Class A Ordinary Shares,9.92,0.0,7,Finance
MEVOW,M Evo Global Acquisition Corp II Warrants,0.371,0.0,2060,Finance
ARTC,Art Technology Acquisition Corp. Class A Ordinary Shares,9.92,0.0,21449,Finance
MKLYU,McKinley Acquisition Corporation Units,10.33,0.0,3,Finance
GCGR,General Catalyst Global Resilience Merger Corp. Class A Ordinary Shares,10.07,0.0,380941,Uncategorized
GCGRU,General Catalyst Global Resilience Merger Corp. Units,10.28,0.0,2823,Uncategorized
GCGRW,General Catalyst Global Resilience Merger Corp. Warrants,0.9563,0.0,17961,Uncategorized
ATII,Archimedes Tech SPAC Partners II Co. Ordinary Shares,10.81,0.0,533408,Uncategorized
PFL,PIMCO Income Strategy Fund Shares of Beneficial Interest,7.79,0.0,174949,Finance
FSHP,Flag Ship Acquisition Corp. Ordinary Shares,11.21,0.0,115,Uncategorized
FSHPR,Flag Ship Acquisition Corp. Right,0.096,0.0,5192,Uncategorized
FSHPU,Flag Ship Acquisition Corp. Unit,11.01,0.0,18,Uncategorized
TWN,Taiwan Fund Inc. (The) Common Stock,93.92,0.0,119503,Finance
TWOD,Two Harbors Investments Corp 9.375% Senior Notes due 2030,25.5,0.0,24248,Real Estate
NAD,Nuveen Quality Municipal Income Fund Common Stock,12.06,0.0,454943,Finance
ATIIW,Archimedes Tech SPAC Partners II Co. Warrant,2.0101,0.0,14964,Finance
ASG,Liberty All-Star Growth Fund Inc.,5.39,0.0,217396,Finance
ASGI,abrdn Global Infrastructure Income Fund Common Shares of Beneficial Interest,23.03,0.0,201004,Finance
GDL,GDL Fund The Common Shares of Beneficial Interest,8.46,0.0,853,Finance
MPA,Blackrock MuniYield Pennsylvania Quality Fund Common Stock,11.33,0.0,24610,Finance
DMAAR,Drugs Made In America Acquisition Corp. Rights,0.105,0.0,14,Finance
FWACU,Futurewave Acquisition Corporation Units,10.0192,0.0,21693,Uncategorized
FXACU,FortuneX Acquisition Corporation Units,10.05,0.0,5677,Finance
GAING,Gladstone Investment Corporation 7.125% Notes due 2031,25.08,0.0,3376,Finance
GAINI,Gladstone Investment Corporation 7.875% Notes due 2030,25.65,0.0,16442,Finance
MLAA,Mountain Lake Acquisition Corp. II Class A Ordinary Shares,9.94,0.0,1360,Finance
MLAAW,Mountain Lake Acquisition Corp. II Warrants,0.2735,0.0,120,Finance
