symbol,name,price,marketCap,volume,industry
OPLN,OPENLANE Inc. Common Stock,41.54,4401001243.0,1376263,Consumer Discretionary
POWI,Power Integrations Inc. Common Stock,78.96,4399649937.0,879673,Technology
SEB,Seaboard Corporation Common Stock,4591.23,4397452547.0,4817,Industrials
NVST,Envista Holdings Corporation Common Stock,27.02,4396908479.0,2516358,Health Care
BFH,Bread Financial Holdings Inc. Common Stock,108.73,4393460177.0,877931,Consumer Discretionary
LFTO,Liftoff Mobile Inc. Common Stock,25.47,4391371055.0,1879235,Technology
OLLI,Ollie's Bargain Outlet Holdings Inc. Common Stock,72.33,4372586610.0,2274887,Consumer Discretionary
MIR,Mirion Technologies Inc. Class A Common Stock,17.46,4372337967.0,4470744,Industrials
OXLCM,Oxford Lane Capital Corp. Preferred Stock Shares 8.25% Series 2031,24.979,4336354400.0,8663,Finance
PTRN,Pattern Group Inc. Series A Common Stock,24.45,4324375778.0,4076682,Consumer Discretionary
ACAD,ACADIA Pharmaceuticals Inc. Common Stock,25.2,4315143924.0,2090149,Health Care
DHCNI,Diversified Healthcare Trust 5.625% Senior Notes due 2042,17.86,4311660416.0,25044,Real Estate
TDS,Telephone and Data Systems Inc. Common Shares,37.87,4309606000.0,1408809,Telecommunications
TPC,Tutor Perini Corporation Common Stock,81.88,4308091882.0,539998,Consumer Discretionary
SXI,Standex International Corporation Common Stock,355.03,4301160758.0,357198,Industrials
HHH,Howard Hughes Holdings Inc. Common Stock,72.13,4300721605.0,406373,Real Estate
HGV,Hilton Grand Vacations Inc. Common Stock ,53.78,4289700875.0,1418896,Consumer Discretionary
DTW,DTE Energy Company 2017 Series E 5.25% Junior Subordinated Debentures due 2077,20.61,4287463531.0,39855,Utilities
LBRT,Liberty Energy Inc. Class A common stock,26.27,4287038498.0,3829857,Energy
FHI,Federated Hermes Inc. Common Stock,56.45,4285269262.0,503512,Finance
OXLCZ,Oxford Lane Capital Corp. 5.00% Notes due 2027,24.63,4275768000.0,1824,Finance
KBR,KBR Inc. Common Stock,33.71,4274089450.0,3975738,Industrials
ELC,Entergy Louisiana Inc. Collateral Trust Mortgage Bonds 4.875 % Series due September 1 2066,20.03,4271148167.0,19171,Utilities
HCC,Warrior Met Coal Inc. Common Stock,80.81,4266926711.0,880021,Energy
OXLCN,Oxford Lane Capital Corp. 7.125% Series 2029 Term Preferred Stock,24.56,4263616000.0,1057,Finance
CWEN,Clearway Energy Inc. Class C Common Stock,35.18,4256780000.0,2156482,Utilities
BRC,Brady Corporation Common Stock,90.0,4240151100.0,259687,Consumer Discretionary
VECO,Veeco Instruments Inc. Common Stock,69.47,4239996203.0,2219423,Technology
NTSK,Netskope Inc. Class A Common Stock,10.495,4239178696.0,5810191,Technology
UCB,United Community Banks Inc. Common Stock,35.36,4232119696.0,1395034,Finance
OXLCL,Oxford Lane Capital Corp. 6.75% Notes due 2031,24.332,4224035200.0,4763,Finance
ONDS,Ondas Inc. Common Stock,8.02,4222856879.0,58290112,Technology
EE,Excelerate Energy Inc. Class A Common Stock,37.04,4217345435.0,299862,Utilities
CVSA,Covista Inc. Common Shares,123.85,4214725355.0,410247,Real Estate
NVTS,Navitas Semiconductor Corporation Common Stock,17.74,4204270580.0,17585734,Technology
REGCP,Regency Centers Corporation 6.25% Series A Cumulative Redeemable Preferred Stock,22.8498,4183725032.0,2588,Real Estate
EXTR,Extreme Networks Inc. Common Stock,31.98,4182283254.0,2329508,Telecommunications
MMSI,Merit Medical Systems Inc. Common Stock,70.09,4181208787.0,836708,Health Care
EPAM,EPAM Systems Inc. Common Stock,80.03,4181123414.0,1500050,Technology
MMED,MiniMed Group Inc. Common Stock,14.88,4178601421.0,1339531,Health Care
CRK,Comstock Resources Inc. Common Stock,14.19,4167543856.0,2605095,Energy
OXLCO,Oxford Lane Capital Corp. Preferred Stock Shares 6.00% Series 2029,24.006,4167441600.0,5720,Finance
ATMU,Atmus Filtration Technologies Inc. Common Stock,51.0,4165293828.0,1248460,Consumer Discretionary
HLNE,Hamilton Lane Incorporated Class A Common Stock,75.0,4165036050.0,1024115,Finance
ELF,e.l.f. Beauty Inc. Common Stock,69.91,4155487173.0,3407003,Consumer Discretionary
CDP,COPT Defense Properties Common Shares of Beneficial Interest,36.64,4154128993.0,1336862,Real Estate
CATY,Cathay General Bancorp Common Stock,61.83,4144803419.0,499771,Finance
COCO,The Vita Coco Company Inc. Common Stock,72.53,4142379997.0,1646784,Consumer Staples
MHO,M/I Homes Inc. Common Stock,161.34,4128708186.0,269794,Consumer Discretionary
DNLI,Denali Therapeutics Inc. Common Stock,25.89,4108995091.0,2176876,Health Care
THO,Thor Industries Inc. Common Stock,78.92,4108367877.0,570863,Industrials
PLNT,Planet Fitness Inc. Common Stock,51.58,4097658438.0,1753803,Consumer Discretionary
MWA,MUELLER WATER PRODUCTS Common Stock,26.1,4083895162.0,1438631,Industrials
POST,Post Holdings Inc. Common Stock,89.73,4066795642.0,833086,Consumer Staples
PI,Impinj Inc. Common Stock,133.3,4060209361.0,353158,Technology
BNL,Broadstone Net Lease Inc. Common Stock,21.16,4057780304.0,2487319,Real Estate
PDI,PIMCO Dynamic Income Fund Common Stock,16.65,4047448500.0,2057963,Finance
BMI,Badger Meter Inc. Common Stock,138.67,4047162992.0,552469,Industrials
PII,Polaris Inc. Common Stock,71.08,4043468750.0,653140,Consumer Discretionary
CDNL,Cardinal Infrastructure Group Inc. Class A Common Stock,94.31,4042773472.0,1110485,Industrials
VNT,Vontier Corporation Common Stock ,28.71,4042368000.0,1775409,Industrials
HGTY,Hagerty Inc. Class A Common Stock,11.76,4037847768.0,104793,Finance
OLED,Universal Display Corporation Common Stock,86.25,4032264349.0,775099,Technology
INDB,Independent Bank Corp. Common Stock,83.41,4030964245.0,455843,Finance
BELFB,Bel Fuse Inc. Class B Common Stock,315.65,4015922465.0,427983,Uncategorized
LFST,LifeStance Health Group Inc. Common Stock,10.34,4010208027.0,4778770,Health Care
REGCO,Regency Centers Corporation 5.875% Series B Cumulative Redeemable Preferred Stock,21.855,4001580345.0,2073,Real Estate
WSFS,WSFS Financial Corporation Common Stock,76.7,3991778328.0,465165,Finance
CNR,Core Natural Resources Inc. Common Stock,79.12,3988250103.0,1016609,Energy
APLE,Apple Hospitality REIT Inc. Common Shares,16.89,3987180987.0,2672903,Real Estate
MAT,Mattel Inc. Common Stock,13.69,3978314000.0,4977156,Consumer Discretionary
WHD,Cactus Inc. Class A Common Stock,49.59,3975970735.0,768831,Consumer Discretionary
EMAT,Evolution Metals & Technologies Corp. Common Stock,6.7,3975444008.0,80721,Miscellaneous
ANF,Abercrombie & Fitch Company Common Stock,89.39,3971750557.0,1147227,Consumer Discretionary
DORM,Dorman Products Inc. Common Stock,132.56,3961262510.0,292690,Consumer Discretionary
IRT,Independence Realty Trust Inc. Common Stock,16.79,3958174484.0,2731557,Real Estate
CVBF,CVB Financial Corporation Common Stock,22.4,3952596390.0,1732660,Finance
CLSK,CleanSpark Inc. Common Stock,15.37,3944074274.0,18789806,Finance
CAKE,Cheesecake Factory Incorporated (The) Common Stock,79.36,3943030408.0,1078048,Consumer Discretionary
OII,Oceaneering International Inc. Common Stock,39.53,3942929693.0,1421683,Energy
SMG,Scotts Miracle-Gro Company (The) Common Stock,67.69,3938335316.0,1427085,Industrials
RNST,Renasant Corporation Common Stock,42.68,3938174082.0,1259084,Finance
GEO,Geo Group Inc (The) REIT,29.46,3936394647.0,2284634,Consumer Discretionary
KBH,KB Home Common Stock,62.64,3924286129.0,1627776,Consumer Discretionary
SKYW,SkyWest Inc. Common Stock,98.71,3914866338.0,519145,Consumer Discretionary
RCUS,Arcus Biosciences Inc. Common Stock,31.08,3909029875.0,1565372,Health Care
MKTX,MarketAxess Holdings Inc. Common Stock,109.93,3906852068.0,709339,Finance
EXLS,ExlService Holdings Inc. Common Stock,25.57,3906659546.0,3812602,Consumer Discretionary
CRNX,Crinetics Pharmaceuticals Inc. Common Stock,36.94,3894961284.0,883708,Health Care
IRTC,iRhythm Holdings Inc. Common Stock,118.42,3891566355.0,528614,Health Care
CHEF,The Chefs' Warehouse Inc. Common Stock,95.29,3885700267.0,573422,Consumer Discretionary
CNS,Cohen & Steers Inc Common Stock,75.36,3873044982.0,420109,Finance
INSW,International Seaways Inc. Common Stock ,77.81,3851960396.0,861031,Consumer Discretionary
CPRX,Catalyst Pharmaceuticals Inc. Common Stock,31.46,3850106008.0,1752951,Health Care
WAY,Waystar Holding Corp. Common Stock,19.98,3832421562.0,1813583,Technology
MSGE,Madison Square Garden Entertainment Corp. Class A Common Stock,80.95,3829358692.0,749615,Consumer Discretionary
FOUR,Shift4 Payments Inc. Class A Common Stock,48.23,3826034005.0,1649339,Consumer Discretionary
CNK,Cinemark Holdings Inc Cinemark Holdings Inc. Common Stock,32.7,3818959719.0,2228874,Consumer Discretionary
CON,Concentra Group Holdings Parent Inc. Common Stock,29.77,3809422191.0,1001122,Health Care
YETI,YETI Holdings Inc. Common Stock,50.24,3806098148.0,1188670,Consumer Discretionary
BCO,Brinks Company (The) Common Stock,92.16,3795204465.0,699913,Industrials
CII,BlackRock Enhanced Large Cap Core Fund Inc. Common Stock,25.46,3787492512.0,82554,Finance
BKD,Brookdale Senior Living Inc. Common Stock,15.86,3787206165.0,4993475,Health Care
RLAY,Relay Therapeutics Inc. Common Stock,19.74,3781910897.0,4215772,Health Care
BETA,Beta Technologies Inc. Class A Common Stock,16.37,3777476031.0,1391989,Industrials
USAC,USA Compression Partners LP Common Units Representing Limited Partner Interests,26.03,3773630479.0,86338,Utilities
BANF,BancFirst Corporation Common Stock,112.27,3770743668.0,292211,Finance
DOCS,Doximity Inc. Class A Common Stock,20.59,3765335448.0,5530250,Technology
SLG,SL Green Realty Corp Common Stock,52.93,3764618885.0,1722464,Real Estate
NHI,National Health Investors Inc. Common Stock,77.6,3761355730.0,7913604,Real Estate
CALM,Cal-Maine Foods Inc. Common Stock,79.34,3758858492.0,736570,Consumer Staples
LOPE,Grand Canyon Education Inc. Common Stock,141.75,3758401458.0,294162,Real Estate
ABG,Asbury Automotive Group Inc Common Stock,201.46,3750943448.0,360115,Consumer Discretionary
SMR,NuScale Power Corporation Class A Common Stock,10.26,3749836661.0,20705372,Industrials
FIBK,First Interstate BancSystem Inc. Common Stock (DE),38.59,3748743701.0,979789,Finance
BWIN,The Baldwin Insurance Group Inc. Class A Common Stock,26.25,3742400156.0,1824224,Finance
OTTR,Otter Tail Corporation Common Stock,88.87,3731131411.0,265482,Utilities
WSBC,WesBanco Inc. Common Stock,38.79,3730843922.0,1093209,Finance
BFAM,Bright Horizons Family Solutions Inc. Common Stock,70.89,3729287191.0,1020687,Consumer Discretionary
AAP,Advance Auto Parts Inc.,61.63,3718089089.0,1972261,Consumer Discretionary
ITRI,Itron Inc. Common Stock,83.72,3712090131.0,663917,Industrials
KAI,Kadant Inc Common Stock,313.77,3705141122.0,194986,Industrials
ICUI,ICU Medical Inc. Common Stock,147.93,3697301029.0,344303,Health Care
WRBY,Warby Parker Inc. Class A Common Stock,30.11,3694955756.0,2867440,Health Care
TENB,Tenable Holdings Inc. Common Stock,33.49,3693008376.0,6013287,Technology
HAYW,Hayward Holdings Inc. Common Stock,16.99,3686201234.0,4095296,Industrials
ATRO,Astronics Corporation Common Stock,85.66,3684103227.0,546391,Industrials
BOX,Box Inc. Class A Common Stock,26.57,3678611850.0,2388675,Technology
ICHR,Ichor Holdings Ordinary Shares,105.46,3677079409.0,1092744,Technology
GPCR,Structure Therapeutics Inc. American Depositary Shares,51.69,3673841732.0,778714,Health Care
LRN,Stride Inc. Common Stock,86.35,3672019934.0,726815,Real Estate
LASR,nLIGHT Inc. Common Stock,65.04,3668822433.0,1098931,Technology
ASBA,Associated Banc-Corp 6.625% Fixed-Rate Reset Subordinated Notes due 2033,24.2601,3660868862.0,142520,Finance
UNMA,Unum Group 6.250% Junior Subordinated Notes due 2058,21.48,3658328395.0,135414,Finance
BHF,Brighthouse Financial Inc. Common Stock,63.57,3651828552.0,279706,Finance
GNW,Genworth Financial Inc Common Stock,9.52,3646248117.0,3066162,Finance
ADEA,Adeia Inc. Common Stock,33.0,3639693717.0,2435682,Technology
NSIT,Insight Enterprises Inc. Common Stock,120.41,3636853646.0,617573,Consumer Discretionary
PTEN,Patterson-UTI Energy Inc. Common Stock,9.55,3625348586.0,8598898,Energy
BATRA,Atlanta Braves Holdings Inc. Series A Common Stock,56.47,3622201572.0,46326,Consumer Discretionary
JOE,St. Joe Company (The) Common Stock,62.97,3615091706.0,358779,Real Estate
PLUG,Plug Power Inc. Common Stock,2.59,3613228922.0,44626028,Energy
BEAM,Beam Therapeutics Inc. Common Stock,34.95,3595628529.0,2894616,Health Care
BULL,Webull Corporation Class A Ordinary Shares,6.75,3589775989.0,7077011,Finance
KFY,Korn Ferry Common Stock,70.52,3586435640.0,796912,Consumer Discretionary
BILL,BILL Holdings Inc. Common Stock,35.93,3578510401.0,2042312,Technology
FG,F&G Annuities & Life Inc. Common Stock,26.99,3575769880.0,465997,Finance
OGN,Organon & Co. Common Stock ,13.55,3558241680.0,1449864,Health Care
FHB,First Hawaiian Inc. Common Stock,29.25,3558232460.0,1915490,Finance
DTB,DTE Energy Company 2020 Series G 4.375% Junior Subordinated Debentures due 2080,17.1,3557284152.0,58550,Utilities
FFBC,First Financial Bancorp. Common Stock,33.9,3557105779.0,1113142,Finance
ACHR,Archer Aviation Inc. Class A Common Stock,4.68,3554918682.0,34900121,Industrials
DTG,DTE Energy Company 2021 Series E 4.375% Junior Subordinated Debentures,17.04,3544802454.0,29395,Utilities
GPI,Group 1 Automotive Inc. Common Stock,297.85,3543876785.0,310519,Consumer Discretionary
VAC,Marriott Vacations Worldwide Corporation Common Stock,103.04,3538709315.0,489211,Finance
NAN,Nuveen New York Quality Municipal Income Fund Common Stock,11.7,3537094860.0,84577,Finance
FLNC,Fluence Energy Inc. Class A Common Stock,19.15,3528967496.0,10243661,Miscellaneous
MCHB,Mechanics Bancorp Class A Common Stock,15.91,3522491183.0,531479,Finance
IPAR,Interparfums Inc. Common Stock,109.97,3521875137.0,365049,Consumer Discretionary
BKU,BankUnited Inc. Common Stock,48.41,3518521775.0,918496,Finance
OSIS,OSI Systems Inc. Common Stock (DE),213.24,3514811464.0,241594,Technology
DYN,Dyne Therapeutics Inc. Common Stock,21.26,3514571303.0,2172743,Health Care
CBU,Community Financial System Inc. Common Stock,66.82,3511720356.0,530954,Finance
NSA,National Storage Affiliates Trust Common Shares of Beneficial Interest,45.35,3501588372.0,522819,Real Estate
FULTP,Fulton Financial Corporation Depositary Shares Each Representing a 1/40th Interest in a Share of Fixed Rate Non-Cumulative Perpetual Preferred Stock Series A,18.3,3497744624.0,2976,Finance
KN,Knowles Corporation Common Stock,40.88,3497719781.0,1185668,Consumer Staples
CALY,Callaway Golf Company Common Stock,19.21,3495760324.0,1992868,Consumer Discretionary
MIAX,Miami International Holdings Inc. Common Stock,36.83,3495427977.0,3052842,Finance
BELFA,Bel Fuse Inc. Class A Common Stock,272.57,3467828247.0,295879,Uncategorized
PBLS,Parabilis Medicines Inc. Common Stock,29.19,3466333488.0,557240,Health Care
NIC,Nicolet Bankshares Inc. Common Stock,162.92,3462360363.0,385187,Finance
ALMS,Alumis Inc. Common Stock,27.14,3460132337.0,1701308,Health Care
GRBK,Green Brick Partners Inc. Common Stock,80.14,3457743120.0,271218,Consumer Discretionary
PPLI,People Incorporated Common Stock,46.37,3449348190.0,1257728,Technology
PENG,Penguin Solutions Inc. Common Stock,67.94,3447785694.0,2486804,Technology
OUST,Ouster Inc. Common Stock,54.07,3431341190.0,10084471,Industrials
GEF,Greif Inc. Class A Common Stock,74.25,3425620795.0,206587,Uncategorized
ADPT,Adaptive Biotechnologies Corporation Common Stock,21.4,3424949989.0,3524606,Health Care
NTRSO,Northern Trust Corporation Depositary Shares Each Representing a 1/1000th Interest in a Share of Series E Non-Cumulative Perpetual Preferred Stock,18.5,3423374273.0,23860,Finance
BHE,Benchmark Electronics Inc. Common Stock,95.16,3414058746.0,611192,Technology
HAE,Haemonetics Corporation Common Stock,75.12,3413902243.0,612934,Health Care
AVA,Avista Corporation Common Stock,41.26,3409661622.0,877182,Utilities
PVH,PVH Corp. Common Stock,73.29,3379262063.0,1359290,Industrials
AVNT,Avient Corporation Common Stock,36.84,3378602552.0,1088854,Industrials
UWMC,UWM Holdings Corporation Class A Common Stock,2.1,3362285058.0,40770185,Finance
UPST,Upstart Holdings Inc. Common stock,35.03,3352776262.0,5351516,Finance
PLMR,Palomar Holdings Inc. Common stock,126.33,3348234023.0,485655,Finance
OPCH,Option Care Health Inc. Common Stock,21.32,3347826385.0,2602025,Health Care
ARQT,Arcutis Biotherapeutics Inc. Common Stock,26.76,3347231088.0,1386280,Health Care
HP,Helmerich & Payne Inc. Common Stock,33.35,3332697249.0,1194818,Energy
GBDC,Golub Capital BDC Inc. Common Stock,12.78,3329128413.0,1478575,Finance
HIW,Highwoods Properties Inc. Common Stock,30.18,3328029995.0,1388529,Real Estate
RHI,Robert Half Inc. Common Stock,32.38,3312266412.0,1811875,Consumer Discretionary
TDW,Tidewater Inc. Common Stock,66.6,3312061423.0,804010,Consumer Discretionary
CRGY,Crescent Energy Company Class A Common Stock,10.0,3302516280.0,5699889,Energy
WDFC,WD-40 Company Common Stock,245.42,3302224759.0,214875,Industrials
CURB,Curbline Properties Corp. Common Stock,31.27,3300215287.0,1220952,Finance
BATRK,Atlanta Braves Holdings Inc. Series C Common Stock,51.38,3295709523.0,1105428,Consumer Discretionary
PRK,Park National Corporation Common Stock,182.01,3293669159.0,149373,Finance
SFNC,Simmons First National Corporation Class A Common Stock,22.67,3288605618.0,1437154,Finance
AB,AllianceBernstein Holding L.P.  Units,35.1,3278475240.0,342668,Finance
RNG,RingCentral Inc. Class A Common Stock,39.09,3278032830.0,1776581,Technology
LXP,LXP Industrial Trust Common Stock (Maryland REIT),55.27,3258305338.0,672612,Real Estate
ARCB,ArcBest Corporation Common Stock,145.81,3246281762.0,365731,Industrials
AWR,American States Water Company Common Stock,82.79,3244759742.0,423502,Utilities
TDC,Teradata Corporation Common Stock,34.32,3229512000.0,3564615,Technology
CSQ,Calamos Strategic Total Return Common Stock,20.29,3223829850.0,161872,Finance
NHC,National HealthCare Corporation Common Stock,206.33,3222800528.0,137295,Health Care
PRVA,Privia Health Group Inc. Common Stock,25.55,3219616156.0,1365607,Health Care
CWK,Cushman & Wakefield Ltd. Common Shares,13.74,3219288939.0,2632266,Finance
SBCF,Seacoast Banking Corporation of Florida Common Stock,33.1,3218868153.0,1438107,Finance
RUN,Sunrun Inc. Common Stock,13.48,3215644389.0,10962255,Miscellaneous
COHU,Cohu Inc. Common Stock,68.12,3213584638.0,1244414,Industrials
IDYA,IDEAYA Biosciences Inc. Common Stock,36.55,3211316626.0,1040685,Health Care
RWTN,Redwood Trust Inc. 9.125% Senior Notes Due 2029,24.85,3211203080.0,2860,Real Estate
BOH,Bank of Hawaii Corporation Common Stock,80.8,3201378174.0,414876,Finance
FUL,H. B. Fuller Company Common Stock,59.14,3180987487.0,1394715,Industrials
RWTO,Redwood Trust Inc. 9.00% Senior Notes Due 2029,24.6,3178897214.0,2571,Real Estate
MZTI,The Marzetti Company Common Stock,115.52,3167789440.0,342072,Consumer Staples
NATL,NCR Atleos Corporation Common Stock,42.88,3163678553.0,714538,Miscellaneous
DK,Delek US Holdings Inc. Common Stock,51.58,3161211416.0,1475745,Energy
LBRDP,Liberty Broadband Corporation Series A Cumulative Redeemable Preferred Stock,22.0,3156950060.0,33411,Telecommunications
LEU,Centrus Energy Corp. Class A Common Stock,160.25,3152565239.0,657978,Industrials
COLM,Columbia Sportswear Company Common Stock,61.64,3152318419.0,606176,Consumer Discretionary
FGN,F&G Annuities & Life Inc. 7.950% Senior Notes due 2053,24.99,3151202715.0,64738,Finance
GPK,Graphic Packaging Holding Company,10.65,3151200672.0,4029307,Consumer Discretionary
CRVL,CorVel Corp. Common Stock,61.65,3144708487.0,236876,Finance
AD,Array Digital Infrastructure Inc. Common Shares,36.37,3142368000.0,449452,Telecommunications
BANC,Banc of California Inc. Common Stock,20.44,3142134646.0,2864489,Finance
NMIH,NMI Holdings Inc. Common Stock,41.22,3131561347.0,819858,Finance
CLMT,Calumet Inc. Common Stock,35.83,3122482277.0,770815,Energy
SHOO,Steven Madden Ltd. Common Stock,42.57,3111247011.0,1485180,Consumer Discretionary
FA,First Advantage Corporation Common Stock,18.12,3108251292.0,2175852,Technology
VERA,Vera Therapeutics Inc. Class A Common Stock,43.15,3097432308.0,3394846,Health Care
ITGR,Integer Holdings Corporation Common Stock,91.22,3097360414.0,720378,Health Care
ELVN,Enliven Therapeutics Inc. Common Stock,50.85,3097016504.0,1573030,Health Care
ARLP,Alliance Resource Partners L.P. Common Units representing Limited Partners Interests,23.99,3086524636.0,245699,Energy
RH,RH Common Stock,163.2,3084638141.0,900752,Consumer Discretionary
CTRI,Centuri Holdings Inc. Common Stock,30.52,3080525884.0,1431382,Utilities
CARG,CarGurus Inc. Class A Common Stock ,34.0,3066361332.0,1469684,Technology
PATK,Patrick Industries Inc. Common Stock,93.18,3064990519.0,580033,Consumer Discretionary
PFS,Provident Financial Services Inc Common Stock,23.48,3059765371.0,1120165,Finance
KALU,Kaiser Aluminum Corporation Common Stock,187.16,3058307819.0,283606,Industrials
CC,Chemours Company (The) Common Stock,20.26,3046652384.0,3735292,Industrials
AEHR,Aehr Test Systems Common Stock,94.77,3042501577.0,1198573,Industrials
NTCT,NetScout Systems Inc. Common Stock,42.41,3032112068.0,805942,Technology
RARE,Ultragenyx Pharmaceutical Inc. Common Stock,30.68,3021649392.0,3995218,Health Care
PAY,Paymentus Holdings Inc. Class A Common Stock,24.01,3020201981.0,1337759,Consumer Discretionary
PHIN,PHINIA Inc. Common Stock,81.33,3010881982.0,562837,Consumer Discretionary
HTFL,Heartflow Inc. Common Stock,34.85,3005492856.0,1703908,Health Care
RGTIW,Rigetti Computing Inc. Warrants,9.03,3001561227.0,89696,Technology
CXW,CoreCivic Inc. Common Stock,30.29,2995331453.0,1174671,Real Estate
MGRC,McGrath RentCorp Common Stock,121.55,2985483144.0,238452,Consumer Discretionary
GPOR,Gulfport Energy Corporation Common Shares,166.0,2982960406.0,1057688,Energy
FRPT,Freshpet Inc. Common Stock,60.64,2980018846.0,1918138,Consumer Staples
CPK,Chesapeake Utilities Corporation Common Stock,123.97,2975870221.0,192449,Utilities
FSK,FS KKR Capital Corp. Common Stock,10.61,2971504854.0,2282678,Finance
HTGC,Hercules Capital Inc. Common Stock,15.88,2971443209.0,1374678,Finance
FIZZ,National Beverage Corp. Common Stock,31.73,2970946596.0,874108,Consumer Staples
BSM,Black Stone Minerals L.P. Common units representing limited partner interests,13.97,2968615654.0,190903,Energy
TR,Tootsie Roll Industries Inc. Common Stock,39.46,2966254802.0,392269,Consumer Staples
HWKN,Hawkins Inc. Common Stock,141.4,2956164960.0,283085,Consumer Discretionary
HLIO,Helios Technologies Inc. Common Stock,89.4,2954344405.0,407494,Industrials
PENN,PENN Entertainment Inc. Common Stock,22.06,2952584764.0,3209844,Consumer Discretionary
QTWO,Q2 Holdings Inc. Common Stock,47.16,2952235949.0,853993,Technology
MGEE,MGE Energy Inc,80.24,2949335301.0,372509,Energy
ASH,Ashland Inc. Common Stock,64.23,2940948917.0,1044011,Consumer Discretionary
AMBA,Ambarella Inc. Ordinary Shares,67.01,2939607077.0,1739578,Technology
CLDX,Celldex Therapeutics Inc.,37.44,2938743176.0,1579684,Health Care
BXMT,Blackstone Mortgage Trust Inc. Common Stock,17.42,2938466918.0,2444978,Real Estate
ROG,Rogers Corporation Common Stock,164.62,2938225832.0,264875,Industrials
GRAL,GRAIL Inc. Common Stock ,68.39,2935065795.0,482870,Health Care
CWT,California Water Service Group Common Stock,48.91,2927423044.0,647906,Utilities
PK,Park Hotels & Resorts Inc. Common Stock ,14.53,2925787463.0,4866068,Consumer Discretionary
USLM,United States Lime & Minerals Inc. Common Stock,101.76,2918686019.0,296554,Industrials
UE,Urban Edge Properties Common Shares of Beneficial Interest,23.15,2917362861.0,1252742,Finance
ASO,Academy Sports and Outdoors Inc. Common Stock,46.98,2913623070.0,2162537,Consumer Discretionary
AGYS,Agilysys Inc. Common Stock (DE),103.4,2912429439.0,404257,Technology
VISN,Vistance Networks Inc. Common Stock,12.88,2905336847.0,5401913,Technology
EXPO,Exponent Inc. Common Stock,59.7,2896144251.0,514570,Consumer Discretionary
DBD,Diebold Nixdorf Incorporated Common stock,83.45,2889739312.0,389730,Miscellaneous
DBRG,DigitalBridge Group Inc.,15.8,2881483636.0,1619168,Real Estate
CCC,CCC Intelligent Solutions Holdings Inc. Common Stock,4.9,2876008626.0,14127609,Technology
SLS,SELLAS Life Sciences Group Inc. Common Stock,15.45,2874203268.0,33144992,Health Care
NESR,National Energy Services Reunited Corp Ordinary Shares,28.49,2873138295.0,3398295,Energy
HNI,HNI Corporation Common Stock,39.9,2872517029.0,1016135,Consumer Discretionary
DAN,Dana Incorporated Common Stock ,26.48,2866081310.0,2788302,Consumer Discretionary
AKR,Acadia Realty Trust Common Stock,21.44,2862607503.0,2192879,Real Estate
MMS,Maximus Inc. Common Stock,54.46,2861348169.0,587955,Consumer Discretionary
AEO,American Eagle Outfitters Inc. Common Stock,17.07,2860476794.0,5160707,Consumer Discretionary
IRON,Disc Medicine Inc. Common Stock,74.5,2845832131.0,1454654,Health Care
BKV,BKV Corporation Common Stock,26.0,2844051886.0,969896,Energy
PARR,Par Pacific Holdings Inc.  Common Stock,56.67,2841676178.0,903371,Energy
FBK,FB Financial Corporation Common Stock,55.11,2839457991.0,471782,Finance
BTU,Peabody Energy Corporation Common Stock ,23.28,2836296195.0,2277784,Energy
APAM,Artisan Partners Asset Management Inc. Class A Common Stock,34.99,2836211092.0,911049,Finance
DX,Dynex Capital Inc. Common Stock,13.18,2835688954.0,5954440,Real Estate
CXT,Crane NXT Co. Common Stock,49.14,2827631914.0,1427950,Industrials
IVT,InvenTrust Properties Corp. Common Stock,36.25,2825174816.0,880359,Real Estate
CVI,CVR Energy Inc. Common Stock,28.1,2824909832.0,1329940,Energy
FRSH,Freshworks Inc. Class A Common Stock,10.21,2822392845.0,54568752,Technology
FTAIM,FTAI Aviation Ltd. 9.500% Fixed-Rate Reset Series D Cumulative Perpetual Redeemable Preferred Shares,27.4999,2821021472.0,3141,Industrials
FSLY,Fastly Inc. Class A Common Stock,18.0,2817000000.0,5719204,Technology
WAFD,WaFd Inc. Common Stock,38.05,2811456664.0,938404,Finance
KLRA,Kailera Therapeutics Inc. Common Stock,21.67,2807686725.0,581738,Health Care
CLOV,Clover Health Investments Corp. Class A Common Stock,5.31,2796693760.0,8462016,Health Care
UNFI,United Natural Foods Inc. Common Stock,46.19,2795379077.0,972728,Consumer Discretionary
