symbol,name,price,marketCap,volume,industry
RYAM,Rayonier Advanced Materials Inc. Common Stock,9.55,639903413.0,2380132,Basic Materials
HPK,HighPeak Energy Inc. Common Stock,5.09,639238303.0,607204,Energy
MAX,MediaAlpha Inc. Class A Common Stock,9.9,638507183.0,1909325,Real Estate
YDES,YD Bio Limited Ordinary Shares,9.03,636807872.0,11119,Health Care
AMSF,AMERISAFE Inc. Common Stock,33.63,636427538.0,301410,Finance
CTO,CTO Realty Growth Inc. Common Stock,19.53,635888754.0,299711,Real Estate
REPL,Replimune Group Inc. Common Stock,7.69,634983440.0,1045635,Health Care
TDUP,ThredUp Inc. Class A Common Stock,5.07,634469398.0,2369751,Consumer Discretionary
NPB,Northpointe Bancshares Inc. Common Stock,18.46,634371605.0,170314,Finance
TWI,Titan International Inc. (DE) Common Stock,9.9,633119791.0,828398,Industrials
HSTM,HealthStream Inc. Common Stock,21.33,632821362.0,395881,Technology
ALRS,Alerus Financial Corporation Common Stock,24.9,632392845.0,110507,Finance
CODI,D/B/A Compass Diversified Holdings Shares of Beneficial Interest,8.36,628972676.0,1462991,Consumer Discretionary
SES,SES AI Corporation Class A Common Stock,1.72,627923427.0,16219696,Miscellaneous
VPG,Vishay Precision Group Inc. Common Stock,47.26,627569510.0,161557,Technology
ASPI,ASP Isotopes Inc. Common Stock,5.66,627355091.0,2998456,Industrials
KE,Kimball Electronics Inc. Common Stock,25.89,626903929.0,129238,Technology
REPX,Riley Exploration Permian Inc. Common Stock,28.41,624136619.0,217922,Energy
SD,SandRidge Energy Inc. Common Stock,16.96,623682732.0,310644,Energy
NGVC,Natural Grocers by Vitamin Cottage Inc. Common Stock,26.99,621663180.0,141339,Consumer Staples
EMBC,Embecta Corp. Common Stock,10.48,620624070.0,736136,Health Care
FRGE,Forge Global Holdings Inc. Common Stock,44.81,620376795.0,417400,Finance
CNNE,Cannae Holdings Inc. Common Stock,12.57,619517553.0,832715,Consumer Discretionary
GOOD,Gladstone Commercial Corporation Real Estate Investment Trust,12.76,617673231.0,677156,Real Estate
MGTX,MeiraGTx Holdings plc Ordinary Shares,7.66,616560210.0,235504,Health Care
RRBI,Red River Bancshares Inc. Common Stock,91.19,616135175.0,71033,Consumer Discretionary
IIM,Invesco Value Municipal Income Trust Common Stock,13.08,615655182.0,191001,Finance
CRSR,Corsair Gaming Inc. Common Stock,5.77,614938962.0,1246061,Technology
ALLO,Allogene Therapeutics Inc. Common Stock,2.73,613513293.0,7333593,Health Care
OCGN,Ocugen Inc. Common Stock,1.87,613151259.0,9870473,Health Care
UHT,Universal Health Realty Income Trust Common Stock,44.19,613075179.0,87699,Real Estate
LBRX,LB Pharmaceuticals Inc Common Stock,24.23,612997241.0,196735,Health Care
DSP,Viant Technology Inc. Class A Common Stock,9.81,612473675.0,210890,Technology
DGICB,Donegal Group Inc. Class B Common Stock,16.69,611547653.0,1114,Finance
DSGN,Design Therapeutics Inc. Common Stock,10.68,608372925.0,131556,Health Care
BCAL,California BanCorp Common Stock,18.82,608312292.0,199144,Finance
MGR,Affiliated Managers Group Inc. 5.875% Junior Subordinated Notes due 2059,21.4,608018148.0,12799,Finance
RDVT,Red Violet Inc. Common Stock ,43.45,607074232.0,75981,Technology
SSTK,Shutterstock Inc. Common Stock,17.02,605005770.0,557994,Technology
MATV,Mativ Holdings Inc. Common Stock,11.06,604773121.0,585991,Basic Materials
AMC,AMC Entertainment Holdings Inc. Class A Common Stock,1.14,603684110.0,30849022,Consumer Discretionary
PGC,Peapack-Gladstone Financial Corporation Common Stock,34.33,602766792.0,94047,Finance
PANL,Pangaea Logistics Solutions Ltd. Common Shares,9.27,602306088.0,547478,Consumer Discretionary
OXM,Oxford Industries Inc. Common Stock,40.4,601046596.0,212376,Industrials
GTN,Gray Media Inc. Common Stock,5.88,600269520.0,3527404,Industrials
ANRO,Alto Neuroscience Inc. Common Stock,19.29,599269602.0,109296,Health Care
LWLG,Lightwave Logic Inc. Common Stock,4.48,599262532.0,1766216,Industrials
SSSSL,SuRo Capital Corp. 6.00% Notes due 2026,25.05,598397080.0,4721,Finance
RGR,Sturm Ruger & Company Inc. Common Stock,37.44,596952832.0,151857,Industrials
IRWD,Ironwood Pharmaceuticals Inc. Class A Common Stock,3.66,595403848.0,6755006,Health Care
CEVA,CEVA Inc. Common Stock,21.6,593304588.0,402290,Technology
NMRA,Neumora Therapeutics Inc. Common Stock,3.55,593166355.0,386092,Health Care
EVER,EverQuote Inc. Class A Common Stock,16.49,592913137.0,1082640,Technology
WHFCL,WhiteHorse Finance Inc. 7.875% Notes due 2028,25.5,592698744.0,1184,
ETD,Ethan Allen Interiors Inc. Common Stock,23.19,590100601.0,429387,Consumer Discretionary
RFI,Cohen & Steers Total Return Realty Fund Inc. Common Stock,12.0,589663536.0,58691,Finance
BWMN,Bowman Consulting Group Ltd. Common Stock,33.92,589296536.0,126036,Consumer Discretionary
CASS,Cass Information Systems Inc Common Stock,44.97,588400027.0,48907,Real Estate
DNA,Ginkgo Bioworks Holdings Inc. Class A Common Stock,9.71,588331026.0,924111,Health Care
TYG,Tortoise Energy Infrastructure Corporation Common Stock,49.28,587807060.0,93780,Finance
RSVR,Reservoir Media Inc. Common Stock,8.94,586465958.0,598133,Consumer Discretionary
GDYN,Grid Dynamics Holdings Inc. Class A Common Stock,6.9,584906500.0,1503796,Technology
EBS,Emergent BioSolutions Inc. Common Stock,11.1,582971600.0,1415880,Health Care
GOGO,Gogo Inc. Common Stock,4.35,582266388.0,1991310,Consumer Discretionary
FULC,Fulcrum Therapeutics Inc. Common Stock,8.73,581419825.0,873492,Health Care
CCSI,Consensus Cloud Solutions Inc. Common Stock,30.74,580031062.0,180581,Technology
CRMD,CorMedix Inc. Common Stock,7.35,579099481.0,1004183,Health Care
BBNX,Beta Bionics Inc. Common Stock,13.02,577855541.0,1049820,Health Care
CTNM,Contineum Therapeutics Inc. Class A Common Stock,15.78,576434705.0,150480,Health Care
BTBT,Bit Digital Inc. Ordinary Shares,1.78,576141199.0,21456069,Finance
NTGR,NETGEAR Inc. Common Stock,20.49,576038464.0,330039,Utilities
VLGEA,Village Super Market Inc. Class A Common Stock,39.0,575385330.0,22902,Consumer Staples
RMT,Royce Micro-Cap Trust Inc. Common Stock,12.34,570960780.0,135116,Finance
VGM,Invesco Trust for Investment Grade Municipals Common Stock (DE),10.51,569977984.0,141751,Finance
TCBX,Third Coast Bancshares Inc. Common Stock,40.97,569240376.0,77158,Finance
BWBBP,Bridgewater Bancshares Inc. Depositary Shares Each Representing a 1/100th Interest in a Share of 5.875% Non-Cumulative Perpetual Preferred Stock Series A,20.61,568521327.0,11,Finance
NFBK,Northfield Bancorp Inc. Common Stock (Delaware),13.56,566828272.0,149481,Finance
VREX,Varex Imaging Corporation Common Stock,13.52,566488000.0,222739,Technology
SCVL,Shoe Carnival Inc. Common Stock,20.68,566114338.0,381959,Consumer Discretionary
NRGV,Energy Vault Holdings Inc. Common Stock,3.4,565555442.0,3973589,Miscellaneous
BHB,Bar Harbor Bankshares Inc. Common Stock,33.88,565408853.0,59824,Finance
FPI,Farmland Partners Inc. Common Stock,12.98,565121760.0,662397,Real Estate
BDN,Brandywine Realty Trust Common Stock,3.25,564563506.0,2080833,Real Estate
PSTL,Postal Realty Trust Inc. Class A Common Stock,20.55,564449542.0,370704,Real Estate
BME,Blackrock Health Sciences Trust,42.3,563986661.0,28278,Finance
AROW,Arrow Financial Corporation Common Stock,34.3,563976138.0,92077,Finance
GLOO,Gloo Holdings Inc. Class A Common Stock,6.97,563580595.0,120917,Technology
MOV,Movado Group Inc. Common Stock,25.45,563410929.0,110216,Consumer Discretionary
CTKB,Cytek Biosciences Inc. Common Stock,4.4,562605252.0,888897,Industrials
PFIS,Peoples Financial Services Corp. Common Stock,56.22,561896131.0,24888,Finance
SMC,Summit Midstream Corporation Common Stock,29.9,561713988.0,63049,Utilities
MBUU,Malibu Boats Inc. Class A Common Stock,30.18,561424506.0,191054,Industrials
GAIN,Gladstone Investment Corporation Business Development Company,14.03,558702197.0,223733,Finance
RXT,Rackspace Technology Inc. Common Stock,2.28,555390034.0,150937161,Technology
ACIC,American Coastal Insurance Corporation Common Stock,11.36,553973831.0,400882,Finance
ERII,Energy Recovery Inc. Common Stock,10.43,552498961.0,4519000,Technology
FDMT,4D Molecular Therapeutics Inc. Common Stock,9.66,551924825.0,983393,Health Care
CMCO,Columbus McKinnon Corporation Common Stock,19.19,551508434.0,507796,Industrials
VKQ,Invesco Municipal Trust Common Stock,9.94,550035019.0,216368,Finance
ORN,Orion Group Holdings Inc. Common,13.78,549835477.0,254502,Industrials
FFIC,Flushing Financial Corporation Common Stock,16.26,549237402.0,131425,Finance
AVR,Anteris Technologies Global Corp. Common Stock,6.34,548391944.0,656446,Health Care
AUROW,Aurora Innovation Inc. Warrant,0.2812,548006284.0,9710,Technology
MSBIP,Midland States Bancorp Inc. Depositary Shares Each Representing a 1/40th Interest in a Share of 7.750% Fixed-Rate Reset Non-Cumulative Perpetual Preferred Stock Series A,25.315,545581817.0,17191,Finance
NHPAP,National Healthcare Properties Inc. 7.375% Series A Cumulative Redeemable Perpetual Preferred Stock,19.1999,545511072.0,6072,Real Estate
NRIM,Northrim BanCorp Inc Common Stock,24.6,543430433.0,169815,Finance
CARS,Cars.com Inc. Common Stock ,9.08,543104473.0,3977069,Technology
PKE,Park Aerospace Corp. Common Stock,27.12,540387642.0,264160,Industrials
VCV,Invesco California Value Municipal Income Trust Common Stock,11.28,540205122.0,66806,Finance
PLAY,Dave & Buster's Entertainment Inc. Common Stock,15.5,537544108.0,766778,Consumer Discretionary
PACB,Pacific Biosciences of California Inc. Common Stock,1.78,537395227.0,4671884,Industrials
RILYT,BRC Group Holdings Inc. 6.00% Senior Notes Due 2028,17.62,537358303.0,5045,Finance
IQI,Invesco Quality Municipal Income Trust Common Stock,10.15,536770540.0,126576,Finance
UNTY,Unity Bancorp Inc. Common Stock,53.35,535604337.0,53251,Finance
BXC,Bluelinx Holdings Inc. Common Stock,68.07,535494710.0,88037,Consumer Discretionary
ACNB,ACNB Corporation Common Stock,51.55,535337059.0,37486,Finance
JOUT,Johnson Outdoors Inc. Class A Common Stock,51.16,534778243.0,52736,Consumer Discretionary
NHPBP,National Healthcare Properties Inc. 7.125% Series B Cumulative Redeemable Perpetual Preferred Stock,18.78,533580797.0,711,Real Estate
LE,Lands' End Inc. Common Stock,17.45,533116137.0,233789,Consumer Discretionary
LEGH,Legacy Housing Corporation Common Stock (TX),22.31,532511299.0,92068,Consumer Discretionary
RMR,The RMR Group Inc. Class A Common Stock,16.61,532486320.0,198985,Consumer Discretionary
EBF,Ennis Inc. Common Stock,21.04,532161901.0,182439,Consumer Discretionary
EGY,VAALCO Energy Inc.  Common Stock,5.08,529631925.0,744885,Energy
SWBI,Smith & Wesson Brands Inc. Common Stock,11.9,529475566.0,254460,Industrials
MLAB,Mesa Laboratories Inc. Common Stock,95.56,527951130.0,94583,Industrials
PURR,Hyperliquid Strategies Inc Common Stock,4.25,526861909.0,1938647,Finance
BLMN,Bloomin' Brands Inc. Common Stock,6.18,526641622.0,4555913,Consumer Discretionary
BWB,Bridgewater Bancshares Inc. Common Stock,19.07,526040839.0,26745,Finance
MTW,Manitowoc Company Inc. (The) Common Stock,14.81,525361321.0,326106,Industrials
TREE,LendingTree Inc. Common Stock,38.32,523861071.0,672026,Finance
GRPN,Groupon Inc. Common Stock,12.85,523699219.0,1013396,Consumer Discretionary
KELYB,Kelly Services Inc. Class B Common Stock,15.15,518304649.0,9184,Consumer Discretionary
EU,enCore Energy Corp. Common Shares,2.76,516808714.0,1747147,Basic Materials
KRNY,Kearny Financial Corp Common Stock,7.98,516618425.0,242614,Finance
CLNE,Clean Energy Fuels Corp. Common Stock,2.35,515662733.0,1096149,Utilities
LAND,Gladstone Land Corporation Common Stock,12.42,514665003.0,1036943,Real Estate
CABO,Cable One Inc. Common Stock,90.9,512237589.0,178860,Telecommunications
OLP,One Liberty Properties Inc. Common Stock,23.65,511908081.0,70663,Real Estate
ZVRA,Zevra Therapeutics Inc. Common Stock,9.09,511744593.0,446035,Health Care
FTHY,First Trust High Yield Opportunities 2027 Term Fund Common Stock,13.9,511144547.0,100963,Finance
ASST,Strive Inc. Class A Common Stock,8.19,510825378.0,3457918,Technology
FFWM,First Foundation Inc. Common Stock,6.16,510567910.0,458661,Finance
BSTZ,BlackRock Science and Technology Term Trust Common Shares of Beneficial Interest,23.04,510516403.0,119717,Finance
VNDA,Vanda Pharmaceuticals Inc. Common Stock,8.6,508329058.0,2283851,Health Care
RILYZ,BRC Group Holdings Inc. 5.25% Senior Notes due 2028,16.64,507471178.0,9820,Finance
UMAC,Unusual Machines Inc. Common Stock,13.76,507407554.0,1435185,Technology
CYH,Community Health Systems Inc. Common Stock,3.66,507370267.0,944925,Health Care
HLLY,Holley Inc. Common Stock,4.17,507087208.0,337186,Consumer Discretionary
MGRB,Affiliated Managers Group Inc. 4.750% Junior Subordinated Notes due 2060,17.82,506302963.0,7064,Finance
FMNB,Farmers National Banc Corp. Common Stock,13.44,506058780.0,468157,Finance
INN,Summit Hotel Properties Inc. Common Stock,4.65,505934066.0,1182581,Real Estate
ABAT,American Battery Technology Company Common Stock,3.84,505763501.0,3086435,Basic Materials
MCS,Marcus Corporation (The) Common Stock,16.42,504319857.0,286119,Consumer Discretionary
LXEO,Lexeo Therapeutics Inc. Common Stock,6.9,503612556.0,428670,Health Care
ALT,Altimmune Inc. Common Stock,4.46,503237843.0,1898150,Health Care
AIOT,PowerFleet Inc. Common Stock,3.75,503052289.0,1579098,Telecommunications
BSRR,Sierra Bancorp Common Stock,37.28,502626034.0,79262,Finance
AQST,Aquestive Therapeutics Inc. Common Stock,4.11,501432794.0,1617188,Health Care
CBNK,Capital Bancorp Inc. Common Stock,30.3,500582149.0,26557,Finance
NPCE,Neuropace Inc. Common Stock,15.02,500282165.0,121269,Health Care
KRT,Karat Packaging Inc. Common Stock,24.89,500276679.0,78496,Industrials
CERS,Cerus Corporation Common Stock,2.6,499427503.0,1052548,Technology
SFST,Southern First Bancshares Inc. Common Stock,60.61,498892911.0,180758,Finance
AHH,Armada Hoffler Properties Inc. Common Stock,6.22,498554098.0,1799918,Finance
FEIM,Frequency Electronics Inc. Common Stock,50.85,497193350.0,129223,Industrials
ETO,Eaton Vance Tax-Advantage Global Dividend Opp Common Stock,30.31,496724463.0,38139,Finance
MSBI,Midland States Bancorp Inc. Common Stock,23.03,496336135.0,95736,Finance
PRAA,PRA Group Inc. Common Stock,12.67,494325650.0,842164,Finance
XRN,Chiron Real Estate Inc. Common Stock,36.6,490709303.0,114877,Real Estate
RCKT,Rocket Pharmaceuticals Inc. Common Stock,4.53,490246693.0,2928294,Health Care
SLDB,Solid Biosciences Inc. Common Stock,6.29,490055403.0,755926,Health Care
KFRC,Kforce Inc. Common Stock,26.79,489667620.0,385624,Consumer Discretionary
MG,Mistras Group Inc Common Stock,15.51,489311853.0,142084,Consumer Discretionary
CCAP,Crescent Capital BDC Inc. Common stock,13.22,489041154.0,249203,Finance
TRDA,Entrada Therapeutics Inc. Common Stock,12.79,488823977.0,245340,Health Care
LYEL,Lyell Immunopharma Inc. Common Stock,23.01,488231173.0,75620,Health Care
BLW,Blackrock Limited Duration Income Trust,13.66,487815716.0,64577,Consumer Discretionary
CHCT,Community Healthcare Trust Incorporated Common Stock,17.02,486291917.0,266708,Real Estate
MLR,Miller Industries Inc. Common Stock,42.4,484692038.0,37873,Consumer Discretionary
NGS,Natural Gas Services Group Inc. Common Stock,38.4,482646413.0,80981,Energy
HBCP,Home Bancorp Inc. Common Stock,61.54,481743982.0,85032,Finance
NATR,Nature's Sunshine Products Inc. Common Stock,27.5,481127983.0,131439,Health Care
ASIX,AdvanSix Inc. Common Stock ,17.89,480756396.0,321825,Industrials
SXC,SunCoke Energy Inc. Common Stock,5.67,480053436.0,2947892,Industrials
IHRT,iHeartMedia Inc. Class A Common Stock,3.19,479005679.0,1286249,Consumer Discretionary
TRC,Tejon Ranch Co Common Stock,17.79,478443459.0,81793,Finance
LVWR,LiveWire Group Inc. Common Stock,2.34,478158820.0,1539199,Consumer Discretionary
ALIT,Alight Inc. Class A Common Stock,0.8919,476723030.0,63632823,Real Estate
YORW,York Water Company (The) Common Stock,32.99,476200093.0,134414,Utilities
APPS,Digital Turbine Inc. Common Stock,3.97,476002734.0,3343792,Miscellaneous
CARE,Carter Bankshares Inc. Common Stock,21.53,475534057.0,170152,Finance
SIGA,SIGA Technologies Inc. Common Stock,6.64,475499045.0,348629,Health Care
FTK,Flotek Industries Inc. Common Stock,15.79,474613025.0,275260,Industrials
CVGW,Calavo Growers Inc. Common Stock,26.55,474556797.0,120348,Consumer Discretionary
MAGN,Magnera Corporation Common Stock,13.21,474239000.0,311954,Basic Materials
LRMR,Larimar Therapeutics Inc. Common Stock,5.52,472458964.0,12872037,Health Care
ANGO,AngioDynamics Inc. Common Stock,11.46,472351244.0,153158,Health Care
CIVB,Civista Bancshares Inc. Common Stock,24.43,471813634.0,72690,Finance
ORGO,Organogenesis Holdings Inc. Class A Common Stock,3.7,469574925.0,885024,Health Care
ASMB,Assembly Biosciences Inc. Common Stock,29.59,468029173.0,90184,Health Care
IPI,Intrepid Potash Inc Common Stock,34.84,467794311.0,172796,Industrials
IMXI,International Money Express Inc. Common Stock,15.74,467772826.0,974115,Real Estate
FBIZ,First Business Financial Services Inc. Common Stock,56.17,467573572.0,30579,Finance
PRTA,Prothena Corporation plc Ordinary Shares,8.64,465091044.0,355736,Health Care
BAND,Bandwidth Inc. Class A Common Stock,14.81,464840315.0,580111,Technology
KYTX,Kyverna Therapeutics Inc. Common Stock,8.12,463874650.0,414154,Health Care
DHIL,Diamond Hill Investment Group Inc. Class A Common Stock,171.36,463579523.0,48896,Finance
ETON,Eton Pharmaceuticals Inc. Common Stock,17.25,462602479.0,323907,Health Care
TITN,Titan Machinery Inc. Common Stock,19.79,462495743.0,156946,Consumer Discretionary
ISSC,Innovative Solutions and Support Inc. Common Stock,25.9,460459084.0,295928,Technology
CWBC,Community West Bancshares Common Stock,23.95,458944605.0,127220,Finance
FRPH,FRP Holdings Inc. Common Stock,23.98,458390218.0,39501,Finance
KROS,Keros Therapeutics Inc. Common Stock,15.03,457905017.0,291248,Health Care
SFIX,Stitch Fix Inc. Class A Common Stock,3.41,457618570.0,2739429,Consumer Discretionary
ETB,Eaton Vance Tax-Managed Buy-Write Income Fund Eaton Vance Tax-Managed Buy-Write Income Fund Common Shares of Beneficial Interest,15.5,455256669.0,57362,Finance
ZUMZ,Zumiez Inc. Common Stock,26.855,455180917.0,194420,Consumer Discretionary
MYGN,Myriad Genetics Inc. Common Stock,4.86,454449682.0,1507987,Health Care
PRTH,Priority Technology Holdings Inc. Common Stock,5.55,454387202.0,205017,Real Estate
FBIOP,Fortress Biotech Inc. 9.375% Series A Cumulative Redeemable Perpetual Preferred Stock,14.36,454320775.0,30237,Health Care
OBT,Orange County Bancorp Inc. Common Stock,33.95,453800823.0,52354,Finance
WEST,Westrock Coffee Company Common Stock,4.68,453140579.0,302871,Consumer Staples
LTBR,Lightbridge Corporation Common Stock,13.87,452290519.0,785803,Consumer Discretionary
BLND,Blend Labs Inc. Class A Common Stock,1.74,451959641.0,2797245,Technology
DIN,Dine Brands Global Inc. Common Stock,31.32,451750253.0,501280,Consumer Discretionary
LCTX,Lineage Cell Therapeutics Inc. Common Stock,1.96,451441973.0,1572414,Health Care
KREF,KKR Real Estate Finance Trust Inc. Common Stock,7.02,451215014.0,1416285,Real Estate
GBFH,GBank Financial Holdings Inc. Common Stock,31.38,451122426.0,23902,Finance
KLC,KinderCare Learning Companies Inc. Common Stock,3.81,450793691.0,446096,Consumer Discretionary
GEVO,Gevo Inc. Common Stock,1.86,450694379.0,1931189,Industrials
LAB,Standard BioTools Inc. Common Stock,1.17,449941534.0,1539878,Industrials
IMMX,Immix Biopharma Inc. Common Stock,8.49,449589054.0,482393,Health Care
MGRD,Affiliated Managers Group Inc. 4.200% Junior Subordinated Notes due 2061,15.8,448910595.0,8731,Finance
TECX,Tectonic Therapeutic Inc. Common Stock,23.93,447880580.0,297408,Health Care
PACK,Ranpak Holdings Corp Class A Common Stock,5.29,446348352.0,369643,Consumer Discretionary
GUT,Gabelli Utility Trust (The) Common Stock,6.08,446266096.0,130135,Finance
KIDS,OrthoPediatrics Corp. Common Stock,17.79,446125701.0,150388,Health Care
COFS,ChoiceOne Financial Services Inc. Common Stock,29.52,443500569.0,57897,Finance
RGNX,REGENXBIO Inc. Common Stock,8.75,442952003.0,916902,Health Care
CDZI,CADIZ Inc. Common Stock,5.31,441314519.0,528804,Utilities
CLFD,Clearfield Inc. Common Stock,32.2,440670234.0,50418,Utilities
CTGO,Contango ORE Inc. Common Stock,28.91,437787455.0,202756,Basic Materials
EVN,Eaton Vance Municipal Income Trust Common Stock,11.03,437528808.0,38714,Finance
ITIC,Investors Title Company Common Stock,231.37,436727996.0,8930,Finance
MEC,Mayville Engineering Company Inc. Common Stock,21.44,435625853.0,117098,Industrials
NPWR,NET Power Inc. Class A Common Stock,1.96,435398475.0,610583,Energy
OPENL,Opendoor Technologies Inc  Series A Warrants each whole warrant exercisable to purchase one share of Common Stock at an exercise price of $13.00 per warrant,0.4528,433929778.0,619911,Finance
CION,CION Investment Corporation Common Stock,8.38,433002536.0,562645,Finance
FCEL,FuelCell Energy Inc. Common Stock,9.07,432421710.0,1375473,Energy
OSPN,OneSpan Inc. Common Stock,11.37,432368389.0,414376,Technology
ATNI,ATN International Inc. Common Stock,28.33,432241887.0,32227,Telecommunications
ULH,Universal Logistics Holdings Inc. Common Stock,16.39,431549651.0,44937,Industrials
EB,Eventbrite Inc. Class A Common Stock,4.41,430747438.0,1095267,Technology
PEPG,PepGen Inc. Common Stock,6.24,428988918.0,240351,Health Care
KOPN,Kopin Corporation Common Stock,2.32,428633059.0,1778304,Technology
DMAC,DiaMedica Therapeutics Inc. Common Stock,8.23,428597323.0,265049,Health Care
BGS,B&G Foods Inc. Common Stock,5.35,427877218.0,3124062,Consumer Staples
HQL,abrdn Life Sciences Investors Shares of Beneficial Interest,16.64,427309143.0,130704,Finance
CYRX,CryoPort Inc. Common Stock,8.53,427087751.0,222094,Health Care
UPB,Upstream Bio Inc. Common Stock,7.9,426904869.0,1496059,Health Care
SABR,Sabre Corporation Common Stock,1.08,426778236.0,14981502,Technology
STEX,Streamex Corp. Common Stock,2.39,426661995.0,1240009,Health Care
BMRC,Bank of Marin Bancorp Common Stock,26.405,424980184.0,163942,Finance
SGU,Star Group L.P. Common Stock,12.91,424468600.0,25562,Consumer Discretionary
LENZ,LENZ Therapeutics Inc. Common Stock,13.52,423040381.0,705800,Health Care
GLAD,Gladstone Capital Corporation Common Stock,18.71,422716321.0,200946,Consumer Discretionary
ABSI,Absci Corporation Common Stock,2.81,422544002.0,1527629,Health Care
WTBA,West Bancorporation Common Stock,24.92,422164362.0,37603,Finance
MGPI,MGP Ingredients Inc.,19.78,421201551.0,737299,Consumer Staples
RPD,Rapid7 Inc. Common Stock,6.39,421056986.0,1818410,Technology
SPT,Sprout Social Inc Class A Common Stock,7.11,420836271.0,2355832,Technology
NC,NACCO Industries Inc. Common Stock,56.36,420443064.0,12619,Energy
MCI,Barings Corporate Investors Common Stock,20.72,419822818.0,6991,Finance
DVLT,Datavault AI Inc. Common Stock,0.72,418590845.0,19425028,Technology
ENTA,Enanta Pharmaceuticals Inc. Common Stock,14.41,418168747.0,177681,Health Care
RVMDW,Revolution Medicines Inc. Warrant,2.16,417570779.0,31017,Health Care
HPP,Hudson Pacific Properties Inc. Common Stock,7.69,416931860.0,2781551,Finance
VKI,Invesco Advantage Municipal Income Trust II Common Shares of Beneficial Interest (DE),9.37,416084407.0,157503,Finance
CLMB,Climb Global Solutions Inc. Common Stock,90.03,415348543.0,114314,Technology
NUS,Nu Skin Enterprises Inc. Common Stock,8.63,415334500.0,407447,Health Care
PTLO,Portillo's Inc. Class A Common Stock,5.48,413783758.0,1203684,Consumer Discretionary
NAGE,Niagen Bioscience Inc. Common Stock,5.18,413395800.0,776294,Health Care
AVXL,Anavex Life Sciences Corp. Common Stock,4.46,413316041.0,858869,Health Care
CZNC,Citizens & Northern Corp Common Stock,23.21,413181472.0,45457,Finance
CCCC,C4 Therapeutics Inc. Common Stock,2.78,413081654.0,4395571,Health Care
NATH,Nathan's Famous Inc. Common Stock,100.77,412593192.0,32958,Consumer Discretionary
FRBA,First Bank Common Stock,16.38,411701521.0,132731,Finance
CLPT,ClearPoint Neuro Inc. Common Stock,14.43,410148334.0,1416966,Health Care
WNC,Wabash National Corporation Common Stock,10.14,410025471.0,473990,Industrials
DDT,Dillard's Capital Trust I,26.24,409684228.0,3608,Consumer Discretionary
CAL,Caleres Inc. Common Stock,12.06,408780478.0,552042,Consumer Discretionary
AII,American Integrity Insurance Group Inc. Common Stock,20.87,408567899.0,140940,Finance
MSB,Mesabi Trust Common Stock,31.05,407376311.0,19810,Industrials
BSVN,Bank7 Corp. Common stock,42.98,406306702.0,8595,Finance
LEO,BNY Mellon Strategic Municipals Inc. Common Stock,6.5,404890551.0,107022,Finance
ACTG,Acacia Research Corporation (Acacia Tech) Common Stock,4.18,403204380.0,195628,Miscellaneous
IPSC,Century Therapeutics Inc. Common Stock,2.24,402411137.0,1543480,Health Care
PRTC,PureTech Health plc American Depositary Shares,16.65,402403927.0,5532,Health Care
SOR,Source Capital Inc. Cmn Shs of BI,48.14,401703412.0,43991,Finance
ISTR,Investar Holding Corporation Common Stock,29.15,401272166.0,104721,Finance
ILPT,Industrial Logistics Properties Trust Common Shares of Beneficial Interest,6.02,401251837.0,176693,Real Estate
PDLB,Ponce Financial Group Inc. Common Stock,16.71,401058799.0,34566,Finance
IKT,Inhibikase Therapeutics Inc. Common Stock,2.09,399524634.0,2467906,Health Care
GBLI,Global Indemnity Group LLC Class A Common Stock ,27.89,399495077.0,5468,Finance
RBBN,Ribbon Communications Inc. Common Stock,2.26,399115073.0,935337,Technology
SBC,SBC Medical Group Holdings Incorporated Common Stock,3.89,399024308.0,20734,Health Care
SVC,Service Properties Trust Common Stock,2.37,398364301.0,3597151,Real Estate
VHI,Valhi Inc. Common Stock,14.07,398213263.0,10814,Basic Materials
CTRN,Citi Trends Inc. Common Stock,47.6,397234376.0,126462,Consumer Discretionary
RNGR,Ranger Energy Services Inc. Class A Common Stock,16.85,396822353.0,117684,Energy
IVVD,Invivyd Inc. Common Stock,1.7,396308818.0,1234940,Health Care
SAJ,Saratoga Investment Corp 8.00% Notes due 2027,25.25,395620308.0,3390,Finance
SAZ,Saratoga Investment Corp 8.50% Notes due 2028,25.25,395620308.0,5570,Finance
ARMP,Armata Pharmaceuticals Inc. Common Stock,10.83,394286781.0,32805,Health Care
