symbol,name,price,marketCap,volume,industry
NVDA,NVIDIA Corporation Common Stock,177.64,4316652000000.0,107220276,Technology
AAPL,Apple Inc. Common Stock,258.86,3800359900400.0,29296823,Technology
GOOGL,Alphabet Inc. Class A Common Stock,299.99,3628979030000.0,16914238,Technology
GOOG,Alphabet Inc. Class C Capital Stock,297.66,3600793020000.0,10105194,Technology
MSFT,Microsoft Corporation Common Stock,372.88,2768868569859.0,16094760,Technology
AMZN,Amazon.com Inc. Common Stock,212.79,2284283811927.0,25292365,Consumer Discretionary
AVGO,Broadcom Inc. Common Stock,314.43,1488721717095.0,11927834,Technology
META,Meta Platforms Inc. Class A Common Stock,573.02,1449485871981.0,9489660,Technology
TSLA,Tesla Inc. Common Stock,352.82,1323933052595.0,77283343,Industrials
BRK/A,Berkshire Hathaway Inc.,716500.0,1053881221000.0,395,Uncategorized
BRK/B,Berkshire Hathaway Inc.,476.38,1051042610917.0,3661196,Uncategorized
WMT,Walmart Inc. Common Stock,126.79,1010820913102.0,10846255,Consumer Discretionary
LLY,Eli Lilly and Company Common Stock,927.06,875903791820.0,1818985,Health Care
JPM,JP Morgan Chase & Co. Common Stock,295.45,796838215194.0,7140366,Finance
XOM,Exxon Mobil Corporation Common Stock,163.37,680724145317.0,16331884,Energy
V,Visa Inc.,303.33,581183102789.0,5500036,Real Estate
JNJ,Johnson & Johnson Common Stock,240.97,580403527382.0,4440412,Health Care
COST,Costco Wholesale Corporation Common Stock,1018.55,451882294617.0,1448196,Consumer Discretionary
MA,Mastercard Incorporated Common Stock,501.5,447243873967.0,2465982,Real Estate
MU,Micron Technology Inc. Common Stock,377.76,426012815106.0,41125422,Technology
ORCL,Oracle Corporation Common Stock,145.54,418579734840.0,12529787,Technology
NFLX,Netflix Inc. Common Stock,98.93,417698501500.0,36967920,Consumer Discretionary
CVX,Chevron Corporation Common Stock,198.86,396802368286.0,8240971,Energy
ABBV,AbbVie Inc. Common Stock,206.69,365585495702.0,4928492,Health Care
AMD,Advanced Micro Devices Inc. Common Stock,220.18,358967992360.0,30717140,Technology
BAC,Bank of America Corporation Common Stock,50.06,357714201601.0,28495272,Finance
PLTR,Palantir Technologies Inc. Class A Common Stock,147.93,353651918278.0,25085988,Technology
CAT,Caterpillar Inc. Common Stock,721.24,335583835332.0,1242532,Industrials
KO,Coca-Cola Company (The) Common Stock,77.22,332366685162.0,8257704,Consumer Staples
PG,Procter & Gamble Company (The) Common Stock,142.77,331797577797.0,6820562,Consumer Discretionary
HD,Home Depot Inc. (The) Common Stock,326.65,325347145369.0,2447374,Consumer Discretionary
CSCO,Cisco Systems Inc. Common Stock (DE),80.435,317709646833.0,16380956,Telecommunications
GE,GE Aerospace Common Stock,288.69,301631857801.0,5061124,Technology
MRK,Merck & Company Inc. Common Stock (new),120.85,298788573563.0,4890223,Health Care
AMAT,Applied Materials Inc. Common Stock,352.62,279842711302.0,2504038,Technology
LRCX,Lam Research Corporation Common Stock,220.65,275541321150.0,4026080,Technology
RTX,RTX Corporation Common Stock,198.41,267054744990.0,2313831,Industrials
MS,Morgan Stanley Common Stock,166.55,263648650000.0,3674761,Finance
GS,Goldman Sachs Group Inc. (The) Common Stock,866.05,255479503469.0,1443877,Finance
UNH,UnitedHealth Group Incorporated Common Stock (DE),281.36,255383674061.0,6894407,Health Care
INTC,Intel Corporation Common Stock,50.78,254576661628.0,79811271,Technology
WFC,Wells Fargo & Company Common Stock,81.85,252537623635.0,7069019,Finance
PM,Philip Morris International Inc Common Stock,160.34,249598003697.0,2804155,Health Care
GEV,GE Vernova Inc. Common Stock,897.36,241864959815.0,1384224,Uncategorized
CCZ,Comcast Holdings ZONES,65.0,233859989610.0,13,Telecommunications
LIN,Linde plc Ordinary Shares,499.47,231451479097.0,1488235,Basic Materials
IBM,International Business Machines Corporation Common Stock,246.74,231450608843.0,3254651,Technology
MCD,McDonald's Corporation Common Stock,309.76,220053083346.0,1815530,Consumer Discretionary
TMUS,T-Mobile US Inc. Common Stock,198.61,218840958593.0,3780220,Telecommunications
PEP,PepsiCo Inc. Common Stock,156.73,214240657444.0,3562542,Consumer Staples
AXP,American Express Company Common Stock,305.73,209664579060.0,2184072,Finance
VZ,Verizon Communications Inc. Common Stock,49.15,207299176857.0,17534163,Telecommunications
C,Citigroup Inc. Common Stock,117.36,205300078896.0,13314966,Finance
KLAC,KLA Corporation Common Stock,1540.06,201865845537.0,411844,Technology
T,AT&T Inc.,28.32,197774313736.0,29388738,Telecommunications
NEE,NextEra Energy Inc. Common Stock,92.73,193370133744.0,4788123,Technology
AMGN,Amgen Inc. Common Stock,342.57,184668413425.0,2143673,Health Care
TXN,Texas Instruments Incorporated Common Stock,199.42,181564606641.0,4234823,Technology
TMO,Thermo Fisher Scientific Inc Common Stock,488.19,181354893078.0,1473692,Industrials
TJX,TJX Companies Inc. (The) Common Stock,161.82,179104100030.0,3698072,Consumer Discretionary
ABT,Abbott Laboratories Common Stock,102.3,178171544245.0,7125151,Health Care
GILD,Gilead Sciences Inc. Common Stock,140.13,173960258589.0,3921940,Health Care
CRM,Salesforce Inc. Common Stock,185.03,170782690000.0,8887790,Technology
DIS,Walt Disney Company (The) Common Stock,96.28,170561931254.0,5826301,Consumer Discretionary
BA,Boeing Company (The) Common Stock,212.3,166834710922.0,4164680,Industrials
SCHW,Charles Schwab Corporation (The) Common Stock,92.99,161625867019.0,10967240,Finance
ISRG,Intuitive Surgical Inc. Common Stock,452.58,160724842661.0,1152290,Health Care
COP,ConocoPhillips Common Stock,131.64,160707135238.0,4208605,Energy
ADI,Analog Devices Inc. Common Stock,327.36,159818512836.0,2352932,Technology
ANET,Arista Networks Inc. Common Stock,126.25,158637910633.0,3031958,Telecommunications
PFE,Pfizer Inc. Common Stock,27.83,158306951070.0,25128228,Health Care
APH,Amphenol Corporation Common Stock,126.49,155483396496.0,4604984,Technology
DE,Deere & Company Common Stock,575.09,155335996805.0,1055697,Industrials
TBB,AT&T Inc. 5.350% Global Notes due 2066,21.52,153876295530.0,48990,Telecommunications
BLK,BlackRock Inc. Common Stock,959.41,149228105054.0,451038,Finance
UBER,Uber Technologies Inc. Common Stock,72.17,147439437574.0,7747989,Real Estate
LMT,Lockheed Martin Corporation Common Stock,637.9,147011785072.0,1127315,Industrials
UNP,Union Pacific Corporation Common Stock,245.54,145771769782.0,1450853,Industrials
HON,Honeywell International Inc. Common Stock,228.21,145067551725.0,3139521,Industrials
SCCO,Southern Copper Corporation Common Stock,176.67,144710941497.0,945260,Basic Materials
WELL,Welltower Inc. Common Stock,200.91,140185460802.0,1528840,Real Estate
APP,Applovin Corporation Class A Common Stock,412.68,139187885040.0,4253755,Technology
DHR,Danaher Corporation Common Stock,192.12,135963212378.0,2595672,Industrials
QCOM,QUALCOMM Incorporated Common Stock,125.73,134153910000.0,8031754,Technology
PANW,Palo Alto Networks Inc. Common Stock,161.95,132151200000.0,4813925,Technology
LOW,Lowe's Companies Inc. Common Stock,235.2,131726918501.0,1949621,Consumer Discretionary
SPGI,S&P Global Inc. Common Stock,434.11,131594758357.0,993450,Finance
SYK,Stryker Corporation Common Stock,332.3,127265667272.0,1332440,Health Care
GLW,Corning Incorporated Common Stock,146.5,125689397969.0,11929499,Industrials
PLD,Prologis Inc. Common Stock,132.35,123380729969.0,2602898,Real Estate
NEM,Newmont Corporation,112.83,121848855058.0,4761974,Basic Materials
BMY,Bristol-Myers Squibb Company Common Stock,59.33,121136164545.0,7953608,Health Care
INTU,Intuit Inc. Common Stock,417.36,115420908000.0,2182130,Technology
COF,Capital One Financial Corporation Common Stock,184.21,115150089341.0,2781182,Finance
PH,Parker-Hannifin Corporation Common Stock,912.1,115122096101.0,300575,Industrials
PGR,Progressive Corporation (The) Common Stock,196.38,115060289602.0,1608784,Finance
CME,CME Group Inc. Class A Common Stock,308.57,111951689554.0,1471690,Finance
DELL,Dell Technologies Inc. Class C Common Stock ,173.18,111830716744.0,3921912,Technology
MO,Altria Group Inc.,66.55,111264817690.0,5224606,Health Care
MDT,Medtronic plc. Ordinary Shares,86.28,110773594694.0,4531709,Health Care
