symbol,name,price,marketCap,volume,industry
NVDA,NVIDIA Corporation Common Stock,192.51,4677993000000.0,171128025,Technology
GOOG,Alphabet Inc. Class C Capital Stock,338.66,4086610220000.0,24484198,Technology
GOOGL,Alphabet Inc. Class A Common Stock,338.25,4081662750000.0,39703783,Technology
AAPL,Apple Inc. Common Stock,258.28,3796180327280.0,66530333,Technology
MSFT,Microsoft Corporation Common Stock,433.5,3221935713443.0,128612762,Technology
AMZN,Amazon.com Inc. Common Stock,241.73,2584145916339.0,47140514,Consumer Discretionary
META,Meta Platforms Inc. Class A Common Stock,738.31,1860930730141.0,59722066,Technology
AVGO,Broadcom Inc. Common Stock,330.73,1568081483543.0,20399202,Technology
TSLA,Tesla Inc. Common Stock,416.56,1385403232206.0,80700077,Industrials
BRK/B,Berkshire Hathaway Inc.,476.79,1051947198579.0,5375646,
BRK/A,Berkshire Hathaway Inc.,714000.0,1050204036000.0,340,
LLY,Eli Lilly and Company Common Stock,1024.14,968205320894.0,2291160,Health Care
WMT,Walmart Inc. Common Stock,117.41,935777303243.0,16369745,Consumer Discretionary
JPM,JP Morgan Chase & Co. Common Stock,306.42,834155612434.0,11576868,Finance
V,Visa Inc.,331.8,638955593821.0,10208465,Real Estate
XOM,Exxon Mobil Corporation Common Stock,140.51,592553940423.0,35741886,Energy
JNJ,Johnson & Johnson Common Stock,227.29,547608683734.0,9641846,Health Care
MU,Micron Technology Inc. Common Stock,435.79,490485680851.0,42229985,Technology
MA,Mastercard Incorporated Common Stock,543.73,488267282433.0,5487087,Real Estate
ORCL,Oracle Corporation Common Stock,169.01,485587701300.0,37150880,Technology
COST,Costco Wholesale Corporation Common Stock,952.89,422958723048.0,1821585,Consumer Discretionary
AMD,Advanced Micro Devices Inc. Common Stock,252.18,410559515557.0,31574140,Technology
ABBV,AbbVie Inc. Common Stock,220.43,389584594432.0,7832704,Health Care
BAC,Bank of America Corporation Common Stock,53.08,387616463794.0,35180927,Finance
HD,Home Depot Inc. (The) Common Stock,371.81,370141125238.0,4743536,Consumer Discretionary
PLTR,Palantir Technologies Inc. Class A Common Stock,151.86,361948642289.0,59652314,Technology
NFLX,Netflix Inc. Common Stock,83.16,351115004394.0,42159430,Consumer Discretionary
PG,Procter & Gamble Company (The) Common Stock,149.9,348367702682.0,11032450,Consumer Discretionary
CVX,Chevron Corporation Common Stock,171.19,344694762190.0,16757566,Energy
KO,Coca-Cola Company (The) Common Stock,73.43,315867137488.0,20852228,Consumer Staples
GE,GE Aerospace Common Stock,298.86,315241685441.0,6144330,Technology
LRCX,Lam Research Corporation Common Stock,248.17,311708965100.0,16779869,Technology
CAT,Caterpillar Inc. Common Stock,665.24,311318746443.0,4440433,Industrials
CSCO,Cisco Systems Inc. Common Stock (DE),78.43,309884346576.0,22634002,Telecommunications
MS,Morgan Stanley Common Stock,182.4,289890018326.0,7471488,Finance
IBM,International Business Machines Corporation Common Stock,309.24,289057515103.0,10114251,Technology
WFC,Wells Fargo & Company Common Stock,90.64,284526622887.0,21494323,Finance
GS,Goldman Sachs Group Inc. (The) Common Stock,940.12,281968791761.0,2335369,Finance
PM,Philip Morris International Inc Common Stock,177.89,276910467060.0,7577916,Health Care
AMAT,Applied Materials Inc. Common Stock,341.34,270663288550.0,7344597,Technology
MRK,Merck & Company Inc. Common Stock (new),108.34,268902321550.0,13571894,Health Care
RTX,RTX Corporation Common Stock,199.88,267993495767.0,8869289,Industrials
UNH,UnitedHealth Group Incorporated Common Stock (DE),292.29,264767570240.0,13435209,Health Care
AXP,American Express Company Common Stock,358.5,246953317601.0,4205978,Finance
INTC,Intel Corporation Common Stock,48.66,243056700000.0,123896355,Technology
CCZ,Comcast Holdings ZONES,65.0,236853142825.0,29,Telecommunications
MCD,McDonald's Corporation Common Stock,315.51,224691818969.0,3210781,Consumer Discretionary
TMO,Thermo Fisher Scientific Inc Common Stock,592.16,222479284217.0,3950382,Industrials
KLAC,KLA Corporation Common Stock,1684.71,221357985752.0,1502132,Technology
LIN,Linde plc Ordinary Shares,455.0,212461763150.0,2717187,Basic Materials
TMUS,T-Mobile US Inc. Common Stock,189.28,211710934169.0,5915738,Telecommunications
C,Citigroup Inc. Common Stock,115.2,206123461517.0,14438123,Finance
PEP,PepsiCo Inc. Common Stock,148.69,203309802740.0,9061413,Consumer Staples
CRM,Salesforce Inc. Common Stock,214.08,200592960000.0,18531126,Technology
TXN,Texas Instruments Incorporated Common Stock,218.97,198961182689.0,14117114,Technology
DIS,Walt Disney Company (The) Common Stock,111.58,197874515546.0,11068093,Consumer Discretionary
GEV,GE Vernova Inc. Common Stock,717.39,194642584082.0,3487101,
APP,Applovin Corporation Class A Common Stock,569.24,192377504200.0,5283066,Technology
ANET,Arista Networks Inc. Common Stock,148.15,186563083121.0,8913379,Telecommunications
AMGN,Amgen Inc. Common Stock,342.94,184666561313.0,3152544,Health Care
ABT,Abbott Laboratories Common Stock,106.09,184476924857.0,15686614,Health Care
SCHW,Charles Schwab Corporation (The) Common Stock,103.47,183859647592.0,10033287,Finance
NEE,NextEra Energy Inc. Common Stock,88.18,183644521935.0,11201607,Technology
APH,Amphenol Corporation Common Stock,149.58,183094222887.0,16925699,Technology
ISRG,Intuitive Surgical Inc. Common Stock,507.55,179924481851.0,2166194,Health Care
T,AT&T Inc.,25.13,178157865809.0,73229757,Telecommunications
BA,Boeing Company (The) Common Stock,234.04,177892743331.0,9126414,Industrials
BLK,BlackRock Inc. Common Stock,1127.78,174976092152.0,700969,Finance
GILD,Gilead Sciences Inc. Common Stock,139.55,173136841390.0,7147948,Health Care
UBER,Uber Technologies Inc. Common Stock,81.7,169758742128.0,26840044,Real Estate
SCCO,Southern Copper Corporation Common Stock,207.93,168879047212.0,4965901,Basic Materials
VZ,Verizon Communications Inc. Common Stock,39.81,167855898717.0,44287676,Telecommunications
BKNG,Booking Holdings Inc. Common Stock,5113.32,164821810916.0,244310,Consumer Discretionary
TJX,TJX Companies Inc. (The) Common Stock,147.47,163760582500.0,5950359,Consumer Discretionary
QCOM,QUALCOMM Incorporated Common Stock,152.22,162577825274.0,9134775,Technology
TBB,AT&T Inc. 5.350% Global Notes due 2066,22.42,160311642462.0,48303,Telecommunications
SPGI,S&P Global Inc. Common Stock,528.63,160069164000.0,1615105,Finance
ADI,Analog Devices Inc. Common Stock,318.7,155725933227.0,3130764,Technology
DHR,Danaher Corporation Common Stock,219.62,155128491026.0,7444841,Industrials
LOW,Lowe's Companies Inc. Common Stock,266.64,149572096494.0,3264720,Consumer Discretionary
PFE,Pfizer Inc. Common Stock,26.1,148396967107.0,44359427,Health Care
HON,Honeywell International Inc. Common Stock,227.24,144271769146.0,6911651,Industrials
LMT,Lockheed Martin Corporation Common Stock,622.51,144047441988.0,3930489,Industrials
DE,Deere & Company Common Stock,530.07,143355012791.0,1493472,Industrials
INTU,Intuit Inc. Common Stock,502.98,140029632000.0,5913780,Technology
COF,Capital One Financial Corporation Common Stock,219.31,139422736913.0,4853961,Finance
UNP,Union Pacific Corporation Common Stock,233.58,138550520453.0,3539926,Industrials
NEM,Newmont Corporation,126.93,138514010178.0,15043058,Basic Materials
BSX,Boston Scientific Corporation Common Stock,92.33,136873873461.0,19051048,Health Care
SYK,Stryker Corporation Common Stock,354.3,135492698486.0,2223529,Health Care
MDT,Medtronic plc. Ordinary Shares,101.0,129483435008.0,10125094,Health Care
WELL,Welltower Inc. Common Stock,185.69,127444254305.0,2617733,Real Estate
COP,ConocoPhillips Common Stock,102.8,127031836100.0,14464308,Energy
PANW,Palo Alto Networks Inc. Common Stock,176.2,122811400000.0,12920092,Technology
PGR,Progressive Corporation (The) Common Stock,208.26,122123088369.0,6249884,Finance
NOW,ServiceNow Inc. Common Stock,116.73,121211345827.0,55075800,Technology
PLD,Prologis Inc. Common Stock,130.41,121133545470.0,4510721,Real Estate
VRTX,Vertex Pharmaceuticals Incorporated Common Stock,475.68,120688973530.0,1497941,Health Care
SATA,Strive Inc. Variable Rate Series A Perpetual Preferred Stock,96.24,120053318979.0,188759,
ADBE,Adobe Inc. Common Stock,291.65,119722325000.0,7406753,Technology
PH,Parker-Hannifin Corporation Common Stock,948.4,119675465332.0,1177581,Industrials
CRWD,CrowdStrike Holdings Inc. Class A Common Stock,444.62,112088008393.0,5224400,Technology
BMY,Bristol-Myers Squibb Company Common Stock,54.28,110500674306.0,16528719,Health Care
HCA,HCA Healthcare Inc. Common Stock,482.53,110110402567.0,1027256,Health Care
SBUX,Starbucks Corporation Common Stock,93.88,106953924258.0,16599743,Consumer Discretionary
CMCSA,Comcast Corporation Class A Common Stock,29.24,106547475326.0,65920699,Telecommunications
BX,Blackstone Inc. Common Stock,142.94,105554167501.0,8263624,Finance
CME,CME Group Inc. Class A Common Stock,289.83,104511726200.0,1940310,Finance
CEG,Constellation Energy Corporation Common Stock ,287.45,104159081576.0,3140286,Utilities
KKR,KKR & Co. Inc. Common Stock,114.98,102487815082.0,6625496,Finance
MCK,McKesson Corporation Common Stock,822.3,101493734295.0,677724,Health Care
MO,Altria Group Inc.,59.76,100317411948.0,27862981,Health Care
ICE,Intercontinental Exchange Inc. Common Stock,175.1,99838270234.0,3193104,Finance
ADP,Automatic Data Processing Inc. Common Stock,245.97,99482257562.0,3531673,Industrials
NOC,Northrop Grumman Corporation Common Stock,695.35,98685199162.0,1064219,Industrials
SO,Southern Company (The) Common Stock,89.14,98152485705.0,5943600,Utilities
WDC,Western Digital Corporation Common Stock,278.41,95188178823.0,15535987,Technology
GD,General Dynamics Corporation Common Stock,349.95,94528648678.0,1759717,Industrials
CVS,CVS Health Corporation Common Stock,74.44,94496554183.0,10590559,Consumer Staples
RCL,Royal Caribbean Cruises Ltd. Common Stock,345.98,94353234053.0,7708445,Consumer Discretionary
DUK,Duke Energy Corporation (Holding Company) Common Stock,120.89,94011465369.0,4293809,Utilities
FCX,Freeport-McMoRan Inc. Common Stock,65.13,93522163886.0,48197230,Basic Materials
CVNA,Carvana Co. Class A Common Stock,427.44,92986436300.0,6894420,Consumer Discretionary
NKE,Nike Inc. Common Stock,62.6,92672000965.0,12701998,Consumer Discretionary
MRSH,Marsh Common Stock,187.92,92063827629.0,3610720,Finance
MCO,Moody's Corporation Common Stock,515.45,91956280000.0,904564,Finance
SNPS,Synopsys Inc. Common Stock,480.0,91832738880.0,2511635,Technology
HOOD,Robinhood Markets Inc. Class A Common Stock,101.24,91033881098.0,29350488,Finance
UPS,United Parcel Service Inc. Common Stock,105.99,89920389638.0,10937126,Industrials
WM,Waste Management Inc. Common Stock,223.13,89891725090.0,4106965,Utilities
DASH,DoorDash Inc. Class A Common Stock,207.68,89509772426.0,3307158,Technology
GLW,Corning Incorporated Common Stock,103.0,88308120788.0,11661374,Industrials
PNC,PNC Financial Services Group Inc. (The) Common Stock,224.46,88023885911.0,2495598,Finance
USB,U.S. Bancorp Common Stock,56.33,87933082454.0,8084165,Finance
SHW,Sherwin-Williams Company (The) Common Stock,354.58,87898081840.0,2645567,Consumer Discretionary
MAR,Marriott International Class A Common Stock,319.77,85810853487.0,1698227,Consumer Discretionary
AMT,American Tower Corporation (REIT) Common Stock,181.34,84893708615.0,3496038,Real Estate
BK,The Bank of New York Mellon Corporation Common Stock,121.49,84720945075.0,3901737,Finance
EMR,Emerson Electric Company Common Stock,150.72,84674496000.0,3544848,Technology
HWM,Howmet Aerospace Inc. Common Stock,208.93,84002868400.0,3235848,Industrials
ORLY,O'Reilly Automotive Inc. Common Stock,98.85,83439689494.0,4788607,Consumer Discretionary
MMM,3M Company Common Stock,156.38,83072973006.0,4136991,Health Care
CDNS,Cadence Design Systems Inc. Common Stock,302.67,82387076670.0,3701295,Technology
WMB,Williams Companies Inc. (The) Common Stock,67.24,82114756617.0,7018016,Utilities
ABNB,Airbnb Inc. Class A Common Stock,131.77,81110991348.0,4251061,Consumer Discretionary
EQIX,Equinix Inc. Common Stock REIT,826.05,81106609732.0,685775,Real Estate
CMI,Cummins Inc. Common Stock,583.94,80604889577.0,960389,Industrials
TDG,Transdigm Group Incorporated Common Stock,1422.0,80275221792.0,354142,Industrials
ECL,Ecolab Inc. Common Stock,282.83,80107539738.0,1199138,Consumer Discretionary
SNDK,Sandisk Corporation Common Stock,539.3,79036129435.0,22299172,Technology
REGN,Regeneron Pharmaceuticals Inc. Common Stock,749.44,78765742300.0,924048,Health Care
DELL,Dell Technologies Inc. Class C Common Stock ,118.49,78522091296.0,6242713,Technology
MNST,Monster Beverage Corporation,80.04,78200778129.0,3941202,Consumer Staples
APO,Apollo Global Management Inc. (New) Common Stock,134.49,78061031843.0,3348827,Finance
GM,General Motors Company Common Stock,86.26,77976267000.0,9692913,Industrials
ELV,Elevance Health Inc. Common Stock,346.98,77112405986.0,2732669,Health Care
ITW,Illinois Tool Works Inc. Common Stock,262.86,76255686000.0,1269409,Industrials
CTAS,Cintas Corporation Common Stock,189.65,75839071364.0,1413995,Industrials
FDX,FedEx Corporation Common Stock,319.93,75222842523.0,1640516,Consumer Discretionary
VRT,Vertiv Holdings LLC Class A Common Stock,195.1,74594204866.0,5656207,Technology
MDLZ,Mondelez International Inc. Class A Common Stock,57.31,73950445177.0,11867110,Consumer Staples
EPD,Enterprise Products Partners L.P. Common Stock,34.11,73790881016.0,6417317,Utilities
AON,Aon plc Class A Ordinary Shares (Ireland),342.95,73712049132.0,2149177,Finance
CI,The Cigna Group Common Stock,271.27,72463220106.0,1554566,Health Care
SE,Sea Limited American Depositary Shares each representing one Class A Ordinary Share,121.9,72167229955.0,5796676,Consumer Discretionary
PWR,Quanta Services Inc. Common Stock,483.43,72087093252.0,1035493,Industrials
CSX,CSX Corporation Common Stock,37.87,70519126524.0,12082673,Industrials
HLT,Hilton Worldwide Holdings Inc. Common Stock ,299.28,69563196480.0,2848138,Consumer Discretionary
MRVL,Marvell Technology Inc. Common Stock,81.34,68984454000.0,13902614,Technology
CL,Colgate-Palmolive Company Common Stock,85.24,68708975656.0,7939639,Consumer Discretionary
COR,Cencora Inc. Common Stock,352.1,68483360567.0,1717608,Health Care
WBD,Warner Bros. Discovery Inc. Series A Common Stock ,27.6,68392096448.0,29218136,Consumer Discretionary
SNOW,Snowflake Inc. Common Stock,199.37,68224414000.0,7992843,Technology
KMI,Kinder Morgan Inc. Common Stock,30.24,67276754194.0,18864136,Utilities
MSI,Motorola Solutions Inc. Common Stock,403.15,67146647444.0,1089050,Technology
LHX,L3Harris Technologies Inc. Common Stock,356.02,66594554589.0,2109939,Industrials
RSG,Republic Services Inc. Common Stock,214.75,66478782885.0,1884703,Utilities
TFC,Truist Financial Corporation Common Stock,51.32,65650920681.0,12269494,Finance
NSC,Norfolk Southern Corporation Common Stock,290.16,65108020789.0,1125744,Industrials
PCAR,PACCAR Inc. Common Stock,123.32,64768201552.0,4478477,Consumer Discretionary
AEP,American Electric Power Company Inc. Common Stock,119.21,63669408921.0,3536666,Utilities
ET,Energy Transfer LP Common Units ,18.53,63620658405.0,17275665,Utilities
TRV,The Travelers Companies Inc. Common Stock,284.29,63414698819.0,1764140,Finance
NET,Cloudflare Inc. Class A Common Stock,180.39,63187219354.0,5964359,Technology
AJG,Arthur J. Gallagher & Co. Common Stock,245.84,63131712000.0,2250007,Finance
EOG,EOG Resources Inc. Common Stock,112.08,62767321240.0,8827682,Energy
SPG,Simon Property Group Inc. Common Stock,189.8,61964017388.0,1687253,Real Estate
AZO,AutoZone Inc. Common Stock,3703.76,61363232707.0,143529,Consumer Discretionary
FTNT,Fortinet Inc. Common Stock,81.51,60614756794.0,6265592,Technology
ROST,Ross Stores Inc. Common Stock,186.5,60322479072.0,2759845,Consumer Discretionary
RKT,Rocket Companies Inc. Class A Common Stock,20.77,58486035549.0,32758865,Finance
PSX,Phillips 66 Common Stock,144.08,58052877131.0,2290874,Energy
MDLN,Medline Inc. Class A Common Stock,43.73,57956925657.0,4144435,Health Care
AFL,AFLAC Incorporated Common Stock,110.51,57919828968.0,2490273,Finance
DLR,Digital Realty Trust Inc. Common Stock,167.44,57515899867.0,2287254,Real Estate
BDX,Becton Dickinson and Company Common Stock,201.09,57394816421.0,1456546,Health Care
MPLX,MPLX LP Common Units Representing Limited Partner Interests,56.24,57199744148.0,1568617,Energy
APD,Air Products and Chemicals Inc. Common Stock,256.02,56987553501.0,2621887,Basic Materials
SRE,DBA Sempra Common Stock,87.1,56848560479.0,5638854,Utilities
MPWR,Monolithic Power Systems Inc. Common Stock,1183.15,56681167050.0,642138,Technology
