symbol,name,price,marketCap,volume,industry
NVDA,NVIDIA Corporation Common Stock,185.04,4496472000000.0,172049972,Technology
GOOG,Alphabet Inc. Class C Capital Stock,326.01,3933962670000.0,21762294,Technology
GOOGL,Alphabet Inc. Class A Common Stock,325.44,3927084480000.0,31863551,Technology
AAPL,Apple Inc. Common Stock,259.04,3827666481120.0,50358516,Technology
MSFT,Microsoft Corporation Common Stock,478.11,3553494080632.0,18146922,Technology
AMZN,Amazon.com Inc. Common Stock,246.29,2632893301349.0,39440562,Consumer Discretionary
META,Meta Platforms Inc. Class A Common Stock,646.06,1628412059318.0,11906569,Technology
AVGO,Broadcom Inc. Common Stock,332.48,1576378712692.0,24341489,Technology
TSLA,Tesla Inc. Common Stock,435.8,1449391992979.0,56887678,Industrials
BRK/A,Berkshire Hathaway Inc.,750300.0,1103596762200.0,322,
BRK/B,Berkshire Hathaway Inc.,499.77,1102648233885.0,4805428,
LLY,Eli Lilly and Company Common Stock,1085.19,1025920999259.0,3153798,Health Care
WMT,Walmart Inc. Common Stock,113.07,901186778619.0,24054529,Consumer Discretionary
JPM,JP Morgan Chase & Co. Common Stock,329.79,897774882268.0,11734671,Finance
V,Visa Inc.,352.23,678298157961.0,6357015,Real Estate
ORCL,Oracle Corporation Common Stock,189.65,544889104500.0,19442443,Technology
MA,Mastercard Incorporated Common Stock,580.07,520900451549.0,3390171,Real Estate
XOM,Exxon Mobil Corporation Common Stock,122.91,518331825617.0,20222878,Energy
JNJ,Johnson & Johnson Common Stock,205.75,495712467237.0,6557138,Health Care
PLTR,Palantir Technologies Inc. Class A Common Stock,176.86,421534550739.0,47184055,Technology
BAC,Bank of America Corporation Common Stock,56.18,410254199999.0,30927674,Finance
COST,Costco Wholesale Corporation Common Stock,915.31,406278110582.0,5200828,Consumer Discretionary
ABBV,AbbVie Inc. Common Stock,224.13,396123917570.0,9363745,Health Care
NFLX,Netflix Inc. Common Stock,90.53,383604881970.0,39960497,Consumer Discretionary
MU,Micron Technology Inc. Common Stock,327.02,368064038532.0,33775907,Technology
HD,Home Depot Inc. (The) Common Stock,359.56,357946109547.0,5189830,Consumer Discretionary
AMD,Advanced Micro Devices Inc. Common Stock,204.68,333227542407.0,27420564,Technology
GE,GE Aerospace Common Stock,314.44,331675686175.0,5682328,Technology
PG,Procter & Gamble Company (The) Common Stock,141.53,330717899190.0,9295680,Consumer Discretionary
CVX,Chevron Corporation Common Stock,159.25,320653314322.0,12904867,Energy
UNH,UnitedHealth Group Incorporated Common Stock (DE),346.85,314190125347.0,5035479,Health Care
WFC,Wells Fargo & Company Common Stock,95.6,300096482215.0,12403345,Finance
KO,Coca-Cola Company (The) Common Stock,69.37,298402605578.0,19230100,Consumer Staples
MS,Morgan Stanley Common Stock,184.68,293513643555.0,3745910,Finance
CSCO,Cisco Systems Inc. Common Stock (DE),73.96,292222953879.0,17190798,Telecommunications
CAT,Caterpillar Inc. Common Stock,608.13,284592431715.0,2074839,Industrials
IBM,International Business Machines Corporation Common Stock,302.72,282963041560.0,3342716,Technology
GS,Goldman Sachs Group Inc. (The) Common Stock,934.83,280382169938.0,1960799,Finance
MRK,Merck & Company Inc. Common Stock (new),110.99,275479681271.0,20276247,Health Care
AXP,American Express Company Common Stock,382.98,263816406066.0,2707676,Finance
LRCX,Lam Research Corporation Common Stock,200.96,252411788800.0,13919893,Technology
RTX,RTX Corporation Common Stock,187.17,250952284384.0,9769355,Industrials
PM,Philip Morris International Inc Common Stock,158.81,247209799729.0,3667898,Health Care
CRM,Salesforce Inc. Common Stock,260.53,244116610000.0,5240917,Technology
TMO,Thermo Fisher Scientific Inc Common Stock,606.5,227866937784.0,3147720,Industrials
CCZ,Comcast Holdings ZONES,62.16,226504482431.0,3,Telecommunications
AMAT,Applied Materials Inc. Common Stock,281.64,223324569600.0,5498959,Technology
TMUS,T-Mobile US Inc. Common Stock,197.91,221363646352.0,5184641,Telecommunications
MCD,McDonald's Corporation Common Stock,308.88,219970235628.0,3267684,Consumer Discretionary
ABT,Abbott Laboratories Common Stock,126.18,219410862272.0,4344506,Health Care
C,Citigroup Inc. Common Stock,120.6,215785498775.0,14796852,Finance
APP,Applovin Corporation Class A Common Stock,616.53,208359396150.0,3026992,Technology
ISRG,Intuitive Surgical Inc. Common Stock,585.08,207408562391.0,1491192,Health Care
LIN,Linde plc Ordinary Shares,439.69,205312775032.0,2801627,Basic Materials
DIS,Walt Disney Company (The) Common Stock,114.17,203826427548.0,9776727,Consumer Discretionary
QCOM,QUALCOMM Incorporated Common Stock,181.87,194782770000.0,8350367,Technology
PEP,PepsiCo Inc. Common Stock,139.37,190566192803.0,8761175,Consumer Staples
UBER,Uber Technologies Inc. Common Stock,87.59,181997163072.0,15493643,Real Estate
INTU,Intuit Inc. Common Stock,652.75,181725600000.0,1651429,Technology
SCHW,Charles Schwab Corporation (The) Common Stock,101.34,180074772272.0,6496569,Finance
INTC,Intel Corporation Common Stock,41.11,179938470000.0,87732026,Technology
AMGN,Amgen Inc. Common Stock,330.11,177757854304.0,2799288,Health Care
TJX,TJX Companies Inc. (The) Common Stock,158.25,175731417784.0,5949826,Consumer Discretionary
BKNG,Booking Holdings Inc. Common Stock,5445.0,175513122675.0,160808,Consumer Discretionary
KLAC,KLA Corporation Common Stock,1324.6,174042290915.0,948517,Technology
BA,Boeing Company (The) Common Stock,227.38,172830507514.0,7120447,Industrials
T,AT&T Inc.,24.17,171351994294.0,43720832,Telecommunications
TXN,Texas Instruments Incorporated Common Stock,188.45,171230008119.0,6854486,Technology
VZ,Verizon Communications Inc. Common Stock,40.57,171060382089.0,28093433,Telecommunications
GEV,GE Vernova Inc. Common Stock,628.4,170497776436.0,4306359,
BLK,BlackRock Inc. Common Stock,1087.92,168791776919.0,558048,Finance
APH,Amphenol Corporation Common Stock,136.25,166777562965.0,6970693,Technology
DHR,Danaher Corporation Common Stock,235.0,165992147305.0,2533891,Industrials
NEE,NextEra Energy Inc. Common Stock,79.49,165546643781.0,8695111,Technology
SPGI,S&P Global Inc. Common Stock,541.56,163984368000.0,1332333,Finance
COF,Capital One Financial Corporation Common Stock,255.68,162544368126.0,3839936,Finance
TBB,AT&T Inc. 5.350% Global Notes due 2066,22.56,161312696429.0,73070,Telecommunications
ANET,Arista Networks Inc. Common Stock,123.72,155798748860.0,8931969,Telecommunications
NOW,ServiceNow Inc. Common Stock,146.19,151802335702.0,7422776,Technology
GILD,Gilead Sciences Inc. Common Stock,120.67,149712810107.0,6717074,Health Care
ADI,Analog Devices Inc. Common Stock,299.16,146484919659.0,3774092,Technology
BSX,Boston Scientific Corporation Common Stock,98.38,145842647797.0,9736281,Health Care
PFE,Pfizer Inc. Common Stock,25.29,143791543990.0,42962406,Health Care
LOW,Lowe's Companies Inc. Common Stock,256.21,143721372798.0,3162512,Consumer Discretionary
ADBE,Adobe Inc. Common Stock,339.04,141922144000.0,3106408,Technology
SYK,Stryker Corporation Common Stock,367.21,140429787782.0,1682148,Health Care
UNP,Union Pacific Corporation Common Stock,229.85,136338030337.0,2198231,Industrials
DE,Deere & Company Common Stock,500.8,135439074850.0,1797208,Industrials
PANW,Palo Alto Networks Inc. Common Stock,190.8,132987600000.0,6448998,Technology
SCCO,Southern Copper Corporation Common Stock,160.55,130397398307.0,2566058,Basic Materials
HON,Honeywell International Inc. Common Stock,205.24,130304250570.0,5192536,Industrials
WELL,Welltower Inc. Common Stock,186.31,127869777691.0,2429438,Real Estate
MDT,Medtronic plc. Ordinary Shares,98.69,126521982188.0,5385849,Health Care
PGR,Progressive Corporation (The) Common Stock,213.15,124990570853.0,4362393,Finance
COP,ConocoPhillips Common Stock,98.72,121990105640.0,9600177,Energy
LMT,Lockheed Martin Corporation Common Stock,518.44,119965873358.0,4107266,Industrials
PLD,Prologis Inc. Common Stock,128.39,119257234130.0,3295826,Real Estate
VRTX,Vertex Pharmaceuticals Incorporated Common Stock,469.68,119166660544.0,2115005,Health Care
KKR,KKR & Co. Inc. Common Stock,133.64,119120469712.0,3443641,Finance
CRWD,CrowdStrike Holdings Inc. Class A Common Stock,463.87,116940903363.0,2448910,Technology
