symbol,name,price,marketCap,volume,industry
NVDA,NVIDIA Corporation Common Stock,188.52,4581036000000.0,143217234,Technology
GOOG,Alphabet Inc. Class C Capital Stock,335.0,4042445000000.0,16057303,Technology
GOOGL,Alphabet Inc. Class A Common Stock,334.55,4037014850000.0,21569671,Technology
AAPL,Apple Inc. Common Stock,258.27,3796033348020.0,49561488,Technology
MSFT,Microsoft Corporation Common Stock,480.58,3571852053440.0,29154112,Technology
AMZN,Amazon.com Inc. Common Stock,244.68,2615682053571.0,37949811,Consumer Discretionary
META,Meta Platforms Inc. Class A Common Stock,672.97,1696239456953.0,13250358,Technology
AVGO,Broadcom Inc. Common Stock,332.79,1577848507569.0,25473485,Technology
TSLA,Tesla Inc. Common Stock,430.9,1433095479060.0,37572718,Industrials
BRK/A,Berkshire Hathaway Inc.,713000.0,1048733162000.0,410,
BRK/B,Berkshire Hathaway Inc.,474.67,1047269818473.0,6302301,
LLY,Eli Lilly and Company Common Stock,1039.51,982735869239.0,2586396,Health Care
WMT,Walmart Inc. Common Stock,116.94,932031324770.0,22963420,Consumer Discretionary
JPM,JP Morgan Chase & Co. Common Stock,300.31,817522589811.0,11522349,Finance
V,Visa Inc.,325.26,626361351555.0,6364596,Real Estate
XOM,Exxon Mobil Corporation Common Stock,136.83,577034770964.0,14509072,Energy
JNJ,Johnson & Johnson Common Stock,224.44,540742192693.0,8154073,Health Care
ORCL,Oracle Corporation Common Stock,174.9,502510437000.0,26823520,Technology
MA,Mastercard Incorporated Common Stock,520.41,467326019258.0,3850016,Real Estate
MU,Micron Technology Inc. Common Stock,410.24,461728919233.0,35886467,Technology
COST,Costco Wholesale Corporation Common Stock,970.28,430677612105.0,2076773,Consumer Discretionary
AMD,Advanced Micro Devices Inc. Common Stock,252.03,410315309326.0,25537009,Technology
ABBV,AbbVie Inc. Common Stock,223.93,395770440644.0,5743682,Health Care
PLTR,Palantir Technologies Inc. Class A Common Stock,165.7,394935401207.0,26443257,Technology
BAC,Bank of America Corporation Common Stock,52.17,380971192844.0,26485082,Finance
HD,Home Depot Inc. (The) Common Stock,380.36,378652748435.0,3465191,Consumer Discretionary
NFLX,Netflix Inc. Common Stock,85.58,361332636797.0,37620740,Consumer Discretionary
PG,Procter & Gamble Company (The) Common Stock,148.34,344742261613.0,9544934,Consumer Discretionary
CVX,Chevron Corporation Common Stock,169.05,340385825973.0,9778793,Energy
KO,Coca-Cola Company (The) Common Stock,73.55,316383330550.0,13237174,Consumer Staples
GE,GE Aerospace Common Stock,297.47,313775494105.0,7448724,Technology
CSCO,Cisco Systems Inc. Common Stock (DE),78.68,310872120217.0,17752145,Telecommunications
LRCX,Lam Research Corporation Common Stock,238.46,299512913800.0,11975373,Technology
CAT,Caterpillar Inc. Common Stock,638.91,298996843680.0,1826111,Industrials
MS,Morgan Stanley Common Stock,182.66,290303238747.0,5137576,Finance
GS,Goldman Sachs Group Inc. (The) Common Stock,929.72,278849535247.0,2010966,Finance
WFC,Wells Fargo & Company Common Stock,88.71,278468189721.0,15104926,Finance
PM,Philip Morris International Inc Common Stock,178.88,278451539421.0,3887517,Health Care
IBM,International Business Machines Corporation Common Stock,293.86,274681287635.0,2952443,Technology
RTX,RTX Corporation Common Stock,201.28,269870576486.0,10133170,Industrials
MRK,Merck & Company Inc. Common Stock (new),107.92,267859872085.0,7906188,Health Care
AMAT,Applied Materials Inc. Common Stock,332.71,263820187302.0,8013658,Technology
UNH,UnitedHealth Group Incorporated Common Stock (DE),282.7,256080577874.0,65688286,Health Care
AXP,American Express Company Common Stock,359.45,247607726671.0,1915955,Finance
CCZ,Comcast Holdings ZONES,65.0,236853142825.0,3,Telecommunications
TMO,Thermo Fisher Scientific Inc Common Stock,623.91,234408015091.0,1638190,Industrials
MCD,McDonald's Corporation Common Stock,314.13,223709045966.0,2506576,Consumer Discretionary
INTC,Intel Corporation Common Stock,43.93,219430350000.0,116745230,Technology
CRM,Salesforce Inc. Common Stock,228.53,214132610000.0,9831512,Technology
KLAC,KLA Corporation Common Stock,1616.33,212373377680.0,1173625,Technology
LIN,Linde plc Ordinary Shares,453.03,211541873758.0,1929167,Basic Materials
TMUS,T-Mobile US Inc. Common Stock,184.49,206353287431.0,6788227,Telecommunications
C,Citigroup Inc. Common Stock,114.79,205389862392.0,11970341,Finance
APH,Amphenol Corporation Common Stock,166.25,203499228205.0,18291286,Technology
PEP,PepsiCo Inc. Common Stock,148.78,203432863351.0,7113870,Consumer Staples
DIS,Walt Disney Company (The) Common Stock,110.61,196154330208.0,8953514,Consumer Discretionary
AMGN,Amgen Inc. Common Stock,351.32,189179029336.0,3269608,Health Care
ABT,Abbott Laboratories Common Stock,108.27,188267665702.0,16592306,Health Care
GEV,GE Vernova Inc. Common Stock,692.7,187943681949.0,4704869,
ISRG,Intuitive Surgical Inc. Common Stock,525.04,186124618168.0,1502868,Health Care
BA,Boeing Company (The) Common Stock,244.56,185888947654.0,20491204,Industrials
ANET,Arista Networks Inc. Common Stock,146.69,184724526918.0,8682470,Telecommunications
SCHW,Charles Schwab Corporation (The) Common Stock,103.72,184303881784.0,8837463,Finance
APP,Applovin Corporation Class A Common Stock,543.56,183698819800.0,4652217,Technology
NEE,NextEra Energy Inc. Common Stock,87.15,181499433961.0,15151875,Technology
TXN,Texas Instruments Incorporated Common Stock,196.63,178662544423.0,10624116,Technology
GILD,Gilead Sciences Inc. Common Stock,140.97,174898606454.0,10615362,Health Care
BLK,BlackRock Inc. Common Stock,1106.69,171703959481.0,537138,Finance
UBER,Uber Technologies Inc. Common Stock,81.24,168802940152.0,19985844,Real Estate
DHR,Danaher Corporation Common Stock,235.75,166521909477.0,4298483,Industrials
BKNG,Booking Holdings Inc. Common Stock,5153.41,166114064559.0,156437,Consumer Discretionary
VZ,Verizon Communications Inc. Common Stock,39.32,165789850227.0,26060892,Telecommunications
TJX,TJX Companies Inc. (The) Common Stock,148.01,164360234731.0,7093628,Consumer Discretionary
QCOM,QUALCOMM Incorporated Common Stock,153.04,163453622257.0,8324371,Technology
T,AT&T Inc.,23.0,163057338385.0,72121222,Telecommunications
TBB,AT&T Inc. 5.350% Global Notes due 2066,22.58,161455704138.0,49519,Telecommunications
SPGI,S&P Global Inc. Common Stock,526.67,159475676000.0,1310443,Finance
SCCO,Southern Copper Corporation Common Stock,194.84,158247456157.0,2656874,Basic Materials
LOW,Lowe's Companies Inc. Common Stock,273.94,153667042131.0,2492947,Consumer Discretionary
INTU,Intuit Inc. Common Stock,545.4,151839360000.0,2459225,Technology
PFE,Pfizer Inc. Common Stock,26.5,150671250128.0,75527674,Health Care
ADI,Analog Devices Inc. Common Stock,303.83,148460026019.0,3548903,Technology
DE,Deere & Company Common Stock,519.19,140412566436.0,1043428,Industrials
HON,Honeywell International Inc. Common Stock,220.91,140252933119.0,3520254,Industrials
BSX,Boston Scientific Corporation Common Stock,93.61,138771399271.0,9610567,Health Care
NEM,Newmont Corporation,127.0,138590398587.0,12286100,Basic Materials
COF,Capital One Financial Corporation Common Stock,217.11,138024122982.0,6183274,Finance
UNP,Union Pacific Corporation Common Stock,232.55,137939564737.0,5212405,Industrials
LMT,Lockheed Martin Corporation Common Stock,594.95,137670118730.0,1706984,Industrials
NOW,ServiceNow Inc. Common Stock,131.8,136859893601.0,11784891,Technology
SYK,Stryker Corporation Common Stock,354.57,135595952871.0,1395974,Health Care
MDT,Medtronic plc. Ordinary Shares,100.69,129086010604.0,7131856,Health Care
PANW,Palo Alto Networks Inc. Common Stock,183.5,127899500000.0,5537404,Technology
WELL,Welltower Inc. Common Stock,183.49,125934332610.0,2499079,Real Estate
COP,ConocoPhillips Common Stock,99.87,123411181628.0,7276343,Energy
ADBE,Adobe Inc. Common Stock,297.42,122090910000.0,4163470,Technology
PGR,Progressive Corporation (The) Common Stock,208.08,122017536867.0,3527225,Finance
SATA,Strive Inc. Variable Rate Series A Perpetual Preferred Stock,96.89,120864152908.0,128935,
VRTX,Vertex Pharmaceuticals Incorporated Common Stock,474.17,120305858095.0,1631843,Health Care
CRWD,CrowdStrike Holdings Inc. Class A Common Stock,476.66,120165242410.0,2831952,Technology
PLD,Prologis Inc. Common Stock,128.7,119545182900.0,3019736,Real Estate
PH,Parker-Hannifin Corporation Common Stock,925.97,116845097673.0,678251,Industrials
HCA,HCA Healthcare Inc. Common Stock,505.84,115429602376.0,3082180,Health Care
BMY,Bristol-Myers Squibb Company Common Stock,55.56,113106438180.0,11346502,Health Care
BX,Blackstone Inc. Common Stock,148.41,109593493765.0,2952573,Finance
SBUX,Starbucks Corporation Common Stock,95.72,108843212000.0,16398921,Consumer Discretionary
MO,Altria Group Inc.,63.62,106797084138.0,8737910,Health Care
CEG,Constellation Energy Corporation Common Stock ,288.76,104633767250.0,5961761,Utilities
CMCSA,Comcast Corporation Class A Common Stock,28.7,104579772294.0,40820677,Telecommunications
CVNA,Carvana Co. Class A Common Stock,477.72,103924481446.0,3469863,Consumer Discretionary
KKR,KKR & Co. Inc. Common Stock,116.0,103396995560.0,5487944,Finance
MCK,McKesson Corporation Common Stock,834.18,102960042897.0,576615,Health Care
ADP,Automatic Data Processing Inc. Common Stock,254.51,102936249835.0,3480983,Industrials
CME,CME Group Inc. Class A Common Stock,284.48,102582534139.0,1553535,Finance
GD,General Dynamics Corporation Common Stock,366.62,99031556446.0,1389128,Industrials
ICE,Intercontinental Exchange Inc. Common Stock,173.28,98800545209.0,2846291,Finance
SO,Southern Company (The) Common Stock,88.84,97822154252.0,4470380,Utilities
NOC,Northrop Grumman Corporation Common Stock,678.74,96869818276.0,1363387,Industrials
SNPS,Synopsys Inc. Common Stock,502.7,96175662156.0,1237368,Technology
HOOD,Robinhood Markets Inc. Class A Common Stock,105.24,94630636574.0,18282138,Finance
GLW,Corning Incorporated Common Stock,109.74,94086729857.0,25299689,Industrials
DUK,Duke Energy Corporation (Holding Company) Common Stock,120.29,93544868635.0,4812867,Utilities
NKE,Nike Inc. Common Stock,63.09,93397388832.0,13510276,Consumer Discretionary
WM,Waste Management Inc. Common Stock,231.34,93199263578.0,2309939,Utilities
MCO,Moody's Corporation Common Stock,518.87,92566408000.0,727801,Finance
CVS,CVS Health Corporation Common Stock,72.0,91399138920.0,44170010,Consumer Staples
UPS,United Parcel Service Inc. Common Stock,107.2,90946936213.0,14445238,Industrials
FCX,Freeport-McMoRan Inc. Common Stock,62.87,90276960594.0,20086303,Basic Materials
DASH,DoorDash Inc. Class A Common Stock,207.36,89371852900.0,2916581,Technology
USB,U.S. Bancorp Common Stock,56.53,88245289386.0,12743081,Finance
MRSH,Marsh Common Stock,179.18,87782017000.0,3389406,Finance
PNC,PNC Financial Services Group Inc. (The) Common Stock,223.7,87725845489.0,2219026,Finance
CDNS,Cadence Design Systems Inc. Common Stock,318.37,86660632370.0,1453750,Technology
HWM,Howmet Aerospace Inc. Common Stock,215.53,86656479329.0,2625031,Industrials
WDC,Western Digital Corporation Common Stock,252.66,86384272337.0,7413350,Technology
SHW,Sherwin-Williams Company (The) Common Stock,346.08,85790986979.0,1456498,Consumer Discretionary
ORLY,O'Reilly Automotive Inc. Common Stock,100.62,84933753737.0,4707217,Consumer Discretionary
AMT,American Tower Corporation (REIT) Common Stock,180.07,84299162404.0,2867008,Real Estate
MAR,Marriott International Class A Common Stock,313.95,84249046040.0,953953,Consumer Discretionary
MMM,3M Company Common Stock,158.05,83960118836.0,4661085,Health Care
EMR,Emerson Electric Company Common Stock,147.67,82961006000.0,2543274,Technology
BK,The Bank of New York Mellon Corporation Common Stock,118.87,82893890370.0,2659807,Finance
ABNB,Airbnb Inc. Class A Common Stock,132.22,81387988738.0,2529728,Consumer Discretionary
REGN,Regeneron Pharmaceuticals Inc. Common Stock,771.25,81057961610.0,645774,Health Care
GM,General Motors Company Common Stock,86.38,80580559353.0,23624059,Industrials
TDG,Transdigm Group Incorporated Common Stock,1427.18,80567644892.0,282391,Industrials
ECL,Ecolab Inc. Common Stock,284.09,80464416661.0,1004204,Consumer Discretionary
WMB,Williams Companies Inc. (The) Common Stock,65.48,79965411411.0,8716827,Utilities
CMI,Cummins Inc. Common Stock,576.23,79540630066.0,762467,Industrials
MNST,Monster Beverage Corporation,81.41,79539297195.0,4493796,Consumer Staples
EQIX,Equinix Inc. Common Stock REIT,809.55,79486539445.0,526249,Real Estate
RCL,Royal Caribbean Cruises Ltd. Common Stock,290.58,79244935404.0,2295773,Consumer Discretionary
CTAS,Cintas Corporation Common Stock,191.21,76462899212.0,1053435,Industrials
APO,Apollo Global Management Inc. (New) Common Stock,131.72,76453261316.0,4015841,Finance
MDLZ,Mondelez International Inc. Class A Common Stock,59.02,76156958198.0,10450559,Consumer Staples
DELL,Dell Technologies Inc. Class C Common Stock ,114.66,75983990109.0,5050112,Technology
SE,Sea Limited American Depositary Shares each representing one Class A Ordinary Share,127.11,75251653811.0,2783053,Consumer Discretionary
ITW,Illinois Tool Works Inc. Common Stock,258.69,75045969000.0,860466,Industrials
FDX,FedEx Corporation Common Stock,312.42,73457070175.0,2121250,Consumer Discretionary
SNOW,Snowflake Inc. Common Stock,212.75,72803050000.0,2853950,Technology
VRT,Vertiv Holdings LLC Class A Common Stock,189.21,72342232203.0,4379296,Technology
CI,The Cigna Group Common Stock,270.09,72148011643.0,2225099,Health Care
NET,Cloudflare Inc. Class A Common Stock,205.95,72140405932.0,12521310,Technology
ELV,Elevance Health Inc. Common Stock,322.92,71765341348.0,5771006,Health Care
EPD,Enterprise Products Partners L.P. Common Stock,33.17,71757359229.0,4636788,Utilities
PWR,Quanta Services Inc. Common Stock,479.27,71466771162.0,820971,Industrials
AON,Aon plc Class A Ordinary Shares (Ireland),330.75,71089838899.0,1330487,Finance
SNDK,Sandisk Corporation Common Stock,481.43,70555096966.0,13851370,Technology
MRVL,Marvell Technology Inc. Common Stock,82.93,70332933000.0,11278720,Technology
CSX,CSX Corporation Common Stock,37.67,70146699133.0,12328861,Industrials
WBD,Warner Bros. Discovery Inc. Series A Common Stock ,28.07,69556744468.0,21556813,Consumer Discretionary
COR,Cencora Inc. Common Stock,356.14,69269139540.0,1135205,Health Care
CL,Colgate-Palmolive Company Common Stock,85.76,69128129426.0,4992058,Consumer Discretionary
HLT,Hilton Worldwide Holdings Inc. Common Stock ,296.17,68840323114.0,1370218,Consumer Discretionary
MSI,Motorola Solutions Inc. Common Stock,406.08,67634653588.0,1013858,Technology
LHX,L3Harris Technologies Inc. Common Stock,360.54,67440033457.0,1289484,Industrials
RSG,Republic Services Inc. Common Stock,217.19,67234118067.0,1019171,Utilities
KMI,Kinder Morgan Inc. Common Stock,29.59,65830659940.0,14937822,Utilities
TFC,Truist Financial Corporation Common Stock,50.89,65100844767.0,10000614,Finance
NSC,Norfolk Southern Corporation Common Stock,288.97,64841000714.0,1502554,Industrials
AEP,American Electric Power Company Inc. Common Stock,119.43,63786909718.0,2675667,Utilities
PCAR,PACCAR Inc. Common Stock,120.81,63449938611.0,5224255,Consumer Discretionary
AZO,AutoZone Inc. Common Stock,3799.99,62957554122.0,146735,Consumer Discretionary
TRV,The Travelers Companies Inc. Common Stock,281.27,62741047300.0,1394022,Finance
AJG,Arthur J. Gallagher & Co. Common Stock,242.33,62230344000.0,3485512,Finance
ET,Energy Transfer LP Common Units ,17.95,61629294029.0,13509815,Utilities
MDLN,Medline Inc. Class A Common Stock,46.31,61376291497.0,5156384,Health Care
EOG,EOG Resources Inc. Common Stock,108.59,60812842732.0,3149247,Energy
FTNT,Fortinet Inc. Common Stock,81.71,60763486414.0,4817770,Technology
SPG,Simon Property Group Inc. Common Stock,184.56,60253314274.0,1021709,Real Estate
ROST,Ross Stores Inc. Common Stock,186.0,60160756608.0,3261036,Consumer Discretionary
RKT,Rocket Companies Inc. Class A Common Stock,21.03,59218166952.0,17636376,Finance
BDX,Becton Dickinson and Company Common Stock,203.4,58054133273.0,1884859,Health Care
URI,United Rentals Inc. Common Stock,907.45,57741176895.0,408258,Consumer Discretionary
APD,Air Products and Chemicals Inc. Common Stock,259.12,57677583248.0,899792,Basic Materials
SRE,DBA Sempra Common Stock,87.11,56855087294.0,3797988,Utilities
COIN,Coinbase Global Inc. Class A Common Stock,210.83,56849005306.0,7428081,Finance
ADSK,Autodesk Inc. Common Stock,268.09,56835080000.0,1458386,Technology
AFL,AFLAC Incorporated Common Stock,108.38,56803466324.0,2300521,Finance
MPLX,MPLX LP Common Units Representing Limited Partner Interests,55.73,56681040921.0,1143031,Energy
