symbol,name,price,marketCap,volume,industry
NVDA,NVIDIA Corporation Common Stock,184.89,4492827000000.0,359303190,Technology
AAPL,Apple Inc. Common Stock,272.95,4007217163000.0,32292484,Technology
GOOGL,Alphabet Inc. Class A Common Stock,307.38,3718375860000.0,36149536,Technology
GOOG,Alphabet Inc. Class C Capital Stock,307.15,3715593550000.0,22204911,Technology
MSFT,Microsoft Corporation Common Stock,401.72,2983023712411.0,34284221,Technology
AMZN,Amazon.com Inc. Common Stock,207.92,2232004747290.0,47633480,Consumer Discretionary
META,Meta Platforms Inc. Class A Common Stock,657.01,1661943235403.0,10612545,Technology
TSLA,Tesla Inc. Common Stock,408.58,1533168660023.0,53469915,Industrials
AVGO,Broadcom Inc. Common Stock,321.7,1525267781138.0,32858547,Technology
BRK/B,Berkshire Hathaway Inc.,502.67,1109046536861.0,4565658,
BRK/A,Berkshire Hathaway Inc.,753250.0,1107935840500.0,249,
WMT,Walmart Inc. Common Stock,124.42,991648173661.0,18630415,Consumer Discretionary
LLY,Eli Lilly and Company Common Stock,1022.02,964130150388.0,2663899,Health Care
JPM,JP Morgan Chase & Co. Common Stock,306.13,825642520959.0,7004475,Finance
XOM,Exxon Mobil Corporation Common Stock,148.54,618931043309.0,15606610,Energy
V,Visa Inc.,316.7,606800147210.0,8714679,Real Estate
JNJ,Johnson & Johnson Common Stock,243.47,586738093948.0,7162710,Health Care
MU,Micron Technology Inc. Common Stock,415.56,467716628501.0,35303269,Technology
MA,Mastercard Incorporated Common Stock,514.77,459078223333.0,4843570,Real Estate
COST,Costco Wholesale Corporation Common Stock,986.74,437983702610.0,1803800,Consumer Discretionary
ORCL,Oracle Corporation Common Stock,150.31,432004618210.0,20511716,Technology
ABBV,AbbVie Inc. Common Stock,224.69,397289895306.0,5317669,Health Care
BAC,Bank of America Corporation Common Stock,52.3,381920517265.0,52355180,Finance
PG,Procter & Gamble Company (The) Common Stock,163.75,380555112169.0,7018407,Consumer Discretionary
HD,Home Depot Inc. (The) Common Stock,375.09,373406402909.0,2884742,Consumer Discretionary
CVX,Chevron Corporation Common Stock,184.16,367470200862.0,7121501,Energy
GE,GE Aerospace Common Stock,340.84,357477631514.0,4715778,Technology
NFLX,Netflix Inc. Common Stock,84.59,357152696269.0,79070797,Consumer Discretionary
CAT,Caterpillar Inc. Common Stock,752.93,350328790883.0,3305638,Industrials
KO,Coca-Cola Company (The) Common Stock,80.5,346208207055.0,12811807,Consumer Staples
AMD,Advanced Micro Devices Inc. Common Stock,203.68,332082080502.0,34885642,Technology
PLTR,Palantir Technologies Inc. Class A Common Stock,135.94,324987776453.0,44962701,Technology
CSCO,Cisco Systems Inc. Common Stock (DE),78.1,308486646580.0,19606400,Telecommunications
LRCX,Lam Research Corporation Common Stock,239.07,298543682970.0,10694584,Technology
AMAT,Applied Materials Inc. Common Stock,375.72,298175099229.0,7709386,Technology
MRK,Merck & Company Inc. Common Stock (new),119.3,294956365958.0,10311673,Health Care
PM,Philip Morris International Inc Common Stock,187.5,291877421063.0,4869209,Health Care
MS,Morgan Stanley Common Stock,177.49,281829307963.0,6891227,Finance
GS,Goldman Sachs Group Inc. (The) Common Stock,929.0,278633586719.0,2216971,Finance
WFC,Wells Fargo & Company Common Stock,86.3,266290355818.0,18745170,Finance
RTX,RTX Corporation Common Stock,197.63,265276313408.0,5753482,Industrials
UNH,UnitedHealth Group Incorporated Common Stock (DE),286.66,259667698809.0,10202726,Health Care
MCD,McDonald's Corporation Common Stock,334.53,237649657708.0,2421035,Consumer Discretionary
GEV,GE Vernova Inc. Common Stock,876.46,236231794017.0,2793296,
TMUS,T-Mobile US Inc. Common Stock,213.15,234862042818.0,6626114,Telecommunications
LIN,Linde plc Ordinary Shares,498.51,232778711094.0,1945576,Basic Materials
CCZ,Comcast Holdings ZONES,64.38,231629325094.0,5,Telecommunications
AXP,American Express Company Common Stock,335.32,230235408157.0,3197748,Finance
PEP,PepsiCo Inc. Common Stock,167.58,229023048302.0,7218506,Consumer Staples
INTC,Intel Corporation Common Stock,45.46,227072700000.0,71195224,Technology
IBM,International Business Machines Corporation Common Stock,242.01,227013706112.0,7334549,Technology
VZ,Verizon Communications Inc. Common Stock,48.89,206202578974.0,23687985,Telecommunications
AMGN,Amgen Inc. Common Stock,379.33,204484541158.0,2589387,Health Care
C,Citigroup Inc. Common Stock,116.19,203253375656.0,14755491,Finance
ABT,Abbott Laboratories Common Stock,116.26,202023012443.0,7840564,Health Care
KLAC,KLA Corporation Common Stock,1524.31,199801388913.0,1184003,Technology
TMO,Thermo Fisher Scientific Inc Common Stock,520.12,195413275647.0,1551098,Industrials
TXN,Texas Instruments Incorporated Common Stock,212.63,192972521076.0,6040754,Technology
T,AT&T Inc.,27.46,192235849939.0,33835938,Telecommunications
NEE,NextEra Energy Inc. Common Stock,91.99,191663185468.0,20010889,Technology
DIS,Walt Disney Company (The) Common Stock,105.55,186983920273.0,9561885,Consumer Discretionary
CRM,Salesforce Inc. Common Stock,199.47,186903390000.0,26569162,Technology
APH,Amphenol Corporation Common Stock,148.47,182501540657.0,7755545,Technology
BA,Boeing Company (The) Common Stock,229.41,180166477293.0,4606824,Industrials
ISRG,Intuitive Surgical Inc. Common Stock,506.88,180008414531.0,1570325,Health Care
GILD,Gilead Sciences Inc. Common Stock,143.77,178479029311.0,7987246,Health Care
TJX,TJX Companies Inc. (The) Common Stock,158.69,176220023306.0,5986043,Consumer Discretionary
SCCO,Southern Copper Corporation Common Stock,215.7,175189777731.0,1852692,Basic Materials
SCHW,Charles Schwab Corporation (The) Common Stock,97.52,173286873810.0,9895717,Finance
ADI,Analog Devices Inc. Common Stock,354.35,172995143033.0,4661589,Technology
BLK,BlackRock Inc. Common Stock,1090.27,169156381555.0,725414,Finance
DE,Deere & Company Common Stock,619.46,167530130404.0,1421720,Industrials
ANET,Arista Networks Inc. Common Stock,130.25,163664062257.0,6347671,Telecommunications
TBB,AT&T Inc. 5.350% Global Notes due 2066,22.63,161813223412.0,95044,Telecommunications
UNP,Union Pacific Corporation Common Stock,265.45,157515763057.0,3821916,Industrials
QCOM,QUALCOMM Incorporated Common Stock,145.59,155344530000.0,8640502,Technology
PFE,Pfizer Inc. Common Stock,27.1,154082674659.0,30497076,Health Care
UBER,Uber Technologies Inc. Common Stock,74.8,153947075528.0,22383678,Real Estate
HON,Honeywell International Inc. Common Stock,240.88,153121562857.0,3039392,Industrials
APP,Applovin Corporation Class A Common Stock,444.93,150065100540.0,5874730,Technology
LOW,Lowe's Companies Inc. Common Stock,264.39,148309955716.0,3428229,Consumer Discretionary
DHR,Danaher Corporation Common Stock,209.36,148046695572.0,2839634,Industrials
SYK,Stryker Corporation Common Stock,386.06,147740789871.0,1060510,Health Care
LMT,Lockheed Martin Corporation Common Stock,641.63,147626384391.0,1268711,Industrials
WELL,Welltower Inc. Common Stock,208.45,145446514879.0,2192719,Real Estate
NEM,Newmont Corporation,127.47,138671325804.0,7226896,Basic Materials
COP,ConocoPhillips Common Stock,110.7,135312944126.0,7204880,Energy
BKNG,Booking Holdings Inc. Common Stock,4250.26,134619955570.0,754863,Consumer Discretionary
PLD,Prologis Inc. Common Stock,142.66,132610886940.0,3221681,Real Estate
SPGI,S&P Global Inc. Common Stock,437.49,130722012000.0,2513492,Finance
COF,Capital One Financial Corporation Common Stock,208.47,129654079193.0,4740266,Finance
GLW,Corning Incorporated Common Stock,150.3,128949600783.0,17533545,Industrials
PH,Parker-Hannifin Corporation Common Stock,1014.97,128105990439.0,459884,Industrials
MDT,Medtronic plc. Ordinary Shares,97.03,124575358057.0,7910673,Health Care
BMY,Bristol-Myers Squibb Company Common Stock,61.1,124428543376.0,10671999,Health Care
PGR,Progressive Corporation (The) Common Stock,211.73,124157886778.0,3087825,Finance
VRTX,Vertex Pharmaceuticals Incorporated Common Stock,480.13,121969435645.0,1305275,Health Care
PANW,Palo Alto Networks Inc. Common Stock,149.4,121910400000.0,12112941,Technology
MCK,McKesson Corporation Common Stock,974.45,119357901499.0,599926,Health Care
HCA,HCA Healthcare Inc. Common Stock,525.88,117598442536.0,1062214,Health Care
CEG,Constellation Energy Corporation Common Stock ,323.56,117125592793.0,3958061,Utilities
MO,Altria Group Inc.,69.47,116617312717.0,6468400,Health Care
NOW,ServiceNow Inc. Common Stock,109.3,114327800000.0,26468526,Technology
CME,CME Group Inc. Class A Common Stock,316.45,114110808943.0,2477651,Finance
BSX,Boston Scientific Corporation Common Stock,75.75,112404323292.0,13021370,Health Care
SBUX,Starbucks Corporation Common Stock,98.08,111738825003.0,6245384,Consumer Discretionary
CMCSA,Comcast Corporation Class A Common Stock,30.85,110993548915.0,25474882,Telecommunications
INTU,Intuit Inc. Common Stock,394.42,109806528000.0,9730246,Technology
SO,Southern Company (The) Common Stock,96.35,107853350888.0,5711749,Utilities
ADBE,Adobe Inc. Common Stock,259.04,106335920000.0,6197488,Technology
HWM,Howmet Aerospace Inc. Common Stock,260.31,104368707800.0,1617484,Industrials
NOC,Northrop Grumman Corporation Common Stock,710.9,100892080369.0,587974,Industrials
DUK,Duke Energy Corporation (Holding Company) Common Stock,129.23,100497159978.0,3737803,Utilities
CVS,CVS Health Corporation Common Stock,78.01,99245185025.0,6319185,Consumer Staples
VRT,Vertiv Holdings LLC Class A Common Stock,259.23,99180999823.0,8555334,Technology
UPS,United Parcel Service Inc. Common Stock,116.63,99030732904.0,5312552,Industrials
FCX,Freeport-McMoRan Inc. Common Stock,68.38,98275845818.0,17720961,Basic Materials
SNDK,Sandisk Corporation Common Stock,651.9,96221073647.0,23614433,Technology
CRWD,CrowdStrike Holdings Inc. Class A Common Stock,381.1,96074715484.0,6192273,Technology
WDC,Western Digital Corporation Common Stock,282.25,95693453485.0,10828582,Technology
GD,General Dynamics Corporation Common Stock,350.72,94831096276.0,1005016,Industrials
NKE,Nike Inc. Common Stock,63.95,94670518558.0,10507257,Consumer Discretionary
WM,Waste Management Inc. Common Stock,233.9,94340239176.0,2454797,Utilities
EQIX,Equinix Inc. Common Stock REIT,948.02,93147636843.0,612282,Real Estate
MAR,Marriott International Class A Common Stock,350.57,92895635096.0,1471698,Consumer Discretionary
ICE,Intercontinental Exchange Inc. Common Stock,162.89,92504663003.0,3209622,Finance
WMB,Williams Companies Inc. (The) Common Stock,74.77,91336273809.0,6609772,Utilities
FDX,FedEx Corporation Common Stock,387.68,91152413307.0,1786978,Consumer Discretionary
PNC,PNC Financial Services Group Inc. (The) Common Stock,222.82,89879109063.0,2653249,Finance
MRSH,Marsh Common Stock,185.29,89703382838.0,2768880,Finance
SHW,Sherwin-Williams Company (The) Common Stock,360.5,89322803504.0,1222767,Consumer Discretionary
USB,U.S. Bancorp Common Stock,57.26,88964621451.0,10932137,Finance
ADP,Automatic Data Processing Inc. Common Stock,218.36,87921423323.0,3862766,Industrials
MMM,3M Company Common Stock,166.17,87521739000.0,3473472,Health Care
BX,Blackstone Inc. Common Stock,117.95,87100280234.0,9112443,Finance
ECL,Ecolab Inc. Common Stock,306.76,86496947868.0,1187911,Consumer Discretionary
RCL,Royal Caribbean Cruises Ltd. Common Stock,318.94,86282296959.0,2450136,Consumer Discretionary
AMT,American Tower Corporation (REIT) Common Stock,185.01,86230352548.0,2918220,Real Estate
EMR,Emerson Electric Company Common Stock,152.72,85828640000.0,2676336,Technology
MCO,Moody's Corporation Common Stock,479.47,85010031000.0,1744513,Finance
BK,The Bank of New York Mellon Corporation Common Stock,121.61,84804626970.0,3565463,Finance
MNST,Monster Beverage Corporation,86.66,84668658579.0,9466474,Consumer Staples
PWR,Quanta Services Inc. Common Stock,565.05,84542457791.0,1082156,Industrials
ITW,Illinois Tool Works Inc. Common Stock,290.28,83629668000.0,1416884,Industrials
KKR,KKR & Co. Inc. Common Stock,93.62,83457825273.0,15499919,Finance
ABNB,Airbnb Inc. Class A Common Stock,136.97,83375550827.0,7277319,Consumer Discretionary
SNPS,Synopsys Inc. Common Stock,426.0,81557240346.0,3915050,Technology
REGN,Regeneron Pharmaceuticals Inc. Common Stock,770.79,81487769267.0,772709,Health Care
CMI,Cummins Inc. Common Stock,588.11,81256490445.0,797741,Industrials
CDNS,Cadence Design Systems Inc. Common Stock,297.6,81140937600.0,3284288,Technology
DELL,Dell Technologies Inc. Class C Common Stock ,121.45,80483652527.0,14213339,Technology
CSX,CSX Corporation Common Stock,42.65,79310097477.0,10894170,Industrials
CTAS,Cintas Corporation Common Stock,198.28,79290119009.0,2107637,Industrials
DASH,DoorDash Inc. Class A Common Stock,180.41,78374858164.0,5539604,Technology
CL,Colgate-Palmolive Company Common Stock,97.55,78191010131.0,5800185,Consumer Discretionary
MSI,Motorola Solutions Inc. Common Stock,471.95,78182723518.0,920334,Technology
EPD,Enterprise Products Partners L.P. Common Stock,35.98,77836291379.0,4892682,Utilities
CVNA,Carvana Co. Class A Common Stock,353.9,77449481905.0,3202847,Consumer Discretionary
CI,The Cigna Group Common Stock,288.82,77151278177.0,1215703,Health Care
ORLY,O'Reilly Automotive Inc. Common Stock,91.33,77092026722.0,9821843,Consumer Discretionary
MDLZ,Mondelez International Inc. Class A Common Stock,59.94,76833829400.0,10716552,Consumer Staples
TDG,Transdigm Group Incorporated Common Stock,1314.26,74220944908.0,372864,Industrials
KMI,Kinder Morgan Inc. Common Stock,33.06,73552099485.0,12412316,Utilities
GM,General Motors Company Common Stock,80.79,73031562844.0,6402170,Industrials
HLT,Hilton Worldwide Holdings Inc. Common Stock ,317.83,72875753995.0,1160761,Consumer Discretionary
HOOD,Robinhood Markets Inc. Class A Common Stock,79.45,71529501586.0,22617136,Finance
AEP,American Electric Power Company Inc. Common Stock,132.1,71447800583.0,3811375,Utilities
WBD,Warner Bros. Discovery Inc. Series A Common Stock ,28.8,71365665859.0,18300761,Consumer Discretionary
COR,Cencora Inc. Common Stock,366.65,71324674555.0,1024478,Health Care
ELV,Elevance Health Inc. Common Stock,323.05,71298642674.0,2164508,Health Care
AON,Aon plc Class A Ordinary Shares (Ireland),330.27,70761832394.0,1061993,Finance
NSC,Norfolk Southern Corporation Common Stock,313.01,70293289545.0,1138580,Industrials
RSG,Republic Services Inc. Common Stock,224.59,69354508212.0,1190231,Utilities
MRVL,Marvell Technology Inc. Common Stock,79.29,69076395584.0,12312520,Technology
APO,Apollo Global Management Inc. (New) Common Stock,114.4,66400342351.0,6778912,Finance
LHX,L3Harris Technologies Inc. Common Stock,355.16,66335457567.0,1553031,Industrials
TRV,The Travelers Companies Inc. Common Stock,306.24,66220695108.0,1018528,Finance
SPG,Simon Property Group Inc. Common Stock,202.6,66142834156.0,1103159,Real Estate
ROST,Ross Stores Inc. Common Stock,203.5,65821042848.0,2641253,Consumer Discretionary
SE,Sea Limited American Depositary Shares each representing one Class A Ordinary Share,110.9,65655010681.0,6274616,Consumer Discretionary
PCAR,PACCAR Inc. Common Stock,124.08,65252982487.0,3847005,Consumer Discretionary
EOG,EOG Resources Inc. Common Stock,121.13,64985214547.0,5120363,Energy
MDLN,Medline Inc. Class A Common Stock,48.89,64795657337.0,3061844,Health Care
TFC,Truist Financial Corporation Common Stock,51.5,64332168583.0,6013013,Finance
ET,Energy Transfer LP Common Units ,18.69,64299479407.0,9710350,Utilities
BKR,Baker Hughes Company Class A Common Stock,64.9,64136549499.0,7247432,Consumer Discretionary
VLO,Valero Energy Corporation Common Stock,203.79,62157893953.0,2343014,Energy
SRE,DBA Sempra Common Stock,95.2,62135280799.0,4950865,Utilities
APD,Air Products and Chemicals Inc. Common Stock,276.23,61504269090.0,1524407,Basic Materials
O,Realty Income Corporation Common Stock,66.6,61265723949.0,6310720,Real Estate
NET,Cloudflare Inc. Class A Common Stock,174.66,61180108279.0,4094784,Technology
PSX,Phillips 66 Common Stock,152.46,61097433594.0,2476153,Energy
AZO,AutoZone Inc. Common Stock,3660.0,60638224860.0,128171,Consumer Discretionary
DLR,Digital Realty Trust Inc. Common Stock,176.37,60603455858.0,1992740,Real Estate
MPC,Marathon Petroleum Corporation Common Stock,201.07,60442140453.0,2021157,Energy
SOMN,Southern Company (The) 2025 Series A Corporate Units,53.7,60111312327.0,136745,Basic Materials
VST,Vistra Corp. Common Stock,176.82,59911123142.0,7740146,Utilities
AFL,AFLAC Incorporated Common Stock,113.97,59733263120.0,1901804,Finance
MPLX,MPLX LP Common Units Representing Limited Partner Interests,58.66,59661041816.0,1484728,Energy
SNOW,Snowflake Inc. Common Stock,173.06,59221132000.0,16623218,Technology
