symbol,name,price,marketCap,volume,industry
NVDA,NVIDIA Corporation Common Stock,199.57,4849551000000.0,224649422,Technology
GOOGL,Alphabet Inc. Class A Common Stock,384.8,4655096510459.0,71948870,Technology
GOOG,Alphabet Inc. Class C Capital Stock,381.94,4620497820179.0,44508166,Technology
AAPL,Apple Inc. Common Stock,271.35,3983727339000.0,89993046,Technology
MSFT,Microsoft Corporation Common Stock,407.78,3028023024611.0,70778767,Technology
AMZN,Amazon.com Inc. Common Stock,265.06,2850521981843.0,100868133,Consumer Discretionary
AVGO,Broadcom Inc. Common Stock,417.43,1976392540047.0,21799451,Technology
META,Meta Platforms Inc. Class A Common Stock,611.91,1553286603951.0,52674813,Technology
TSLA,Tesla Inc. Common Stock,381.63,1433296900890.0,50938547,Industrials
WMT,Walmart Inc. Common Stock,131.93,1051799061957.0,19860018,Consumer Discretionary
BRK/A,Berkshire Hathaway Inc.,711900.0,1047115200600.0,175,Uncategorized
BRK/B,Berkshire Hathaway Inc.,473.6,1044909065306.0,5100226,Uncategorized
LLY,Eli Lilly and Company Common Stock,934.6,883027726183.0,8228431,Health Care
JPM,JP Morgan Chase & Co. Common Stock,313.23,840151654392.0,8863329,Finance
XOM,Exxon Mobil Corporation Common Stock,154.33,643056603701.0,22851358,Energy
V,Visa Inc.,329.84,631976509491.0,11237902,Real Estate
MU,Micron Technology Inc. Common Stock,517.16,583218941815.0,36148223,Technology
AMD,Advanced Micro Devices Inc. Common Stock,354.49,577938793768.0,41999678,Technology
JNJ,Johnson & Johnson Common Stock,229.85,553298820784.0,8155773,Health Care
INTC,Intel Corporation Common Stock,94.48,474856480000.0,159992707,Technology
ORCL,Oracle Corporation Common Stock,161.39,464165063940.0,20959231,Technology
COST,Costco Wholesale Corporation Common Stock,1014.53,450098811406.0,2048346,Consumer Discretionary
MA,Mastercard Incorporated Common Stock,502.92,441453454556.0,5971540,Real Estate
CAT,Caterpillar Inc. Common Stock,890.11,414156907087.0,5200901,Industrials
NFLX,Netflix Inc. Common Stock,93.61,394172850206.0,40818609,Consumer Discretionary
CVX,Chevron Corporation Common Stock,193.31,385128721604.0,11725557,Energy
BAC,Bank of America Corporation Common Stock,53.46,382009612816.0,27084559,Finance
ABBV,AbbVie Inc. Common Stock,211.32,373774865508.0,10318176,Health Care
CSCO,Cisco Systems Inc. Common Stock (DE),91.5,361415213343.0,21680264,Telecommunications
PG,Procter & Gamble Company (The) Common Stock,147.09,342513623674.0,9490730,Consumer Discretionary
KO,Coca-Cola Company (The) Common Stock,78.76,338995080593.0,15139342,Consumer Staples
UNH,UnitedHealth Group Incorporated Common Stock (DE),370.48,336474818926.0,6874061,Health Care
PLTR,Palantir Technologies Inc. Class A Common Stock,139.11,333468525433.0,32375551,Technology
HD,Home Depot Inc. (The) Common Stock,328.8,327493893950.0,4316445,Consumer Discretionary
LRCX,Lam Research Corporation Common Stock,257.86,322472238060.0,10376499,Technology
AMAT,Applied Materials Inc. Common Stock,394.49,313071156433.0,7039474,Technology
GE,GE Aerospace Common Stock,289.93,302494764544.0,7600698,Technology
MS,Morgan Stanley Common Stock,190.59,301396512880.0,5662695,Finance
GEV,GE Vernova Inc. Common Stock,1083.46,291147365783.0,3530725,Uncategorized
GS,Goldman Sachs Group Inc. (The) Common Stock,923.77,272506553801.0,1879323,Finance
MRK,Merck & Company Inc. Common Stock (new),109.18,269814872280.0,17100568,Health Care
PM,Philip Morris International Inc Common Stock,165.07,257271308709.0,4813470,Health Care
TXN,Texas Instruments Incorporated Common Stock,281.08,255808881694.0,11063517,Technology
WFC,Wells Fargo & Company Common Stock,82.23,253710064648.0,13535197,Finance
RTX,RTX Corporation Common Stock,176.07,237110551168.0,6220217,Industrials
LIN,Linde plc Ordinary Shares,501.14,232225347338.0,3036234,Basic Materials
CCZ,Comcast Holdings ZONES,64.54,230654437674.0,349,Telecommunications
KLAC,KLA Corporation Common Stock,1750.35,229429946064.0,1890615,Technology
C,Citigroup Inc. Common Stock,127.98,223651065188.0,12124744,Finance
AXP,American Express Company Common Stock,323.05,220425557411.0,4586823,Finance
ANET,Arista Networks Inc. Common Stock,172.71,217471153637.0,6136554,Telecommunications
IBM,International Business Machines Corporation Common Stock,230.98,217094701974.0,6279605,Technology
PEP,PepsiCo Inc. Common Stock,158.49,216619110244.0,7065116,Consumer Staples
TMUS,T-Mobile US Inc. Common Stock,195.5,211571022174.0,5091746,Telecommunications
MCD,McDonald's Corporation Common Stock,293.59,208691884185.0,4136611,Consumer Discretionary
NEE,NextEra Energy Inc. Common Stock,97.88,204113221713.0,17547487,Technology
VZ,Verizon Communications Inc. Common Stock,48.03,202575370589.0,34705003,Telecommunications
ADI,Analog Devices Inc. Common Stock,402.26,196385004195.0,3745043,Technology
QCOM,QUALCOMM Incorporated Common Stock,179.58,191611860000.0,61082440,Technology
AMGN,Amgen Inc. Common Stock,346.25,186866105414.0,3591222,Health Care
DIS,Walt Disney Company (The) Common Stock,103.75,183795184541.0,9194749,Consumer Discretionary
T,AT&T Inc.,26.13,181560093759.0,44636702,Telecommunications
APH,Amphenol Corporation Common Stock,147.27,181058260514.0,9312913,Technology
BA,Boeing Company (The) Common Stock,229.03,180544882869.0,4833503,Industrials
TMO,Thermo Fisher Scientific Inc Common Stock,478.96,177926093506.0,2161223,Industrials
TJX,TJX Companies Inc. (The) Common Stock,156.75,173492570015.0,4613201,Consumer Discretionary
BLK,BlackRock Inc. Common Stock,1065.6,165556655222.0,573120,Finance
CRM,Salesforce Inc. Common Stock,176.53,162937190000.0,14390521,Technology
GILD,Gilead Sciences Inc. Common Stock,130.84,162427461884.0,6660032,Health Care
ISRG,Intuitive Surgical Inc. Common Stock,457.61,162068458128.0,1999459,Health Care
SNDK,Sandisk Corporation Common Stock,1096.51,161845941808.0,14322942,Technology
UNP,Union Pacific Corporation Common Stock,269.48,159993836639.0,3317025,Industrials
DE,Deere & Company Common Stock,589.87,159328182433.0,1561898,Industrials
SCHW,Charles Schwab Corporation (The) Common Stock,91.64,159279432773.0,12559277,Finance
ABT,Abbott Laboratories Common Stock,90.79,158125068446.0,19652205,Health Care
TBB,AT&T Inc. 5.350% Global Notes due 2066,21.52,153876295530.0,72367,Telecommunications
COP,ConocoPhillips Common Stock,125.78,153553201688.0,11943227,Energy
WELL,Welltower Inc. Common Stock,217.34,153122656479.0,4137887,Real Estate
UBER,Uber Technologies Inc. Common Stock,74.61,152424226651.0,16056019,Real Estate
PFE,Pfizer Inc. Common Stock,26.7,151879108644.0,39037235,Health Care
APP,Applovin Corporation Class A Common Stock,446.35,150105021955.0,2244280,Technology
WDC,Western Digital Corporation Common Stock,434.52,147318757867.0,11472046,Technology
PANW,Palo Alto Networks Inc. Common Stock,179.32,146325120000.0,5768102,Technology
MRVL,Marvell Technology Inc. Common Stock,165.15,144416779162.0,20289945,Technology
SCCO,Southern Copper Corporation Common Stock,171.69,141827106889.0,1366227,Basic Materials
GLW,Corning Incorporated Common Stock,164.24,141091371400.0,12857504,Industrials
HON,Honeywell International Inc. Common Stock,214.33,135810872995.0,4126075,Industrials
DELL,Dell Technologies Inc. Class C Common Stock ,208.95,134929138836.0,5632797,Technology
LOW,Lowe's Companies Inc. Common Stock,238.79,133737546211.0,2958883,Consumer Discretionary
PLD,Prologis Inc. Common Stock,142.02,132395400606.0,3859467,Real Estate
BKNG,Booking Holdings Inc. Common Stock,168.36,130458533485.0,8642186,Consumer Discretionary
SPGI,S&P Global Inc. Common Stock,431.23,127644080000.0,1675101,Finance
DHR,Danaher Corporation Common Stock,178.95,126655553702.0,5142361,Industrials
VRT,Vertiv Holdings LLC Class A Common Stock,328.49,126175904968.0,6258178,Technology
BMY,Bristol-Myers Squibb Company Common Stock,60.59,123708751218.0,24877959,Health Care
MO,Altria Group Inc.,72.65,121420930425.0,24763986,Health Care
COF,Capital One Financial Corporation Common Stock,191.3,121321676818.0,4900158,Finance
SYK,Stryker Corporation Common Stock,315.13,120689827648.0,2751484,Health Care
SBUX,Starbucks Corporation Common Stock,105.33,120044601000.0,9484092,Consumer Discretionary
LMT,Lockheed Martin Corporation Common Stock,517.97,119425032036.0,1585821,Industrials
NEM,Newmont Corporation,111.09,118594436553.0,8290812,Basic Materials
PGR,Progressive Corporation (The) Common Stock,201.28,117931230732.0,2467516,Finance
PH,Parker-Hannifin Corporation Common Stock,909.42,114783835803.0,2029681,Industrials
CRWD,CrowdStrike Holdings Inc. Class A Common Stock,445.75,113048480618.0,2439655,Technology
PWR,Quanta Services Inc. Common Stock,727.77,109206779114.0,2424182,Industrials
SO,Southern Company (The) Common Stock,96.7,109108527078.0,8323505,Utilities
VRTX,Vertex Pharmaceuticals Incorporated Common Stock,427.38,108749815992.0,1121072,Health Care
INTU,Intuit Inc. Common Stock,388.5,107439675000.0,2450021,Technology
EQIX,Equinix Inc. Common Stock REIT,1082.83,106792470428.0,1077344,Real Estate
CVS,CVS Health Corporation Common Stock,83.29,106744830726.0,8330792,Consumer Staples
CME,CME Group Inc. Class A Common Stock,287.82,104294267254.0,2508705,Finance
MDT,Medtronic plc. Ordinary Shares,80.97,103956165535.0,15780308,Health Care
DUK,Duke Energy Corporation (Holding Company) Common Stock,129.55,100805138319.0,3798899,Utilities
MCK,McKesson Corporation Common Stock,815.2,99851774131.0,1367386,Health Care
ADBE,Adobe Inc. Common Stock,246.1,99473620000.0,5122778,Technology
CEG,Constellation Energy Corporation Common Stock ,313.0,98065931405.0,2903187,Utilities
HWM,Howmet Aerospace Inc. Common Stock,243.04,97389422893.0,2539469,Industrials
HCA,HCA Healthcare Inc. Common Stock,434.45,96660737055.0,1496475,Health Care
CMCSA,Comcast Corporation Class A Common Stock,27.04,96636132549.0,41994092,Telecommunications
FDX,FedEx Corporation Common Stock,403.31,96232490762.0,1941009,Consumer Discretionary
MAR,Marriott International Class A Common Stock,361.69,95823252548.0,1996732,Consumer Discretionary
WM,Waste Management Inc. Common Stock,232.55,93697536518.0,3191050,Utilities
WMB,Williams Companies Inc. (The) Common Stock,76.31,93314224300.0,8828723,Utilities
GD,General Dynamics Corporation Common Stock,344.3,93252230287.0,2029833,Industrials
BX,Blackstone Inc. Common Stock,125.58,93203056952.0,9133466,Finance
KKR,KKR & Co. Inc. Common Stock,104.34,93024420280.0,5267115,Finance
CMI,Cummins Inc. Common Stock,671.01,92772111394.0,879611,Industrials
BK,The Bank of New York Mellon Corporation Common Stock,134.37,92477059571.0,6068038,Finance
SNPS,Synopsys Inc. Common Stock,482.6,92447834230.0,1340733,Technology
UPS,United Parcel Service Inc. Common Stock,108.8,92398171194.0,6089693,Industrials
NOW,ServiceNow Inc. Common Stock,88.31,91047610000.0,22040943,Technology
CDNS,Cadence Design Systems Inc. Common Stock,329.59,90997184692.0,2076826,Technology
PNC,PNC Financial Services Group Inc. (The) Common Stock,223.0,89951715829.0,2318705,Finance
ICE,Intercontinental Exchange Inc. Common Stock,158.09,89547039006.0,5847250,Finance
USB,U.S. Bancorp Common Stock,56.66,88032403971.0,10918673,Finance
CVNA,Carvana Co. Class A Common Stock,395.8,86721062392.0,5786945,Consumer Discretionary
BSX,Boston Scientific Corporation Common Stock,57.61,85618551371.0,21707071,Health Care
ADP,Automatic Data Processing Inc. Common Stock,211.94,85336446506.0,4253558,Industrials
AMT,American Tower Corporation (REIT) Common Stock,182.71,85123322637.0,3006345,Real Estate
CSX,CSX Corporation Common Stock,45.43,84415248228.0,13271495,Industrials
EPD,Enterprise Products Partners L.P. Common Stock,38.7,83660138432.0,6587671,Utilities
ABNB,Airbnb Inc. Class A Common Stock,140.36,83447564371.0,2857323,Consumer Discretionary
ORLY,O'Reilly Automotive Inc. Common Stock,99.4,83167927517.0,11140190,Consumer Discretionary
FCX,Freeport-McMoRan Inc. Common Stock,57.78,83060523615.0,16173328,Basic Materials
NOC,Northrop Grumman Corporation Common Stock,579.48,82305558672.0,649611,Industrials
ELV,Elevance Health Inc. Common Stock,376.42,81744263080.0,1730557,Health Care
MRSH,Marsh Common Stock,167.71,80801755763.0,2994597,Finance
MCO,Moody's Corporation Common Stock,461.85,80685195000.0,1070811,Finance
BE,Bloom Energy Corporation Class A Common Stock,283.36,80598662243.0,13928094,Energy
SHW,Sherwin-Williams Company (The) Common Stock,321.61,79320482070.0,2165655,Consumer Discretionary
MPWR,Monolithic Power Systems Inc. Common Stock,1614.41,79296590380.0,1076301,Technology
EMR,Emerson Electric Company Common Stock,140.44,78927280000.0,2736968,Technology
MDLZ,Mondelez International Inc. Class A Common Stock,61.44,78867441623.0,10111236,Consumer Staples
CI,The Cigna Group Common Stock,290.58,76576046731.0,2412450,Health Care
MMM,3M Company Common Stock,146.52,76420035082.0,5017913,Health Care
VLO,Valero Energy Corporation Common Stock,252.58,75509718221.0,3529281,Energy
MNST,Monster Beverage Corporation,77.07,75367217116.0,4559239,Consumer Staples
EOG,EOG Resources Inc. Common Stock,140.57,75305571974.0,3808701,Energy
CIEN,Ciena Corporation Common Stock,527.58,74598982117.0,2664332,Utilities
AEP,American Electric Power Company Inc. Common Stock,137.11,74527988743.0,3690419,Utilities
ITW,Illinois Tool Works Inc. Common Stock,258.01,74327024389.0,3486793,Industrials
APO,Apollo Global Management Inc. (New) Common Stock,128.72,74209550780.0,4212119,Finance
REGN,Regeneron Pharmaceuticals Inc. Common Stock,707.06,74127485966.0,1096549,Health Care
HLT,Hilton Worldwide Holdings Inc. Common Stock ,324.07,73774007914.0,2143068,Consumer Discretionary
DASH,DoorDash Inc. Class A Common Stock,168.65,73703341711.0,3312552,Technology
ECL,Ecolab Inc. Common Stock,260.6,73599633941.0,1413316,Consumer Discretionary
ROST,Ross Stores Inc. Common Stock,227.79,73382126633.0,2354556,Consumer Discretionary
MPC,Marathon Petroleum Corporation Common Stock,248.29,73291422074.0,2355787,Energy
KMI,Kinder Morgan Inc. Common Stock,32.87,73130022633.0,14937399,Utilities
MSI,Motorola Solutions Inc. Common Stock,439.03,72968371337.0,1155557,Technology
NET,Cloudflare Inc. Class A Common Stock,204.97,72145401681.0,3052531,Technology
PSX,Phillips 66 Common Stock,179.15,71836031178.0,3613271,Energy
NSC,Norfolk Southern Corporation Common Stock,315.83,70933523336.0,1893365,Industrials
RCL,Royal Caribbean Cruises Ltd. Common Stock,263.76,70738512091.0,5212607,Consumer Discretionary
DLR,Digital Realty Trust Inc. Common Stock,200.94,70119110735.0,3230781,Real Estate
CTAS,Cintas Corporation Common Stock,174.71,69899220560.0,2808500,Industrials
ET,Energy Transfer LP Common Units ,20.19,69459951269.0,30700627,Utilities
GM,General Motors Company Common Stock,76.89,69329036844.0,11020252,Industrials
BKR,Baker Hughes Company Class A Common Stock,69.67,69117426120.0,8002954,Consumer Discretionary
CL,Colgate-Palmolive Company Common Stock,85.36,68393805769.0,7493185,Consumer Discretionary
WBD,Warner Bros. Discovery Inc. Series A Common Stock ,27.05,67082093381.0,13574970,Consumer Discretionary
APD,Air Products and Chemicals Inc. Common Stock,300.05,66807935200.0,2304940,Basic Materials
AON,Aon plc Class A Ordinary Shares (Ireland),311.65,66560200909.0,2614124,Finance
SPG,Simon Property Group Inc. Common Stock,203.71,66174823970.0,1394391,Real Estate
NKE,Nike Inc. Common Stock,44.36,65692148784.0,21650963,Consumer Discretionary
HOOD,Robinhood Markets Inc. Class A Common Stock,72.89,65661665327.0,31120864,Finance
TDG,Transdigm Group Incorporated Common Stock,1159.98,65508203609.0,343462,Industrials
TRV,The Travelers Companies Inc. Common Stock,305.14,64886401622.0,1560224,Finance
FIX,Comfort Systems USA Inc. Common Stock,1840.25,64781260766.0,574866,Industrials
RSG,Republic Services Inc. Common Stock,209.22,64639814490.0,1630764,Utilities
LITE,Lumentum Holdings Inc. Common Stock,902.32,64425648000.0,6128418,Telecommunications
TFC,Truist Financial Corporation Common Stock,51.5,63912002228.0,7607903,Finance
PCAR,PACCAR Inc. Common Stock,118.8,62520040242.0,2821866,Consumer Discretionary
FTNT,Fortinet Inc. Common Stock,84.31,62382957283.0,5809357,Technology
SRE,DBA Sempra Common Stock,95.12,62144992727.0,4745876,Utilities
UI,Ubiquiti Inc. Common Stock,1012.01,61247648736.0,64300,Technology
AZO,AutoZone Inc. Common Stock,3704.03,61030635585.0,349077,Consumer Discretionary
CRWV,CoreWeave Inc. Class A Common Stock,111.6,60595123003.0,25194638,Technology
URI,United Rentals Inc. Common Stock,959.84,60130671271.0,816496,Consumer Discretionary
OXY,Occidental Petroleum Corporation Common Stock,60.58,60076894065.0,12962487,Energy
