symbol,name,price,marketCap,volume,industry
MHH,Mastech Digital Inc Common Stock,7.18,85267569.0,4715,Consumer Discretionary
AGH,Aureus Greenway Holdings Inc. Common Stock,4.06,82234009.0,703260,Consumer Discretionary
CPHC,Canterbury Park Holding Corporation 'New' Common Stock,15.93,82044821.0,983,Consumer Discretionary
DLHC,DLH Holdings Corp.,5.5,79711693.0,126411,Consumer Discretionary
DIT,AMCON Distributing Company Common Stock,80.46,78531213.0,401,Consumer Discretionary
BARK,BARK Inc. Class A Common Stock,9.06,78293539.0,50886,Consumer Discretionary
FLNT,Fluent Inc. Common Stock,2.62,78117165.0,47585,Consumer Discretionary
JFB,JFB Construction Holdings Class A Common Stock,5.44,77290976.0,189022,Consumer Discretionary
HOUR,Hour Loop Inc. Common Stock,2.19,77052719.0,72018,Consumer Discretionary
UFI,Unifi Inc. New Common Stock,4.11,76393614.0,18635,Consumer Discretionary
MDIA,Mediaco Holding Inc. Class A Common Stock ,0.9319,76165893.0,21098,Consumer Discretionary
NDLS,Noodles & Company Class A Common Stock,12.73,75005784.0,30163,Consumer Discretionary
GENK,GEN Restaurant Group Inc. Class A Common Stock,2.26,74500037.0,79078,Consumer Discretionary
LVO,LiveOne Inc. Common Stock,5.53,74495974.0,90740,Consumer Discretionary
TISI,Team Inc. Common Stock,15.75,71999267.0,5196,Consumer Discretionary
RGS,Regis Corporation Common Stock,28.05,70090723.0,34187,Consumer Discretionary
RRGB,Red Robin Gourmet Burgers Inc. Common Stock,3.77,68370194.0,304199,Consumer Discretionary
PLCE,Children's Place Inc. (The) Common Stock,3.07,68195466.0,132994,Consumer Discretionary
IZEA,IZEA Worldwide Inc. Common Stock,3.87,67090788.0,122296,Consumer Discretionary
OMEX,Odyssey Marine Exploration Inc. Common Stock,1.14,66711271.0,787445,Consumer Discretionary
GAIA,Gaia Inc. Class A Common Stock,2.53,64044865.0,80454,Consumer Discretionary
SGA,Saga Communications Inc. Class A Common Stock (FL),10.02,63766959.0,26305,Consumer Discretionary
SPRU,Spruce Power Holding Corporation Class A Common Stock,3.3,60618690.0,64571,Consumer Discretionary
VRM,Vroom Inc. Common Stock,11.62,60499472.0,4458,Consumer Discretionary
STKS,The ONE Group Hospitality Inc. Common Stock,1.89,59656529.0,28101,Consumer Discretionary
ELWT,Elauwit Connection Inc. Common Stock,8.84,58518997.0,60453,Consumer Discretionary
AIRT,Air T Inc. Common Stock,21.26,57458105.0,115,Consumer Discretionary
BGSF,BGSF Inc. Common Stock,5.11,57456671.0,14271,Consumer Discretionary
CATO,Cato Corporation (The) Class A Common Stock,2.9,57054847.0,8198,Consumer Discretionary
BDL,Flanigan's Enterprises Inc. Common Stock,30.4999,56688548.0,442,Consumer Discretionary
AIRTP,Air T Inc. Air T Funding Alpha Income Trust Preferred Securities,20.449,55266265.0,6034,Consumer Discretionary
CNVS,Cineverse Corp. Class A Common Stock,2.57,54727806.0,275150,Consumer Discretionary
VNCE,Vince Holding Corp. Common Stock,4.22,54215581.0,111949,Consumer Discretionary
PRTS,CarParts.com Inc. Common Stock,0.6611,53270151.0,944397,Consumer Discretionary
SPWH,Sportsman's Warehouse Holdings Inc. Common Stock,1.33,51807956.0,95890,Consumer Discretionary
PRPL,Purple Innovation Inc. Common Stock,0.4572,49829628.0,890355,Consumer Discretionary
BZFD,BuzzFeed Inc. Class A Common Stock,1.31,49306732.0,12280630,Consumer Discretionary
NOMA,NOMADAR Corp. Class A Common Stock,3.3,47110470.0,8680,Consumer Discretionary
NXXT,NextNRG Inc. Common Stock,0.295,46213217.0,1845163,Consumer Discretionary
ACFN,Acorn Energy Inc. Common Stock,17.525,43957221.0,7786,Consumer Discretionary
GAME,GameSquare Holdings Inc. Common Stock,0.455,42528948.0,1762764,Consumer Discretionary
LIVE,Live Ventures Incorporated Common Stock,13.75,42235270.0,2993,Consumer Discretionary
JRSH,Jerash Holdings (US) Inc. Common Stock,3.3,41909802.0,172442,Consumer Discretionary
CULP,Culp Inc. Common Stock,3.3,41787187.0,27639,Consumer Discretionary
SNBR,Sleep Number Corporation Common Stock,1.77,40785885.0,1111087,Consumer Discretionary
BIRD,Allbirds Inc. Class A Common Stock,4.63,40318656.0,498555,Consumer Discretionary
MAMO,Massimo Group Common Stock,0.9658,40216830.0,116049,Consumer Discretionary
VTSI,VirTra Inc. Common Stock,3.51,39687166.0,67151,Consumer Discretionary
HCMAW,HCM III Acquisition Corp. Warrants,0.5,39652868.0,2127,Consumer Discretionary
SCWO,374Water Inc. Common Stock,2.22,38719837.0,46934,Consumer Discretionary
OESX,Orion Energy Systems Inc. Common Stock,9.435,38238762.0,15974,Consumer Discretionary
RAVE,Rave Restaurant Group Inc. Common Stock,2.69,38229113.0,4240,Consumer Discretionary
TOON,Kartoon Studios Inc. Common Stock,0.6523,36747996.0,261684,Consumer Discretionary
CNTY,Century Casinos Inc. Common Stock,1.29,36341694.0,135476,Consumer Discretionary
DXLG,Destination XL Group Inc. Common Stock,0.66,36174937.0,44214,Consumer Discretionary
STRR,Star Equity Holdings Inc. Common Stock,9.51,35256556.0,1184,Consumer Discretionary
AERT,Aeries Technology Inc. Class A Ordinary Share,0.696,34945963.0,64412,Consumer Discretionary
NTRP,NextTrip Inc. Common Stock,2.51,34303686.0,50486,Consumer Discretionary
MPU,Mega Matrix Inc. Class A Ordinary Shares,0.5002,34008695.0,95668,Consumer Discretionary
ARAI,Arrive AI Inc. Common Stock,0.7019,33502663.0,805020,Consumer Discretionary
SWAG,Stran & Company Inc. Common Stock,1.74,32520875.0,386092,Consumer Discretionary
UG,United-Guardian Inc. Common Stock,6.99,32114290.0,4490,Consumer Discretionary
KPLT,Katapult Holdings Inc. Common Stock,6.71,31973539.0,15549,Consumer Discretionary
AENTW,Alliance Entertainment Holding Corporation Warrant,0.6,30574422.0,40334,Consumer Discretionary
BBGI,Beasley Broadcast Group Inc. Class A Common Stock,16.8,30345958.0,21194,Consumer Discretionary
EVTV,Envirotech Vehicles Inc. Common Stock,2.33,30128575.0,778954,Consumer Discretionary
SMXT,Solarmax Technology Inc. Common Stock,0.5251,29881641.0,62770,Consumer Discretionary
CRWS,Crown Crafts Inc Common Stock,2.76,29525892.0,12456,Consumer Discretionary
YYAI,AiRWA Inc. Common Stock,0.6838,28816995.0,496851,Consumer Discretionary
GIFT,Giftify Inc. Common Stock,0.8452,28434482.0,33489,Consumer Discretionary
UONE,Urban One Inc. Class A Common Stock,6.47,28325744.0,54712,Consumer Discretionary
ACCS,ACCESS Newswire Inc. Common Stock,6.93,26903251.0,24534,Consumer Discretionary
LVLU,Lulu's Fashion Lounge Holdings Inc. Common Stock,9.3,26638967.0,8453,Consumer Discretionary
INUV,Inuvo Inc.,1.79,26529407.0,141494,Consumer Discretionary
JOB,GEE Group Inc. Common Stock,0.24,26368965.0,143116,Consumer Discretionary
EFOI,Energy Focus Inc. Common Stock,3.92,24709457.0,60444,Consumer Discretionary
NHTC,Natural Health Trends Corp. Common Stock,2.86,24532645.0,51814,Consumer Discretionary
XOS,Xos Inc. Common Stock,2.03,24474108.0,639536,Consumer Discretionary
DBGI,Digital Brands Group Inc. Common Stock,1.14,24397428.0,622801,Consumer Discretionary
UONEK,Urban One Inc. Class D Common Stock,5.49,24035291.0,8637,Consumer Discretionary
RDI,Reading International Inc Class A Common Stock,1.05,23853123.0,4583,Consumer Discretionary
ARKR,Ark Restaurants Corp. Common Stock,6.61,23836698.0,7727,Consumer Discretionary
HHS,Harte Hanks Inc. Common Stock,2.81,20835571.0,385,Consumer Discretionary
TLF,Tandy Leather Factory Inc. Common Stock,2.32,18893080.0,19988,Consumer Discretionary
DLPN,Dolphin Entertainment Inc. Common Stock,1.41,17511701.0,42153,Consumer Discretionary
BNKK,Bonk Inc. Common Stock,2.2,17310608.0,199271,Consumer Discretionary
REBN,Reborn Coffee Inc. Common Stock,2.06,16919717.0,31339,Consumer Discretionary
DFNS,T3 Defense Inc. Common Stock,0.437,16528886.0,1179839,Consumer Discretionary
MWYN,Marwynn Holdings Inc. Common stock,0.8123,16404239.0,62877,Consumer Discretionary
TBH,Brag House Holdings Inc. Common Stock,0.64,15037520.0,324900,Consumer Discretionary
SURG,SurgePays Inc. Common Stock,0.5982,15027918.0,75085,Consumer Discretionary
BTOC,Armlogi Holding Corp. Common Stock,0.312,14178241.0,436264,Consumer Discretionary
AGAE,Allied Gaming & Entertainment Inc. Common Stock,0.3729,14060914.0,610143,Consumer Discretionary
LESL,Leslie's Inc. Common Stock,1.43,13322702.0,1032096,Consumer Discretionary
CISO,CISO Global Inc. Common Stock,0.2898,13131805.0,169085,Consumer Discretionary
GTIM,Good Times Restaurants Inc. Common Stock,1.24,13091791.0,5945,Consumer Discretionary
EDUC,Educational Development Corporation Common Stock,1.48,12596819.0,51156,Consumer Discretionary
ATER,Aterian Inc. Common Stock,1.06,11473230.0,324335,Consumer Discretionary
RSVRW,Reservoir Media Inc. Warrant,0.1725,11316038.0,98,Consumer Discretionary
OBAI,Our Bond Inc. Common Stock,0.5417,11198664.0,308032,Consumer Discretionary
XWEL,XWELL Inc. Common Stock,1.36,10780402.0,80046,Consumer Discretionary
CABR,Caring Brands Inc. Common Stock,1.06,9477996.0,115297,Consumer Discretionary
CETY,Clean Energy Technologies Inc. Common Stock,0.76,9246241.0,58212,Consumer Discretionary
RTB,RTB Digital Inc. Common Stock,7.2,9214308.0,101280,Consumer Discretionary
YCBD,cbdMD Inc. Common Stock,0.7958,8352367.0,275815,Consumer Discretionary
UGRO,urban-gro Inc. Common Stock,5.51,7116044.0,46332,Consumer Discretionary
JCTC,Jewett-Cameron Trading Company Common Shares,1.99,7005025.0,98478,Consumer Discretionary
FABC,Fabric.AI Inc. Common Stock,4.8,6988680.0,1297113,Consumer Discretionary
BTBD,BT Brands Inc. Common Stock,1.11,6831744.0,178802,Consumer Discretionary
WALDW,Waldencast plc Warrant ,0.05,6412994.0,3783,Consumer Discretionary
SILO,Silo Pharma Inc. Common Stock,0.3903,6348851.0,277193,Consumer Discretionary
MITQ,Moving iMage Technologies Inc. Common Stock,0.6001,5968064.0,157215,Consumer Discretionary
VSTD,Vestand Inc. Class A Common Stock,0.4092,5820862.0,30662,Consumer Discretionary
SLE,Super League Enterprise Inc. Common Stock,3.95,5768774.0,17491,Consumer Discretionary
DSS,DSS Inc. Common Stock,0.5251,5273326.0,25159,Consumer Discretionary
NWTG,Newton Golf Company Inc. Common Stock,1.11,5097190.0,30008,Consumer Discretionary
SOBR,SOBR Safe Inc. Common Stock,1.79,5023776.0,3178597,Consumer Discretionary
HYFM,Hydrofarm Holdings Group Inc. Common Stock,1.02,4859904.0,31108,Consumer Discretionary
OLOX,Olenox Industries Inc. Common Stock,4.72,4535656.0,40711,Consumer Discretionary
CTNT,Cheetah Net Supply Chain Service Inc Class A Common Stock,2.27,4447711.0,208885,Consumer Discretionary
JTAI,Jet.AI Inc. Common Stock,6.29,3749142.0,94366,Consumer Discretionary
GNLN,Greenlane Holdings Inc. Class A Common Stock,4.3851,2762372.0,5782,Consumer Discretionary
DRCT,Direct Digital Holdings Inc. Class A Common Stock,3.61,2683811.0,53015,Consumer Discretionary
DFNSW,T3 Defense Inc. Warrants,0.0707,2674124.0,247026,Consumer Discretionary
BNBX,BNB Plus Corp. Common Stock,0.481,2620233.0,50156,Consumer Discretionary
ZNB,Zeta Network Group Class A Ordinary Shares,1.65,2608315.0,24540,Consumer Discretionary
TRUG,TruGolf Holdings Inc. Class A Common Stock,1.65,2301372.0,58442,Consumer Discretionary
LIDRW,AEye Inc. Warrant,0.0446,2022428.0,53940,Consumer Discretionary
FRGT,Freight Technologies Inc. Ordinary Shares,0.929,1453185.0,183434,Consumer Discretionary
BZFDW,BuzzFeed Inc. Warrant,0.0301,1132926.0,219173,Consumer Discretionary
IPW,iPower Inc. Common Stock,0.8159,1079009.0,817096,Consumer Discretionary
SWAGW,Stran & Company Inc. Warrant,0.0497,928901.0,5967,Consumer Discretionary
SDOT,Sadot Group Inc. Common Stock,0.2152,395036.0,2609619,Consumer Discretionary
BTBDW,BT Brands Inc. Warrant,0.0505,310814.0,3716,Consumer Discretionary
XOSWW,Xos Inc. Warrants,0.0026,31346.0,3716,Consumer Discretionary
KPLTW,Katapult Holdings Inc. Warrant,0.0018,8577.0,1074,Consumer Discretionary
