symbol,name,price,marketCap,volume,industry
FLL,Full House Resorts Inc. Common Stock,2.15,77793601.0,140103,Consumer Discretionary
BLNK,Blink Charging Co. Common Stock,0.5432,76728486.0,4232088,Consumer Discretionary
COOK,Traeger Inc. Common Stock,27.47,75406002.0,9870,Consumer Discretionary
PRPL,Purple Innovation Inc. Common Stock,0.6823,73967412.0,578688,Consumer Discretionary
BODI,The Beachbody Company Inc. Class A Common Stock,10.23,73448577.0,105972,Consumer Discretionary
SPRU,Spruce Power Holding Corporation Class A Common Stock,3.98,72312075.0,44716,Consumer Discretionary
BGSF,BGSF Inc. Common Stock,6.41,71790635.0,25721,Consumer Discretionary
TISI,Team Inc. Common Stock,15.62,71404987.0,718,Consumer Discretionary
MHH,Mastech Digital Inc Common Stock,5.9,69964566.0,5761,Consumer Discretionary
PLCE,Children's Place Inc. (The) Common Stock,3.15,69828850.0,369885,Consumer Discretionary
UHG,United Homes Group Inc Class A Common Stock,1.17,68827844.0,32903,Consumer Discretionary
GAIA,Gaia Inc. Class A Common Stock,2.73,68189591.0,34377,Consumer Discretionary
UFI,Unifi Inc. New Common Stock,3.58,66520163.0,8871,Consumer Discretionary
ZBAI,ATIF Holdings Limited Ordinary Shares,6.36,65593052.0,6670,Consumer Discretionary
CPSH,CPS Technologies Corp. Common Stock,3.6,64825067.0,154071,Consumer Discretionary
GRWG,GrowGeneration Corp. Common Stock,1.07,64297268.0,398989,Consumer Discretionary
SLSN,Solesence Inc. Common Stock,0.9083,64068616.0,22116,Consumer Discretionary
GENK,GEN Restaurant Group Inc. Class A Common Stock,1.9,62590342.0,54226,Consumer Discretionary
TZOO,Travelzoo Common Stock,5.7,62314321.0,104636,Consumer Discretionary
VRM,Vroom Inc. Common Stock,11.65,60575573.0,4759,Consumer Discretionary
HOUR,Hour Loop Inc. Common Stock,1.71,60164452.0,15436,Consumer Discretionary
IZEA,IZEA Worldwide Inc. Common Stock,3.47,60156340.0,69828,Consumer Discretionary
RGS,Regis Corporation Common Stock,23.85,59595855.0,15048,Consumer Discretionary
AIRT,Air T Inc. Common Stock,21.97,59376979.0,189,Consumer Discretionary
SEAT,Vivid Seats Inc. Class A Common Stock,5.5,59211658.0,98865,Consumer Discretionary
PRTS,CarParts.com Inc. Common Stock,0.825,58156008.0,362515,Consumer Discretionary
BDL,Flanigan's Enterprises Inc. Common Stock,31.0,57618057.0,1952,Consumer Discretionary
LVO,LiveOne Inc. Common Stock,4.77,55563660.0,71881,Consumer Discretionary
NXXT,NextNRG Inc. Common Stock,0.4184,54840660.0,3235855,Consumer Discretionary
STKS,The ONE Group Hospitality Inc. Common Stock,1.75,54679403.0,249847,Consumer Discretionary
CATO,Cato Corporation (The) Class A Common Stock,2.74,54088986.0,58985,Consumer Discretionary
NDLS,Noodles & Company Class A Common Stock,9.2,53840636.0,202815,Consumer Discretionary
MDIA,Mediaco Holding Inc. Class A Common Stock ,0.655,53610757.0,20789,Consumer Discretionary
AIRTP,Air T Inc. Air T Funding Alpha Income Trust Preferred Securities,19.305,52174446.0,56,Consumer Discretionary
CTNT,Cheetah Net Supply Chain Service Inc Class A Common Stock,1.4,51616022.0,6250,Consumer Discretionary
AGH,Aureus Greenway Holdings Inc. Common Stock,3.41,51341973.0,500708,Consumer Discretionary
CNVS,Cineverse Corp. Class A Common Stock,2.4,51107678.0,83088,Consumer Discretionary
MPU,Mega Matrix Inc. Class A Ordinary Shares,0.745,50522274.0,36095,Consumer Discretionary
SCWO,374Water Inc. Common Stock,2.955,50013020.0,60387,Consumer Discretionary
SPWH,Sportsman's Warehouse Holdings Inc. Common Stock,1.27,48870991.0,397634,Consumer Discretionary
RRGB,Red Robin Gourmet Burgers Inc. Common Stock,2.65,47897351.0,691280,Consumer Discretionary
SNBR,Sleep Number Corporation Common Stock,2.04,47007461.0,1380138,Consumer Discretionary
ACFN,Acorn Energy Inc. Common Stock,18.69,46846504.0,26707,Consumer Discretionary
OMEX,Odyssey Marine Exploration Inc. Common Stock,0.8274,46118027.0,521735,Consumer Discretionary
ELWT,Elauwit Connection Inc. Common Stock,6.61,43756852.0,28762,Consumer Discretionary
VTSI,VirTra Inc. Common Stock,3.735,42207767.0,268078,Consumer Discretionary
MAMO,Massimo Group Common Stock,1.0,41640950.0,260567,Consumer Discretionary
LIVE,Live Ventures Incorporated Common Stock,13.26,40730159.0,3091,Consumer Discretionary
CNTY,Century Casinos Inc. Common Stock,1.38,39507387.0,69638,Consumer Discretionary
HCMAW,HCM III Acquisition Corp. Warrants,0.4767,37805044.0,46805,Consumer Discretionary
AENTW,Alliance Entertainment Holding Corporation Warrant,0.74,37708454.0,93477,Consumer Discretionary
STRR,Star Equity Holdings Inc. Common Stock,10.1,37516925.0,4224,Consumer Discretionary
OESX,Orion Energy Systems Inc. Common Stock,9.22,37367397.0,15597,Consumer Discretionary
SMXT,Solarmax Technology Inc. Common Stock,0.6791,36877133.0,210981,Consumer Discretionary
JRSH,Jerash Holdings (US) Inc. Common Stock,2.9,36829826.0,11770,Consumer Discretionary
NTRP,NextTrip Inc. Common Stock,2.65,36217039.0,580372,Consumer Discretionary
YYAI,AiRWA Inc. Common Stock,0.8597,36189534.0,634127,Consumer Discretionary
RAVE,Rave Restaurant Group Inc. Common Stock,2.54,36097378.0,12127,Consumer Discretionary
LVLU,Lulu's Fashion Lounge Holdings Inc. Common Stock,12.67,35119289.0,38842,Consumer Discretionary
CULP,Culp Inc. Common Stock,2.75,34822656.0,17215,Consumer Discretionary
KPLT,Katapult Holdings Inc. Common Stock,7.12,33927213.0,15206,Consumer Discretionary
TOON,Kartoon Studios Inc. Common Stock,0.6162,33216690.0,100369,Consumer Discretionary
ACCS,ACCESS Newswire Inc. Common Stock,8.59,33150622.0,24919,Consumer Discretionary
SWAG,Stran & Company Inc. Common Stock,1.65,30838761.0,96569,Consumer Discretionary
UG,United-Guardian Inc. Common Stock,6.56,30138733.0,22903,Consumer Discretionary
GIFT,Giftify Inc. Common Stock,0.8642,29073686.0,40730,Consumer Discretionary
INUV,Inuvo Inc.,1.92,28250352.0,225356,Consumer Discretionary
CRWS,Crown Crafts Inc Common Stock,2.64,28242158.0,60478,Consumer Discretionary
JOB,GEE Group Inc. Common Stock,0.249,27357801.0,85640,Consumer Discretionary
ARAI,Arrive AI Inc. Common Stock,0.7964,27263230.0,302190,Consumer Discretionary
QVCGP,QVC Group Inc. 8.0% Fixed Rate Cumulative Redeemable Preferred Stock,3.36,27110052.0,12179,Consumer Discretionary
UONE,Urban One Inc. Class A Common Stock,5.96,26908506.0,40863,Consumer Discretionary
VNCE,Vince Holding Corp. Common Stock,1.99,26545458.0,54022,Consumer Discretionary
DXLG,Destination XL Group Inc. Common Stock,0.4831,26478958.0,58158,Consumer Discretionary
BIRD,Allbirds Inc. Class A Common Stock,3.18,26117633.0,34916,Consumer Discretionary
UONEK,Urban One Inc. Class D Common Stock,5.7,25734645.0,1888,Consumer Discretionary
RDI,Reading International Inc Class A Common Stock,1.11,25216159.0,36322,Consumer Discretionary
ARKR,Ark Restaurants Corp. Common Stock,6.9,24882483.0,1629,Consumer Discretionary
GAME,GameSquare Holdings Inc. Common Stock,0.2457,24323955.0,915787,Consumer Discretionary
NHTC,Natural Health Trends Corp. Common Stock,2.78,23846417.0,14463,Consumer Discretionary
TRUG,TruGolf Holdings Inc. Class A Common Stock,4.47,22606775.0,141842,Consumer Discretionary
BZFD,BuzzFeed Inc. Class A Common Stock,0.587,22093933.0,188085,Consumer Discretionary
TBHC,The Brand House Collective Inc. Common Stock,0.895,20102938.0,94762,Consumer Discretionary
XOS,Xos Inc. Common Stock,1.68,19041443.0,128029,Consumer Discretionary
DLPN,Dolphin Entertainment Inc. Common Stock,1.53,18547306.0,8126,Consumer Discretionary
TLF,Tandy Leather Factory Inc. Common Stock,2.27,18325426.0,9125,Consumer Discretionary
DFNS,T3 Defense Inc. Common Stock,0.7491,18276402.0,1067665,Consumer Discretionary
HHS,Harte Hanks Inc. Common Stock,2.37,17573062.0,448,Consumer Discretionary
CABR,Caring Brands Inc. Common Stock,1.24,17033787.0,223675,Consumer Discretionary
OBAI,Our Bond Inc. Common Stock,1.21,16814044.0,273657,Consumer Discretionary
SURG,SurgePays Inc. Common Stock,0.7403,15866877.0,103457,Consumer Discretionary
AERT,Aeries Technology Inc. Class A Ordinary Share,0.3104,15585096.0,747875,Consumer Discretionary
QVCGA,QVC Group Inc. Series A Common Stock,1.87,15088035.0,146987,Consumer Discretionary
MWYN,Marwynn Holdings Inc. Common stock,0.7412,14968389.0,6532,Consumer Discretionary
CISO,CISO Global Inc. Common Stock,0.329,14491247.0,131070,Consumer Discretionary
DBGI,Digital Brands Group Inc. Common Stock,1.73,14165821.0,487368,Consumer Discretionary
UGRO,urban-gro Inc. Common Stock,17.61,13236063.0,3406061,Consumer Discretionary
BTBD,BT Brands Inc. Common Stock,1.66,13022225.0,327251,Consumer Discretionary
GTIM,Good Times Restaurants Inc. Common Stock,1.188,12542780.0,28360,Consumer Discretionary
BNKK,Bonk Inc. Common Stock,2.32,12294427.0,34536,Consumer Discretionary
EFOI,Energy Focus Inc. Common Stock,1.9,11982223.0,26558,Consumer Discretionary
CETY,Clean Energy Technologies Inc. Common Stock,0.96,11679462.0,977195,Consumer Discretionary
REBN,Reborn Coffee Inc. Common Stock,1.95,11653828.0,44762,Consumer Discretionary
BTOC,Armlogi Holding Corp. Common Stock,0.2557,11619795.0,987762,Consumer Discretionary
AGAE,Allied Gaming & Entertainment Inc. Common Stock,0.2959,11157481.0,189502,Consumer Discretionary
EDUC,Educational Development Corporation Common Stock,1.27,10809432.0,5333,Consumer Discretionary
UHGWW,United Homes Group Inc. Warrant,0.1814,10671257.0,13,Consumer Discretionary
LESL,Leslie's Inc. Common Stock,1.02,9502907.0,157684,Consumer Discretionary
JTAI,Jet.AI Inc. Common Stock,0.0789,9405643.0,15265591,Consumer Discretionary
RSVRW,Reservoir Media Inc. Warrant,0.1399,9177471.0,557,Consumer Discretionary
DSS,DSS Inc. Common Stock,0.965,8774280.0,25537,Consumer Discretionary
EVTV,Envirotech Vehicles Inc. Common Stock,1.63,7872109.0,362307,Consumer Discretionary
YCBD,cbdMD Inc. Common Stock,0.72,7556804.0,355620,Consumer Discretionary
XWEL,XWELL Inc. Common Stock,1.2,6920044.0,177727,Consumer Discretionary
NWTG,Newton Golf Company Inc. Common Stock,1.45,6891071.0,10495,Consumer Discretionary
OLOX,Olenox Industries Inc. Common Stock,1.03,6367214.0,761966,Consumer Discretionary
ATER,Aterian Inc. Common Stock,0.5605,6066741.0,37394,Consumer Discretionary
BBGI,Beasley Broadcast Group Inc. Class A Common Stock,3.22,5808861.0,19239,Consumer Discretionary
JCTC,Jewett-Cameron Trading Company Common Shares,1.65,5808186.0,3647,Consumer Discretionary
TBH,Brag House Holdings Inc. Common Stock,0.275,5761625.0,747077,Consumer Discretionary
CAPS,Capstone Holding Corp. Common Stock,0.6324,5747171.0,82714,Consumer Discretionary
SILO,Silo Pharma Inc. Common Stock,0.34,5572498.0,144231,Consumer Discretionary
MITQ,Moving iMage Technologies Inc. Common Stock,0.552,5489703.0,82014,Consumer Discretionary
RVYL,Ryvyl Inc. Common Stock,5.08,5270962.0,43903,Consumer Discretionary
SLE,Super League Enterprise Inc. Common Stock,3.7,4851281.0,46054,Consumer Discretionary
HYFM,Hydrofarm Holdings Group Inc. Common Stock,1.013,4727675.0,89727,Consumer Discretionary
WALDW,Waldencast plc Warrant ,0.0363,4655833.0,27538,Consumer Discretionary
VSTD,Vestand Inc. Class A Common Stock,0.2877,4092527.0,52973,Consumer Discretionary
BNBX,BNB Plus Corp. Common Stock,0.6899,3758209.0,23016,Consumer Discretionary
ZNB,Zeta Network Group Class A Ordinary Shares,2.29,3620025.0,65354,Consumer Discretionary
SDOT,Sadot Group Inc. Common Stock,1.55,2866074.0,10374,Consumer Discretionary
DFNSW,T3 Defense Inc. Warrants,0.1099,2681320.0,62216,Consumer Discretionary
SBLX,StableX Technologies Inc. Common Stock,1.83,2664434.0,44080,Consumer Discretionary
WORX,SCWorx Corp. Common Stock,0.123,1946701.0,804685,Consumer Discretionary
GNLN,Greenlane Holdings Inc. Class A Common Stock,0.389,1917600.0,292415,Consumer Discretionary
IPW,iPower Inc. Common Stock,1.386,1832953.0,82612,Consumer Discretionary
DRCT,Direct Digital Holdings Inc. Class A Common Stock,0.768,1824829.0,96143,Consumer Discretionary
BTBDW,BT Brands Inc. Warrant,0.2052,1609735.0,801,Consumer Discretionary
FRGT,Freight Technologies Inc. Ordinary Shares,0.99,1548604.0,77619,Consumer Discretionary
LIDRW,AEye Inc. Warrant,0.0318,1442000.0,7500,Consumer Discretionary
SOBR,SOBR Safe Inc. Common Stock,0.691,1303402.0,477550,Consumer Discretionary
AERTW,Aeries Technology Inc. Warrant,0.0152,763188.0,1626,Consumer Discretionary
SWAGW,Stran & Company Inc. Warrant,0.0352,657894.0,2001,Consumer Discretionary
SRTAW,Strata Critical Medical Inc. Warrants,0.0061,530634.0,61395,Consumer Discretionary
BZFDW,BuzzFeed Inc. Warrant,0.014,526942.0,1236,Consumer Discretionary
XOSWW,Xos Inc. Warrants,0.0033,37403.0,22876,Consumer Discretionary
KPLTW,Katapult Holdings Inc. Warrant,0.0029,13819.0,15509,Consumer Discretionary
QVCC,QVC Inc. 6.250% Senior Secured Notes due 2068,10.39,0.0,30267,Consumer Discretionary
QVCD,QVC Inc. 6.375% Senior Secured Notes due 2067,10.4,0.0,13103,Consumer Discretionary
