symbol,name,price,marketCap,volume,industry
AMZN,Amazon.com Inc. Common Stock,207.54,2227925477360.0,46653718,Consumer Discretionary
WMT,Walmart Inc. Common Stock,122.18,974068137572.0,16419916,Consumer Discretionary
COST,Costco Wholesale Corporation Common Stock,979.65,434624210811.0,1495850,Consumer Discretionary
NFLX,Netflix Inc. Common Stock,93.32,394012171838.0,59423552,Consumer Discretionary
PG,Procter & Gamble Company (The) Common Stock,142.42,330984177558.0,6430073,Consumer Discretionary
HD,Home Depot Inc. (The) Common Stock,328.43,327120045778.0,3440915,Consumer Discretionary
MCD,McDonald's Corporation Common Stock,308.93,219463452473.0,3021711,Consumer Discretionary
TJX,TJX Companies Inc. (The) Common Stock,157.57,174976300159.0,4156640,Consumer Discretionary
DIS,Walt Disney Company (The) Common Stock,94.75,167851505882.0,8535561,Consumer Discretionary
BKNG,Booking Holdings Inc. Common Stock,4213.76,133463878441.0,324768,Consumer Discretionary
LOW,Lowe's Companies Inc. Common Stock,236.03,132191771147.0,2113613,Consumer Discretionary
SBUX,Starbucks Corporation Common Stock,91.22,103923487120.0,6133321,Consumer Discretionary
MAR,Marriott International Class A Common Stock,325.74,86316068620.0,1010232,Consumer Discretionary
FDX,FedEx Corporation Common Stock,349.55,83404991560.0,1588662,Consumer Discretionary
ABNB,Airbnb Inc. Class A Common Stock,131.06,79778051335.0,3354118,Consumer Discretionary
SHW,Sherwin-Williams Company (The) Common Stock,319.55,79044638303.0,2058003,Consumer Discretionary
ORLY,O'Reilly Automotive Inc. Common Stock,92.27,77367198627.0,5294761,Consumer Discretionary
NKE,Nike Inc. Common Stock,52.07,77083563742.0,14451540,Consumer Discretionary
ECL,Ecolab Inc. Common Stock,264.25,74630480694.0,1260217,Consumer Discretionary
RCL,Royal Caribbean Cruises Ltd. Common Stock,274.0,74124755022.0,1880165,Consumer Discretionary
ROST,Ross Stores Inc. Common Stock,214.3,69314248070.0,2926295,Consumer Discretionary
HLT,Hilton Worldwide Holdings Inc. Common Stock ,301.7,69177280246.0,1287193,Consumer Discretionary
CL,Colgate-Palmolive Company Common Stock,84.14,67442251076.0,4889760,Consumer Discretionary
WBD,Warner Bros. Discovery Inc. Series A Common Stock ,27.07,67131691971.0,25746592,Consumer Discretionary
CVNA,Carvana Co. Class A Common Stock,301.37,66031143439.0,2661267,Consumer Discretionary
BKR,Baker Hughes Company Class A Common Stock,62.36,61626428764.0,7673354,Consumer Discretionary
PCAR,PACCAR Inc. Common Stock,115.33,60693907753.0,2492885,Consumer Discretionary
AZO,AutoZone Inc. Common Stock,3395.97,55954786415.0,126877,Consumer Discretionary
TGT,Target Corporation Common Stock,117.0,52984103913.0,3401815,Consumer Discretionary
FAST,Fastenal Company Common Stock,45.11,51795864251.0,5845677,Consumer Discretionary
EA,Electronic Arts Inc. Common Stock,201.91,50528727192.0,2864749,Consumer Discretionary
SE,Sea Limited American Depositary Shares each representing one Class A Ordinary Share,79.86,47278711929.0,2541287,Consumer Discretionary
URI,United Rentals Inc. Common Stock,742.22,46758484666.0,422470,Consumer Discretionary
DAL,Delta Air Lines Inc. Common Stock,66.86,43668319137.0,11101760,Consumer Discretionary
YUM,Yum! Brands Inc.,156.14,43161800498.0,2034023,Consumer Discretionary
CMG,Chipotle Mexican Grill Inc. Common Stock,32.17,41898947910.0,10149531,Consumer Discretionary
TRI,Thomson Reuters Corporation Common Shares,90.38,40115456916.0,1802217,Consumer Discretionary
SYY,Sysco Corporation Common Stock,82.64,39578828833.0,2023658,Consumer Discretionary
DHI,D.R. Horton Inc. Common Stock,135.96,39388073584.0,1988239,Consumer Discretionary
TKO,TKO Group Holdings Inc. Class A Common Stock,192.64,37396230946.0,613480,Consumer Discretionary
CCL,Carnival Corporation Common Stock,25.28,36818149131.0,22405829,Consumer Discretionary
CUK,Carnival Plc ADS ADS,25.23,36745328424.0,2367656,Consumer Discretionary
TTWO,Take-Two Interactive Software Inc. Common Stock,194.72,36057364792.0,1676465,Consumer Discretionary
LYV,Live Nation Entertainment Inc. Common Stock,150.05,35232028396.0,1836785,Consumer Discretionary
LVS,Las Vegas Sands Corp. Common Stock,52.4,35208121885.0,3828268,Consumer Discretionary
KVUE,Kenvue Inc. Common Stock,17.57,33676982821.0,15052287,Consumer Discretionary
CPNG,Coupang Inc. Class A Common Stock,18.37,33583878884.0,13796792,Consumer Discretionary
ASTS,AST SpaceMobile Inc. Class A Common Stock,87.86,33563857932.0,13344013,Consumer Discretionary
KMB,Kimberly-Clark Corporation Common Stock,98.85,32810861969.0,2996425,Consumer Discretionary
SATS,EchoStar  Corporation Common Stock,111.4,32180770693.0,9230689,Consumer Discretionary
VIK,Viking Holdings Ltd Ordinary Shares,71.59,31913822532.0,2576238,Consumer Discretionary
CPRT,Copart Inc. (DE) Common Stock,33.03,31818076056.0,8985283,Consumer Discretionary
UAL,United Airlines Holdings Inc. Common Stock,92.69,29978765537.0,5968942,Consumer Discretionary
TPR,Tapestry Inc. Common Stock,141.41,28630465774.0,1866849,Consumer Discretionary
EXPE,Expedia Group Inc. Common Stock,232.84,28531019829.0,1188908,Consumer Discretionary
CASY,Casey's General Stores Inc. Common Stock,711.81,26307807144.0,453680,Consumer Discretionary
DG,Dollar General Corporation Common Stock,119.23,26257584134.0,4081929,Consumer Discretionary
ROL,Rollins Inc. Common Stock,52.81,25453830852.0,2503698,Consumer Discretionary
EL,Estee Lauder Companies Inc. (The) Common Stock,69.75,25230461249.0,5358962,Consumer Discretionary
TSCO,Tractor Supply Company Common Stock,45.89,24154260515.0,4049238,Consumer Discretionary
PPG,PPG Industries Inc. Common Stock,105.31,23568235832.0,1756336,Consumer Discretionary
OMC,Omnicom Group Inc. Common Stock,75.31,23371430067.0,4155194,Consumer Discretionary
ULTA,Ulta Beauty Inc. Common Stock,521.64,23141083402.0,655120,Consumer Discretionary
DRI,Darden Restaurants Inc. Common Stock,198.87,22897742449.0,901430,Consumer Discretionary
LEN,Lennar Corporation Class A Common Stock,91.11,22560767532.0,2194109,Consumer Discretionary
PHM,PulteGroup Inc. Common Stock,117.12,22438932960.0,1663556,Consumer Discretionary
XPO,XPO Inc. Common Stock,191.39,22420832656.0,1129213,Consumer Discretionary
CHD,Church & Dwight Company Inc. Common Stock,93.22,22081496263.0,1837356,Consumer Discretionary
WSM,Williams-Sonoma Inc. Common Stock (DE),180.56,21555381178.0,1428328,Consumer Discretionary
DLTR,Dollar Tree Inc. Common Stock,105.99,20911638020.0,3035764,Consumer Discretionary
USFD,US Foods Holding Corp. Common Stock,92.1,20284315370.0,1384944,Consumer Discretionary
BURL,Burlington Stores Inc. Common Stock,320.21,20073140679.0,543826,Consumer Discretionary
LUV,Southwest Airlines Company Common Stock,39.53,19421800145.0,5030550,Consumer Discretionary
PKG,Packaging Corporation of America Common Stock,212.6,18966767564.0,807920,Consumer Discretionary
SNA,Snap-On Incorporated Common Stock,362.0,18844758166.0,393346,Consumer Discretionary
NVR,NVR Inc. Common Stock,6530.22,18141728256.0,21137,Consumer Discretionary
YUMC,Yum China Holdings Inc. Common Stock,49.97,17644229307.0,1325091,Consumer Discretionary
APG,APi Group Corporation Common Stock,40.77,17590464667.0,2554864,Consumer Discretionary
DKS,Dick's Sporting Goods Inc Common Stock,192.34,17304619380.0,941258,Consumer Discretionary
SGI,Somnigroup International Inc. Common Stock,73.76,15514724426.0,2246110,Consumer Discretionary
NWS,News Corporation Class B Common Stock,27.55,15300665553.0,1109111,Consumer Discretionary
SN,SharkNinja Inc. Ordinary Shares,104.28,14728805337.0,1457566,Consumer Discretionary
TME,Tencent Music Entertainment Group American Depositary Shares each representing two Class A Ordinary Shares,9.49,14699103743.0,12749616,Consumer Discretionary
GPC,Genuine Parts Company Common Stock,105.28,14646775530.0,1821453,Consumer Discretionary
WSO,Watsco Inc. Common Stock,348.01,14130210357.0,875225,Consumer Discretionary
QXO,QXO Inc. Common Stock,19.66,13956534068.0,6278634,Consumer Discretionary
H,Hyatt Hotels Corporation Class A Common Stock,145.96,13788514979.0,678796,Consumer Discretionary
NWSA,News Corporation Class A Common Stock,24.26,13473471736.0,2223348,Consumer Discretionary
NYT,New York Times Company (The) Common Stock,82.96,13432630338.0,2866431,Consumer Discretionary
PFGC,Performance Food Group Company Common Stock,85.09,13367551442.0,870245,Consumer Discretionary
DECK,Deckers Outdoor Corporation Common Stock,93.69,13299292783.0,3136808,Consumer Discretionary
BBY,Best Buy Co. Inc. Common Stock,63.21,13218005992.0,11505930,Consumer Discretionary
BJ,BJ's Wholesale Club Holdings Inc. Common Stock,100.54,13037684158.0,1651825,Consumer Discretionary
AVY,Avery Dennison Corporation Common Stock,168.52,12962058064.0,546489,Consumer Discretionary
WCC,WESCO International Inc. Common Stock,265.98,12943096152.0,549723,Consumer Discretionary
HAS,Hasbro Inc. Common Stock,91.16,12824913699.0,1079820,Consumer Discretionary
WMG,Warner Music Group Corp. Class A Common Stock,24.22,12651224189.0,2173014,Consumer Discretionary
TOL,Toll Brothers Inc. Common Stock,133.23,12617813610.0,1615576,Consumer Discretionary
RPM,RPM International Inc. Common Stock,98.37,12598804937.0,940399,Consumer Discretionary
ALLE,Allegion plc Ordinary Shares,145.79,12559150112.0,1033070,Consumer Discretionary
FIVE,Five Below Inc. Common Stock,226.79,12527524447.0,1205439,Consumer Discretionary
RRX,Regal Rexnord Corporation Common Stock,187.39,12473705110.0,774609,Consumer Discretionary
CLX,Clorox Company (The) Common Stock,102.18,12354774161.0,2189454,Consumer Discretionary
DPZ,Domino's Pizza Inc Common Stock,358.54,12057304730.0,1202250,Consumer Discretionary
GNRC,Generac Holdlings Inc. Common Stock,198.0,11617813746.0,1347696,Consumer Discretionary
MOD,Modine Manufacturing Company Common Stock,215.81,11379919625.0,755780,Consumer Discretionary
SCI,Service Corporation International Common Stock,81.84,11352939653.0,2023327,Consumer Discretionary
BWA,BorgWarner Inc. Common Stock,54.76,11283927083.0,2013329,Consumer Discretionary
ACM,AECOM Common Stock,86.95,11241645857.0,984197,Consumer Discretionary
CHWY,Chewy Inc. Class A Common Stock,27.01,11209110917.0,11600041,Consumer Discretionary
IT,Gartner Inc. Common Stock,156.6,11032516040.0,1259794,Consumer Discretionary
SWK,Stanley Black & Decker Inc. Common Stock,70.81,10981177129.0,1090438,Consumer Discretionary
TXRH,Texas Roadhouse Inc. Common Stock,166.35,10966647871.0,711239,Consumer Discretionary
ARMK,Aramark Common Stock,40.55,10657999759.0,2500964,Consumer Discretionary
DKNG,DraftKings Inc. Class A Common Stock,21.27,10485926759.0,17032590,Consumer Discretionary
WMS,Advanced Drainage Systems Inc. Common Stock,134.32,10462934977.0,927484,Consumer Discretionary
WYNN,Wynn Resorts Limited Common stock,99.47,10373058956.0,1314778,Consumer Discretionary
GME,GameStop Corporation Common Stock,22.56,10115343542.0,6892382,Consumer Discretionary
PAG,Penske Automotive Group Inc. Common Stock,148.89,9789406577.0,182465,Consumer Discretionary
BLD,TopBuild Corp. Common Stock,347.81,9789160100.0,296077,Consumer Discretionary
AIT,Applied Industrial Technologies Inc. Common Stock,260.51,9717658644.0,278066,Consumer Discretionary
BAH,Booz Allen Hamilton Holding Corporation Common Stock,80.33,9687347268.0,1096918,Consumer Discretionary
CNM,Core & Main Inc. Class A Common Stock,49.62,9658533496.0,2060748,Consumer Discretionary
W,Wayfair Inc. Class A Common Stock,73.7,9636117429.0,3661829,Consumer Discretionary
ALSN,Allison Transmission Holdings Inc. Common Stock,116.32,9631946461.0,481244,Consumer Discretionary
MGM,MGM Resorts International Common Stock,37.57,9611477459.0,5130248,Consumer Discretionary
GAP,Gap Inc. (The) Common Stock,25.07,9340142176.0,7967519,Consumer Discretionary
CAVA,CAVA Group Inc. Common Stock,78.9,9182205659.0,2870570,Consumer Discretionary
MUSA,Murphy USA Inc. Common Stock,495.2,9178703834.0,391778,Consumer Discretionary
TTC,Toro Company (The) Common Stock,93.81,9093279195.0,600570,Consumer Discretionary
BLDR,Builders FirstSource Inc. Common Stock,82.17,9088418520.0,1271691,Consumer Discretionary
AOS,A.O. Smith Corporation Common Stock,65.61,9073201454.0,1305187,Consumer Discretionary
NCLH,Norwegian Cruise Line Holdings Ltd. Ordinary Shares,19.85,9042580974.0,17179243,Consumer Discretionary
UHAL,U-Haul Holding Company Common Stock,45.52,8925465098.0,279566,Consumer Discretionary
DDS,Dillard's Inc. Common Stock,552.31,8623197251.0,83652,Consumer Discretionary
FCFS,FirstCash Holdings Inc. Common Stock,192.0,8445061632.0,215832,Consumer Discretionary
LLYVK,Liberty Live Holdings Inc. Series C Liberty Live Group Common Stock,91.72,8431972681.0,372532,Consumer Discretionary
AYI,Acuity Inc. Common Stock,270.34,8289332961.0,641573,Consumer Discretionary
LLYVA,Liberty Live Holdings Inc. Series A Liberty Live Group Common Stock,89.49,8226965059.0,84791,Consumer Discretionary
TTEK,Tetra Tech Inc. Common Stock,30.41,7931157930.0,3185519,Consumer Discretionary
BROS,Dutch Bros Inc. Class A Common Stock,48.02,7901449892.0,3343181,Consumer Discretionary
R,Ryder System Inc. Common Stock,199.88,7879673557.0,275426,Consumer Discretionary
GSAT,Globalstar Inc. Common Stock,60.275,7748613326.0,1382950,Consumer Discretionary
RTO,Rentokil Initial plc American Depositary Shares (each representing five (5) Ordinary Shares),30.71,7745062000.0,1264869,Consumer Discretionary
SIRI,SiriusXM Holdings Inc. Common Stock,22.95,7683037527.0,2982159,Consumer Discretionary
MSGS,Madison Square Garden Sports Corp. Class A Common Stock (New),314.93,7580155042.0,192757,Consumer Discretionary
LKQ,LKQ Corporation Common Stock,29.65,7566950438.0,2233358,Consumer Discretionary
POOL,Pool Corporation Common Stock,201.04,7395823333.0,734037,Consumer Discretionary
KEX,Kirby Corporation Common Stock,136.15,7300499150.0,614264,Consumer Discretionary
AL,Air Lease Corporation Class A Common Stock,64.72,7250931606.0,2362678,Consumer Discretionary
NOV,NOV Inc. Common Stock,19.92,7179258516.0,3411183,Consumer Discretionary
IBP,Installed Building Products Inc. Common Stock,264.98,7147881342.0,158995,Consumer Discretionary
AAL,American Airlines Group Inc. Common Stock,10.71,7071861977.0,41628885,Consumer Discretionary
SSD,Simpson Manufacturing Company Inc. Common Stock,171.13,7049532300.0,249454,Consumer Discretionary
LEVI,Levi Strauss & Co Class A Common Stock,18.3,7037674627.0,1665763,Consumer Discretionary
WFRD,Weatherford International plc Ordinary Shares,95.94,6880585872.0,1340463,Consumer Discretionary
AN,AutoNation Inc. Common Stock,195.0,6693469965.0,273463,Consumer Discretionary
BYD,Boyd Gaming Corporation Common Stock,82.94,6245748844.0,566742,Consumer Discretionary
LEA,Lear Corporation Common Stock,121.95,6186213015.0,440671,Consumer Discretionary
CHDN,Churchill Downs Incorporated Common Stock,87.57,6103311646.0,637370,Consumer Discretionary
MHK,Mohawk Industries Inc. Common Stock,98.58,6058762092.0,1097232,Consumer Discretionary
WH,Wyndham Hotels & Resorts Inc. Common Stock ,80.59,6056245338.0,1376430,Consumer Discretionary
KMX,CarMax Inc,42.68,6051880638.0,2458857,Consumer Discretionary
PLNT,Planet Fitness Inc. Common Stock,75.4,6033056882.0,987133,Consumer Discretionary
LAD,Lithia Motors Inc. Common Stock,256.84,6003611884.0,314174,Consumer Discretionary
EAT,Brinker International Inc. Common Stock,137.57,5991218623.0,1276041,Consumer Discretionary
GATX,GATX Corporation Common Stock,168.42,5982890438.0,129308,Consumer Discretionary
SITE,SiteOne Landscape Supply Inc. Common Stock,133.49,5934874093.0,420525,Consumer Discretionary
GXO,GXO Logistics Inc. Common Stock ,51.72,5932986306.0,900613,Consumer Discretionary
LTH,Life Time Group Holdings Inc. Common Stock,26.58,5919434045.0,1695858,Consumer Discretionary
ECG,Everus Construction Group Inc. Common Stock,115.09,5870363290.0,410462,Consumer Discretionary
RRR,Red Rock Resorts Inc. Class A Common Stock,55.74,5854195616.0,928273,Consumer Discretionary
AXTA,Axalta Coating Systems Ltd. Common Shares,27.36,5837911053.0,2287100,Consumer Discretionary
AGX,Argan Inc. Common Stock,410.85,5699890499.0,598101,Consumer Discretionary
FND,Floor & Decor Holdings Inc. Common Stock,52.61,5675320059.0,3801150,Consumer Discretionary
TMHC,Taylor Morrison Home Corporation Common Stock,58.89,5673089709.0,964697,Consumer Discretionary
LGN,Legence Corp. Class A Common stock,52.98,5580750498.0,1580188,Consumer Discretionary
URBN,Urban Outfitters Inc. Common Stock,61.99,5559197429.0,1296886,Consumer Discretionary
OLLI,Ollie's Bargain Outlet Holdings Inc. Common Stock,90.52,5517756401.0,1563407,Consumer Discretionary
CZR,Caesars Entertainment Inc. Common Stock,26.89,5472680255.0,5012964,Consumer Discretionary
EQPT,EquipmentShare.com Inc Class A Common Stock,20.42,5432682742.0,943701,Consumer Discretionary
ADT,ADT Inc. Common Stock,6.62,5429206561.0,7985175,Consumer Discretionary
GOLF,Acushnet Holdings Corp. Common Stock,91.06,5332506199.0,227715,Consumer Discretionary
SON,Sonoco Products Company Common Stock,53.56,5282828256.0,752288,Consumer Discretionary
FCN,FTI Consulting Inc. Common Stock,171.27,5237761499.0,262798,Consumer Discretionary
RUSHA,Rush Enterprises Inc. Common Stock Cl A,66.2,5093505785.0,373816,Consumer Discretionary
RSI,Rush Street Interactive Inc. Class A Common Stock,21.45,4983933776.0,1347587,Consumer Discretionary
MATX,Matson Inc. Common Stock,163.24,4968912964.0,165120,Consumer Discretionary
CAR,Avis Budget Group Inc. Common Stock,139.58,4921402646.0,3502556,Consumer Discretionary
M,Macy's Inc Common Stock,18.49,4916178685.0,5468531,Consumer Discretionary
IEP,Icahn Enterprises L.P. Common Stock,7.66,4881024402.0,669604,Consumer Discretionary
VSEC,VSE Corporation Common Stock,173.57,4869574563.0,434273,Consumer Discretionary
RUSHB,Rush Enterprises Inc. Class B,63.1,4854988143.0,56534,Consumer Discretionary
ATMU,Atmus Filtration Technologies Inc. Common Stock,59.19,4824493501.0,754347,Consumer Discretionary
GNTX,Gentex Corporation Common Stock,22.05,4749622104.0,1824212,Consumer Discretionary
CHH,Choice Hotels International Inc. Common Stock,101.54,4667935245.0,706606,Consumer Discretionary
BOOT,Boot Barn Holdings Inc. Common Stock,152.83,4649154470.0,433562,Consumer Discretionary
MTN,Vail Resorts Inc. Common Stock,130.13,4636928927.0,607172,Consumer Discretionary
UNF,Unifirst Corporation Common Stock,251.47,4544699874.0,428707,Consumer Discretionary
PSMT,PriceSmart Inc. Common Stock,146.43,4512301511.0,194576,Consumer Discretionary
BFAM,Bright Horizons Family Solutions Inc. Common Stock,81.2,4475227974.0,1040402,Consumer Discretionary
ALK,Alaska Air Group Inc. Common Stock,38.95,4465284478.0,2808173,Consumer Discretionary
MAT,Mattel Inc. Common Stock,14.62,4418164000.0,3012442,Consumer Discretionary
TNL,Travel   Leisure Co. Common  Stock,70.69,4410895816.0,367496,Consumer Discretionary
REYN,Reynolds Consumer Products Inc. Common Stock,20.93,4410697992.0,944965,Consumer Discretionary
WING,Wingstop Inc. Common Stock,155.67,4253385420.0,1549092,Consumer Discretionary
SEI,Solaris Energy Infrastructure Inc. Class A Common Stock,60.45,4138805970.0,1690151,Consumer Discretionary
ANF,Abercrombie & Fitch Company Common Stock,89.76,4116174227.0,1488207,Consumer Discretionary
SKY,Champion Homes Inc. Common Stock,74.42,4115576403.0,415576,Consumer Discretionary
FELE,Franklin Electric Co. Inc. Common Stock,91.98,4065713481.0,155350,Consumer Discretionary
MTH,Meritage Homes Corporation Common Stock,60.54,4044112199.0,727687,Consumer Discretionary
TPC,Tutor Perini Corporation Common Stock,76.24,4024820224.0,450947,Consumer Discretionary
CROX,Crocs Inc. Common Stock,79.94,4015673664.0,1113961,Consumer Discretionary
TDW,Tidewater Inc. Common Stock,80.8,4005540416.0,685343,Consumer Discretionary
TPH,Tri Pointe Homes Inc. Common Stock,46.67,3973267345.0,2860491,Consumer Discretionary
HRB,H&R Block Inc. Common Stock,31.28,3965044605.0,1480006,Consumer Discretionary
ELF,e.l.f. Beauty Inc. Common Stock,66.88,3949413744.0,1538497,Consumer Discretionary
FTDR,Frontdoor Inc. Common Stock,55.84,3943291698.0,623416,Consumer Discretionary
GPI,Group 1 Automotive Inc. Common Stock,331.51,3935878001.0,141814,Consumer Discretionary
WHD,Cactus Inc. Class A Common Stock,48.81,3897882452.0,924399,Consumer Discretionary
BRC,Brady Corporation Common Stock,82.12,3878366563.0,177800,Consumer Discretionary
SPHR,Sphere Entertainment Co. Class A Common Stock,108.33,3845944660.0,875068,Consumer Discretionary
ABG,Asbury Automotive Group Inc Common Stock,198.55,3831165405.0,204151,Consumer Discretionary
SKYW,SkyWest Inc. Common Stock,93.98,3797419035.0,275441,Consumer Discretionary
CVCO,Cavco Industries Inc. Common Stock When Issued,472.64,3668236080.0,163496,Consumer Discretionary
SHAK,Shake Shack Inc. Class A Common Stock,85.08,3632278836.0,1018390,Consumer Discretionary
DAN,Dana Incorporated Common Stock ,32.85,3598931222.0,1416885,Consumer Discretionary
PATK,Patrick Industries Inc. Common Stock,108.16,3594666774.0,451596,Consumer Discretionary
BBWI,Bath & Body Works Inc.,17.83,3586223945.0,4934960,Consumer Discretionary
VSCO,Victorias Secret & Co. Common Stock ,44.33,3567102642.0,2062469,Consumer Discretionary
INSW,International Seaways Inc. Common Stock ,70.01,3460422285.0,351311,Consumer Discretionary
ASO,Academy Sports and Outdoors Inc. Common Stock,53.5,3444515057.0,1337484,Consumer Discretionary
BATRA,Atlanta Braves Holdings Inc. Series A Common Stock,46.68,3419558618.0,28870,Consumer Discretionary
CALX,Calix Inc Common Stock,51.02,3347302966.0,673761,Consumer Discretionary
KFY,Korn Ferry Common Stock,64.06,3323886793.0,508648,Consumer Discretionary
HGV,Hilton Grand Vacations Inc. Common Stock ,40.36,3279607912.0,743848,Consumer Discretionary
CNK,Cinemark Holdings Inc Cinemark Holdings Inc. Common Stock,28.11,3247442522.0,1288002,Consumer Discretionary
KBH,KB Home Common Stock,51.91,3236116846.0,1534418,Consumer Discretionary
PII,Polaris Inc. Common Stock,56.83,3217481199.0,656418,Consumer Discretionary
EXPO,Exponent Inc. Common Stock,65.3,3216308337.0,416361,Consumer Discretionary
DORM,Dorman Products Inc. Common Stock,106.47,3213611692.0,219375,Consumer Discretionary
HWKN,Hawkins Inc. Common Stock,151.34,3163322755.0,163133,Consumer Discretionary
MHO,M/I Homes Inc. Common Stock,121.88,3140568373.0,128175,Consumer Discretionary
AAP,Advance Auto Parts Inc.,51.85,3116185000.0,1181198,Consumer Discretionary
BATRK,Atlanta Braves Holdings Inc. Series C Common Stock,42.16,3088444544.0,288228,Consumer Discretionary
WHR,Whirlpool Corporation Common Stock,53.61,3031117442.0,1671395,Consumer Discretionary
LCII,LCI Industries,123.75,2994882289.0,215881,Consumer Discretionary
IPAR,Interparfums Inc. Common Stock,91.48,2933926892.0,216922,Consumer Discretionary
GBTG,Global Business Travel Group Inc. Class A Common Stock,5.53,2897718164.0,1533547,Consumer Discretionary
COLM,Columbia Sportswear Company Common Stock,54.84,2870959112.0,598642,Consumer Discretionary
OPLN,OPENLANE Inc. Common Stock,26.82,2850891682.0,1037340,Consumer Discretionary
GPK,Graphic Packaging Holding Company,9.34,2762220109.0,5833188,Consumer Discretionary
CAKE,Cheesecake Factory Incorporated (The) Common Stock,55.33,2758703505.0,733724,Consumer Discretionary
UNFI,United Natural Foods Inc. Common Stock,45.12,2741128661.0,1587541,Consumer Discretionary
MGRC,McGrath RentCorp Common Stock,111.02,2732386160.0,144167,Consumer Discretionary
AEO,American Eagle Outfitters Inc. Common Stock,16.07,2724057936.0,4976917,Consumer Discretionary
GRBK,Green Brick Partners Inc. Common Stock,63.0,2718909396.0,185125,Consumer Discretionary
YETI,YETI Holdings Inc. Common Stock,36.0,2709661212.0,1126125,Consumer Discretionary
MSGE,Madison Square Garden Entertainment Corp. Class A Common Stock,56.88,2688893871.0,201331,Consumer Discretionary
BCC,Boise Cascade L.L.C. Common Stock,74.29,2663764824.0,285802,Consumer Discretionary
PHIN,PHINIA Inc. Common Stock,68.59,2600600962.0,348545,Consumer Discretionary
FIGS,FIGS Inc. Class A Common Stock,15.43,2567198992.0,2718435,Consumer Discretionary
BKE,Buckle Inc. (The) Common Stock,49.64,2539414915.0,396950,Consumer Discretionary
RHI,Robert Half Inc. Common Stock,25.09,2537692824.0,2853311,Consumer Discretionary
HNI,HNI Corporation Common Stock,35.21,2509451875.0,834185,Consumer Discretionary
UAA,Under Armour Inc. Class A Common Stock,5.89,2508492106.0,7544055,Consumer Discretionary
ASH,Ashland Inc. Common Stock,54.2,2480321592.0,771261,Consumer Discretionary
RH,RH Common Stock,132.03,2479219599.0,623803,Consumer Discretionary
CALY,Callaway Golf Company Common Stock,13.37,2461340470.0,1616463,Consumer Discretionary
CHEF,The Chefs' Warehouse Inc. Common Stock,60.46,2460373327.0,422293,Consumer Discretionary
UA,Under Armour Inc. Class C Common Stock,5.76,2453126406.0,1945722,Consumer Discretionary
SHOO,Steven Madden Ltd. Common Stock,33.2,2420672125.0,1180472,Consumer Discretionary
BRSL,Brightstar Lottery PLC Trading under the Legal Name to begin at the market open on July 21 2025. Ordinary Shares,12.88,2376360000.0,882833,Consumer Discretionary
VC,Visteon Corporation Common Stock,87.84,2355823650.0,292592,Consumer Discretionary
RXO,RXO Inc. Common Stock,14.2,2331554246.0,988786,Consumer Discretionary
CENT,Central Garden & Pet Company Common Stock,37.33,2324443498.0,111840,Consumer Discretionary
GEO,Geo Group Inc (The) REIT,17.31,2297163138.0,1417221,Consumer Discretionary
MCW,Mister Car Wash Inc. Common Stock,6.98,2292783874.0,3736081,Consumer Discretionary
FLOC,Flowco Holdings Inc. Class A Common Stock,21.97,2244093552.0,881818,Consumer Discretionary
SAH,Sonic Automotive Inc. Common Stock,66.8,2240936394.0,388284,Consumer Discretionary
DNOW,DNOW Inc. Common Stock,12.02,2239880663.0,2845823,Consumer Discretionary
ABM,ABM Industries Incorporated Common Stock,38.22,2237124380.0,767450,Consumer Discretionary
PTRN,Pattern Group Inc. Series A Common Stock,12.48,2208348318.0,540314,Consumer Discretionary
VRRM,Verra Mobility Corporation Class A Common Stock,14.47,2190207547.0,2393863,Consumer Discretionary
