symbol,name,price,marketCap,volume,industry
CPSH,CPS Technologies Corp. Common Stock,5.34,96009339.0,895490,Consumer Discretionary
SLSN,Solesence Inc. Common Stock,1.35,95224741.0,42166,Consumer Discretionary
PLCE,Children's Place Inc. (The) Common Stock,4.03,89336593.0,193509,Consumer Discretionary
DLTH,Duluth Holdings Inc. Class B Common Stock,2.41,88510123.0,73339,Consumer Discretionary
QVCGA,QVC Group Inc. Series A Common Stock,10.75,86736031.0,14745,Consumer Discretionary
GAIA,Gaia Inc. Class A Common Stock,3.39,84894675.0,59791,Consumer Discretionary
FLL,Full House Resorts Inc. Common Stock,2.32,83801875.0,217706,Consumer Discretionary
DLHC,DLH Holdings Corp.,5.71,82755230.0,3976,Consumer Discretionary
MHH,Mastech Digital Inc Common Stock,6.94,81179477.0,7675,Consumer Discretionary
BODI,The Beachbody Company Inc. Class A Common Stock,11.38,80661861.0,21603,Consumer Discretionary
CPHC,Canterbury Park Holding Corporation 'New' Common Stock,15.5,79038716.0,655,Consumer Discretionary
GRWG,GrowGeneration Corp. Common Stock,1.31,78394910.0,237632,Consumer Discretionary
SEAT,Vivid Seats Inc. Class A Common Stock,7.29,78187554.0,156464,Consumer Discretionary
NOMA,NOMADAR Corp. Class A Common Stock,3.51,76658639.0,30823,Consumer Discretionary
SGA,Saga Communications Inc. Class A Common Stock (FL),11.38,74614347.0,1832,Consumer Discretionary
PRPL,Purple Innovation Inc. Common Stock,0.6875,74531138.0,351459,Consumer Discretionary
LIDR,AEye Inc. Class A Common Stock,1.64,73890195.0,972189,Consumer Discretionary
LCUT,Lifetime Brands Inc. Common Stock,3.15,71366369.0,63722,Consumer Discretionary
UFI,Unifi Inc. New Common Stock,3.86,70872159.0,24735,Consumer Discretionary
DIT,AMCON Distributing Company Common Stock,108.46,70575898.0,1628,Consumer Discretionary
GENK,GEN Restaurant Group Inc. Class A Common Stock,2.08,68519953.0,33742,Consumer Discretionary
STKS,The ONE Group Hospitality Inc. Common Stock,2.16,67186327.0,9876,Consumer Discretionary
VRA,Vera Bradley Inc. Common Stock,2.4,67092053.0,165093,Consumer Discretionary
RRGB,Red Robin Gourmet Burgers Inc. Common Stock,3.73,67007432.0,180122,Consumer Discretionary
ZBAI,ATIF Holdings Limited Ordinary Shares,6.45,66521256.0,2425,Consumer Discretionary
TISI,Team Inc. Common Stock,14.43,65328073.0,3699,Consumer Discretionary
BGSF,BGSF Inc. Common Stock,5.73,64174780.0,28860,Consumer Discretionary
TZOO,Travelzoo Common Stock,5.85,63954171.0,121964,Consumer Discretionary
ARAI,Arrive AI Inc. Common Stock,1.86,63636900.0,769015,Consumer Discretionary
LIVE,Live Ventures Incorporated Common Stock,20.5,62968948.0,2887,Consumer Discretionary
HOUR,Hour Loop Inc. Common Stock,1.75,61558560.0,56751,Consumer Discretionary
UONE,Urban One Inc. Class A Common Stock,13.62,61228015.0,90984,Consumer Discretionary
AIRT,Air T Inc. Common Stock,22.53,60890457.0,9048,Consumer Discretionary
IZEA,IZEA Worldwide Inc. Common Stock,3.52,60282647.0,147542,Consumer Discretionary
CATO,Cato Corporation (The) Class A Common Stock,3.05,60233248.0,33624,Consumer Discretionary
DBGI,Digital Brands Group Inc. Common Stock,7.28,59611086.0,311392,Consumer Discretionary
BDL,Flanigan's Enterprises Inc. Common Stock,31.8,59104975.0,476,Consumer Discretionary
RGS,Regis Corporation Common Stock,22.56,55959922.0,17212,Consumer Discretionary
LVO,LiveOne Inc. Common Stock,4.81,55936086.0,64021,Consumer Discretionary
CVGI,Commercial Vehicle Group Inc. Common Stock,1.5,55097072.0,136042,Consumer Discretionary
AIRTP,Air T Inc. Air T Funding Alpha Income Trust Preferred Securities,20.28,54809519.0,1720,Consumer Discretionary
MDIA,Mediaco Holding Inc. Class A Common Stock ,0.669,54756636.0,55135,Consumer Discretionary
OESX,Orion Energy Systems Inc. Common Stock,15.16,53527989.0,210907,Consumer Discretionary
VTSI,VirTra Inc. Common Stock,4.69,52999847.0,26391,Consumer Discretionary
SPWH,Sportsman's Warehouse Holdings Inc. Common Stock,1.37,52719100.0,324383,Consumer Discretionary
SCWO,374Water Inc. Common Stock,3.11,52636377.0,119168,Consumer Discretionary
LVLU,Lulu's Fashion Lounge Holdings Inc. Common Stock,18.62,51611773.0,27269,Consumer Discretionary
SMXT,Solarmax Technology Inc. Common Stock,0.9289,50442010.0,226047,Consumer Discretionary
AGH,Aureus Greenway Holdings Inc. Common Stock,3.32,49986906.0,44571,Consumer Discretionary
HCMAW,HCM III Acquisition Corp. Warrants,0.609,48297193.0,281,Consumer Discretionary
RAVE,Rave Restaurant Group Inc. Common Stock,3.34,47466630.0,30859,Consumer Discretionary
TLYS,Tilly's Inc. Common Stock,1.47,44796295.0,88018,Consumer Discretionary
MPU,Mega Matrix Inc. Class A Ordinary Shares,0.66,44757988.0,119955,Consumer Discretionary
CNTY,Century Casinos Inc. Common Stock,1.52,44756485.0,53547,Consumer Discretionary
CULP,Culp Inc. Common Stock,3.52,44573000.0,15844,Consumer Discretionary
ACFN,Acorn Energy Inc. Common Stock,17.72,44381973.0,20798,Consumer Discretionary
NHTC,Natural Health Trends Corp. Common Stock,3.81,43864816.0,26500,Consumer Discretionary
NTRP,NextTrip Inc. Common Stock,3.02,41273757.0,28419,Consumer Discretionary
NUKK,Nukkleus Inc. Common Stock,2.47,41115042.0,1504485,Consumer Discretionary
UONEK,Urban One Inc. Class D Common Stock,9.0,40459041.0,3033,Consumer Discretionary
JRSH,Jerash Holdings (US) Inc. Common Stock,3.06,38861816.0,42184,Consumer Discretionary
TOON,Kartoon Studios Inc. Common Stock,0.7112,38337732.0,177742,Consumer Discretionary
CNVS,Cineverse Corp. Class A Common Stock,2.0,38300806.0,81509,Consumer Discretionary
GAME,GameSquare Holdings Inc. Common Stock,0.3808,37463396.0,1321033,Consumer Discretionary
DXLG,Destination XL Group Inc. Common Stock,0.683,37330331.0,90933,Consumer Discretionary
VNCE,Vince Holding Corp. Common Stock,2.7,36016450.0,152958,Consumer Discretionary
ELWT,Elauwit Connection Inc. Common Stock,5.42,35879294.0,44658,Consumer Discretionary
PRTS,CarParts.com Inc. Common Stock,0.5133,35809057.0,913991,Consumer Discretionary
STRR,Star Equity Holdings Inc. Common Stock,10.27,35286724.0,4258,Consumer Discretionary
SWAG,Stran & Company Inc. Common Stock,1.86,34015974.0,114556,Consumer Discretionary
ACCS,ACCESS Newswire Inc. Common Stock,8.64,33426657.0,9365,Consumer Discretionary
UG,United-Guardian Inc. Common Stock,7.21,33125040.0,8895,Consumer Discretionary
LEE,Lee Enterprises Incorporated Common Stock,5.27,32904088.0,28183,Consumer Discretionary
BZFD,BuzzFeed Inc. Class A Common Stock,0.8804,32757812.0,209485,Consumer Discretionary
GIFT,Giftify Inc. Common Stock,1.05,32512109.0,120126,Consumer Discretionary
BIRD,Allbirds Inc. Class A Common Stock,3.91,32113190.0,60928,Consumer Discretionary
AENTW,Alliance Entertainment Holding Corporation Warrants,0.63,32103143.0,15033,Consumer Discretionary
CRWS,Crown Crafts Inc Common Stock,2.95,31573222.0,11511,Consumer Discretionary
NDLS,Noodles & Company Class A Common Stock,0.661,30918078.0,173095,Consumer Discretionary
INUV,Inuvo Inc.,2.08,30379596.0,423673,Consumer Discretionary
KPLT,Katapult Holdings Inc. Common Stock,6.52,30274538.0,40454,Consumer Discretionary
QVCGP,QVC Group Inc. 8.0% Fixed Rate Cumulative Redeemable Preferred Stock,3.74,30176070.0,14228,Consumer Discretionary
XOS,Xos Inc. Common Stock,2.66,30148951.0,32887,Consumer Discretionary
FATBB,FAT Brands Inc. Class B Common Stock,1.55,27805954.0,56289443,Consumer Discretionary
TBHC,The Brand House Collective Inc. Common Stock,1.2,26953660.0,321393,Consumer Discretionary
BNBX,BNB Plus Corp. Common Stock,1.29,26502159.0,31504,Consumer Discretionary
JOB,GEE Group Inc. Common Stock,0.2355,25906348.0,146436,Consumer Discretionary
AERT,Aeries Technology Inc. Class A Ordinary Share,0.5149,24897377.0,31149,Consumer Discretionary
SURG,SurgePays Inc. Common Stock,1.14,24433662.0,265674,Consumer Discretionary
RDI,Reading International Inc Class A Common Stock,1.07,24307468.0,7123,Consumer Discretionary
YYAI,AiRWA Inc. Common Stock,1.28,24296365.0,1816155,Consumer Discretionary
ARKR,Ark Restaurants Corp. Common Stock,6.56,23656390.0,666,Consumer Discretionary
TLF,Tandy Leather Factory Inc. Common Stock,2.85,22992381.0,6429,Consumer Discretionary
HHS,Harte Hanks Inc. Common Stock,3.03,22466826.0,5876,Consumer Discretionary
BTOC,Armlogi Holding Corp. Common Stock,0.485,22039893.0,31517,Consumer Discretionary
BNKK,Bonk Inc. Common Stock,3.85,20402390.0,106577,Consumer Discretionary
DLPN,Dolphin Entertainment Inc. Common Stock,1.61,19517099.0,10217,Consumer Discretionary
CISO,CISO Global Inc. Common Stock,0.4368,19239443.0,1218711,Consumer Discretionary
UHGWW,United Homes Group Inc. Warrant,0.32,18820364.0,3499,Consumer Discretionary
MWYN,Marwynn Holdings Inc. Common stock,0.8058,16272973.0,24453,Consumer Discretionary
IMG,CIMG Inc. Common Stock,0.8497,13156370.0,262216,Consumer Discretionary
RSVRW,Reservoir Media Inc. Warrant,0.2,13117645.0,1600,Consumer Discretionary
LESL,Leslie's Inc. Common Stock,1.37,12762879.0,148722,Consumer Discretionary
EFOI,Energy Focus Inc. Common Stock,2.19,12569319.0,5176,Consumer Discretionary
CETY,Clean Energy Technologies Inc. Common Stock,0.7657,12336103.0,362592,Consumer Discretionary
GTIM,Good Times Restaurants Inc. Common Stock,1.16,12247159.0,13775,Consumer Discretionary
EDUC,Educational Development Corporation Common Stock,1.4,11915910.0,5925,Consumer Discretionary
CABR,Caring Brands Inc. Common Stock,0.8428,11577480.0,37287,Consumer Discretionary
REBN,Reborn Coffee Inc. Common Stock,1.89,11295249.0,11800,Consumer Discretionary
AGAE,Allied Gaming & Entertainment Inc. Common Stock,0.29,10935010.0,325928,Consumer Discretionary
YCBD,cbdMD Inc. Common Stock,1.04,10915383.0,25367122,Consumer Discretionary
BTBD,BT Brands Inc. Common Stock,1.33,10433470.0,24928,Consumer Discretionary
SRTAW,Strata Critical Medical Inc. Warrants,0.115,9932150.0,43078,Consumer Discretionary
DSS,DSS Inc. Common Stock,1.02,9274368.0,8042,Consumer Discretionary
EVTV,Envirotech Vehicles Inc. Common Stock,1.91,9224374.0,980967,Consumer Discretionary
TWNP,Twin Hospitality Group Inc. Class A Common Stock,0.159,9114811.0,249609777,Consumer Discretionary
BBGI,Beasley Broadcast Group Inc. Class A Common Stock,5.01,9038010.0,44408,Consumer Discretionary
TBH,Brag House Holdings Inc. Common Stock,0.429,8988135.0,262324,Consumer Discretionary
OLOX,Olenox Industries Inc. Common Stock,1.27,7850836.0,346081,Consumer Discretionary
GNLN,Greenlane Holdings Inc. Class A Common Stock,1.48,7147753.0,43636,Consumer Discretionary
ATER,Aterian Inc. Common Stock,0.6926,6944732.0,66219,Consumer Discretionary
NWTG,Newton Golf Company Inc. Common Stock,1.46,6938596.0,31597,Consumer Discretionary
HYFM,Hydrofarm Holdings Group Inc. Common Stock,1.48,6907166.0,61298,Consumer Discretionary
JTAI,Jet.AI Inc. Common Stock,0.1484,6748972.0,13202995,Consumer Discretionary
MITQ,Moving iMage Technologies Inc. Common Stock,0.6772,6731187.0,16809,Consumer Discretionary
JCTC,Jewett-Cameron Trading Company Common Shares,1.91,6723416.0,9536,Consumer Discretionary
RVYL,Ryvyl Inc. Common Stock,6.11,6299581.0,46342,Consumer Discretionary
AEVAW,Aeva Technologies Inc. Warrants,0.103,6188231.0,39115,Consumer Discretionary
SILO,Silo Pharma Inc. Common Stock,0.3451,5656086.0,295903,Consumer Discretionary
FAT,FAT Brands Inc. Class A Common Stock,0.2925,5247253.0,186889070,Consumer Discretionary
SLE,Super League Enterprise Inc. Common Stock,5.4,5171423.0,38963,Consumer Discretionary
WALDW,Waldencast plc Warrant ,0.0399,5108844.0,243870,Consumer Discretionary
CAPS,Capstone Holding Corp. Common Stock,0.6,4983723.0,134873,Consumer Discretionary
SDOT,Sadot Group Inc. Common Stock,3.135,4856366.0,44657,Consumer Discretionary
IPW,iPower Inc. Common Stock,4.34,4556271.0,126070,Consumer Discretionary
VSTD,Vestand Inc. Class A Common Stock,0.3,4267494.0,107443,Consumer Discretionary
SBLX,StableX Technologies Inc. Common Stock,2.88,4193208.0,165859,Consumer Discretionary
CTNT,Cheetah Net Supply Chain Service Inc. Class A Common Stock,1.06,3471062.0,99144,Consumer Discretionary
LIDRW,AEye Inc. Warrant,0.0742,3343081.0,8637,Consumer Discretionary
TRUG,TruGolf Holdings Inc. Class A Common Stock,0.649,3282281.0,93066,Consumer Discretionary
WORX,SCWorx Corp. Common Stock,0.198,3133713.0,2098821,Consumer Discretionary
SOBR,SOBR Safe Inc. Common Stock,1.29,2433269.0,210914,Consumer Discretionary
FATBP,FAT Brands Inc. 8.25% Series B Cumulative Preferred Stock,0.13,2332112.0,8789922,Consumer Discretionary
UGRO,urban-gro Inc. Common Stock,0.1336,2177788.0,1449817,Consumer Discretionary
NUKKW,Nukkleus Inc. Warrants,0.1298,2160620.0,54449,Consumer Discretionary
FRGT,Freight Technologies Inc. Ordinary Shares,1.25,1955308.0,82887,Consumer Discretionary
XWEL,XWELL Inc. Common Stock,0.3155,1819395.0,8221735,Consumer Discretionary
DRCT,Direct Digital Holdings Inc. Class A Common Stock,2.28,1710559.0,402499,Consumer Discretionary
SWAGW,Stran & Company Inc. Warrant,0.0701,1282000.0,26577,Consumer Discretionary
AERTW,Aeries Technology Inc. Warrant,0.0265,1281376.0,2000,Consumer Discretionary
BTBDW,BT Brands Inc. Warrant,0.15,1176707.0,1165,Consumer Discretionary
SEATW,Vivid Seats Inc. Warrant,0.0749,803326.0,54978,Consumer Discretionary
BZFDW,BuzzFeed Inc. Warrant,0.0197,732995.0,8953,Consumer Discretionary
XOSWW,Xos Inc. Warrants,0.0051,57804.0,47520,Consumer Discretionary
KPLTW,Katapult Holdings Inc. Warrant,0.0039,18109.0,72117,Consumer Discretionary
QVCD,QVC Inc. 6.375% Senior Secured Notes due 2067,8.44,0.0,41784,Consumer Discretionary
QVCC,QVC Inc. 6.250% Senior Secured Notes due 2068,8.3,0.0,156152,Consumer Discretionary
