symbol,name,price,marketCap,volume,industry
VRRM,Verra Mobility Corporation Class A Common Stock,13.88,2100903991.0,1358528,Consumer Discretionary
PK,Park Hotels & Resorts Inc. Common Stock ,10.43,2100585719.0,2440291,Consumer Discretionary
DRVN,Driven Brands Holdings Inc. Common Stock,12.6,2072123147.0,1453288,Consumer Discretionary
PTRN,Pattern Group Inc. Series A Common Stock,11.61,2054400959.0,683679,Consumer Discretionary
HURN,Huron Consulting Group Inc. Common Stock,122.64,2032967960.0,180237,Consumer Discretionary
NSIT,Insight Enterprises Inc. Common Stock,65.82,2031003264.0,377691,Consumer Discretionary
CENTA,Central Garden & Pet Company Class A Common Stock Nonvoting,32.49,2023069093.0,209070,Consumer Discretionary
WLYB,John Wiley & Sons Inc. Common Stock,38.555,1978758111.0,109,Consumer Discretionary
WLY,John Wiley & Sons Inc. Common Stock,37.62,1930771110.0,621256,Consumer Discretionary
PTON,Peloton Interactive Inc. Class A Common Stock,4.43,1884916669.0,38009342,Consumer Discretionary
GT,The Goodyear Tire & Rubber Company Common Stock,6.44,1845171006.0,5887536,Consumer Discretionary
PENN,PENN Entertainment Inc. Common Stock,13.77,1838932179.0,3503772,Consumer Discretionary
RVLV,Revolve Group Inc. Class A Common Stock,21.92,1808536825.0,649475,Consumer Discretionary
COTY,Coty Inc. Class A Common Stock,2.0,1760012718.0,6692663,Consumer Discretionary
BLBD,Blue Bird Corporation Common Stock,55.11,1741029719.0,198443,Consumer Discretionary
INVX,Innovex International Inc. Common Stock,25.13,1737455280.0,452279,Consumer Discretionary
SHO,Sunstone Hotel Investors Inc. Sunstone Hotel Investors Inc. Common Shares,8.95,1692809936.0,1565105,Consumer Discretionary
FUN,Six Flags Entertainment Corporation Common Stock New,16.6,1691042100.0,1605958,Consumer Discretionary
MCRI,Monarch Casino & Resort Inc. Common Stock,93.98,1680937558.0,80210,Consumer Discretionary
TPB,Turning Point Brands Inc. Common Stock,85.37,1651117437.0,218854,Consumer Discretionary
CCS,Century Communities Inc. Common Stock,55.47,1610042377.0,352647,Consumer Discretionary
HLMN,Hillman Solutions Corp. Common Stock,8.17,1606147694.0,878848,Consumer Discretionary
AMSC,American Superconductor Corporation Common Stock,33.72,1605486250.0,1041588,Consumer Discretionary
ADNT,Adient plc Ordinary Shares ,20.25,1586178511.0,852039,Consumer Discretionary
JBLU,JetBlue Airways Corporation Common Stock,4.22,1561904999.0,26188637,Consumer Discretionary
OI,O-I Glass Inc. Common Stock,10.25,1561706492.0,1675888,Consumer Discretionary
EZPW,EZCORP Inc. Class A Non Voting Common Stock,25.21,1555387017.0,969441,Consumer Discretionary
ASGN,ASGN Incorporated Common Stock,37.56,1551228000.0,665367,Consumer Discretionary
OXSQG,Oxford Square Capital Corp. 5.50% Notes due 2028,24.05,1533376533.0,473,Consumer Discretionary
GCT,GigaCloud Technology Inc Class A Ordinary Shares,41.59,1522946405.0,448905,Consumer Discretionary
WINA,Winmark Corporation Common Stock,417.55,1493752139.0,59144,Consumer Discretionary
ALGT,Allegiant Travel Company Common Stock,79.4,1465112144.0,359451,Consumer Discretionary
YELP,Yelp Inc. Common Stock,24.36,1449834437.0,1113203,Consumer Discretionary
CNXN,PC Connection Inc. Common Stock,57.14,1439840690.0,65744,Consumer Discretionary
AIN,Albany International Corporation Common Stock,50.83,1438489000.0,241996,Consumer Discretionary
HTZ,Hertz Global Holdings Inc Common Stock,4.6,1436859119.0,6510979,Consumer Discretionary
TILE,Interface Inc. Common Stock,24.73,1433437058.0,675048,Consumer Discretionary
LPG,Dorian LPG Ltd. Common Stock,33.35,1425515835.0,283054,Consumer Discretionary
AMRC,Ameresco Inc. Class A Common Stock,26.75,1414541953.0,654363,Consumer Discretionary
KSS,Kohl's Corporation Common Stock,12.46,1398191910.0,4801267,Consumer Discretionary
OLPX,Olaplex Holdings Inc. Common Stock,2.02,1352193335.0,10624608,Consumer Discretionary
SPH,Suburban Propane Partners L.P. Common Stock,20.38,1351835583.0,60005,Consumer Discretionary
XHR,Xenia Hotels & Resorts Inc. Common Stock,14.63,1348211981.0,541705,Consumer Discretionary
ASTH,Astrana Health Inc. Common Stock,24.19,1345051036.0,333367,Consumer Discretionary
VTOL,Bristow Group Inc. Common Stock,46.0,1342786000.0,174588,Consumer Discretionary
DCH,Dauch Corporation Common Stock,5.61,1328150002.0,2684118,Consumer Discretionary
MAN,ManpowerGroup Common Stock,28.42,1321235739.0,841772,Consumer Discretionary
LZB,La-Z-Boy Incorporated Common Stock,31.94,1307103297.0,283526,Consumer Discretionary
LEG,Leggett & Platt Incorporated Common Stock,9.58,1301707351.0,1006839,Consumer Discretionary
WEN,Wendy's Company (The) Common Stock,6.8,1294451788.0,8155447,Consumer Discretionary
WWW,Wolverine World Wide Inc. Common Stock,15.78,1293660164.0,730104,Consumer Discretionary
CSWC,Capital Southwest Corporation Common Stock,21.45,1290475329.0,691327,Consumer Discretionary
SBH,Sally Beauty Holdings Inc. (Name to be changed from Sally Holdings Inc.) Common Stock,13.3,1290217226.0,1043657,Consumer Discretionary
FBYD,Falcon's Beyond Global Inc. Class A Common Stock,9.63,1273319085.0,123804,Consumer Discretionary
CRI,Carter's Inc. Common Stock,34.82,1266965395.0,546523,Consumer Discretionary
NPKI,NPK International Inc. Common Stock,14.61,1234953116.0,751160,Consumer Discretionary
DFH,Dream Finders Homes Inc. Class A Common Stock,13.39,1229327853.0,709084,Consumer Discretionary
DLX,Deluxe Corporation Common Stock,26.99,1222446437.0,290640,Consumer Discretionary
WBTN,WEBTOON Entertainment Inc. Common stock,9.12,1217363309.0,315841,Consumer Discretionary
DSGR,Distribution Solutions Group Inc. Common Stock,26.02,1201767344.0,122294,Consumer Discretionary
ICFI,ICF International Inc. Common Stock,64.77,1183560346.0,443001,Consumer Discretionary
WLDN,Willdan Group Inc. Common Stock,79.79,1180581617.0,259984,Consumer Discretionary
DFIN,Donnelley Financial Solutions Inc. Common Stock ,45.76,1172370422.0,161310,Consumer Discretionary
CCO,Clear Channel Outdoor Holdings Inc. Common Stock,2.35,1171446878.0,19423413,Consumer Discretionary
WLFC,Willis Lease Finance Corporation Common Stock,168.53,1143710644.0,56751,Consumer Discretionary
PRG,PROG Holdings Inc. Common Stock,28.51,1128306343.0,341035,Consumer Discretionary
SCL,Stepan Company Common Stock,49.49,1122946857.0,110744,Consumer Discretionary
ARRY,Array Technologies Inc. Common Stock,7.33,1121814521.0,2972367,Consumer Discretionary
GIII,G-III Apparel Group LTD. Common Stock,26.55,1120125570.0,643943,Consumer Discretionary
SVV,Savers Value Village Inc. Common Stock,7.13,1105554378.0,1674554,Consumer Discretionary
LIND,Lindblad Expeditions Holdings Inc. Common Stock,16.87,1100801038.0,742033,Consumer Discretionary
LUCK,Lucky Strike Entertainment Corporation Class A Common Stock,7.93,1091997066.0,72140,Consumer Discretionary
MBC,MasterBrand Inc. Common Stock,8.28,1056009407.0,1868898,Consumer Discretionary
UPBD,Upbound Group Inc. Common Stock,18.07,1050185122.0,762599,Consumer Discretionary
PZZA,Papa John's International Inc. Common Stock,31.76,1042069484.0,963014,Consumer Discretionary
MLKN,MillerKnoll Inc. Common Stock,15.02,1029091905.0,2146407,Consumer Discretionary
REAL,The RealReal Inc. Common Stock,8.57,1019682639.0,2930557,Consumer Discretionary
VSTS,Vestis Corporation Common Stock,7.71,1017326312.0,1118116,Consumer Discretionary
FUBO,FuboTV Inc. Class A Common Stock,9.28,1005817004.0,3442505,Consumer Discretionary
CRAI,CRA International Inc. Common Stock,153.16,1005676588.0,197924,Consumer Discretionary
NSP,Insperity Inc. Common Stock,26.49,999425925.0,689728,Consumer Discretionary
TDAY,USA TODAY Co. Inc. Common Stock,6.79,998859599.0,2620867,Consumer Discretionary
EPC,Edgewell Personal Care Company Common Stock,21.02,981983037.0,1112718,Consumer Discretionary
GNK,Genco Shipping & Trading Limited Ordinary Shares New (Marshall Islands),22.34,967719875.0,200652,Consumer Discretionary
TH,Target Hospitality Corp. Common Stock,9.61,962472290.0,349624,Consumer Discretionary
LMB,Limbach Holdings Inc. Common Stock,80.8,943694793.0,216085,Consumer Discretionary
DAKT,Daktronics Inc. Common Stock,19.25,929738618.0,424161,Consumer Discretionary
KODK,Eastman Kodak Company Common New,9.46,922350000.0,3094211,Consumer Discretionary
ODC,Oil-Dri Corporation Of America Common Stock,63.28,916294843.0,26453,Consumer Discretionary
CCOI,Cogent Communications Holdings Inc.,17.62,882803654.0,905169,Consumer Discretionary
ACEL,Accel Entertainment Inc. ,10.75,876912438.0,237426,Consumer Discretionary
LGIH,LGI Homes Inc. Common Stock,37.73,872811335.0,379783,Consumer Discretionary
WOOF,Petco Health and Wellness Company Inc. Class A Common Stock,2.7,869795350.0,1880977,Consumer Discretionary
SNCY,Sun Country Airlines Holdings Inc. Common Stock,16.29,867007590.0,435997,Consumer Discretionary
THRM,Gentherm Inc Common Stock,27.67,844667287.0,189412,Consumer Discretionary
SCHL,Scholastic Corporation Common Stock,38.74,842299646.0,427328,Consumer Discretionary
ULCC,Frontier Group Holdings Inc. Common Stock,3.53,810522305.0,3209811,Consumer Discretionary
AEVA,Aeva Technologies Inc. Common Stock,12.765,803527250.0,1816592,Consumer Discretionary
HCMA,HCM III Acquisition Corp. Class A Ordinary Share,10.09,800194876.0,2117,Consumer Discretionary
KRUS,Kura Sushi USA Inc. Class A Common Stock,66.06,800084171.0,442791,Consumer Discretionary
SMP,Standard Motor Products Inc. Common Stock,35.81,793046076.0,105898,Consumer Discretionary
RJET,Republic Airways Holdings Inc. Common Stock,16.71,782520544.0,98384,Consumer Discretionary
MEG,Montrose Environmental Group Inc. Common Stock,21.12,763905775.0,235544,Consumer Discretionary
BBSI,Barrett Business Services Inc. Common Stock,29.36,739962722.0,370213,Consumer Discretionary
BJRI,BJ's Restaurants Inc. Common Stock,34.74,736390276.0,455418,Consumer Discretionary
OIS,Oil States International Inc. Common Stock,12.2,734516921.0,932618,Consumer Discretionary
AMN,AMN Healthcare Services Inc,18.91,730989574.0,563817,Consumer Discretionary
CWH,Camping World Holdings Inc. Class A Common Stock,6.91,711638429.0,2601318,Consumer Discretionary
HTZWW,Hertz Global Holdings Inc Warrant,2.27,709058739.0,53746,Consumer Discretionary
CSV,Carriage Services Inc. Common Stock,44.62,707716972.0,195241,Consumer Discretionary
FOXF,Fox Factory Holding Corp. Common Stock,16.86,706983535.0,1118310,Consumer Discretionary
IBTA,Ibotta Inc. Class A Common Stock,28.98,705668216.0,204291,Consumer Discretionary
ARHS,Arhaus Inc. Class A Common Stock,6.5,702087360.0,1294774,Consumer Discretionary
BH,Biglari Holdings Inc. Class B Common Stock,305.79,701578890.0,59078,Consumer Discretionary
APOG,Apogee Enterprises Inc. Common Stock,32.46,698218365.0,319353,Consumer Discretionary
FET,Forum Energy Technologies Inc. Common Stock,61.92,696980808.0,208814,Consumer Discretionary
GDEN,Golden Entertainment Inc. Common Stock,25.91,678818137.0,123823,Consumer Discretionary
DJCO,Daily Journal Corp. (S.C.) Common Stock,491.76,677508571.0,59894,Consumer Discretionary
HOV,Hovnanian Enterprises Inc. Class A Common Stock,106.81,634258501.0,115135,Consumer Discretionary
FWRG,First Watch Restaurant Group Inc. Common Stock,10.31,630334254.0,2318431,Consumer Discretionary
SERV,Serve Robotics Inc. Common Stock,8.32,629742273.0,3507806,Consumer Discretionary
MNTN,MNTN Inc. Class A Common Stock,8.49,627179308.0,532335,Consumer Discretionary
SDHC,Smith Douglas Homes Corp. Class A Common Stock,12.0,617846400.0,214056,Consumer Discretionary
BRCB,Black Rock Coffee Bar Inc. Class A Common Stock,12.27,614184752.0,732354,Consumer Discretionary
RSVR,Reservoir Media Inc. Common Stock,9.28,608770032.0,71919,Consumer Discretionary
CBRL,Cracker Barrel Old Country Store Inc Common Stock,26.74,597666355.0,960533,Consumer Discretionary
TRON,Tron Inc. Common Stock,2.17,595409079.0,1702128,Consumer Discretionary
RRBI,Red River Bancshares Inc. Common Stock,89.9,591289021.0,69582,Consumer Discretionary
GOGO,Gogo Inc. Common Stock,4.31,580478980.0,1755317,Consumer Discretionary
LYTS,LSI Industries Inc. Common Stock,18.53,576536509.0,179743,Consumer Discretionary
HZO,MarineMax Inc.  (FL) Common Stock,25.79,568087007.0,295440,Consumer Discretionary
ETD,Ethan Allen Interiors Inc. Common Stock,22.16,563890872.0,357401,Consumer Discretionary
BZH,Beazer Homes USA Inc. Common Stock,19.04,561809586.0,322814,Consumer Discretionary
SG,Sweetgreen Inc. Class A Common Stock,4.7,558341111.0,5835125,Consumer Discretionary
AMC,AMC Entertainment Holdings Inc. Class A Common Stock,0.9482,552608352.0,15912029,Consumer Discretionary
EBF,Ennis Inc. Common Stock,21.32,539243903.0,105419,Consumer Discretionary
MOV,Movado Group Inc. Common Stock,24.05,530975611.0,113702,Consumer Discretionary
KFRC,Kforce Inc. Common Stock,28.36,516935785.0,210956,Consumer Discretionary
MLR,Miller Industries Inc. Common Stock,45.2,514002196.0,98873,Consumer Discretionary
MCS,Marcus Corporation (The) Common Stock,16.62,511503735.0,83132,Consumer Discretionary
CPS,Cooper-Standard Holdings Inc. Common Stock,28.99,511296891.0,156083,Consumer Discretionary
BALY,Bally's Corporation Common Stock,10.53,511078383.0,151083,Consumer Discretionary
CODI,D/B/A Compass Diversified Holdings Shares of Beneficial Interest,6.68,502576253.0,1336382,Consumer Discretionary
CNNE,Cannae Holdings Inc. Common Stock,10.74,497527482.0,638919,Consumer Discretionary
RMR,The RMR Group Inc. Class A Common Stock,15.36,492413599.0,62157,Consumer Discretionary
BWMN,Bowman Consulting Group Ltd. Common Stock,28.63,490246063.0,147051,Consumer Discretionary
JOUT,Johnson Outdoors Inc. Class A Common Stock,46.8,489202927.0,100752,Consumer Discretionary
BBW,Build-A-Bear Workshop Inc. Common Stock,37.28,482620132.0,354843,Consumer Discretionary
CVGW,Calavo Growers Inc. Common Stock,26.4,471875686.0,386886,Consumer Discretionary
LEGH,Legacy Housing Corporation Common Stock (TX),19.75,470293735.0,125869,Consumer Discretionary
MNRO,Monro Inc. Common Stock,15.47,464404140.0,1033786,Consumer Discretionary
MG,Mistras Group Inc Common Stock,14.59,460979250.0,81713,Consumer Discretionary
SFIX,Stitch Fix Inc. Class A Common Stock,3.33,454619992.0,3248933,Consumer Discretionary
BLMN,Bloomin' Brands Inc. Common Stock,5.26,448297297.0,2047698,Consumer Discretionary
PANL,Pangaea Logistics Solutions Ltd. Common Shares,6.77,442207240.0,457350,Consumer Discretionary
ELA,Envela Corporation Common Stock,16.96,440340553.0,107766,Consumer Discretionary
SCVL,Shoe Carnival Inc. Common Stock,16.02,438546987.0,771906,Consumer Discretionary
BLW,Blackrock Limited Duration Income Trust,12.19,435320174.0,383894,Consumer Discretionary
KELYB,Kelly Services Inc. Class B Common Stock,12.7,434486406.0,1650,Consumer Discretionary
SPIR,Spire Global Inc. Class A Common Stock,12.36,432740719.0,623190,Consumer Discretionary
GRPN,Groupon Inc. Common Stock,10.47,426584351.0,1256458,Consumer Discretionary
IHRT,iHeartMedia Inc. Class A Common Stock,2.8,421798558.0,538280,Consumer Discretionary
LE,Lands' End Inc. Common Stock,13.6,415494525.0,1148305,Consumer Discretionary
LOCO,El Pollo Loco Holdings Inc. Common Stock,13.81,413695937.0,522423,Consumer Discretionary
NATH,Nathan's Famous Inc. Common Stock,100.68,412224695.0,11214,Consumer Discretionary
BXC,Bluelinx Holdings Inc. Common Stock,51.82,407658820.0,75355,Consumer Discretionary
DDT,Dillard's Capital Trust I,26.09,407342283.0,10877,Consumer Discretionary
SGU,Star Group L.P. Common Stock,12.37,406713910.0,23776,Consumer Discretionary
TDUP,ThredUp Inc. Class A Common Stock,3.18,403977253.0,1768046,Consumer Discretionary
PTLO,Portillo's Inc. Class A Common Stock,5.18,391131362.0,1114923,Consumer Discretionary
TITN,Titan Machinery Inc. Common Stock,16.1,376259801.0,110893,Consumer Discretionary
GLAD,Gladstone Capital Corporation Common Stock,16.55,373915292.0,279385,Consumer Discretionary
LTBR,Lightbridge Corporation Common Stock,10.7,365427063.0,638234,Consumer Discretionary
ZUMZ,Zumiez Inc. Common Stock,21.34,362132331.0,193533,Consumer Discretionary
SRTA,Strata Critical Medical Inc. Class A Common Stock,4.14,360135052.0,527754,Consumer Discretionary
HLLY,Holley Inc. Common Stock,2.91,355122825.0,1009985,Consumer Discretionary
CAL,Caleres Inc. Common Stock,10.44,353869667.0,647879,Consumer Discretionary
CTRN,Citi Trends Inc. Common Stock,42.33,353254856.0,83038,Consumer Discretionary
BBCP,Concrete Pumping Holdings Inc. Common Stock,6.84,345491861.0,179655,Consumer Discretionary
HVT,Haverty Furniture Companies Inc. Common Stock,21.3,343869032.0,149307,Consumer Discretionary
AENT,Alliance Entertainment Holding Corporation Class A Common Stock,6.73,342943100.0,52301,Consumer Discretionary
QUAD,Quad Graphics Inc Class A Common Stock,6.52,340759800.0,134630,Consumer Discretionary
PLAY,Dave & Buster's Entertainment Inc. Common Stock,9.81,340213400.0,2821570,Consumer Discretionary
DIN,Dine Brands Global Inc. Common Stock,25.18,328507924.0,443381,Consumer Discretionary
TSSI,TSS Inc. Common Stock,11.7,324951050.0,1120210,Consumer Discretionary
HNST,The Honest Company Inc. Common Stock,2.88,323925745.0,1498146,Consumer Discretionary
STRT,STRATTEC SECURITY CORPORATION Common Stock,77.49,323890997.0,46637,Consumer Discretionary
MTRX,Matrix Service Company Common Stock,11.39,320382533.0,200397,Consumer Discretionary
HYLN,Hyliion Holdings Corp. Class A Common Stock,1.8,320063011.0,799980,Consumer Discretionary
EWCZ,European Wax Center Inc. Class A Common Stock,5.775,314951614.0,375428,Consumer Discretionary
HCKT,Hackett Group Inc (The). Common Stock,12.38,312226398.0,257678,Consumer Discretionary
XWIN,XMAX Inc. Common Stock,7.16,308404305.0,1820575,Consumer Discretionary
CCRN,Cross Country Healthcare Inc. Common Stock $0.0001 Par Value,9.52,307674414.0,257877,Consumer Discretionary
GCO,Genesco Inc. Common Stock,27.97,303704525.0,246041,Consumer Discretionary
BBBY,Bed Bath & Beyond Inc. Common Stock,4.37,302993063.0,2049247,Consumer Discretionary
KELYA,Kelly Services Inc. Class A Common Stock,8.78,300377216.0,267205,Consumer Discretionary
PACK,Ranpak Holdings Corp Class A Common Stock,3.54,299913678.0,252326,Consumer Discretionary
BNED,Barnes & Noble Education Inc Common Stock,8.72,299062158.0,109267,Consumer Discretionary
ASLE,AerSale Corporation Common Stock,6.15,290535932.0,346079,Consumer Discretionary
RCKY,Rocky Brands Inc. Common Stock,37.91,285708260.0,54957,Consumer Discretionary
CIX,CompX International Inc. Common Stock,23.16,285402000.0,4959,Consumer Discretionary
NCMI,National CineMedia Inc. Common Stock,3.04,283157295.0,461256,Consumer Discretionary
XPOF,Xponential Fitness Inc. Class A Common Stock,5.75,282037500.0,275478,Consumer Discretionary
LVWR,LiveWire Group Inc. Common Stock,1.37,279947685.0,164851,Consumer Discretionary
ASPN,Aspen Aerogels Inc. Common Stock,3.3,273324490.0,773201,Consumer Discretionary
DBI,Designer Brands Inc. Class A Common Stock,5.44,270020340.0,1706142,Consumer Discretionary
SEG,Seaport Entertainment Group Inc. Common Stock,20.86,266929775.0,85875,Consumer Discretionary
ACCO,Acco Brands Corporation Common Stock,2.94,265100614.0,1369006,Consumer Discretionary
EVI,EVI Industries Inc.  Common Stock,20.38,262130597.0,13076,Consumer Discretionary
ANGI,Angi Inc. Class A Common Stock,6.48,259878767.0,863701,Consumer Discretionary
EVH,Evolent Health Inc Class A Common Stock,2.21,246720727.0,2205519,Consumer Discretionary
FLXS,Flexsteel Industries Inc. Common Stock,45.83,244984723.0,42753,Consumer Discretionary
HDSN,Hudson Technologies Inc. Common Stock,5.76,244620415.0,276737,Consumer Discretionary
KLC,KinderCare Learning Companies Inc. Common Stock,2.05,242629384.0,1877692,Consumer Discretionary
HBB,Hamilton Beach Brands Holding Company Class A Common Stock ,17.64,239503060.0,17263,Consumer Discretionary
ESCA,Escalade Incorporated Common Stock,17.35,237630996.0,39985,Consumer Discretionary
FOSL,Fossil Group Inc. Common Stock,3.98,232254747.0,321427,Consumer Discretionary
JAKK,JAKKS Pacific Inc. Common Stock,19.67,225111564.0,59135,Consumer Discretionary
JILL,J. Jill Inc. Common Stock,14.76,223102610.0,76659,Consumer Discretionary
RDIB,Reading International Inc Class B Common Stock,9.41,213769417.0,596,Consumer Discretionary
MPAA,Motorcar Parts  of America Inc. Common Stock,10.9,209399399.0,73985,Consumer Discretionary
SMHI,SEACOR Marine Holdings Inc. Common Stock ,7.53,202946949.0,77729,Consumer Discretionary
FLWS,1-800-FLOWERS.COM Inc. Common Stock,3.1,198603996.0,483303,Consumer Discretionary
LOVE,The Lovesac Company Common Stock,13.53,197769444.0,761251,Consumer Discretionary
STRZ,Starz Entertainment Corp. Common Shares,11.68,195418617.0,83698,Consumer Discretionary
DIBS,1stdibs.com Inc. Common Stock,5.29,191456230.0,165834,Consumer Discretionary
LEE,Lee Enterprises Incorporated Common Stock,8.5,188954482.0,68887,Consumer Discretionary
JACK,Jack In The Box Inc. Common Stock,9.7,184649355.0,1484887,Consumer Discretionary
TPVG,TriplePoint Venture Growth BDC Corp. Common Stock,4.5,182210153.0,499874,Consumer Discretionary
PLBY,Playboy Inc. Common Stock,1.57,180329765.0,626012,Consumer Discretionary
III,Information Services Group Inc. Common Stock,3.76,179255522.0,196514,Consumer Discretionary
CURV,Torrid Holdings Inc. Common Stock,1.79,177562526.0,747393,Consumer Discretionary
RICK,RCI Hospitality Holdings Inc. Common Stock,22.97,177098700.0,92469,Consumer Discretionary
FC,Franklin Covey Company Common Stock,15.29,176638520.0,117604,Consumer Discretionary
PAL,Proficient Auto Logistics Inc. Common Stock,6.32,175885834.0,147528,Consumer Discretionary
CURI,CuriosityStream Inc. Class A Common Stock,2.85,168076863.0,599153,Consumer Discretionary
ACU,Acme United Corporation. Common Stock,43.86,167028749.0,10982,Consumer Discretionary
SPCE,Virgin Galactic Holdings Inc. Common Stock,2.26,165272326.0,2293087,Consumer Discretionary
FNKO,Funko Inc. Class A Common Stock,2.93,162720128.0,676144,Consumer Discretionary
PMTS,CPI Card Group Inc. Common Stock,14.19,162623587.0,51130,Consumer Discretionary
FBYDW,Falcon's Beyond Global Inc. Warrants,1.2,158669045.0,50,Consumer Discretionary
SKYX,SKYX Platforms Corp. Common Stock,1.195,157160554.0,3131341,Consumer Discretionary
RENT,Rent the Runway Inc. Class A Common Stock,4.68,156998102.0,46940,Consumer Discretionary
SGC,Superior Group of Companies Inc. Common Stock,9.98,156735022.0,26636,Consumer Discretionary
ONEW,OneWater Marine Inc. Class A Common Stock,8.83,146696711.0,100872,Consumer Discretionary
TONX,TON Strategy Company Common Stock,2.435,143885419.0,560723,Consumer Discretionary
WW,WW International Inc.  Common Stock,14.225,142199757.0,694465,Consumer Discretionary
HQI,HireQuest Inc. Common Stock (DE),9.94,140154000.0,9807,Consumer Discretionary
RCMT,RCM Technologies Inc. Common Stock,18.6,137835486.0,47466,Consumer Discretionary
SRI,Stoneridge Inc. Common Stock,4.84,135601946.0,259467,Consumer Discretionary
VENU,Venu Holding Corporation Common Stock,3.08,132100670.0,355176,Consumer Discretionary
HOFT,Hooker Furnishings Corporation Common Stock,12.25,132027070.0,44217,Consumer Discretionary
BRLT,Brilliant Earth Group Inc. Class A Common Stock,1.28,129414797.0,51091,Consumer Discretionary
DTI,Drilling Tools International Corporation Common Stock,3.67,129140914.0,258305,Consumer Discretionary
AMCI,AMC Robotics Corporation Common Stock,5.71,129019643.0,25188,Consumer Discretionary
CVGI,Commercial Vehicle Group Inc. Common Stock,3.51,128594887.0,211555,Consumer Discretionary
WALD,Waldencast plc Class A Ordinary Share,0.9801,125707501.0,181609,Consumer Discretionary
TLYS,Tilly's Inc. Common Stock,4.09,124637310.0,421107,Consumer Discretionary
BSET,Bassett Furniture Industries Incorporated Common Stock,14.24,123238229.0,11565,Consumer Discretionary
HOVNP,Hovnanian Enterprises Inc Dep Shr Srs A Pfd,20.533,121928937.0,1305,Consumer Discretionary
EML,Eastern Company (The) Common Stock,19.76,119279066.0,10161,Consumer Discretionary
AOUT,American Outdoor Brands Inc. Common Stock ,9.105,114684395.0,63069,Consumer Discretionary
LCUT,Lifetime Brands Inc. Common Stock,4.93,111685241.0,93938,Consumer Discretionary
CHPT,ChargePoint Holdings Inc. Common Stock,4.69,110932987.0,777385,Consumer Discretionary
DLTH,Duluth Holdings Inc. Class B Common Stock,3.01,110657184.0,143801,Consumer Discretionary
THRY,Thryv Holdings Inc. Common Stock,2.49,109970907.0,624247,Consumer Discretionary
CRMT,America's Car-Mart Inc Common Stock,13.04,108263948.0,158089,Consumer Discretionary
TTEC,TTEC Holdings Inc. Common Stock,2.22,107815517.0,367498,Consumer Discretionary
GPRO,GoPro Inc. Class A Common Stock,0.64,105063944.0,2478341,Consumer Discretionary
CLAR,Clarus Corporation Common Stock,2.67,102532870.0,236324,Consumer Discretionary
JFB,JFB Construction Holdings Class A Common Stock,7.27,101984869.0,195121,Consumer Discretionary
TBI,TrueBlue Inc. Common Stock,3.31,99507342.0,558324,Consumer Discretionary
VIRC,Virco Manufacturing Corporation Common Stock,6.23,98191908.0,18716,Consumer Discretionary
FLNT,Fluent Inc. Common Stock,3.23,95723850.0,29205,Consumer Discretionary
BARK,BARK Inc. Class A Common Stock,0.544,94021378.0,1492374,Consumer Discretionary
HFFG,HF Foods Group Inc. Common Stock,1.73,91765829.0,240213,Consumer Discretionary
VRA,Vera Bradley Inc. Common Stock,3.21,89735621.0,229238,Consumer Discretionary
DIT,AMCON Distributing Company Common Stock,89.55,87406442.0,1630,Consumer Discretionary
TSQ,Townsquare Media Inc. Class A Common Stock,4.97,85012412.0,189957,Consumer Discretionary
SRFM,Surf Air Mobility Inc. Common Stock,1.1,84692577.0,2482343,Consumer Discretionary
LIDR,AEye Inc. Class A Common Stock,1.85,83889950.0,1208464,Consumer Discretionary
NOMA,NOMADAR Corp. Class A Common Stock,3.77,82337056.0,6486,Consumer Discretionary
DLHC,DLH Holdings Corp.,5.59,81016066.0,11913,Consumer Discretionary
CPHC,Canterbury Park Holding Corporation 'New' Common Stock,15.3899,78854539.0,340,Consumer Discretionary
SGA,Saga Communications Inc. Class A Common Stock (FL),11.9685,78472918.0,6068,Consumer Discretionary
