symbol,name,price,marketCap,volume,industry
JSM,Navient Corporation 6% Senior Notes due December 15 2043,17.96,1785781442.0,9527,Finance
MUJ,Blackrock MuniHoldings New Jersey Quality Fund Inc. Common Stock,12.0,1785149652.0,60442,Finance
AFGB,American Financial Group Inc. 5.875% Subordinated Debentures due 2059,21.25,1770100201.0,4568,Finance
MIY,Blackrock MuniYield Michigan Quality Fund Inc. Common Stock,11.87,1765810531.0,37688,Finance
WTFCN,Wintrust Financial Corporation Depositary Shares Each Representing a 1/1000th Interest in a Share of 7.875% Fixed-Rate Reset Non-Cumulative Perpetual Preferred StocK,26.24,1765177579.0,46148,Finance
RVT,Royce Small-Cap Trust Inc. Common Stock,16.34,1764012723.0,334276,Finance
TRINI,Trinity Capital Inc. 7.875% Notes Due 2029,25.04,1760666566.0,6831,Finance
TRINZ,Trinity Capital Inc. 7.875% Notes due 2029,25.04,1760666566.0,2242,Finance
FCF,First Commonwealth Financial Corporation Common Stock,17.11,1748747158.0,1074358,Finance
SRCE,1st Source Corporation Common Stock,68.1,1716648388.0,234600,Finance
NBHC,National Bank Holdings Corporation Common Stock,38.04,1712318181.0,747195,Finance
MHD,Blackrock MuniHoldings Fund Inc. Common Stock,11.48,1707793167.0,324604,Finance
HMN,Horace Mann Educators Corporation Common Stock,42.22,1707780001.0,221958,Finance
CHCO,City Holding Company Common Stock,118.95,1706982697.0,148493,Finance
TY,Tri Continental Corporation Common Stock,31.26,1699010228.0,128194,Finance
LC,LendingClub Corporation Common Stock,14.69,1692002985.0,1926315,Finance
AFGD,American Financial Group Inc. 5.625% Subordinated Debentures due 2060,20.22,1684302403.0,6323,Finance
RZC,Reinsurance Group of America Incorporated 7.125% Fixed-Rate Reset Subordinated Debentures due 2052,25.34,1661370804.0,54790,Finance
MQY,Blackrock MuniYield Quality Fund Inc. Common Stock,11.15,1658701552.0,338820,Finance
GAB,Gabelli Equity Trust Inc. (The) Common Stock,5.6,1645376393.0,2018956,Finance
BPOPM,Popular Inc. Popular Capital Trust II - 6.125% Cumulative Monthly Income Trust Preferred Securities,25.2001,1640634921.0,652,Finance
RZB,Reinsurance Group of America Incorporated 5.75% Fixed-To-Floating Rate Subordinated Debentures due 2056,24.94,1635145535.0,19518,Finance
FRMEP,First Merchants Corporation Depository Shares,25.655,1626340950.0,1200,Finance
GSHD,Goosehead Insurance Inc. Class A Common Stock,44.39,1624175900.0,603095,Finance
FRA,Blackrock Floating Rate Income Strategies Fund Inc  Common Stock,10.84,1612585186.0,171675,Finance
RQI,Cohen & Steers Quality Income Realty Fund Inc Common Shares,12.0,1611604896.0,325496,Finance
BKT,BlackRock Income Trust Inc. (The),10.66,1585807941.0,64317,Finance
MYI,Blackrock MuniYield Quality Fund III Inc Common Stock,10.66,1585807941.0,210513,Finance
PWP,Perella Weinberg Partners Class A Common Stock,17.26,1584322912.0,678144,Finance
MUC,Blackrock MuniHoldings California Quality Fund Inc.  Common Stock,10.625,1580601254.0,276720,Finance
MUA,Blackrock MuniAssets Fund Inc Common Stock,10.53,1566468820.0,74724,Finance
GABC,German American Bancorp Inc. Common Stock,41.53,1560512799.0,278265,Finance
BCAT,BlackRock Capital Allocation Term Trust Common Shares of Beneficial Interest,14.43,1560388050.0,585293,Finance
AGM,Federal Agricultural Mortgage Corporation Common Stock,142.75,1549834038.0,104552,Finance
BDJ,Blackrock Enhanced Equity Dividend Trust,8.66,1531652771.0,492631,Finance
AFGC,American Financial Group Inc. 5.125% Subordinated Debentures due 2059,18.23,1518537726.0,4798,Finance
ECCX,Eagle Point Credit Company Inc. 6.6875% Notes due 2028,25.005,1516866413.0,5320,Finance
ECCW,Eagle Point Credit Company Inc. 6.75% Notes due 2031,24.995,1516259787.0,2449,Finance
WD,Walker & Dunlop Inc Common Stock,44.5,1515687667.0,425299,Finance
TCBK,TriCo Bancshares Common Stock,47.14,1515580792.0,188905,Finance
LOB,Live Oak Bancshares Inc. Common Stock,32.75,1513692031.0,430222,Finance
OXLC,Oxford Lane Capital Corp. Common Stock,8.71,1512056000.0,1097791,Finance
KW,Kennedy-Wilson Holdings Inc. Common Stock,10.89,1507878557.0,1060127,Finance
ETV,Eaton Vance Corporation Eaton Vance Tax-Managed Buy-Write Opportunities Fund Common Shares of Beneficial Interest,13.76,1503532482.0,187918,Finance
ECPG,Encore Capital Group Inc Common Stock,70.16,1502144754.0,246408,Finance
STBA,S&T Bancorp Inc. Common Stock,40.95,1496666480.0,382944,Finance
ECCC,Eagle Point Credit Company Inc. 6.50% Series C Term Preferred Stock due 2031,24.58,1491084840.0,1798,Finance
BFC,Bank First Corporation Common Stock,132.68,1486238504.0,90063,Finance
IIPR,Innovative Industrial Properties Inc. Common Stock,52.38,1473756609.0,259344,Finance
ECAT,BlackRock ESG Capital Allocation Term Trust Common Shares of Beneficial Interest,13.57,1467391950.0,710895,Finance
DCOM,Dime Community Bancshares Inc. Common Stock,32.87,1443186539.0,349340,Finance
EFC,Ellington Financial Inc. Common Stock ,11.53,1437203235.0,2460780,Finance
LKFN,Lakeland Financial Corporation Common Stock,56.79,1434884705.0,205360,Finance
GAM,General American Investors Inc. Common Stock,59.82,1434220990.0,37033,Finance
ECCV,Eagle Point Credit Company Inc. 5.375% Notes due 2029,23.4601,1423148879.0,8642,Finance
HOPE,Hope Bancorp Inc. Common Stock,11.05,1412713637.0,1147520,Finance
BY,Byline Bancorp Inc. Common Stock,30.94,1410575980.0,156731,Finance
QCRH,QCR Holdings Inc. Common Stock,83.61,1398855666.0,176314,Finance
AFGE,American Financial Group Inc. 4.500% Subordinated Debentures due 2060,16.7,1391090511.0,2924,Finance
TFIN,Triumph Financial Inc. Common Stock,57.16,1360063039.0,201770,Finance
RBCAA,Republic Bancorp Inc. Class A Common Stock,69.29,1358731515.0,101514,Finance
NCV,Virtus Convertible & Income Fund Common Shares of Beneficial Interest,14.96,1351988592.0,85550,Finance
CNOB,ConnectOne Bancorp Inc. Common Stock,26.72,1343304767.0,491683,Finance
RHLD,Resolute Holdings Management Common Stock ,157.56,1335165016.0,345229,Finance
KMPB,Kemper Corporation 5.875% Fixed-Rate Reset Junior Subordinated Debentures due 2062,22.4,1315206794.0,12940,Finance
FINV,FinVolution Group American Depositary Shares,5.1,1292410691.0,2299557,Finance
PFBC,Preferred Bank Common Stock,88.99,1277603623.0,120230,Finance
FOR,Forestar Group Inc Common Stock ,25.07,1275864446.0,114192,Finance
OBK,Origin Bancorp Inc. Common Stock,41.01,1270543031.0,198776,Finance
PRA,ProAssurance Corporation Common Stock,24.64,1266832164.0,795495,Finance
PSEC,Prospect Capital Corporation Common Stock,2.57,1250266309.0,3838156,Finance
WAFDP,WaFd Inc. Depositary Shares,16.46,1248710478.0,21631,Finance
CNOBP,ConnectOne Bancorp Inc. Depositary Shares each representing a 1/40th interest in a share of 5.25% Fixed-Rate Reset Non-Cumulative Perpetual Preferred Stock Series A,24.48,1230692391.0,7424,Finance
WABC,Westamerica Bancorporation Common Stock,50.6,1223983842.0,310357,Finance
TRIN,Trinity Capital Inc. Common Stock,14.62,1216017228.0,1326257,Finance
WLTH,Wealthfront Corporation Common Stock,7.95,1193457045.0,3517087,Finance
CCB,Coastal Financial Corporation Common Stock,77.13,1173067316.0,137325,Finance
PEBO,Peoples Bancorp Inc. Common Stock,32.0,1149353312.0,318106,Finance
MBINM,Merchants Bancorp Depositary Shares Each Representing a 1/40th Interest in a Share of 8.25% Fixed-Rate Reset Series D Non-Cumulative Perpetual Preferred Stock,24.94,1146293901.0,7934,Finance
AMAL,Amalgamated Financial Corp. Common Stock (DE),38.17,1138586519.0,191321,Finance
TMP,Tompkins Financial Corporation Common Stock,75.84,1093463016.0,64563,Finance
MBINL,Merchants Bancorp Depositary Shares Each Representing a 1/40thInterest in a Share of 7.25% Fixed Rate Series E Non-CumulativePerpetual Preferred Stock without par value,23.79,1093437526.0,8592,Finance
DSL,DoubleLine Income Solutions Fund Common Shares of Beneficial Interests,10.67,1088306155.0,672472,Finance
CTBI,Community Trust Bancorp Inc. Common Stock,59.85,1086323644.0,121687,Finance
TWFG,TWFG Inc. Class A Common Stock,19.22,1080166729.0,496315,Finance
JCAP,Jefferson Capital Inc. Common Stock,19.46,1076704753.0,472895,Finance
BTZ,BlackRock Credit Allocation Income Trust,9.95,1075943250.0,355635,Finance
FMBH,First Mid Bancshares Inc. Common Stock,40.4,1075541324.0,198484,Finance
SAFT,Safety Insurance Group Inc. Common Stock,73.1,1069576100.0,97203,Finance
HTFC,Horizon Technology Finance Corporation 6.25% Notes due 2027,24.5075,1042689208.0,16492,Finance
NCZ,Virtus Convertible & Income Fund II Common Shares of Beneficial Interest,13.67,1040502289.0,99886,Finance
GSBD,Goldman Sachs BDC Inc. Common Stock,9.24,1040138179.0,1496362,Finance
HFWA,Heritage Financial Corporation Common Stock,25.28,1039794208.0,427899,Finance
OSBC,Old Second Bancorp Inc. Common Stock,19.68,1036955062.0,673810,Finance
FSCO,FS Credit Opportunities Corp. Common Stock,5.22,1035417798.0,1957501,Finance
DCOMG,Dime Community Bancshares Inc. 9.000% Fixed-to-Floating Rate Subordinated Notes due 2034,26.4,1033524017.0,5869,Finance
PTA,Cohen & Steers Tax-Advantaged Preferred Securities and Income Fund Common Shares of Beneficial Interest,18.6,1028086300.0,242629,Finance
OCFC,OceanFirst Financial Corp. Common Stock,17.88,1026348046.0,1477327,Finance
MFIC,MidCap Financial Investment Corporation Common Stock,11.07,1020785390.0,1599746,Finance
FSUN,FirstSun Capital Bancorp Common Stock,36.38,1015850855.0,195723,Finance
AIZN,Assurant Inc. 5.25% Subordinated Notes due 2061,20.095,1013977845.0,20342,Finance
MCB,Metropolitan Bank Holding Corp. Common Stock,81.88,1006565087.0,92682,Finance
OCSL,Oaktree Specialty Lending Corporation Common Stock,11.34,998889831.0,718952,Finance
EXPI,eXp World Holdings Inc. Common Stock,6.17,998880402.0,1296314,Finance
MMI,Marcus & Millichap Inc. Common Stock,25.96,988270487.0,275914,Finance
SIGIP,Selective Insurance Group Inc. Depositary Shares each representing a 1/1000th interest in a share of 4.60% Non-Cumulative Preferred Stock Series B,16.388,984623160.0,1988,Finance
BCX,BlackRock Resources Common Shares of Beneficial Interest,11.52,977564275.0,229539,Finance
RNP,Cohen & Steers REIT and Preferred and Income Fund Inc. Common Shares,19.84,974910380.0,58155,Finance
TCBIO,Texas Capital Bancshares Inc. Depositary Shares 5.75% Fixed Rate Non-Cumulative Perpetual Preferred Stock Series B,21.88,967383919.0,16630,Finance
PGY,Pagaya Technologies Ltd. Class A Ordinary Shares,11.7,965559301.0,3910556,Finance
GAINN,Gladstone Investment Corporation 5.00% Notes Due 2026,25.1323,960537154.0,1200,Finance
ETW,Eaton Vance Corporation Eaton Vance Tax-Managed Global Buy-Write Opportunites Fund Common Shares of Beneficial Interest,8.75,958980628.0,407218,Finance
UVE,UNIVERSAL INSURANCE HOLDINGS INC Common Stock,34.18,957319900.0,206809,Finance
UFCS,United Fire Group Inc. Common Stock,37.47,956311251.0,180861,Finance
UVSP,Univest Financial Corporation Common Stock,33.79,948942580.0,233402,Finance
BHFAL,Brighthouse Financial Inc. 6.25% Junior Subordinated Debentures due 2058,16.54,945824997.0,12844,Finance
NBBK,NB Bancorp Inc. Common Stock,20.69,943562774.0,232351,Finance
FMN,Federated Hermes Premier Municipal Income Fund,10.89,939315317.0,45871,Finance
BHRB,Burke & Herbert Financial Services Corp. Common Stock,62.14,934514574.0,165858,Finance
ESQ,Esquire Financial Holdings Inc. Common Stock,107.91,931998059.0,77307,Finance
CFFN,Capitol Federal Financial Inc. Common Stock,7.13,925788946.0,1428657,Finance
FCRX,Crescent Capital BDC Inc. 5.00% Notes due 2026,24.97,925426829.0,478,Finance
MBINN,Merchants Bancorp Depositary Shares Preferred Series C,20.06,921999024.0,3816,Finance
SBSI,Southside Bancshares Inc. Common Stock,30.77,914961550.0,176889,Finance
OPY,Oppenheimer Holdings Inc. Class A Common Stock (DE),85.4,914399577.0,35064,Finance
GAINZ,Gladstone Investment Corporation 4.875% Notes due 2028,23.92,914203982.0,4616,Finance
EQBK,Equity Bancshares Inc. Class A Common Stock,43.54,913997732.0,177056,Finance
RWAYL,Runway Growth Finance Corp. 7.50% Notes due 2027,25.19,912296960.0,5998,Finance
BHFAO,Brighthouse Financial Inc. Depositary Shares 6.75% Non-Cumulative Preferred Stock Series B,15.67,896074831.0,25055,Finance
BANFP,BancFirst Corporation - BFC Capital Trust II Cumulative Trust Preferred Securities,26.175,878042940.0,785,Finance
BFST,Business First Bancshares Inc. Common Stock,26.81,876967084.0,234835,Finance
NBN,Northeast Bank Common Stock,107.82,876576600.0,239229,Finance
ABX,Abacus Global Management Inc. Class A Common Stock,9.07,875637346.0,697318,Finance
VRTS,Virtus Investment Partners Inc. Common Stock,130.03,870617815.0,97697,Finance
BBDC,Barings BDC Inc. Common Stock,8.31,870114206.0,639827,Finance
MBWM,Mercantile Bank Corporation Common Stock,50.28,868484479.0,138397,Finance
BHFAP,Brighthouse Financial Inc. Depositary Shares 6.6% Non-Cumulative Preferred Stock Series A,15.17,867482782.0,16208,Finance
AMTB,Amerant Bancorp Inc. Class A Common Stock,21.33,858126078.0,313558,Finance
HQH,abrdn Healthcare Investors Shares of Beneficial Interest,17.75,840351137.0,134790,Finance
ATLC,Atlanticus Holdings Corporation Common Stock,56.31,840112371.0,69211,Finance
HBT,HBT Financial Inc. Common Stock,26.62,836717817.0,76195,Finance
CCNE,CNB Financial Corporation Common Stock,28.17,834854571.0,391378,Finance
CPF,Central Pacific Financial Corp New,31.51,833018054.0,202143,Finance
HBNC,Horizon Bancorp Inc. Common Stock,16.2,829860325.0,436898,Finance
BST,BlackRock Science and Technology Trust Common Shares of Beneficial Interest,37.24,825157589.0,115101,Finance
HRTG,Heritage Insurance Holdings Inc. Common Stock,26.78,822706184.0,354451,Finance
DCOMP,Dime Community Bancshares Inc. Fixed-Rate Non-Cumulative Perpetual Preferred Stock Series A,18.7,821040106.0,3589,Finance
AEF,abrdn Emerging Markets ex-China Fund Inc. Common Stock,7.64,820249500.0,142004,Finance
MCBS,MetroCity Bankshares Inc. Common Stock,28.29,813485400.0,167758,Finance
PFLT,PennantPark Floating Rate Capital Ltd. Common Stock,8.19,812594568.0,1033931,Finance
BCSF,Bain Capital Specialty Finance Inc. Common Stock,12.47,808910282.0,456347,Finance
RPC,Ridgepost Capital Inc. Class A Common Stock,7.36,805961032.0,1913964,Finance
FSBC,Five Star Bancorp Common Stock,37.54,802460784.0,87435,Finance
CGBD,Carlyle Secured Lending Inc. Common Stock,11.26,795822153.0,729060,Finance
CAC,Camden National Corporation Common Stock,46.565,788127945.0,183081,Finance
NMFC,New Mountain Finance Corporation Common Stock,7.8,786291285.0,910262,Finance
SLRC,SLR Investment Corp. Common Stock,14.4,785586730.0,228446,Finance
NAVI,Navient Corporation Common Stock,8.24,783538864.0,910218,Finance
HAFC,Hanmi Financial Corporation Common Stock,26.2,783185832.0,316276,Finance
EIG,Employers Holdings Inc Common Stock,40.06,780448800.0,274099,Finance
BULLW,Webull Corporation Warrants,1.55,779528776.0,4031,Finance
FCBC,First Community Bankshares Inc. (VA) Common Stock,40.76,777498141.0,111330,Finance
RILYK,BRC Group Holdings Inc. 5.50% Senior Notes Due 2026,25.185,768068607.0,20922,Finance
HTBK,Heritage Commerce Corp Common Stock,12.43,765604520.0,1106870,Finance
TRST,TrustCo Bank Corp NY Common Stock,43.19,764916927.0,170863,Finance
CCNEP,CNB Financial Corporation Depositary Shares each representing a 1/40th ownership interest in a share of 7.125% Series A Fixed-Rate Non-Cumulative Perpetual Preferred Stock,25.25,748316575.0,9,Finance
SKYH,Sky Harbour Group Corporation Class A Common Stock,9.8,746380544.0,470350,Finance
FPH,Five Point Holdings LLC Class A Common Shares,5.06,745978171.0,318557,Finance
THFF,First Financial Corporation Common Stock,62.61,744551609.0,132444,Finance
EGBN,Eagle Bancorp Inc. Common Stock,24.43,741779010.0,493757,Finance
CCBG,Capital City Bank Group Common Stock,42.92,736175042.0,128591,Finance
MPB,Mid Penn Bancorp Common Stock,31.66,733757099.0,251323,Finance
BOW,Bowhead Specialty Holdings Inc. Common Stock,22.24,730317898.0,189806,Finance
RILYN,BRC Group Holdings Inc. 6.50% Senior Notes Due 2026,23.735,723847862.0,42012,Finance
HTB,HomeTrust Bancshares Inc. Common Stock,42.39,717597123.0,112631,Finance
EFSCP,Enterprise Financial Services Corporation Depositary Shares Each Representing a 1/40th Interest in a Share of 5% Fixed Rate Non-Cumulative Perpetual Preferred Stock Series A,19.41,714598793.0,1243,Finance
ROOT,Root Inc. Class A Common Stock,45.79,712247149.0,262210,Finance
CUBB,Customers Bancorp Inc 5.375% Subordinated Notes Due 2034,22.4,708366176.0,205,Finance
PRAA,PRA Group Inc. Common Stock,18.38,706772463.0,435200,Finance
SMBC,Southern Missouri Bancorp Inc. Common Stock,63.24,702487564.0,67282,Finance
BHFAN,Brighthouse Financial Inc. Depositary shares each representing a 1/1000th interest in a share of 5.375% Non-Cumulative Preferred Stock Series C,12.26,701077054.0,35349,Finance
ORRF,Orrstown Financial Services Inc. Common Stock,35.43,695129443.0,204503,Finance
VEL,Velocity Financial Inc. Common Stock,17.55,688579182.0,90197,Finance
NEWTP,NewtekOne Inc. Depositary Shares Non-Cumulative Perpetual Preferred Stock Series B,23.8799,688493122.0,7278,Finance
OPFI,OppFi Inc. Class A Common Stock,8.07,686957548.0,360851,Finance
GSBC,Great Southern Bancorp Inc. Common Stock,62.58,686072863.0,69749,Finance
RILYG,BRC Group Holdings Inc. 5.00% Senior Notes due 2026,22.45,684659132.0,46553,Finance
HIPO,Hippo Holdings Inc. Common Stock,26.21,680699333.0,115336,Finance
SPFI,South Plains Financial Inc. Common Stock,41.62,679713784.0,111870,Finance
GEMI,Gemini Space Station Inc. Class A Common Stock,5.77,678861953.0,2074028,Finance
TBLD,Thornburg Income Builder Opportunities Trust Common Stock,21.09,676606912.0,51351,Finance
IBCP,Independent Bank Corporation Common Stock,32.84,676124567.0,252037,Finance
OPENW,Opendoor Technologies Inc  Series K Warrants each whole warrant exercisable to purchase one share of Common Stock at an exercise price of $9.00 per warrant,0.7051,675715297.0,240098,Finance
WRLD,World Acceptance Corporation Common Stock,136.31,672945976.0,189389,Finance
DGICB,Donegal Group Inc. Class B Common Stock,18.18,672713886.0,2871,Finance
FDUS,Fidus Investment Corporation Common Stock,17.67,670653612.0,538691,Finance
NXP,Nuveen Select Tax Free Income Portfolio Common Stock,14.33,670631289.0,240409,Finance
NEWTI,NewtekOne Inc. 8.00% Fixed Rate Senior Notes due 2028,25.3,665942856.0,189,Finance
MGRE,Affiliated Managers Group Inc. 6.750% Junior Subordinated Notes due 2064,23.29,661716947.0,29222,Finance
SMBK,SmartFinancial Inc. Common Stock,38.67,661139791.0,90236,Finance
PURR,Hyperliquid Strategies Inc Common Stock,5.29,655788117.0,5717120,Finance
DLY,DoubleLine Yield Opportunities Fund Common Shares of Beneficial Interest,13.67,655418799.0,235002,Finance
NEWTG,NewtekOne Inc. 8.50% Fixed Rate Senior Notes due 2029,24.8,652781930.0,5588,Finance
NIE,Virtus Equity & Convertible Income Fund Common Shares of Beneficial Interest,23.44,649498140.0,117142,Finance
VMO,Invesco Municipal Opportunity Trust Common Stock,9.58,646081762.0,223838,Finance
LIFE,Ethos Technologies Inc. Class A Common Stock,10.13,636869585.0,452015,Finance
DGICA,Donegal Group Inc. Class A Common Stock,17.21,636821010.0,105559,Finance
FOF,Cohen & Steers Closed-End Opportunity Fund Inc. Common Stock,12.91,634379687.0,144971,Finance
WASH,Washington Trust Bancorp Inc. Common Stock,32.91,626604689.0,197161,Finance
GDOT,Green Dot Corporation Class A Common Stock $0.001 par value,11.27,626246717.0,740314,Finance
BHFAM,Brighthouse Financial Inc. Depositary shares each representing a 1/1000th Interest in a Share of 4.625% Non-Cumulative Preferred Stock Series D,10.95,626165884.0,31124,Finance
TCBX,Third Coast Bancshares Inc. Common Stock,37.86,624151707.0,82974,Finance
AMSF,AMERISAFE Inc. Common Stock,33.1,622110561.0,241788,Finance
TIPT,Tiptree Inc. Common Stock,16.26,615880947.0,296894,Finance
FISI,Financial Institutions Inc. Common Stock,31.3,614550773.0,177992,Finance
ALRS,Alerus Financial Corporation Common Stock,24.01,609881876.0,147020,Finance
PGC,Peapack-Gladstone Financial Corporation Common Stock,34.54,606889388.0,162038,Finance
SHBI,Shore Bancshares Inc Common Stock,18.14,606204788.0,406038,Finance
SSSSL,SuRo Capital Corp. 6.00% Notes due 2026,24.9801,596727302.0,199,Finance
TREE,LendingTree Inc. Common Stock,42.7,591642318.0,246937,Finance
HIFS,Hingham Institution for Savings Common Stock,275.0,590535000.0,73837,Finance
IIM,Invesco Value Municipal Income Trust Common Stock,12.47,586943434.0,139924,Finance
TYG,Tortoise Energy Infrastructure Corporation Common Stock,48.88,583035899.0,110635,Finance
MGR,Affiliated Managers Group Inc. 5.875% Junior Subordinated Notes due 2059,20.27,575912517.0,15172,Finance
BWBBP,Bridgewater Bancshares Inc. Depositary Shares Each Representing a 1/100th Interest in a Share of 5.875% Non-Cumulative Perpetual Preferred Stock Series A,20.6,573186039.0,4950,Finance
NPB,Northpointe Bancshares Inc. Common Stock,16.66,572515219.0,311161,Finance
GAIN,Gladstone Investment Corporation Business Development Company,14.25,567463030.0,528599,Finance
BCAL,California BanCorp Common Stock,17.54,567013230.0,224129,Finance
NFBK,Northfield Bancorp Inc. Common Stock (Delaware),13.48,562978680.0,313941,Finance
XFLT,XAI Octagon Floating Rate & Alternative Income Trust Common Shares of Beneficial Interest,15.7,556855952.0,328743,Finance
ACIC,American Coastal Insurance Corporation Common Stock,11.36,552734489.0,152296,Finance
WYFI,WhiteFiber Inc. Ordinary Shares,14.41,551326441.0,652293,Finance
AROW,Arrow Financial Corporation Common Stock,33.32,550167945.0,144880,Finance
VGM,Invesco Trust for Investment Grade Municipals Common Stock (DE),10.07,546115918.0,130772,Finance
RFI,Cohen & Steers Total Return Realty Fund Inc. Common Stock,10.93,537085204.0,57258,Finance
BHB,Bar Harbor Bankshares Inc. Common Stock,32.0,535747328.0,118029,Finance
RILYT,BRC Group Holdings Inc. 6.00% Senior Notes Due 2028,17.51,534003626.0,16186,Finance
VKQ,Invesco Municipal Trust Common Stock,9.55,528454168.0,140418,Finance
PFIS,Peoples Financial Services Corp. Common Stock,52.76,527549825.0,49471,Finance
BME,Blackrock Health Sciences Trust,39.34,524520928.0,102707,Finance
RMT,Royce Micro-Cap Trust Inc. Common Stock,11.32,523766291.0,166520,Finance
MSBIP,Midland States Bancorp Inc. Depositary Shares Each Representing a 1/40th Interest in a Share of 7.750% Fixed-Rate Reset Non-Cumulative Perpetual Preferred Stock Series A,24.95,523690246.0,2373,Finance
IQI,Invesco Quality Municipal Income Trust Common Stock,9.84,520376562.0,92730,Finance
FFIC,Flushing Financial Corporation Common Stock,15.18,514353443.0,303304,Finance
ALTI,AlTi Global Inc. Class A Common Stock,3.5,513286806.0,164438,Finance
VCV,Invesco California Value Municipal Income Trust Common Stock,10.7,512428618.0,100864,Finance
TRC,Tejon Ranch Co Common Stock,18.9,508980723.0,134462,Finance
UNTY,Unity Bancorp Inc. Common Stock,50.76,508433835.0,49174,Finance
BTBT,Bit Digital Inc. Ordinary Shares,1.57,508169485.0,13171952,Finance
NRIM,Northrim BanCorp Inc Common Stock,22.85,505624115.0,189576,Finance
RILYZ,BRC Group Holdings Inc. 5.25% Senior Notes due 2028,16.27,496187264.0,14584,Finance
FTHY,First Trust High Yield Opportunities 2027 Term Fund Common Stock,13.48,495699892.0,127015,Finance
ACNB,ACNB Corporation Common Stock,47.25,489202970.0,67947,Finance
FFWM,First Foundation Inc. Common Stock,5.85,485118808.0,1005295,Finance
FMNB,Farmers National Banc Corp. Common Stock,12.84,484565666.0,418739,Finance
BSTZ,BlackRock Science and Technology Term Trust Common Shares of Beneficial Interest,21.83,483705429.0,108458,Finance
CBNK,Capital Bancorp Inc. Common Stock,29.5,482910398.0,83376,Finance
BWB,Bridgewater Bancshares Inc. Common Stock,17.34,482477957.0,115365,Finance
CCAP,Crescent Capital BDC Inc. Common stock,13.01,480364223.0,215979,Finance
HBCP,Home Bancorp Inc. Common Stock,60.47,473863843.0,110293,Finance
KRNY,Kearny Financial Corp Common Stock,7.31,473243194.0,429044,Finance
MGRB,Affiliated Managers Group Inc. 4.750% Junior Subordinated Notes due 2060,16.62,472208487.0,15760,Finance
CIVB,Civista Bancshares Inc. Common Stock,22.53,467166061.0,80382,Finance
DHIL,Diamond Hill Investment Group Inc. Class A Common Stock,172.63,467028886.0,12494,Finance
MSBI,Midland States Bancorp Inc. Common Stock,21.7,455474081.0,127236,Finance
AHRT,AH Realty Trust Inc. Common Stock,5.61,449791225.0,2592323,Finance
CARE,Carter Bankshares Inc. Common Stock,20.28,449495107.0,354620,Finance
FBIZ,First Business Financial Services Inc. Common Stock,53.27,444422394.0,33499,Finance
ETO,Eaton Vance Tax-Advantage Global Dividend Opp Common Stock,27.09,443954658.0,24573,Finance
SFST,Southern First Bancshares Inc. Common Stock,53.36,439216725.0,71593,Finance
BSRR,Sierra Bancorp Common Stock,33.3,439110550.0,92505,Finance
CWBC,Community West Bancshares Common Stock,22.73,435720803.0,170278,Finance
GUT,Gabelli Utility Trust (The) Common Stock,5.93,435256242.0,225943,Finance
OBT,Orange County Bancorp Inc. Common Stock,31.97,427389251.0,56810,Finance
ETB,Eaton Vance Tax-Managed Buy-Write Income Fund Eaton Vance Tax-Managed Buy-Write Income Fund Common Shares of Beneficial Interest,14.54,427060127.0,34303,Finance
MGRD,Affiliated Managers Group Inc. 4.200% Junior Subordinated Notes due 2061,14.9,423339739.0,4677,Finance
EVN,Eaton Vance Municipal Income Trust Common Stock,10.56,418885241.0,93038,Finance
COFS,ChoiceOne Financial Services Inc. Common Stock,27.88,417695846.0,69956,Finance
HQL,abrdn Life Sciences Investors Shares of Beneficial Interest,16.18,415496510.0,107966,Finance
GBLI,Global Indemnity Group LLC Class A Common Stock ,28.98,415108187.0,1431,Finance
CBAN,Colony Bankcorp Inc. Common Stock,19.46,411896490.0,610159,Finance
FRPH,FRP Holdings Inc. Common Stock,21.45,410027947.0,92589,Finance
ITIC,Investors Title Company Common Stock,215.52,406809948.0,9183,Finance
PDLB,Ponce Financial Group Inc. Common Stock,16.62,401486531.0,84461,Finance
WTBA,West Bancorporation Common Stock,23.64,400480157.0,38910,Finance
SAJ,Saratoga Investment Corp 8.00% Notes due 2027,25.55,400320747.0,89,Finance
