symbol,name,price,marketCap,volume,industry
MPA,Blackrock MuniYield Pennsylvania Quality Fund Common Stock,11.32,0.0,17274,Finance
CGCT,Cartesian Growth Corporation III Class A Ordinary Shares,10.3067,0.0,53817,Finance
FFA,First Trust Enhanced Equity Income Fund Common Shares of Beneficial Interest,22.12,0.0,42559,Finance
EOI,Eaton Vance Enhance Equity Income Fund Eaton Vance Enhanced Equity Income Fund Shares of Beneficial Interest,21.09,0.0,228197,Finance
EOD,Allspring Global Dividend Opportunity Fund Common Shares of Beneficial Interest,6.0,0.0,158722,Finance
KCHVR,Kochav Defense Acquisition Corp. Right,0.2506,0.0,122878,Finance
KBONU,Karbon Capital Partners Corp. Units,10.11,0.0,10058,Finance
CGCTU,Cartesian Growth Corporation III Unit,10.7499,0.0,2354,Finance
MEGI,NYLI CBRE Global Infrastructure Megatrends Term Fund Common Shares,13.76,0.0,261506,Finance
SCD,LMP Capital and Income Fund Inc. Common Stock,15.44,0.0,130074,Finance
BLZRW,Trailblazer Acquisition Corp. Warrant,0.4864,0.0,31534,Finance
CGO,Calamos Global Total Return Fund Common Stock,12.1,0.0,35731,Finance
HVIIU,Hennessy Capital Investment Corp. VII Unit,10.79,0.0,656,Finance
HVIIR,Hennessy Capital Investment Corp. VII Rights,0.275,0.0,37435,Finance
EAD,Allspring Income Opportunities Fund Common Shares,6.8,0.0,107500,Finance
HVMCU,Highview Merger Corp. Units,10.15,0.0,1175,Finance
CHACR,Crane Harbor Acquistion Corp. Rights,0.99,0.0,1025010,Finance
HPS,John Hancock Preferred Income Fund III Preferred Income Fund III,14.58,0.0,74262,Finance
VNMEW,Vendome Acquisition Corporation I Warrant,0.26,0.0,5,Finance
VNMEU,Vendome Acquisition Corporation I Unit,10.2,0.0,42,Finance
KKRT,KKR & Co. Inc. 6.875% Subordinated Notes due 2065,25.31,0.0,74473,Finance
KIO,KKR Income Opportunities Fund Common Shares,11.72,0.0,168480,Finance
AGD,abrdn Global Dynamic Dividend Fund Common Shares of Beneficial Interest,12.34,0.0,114577,Finance
CHI,Calamos Convertible Opportunities and Income Fund Common Stock,11.12,0.0,210427,Finance
MHF,Western Asset Municipal High Income Fund Inc. Common Stock,6.97,0.0,61573,Finance
MKLYU,McKinley Acquisition Corporation Units,10.13,0.0,3800,Finance
VNME,Vendome Acquisition Corporation I Class A Ordinary Shares,10.04,0.0,25,Finance
BLZR,Trailblazer Acquisition Corp. Class A Ordinary Shares,10.04,0.0,32957,Finance
BLE,BlackRock Municipal Income Trust II,10.59,0.0,96974,Finance
BNY,BlackRock New York Municipal Income Trust,10.27,0.0,36229,Finance
ASGI,abrdn Global Infrastructure Income Fund Common Shares of Beneficial Interest,21.45,0.0,310378,Finance
ASG,Liberty All-Star Growth Fund Inc.,5.49,0.0,145353,Finance
SRV,NXG Cushing Midstream Energy Fund Common Shares of Beneficial Interest,40.02,0.0,68665,Finance
PDT,John Hancock Premium Dividend Fund,12.72,0.0,99669,Finance
JMM,Nuveen Multi-Market Income Fund (MA),6.09,0.0,11465,Finance
CEE,The Central and Eastern Europe Fund Inc. (The) Common Stock,17.69,0.0,21566,Finance
JRS,Nuveen Real Estate Income Fund Common Shares of Beneficial Interest,7.71,0.0,109733,Finance
JRI,Nuveen Real Asset Income and Growth Fund Common Shares of Beneficial Interest,13.82,0.0,117410,Finance
ALDFW,Aldel Financial II Inc. Warrants,0.55,0.0,1600,Finance
ALCYW,Alchemy Investments Acquisition Corp 1 Warrants,0.4477,0.0,2000,Finance
ALCYU,Alchemy Investments Acquisition Corp 1 Units,15.0,0.0,6,Finance
ALCY,Alchemy Investments Acquisition Corp 1 Class A Ordinary Shares,12.0,0.0,87393,Finance
MXE,Mexico Equity and Income Fund Inc. (The) Common Stock,12.61,0.0,4560,Finance
JLS,Nuveen Mortgage and Income Fund,18.379,0.0,12588,Finance
JGH,Nuveen Global High Income Fund Common Shares of Beneficial Interest,12.88,0.0,203142,Finance
JFR,Nuveen Floating Rate Income Fund Common Stock,7.98,0.0,1106551,Finance
SDHIU,Siddhi Acquisition Corp Unit,10.46,0.0,208,Finance
GOF,Guggenheim Strategic Opportunities Fund Common Shares of Beneficial Interest,13.02,0.0,1170375,Finance
RIV,RiverNorth Opportunities Fund Inc. Common Stock,12.02,0.0,170242,Finance
BHK,Blackrock Core Bond Trust,9.67,0.0,146368,Finance
BFK,BlackRock Municipal Income Trust,10.09,0.0,100697,Finance
ALISR,Calisa Acquisition Corp Right,0.57,0.0,110,Finance
MYN,Blackrock MuniYield New York Quality Fund Inc.Common Stock,10.02,0.0,82822,Finance
MXF,Mexico Fund Inc. (The) Common Stock,20.64,0.0,62768,Finance
HPI,John Hancock Preferred Income Fund Common Shares of Beneficial Interest,16.27,0.0,84542,Finance
GJT,Synthetic Fixed-Income Securities Inc. Floating Rate Structured Repackaged Asset-Backed Trust Securities Certificates Series 2006-3,22.8999,0.0,4,Finance
GJR,Synthetic Fixed-Income Securities Inc. STRATS Trust for Procter&Gamble Securities Series 2006-1,24.85,0.0,5801,Finance
DNP,DNP Select Income Fund Inc. Common Stock,9.99,0.0,548253,Finance
CEPT,Cantor Equity Partners II Inc. Class A Ordinary Share,11.11,0.0,154694,Finance
CEPO,Cantor Equity Partners I Inc. Class A Ordinary Shares,10.44,0.0,23868,Finance
CEPF,Cantor Equity Partners IV Inc. Class A Ordinary Shares,10.32,0.0,40104,Finance
USA,Liberty All-Star Equity Fund Common Stock,6.38,0.0,1194866,Finance
BOE,Blackrock Enhanced Global Dividend Trust Common Shares of Beneficial Interest,12.0,0.0,232101,Finance
HYT,Blackrock Corporate High Yield Fund Inc. Common Stock,8.83,0.0,1633457,Finance
SPXX,Nuveen S&P 500 Dynamic Overwrite Fund,18.24,0.0,43078,Finance
SPE,Special Opportunities Fund Inc Common Stock,15.03,0.0,40292,Finance
PGP,Pimco Global StocksPlus & Income Fund Common Shares of Beneficial Interest,9.1,0.0,46217,Finance
UYSC,UY Scuti Acquisition Corp. Ordinary Shares,10.29,0.0,3306,Finance
EMF,Templeton Emerging Markets Fund Common Stock,18.36,0.0,86049,Finance
EMD,Western Asset Emerging Markets Debt Fund Inc Common Stock,10.85,0.0,237860,Finance
FGSN,F&G Annuities & Life Inc. 7.300% Junior Subordinated Notes due 2065,22.12,0.0,106215,Finance
UTG,Reaves Utility Income Fund Common Shares of Beneficial Interest,37.08,0.0,172489,Finance
JQC,Nuveen Credit Strategies Income Fund Shares of Beneficial Interest,5.16,0.0,1205130,Finance
JPC,Nuveen Preferred & Income Opportunities Fund,8.17,0.0,1119159,Finance
JOF,Japan Smaller Capitalization Fund Inc Common Stock,11.2,0.0,98299,Finance
CUBWU,Lionheart Holdings Unit,11.24,0.0,442,Finance
MSD,Morgan Stanley Emerging Markets Debt Fund Inc. Common Stock,7.44,0.0,212702,Finance
VCICU,Vine Hill Capital Investment Corp. Unit,11.25,0.0,9,Finance
VBF,Invesco Bond Fund Common Stock,15.45,0.0,39018,Finance
UTF,Cohen & Steers Infrastructure Fund Inc Common Stock,24.42,0.0,388253,Finance
DPG,Duff & Phelps Utility and Infrastructure Fund Inc.,12.9,0.0,57320,Finance
ADACU,American Drive Acquisition Company Units,10.0,0.0,7117,Finance
WLACW,Willow Lane Acquisition Corp. Warrants,3.92,0.0,7438,Finance
WLAC,Willow Lane Acquisition Corp. Class A Ordinary Shares,12.7,0.0,202781,Finance
LPCVU,Launchpad Cadenza Acquisition Corp I Unit,10.04,0.0,4140,Finance
ESHA,ESH Acquisition Corp. Class A Common Stock,12.47,0.0,25362,Finance
ERC,Allspring Multi-Sector Income Fund Common Stock,9.34,0.0,73275,Finance
EXG,Eaton Vance Tax-Managed Global Diversified Equity Income Fund Common Shares of Beneficial Interest,9.74,0.0,576538,Finance
CRAN,Crane Harbor Acquisition Corp. II Class A Ordinary Shares,9.9,0.0,9371,Finance
WLACU,Willow Lane Acquisition Corp. Unit,15.0,0.0,46,Finance
CRANR,Crane Harbor Acquisition Corp. II Rights,0.231,0.0,255321,Finance
ESHAR,ESH Acquisition Corp. Right,0.22,0.0,3137,Finance
WIW,Western Asset Inflation-Linked Opportunities & Income Fund,8.61,0.0,226759,Finance
WIA,Western Asset Inflation-Linked Income Fund,8.27,0.0,27090,Finance
KTN,Structured Products Corp 8.205% CorTS 8.205% Corporate Backed Trust Securities (CorTS),25.64,0.0,1664,Finance
KTH,Structures Products Cp 8% CorTS Issued by Peco Energy Cap Tr II Preferred Stock,28.805,0.0,621,Finance
RTACW,Renatus Tactical Acquisition Corp I Warrant,0.939,0.0,87629,Finance
RTACU,Renatus Tactical Acquisition Corp I Unit,11.2,0.0,701,Finance
RTAC,Renatus Tactical Acquisition Corp I Class A Ordinary Shares,10.83,0.0,175099,Finance
BCARW,D. Boral ARC Acquisition I Corp. Warrant,1.1,0.0,5336460,Finance
BCARU,D. Boral ARC Acquisition I Corp. Units,10.95,0.0,28503,Finance
DSU,Blackrock Debt Strategies Fund Inc. Common Stock,10.32,0.0,585033,Finance
BACC,Blue Acquisition Corp. Class A Ordinary Shares,10.24,0.0,376,Finance
ETJ,Eaton Vance Risk-Managed Diversified Equity Income Fund Common Shares of Beneficial Interest,8.97,0.0,231486,Finance
PNI,Pimco New York Municipal Income Fund II Common Shares of Beneficial Interest,6.99,0.0,13635,Finance
LOKVU,Live Oak Acquisition Corp. V Units,10.99,0.0,124,Finance
PMTRW,Perimeter Acquisition Corp. I Warrant,0.9501,0.0,76204,Finance
PMTRU,Perimeter Acquisition Corp. I Unit,10.66,0.0,686,Finance
PMTR,Perimeter Acquisition Corp. I Class A Ordinary Shares,10.43,0.0,33955,Finance
LCCC,Lakeshore Acquisition III Corp. Ordinary Shares,10.19,0.0,205,Finance
ETG,Eaton Vance Tax-Advantaged Global Dividend Income Fund Common Shares of Beneficial Interest,23.4,0.0,110059,Finance
XRPNW,Armada Acquisition Corp. II Warrant,0.85,0.0,31805,Finance
EVV,Eaton Vance Limited Duration Income Fund Common Shares of Beneficial Interest,10.01,0.0,239839,Finance
EVT,Eaton Vance Tax Advantaged Dividend Income Fund Common Shares of Beneficial Interest,25.87,0.0,84867,Finance
EVOXW,Evolution Global Acquisition Corp Warrants,0.56,0.0,65998,Finance
EVOXU,Evolution Global Acquisition Corp Units,10.13,0.0,533,Finance
CRBD,Corebridge Financial Inc. 6.375% Junior Subordinated Notes due 2064,23.76,0.0,45221,Finance
CRAQU,Cal Redwood Acquisition Corp. Units,10.32,0.0,201,Finance
CRAQR,Cal Redwood Acquisition Corp. Right,0.2604,0.0,109349,Finance
ACP,abrdn Income Credit Strategies Fund Common Shares,5.62,0.0,729070,Finance
LPAAW,Launch One Acquisition Corp. Warrant,0.25,0.0,403,Finance
ZTR,Virtus Total Return Fund Inc.,6.3,0.0,185746,Finance
BACQR,Inflection Point Acquisition Corp. IV Right,0.78,0.0,27383,Finance
GUG,Guggenheim Active Allocation Fund Common Shares of Beneficial Interest,15.93,0.0,91399,Finance
GGN,GAMCO Global Gold Natural Resources & Income Trust,5.32,0.0,701249,Finance
GF,New Germany Fund Inc. (The) Common Stock,12.18,0.0,21393,Finance
CHY,Calamos Convertible and High Income Fund Common Stock,11.69,0.0,322365,Finance
MCGAU,Yorkville Acquisition Corp. Unit,10.3,0.0,3267,Finance
CRF,Cornerstone Total Return Fund Inc. (The) Common Stock,8.14,0.0,1703680,Finance
CRAQ,Cal Redwood Acquisition Corp. Class A Ordinary Shares,10.1,0.0,100305,Finance
FCO,abrdn Global Income Fund Inc. Common Stock,2.95,0.0,92995,Finance
MBAVW,M3-Brigade Acquisition V Corp. Warrant,0.9333,0.0,16253,Finance
MACIW,Melar Acquisition Corp. I Warrant,0.1578,0.0,482,Finance
FAX,abrdn Asia-Pacific Income Fund Inc. Common Stock,15.35,0.0,266608,Finance
BDCIW,BTC Development Corp. Warrant,0.63,0.0,178,Finance
BDCIU,BTC Development Corp. Unit,10.14,0.0,1126,Finance
FCT,First Trust Senior Floating Rate Income Fund II Common Shares of Beneficial Interest,9.99,0.0,117122,Finance
SORNU,Soren Acquisition Corp. Unit,9.965,0.0,337788,Finance
PHK,Pimco High Income Fund,4.91,0.0,624498,Finance
ALFUW,Centurion Acquisition Corp. Warrant,0.26,0.0,504303,Finance
BACCU,Blue Acquisition Corp. Unit,10.7,0.0,1,Finance
BACCR,Blue Acquisition Corp. Right ,0.31,0.0,15,Finance
DMIIR,Drugs Made In America Acquisition II Corp. Right,0.1151,0.0,6245,Finance
DMII,Drugs Made In America Acquisition II Corp. Ordinary Shares,9.93,0.0,85662,Finance
VVR,Invesco Senior Income Trust Common Stock (DE),3.3,0.0,1016360,Finance
CIK,Credit Suisse Asset Management Income Fund Inc. Common Stock,2.86,0.0,354033,Finance
CIF,MFS Intermediate High Income Fund Common Stock,1.72,0.0,17066,Finance
CICB,CION Investment Corporation 7.50% Notes due 2029,25.35,0.0,13021,Finance
MBVIU,M3-Brigade Acquisition VI Corp. Units,10.28,0.0,2754,Finance
AFB,AllianceBernstein National Municipal Income Fund Inc,10.94,0.0,53133,Finance
HTD,John Hancock Tax Advantaged Dividend Income Fund Common Shares of Beneficial Interest,23.94,0.0,68910,Finance
HSPTR,Horizon Space Acquisition II Corp. Right,0.176,0.0,56,Finance
PML,Pimco Municipal Income Fund II Common Shares of Beneficial Interest,7.65,0.0,199348,Finance
GIG,GigCapital7 Corp. Class A Ordinary Share,10.53,0.0,71822,Finance
GHY,PGIM Global High Yield Fund Inc.,12.65,0.0,233508,Finance
WENNW,Wen Acquisition Corp Warrant,0.4026,0.0,81603,Finance
WENNU,Wen Acquisition Corp Unit,10.3,0.0,33,Finance
BDCI,BTC Development Corp. Class A Ordinary Shares,10.05,0.0,6045,Finance
ADX,Adams Diversified Equity Fund Inc.,23.34,0.0,451992,Finance
FACTW,FACT II Acquisition Corp. Warrant,0.52,0.0,24711,Finance
FACTU,FACT II Acquisition Corp. Unit,10.75,0.0,5576,Finance
CLM,Cornerstone Strategic Investment Fund Inc. Common Shares,8.5,0.0,2729102,Finance
LWACW,LightWave Acquisition Corp. Warrants,0.28,0.0,30132,Finance
LWACU,LightWave Acquisition Corp. Units,10.2,0.0,1062,Finance
BCV,Bancroft Fund Ltd.,23.43,0.0,11034,Finance
SBI,Western Asset Intermediate Muni Fund Inc Common Stock,7.84,0.0,34368,Finance
GRF,Eagle Capital Growth Fund Inc. Common Stock,11.05,0.0,559,Finance
BCAR,D. Boral ARC Acquisition I Corp. Class A Ordinary Shares,10.35,0.0,12283360,Finance
DNMXW,Dynamix Corporation III Warrants,0.33,0.0,165685,Finance
DNMXU,Dynamix Corporation III Unit,10.12,0.0,19615,Finance
DNMX,Dynamix Corporation III Class A Ordinary Shares,9.9202,0.0,169350,Finance
DMO,Western Asset Mortgage Opportunity Fund Inc. Common Stock,11.14,0.0,50185,Finance
WEA,Western Asset Bond Fund Share of Beneficial Interest,11.24,0.0,15966,Finance
MACIU,Melar Acquisition Corp. I Unit,11.4,0.0,1571,Finance
HSPT,Horizon Space Acquisition II Corp. Ordinary share,10.58,0.0,2082,Finance
ATIIW,Archimedes Tech SPAC Partners II Co. Warrant,0.6282,0.0,10735,Finance
HPF,John Hancock Pfd Income Fund II Pfd Income Fund II,16.15,0.0,32410,Finance
WDI,Western Asset Diversified Income Fund Common Shares of Beneficial Interest,13.84,0.0,167404,Finance
TEI,Templeton Emerging Markets Income Fund Inc. Common Stock,6.64,0.0,186514,Finance
TDWDR,Tailwind 2.0 Acquisition Corp. Rights,0.165,0.0,26900,Finance
IIF,Morgan Stanley India Investment Fund Inc. Common Stock,24.45,0.0,48684,Finance
NZF,Nuveen Municipal Credit Income Fund ,12.69,0.0,766481,Finance
BYM,Blackrock Municipal Income Quality Trust Common Shares of Beneficial Interest,11.08,0.0,96740,Finance
BXMX,Nuveen S&P 500 Buy-Write Income Fund Common Shares of Beneficial Interest,14.79,0.0,162727,Finance
EFR,Eaton Vance Senior Floating-Rate Fund Common Shares of Beneficial Interest,11.34,0.0,71102,Finance
AOMN,Angel Oak Mortgage REIT Inc. 9.500% Senior Notes due 2029,25.7501,0.0,10299,Finance
AOMD,Angel Oak Mortgage REIT Inc. 9.750% Senior Notes due 2030,25.655,0.0,1382,Finance
CAF,Morgan Stanley China A Share Fund Inc. Common Stock,18.04,0.0,29590,Finance
BKN,BlackRock Investment Quality Municipal Trust Inc. (The),11.37,0.0,16706,Finance
EDD,Morgan Stanley Emerging Markets Domestic Debt Fund Inc. Common Stock,5.69,0.0,345141,Finance
SVAQU,Silicon Valley Acquisition Corp. Units,9.98,0.0,15584,Finance
SVACW,Spring Valley Acquisition Corp. III Warrant,0.7,0.0,1166,Finance
SVACU,Spring Valley Acquisition Corp. III Unit,10.49,0.0,802,Finance
SVAC,Spring Valley Acquisition Corp. III Class A Ordinary Shares,10.28,0.0,17680,Finance
QSEAU,Quartzsea Acquisition Corporation Units,10.4,0.0,10,Finance
PTY,Pimco Corporate & Income Opportunity Fund,13.07,0.0,627238,Finance
QETAR,Quetta Acquisition Corporation Right,1.45,0.0,1209,Finance
QETA,Quetta Acquisition Corporation Common Stock,11.325,0.0,122114,Finance
APXTU,Apex Treasury Corporation Units,10.02,0.0,287,Finance
TDWD,Tailwind 2.0 Acquisition Corp. Class A Ordinary Shares,9.91,0.0,18607,Finance
TDF,Templeton Dragon Fund Inc. Common Stock,11.75,0.0,162446,Finance
DYOR,Insight Digital Partners II Class A Ordinary Shares,9.94,0.0,145437,Finance
SIMAW,SIM Acquisition Corp. I Warrant,0.24,0.0,1,Finance
GIGGW,GigCapital7 Corp. Warrant,0.77,0.0,41323,Finance
THW,abrdn World Healthcare Fund Shares of Beneficial Interest,12.78,0.0,239553,Finance
THQ,abrdn Healthcare Opportunities Fund Shares of Beneficial Interest,19.82,0.0,205325,Finance
OACCW,Oaktree Acquisition Corp. III Life Sciences Warrant,0.928,0.0,45875,Finance
OACCU,Oaktree Acquisition Corp. III Life Sciences Unit,10.8,0.0,1025,Finance
OACC,Oaktree Acquisition Corp. III Life Sciences Class A Ordinary Share,10.62,0.0,1994,Finance
NXJ,Nuveen New Jersey Qualified Municipal Fund ,12.63,0.0,214214,Finance
NVG,Nuveen AMT-Free Municipal Credit Income Fund ,12.78,0.0,717859,Finance
NUW,Nuveen AMT-Free Municipal Value Fund,14.4424,0.0,34928,Finance
APACU,StoneBridge Acquisition II Corporation Units,10.12,0.0,1400,Finance
TLNCU,Talon Capital Corp. Units,10.29,0.0,1001,Finance
RA,Brookfield Real Assets Income Fund Inc. Common Stock,12.95,0.0,234380,Finance
DAAQU,Digital Asset Acquisition Corp. Units,10.89,0.0,3906,Finance
GLO,Clough Global Opportunities Fund Common Stock,5.99,0.0,410185,Finance
BPACU,Blueport Acquisition Ltd Units,10.15,0.0,1072,Finance
OYSE,Oyster Enterprises II Acquisition Corp Class A Ordinary Shares,10.11,0.0,2,Finance
OXSQH,Oxford Square Capital Corp. 7.75% Notes due 2030,25.45,0.0,10326,Finance
BTA,BlackRock Long-Term Municipal Advantage Trust Common Shares of Beneficial Interest,9.56,0.0,19347,Finance
IDE,Voya Infrastructure Industrials and Materials Fund Common Shares of Beneficial Interest,12.61,0.0,76813,Finance
PYT,PPlus Tr GSC-2 Tr Ctf Fltg Rate,23.32,0.0,75,Finance
BIT,BlackRock Multi-Sector Income Trust Common Shares of Beneficial Interest,13.3,0.0,200149,Finance
BHV,BlackRock Virginia Municipal Bond Trust,10.58,0.0,1644,Finance
BBN,BlackRock Taxable Municipal Bond Trust Common Shares of Beneficial Interest,16.46,0.0,157829,Finance
OXLCG,Oxford Lane Capital Corp. 7.95% Notes due 2032,25.22,0.0,4180,Finance
BUI,BlackRock Utility Infrastructure & Power Opportunities Trust,25.96,0.0,75459,Finance
SWZ,Total Return Securities Fund Common Stock,6.27,0.0,107183,Finance
SVCCW,Stellar V Capital Corp. Warrant,0.3301,0.0,405,Finance
PAI,Western Asset Investment Grade Income Fund Inc.,12.55,0.0,7370,Finance
TACHU,Titan Acquisition Corp. Units,10.45,0.0,3,Finance
BTT,BlackRock Municipal 2030 Target Term Trust,22.76,0.0,91325,Finance
EVG,Eaton Vance Short Diversified Income Fund Eaton Vance Short Duration Diversified Income Fund Common Shares of Beneficial Interest,11.02,0.0,40596,Finance
EVOX,Evolution Global Acquisition Corp Class A Ordinary Shares,9.89,0.0,100902,Finance
LCCCR,Lakeshore Acquisition III Corp. Rights,0.235,0.0,431,Finance
ETY,Eaton Vance Tax-Managed Diversified Equity Income Fund Common Shares of Beneficial Interest,15.49,0.0,311422,Finance
LDP,Cohen & Steers Limited Duration Preferred and Income Fund Inc.,21.35,0.0,42244,Finance
BACQU,Inflection Point Acquisition Corp. IV Unit,12.0,0.0,20,Finance
XRPN,Armada Acquisition Corp. II Class A Ordinary Shares,10.25,0.0,149529,Finance
AACBU,Artius II Acquisition Inc. Units,10.58,0.0,2,Finance
ZKPU,Lafayette Digital Acquisition Corp. I Unit,9.98,0.0,123904,Finance
LATA,Galata Acquisition Corp. II Class A Ordinary Shares,9.94,0.0,653,Finance
BWG,BrandywineGLOBAL Global Income Opportunities Fund Inc.,8.57,0.0,89849,Finance
IGI,Western Asset Investment Grade Opportunity Trust Inc. Common Stock,16.46,0.0,19640,Finance
IGD,Voya Global Equity Dividend and Premium Opportunity Fund,5.75,0.0,416120,Finance
IGACU,Invest Green Acquisition Corporation Units,10.15,0.0,300,Finance
IGAC,Invest Green Acquisition Corporation Class A Ordinary Shares,9.88,0.0,34201,Finance
IGA,Voya Global Advantage and Premium Opportunity Fund Common Shares of Beneficial Interest,9.8,0.0,106008,Finance
IFN,India Fund Inc. (The) Common Stock,14.0,0.0,313541,Finance
APXTW,Apex Treasury Corporation Warrants,0.2799,0.0,7463,Finance
GLQ,Clough Global Equity Fund Clough Global Equity Fund Common Shares of Beneficial Interest,8.12,0.0,83506,Finance
GJP,Synthetic Fixed-Income Securities Inc. on behalf of STRATS (SM) Trust for Dominion Resources Inc. Securities Series 2005-6 Floating Rate Structured Repackaged Asset-Backed Trust Securities (STRATS) Certificates,24.85,0.0,1,Finance
GJO,Synthetic Fixed-Income Securities Inc. on behalf of STRATS(SM) Trust for Wal-Mart Stores Inc. Securities Series 2004-5,24.8,0.0,7760,Finance
GJH,Synthetic Fixed-Income Securities Inc 6.375% (STRATS) Cl A-1,9.79,0.0,24,Finance
BIXIU,Bitcoin Infrastructure Acquisition Corp Ltd. Unit ,10.09,0.0,4640,Finance
ONCHW,1RT Acquisition Corp. Warrant,0.6,0.0,1337,Finance
ECF,Ellsworth Growth and Income Fund Ltd.,12.24,0.0,70795,Finance
GAINI,Gladstone Investment Corporation 7.875% Notes due 2030,25.855,0.0,7451,Finance
SZZLR,Sizzle Acquisition Corp. II Right,0.1825,0.0,1182,Finance
SZZL,Sizzle Acquisition Corp. II Class A ordinary shares,10.18,0.0,30435,Finance
BSL,Blackstone Senior Floating Rate 2027 Term Fund Common Shares of Beneficial Interest,13.64,0.0,42242,Finance
BRW,Saba Capital Income & Opportunities Fund SBI,6.9,0.0,231994,Finance
TBMCR,Trailblazer Merger Corporation I Rights,0.38,0.0,60038,Finance
TBMC,Trailblazer Merger Corporation I Class A Common Stock,12.35,0.0,3231,Finance
OPP,RiverNorth/DoubleLine Strategic Opportunity Fund Inc. Common Stock,7.95,0.0,67824,Finance
OTGAW,OTG Acquisition Corp. I Warrants,0.31,0.0,84,Finance
OTGAU,OTG Acquisition Corp. I Unit,10.2,0.0,7420,Finance
OTGA,OTG Acquisition Corp. I Class A Ordinary Share ,10.05,0.0,102,Finance
IHD,Voya Emerging Markets High Income Dividend Equity Fund Common Shares,6.67,0.0,120409,Finance
IGR,CBRE Global Real Estate Income Fund Common Shares of Beneficial Interest,4.72,0.0,1890755,Finance
TAVI,Tavia Acquisition Corp. Ordinary Shares,10.44,0.0,200,Finance
TACOW,Berto Acquisition Corp. Warrant,0.43,0.0,100,Finance
TACOU,Berto Acquisition Corp. Unit,10.35,0.0,21,Finance
BTO,John Hancock Financial Opportunities Fund Common Stock,35.61,0.0,46733,Finance
FMY,First Trust Mortgage Income Fund Common Shares of Beneficial Interest,12.22,0.0,2810,Finance
TWN,Taiwan Fund Inc. (The) Common Stock,54.25,0.0,40112,Finance
TWLVU,Twelve Seas Investment Company III Units,10.02,0.0,12437,Finance
TWLVR,Twelve Seas Investment Company III Rights,0.1664,0.0,410149,Finance
TWLV,Twelve Seas Investment Company III Class A Ordinary Shares,9.85,0.0,459710,Finance
NHS,Neuberger High Yield Strategies Fund Inc. Common Stock,7.46,0.0,192539,Finance
CCD,Calamos Dynamic Convertible & Income Fund Common Stock,22.16,0.0,80643,Finance
CCCXW,Churchill Capital Corp X Warrants,8.8,0.0,147444,Finance
CCCXU,Churchill Capital Corp X Unit,21.2,0.0,2056,Finance
NIM,Nuveen Select Maturities Municipal Fund Common Stock,9.41,0.0,10139,Finance
NMP,NMP Acquisition Corp. Class A Ordinary Shares,10.02,0.0,5,Finance
NML,Neuberger Energy Infrastructure and Income Fund Inc. Common Stock,8.73,0.0,192277,Finance
IPODW,Dune Acquisition Corporation II Warrants,0.2999,0.0,44,Finance
IPOD,Dune Acquisition Corporation II Class A Ordinary Shares,10.27,0.0,3001,Finance
TSI,TCW Strategic Income Fund Inc. Common Stock,4.91,0.0,46095,Finance
NHICU,NewHold Investment Corp III Units,10.53,0.0,300,Finance
NEWTH,NewtekOne Inc. 8.625% Fixed Rate Senior Notes due 2029,25.5,0.0,9932,Finance
NMAI,Nuveen Multi-Asset Income Fund Common Shares of Beneficial Interest,13.34,0.0,187707,Finance
NKX,Nuveen California AMT-Free Quality Municipal Income Fund,12.96,0.0,197338,Finance
TVAIU,Thayer Ventures Acquisition Corporation II Unit,10.31,0.0,1,Finance
ISD,PGIM High Yield Bond Fund Inc.,14.56,0.0,68417,Finance
IRHOU,Iron Horse Acquisitions II Corp. Units,9.97,0.0,4259,Finance
NFJ,Virtus Dividend Interest & Premium Strategy Fund Common Shares of Beneficial Interest,13.3,0.0,179821,Finance
NMI,Nuveen Municipal Income Fund Inc. Common Stock,10.23,0.0,20355,Finance
IAE,Voya Asia Pacific High Dividend Equity Income Fund ING Asia Pacific High Dividend Equity Income Fund Common Shares of Beneficial Interest,7.93,0.0,104061,Finance
PFO,Flaherty & Crumrine Preferred and Income Opportunity Fund Incorporated,9.54,0.0,24086,Finance
PFN,PIMCO Income Strategy Fund II,7.43,0.0,351034,Finance
PFL,PIMCO Income Strategy Fund Shares of Beneficial Interest,8.41,0.0,191609,Finance
PFD,Flaherty & Crumrine Preferred and Income Fund Incorporated,12.0,0.0,40049,Finance
PEO,Adams Natural Resources Fund Inc. Common Stock,22.83,0.0,194223,Finance
PELIU,Pelican Acquisition Corporation Unit,10.44,0.0,80,Finance
PELIR,Pelican Acquisition Corporation Right,0.5724,0.0,266745,Finance
CCCX,Churchill Capital Corp X Class A Ordinary Shares,18.06,0.0,2370712,Finance
PCQ,PIMCO California Municipal Income Fund Common Stock,8.89,0.0,61268,Finance
PCN,Pimco Corporate & Income Strategy Fund Common Stock,12.76,0.0,308973,Finance
NAC,Nuveen California Quality Municipal Income Fund,12.03,0.0,430317,Finance
JCE,Nuveen Core Equity Alpha Fund Common Shares of Beneficial Interest,16.16,0.0,100174,Finance
JBK,Lehman ABS 3.50 3.50% Adjustable Corp Backed Tr Certs GS Cap I,26.04,0.0,100,Finance
EMO,ClearBridge Energy Midstream Opportunity Fund Inc. Common Stock,46.72,0.0,82634,Finance
PELI,Pelican Acquisition Corporation Ordinary Shares,10.3,0.0,245142,Finance
NBXG,Neuberger Next Generation Connectivity Fund Inc. Common Stock,14.93,0.0,278186,Finance
NBH,Neuberger Municipal Fund Inc. Common Stock,10.31,0.0,49108,Finance
NBB,Nuveen Taxable Municipal Income Fund Common Shares of Beneficial Interest,16.05,0.0,47040,Finance
NAZ,Nuveen Arizona Quality Municipal Income Fund Common Stock,12.04,0.0,17925,Finance
HFRO,Highland Opportunities and Income Fund Common Shares of Beneficial Interest,6.19,0.0,134314,Finance
AWP,abrdn Global Premier Properties Fund Common Shares of Beneficial Interest,3.91,0.0,368271,Finance
AWF,Alliancebernstein Global High Income Fund,10.67,0.0,214451,Finance
RCG,RENN Fund Inc Common Stock,2.645,0.0,25431,Finance
IAF,abrdn Australia Equity Fund Inc. Common Stock,13.05,0.0,31367,Finance
