symbol,name,price,marketCap,volume,industry
NBHC,National Bank Holdings Corporation Common Stock,41.92,1911513601.0,206028,Finance
FCF,First Commonwealth Financial Corporation Common Stock,18.74,1905566687.0,573211,Finance
SKWD,Skyward Specialty Insurance Group Inc. Common Stock,47.0,1905524055.0,407939,Finance
STEL,Stellar Bancorp Inc. Common Stock,37.41,1904943312.0,239522,Finance
HWCPZ,Hancock Whitney Corporation 6.25% Subordinated Notes due 2060,22.22,1883255611.0,4451,Finance
TY,Tri Continental Corporation Common Stock,34.62,1881629370.0,21917,Finance
PDO,PIMCO Dynamic Income Opportunities Fund Common Shares of Beneficial Interest,12.84,1854989523.0,601655,Finance
OZKAP,Bank OZK 4.625% Series A Non-Cumulative Perpetual Preferred Stock,16.36,1850907120.0,21788,Finance
JSM,Navient Corporation 6% Senior Notes due December 15 2043,18.46,1835496961.0,16225,Finance
LC,LendingClub Corporation Common Stock,15.76,1817930578.0,1083620,Finance
MUJ,Blackrock MuniHoldings New Jersey Quality Fund Inc. Common Stock,12.055,1793331588.0,140594,Finance
RQI,Cohen & Steers Quality Income Realty Fund Inc Common Shares,13.32,1788881435.0,219242,Finance
TRINI,Trinity Capital Inc. 7.875% Notes Due 2029,25.425,1787737518.0,953,Finance
TRINZ,Trinity Capital Inc. 7.875% Notes due 2029,25.395,1785628093.0,4677,Finance
SRCE,1st Source Corporation Common Stock,73.89,1778450356.0,132905,Finance
WTFCN,Wintrust Financial Corporation Depositary Shares Each Representing a 1/1000th Interest in a Share of 7.875% Fixed-Rate Reset Non-Cumulative Perpetual Preferred StocK,26.36,1777922848.0,45354,Finance
MIY,Blackrock MuniYield Michigan Quality Fund Inc. Common Stock,11.94,1776223904.0,49061,Finance
CHCO,City Holding Company Common Stock,124.41,1755570162.0,53608,Finance
WLTH,Wealthfront Corporation Common Stock,11.7,1749178302.0,993117,Finance
ECPG,Encore Capital Group Inc Common Stock,81.57,1748894407.0,220535,Finance
KMPR,Kemper Corporation,29.66,1746209721.0,919660,Finance
AFGB,American Financial Group Inc. 5.875% Subordinated Debentures due 2059,21.01,1745638604.0,3799,Finance
CASH,Pathward Financial Inc. Common Stock,82.65,1744744310.0,154675,Finance
WD,Walker & Dunlop Inc Common Stock,50.53,1734757608.0,270328,Finance
LOB,Live Oak Bancshares Inc. Common Stock,37.41,1730676047.0,222940,Finance
PWP,Perella Weinberg Partners Class A Common Stock,18.37,1707206269.0,1112637,Finance
EFC,Ellington Financial Inc. Common Stock ,13.57,1701591478.0,1023486,Finance
MHD,Blackrock MuniHoldings Fund Inc. Common Stock,11.41,1697379794.0,304744,Finance
FSUN,FirstSun Capital Bancorp Common Stock,35.97,1681119279.0,190744,Finance
OXLC,Oxford Lane Capital Corp. Common Stock,9.65,1675240000.0,855677,Finance
BCAT,BlackRock Capital Allocation Term Trust Common Shares of Beneficial Interest,15.49,1675011150.0,423329,Finance
RZC,Reinsurance Group of America Incorporated 7.125% Fixed-Rate Reset Subordinated Debentures due 2052,25.4,1664034340.0,27567,Finance
RZB,Reinsurance Group of America Incorporated 5.75% Fixed-To-Floating Rate Subordinated Debentures due 2056,25.26,1654862497.0,87707,Finance
MQY,Blackrock MuniYield Quality Fund Inc. Common Stock,11.1,1651263428.0,294888,Finance
ECAT,BlackRock ESG Capital Allocation Term Trust Common Shares of Beneficial Interest,15.22,1645814700.0,399875,Finance
AFGD,American Financial Group Inc. 5.625% Subordinated Debentures due 2060,19.75,1640950139.0,4295,Finance
FRA,Blackrock Floating Rate Income Strategies Fund Inc  Common Stock,11.03,1640850055.0,96271,Finance
GAB,Gabelli Equity Trust Inc. (The) Common Stock,5.57,1636561876.0,1307629,Finance
GABC,German American Bancorp Inc. Common Stock,43.38,1629540028.0,193347,Finance
DCOM,Dime Community Bancshares Inc. Common Stock,36.88,1626905548.0,213706,Finance
BPOPM,Popular Inc. Popular Capital Trust II - 6.125% Cumulative Monthly Income Trust Preferred Securities,25.2,1626350267.0,1449,Finance
IIPR,Innovative Industrial Properties Inc. Common Stock,56.39,1622592363.0,219979,Finance
TCBK,TriCo Bancshares Common Stock,50.8,1621057972.0,141929,Finance
STBA,S&T Bancorp Inc. Common Stock,44.98,1618240332.0,278214,Finance
BDJ,Blackrock Enhanced Equity Dividend Trust,9.14,1617353244.0,553703,Finance
BKKT,Bakkt Inc. Class A Common Stock,12.32,1610980091.0,4813544,Finance
ETV,Eaton Vance Corporation Eaton Vance Tax-Managed Buy-Write Opportunities Fund Common Shares of Beneficial Interest,14.61,1596410579.0,177386,Finance
HOPE,Hope Bancorp Inc. Common Stock,12.45,1591594093.0,832170,Finance
BFC,Bank First Corporation Common Stock,142.37,1589300371.0,195921,Finance
MYI,Blackrock MuniYield Quality Fund III Inc Common Stock,10.68,1588783190.0,227043,Finance
TFIN,Triumph Financial Inc. Common Stock,66.66,1586924825.0,188557,Finance
FRMEP,First Merchants Corporation Depository Shares,25.05,1578719662.0,835,Finance
MUC,Blackrock MuniHoldings California Quality Fund Inc.  Common Stock,10.56,1570931694.0,245188,Finance
MUA,Blackrock MuniAssets Fund Inc Common Stock,10.53,1566468820.0,90794,Finance
RBCAA,Republic Bancorp Inc. Class A Common Stock,79.55,1560590422.0,52337,Finance
BKT,BlackRock Income Trust Inc. (The),10.38,1544154449.0,99132,Finance
NCV,Virtus Convertible & Income Fund Common Shares of Beneficial Interest,17.05,1540869351.0,143193,Finance
GAM,General American Investors Inc. Common Stock,63.92,1532520991.0,18469,Finance
KW,Kennedy-Wilson Holdings Inc. Common Stock,11.0,1532336025.0,1141580,Finance
AFGC,American Financial Group Inc. 5.125% Subordinated Debentures due 2059,18.34,1523798762.0,15569,Finance
GSHD,Goosehead Insurance Inc. Class A Common Stock,42.49,1512901234.0,450046,Finance
QCRH,QCR Holdings Inc. Common Stock,91.08,1503711582.0,76970,Finance
ECCC,Eagle Point Credit Company 6.50% Series C Term Preferred Stock due 2031,24.74,1500790844.0,698,Finance
BY,Byline Bancorp Inc. Common Stock,33.03,1499867825.0,168086,Finance
LKFN,Lakeland Financial Corporation Common Stock,60.19,1499548741.0,104640,Finance
CNOB,ConnectOne Bancorp Inc. Common Stock,29.77,1497088466.0,286590,Finance
TRIN,Trinity Capital Inc. Common Stock,16.61,1493033883.0,824167,Finance
OBK,Origin Bancorp Inc. Common Stock,47.59,1470725786.0,133336,Finance
ECCV,Eagle Point Credit Company 5.375% Notes due 2029,23.81,1444374696.0,2795,Finance
KMPB,Kemper Corporation 5.875% Fixed-Rate Reset Junior Subordinated Debentures due 2062,24.05,1415925280.0,12641,Finance
AFGE,American Financial Group Inc. 4.500% Subordinated Debentures due 2060,16.57,1376736395.0,15864,Finance
PFBC,Preferred Bank Common Stock,94.7,1359580437.0,69924,Finance
FOR,Forestar Group Inc Common Stock ,26.2,1336428805.0,171947,Finance
LIFE,Ethos Technologies Inc. Class A Common Stock,20.71,1304611166.0,994542,Finance
WABC,Westamerica Bancorporation Common Stock,55.47,1302876864.0,172309,Finance
BHRB,Burke & Herbert Financial Services Corp. Common Stock,63.46,1278706689.0,318426,Finance
PRA,ProAssurance Corporation Common Stock,24.63,1271098291.0,723857,Finance
CNOBP,ConnectOne Bancorp Inc. Depositary Shares each representing a 1/40th interest in a share of 5.25% Fixed-Rate Reset Non-Cumulative Perpetual Preferred Stock Series A,24.77,1245645996.0,4316,Finance
PEBO,Peoples Bancorp Inc. Common Stock,34.62,1243670566.0,171650,Finance
TMP,Tompkins Financial Corporation Common Stock,86.12,1238658879.0,50013,Finance
AMAL,Amalgamated Financial Corp. Common Stock (DE),41.39,1236209492.0,106418,Finance
UFCS,United Fire Group Inc. Common Stock,48.13,1234831270.0,134901,Finance
ATLC,Atlanticus Holdings Corporation Common Stock,81.61,1233779735.0,80561,Finance
CTBI,Community Trust Bancorp Inc. Common Stock,67.0,1216969307.0,91050,Finance
WAFDP,WaFd Inc. Depositary Shares,16.32,1205859994.0,15368,Finance
BULLW,Webull Corporation Warrants,2.23,1185955623.0,4196,Finance
MBINM,Merchants Bancorp Depositary Shares Each Representing a 1/40th Interest in a Share of 8.25% Fixed-Rate Reset Series D Non-Cumulative Perpetual Preferred Stock,25.605,1176176122.0,2806,Finance
NCZ,Virtus Convertible & Income Fund II Common Shares of Beneficial Interest,15.38,1170660220.0,89035,Finance
FMBH,First Mid Bancshares Inc. Common Stock,43.76,1164707233.0,91528,Finance
MBINL,Merchants Bancorp Depositary Shares Each Representing a 1/40thInterest in a Share of 7.25% Fixed Rate Series E Non-CumulativePerpetual Preferred Stock without par value,24.92,1144710367.0,15977,Finance
PURR,Hyperliquid Strategies Inc Common Stock,8.48,1141590922.0,24188245,Finance
WYFI,WhiteFiber Inc. Ordinary Shares,29.55,1141050083.0,2453049,Finance
PSEC,Prospect Capital Corporation Common Stock,2.26,1132277296.0,5452678,Finance
MCB,Metropolitan Bank Holding Corp. Common Stock,91.3,1131644966.0,88426,Finance
FINV,FinVolution Group American Depositary Shares,4.78,1128529330.0,930885,Finance
HFWA,Heritage Financial Corporation Common Stock,27.14,1118678693.0,237457,Finance
PGY,Pagaya Technologies Ltd. Class A Ordinary Shares,13.08,1110465696.0,2787788,Finance
UVE,UNIVERSAL INSURANCE HOLDINGS INC Common Stock,39.7,1108071385.0,137069,Finance
DSL,DoubleLine Income Solutions Fund Common Shares of Beneficial Interests,10.85,1106665584.0,312870,Finance
UVSP,Univest Financial Corporation Common Stock,39.31,1094618477.0,206895,Finance
OSBC,Old Second Bancorp Inc. Common Stock,21.08,1084194402.0,367292,Finance
BTZ,BlackRock Credit Allocation Income Trust,10.02,1083512700.0,361748,Finance
OCFC,OceanFirst Financial Corp. Common Stock,18.8,1082881297.0,856416,Finance
MMI,Marcus & Millichap Inc. Common Stock,28.52,1078677964.0,309310,Finance
SAFT,Safety Insurance Group Inc. Common Stock,73.23,1075267872.0,71435,Finance
CCB,Coastal Financial Corporation Common Stock,70.27,1071533738.0,150437,Finance
PTA,Cohen & Steers Tax-Advantaged Preferred Securities and Income Fund Common Shares of Beneficial Interest,19.33,1068435924.0,96957,Finance
HTFC,Horizon Technology Finance Corporation 6.25% Notes due 2027,25.0121,1064157778.0,1968,Finance
DCBG,Dime Community Bancshares Inc. 9.000% Fixed-to-Floating Rate Subordinated Notes due 2034,26.7,1045268608.0,1181,Finance
OCSL,Oaktree Specialty Lending Corporation Common Stock,11.8,1039409171.0,728094,Finance
HBT,HBT Financial Inc. Common Stock,28.48,1036133101.0,87562,Finance
OPY,Oppenheimer Holdings Inc. Class A Common Stock (DE),96.61,1034500363.0,44510,Finance
ETW,Eaton Vance Corporation Eaton Vance Tax-Managed Global Buy-Write Opportunites Fund Common Shares of Beneficial Interest,9.35,1024739299.0,172060,Finance
TWFG,TWFG Inc. Class A Common Stock,18.91,1024327715.0,207357,Finance
BCX,BlackRock Resources Common Shares of Beneficial Interest,12.05,1022539021.0,132283,Finance
RNP,Cohen & Steers REIT and Preferred and Income Fund Inc. Common Shares,20.74,1019135145.0,86978,Finance
BST,BlackRock Science and Technology Trust Common Shares of Beneficial Interest,45.82,1015271771.0,66018,Finance
NBN,Northeast Bank Common Stock,124.27,1010315100.0,199957,Finance
AEF,abrdn Emerging Markets ex-China Fund Inc. Common Stock,9.37,1005986625.0,107220,Finance
GSBD,Goldman Sachs BDC Inc. Common Stock,8.92,1004116078.0,716268,Finance
CFFN,Capitol Federal Financial Inc. Common Stock,7.79,987536952.0,718761,Finance
SIGIP,Selective Insurance Group Inc. Depositary Shares each representing a 1/1000th interest in a share of 4.60% Non-Cumulative Preferred Stock Series B,16.49,987248385.0,4398,Finance
AIZN,Assurant Inc. 5.25% Subordinated Notes due 2061,19.5,983954615.0,9419,Finance
FSCO,FS Credit Opportunities Corp. Common Stock,4.96,983845264.0,1357917,Finance
SBSI,Southside Bancshares Inc. Common Stock,32.97,980913912.0,91727,Finance
JCAP,Jefferson Capital Inc. Common Stock,17.39,963727141.0,333230,Finance
FMN,Federated Hermes Premier Municipal Income Fund,11.12,959153932.0,14715,Finance
ESQ,Esquire Financial Holdings Inc. Common Stock,111.01,959063235.0,178257,Finance
BHFAL,Brighthouse Financial Inc. 6.25% Junior Subordinated Debentures due 2058,16.6516,956564234.0,27100,Finance
VRTS,Virtus Investment Partners Inc. Common Stock,141.67,946656224.0,105541,Finance
HBNC,Horizon Bancorp Inc. Common Stock,18.42,945494253.0,282449,Finance
EQBK,Equity Bancshares Inc. Class A Common Stock,45.76,944522001.0,60596,Finance
RHLD,Resolute Holdings Management Common Stock ,114.31,943908195.0,207922,Finance
MBINN,Merchants Bancorp Depositary Shares Preferred Series C,20.525,942824249.0,16207,Finance
MCBS,MetroCity Bankshares Inc. Common Stock,32.76,938902976.0,117244,Finance
BOW,Bowhead Specialty Holdings Inc. Common Stock,28.46,934570476.0,204950,Finance
FCRX,Crescent Capital BDC Inc. 5.00% Notes due 2026,25.17,932839138.0,721,Finance
HQH,abrdn Healthcare Investors Shares of Beneficial Interest,19.59,927463592.0,159747,Finance
GAINZ,Gladstone Investment Corporation 4.875% Notes due 2028,24.1518,923063199.0,1708,Finance
TCBIO,Texas Capital Bancshares Inc. Depositary Shares 5.75% Fixed Rate Non-Cumulative Perpetual Preferred Stock Series B,21.0,917089719.0,20660,Finance
ROOT,Root Inc. Class A Common Stock,57.85,915551224.0,226638,Finance
BFST,Business First Bancshares Inc. Common Stock,28.01,915309884.0,161371,Finance
CCNE,CNB Financial Corporation Common Stock,30.81,912869891.0,122340,Finance
BHFAO,Brighthouse Financial Inc. Depositary Shares 6.75% Non-Cumulative Preferred Stock Series B,15.88,912239066.0,55571,Finance
RWAYL,Runway Growth Finance Corp. 7.50% Notes due 2027,25.16,911210461.0,11345,Finance
RPC,Ridgepost Capital Inc. Class A Common Stock,8.32,910845212.0,345062,Finance
CPF,Central Pacific Financial Corp New,34.81,908583781.0,120616,Finance
MBWM,Mercantile Bank Corporation Common Stock,52.59,908459381.0,174148,Finance
HAFC,Hanmi Financial Corporation Common Stock,30.32,902518309.0,379745,Finance
FSBC,Five Star Bancorp Common Stock,42.0,897798426.0,99959,Finance
BBDC,Barings BDC Inc. Common Stock,8.51,891055583.0,580145,Finance
NBBK,NB Bancorp Inc. Common Stock,19.88,888758520.0,257324,Finance
BHFAP,Brighthouse Financial Inc. Depositary Shares 6.6% Non-Cumulative Preferred Stock Series A,15.47,888686294.0,48836,Finance
BANFP,BancFirst Corporation - BFC Capital Trust II Cumulative Trust Preferred Securities,26.4382,887963617.0,1644,Finance
AMTB,Amerant Bancorp Inc. Class A Common Stock,22.4,881548394.0,160936,Finance
TRST,TrustCo Bank Corp NY Common Stock,50.44,881429467.0,113102,Finance
MFIC,MidCap Financial Investment Corporation Common Stock,10.65,877268488.0,1229341,Finance
BCSF,Bain Capital Specialty Finance Inc. Common Stock,13.3,862751143.0,203419,Finance
ABX,Abacus Global Management Inc. Class A Common Stock,8.97,860423632.0,436194,Finance
FMNB,Farmers National Banc Corp. Common Stock,14.24,843221899.0,324245,Finance
CAC,Camden National Corporation Common Stock,49.42,835923486.0,103017,Finance
AGNT,eXp World Holdings Inc. Common Stock,5.06,831479055.0,1173421,Finance
MPB,Mid Penn Bancorp Common Stock,32.64,827258907.0,207661,Finance
THFF,First Financial Corporation Common Stock,69.33,824465150.0,107267,Finance
PFLT,PennantPark Floating Rate Capital Ltd. Common Stock,8.17,810610210.0,1386384,Finance
FCBC,First Community Bankshares Inc. (VA) Common Stock,42.36,799194640.0,62287,Finance
EIG,Employers Holdings Inc Common Stock,43.76,798310223.0,264201,Finance
CCBG,Capital City Bank Group Common Stock,46.68,798293772.0,61785,Finance
EGBN,Eagle Bancorp Inc. Common Stock,26.08,795325665.0,210501,Finance
HTB,HomeTrust Bancshares Inc. Common Stock,46.72,785145952.0,56612,Finance
NAVI,Navient Corporation Common Stock,8.35,784732866.0,1120018,Finance
WRLD,World Acceptance Corporation Common Stock,158.11,780569939.0,86675,Finance
GSBC,Great Southern Bancorp Inc. Common Stock,71.16,775160325.0,92195,Finance
SPFI,South Plains Financial Inc. Common Stock,40.13,768319108.0,94995,Finance
SMBC,Southern Missouri Bancorp Inc. Common Stock,69.3,763383298.0,74110,Finance
PGC,Peapack-Gladstone Financial Corporation Common Stock,42.96,761181519.0,136072,Finance
NMFC,New Mountain Finance Corporation Common Stock,8.02,757508168.0,319186,Finance
EFSCP,Enterprise Financial Services Corporation Depositary Shares Each Representing a 1/40th Interest in a Share of 5% Fixed Rate Non-Cumulative Perpetual Preferred Stock Series A,20.7,757326164.0,21,Finance
CGBD,Carlyle Secured Lending Inc. Common Stock,10.79,756658925.0,403303,Finance
RILYN,BRC Group Holdings Inc. 6.50% Senior Notes Due 2026,24.81,756632207.0,16789,Finance
RILYG,BRC Group Holdings Inc. 5.00% Senior Notes due 2026,24.26,739858821.0,7305,Finance
NIE,Virtus Equity & Convertible Income Fund Common Shares of Beneficial Interest,26.62,737612648.0,55463,Finance
CCNEP,CNB Financial Corporation Depositary Shares each representing a 1/40th ownership interest in a share of 7.125% Series A Fixed-Rate Non-Cumulative Perpetual Preferred Stock,24.82,735392103.0,116,Finance
FPH,Five Point Holdings LLC Class A Common Shares,4.95,735090325.0,158869,Finance
GDOT,Green Dot Corporation Class A Common Stock $0.001 par value,12.86,728908208.0,472617,Finance
ORRF,Orrstown Financial Services Inc. Common Stock,36.76,722253569.0,90536,Finance
TBLD,Thornburg Income Builder Opportunities Trust Common Stock,22.39,718313360.0,48317,Finance
SLRC,SLR Investment Corp. Common Stock,13.12,715756798.0,275253,Finance
BHFAN,Brighthouse Financial Inc. Depositary shares each representing a 1/1000th interest in a share of 5.375% Non-Cumulative Preferred Stock Series C,12.4,712327734.0,196887,Finance
HRTG,Heritage Insurance Holdings Inc. Common Stock,23.45,711705741.0,502877,Finance
SMBK,SmartFinancial Inc. Common Stock,41.61,711467462.0,61244,Finance
FDUS,Fidus Investment Corporation Common Stock,18.74,711264781.0,187094,Finance
ALRS,Alerus Financial Corporation Common Stock,28.21,708879104.0,228170,Finance
NEWTP,NewtekOne Inc. Depositary Shares Non-Cumulative Perpetual Preferred Stock Series B,24.4501,705603504.0,5202,Finance
CUBB,Customers Bancorp Inc 5.375% Subordinated Notes Due 2034,22.2885,704840157.0,3394,Finance
OPFI,OppFi Inc. Class A Common Stock,8.25,704494296.0,1059935,Finance
DGICB,Donegal Group Inc. Class B Common Stock,18.95,702089977.0,344,Finance
IBCP,Independent Bank Corporation Common Stock,34.03,701227523.0,109983,Finance
FISI,Financial Institutions Inc. Common Stock,35.37,696306907.0,78997,Finance
VEL,Velocity Financial Inc. Common Stock,17.55,688930182.0,67910,Finance
FOF,Cohen & Steers Closed-End Opportunity Fund Inc. Common Stock,13.85,680569998.0,43290,Finance
BTBT,Bit Digital Inc. Ordinary Shares,1.94,677429415.0,30821480,Finance
MGRE,Affiliated Managers Group Inc. 6.750% Junior Subordinated Notes due 2064,23.84,677343582.0,25860,Finance
HIPO,Hippo Holdings Inc. Common Stock,25.95,675632046.0,105720,Finance
NEWTG,NewtekOne Inc. 8.50% Fixed Rate Senior Notes due 2029,25.61,674102630.0,2958,Finance
SKYH,Sky Harbour Group Corporation Class A Common Stock,8.77,671150069.0,120557,Finance
XFLT,XAI Octagon Floating Rate & Alternative Income Trust Common Shares of Beneficial Interest,18.92,671064625.0,35884,Finance
DLY,DoubleLine Yield Opportunities Fund Common Shares of Beneficial Interest,13.98,670281990.0,136911,Finance
NEWTI,NewtekOne Inc. 8.00% Fixed Rate Senior Notes due 2028,25.4,668575041.0,1873,Finance
SHBI,Shore Bancshares Inc Common Stock,19.95,667445823.0,227198,Finance
NXP,Nuveen Select Tax Free Income Portfolio Common Stock,14.16,662675440.0,50904,Finance
GAIN,Gladstone Investment Corporation Business Development Company,16.44,654673137.0,207170,Finance
DGICA,Donegal Group Inc. Class A Common Stock,17.56,650591029.0,110477,Finance
RILYT,BRC Group Holdings Inc. 6.00% Senior Notes Due 2028,21.28,648977564.0,29302,Finance
CWBC,Community West Bancshares Common Stock,23.74,644166050.0,172869,Finance
VMO,Invesco Municipal Opportunity Trust Common Stock,9.5,640686508.0,213676,Finance
RILYL,BRC Group Holdings Inc. Depositary Shares each representing 1/1000th in a share of 7.375% Series B Cumulative Perpetual Preferred Stock par value $0.0001,17.22,639388794.0,4688,Finance
TIPT,Tiptree Inc. Common Stock,16.96,637188472.0,138259,Finance
RILYP,BRC Group Holdings Inc. Depositary Shares each representing a 1/1000th fractional interest in a share of Series A Cumulative Perpetual Preferred Stock,17.11,635304429.0,13204,Finance
BHFAM,Brighthouse Financial Inc. Depositary shares each representing a 1/1000th Interest in a Share of 4.625% Non-Cumulative Preferred Stock Series D,10.99,631329177.0,60003,Finance
GEMI,Gemini Space Station Inc. Class A Common Stock,5.29,631043746.0,1644490,Finance
TCBX,Third Coast Bancshares Inc. Common Stock,37.92,629171332.0,73163,Finance
BSTZ,BlackRock Science and Technology Term Trust Common Shares of Beneficial Interest,28.38,628839215.0,144712,Finance
RMT,Royce Micro-Cap Trust Inc. Common Stock,13.33,616767196.0,49664,Finance
WASH,Washington Trust Bancorp Inc. Common Stock,32.33,616390622.0,208919,Finance
HPP,Hudson Pacific Properties Inc. Common Stock,11.28,611850031.0,1110486,Finance
BCAL,California BanCorp Common Stock,19.0,611131656.0,145480,Finance
NPB,Northpointe Bancshares Inc. Common Stock,17.62,609332056.0,169174,Finance
HIFS,Hingham Institution for Savings Common Stock,283.57,608938218.0,26905,Finance
AROW,Arrow Financial Corporation Common Stock,36.76,607606738.0,61988,Finance
RILYZ,BRC Group Holdings Inc. 5.25% Senior Notes due 2028,19.845,605214275.0,19868,Finance
SSSSL,SuRo Capital Corp. 6.00% Notes due 2026,25.12,600069248.0,200,Finance
CARE,Carter Bankshares Inc. Common Stock,26.95,598883170.0,265136,Finance
PFIS,Peoples Financial Services Corp. Common Stock,59.57,596348181.0,52289,Finance
NFBK,Northfield Bancorp Inc. Common Stock (Delaware),14.2,593046698.0,229999,Finance
AMSF,AMERISAFE Inc. Common Stock,31.3,585428032.0,158135,Finance
BHB,Bar Harbor Bankshares Inc. Common Stock,34.76,581955535.0,122288,Finance
MGR,Affiliated Managers Group Inc. 5.875% Junior Subordinated Notes due 2059,20.3513,578222418.0,12219,Finance
MSBI,Midland States Bancorp Inc. Common Stock,27.58,571727856.0,143725,Finance
IIM,Invesco Value Municipal Income Trust Common Stock,12.01,565291952.0,87761,Finance
INV,Innventure Inc. Common Stock,6.69,562259364.0,2473972,Finance
ACNB,ACNB Corporation Common Stock,54.76,559211529.0,33487,Finance
PRAA,PRA Group Inc. Common Stock,14.62,557619783.0,414022,Finance
UNTY,Unity Bancorp Inc. Common Stock,55.3,555261881.0,46556,Finance
RFI,Cohen & Steers Total Return Realty Fund Inc. Common Stock,11.26,553300951.0,189612,Finance
TYG,Tortoise Energy Infrastructure Corporation Common Stock,46.38,553216141.0,185052,Finance
BWBBP,Bridgewater Bancshares Inc. Depositary Shares Each Representing a 1/100th Interest in a Share of 5.875% Non-Cumulative Perpetual Preferred Stock Series A,19.75,550696498.0,240,Finance
NRIM,Northrim BanCorp Inc Common Stock,24.49,544774319.0,107991,Finance
VGM,Invesco Trust for Investment Grade Municipals Common Stock (DE),9.98,541235041.0,129754,Finance
FFIC,Flushing Financial Corporation Common Stock,15.95,540443835.0,340615,Finance
SFST,Southern First Bancshares Inc. Common Stock,57.07,539606267.0,252731,Finance
CIVB,Civista Bancshares Inc. Common Stock,25.65,533092876.0,72821,Finance
KRNY,Kearny Financial Corp Common Stock,8.21,531508430.0,337387,Finance
VKQ,Invesco Municipal Trust Common Stock,9.54,527900813.0,370028,Finance
MSBIP,Midland States Bancorp Inc. Depositary Shares Each Representing a 1/40th Interest in a Share of 7.750% Fixed-Rate Reset Non-Cumulative Perpetual Preferred Stock Series A,25.43,527158789.0,1507,Finance
ACIC,American Coastal Insurance Corporation Common Stock,10.85,525834910.0,391032,Finance
TRC,Tejon Ranch Co Common Stock,19.45,525232351.0,70925,Finance
ALTI,AlTi Global Inc. Class A Common Stock,3.46,524597726.0,189514,Finance
BWB,Bridgewater Bancshares Inc. Common Stock,18.81,524486133.0,101760,Finance
BME,Blackrock Health Sciences Trust,39.24,523187626.0,37753,Finance
OPENW,Opendoor Technologies Inc  Series K Warrants each whole warrant exercisable to purchase one share of Common Stock at an exercise price of $9.00 per warrant,0.5412,522115465.0,206679,Finance
AHRT,AH Realty Trust Inc. Common Stock,6.86,521054017.0,1396318,Finance
CBNK,Capital Bancorp Inc. Common Stock,31.55,513888135.0,48239,Finance
HBCP,Home Bancorp Inc. Common Stock,65.16,511025836.0,80538,Finance
TREE,LendingTree Inc. Common Stock,36.59,510540929.0,172137,Finance
IQI,Invesco Quality Municipal Income Trust Common Stock,9.64,509799803.0,87976,Finance
BSRR,Sierra Bancorp Common Stock,38.5,503548584.0,78590,Finance
VCV,Invesco California Value Municipal Income Trust Common Stock,10.5,502850513.0,53206,Finance
FTHY,First Trust High Yield Opportunities 2027 Term Fund Common Stock,13.56,498641731.0,48523,Finance
ETO,Eaton Vance Tax-Advantage Global Dividend Opp Common Stock,30.19,494757886.0,12469,Finance
FBIZ,First Business Financial Services Inc. Common Stock,57.22,478483139.0,34387,Finance
MGRB,Affiliated Managers Group Inc. 4.750% Junior Subordinated Notes due 2060,16.74,475617935.0,8957,Finance
COFS,ChoiceOne Financial Services Inc. Common Stock,31.61,473360856.0,100439,Finance
GUT,Gabelli Utility Trust (The) Common Stock,6.32,463881863.0,310749,Finance
ITIC,Investors Title Company Common Stock,244.01,460689904.0,36892,Finance
OBT,Orange County Bancorp Inc. Common Stock,33.99,455734657.0,48891,Finance
ETB,Eaton Vance Tax-Managed Buy-Write Income Fund Eaton Vance Tax-Managed Buy-Write Income Fund Common Shares of Beneficial Interest,15.34,450557245.0,26134,Finance
PDLB,Ponce Financial Group Inc. Common Stock,18.61,450136838.0,68786,Finance
HQL,abrdn Life Sciences Investors Shares of Beneficial Interest,17.21,441946536.0,121153,Finance
FRPH,FRP Holdings Inc. Common Stock,22.9,438999298.0,74012,Finance
GCBC,Greene County Bancorp Inc. Common Stock,25.0,425637125.0,9362,Finance
BMRC,Bank of Marin Bancorp Common Stock,26.24,424817912.0,86985,Finance
MGRD,Affiliated Managers Group Inc. 4.200% Junior Subordinated Notes due 2061,14.93,424192101.0,11800,Finance
GBFH,GBank Financial Holdings Inc. Common Stock,29.22,422823685.0,68946,Finance
