symbol,name,price,marketCap,volume,industry
MUJ,Blackrock MuniHoldings New Jersey Quality Fund Inc. Common Stock,12.16,1808951647.0,77505,Finance
MIY,Blackrock MuniYield Michigan Quality Fund Inc. Common Stock,12.15,1807464023.0,58157,Finance
AFGB,American Financial Group Inc. 5.875% Subordinated Debentures due 2059,21.67,1807355405.0,7754,Finance
TY,Tri Continental Corporation Common Stock,33.15,1801733495.0,25124,Finance
TRINI,Trinity Capital Inc. 7.875% Notes Due 2029,25.3501,1782470987.0,11842,Finance
TRINZ,Trinity Capital Inc. 7.875% Notes due 2029,25.24,1774729398.0,6130,Finance
FCF,First Commonwealth Financial Corporation Common Stock,17.02,1766097099.0,439958,Finance
MHD,Blackrock MuniHoldings Fund Inc. Common Stock,11.87,1765810531.0,118847,Finance
CHCO,City Holding Company Common Stock,122.06,1758719941.0,74964,Finance
WTFCN,Wintrust Financial Corporation Depositary Shares Each Representing a 1/1000th Interest in a Share of 7.875% Fixed-Rate Reset Non-Cumulative Perpetual Preferred StocK,26.26,1758662609.0,32305,Finance
AFGD,American Financial Group Inc. 5.625% Subordinated Debentures due 2060,21.025,1753560101.0,1608,Finance
HMN,Horace Mann Educators Corporation Common Stock,43.05,1751487872.0,253344,Finance
NWBI,Northwest Bancshares Inc. Common Stock,11.98,1750277653.0,882403,Finance
MQY,Blackrock MuniYield Quality Fund Inc. Common Stock,11.65,1733082787.0,203287,Finance
ECAT,BlackRock ESG Capital Allocation Term Trust Common Shares of Beneficial Interest,15.97,1726915950.0,398081,Finance
KYN,Kayne Anderson Energy Infrastructure Fund Inc.,12.49,1700282810.0,471444,Finance
PWP,Perella Weinberg Partners Class A Common Stock,19.14,1699802767.0,746908,Finance
GTY,Getty Realty Corporation Common Stock,29.37,1695921808.0,587390,Finance
BPOPM,Popular Inc. Popular Capital Trust II - 6.125% Cumulative Monthly Income Trust Preferred Securities,25.4334,1695768257.0,531,Finance
BDJ,Blackrock Enhanced Equity Dividend Trust,9.56,1691597450.0,314295,Finance
RZC,Reinsurance Group of America Incorporated 7.125% Fixed-Rate Reset Subordinated Debentures due 2052,25.42,1670445635.0,16779,Finance
CCB,Coastal Financial Corporation Common Stock,110.39,1669236223.0,131975,Finance
BKT,BlackRock Income Trust Inc. (The),11.16,1660189176.0,164568,Finance
CASH,Pathward Financial Inc. Common Stock,73.65,1645267792.0,171405,Finance
RZB,Reinsurance Group of America Incorporated 5.75% Fixed-To-Floating Rate Subordinated Debentures due 2056,25.036,1645211523.0,9036,Finance
MYI,Blackrock MuniYield Quality Fund III Inc Common Stock,11.05,1643825305.0,223818,Finance
LOB,Live Oak Bancshares Inc. Common Stock,35.81,1642161265.0,163998,Finance
MUA,Blackrock MuniAssets Fund Inc Common Stock,10.96,1630436682.0,53408,Finance
STEL,Stellar Bancorp Inc. Common Stock,31.58,1616501061.0,96571,Finance
MUC,Blackrock MuniHoldings California Quality Fund Inc.  Common Stock,10.86,1615560435.0,259215,Finance
AFGC,American Financial Group Inc. 5.125% Subordinated Debentures due 2059,19.26,1606352797.0,20046,Finance
RQI,Cohen & Steers Quality Income Realty Fund Inc Common Shares,11.95,1604889876.0,831390,Finance
MVT,Blackrock MuniVest Fund II Inc.  Common Stock,10.78,1603659437.0,71117,Finance
CLBK,Columbia Financial Inc. Common Stock,15.37,1603296220.0,79218,Finance
ETV,Eaton Vance Corporation Eaton Vance Tax-Managed Buy-Write Opportunities Fund Common Shares of Beneficial Interest,14.59,1594225212.0,122890,Finance
MBIN,Merchants Bancorp Common Stock,34.59,1587308742.0,55126,Finance
TFIN,Triumph Financial Inc. Common Stock,66.75,1586207017.0,152784,Finance
BCAT,BlackRock Capital Allocation Term Trust Common Shares of Beneficial Interest,14.65,1584177750.0,671089,Finance
MYD,Blackrock MuniYield Fund Inc.  Common Stock,10.58,1573906943.0,107142,Finance
TCBK,TriCo Bancshares Common Stock,48.09,1563485152.0,101525,Finance
SRCE,1st Source Corporation Common Stock,63.43,1549893275.0,65756,Finance
MHN,Blackrock MuniHoldings New York Quality Fund Inc. Common Stock,10.36,1541179200.0,54627,Finance
WLTH,Wealthfront Corporation Common Stock,10.47,1531433802.0,6290784,Finance
EFC,Ellington Financial Inc. Common Stock ,13.72,1526425172.0,894324,Finance
ECCX,Eagle Point Credit Company Inc. 6.6875% Notes due 2028,25.13,1524449228.0,298,Finance
FRMEP,First Merchants Corporation Depository Shares,26.25,1517906775.0,8380,Finance
ECCW,Eagle Point Credit Company Inc. 6.75% Notes due 2031,25.0,1516563100.0,8293,Finance
JCAP,Jefferson Capital Inc. Common Stock,23.37,1511227009.0,296118,Finance
MQT,Blackrock MuniYield Quality Fund II Inc. Common Stock,10.14,1508451456.0,51896,Finance
STBA,S&T Bancorp Inc. Common Stock,39.46,1508259850.0,114800,Finance
MUE,Blackrock MuniHoldings Quality Fund II Inc. Common Stock,10.13,1506963831.0,17411,Finance
NBHC,National Bank Holdings Corporation Common Stock,39.4,1502403085.0,441897,Finance
ECCC,Eagle Point Credit Company Inc. 6.50% Series C Term Preferred Stock due 2031,24.6908,1497806248.0,10813,Finance
TWFG,TWFG Inc. Class A Common Stock,26.59,1494361776.0,135122,Finance
EXPI,eXp World Holdings Inc. Common Stock,9.33,1481946635.0,715686,Finance
GABC,German American Bancorp Inc. Common Stock,39.1,1465929263.0,94723,Finance
LKFN,Lakeland Financial Corporation Common Stock,57.1,1457690597.0,136646,Finance
ECCV,Eagle Point Credit Company Inc. 5.375% Notes due 2029,23.98,1454687326.0,1204,Finance
GAM,General American Investors Inc. Common Stock,60.48,1450044893.0,37582,Finance
AFGE,American Financial Group Inc. 4.500% Subordinated Debentures due 2060,17.36,1447886010.0,33200,Finance
HOPE,Hope Bancorp Inc. Common Stock,11.2,1435685821.0,745633,Finance
BULLW,Webull Corporation Warrants,3.1,1430498850.0,325,Finance
NCV,Virtus Convertible & Income Fund Common Shares of Beneficial Interest,15.65,1414346355.0,165120,Finance
QCRH,QCR Holdings Inc. Common Stock,83.85,1411921054.0,38821,Finance
IIPR,Innovative Industrial Properties Inc. Common Stock,49.89,1398066223.0,390561,Finance
FOR,Forestar Group Inc Common Stock ,27.36,1391039227.0,162739,Finance
KMPB,Kemper Corporation 5.875% Fixed-Rate Reset Junior Subordinated Debentures due 2062,23.6601,1385224562.0,4834,Finance
PFBC,Preferred Bank Common Stock,95.41,1369773701.0,50289,Finance
RBCAA,Republic Bancorp Inc. Class A Common Stock,69.65,1360777612.0,15520,Finance
BY,Byline Bancorp Inc. Common Stock,29.69,1360372850.0,166182,Finance
KW,Kennedy-Wilson Holdings Inc. Common Stock,9.82,1354221149.0,493398,Finance
OPENW,Opendoor Technologies Inc  Series K Warrants each whole warrant exercisable to purchase one share of Common Stock at an exercise price of $9.00 per warrant,1.41,1344841248.0,512177,Finance
FINV,FinVolution Group American Depositary Shares,5.22,1322820354.0,996363,Finance
PSEC,Prospect Capital Corporation Common Stock,2.8,1318550772.0,2854644,Finance
DCOM,Dime Community Bancshares Inc. Common Stock,29.73,1304978877.0,143766,Finance
CNOB,ConnectOne Bancorp Inc. Common Stock,25.89,1301570274.0,206519,Finance
FSCO,FS Credit Opportunities Corp. Common Stock,6.43,1275428437.0,846969,Finance
WAFDP,WaFd Inc. Depositary Shares,16.57,1270935603.0,14877,Finance
ECPG,Encore Capital Group Inc Common Stock,56.04,1249898003.0,138323,Finance
PRA,ProAssurance Corporation Common Stock,24.15,1241639478.0,343763,Finance
GEMI,Gemini Space Station Inc. Class A Common Stock,10.46,1230657890.0,1682665,Finance
CNOBP,ConnectOne Bancorp Inc. Depositary Shares each representing a 1/40th interest in a share of 5.25% Fixed-Rate Reset Non-Cumulative Perpetual Preferred Stock Series A,24.4,1226663372.0,13075,Finance
BFC,Bank First Corporation Common Stock,123.7,1216591108.0,42109,Finance
OBK,Origin Bancorp Inc. Common Stock,39.26,1215965470.0,148719,Finance
WABC,Westamerica Bancorporation Common Stock,48.37,1206011677.0,136008,Finance
TRIN,Trinity Capital Inc. Common Stock,15.81,1196553843.0,865031,Finance
NAVI,Navient Corporation Common Stock,12.07,1176905929.0,617978,Finance
BTZ,BlackRock Credit Allocation Income Trust,10.75,1162451250.0,283901,Finance
MBINM,Merchants Bancorp Depositary Shares Each Representing a 1/40th Interest in a Share of 8.25% Fixed-Rate Reset Series D Non-Cumulative Perpetual Preferred Stock,25.33,1162374399.0,3216,Finance
DSL,DoubleLine Income Solutions Fund Common Shares of Beneficial Interests,11.36,1158683966.0,809988,Finance
ROOT,Root Inc. Class A Common Stock,74.26,1151695444.0,405778,Finance
VRTS,Virtus Investment Partners Inc. Common Stock,168.89,1140751460.0,85587,Finance
PX,P10 Inc. Class A Common Stock,10.15,1116653164.0,449511,Finance
SAFT,Safety Insurance Group Inc. Common Stock,74.91,1115713585.0,57150,Finance
OCSL,Oaktree Specialty Lending Corporation Common Stock,12.6,1109877590.0,568687,Finance
PEBO,Peoples Bancorp Inc. Common Stock,30.36,1083941957.0,181375,Finance
NCZ,Virtus Convertible & Income Fund II Common Shares of Beneficial Interest,14.17,1078560163.0,127234,Finance
PTA,Cohen & Steers Tax-Advantaged Preferred Securities and Income Fund Common Shares of Beneficial Interest,19.5,1077832412.0,215610,Finance
MBINL,Merchants Bancorp Depositary Shares Each Representing a 1/40thInterest in a Share of 7.25% Fixed Rate Series E Non-CumulativePerpetual Preferred Stock without par value,23.417,1074588286.0,26626,Finance
HTFB,Horizon Technology Finance Corporation 4.875% Notes due 2026,24.97,1062366603.0,260,Finance
TMP,Tompkins Financial Corporation Common Stock,73.46,1060165905.0,39275,Finance
HTFC,Horizon Technology Finance Corporation 6.25% Notes due 2027,24.88,1058537489.0,2033,Finance
FSUN,FirstSun Capital Bancorp Common Stock,37.945,1057899428.0,63712,Finance
CTBI,Community Trust Bancorp Inc. Common Stock,58.11,1052711869.0,59525,Finance
MFIC,MidCap Financial Investment Corporation Common Stock,11.23,1047799675.0,470091,Finance
OSBC,Old Second Bancorp Inc. Common Stock,19.87,1046537481.0,602462,Finance
MVF,Blackrock MuniVest Fund Inc. Common Stock,6.99,1039849672.0,87448,Finance
GSBD,Goldman Sachs BDC Inc. Common Stock,9.05,1032723519.0,1231879,Finance
ETW,Eaton Vance Corporation Eaton Vance Tax-Managed Global Buy-Write Opportunites Fund Common Shares of Beneficial Interest,9.37,1026931255.0,697815,Finance
DCOMG,Dime Community Bancshares Inc. 9.000% Fixed-to-Floating Rate Subordinated Notes due 2034,26.14,1023345371.0,1905,Finance
SIGIP,Selective Insurance Group Inc. Depositary Shares each representing a 1/1000th interest in a share of 4.60% Non-Cumulative Preferred Stock Series B,16.91,1021518152.0,3928,Finance
OCFC,OceanFirst Financial Corp. Common Stock,17.78,1020372580.0,554782,Finance
AIZN,Assurant Inc. 5.25% Subordinated Notes due 2061,20.22,1020285246.0,19638,Finance
MMI,Marcus & Millichap Inc. Common Stock,25.75,1002257053.0,305653,Finance
BHFAL,Brighthouse Financial Inc. 6.25% Junior Subordinated Debentures due 2058,17.48,999352873.0,14087,Finance
AMAL,Amalgamated Financial Corp. Common Stock (DE),33.25,995382640.0,129842,Finance
RNP,Cohen & Steers REIT and Preferred and Income Fund Inc. Common Shares,20.2,992600286.0,150519,Finance
BCX,BlackRock Resources Common Shares of Beneficial Interest,11.68,991141557.0,341973,Finance
EIG,Employers Holdings Inc Common Stock,43.95,987956709.0,287302,Finance
FGNXP,FG Nexus Inc. 8.00% Cumulative Preferred Stock,24.49,969175832.0,6887,Finance
FMN,Federated Hermes Premier Municipal Income Fund,11.19,965191772.0,25257,Finance
GAINN,Gladstone Investment Corporation 5.00% Notes Due 2026,25.2,963124596.0,3508,Finance
BHRB,Burke & Herbert Financial Services Corp. Common Stock,63.77,958368975.0,58077,Finance
BBDC,Barings BDC Inc. Common Stock,9.06,952739978.0,419572,Finance
FMBH,First Mid Bancshares Inc. Common Stock,39.37,945023858.0,70700,Finance
PFLT,PennantPark Floating Rate Capital Ltd. Common Stock,9.52,944554370.0,1039921,Finance
SBSI,Southside Bancshares Inc. Common Stock,31.25,939566438.0,75340,Finance
TCBIO,Texas Capital Bancshares Inc. Depositary Shares 5.75% Fixed Rate Non-Cumulative Perpetual Preferred Stock Series B,20.51,936149928.0,55371,Finance
NMFC,New Mountain Finance Corporation Common Stock,9.07,935623215.0,607805,Finance
UVSP,Univest Financial Corporation Common Stock,32.84,935142415.0,146574,Finance
GAINZ,Gladstone Investment Corporation 4.875% Notes due 2028,24.205,925096462.0,2312,Finance
FCRX,Crescent Capital BDC Inc. 5.00% Notes due 2026,24.96,925056213.0,3026,Finance
RWAYZ,Runway Growth Finance Corp. 8.00% Notes due 2027,25.35,918091621.0,4520,Finance
BST,BlackRock Science and Technology Trust Common Shares of Beneficial Interest,41.38,916891005.0,67742,Finance
RWAYL,Runway Growth Finance Corp. 7.50% Notes due 2027,25.29,915918623.0,1404,Finance
BHFAO,Brighthouse Financial Inc. Depositary Shares 6.75% Non-Cumulative Preferred Stock Series B,16.02,915882896.0,21487,Finance
CGBD,Carlyle Secured Lending Inc. Common Stock,12.53,913474352.0,323435,Finance
ATLC,Atlanticus Holdings Corporation Common Stock,59.77,905009248.0,63173,Finance
UFCS,United Fire Group Inc. Common Stock,35.17,897338951.0,87423,Finance
BHFAP,Brighthouse Financial Inc. Depositary Shares 6.6% Non-Cumulative Preferred Stock Series A,15.66,895301258.0,25765,Finance
HQH,abrdn Healthcare Investors Shares of Beneficial Interest,18.91,895269859.0,190137,Finance
ESQ,Esquire Financial Holdings Inc. Common Stock,104.5,895093810.0,52483,Finance
MBINN,Merchants Bancorp Depositary Shares Preferred Series C,19.5,894840141.0,7187,Finance
LDI,loanDepot Inc. Class A Common Stock,2.67,889739917.0,3695444,Finance
BCSF,Bain Capital Specialty Finance Inc. Common Stock,13.64,884806435.0,443720,Finance
NBN,Northeast Bank Common Stock,108.48,881942400.0,69249,Finance
BANFP,BancFirst Corporation - BFC Capital Trust II Cumulative Trust Preferred Securities,26.2168,873915320.0,191,Finance
HBNC,Horizon Bancorp Inc. Common Stock,17.03,872232884.0,306968,Finance
OPFI,OppFi Inc. Class A Common Stock,10.09,871398140.0,484458,Finance
EQBK,Equity Bancshares Inc. Class A Common Stock,45.57,869312095.0,42386,Finance
CFFN,Capitol Federal Financial Inc. Common Stock,6.58,867331547.0,1645387,Finance
TREE,LendingTree Inc. Common Stock,62.41,853188137.0,470278,Finance
FPH,Five Point Holdings LLC Class A Common Shares,5.72,841228148.0,65807,Finance
UVE,UNIVERSAL INSURANCE HOLDINGS INC Common Stock,29.83,836698120.0,137762,Finance
HAFC,Hanmi Financial Corporation Common Stock,27.9,835753065.0,178276,Finance
CPF,Central Pacific Financial Corp New,31.02,832189422.0,88625,Finance
OPENL,Opendoor Technologies Inc  Series A Warrants each whole warrant exercisable to purchase one share of Common Stock at an exercise price of $13.00 per warrant,0.8713,831035588.0,479557,Finance
MOFG,MidWestOne Financial Gp Common Stock,40.1,827373676.0,178506,Finance
SLRC,SLR Investment Corp. Common Stock,15.16,827048251.0,230717,Finance
AMTB,Amerant Bancorp Inc. Class A Common Stock,19.99,824899404.0,159604,Finance
MCB,Metropolitan Bank Holding Corp. Common Stock,79.74,821162679.0,70223,Finance
ABX,Abacus Global Management Inc. Class A Common Stock,8.35,816236339.0,441363,Finance
HFWA,Heritage Financial Corporation Common Stock,23.85,809868201.0,103149,Finance
DCOMP,Dime Community Bancshares Inc. Fixed-Rate Non-Cumulative Perpetual Preferred Stock Series A,18.31,803705457.0,6174,Finance
AEF,abrdn Emerging Markets ex-China Fund Inc. Common Stock,7.46,800924250.0,368524,Finance
BOW,Bowhead Specialty Holdings Inc. Common Stock,24.37,798921076.0,195157,Finance
MBWM,Mercantile Bank Corporation Common Stock,48.66,790900176.0,58235,Finance
HRTG,Heritage Insurance Holdings Inc. Common Stock,25.48,787623364.0,300122,Finance
NBBK,NB Bancorp Inc. Common Stock,19.77,787368837.0,140189,Finance
TRST,TrustCo Bank Corp NY Common Stock,42.44,781915366.0,82974,Finance
FSBC,Five Star Bancorp Common Stock,36.58,781619016.0,59293,Finance
OPY,Oppenheimer Holdings Inc. Class A Common Stock (DE),74.14,779993503.0,14441,Finance
BFST,Business First Bancshares Inc. Common Stock,26.17,775034233.0,91833,Finance
HIPO,Hippo Holdings Inc. Common Stock,30.27,766895868.0,161403,Finance
CCNE,CNB Financial Corporation Common Stock,25.93,764318903.0,85766,Finance
EFSCP,Enterprise Financial Services Corporation Depositary Shares Each Representing a 1/40th Interest in a Share of 5% Fixed Rate Non-Cumulative Perpetual Preferred Stock Series A,20.6,762424725.0,1941,Finance
BTBT,Bit Digital Inc. Ordinary Shares,2.35,760635853.0,36220348,Finance
HTBK,Heritage Commerce Corp Common Stock,12.36,757464567.0,566857,Finance
RILYK,BRC Group Holdings Inc. 5.50% Senior Notes Due 2026,24.83,757242149.0,5762,Finance
HTB,HomeTrust Bancshares Inc. Common Stock,42.88,748000092.0,63476,Finance
CAC,Camden National Corporation Common Stock,44.12,746608567.0,69887,Finance
CCBG,Capital City Bank Group Common Stock,43.52,742835264.0,72851,Finance
BHFAN,Brighthouse Financial Inc. Depositary shares each representing a 1/1000th interest in a share of 5.375% Non-Cumulative Preferred Stock Series C,12.91,738080411.0,28182,Finance
CCNEP,CNB Financial Corporation Depositary Shares each representing a 1/40th ownership interest in a share of 7.125% Series A Fixed-Rate Non-Cumulative Perpetual Preferred Stock,25.0,736906000.0,660,Finance
VEL,Velocity Financial Inc. Common Stock,18.7,727430561.0,116724,Finance
MPB,Mid Penn Bancorp Common Stock,31.32,721878895.0,57084,Finance
THFF,First Financial Corporation Common Stock,60.75,719926684.0,30607,Finance
WRLD,World Acceptance Corporation Common Stock,142.76,719235873.0,77701,Finance
RILYN,BRC Group Holdings Inc. 6.50% Senior Notes Due 2026,23.5,716681051.0,106533,Finance
FDUS,Fidus Investment Corporation Common Stock,19.62,714707373.0,196286,Finance
DLY,DoubleLine Yield Opportunities Fund Common Shares of Beneficial Interest,14.9,714392107.0,214398,Finance
CUBB,Customers Bancorp Inc 5.375% Subordinated Notes Due 2034,22.52,712160995.0,4970,Finance
AMSF,AMERISAFE Inc. Common Stock,37.54,710421938.0,120508,Finance
NIE,Virtus Equity & Convertible Income Fund Common Shares of Beneficial Interest,25.62,709903683.0,32261,Finance
SKYH,Sky Harbour Group Corporation Class A Common Stock,9.33,709416151.0,88344,Finance
DGICA,Donegal Group Inc. Class A Common Stock,19.29,706815712.0,100749,Finance
WYFI,WhiteFiber Inc. Ordinary Shares,18.43,705131597.0,455811,Finance
ORRF,Orrstown Financial Services Inc. Common Stock,35.89,699810855.0,194667,Finance
GSBC,Great Southern Bancorp Inc. Common Stock,62.08,694629385.0,60214,Finance
MGRE,Affiliated Managers Group Inc. 6.750% Junior Subordinated Notes due 2064,24.19,687287804.0,43061,Finance
MCBS,MetroCity Bankshares Inc. Common Stock,26.79,682626908.0,40240,Finance
GDOT,Green Dot Corporation Class A Common Stock $0.001 par value,12.28,680587232.0,836769,Finance
NEWTP,NewtekOne Inc. Depositary Shares Non-Cumulative Perpetual Preferred Stock Series B,23.36,674807211.0,13997,Finance
IBCP,Independent Bank Corporation Common Stock,32.54,673316118.0,99350,Finance
SMBC,Southern Missouri Bancorp Inc. Common Stock,59.8,669890902.0,51965,Finance
NEWTI,NewtekOne Inc. 8.00% Fixed Rate Senior Notes due 2028,25.4156,668985662.0,262,Finance
NXP,Nuveen Select Tax Free Income Portfolio Common Stock,14.26,667355351.0,152736,Finance
FOF,Cohen & Steers Closed-End Opportunity Fund Inc. Common Stock,13.55,665828409.0,86138,Finance
NEWTG,NewtekOne Inc. 8.50% Fixed Rate Senior Notes due 2029,25.25,664626763.0,4832,Finance
BHFAM,Brighthouse Financial Inc. Depositary shares each representing a 1/1000th Interest in a Share of 4.625% Non-Cumulative Preferred Stock Series D,11.6,663186117.0,27738,Finance
RILYG,BRC Group Holdings Inc. 5.00% Senior Notes due 2026,21.7,661786332.0,46529,Finance
VMO,Invesco Municipal Opportunity Trust Common Stock,9.79,660244306.0,259110,Finance
EGBN,Eagle Bancorp Inc. Common Stock,21.69,658752109.0,197535,Finance
TIPT,Tiptree Inc. Common Stock,17.53,657377928.0,254061,Finance
NEWTZ,NewtekOne Inc. 5.50% Notes Due 2026,25.26,655851802.0,1386,Finance
TBLD,Thornburg Income Builder Opportunities Trust Common Stock,20.44,655753689.0,74814,Finance
SPFI,South Plains Financial Inc. Common Stock,39.98,649588603.0,85860,Finance
OPENZ,Opendoor Technologies Inc  Series Z Warrants each whole warrant exercisable to purchase one share of Common Stock at an exercise price of $17.00 per warrant,0.6805,649052815.0,570191,Finance
SMBK,SmartFinancial Inc. Common Stock,38.01,647234318.0,73377,Finance
PRAA,PRA Group Inc. Common Stock,16.58,646876028.0,276658,Finance
FISI,Financial Institutions Inc. Common Stock,31.14,626865202.0,85110,Finance
DGICB,Donegal Group Inc. Class B Common Stock,17.0619,625174650.0,149,Finance
FRGE,Forge Global Holdings Inc. Common Stock,44.64,614095561.0,76909,Finance
NRIM,Northrim BanCorp Inc Common Stock,27.73,612574224.0,117369,Finance
NPB,Northpointe Bancshares Inc. Common Stock,17.82,612378223.0,166132,Finance
MGR,Affiliated Managers Group Inc. 5.875% Junior Subordinated Notes due 2059,21.35,606597545.0,20914,Finance
FCBC,First Community Bankshares Inc. (VA) Common Stock,32.9,602560375.0,32019,Finance
ALRS,Alerus Financial Corporation Common Stock,23.61,599630324.0,114420,Finance
SSSSL,SuRo Capital Corp. 6.00% Notes due 2026,25.03,597919318.0,104,Finance
SHBI,Shore Bancshares Inc Common Stock,17.78,594327722.0,119513,Finance
BCAL,California BanCorp Common Stock,18.35,593120646.0,128430,Finance
IIM,Invesco Value Municipal Income Trust Common Stock,12.57,591650278.0,117533,Finance
HIFS,Hingham Institution for Savings Common Stock,274.25,588924450.0,96120,Finance
ALTI,AlTi Global Inc. Class A Common Stock,3.94,577814290.0,311533,Finance
VGM,Invesco Trust for Investment Grade Municipals Common Stock (DE),10.5,569435664.0,173869,Finance
WASH,Washington Trust Bancorp Inc. Common Stock,29.56,562672679.0,90401,Finance
BME,Blackrock Health Sciences Trust,41.77,556920162.0,24239,Finance
AHH,Armada Hoffler Properties Inc. Common Stock,6.88,551455337.0,469279,Finance
GAIN,Gladstone Investment Corporation Business Development Company,13.87,549896275.0,178271,Finance
UNTY,Unity Bancorp Inc. Common Stock,54.68,548956798.0,68977,Finance
RFI,Cohen & Steers Total Return Realty Fund Inc. Common Stock,11.13,546912930.0,163486,Finance
VKQ,Invesco Municipal Trust Common Stock,9.82,543394757.0,224797,Finance
MSBIP,Midland States Bancorp Inc. Depositary Shares Each Representing a 1/40th Interest in a Share of 7.750% Fixed-Rate Reset Non-Cumulative Perpetual Preferred Stock Series A,25.17,542456818.0,1691,Finance
VCV,Invesco California Value Municipal Income Trust Common Stock,11.29,540684027.0,72439,Finance
ACIC,American Coastal Insurance Corporation Common Stock,11.08,540319546.0,142763,Finance
IQI,Invesco Quality Municipal Income Trust Common Stock,10.16,537299378.0,84766,Finance
BWBBP,Bridgewater Bancshares Inc. Depositary Shares Each Representing a 1/100th Interest in a Share of 5.875% Non-Cumulative Perpetual Preferred Stock Series A,19.41,535419648.0,862,Finance
CCAP,Crescent Capital BDC Inc. Common stock,14.4,532692331.0,130630,Finance
EXOD,Exodus Movement Inc. Class A Common Stock,18.1,530774989.0,111247,Finance
TCBX,Third Coast Bancshares Inc. Common Stock,37.9,526585556.0,27491,Finance
RMT,Royce Micro-Cap Trust Inc. Common Stock,11.29,522378218.0,149571,Finance
FTHY,First Trust High Yield Opportunities 2027 Term Fund Common Stock,14.2,522176444.0,70289,Finance
TYG,Tortoise Energy Infrastructure Corporation Common Stock,43.76,521965035.0,203096,Finance
BHB,Bar Harbor Bankshares Inc. Common Stock,31.26,521684792.0,44276,Finance
AROW,Arrow Financial Corporation Common Stock,31.7,521225760.0,36773,Finance
HPP,Hudson Pacific Properties Inc. Common Stock,9.61,521029281.0,1124880,Finance
RILYT,BRC Group Holdings Inc. 6.00% Senior Notes Due 2028,16.8,512350709.0,43885,Finance
FFIC,Flushing Financial Corporation Common Stock,15.04,508027708.0,515024,Finance
BSTZ,BlackRock Science and Technology Term Trust Common Shares of Beneficial Interest,22.83,505863259.0,280827,Finance
ETO,Eaton Vance Tax-Advantage Global Dividend Opp Common Stock,30.68,502788074.0,103234,Finance
FFWM,First Foundation Inc. Common Stock,6.05,501450626.0,245398,Finance
ACNB,ACNB Corporation Common Stock,48.24,500963331.0,38953,Finance
MGRB,Affiliated Managers Group Inc. 4.750% Junior Subordinated Notes due 2060,17.43,495222258.0,30038,Finance
PGC,Peapack-Gladstone Financial Corporation Common Stock,28.2,495136136.0,52253,Finance
BWB,Bridgewater Bancshares Inc. Common Stock,17.94,494870092.0,74165,Finance
FMNB,Farmers National Banc Corp. Common Stock,13.13,494386293.0,145212,Finance
KRNY,Kearny Financial Corp Common Stock,7.61,492664939.0,282615,Finance
PFIS,Peoples Financial Services Corp. Common Stock,49.21,491834020.0,16715,Finance
CION,CION Investment Corporation Common Stock,9.41,486223611.0,586982,Finance
NFBK,Northfield Bancorp Inc. Common Stock (Delaware),11.5,480717193.0,137506,Finance
CBNK,Capital Bancorp Inc. Common Stock,28.95,478278984.0,30461,Finance
TCPC,BlackRock TCP Capital Corp. Common Stock,5.59,474261397.0,628071,Finance
MSBI,Midland States Bancorp Inc. Common Stock,21.92,472413724.0,139522,Finance
ITIC,Investors Title Company Common Stock,249.89,471685867.0,7344,Finance
GBFH,GBank Financial Holdings Inc. Common Stock,32.37,465354778.0,46265,Finance
HBCP,Home Bancorp Inc. Common Stock,59.38,464835191.0,19046,Finance
RILYZ,BRC Group Holdings Inc. 5.25% Senior Notes due 2028,15.08,459895755.0,54075,Finance
DHIL,Diamond Hill Investment Group Inc. Class A Common Stock,169.76,459251049.0,62333,Finance
FBIZ,First Business Financial Services Inc. Common Stock,55.1,458666616.0,14695,Finance
BSRR,Sierra Bancorp Common Stock,33.97,457999098.0,56991,Finance
FRPH,FRP Holdings Inc. Common Stock,23.94,457625597.0,58884,Finance
GUT,Gabelli Utility Trust (The) Common Stock,6.19,454339990.0,182557,Finance
ETB,Eaton Vance Tax-Managed Buy-Write Income Fund Eaton Vance Tax-Managed Buy-Write Income Fund Common Shares of Beneficial Interest,15.45,453788099.0,39864,Finance
BKKT,Bakkt Holdings Inc. Class A Common Stock,18.72,449999484.0,2171492,Finance
