symbol,name,price,marketCap,volume,industry
FRBA,First Bank Common Stock,15.86,398631632.0,55747,Finance
BMRC,Bank of Marin Bancorp Common Stock,24.7,398324204.0,86118,Finance
GCBC,Greene County Bancorp Inc. Common Stock,23.38,398087239.0,14702,Finance
SAY,Saratoga Investment Corp 8.125% Notes due 2027,25.3,396403714.0,10407,Finance
CZNC,Citizens & Northern Corp Common Stock,22.11,395995473.0,63232,Finance
SAZ,Saratoga Investment Corp 8.50% Notes due 2028,25.255,395698648.0,2801,Finance
MCI,Barings Corporate Investors Common Stock,19.43,393685200.0,17278,Finance
VKI,Invesco Advantage Municipal Income Trust II Common Shares of Beneficial Interest (DE),8.75,388552675.0,145868,Finance
SAT,Saratoga Investment Corp 6.00% Notes due 2027,24.7501,387787809.0,9551,Finance
BOC,Boston Omaha Corporation Class A Common Stock,12.3,386877238.0,148777,Finance
LEO,BNY Mellon Strategic Municipals Inc. Common Stock,6.17,384334569.0,230479,Finance
ATLCZ,Atlanticus Holdings Corporation 9.25% Senior Notes due 2029,25.16,380556297.0,77262,Finance
BSVN,Bank7 Corp. Common stock,39.88,379631080.0,34326,Finance
SOR,Source Capital Inc. Cmn Shs of BI,45.4549,379297640.0,11097,Finance
BWFG,Bankwell Financial Group Inc. Common Stock,47.41,378179519.0,31404,Finance
ATLCL,Atlanticus Holdings Corporation 6.125% Senior Notes due 2026,25.0,378136225.0,6170,Finance
AII,American Integrity Insurance Group Inc. Common Stock,19.29,377679084.0,144902,Finance
ISTR,Investar Holding Corporation Common Stock,27.11,372763178.0,254247,Finance
TACO,Berto Acquisition Corp. Ordinary Shares,10.2,371710766.0,22874,Finance
GBFH,GBank Financial Holdings Inc. Common Stock,25.8,370903715.0,55434,Finance
BRBS,Blue Ridge Bankshares Inc. Common Stock,4.05,369928948.0,215050,Finance
RBB,RBB Bancorp Common Stock,21.22,362149008.0,54872,Finance
SAR,Saratoga Investment Corp New,22.19,359124247.0,128534,Finance
RILYL,BRC Group Holdings Inc. Depositary Shares each representing 1/1000th in a share of 7.375% Series B Cumulative Perpetual Preferred Stock par value $0.0001,11.32,353395344.0,8480,Finance
KTF,DWS Municipal Income Trust,8.93,352743376.0,164512,Finance
PBFS,Pioneer Bancorp Inc. Common Stock,14.04,352078286.0,23814,Finance
PMO,Putnam Municipal Opportunities Trust Common Stock,10.32,350689771.0,53289,Finance
PPT,Putnam Premier Income Trust Common Stock,3.52,350339486.0,109491,Finance
CION,CION Investment Corporation Common Stock,6.91,348930981.0,654368,Finance
FMAO,Farmers & Merchants Bancorp Inc. Common Stock,25.16,345901542.0,42792,Finance
VALU,Value Line Inc. Common Stock,36.68,344323890.0,942,Finance
ATLCP,Atlanticus Holdings Corporation 7.625% Series B Cumulative Perpetual Preferred Stock no par value per share,23.05,343892562.0,11074,Finance
LDI,loanDepot Inc. Class A Common Stock,1.5,343231977.0,1830887,Finance
PLBC,Plumas Bancorp,48.75,340225665.0,37880,Finance
USCB,USCB Financial Holdings Inc. Class A Common Stock,18.51,337936811.0,33127,Finance
ISBA,Isabella Bank Corporation Common stock,45.75,335349147.0,32805,Finance
WSBF,Waterstone Financial Inc. Common Stock (MD),18.26,335252322.0,89481,Finance
NECB,NorthEast Community Bancorp Inc. Common Stock,23.94,331186487.0,31843,Finance
NEWT,NewtekOne Inc. Common Stock,11.47,330697202.0,330395,Finance
PKBK,Parke Bancorp Inc. Common Stock,27.98,328231981.0,112643,Finance
MVBF,MVB Financial Corp. Common Stock,25.38,326001354.0,48467,Finance
INV,Innventure Inc. Common Stock,4.07,325882128.0,1583837,Finance
ONIT,Onity Group Inc. Common Stock,38.21,325611712.0,45781,Finance
GBAB,Guggenheim Taxable Municipal Bond & Investment Grade Debt Trust Common Shares of Beneficial Interest,14.485,324419169.0,113722,Finance
BCML,BayCom Corp Common Stock,29.61,323024876.0,27467,Finance
FRST,Primis Financial Corp. Common Stock,13.06,322571356.0,191515,Finance
GREEL,Greenidge Generation Holdings Inc. 8.50% Senior Notes due 2026,20.5,321305049.0,7661,Finance
RILYP,BRC Group Holdings Inc. Depositary Shares each representing a 1/1000th fractional interest in a share of Series A Cumulative Perpetual Preferred Stock,10.28,320927928.0,17032,Finance
HPP,Hudson Pacific Properties Inc. Common Stock,5.89,319485521.0,1659443,Finance
NWFL,Norwood Financial Corp. Common Stock,29.3,319065368.0,28824,Finance
CMTG,Claros Mortgage Trust Inc. Common Stock,2.27,318296594.0,882003,Finance
FNLC,First Bancorp Inc  (ME) Common Stock,28.15,317259480.0,30771,Finance
OFSSH,OFS Capital Corporation 4.95% Notes due 2028,23.65,316864545.0,342,Finance
PCB,PCB Bancorp Common Stock,22.24,316376877.0,32538,Finance
LNKB,LINKBANCORP Inc. Common Stock,8.42,315477158.0,98620,Finance
EFT,Eaton Vance Floating Rate Income Trust Common Shares of Beneficial Interest,10.83,315049194.0,56734,Finance
MLP,Maui Land & Pineapple Company Inc. Common Stock,15.83,312511253.0,8576,Finance
TCPC,BlackRock TCP Capital Corp. Common Stock,3.7,312024837.0,1501704,Finance
TSBK,Timberland Bancorp Inc. Common Stock,39.26,309538639.0,29065,Finance
OPENL,Opendoor Technologies Inc  Series A Warrants each whole warrant exercisable to purchase one share of Common Stock at an exercise price of $13.00 per warrant,0.3209,307526647.0,160702,Finance
CBK,Commercial Bancgroup Inc. Common Stock,25.1,307215064.0,30826,Finance
PNNT,PennantPark Investment Corporation Common Stock,4.7,306891642.0,865318,Finance
RM,Regional Management Corp. Common Stock,32.57,306057978.0,58712,Finance
AVBH,Avidbank Holdings Inc. Common stock,27.55,302547681.0,127910,Finance
PMM,Putnam Managed Municipal Income Trust Common Stock,6.14,299256287.0,72203,Finance
FSBW,FS Bancorp Inc. Common Stock,39.88,299161495.0,15836,Finance
MBI,MBIA Inc. Common Stock,5.9,298015779.0,275833,Finance
CZFS,Citizens Financial Services Inc. Common Stock,61.79,297038062.0,9554,Finance
FCNCN,First Citizens BancShares Inc. Depositary Shares each representing a 1/40th interest in a share of 6.625% Non-Cumulative Perpetual Preferred Stock Series E,24.32,290312120.0,68817,Finance
OCCIO,OFS Credit Company Inc. 6.125% Series C Term Preferred Stock,24.95,289831925.0,225,Finance
OIA,Invesco Municipal Income Opportunities Trust Common Stock,6.0,285633534.0,100236,Finance
OCCIN,OFS Credit Company Inc. 5.25% Series E Term Preferred Stock Due 2026,24.51,284720660.0,2899,Finance
COSO,CoastalSouth Bancshares Inc. Common Stock,24.02,284715257.0,145211,Finance
JMSB,John Marshall Bancorp Inc. Common Stock,19.96,283702578.0,30742,Finance
MIN,MFS Intermediate Income Trust Common Stock,2.46,282648517.0,466657,Finance
ARDC,Ares Dynamic Credit Allocation Fund Inc. Common Shares,12.15,278416509.0,125004,Finance
OPENZ,Opendoor Technologies Inc  Series Z Warrants each whole warrant exercisable to purchase one share of Common Stock at an exercise price of $17.00 per warrant,0.29,277914389.0,243018,Finance
SCM,Stellus Capital Investment Corporation Common Stock,9.46,273841023.0,221798,Finance
FGBIP,First Guaranty Bancshares Inc. 6.75% Series A Fixed-Rate Non-Cumulative Perpetual Preferred Stock,17.77,272821868.0,863,Finance
FUND,Sprott Focus Trust Inc. Common Stock,9.19,272332389.0,48010,Finance
EOT,Eaton Vance Municipal Income Trust EATON VANCE NATIONAL MUNICIPAL OPPORTUNITIES TRUST,17.3999,271872063.0,15360,Finance
CPZ,Calamos Long/Short Equity & Dynamic Income Trust Common Stock,13.8,270924277.0,144678,Finance
BKKT,Bakkt Inc. Class A Common Stock,8.86,270780171.0,1042506,Finance
NODK,NI Holdings Inc. Common Stock,13.17,270479152.0,33584,Finance
FVCB,FVCBankcorp Inc. Common Stock,15.07,270402396.0,143922,Finance
FBLA,FB Bancorp Inc. Common Stock,13.56,268996500.0,444032,Finance
FCCO,First Community Corporation Common Stock,28.615,268524448.0,76518,Finance
BLFY,Blue Foundry Bancorp Common Stock,12.9,267819803.0,160203,Finance
MMT,MFS Multimarket Income Trust Common Stock,4.49,267371889.0,133994,Finance
OVLY,Oak Valley Bancorp (CA) Common Stock,31.64,265403312.0,41040,Finance
MCR,MFS Charter Income Trust Common Stock,6.02,264930448.0,58620,Finance
CHMG,Chemung Financial Corp Common Stock,54.84,264244730.0,6269,Finance
WNEB,Western New England Bancorp Inc. Common Stock,12.82,259740866.0,141127,Finance
ACV,Virtus Diversified Income & Convertible Fund Common Shares of Beneficial Interest,25.0,259073850.0,39042,Finance
RWAY,Runway Growth Finance Corp. Common Stock,7.13,257635684.0,517712,Finance
FDBC,Fidelity D & D Bancorp Inc. Common Stock,44.31,257227659.0,6700,Finance
FCNCO,First Citizens BancShares Inc. 5.625% Non-Cumulative Perpetual Preferred Stock Series C,21.42,255694310.0,27377,Finance
FCNCP,First Citizens BancShares Inc. Depositary Shares,21.19,252948759.0,18932,Finance
VPV,Invesco Pennsylvania Value Municipal Income Trust Common Stock (DE),10.54,251163394.0,37783,Finance
SSSS,SuRo Capital Corp. Common Stock,9.87,250577152.0,195496,Finance
CFFI,C&F Financial Corporation Common Stock,75.01,244217633.0,7975,Finance
SNFCA,Security National Financial Corporation Class A Common Stock,9.33,242766600.0,87252,Finance
ATLO,Ames National Corporation Common Stock,27.38,242510684.0,77523,Finance
EXOD,Exodus Movement Inc. Class A Common Stock,8.12,242086611.0,130963,Finance
MYFW,First Western Financial Inc. Common Stock,24.72,240651450.0,35097,Finance
FUNC,First United Corporation Common Stock,36.99,240486120.0,22751,Finance
FTF,Franklin Limited Duration Income Trust Common Shares of Beneficial Interest,5.9,238391707.0,138714,Finance
FXNC,First National Corporation Common Stock,26.33,237254812.0,46282,Finance
CIA,Citizens Inc. Class A Common Stock ($1.00 Par),4.68,235402788.0,143801,Finance
CMTV,Community Bancorp. Common Stock,42.0,235393704.0,80456,Finance
NKSH,National Bankshares Inc. Common Stock,36.76,234014197.0,31685,Finance
HWBK,Hawthorn Bancshares Inc. Common Stock,33.9,233971359.0,7543,Finance
BPRN,Princeton Bancorp Inc. Common Stock (PA),34.18,232032673.0,13905,Finance
RILY,BRC Group Holdings Inc. Common Stock,7.27,226959731.0,805601,Finance
LCNB,LCNB Corporation Common Stock,15.88,226098900.0,39899,Finance
FRAF,Franklin Financial Services Corporation Common Stock,50.15,224817084.0,18092,Finance
EICA,Eagle Point Income Company Inc. 5.00% Series A Term Preferred Stock due 2026,24.97,222435457.0,3217,Finance
MRBK,Meridian Corporation Common Stock,18.72,222303332.0,95905,Finance
LIEN,Chicago Atlantic BDC Inc. Common Stock,9.67,220675105.0,134976,Finance
OSG,Octave Specialty Group Inc. Common Stock,4.9,220264374.0,702011,Finance
FINW,FinWise Bancorp Common Stock,16.12,219021167.0,11531,Finance
ECC,Eagle Point Credit Company Inc. Common Stock,3.61,218991712.0,1606893,Finance
BRR,ProCap Financial Inc. Common Stock,2.62,218567671.0,408325,Finance
MFM,MFS Municipal Income Trust Common Stock,5.295,218088506.0,98391,Finance
PRHIZ,Presurance Holdings Inc. 9.75% Senior Unsecured Notes due 2028,17.51,214022646.0,27,Finance
KINS,Kingstone Companies Inc. Common Stock,14.74,213388401.0,131662,Finance
INBKZ,First Internet Bancorp 6.0% Fixed-to-Floating Rate Subordinated Notes Due 2029,24.3201,211903317.0,345,Finance
VABK,Virginia National Bankshares Corporation Common Stock,39.29,211896431.0,6721,Finance
VTN,Invesco Trust for Investment Grade New York Municipals Common Stock,10.84,211228012.0,43495,Finance
AOMR,Angel Oak Mortgage REIT Inc. Common Stock,8.35,208037302.0,78977,Finance
PEBK,Peoples Bancorp of North Carolina Inc. Common Stock,38.08,207973539.0,34618,Finance
MFIN,Medallion Financial Corp. Common Stock,8.74,205652925.0,69558,Finance
OPRT,Oportun Financial Corporation Common Stock,4.61,205146235.0,493137,Finance
SWKH,SWK Holdings Corporation Common Stock,16.8,203212447.0,8209,Finance
HRZN,Horizon Technology Finance Corporation Common Stock,4.23,202213928.0,880029,Finance
FT,Franklin Universal Trust Common Stock,8.03,201809109.0,76828,Finance
OVBC,Ohio Valley Banc Corp. Common Stock,41.96,197673602.0,12130,Finance
MPV,Barings Participation Investors Common Stock,18.47,195813399.0,9877,Finance
HNNAZ,Hennessy Advisors Inc. 4.875% Notes due 2026,24.8601,193599520.0,111,Finance
OPBK,OP Bancorp Common Stock,12.92,192387870.0,64207,Finance
CZWI,Citizens Community Bancorp Inc. Common Stock,19.41,186891359.0,65862,Finance
BMEZ,BlackRock Health Sciences Term Trust Common Shares of Beneficial Interest,13.85,184662299.0,251589,Finance
MNSBP,MainStreet Bancshares Inc. Depositary Shares,24.9499,183782186.0,2546,Finance
INBK,First Internet Bancorp Common Stock,20.79,181219403.0,79339,Finance
UBFO,United Security Bancshares Common Stock,10.3,181031286.0,27561,Finance
CFBK,CF Bankshares Inc. Common Stock,28.07,180602436.0,75271,Finance
EFSI,Eagle Financial Services Inc Common Stock,33.31,180286245.0,21371,Finance
CBFV,CB Financial Services Inc. Common Stock,34.81,176691313.0,7117,Finance
RBKB,Rhinebeck Bancorp Inc. Common Stock,15.57,173465884.0,16921,Finance
BVFL,BV Financial Inc. Common Stock,19.2,170955398.0,17998,Finance
FCAP,First Capital Inc. Common Stock,50.21,168084352.0,5473,Finance
CPSS,Consumer Portfolio Services Inc. Common Stock,7.72,167989323.0,43188,Finance
ALTS,ALT5 Sigma Corporation Common Stock,1.32,166767644.0,1990619,Finance
PNBK,Patriot National Bancorp Inc. Common Stock,1.45,166736975.0,1344338,Finance
EBMT,Eagle Bancorp Montana Inc. Common Stock,20.88,166318199.0,68535,Finance
FNWD,Finward Bancorp Common Stock,38.11,164901970.0,7480,Finance
SAMG,Silvercrest Asset Management Group Inc. Class A Common Stock,13.725,161872856.0,29275,Finance
LPRO,Open Lending Corporation Common Stock,1.37,161216342.0,667392,Finance
MNSB,MainStreet Bancshares Inc. Common Stock,21.75,160211566.0,49368,Finance
PIM,Putnam Master Intermediate Income Trust Common Stock,3.185,160057060.0,44366,Finance
FGNXP,FG Nexus Inc. 8.00% Cumulative Preferred Stock,24.25,158964643.0,8690,Finance
CHCI,Comstock Holding Companies Inc. Class A Common Stock,15.36,156836321.0,53481,Finance
WHF,WhiteHorse Finance Inc. Common Stock,7.05,156750017.0,114901,Finance
SRG,Seritage Growth Properties Class A Common Stock,2.77,156019161.0,200890,Finance
HNVR,Hanover Bancorp Inc. Common Stock,21.61,154989686.0,8506,Finance
DOUG,Douglas Elliman Inc. Common Stock,1.75,154380524.0,948790,Finance
GRX,The Gabelli Healthcare & Wellness Trust Common Shares of Beneficial Interest,9.0,153836757.0,50901,Finance
WHG,Westwood Holdings Group Inc Common Stock,16.11,152851245.0,21406,Finance
FOA,Finance of America Companies Inc. Class A Common Stock,17.72,151540430.0,132299,Finance
OXSQ,Oxford Square Capital Corp. Common Stock,1.71,149643343.0,2125764,Finance
LARK,Landmark Bancorp Inc. Common Stock,24.6,149426083.0,14980,Finance
BCBP,BCB Bancorp Inc. (NJ) Common Stock,8.555,148505655.0,116786,Finance
ECBK,ECB Bancorp Inc. Common Stock,16.76,147435876.0,8468,Finance
GNT,GAMCO Natural Resources Gold & Income Trust,7.88,145586459.0,73191,Finance
RMBI,Richmond Mutual Bancorporation Inc. Common Stock,13.65,142642596.0,18083,Finance
SRBK,SR Bancorp Inc. Common stock,17.02,141869665.0,38970,Finance
BANX,ArrowMark Financial Corp. Common Stock,19.09,135589130.0,27724,Finance
BZAI,Blaize Holdings Inc. Common Stock,1.1,134247377.0,2267533,Finance
SBFG,SB Financial Group Inc. Common Stock,20.82,131217113.0,10617,Finance
GHI,Greystone Housing Impact Investors LP Beneficial Unit Certificates representing assignments of limited partnership interests,5.53,130300680.0,279315,Finance
JHS,John Hancock Income Securities Trust Common Stock,10.9,126947777.0,31010,Finance
FGBI,First Guaranty Bancshares Inc. Common Stock,8.19,125740636.0,6255,Finance
DFDV,DeFi Development Corp. Common Stock,4.26,125534357.0,846246,Finance
RMAX,RE/MAX Holdings Inc. Class A Common Stock,6.17,124278941.0,294574,Finance
HYNE,Hoyne Bancorp Inc. Common Stock,14.71,119105958.0,143028,Finance
CXE,MFS High Income Municipal Trust Common Stock,3.76,118536906.0,54827,Finance
SLQT,SelectQuote Inc. Common Stock,0.6668,117549948.0,1607957,Finance
AFBI,Affinity Bancshares Inc. Common Stock (MD),19.26,117387485.0,4018,Finance
LSBK,Lake Shore Bancorp Inc. Common Stock,14.84,116287724.0,11573,Finance
GLU,Gabelli Global Utility Common Shares of Beneficial Ownership,19.41,115856563.0,11750,Finance
SFBC,Sound Financial Bancorp Inc. Common Stock,44.99,115447444.0,26879,Finance
JHI,John Hancock Investors Trust Common Stock,12.95,113241884.0,32796,Finance
UNB,Union Bankshares Inc. Common Stock,24.12,111290814.0,10694,Finance
RVSB,Riverview Bancorp Inc Common Stock,5.34,110596211.0,57464,Finance
BEEP,Mobile Infrastructure Corporation Common Stock,2.67,110004000.0,24421,Finance
GGT,Gabelli Multi-Media Trust Inc. (The) Common Stock,3.97,109316931.0,386579,Finance
BSBK,Bogota Financial Corp. Common Stock,8.38,108677681.0,20246,Finance
MGYR,Magyar Bancorp Inc. Common Stock,16.67,107988110.0,2893,Finance
SUIG,Sui Group Holdings Limited Common Stock,1.36,104451906.0,252874,Finance
PROV,Provident Financial Holdings Inc. Common Stock,16.21,103339074.0,7424,Finance
MRCC,Monroe Capital Corporation Common Stock,4.69,101615135.0,149291,Finance
CMU,MFS Municipal Income Trust Common Stock,3.56,100838118.0,12055,Finance
HIT,Health In Tech Inc. Class A Common Stock,1.77,100728590.0,164543,Finance
MGF,MFS Government Markets Income Trust Common Stock,2.94,95836335.0,39849,Finance
UBCP,United Bancorp Inc. Common Stock,16.56,95333469.0,13531,Finance
BOTJ,Bank of the James Financial Group Inc. Common Stock,20.96,95228364.0,5396,Finance
BCIC,BCP Investment Corporation Common Stock,7.22,89430667.0,251294,Finance
RDZN,Roadzen Inc. Ordinary Shares,1.12,89259153.0,117906,Finance
EVF,Eaton Vance Senior Income Trust Common Stock,4.99,87518901.0,49855,Finance
SSBI,Summit State Bank Common Stock,13.04,87017615.0,17318,Finance
FUSB,First US Bancshares Inc. Common Stock,15.28,86334399.0,3363,Finance
PROP,Prairie Operating Co. Common Stock,1.42,84698186.0,3152027,Finance
PBHC,Pathfinder Bancorp Inc. Common Stock (MD),13.64,84220289.0,1226,Finance
GCV,Gabelli Convertible and Income Securities Fund Inc. (The) Common Stock,4.4,83776128.0,87513,Finance
EIC,Eagle Point Income Company Inc. Common Stock,9.37,83468972.0,349580,Finance
SIEB,Siebert Financial Corp. Common Stock,2.04,82470949.0,40285,Finance
FNWB,First Northwest Bancorp Common Stock,8.61,81369210.0,12074,Finance
FDSB,Fifth District Bancorp Inc. Common Stock,14.71,81239653.0,3224,Finance
DTF,DTF Tax-Free Income 2028 Term Fund Inc. Common Stock,11.3771,79976087.0,4623,Finance
PFX,PhenixFIN Corporation Common Stock,40.0,79930360.0,2098,Finance
BTCS,BTCS Inc. Common Stock,1.65,78957084.0,538896,Finance
AUBN,Auburn National Bancorporation Inc. Common Stock,22.44,78398606.0,16166,Finance
HNNA,Hennessy Advisors Inc. Common Stock,9.68,76396273.0,7535,Finance
AEI,Alset Inc. Common Stock (TX),1.95,76203071.0,20285,Finance
GLV,Clough Global Dividend and Income Fund Common Shares of beneficial interest,5.93,75367827.0,18008,Finance
FLD,Fold Holdings Inc. Class A Common Stock,1.5,74746947.0,271809,Finance
CPBI,Central Plains Bancshares Inc. Common Stock,17.77,74727381.0,1501,Finance
CXH,MFS Investment Grade Municipal Trust Common Stock,8.15,74248497.0,7389,Finance
BYFC,Broadway Financial Corporation Class A Common Stock,7.81,73629993.0,691,Finance
CEV,Eaton Vance California Municipal Income Trust Shares of Beneficial Interest,10.31,72516158.0,17957,Finance
CLSKW,CleanSpark Inc. Warrant,0.2699,69027711.0,56164,Finance
CLST,Catalyst Bancorp Inc. Common Stock,16.59,68245619.0,2505,Finance
BLNE,Beeline Holdings Inc. Common Stock,2.34,67724432.0,515569,Finance
OBTC,Osprey Bitcoin Trust Common Units of Beneficial Interest,22.7464,66886585.0,30040,Finance
OPHC,OptimumBank Holdings Inc. Common Stock,5.4,65698760.0,7999,Finance
RFL,Rafael Holdings Inc. Class B Common Stock,1.26,65535296.0,51047,Finance
AFCG,Advanced Flower Capital Inc. Common Stock,2.71,63763167.0,206450,Finance
NSTS,NSTS Bancorp Inc. Common Stock,12.17,63759092.0,4372,Finance
ASRV,AmeriServ Financial Inc. Common Stock,3.66,62089217.0,17546,Finance
FSEA,First Seacoast Bancorp Inc. Common Stock,12.99,60976996.0,883,Finance
BENF,Beneficient Class A Common Stock,3.91,55575684.0,20987,Finance
TCBS,Texas Community Bancshares Inc. Common Stock,18.24,53164912.0,3251,Finance
AAME,Atlantic American Corporation Common Stock,2.52,51401015.0,7465,Finance
HFBL,Home Federal Bancorp Inc. of Louisiana Common Stock,16.2,49809119.0,2711,Finance
GOCO,GoHealth Inc. Class A Common Stock,1.69,48526660.0,90220,Finance
PFXNZ,PhenixFIN Corporation  5.25% Notes due 2028,23.9,47892469.0,71,Finance
EHTH,eHealth Inc. Common Stock,1.5,46609503.0,958651,Finance
FGNX,FG Nexus Inc. Common Stock ,7.05,46214463.0,41401,Finance
MLCI,Mount Logan Capital Inc. Common Stock,4.06,45456446.0,79595,Finance
OFS,OFS Capital Corporation Common Stock,3.14,42069965.0,221009,Finance
MBBC,Marathon Bancorp Inc. Common Stock,13.99,41111294.0,554,Finance
AIRE,reAlpha Tech Corp. Common Stock,0.3047,40175471.0,710342,Finance
GECC,Great Elm Capital Corp. Common Stock,5.05,38389898.0,109727,Finance
GROW,U.S. Global Investors Inc. Class A Common Stock,2.99,37532752.0,30664,Finance
KFFB,Kentucky First Federal Bancorp Common Stock,4.53,36632819.0,2332,Finance
BZAIW,Blaize Holdings Inc. Warrants,0.3,36612921.0,18395,Finance
BTM,Bitcoin Depot Inc. Class A Common Stock,3.27,36391778.0,152090,Finance
COHN,Cohen & Company Inc.,14.79,36214188.0,12013,Finance
BCG,Binah Capital Group Inc. Common Stock,2.17,36027338.0,6411,Finance
RAND,Rand Capital Corporation Common Stock,11.5,34152861.0,3010,Finance
OPAD,Offerpad Solutions Inc. Class A Common Stock,0.7,33047453.0,677419,Finance
OCCI,OFS Credit Company Inc. Common Stock,2.82,32758558.0,244323,Finance
USIO,Usio Inc. Common Stock,1.17,32463063.0,115119,Finance
MDBH,MDB Capital Holdings LLC Class A common,2.88,29285660.0,669,Finance
VEEA,Veea Inc. Common Stock,0.5626,28359297.0,195592,Finance
FTHM,Fathom Holdings Inc. Common Stock,0.7898,25582379.0,99861,Finance
ICMB,Investcorp Credit Management BDC Inc. Common Stock,1.77,25522979.0,51374,Finance
MBNKO,Medallion Bank Fixed-Rate Reset Non-Cumulative Perpetual Preferred Stock Series G par value $1.00 per share,25.02,25020000.0,16031,Finance
BAFN,BayFirst Financial Corp. Common Stock,5.98,24577818.0,7908,Finance
EQS,Equus Total Return Inc. Common Stock,1.72,24022717.0,18733,Finance
BRRWW,ProCap Financial Inc. Warrant,0.28,23358377.0,98918,Finance
GREE,Greenidge Generation Holdings Inc. Class A Common Stock,1.28,20222716.0,74253,Finance
LHAI,Linkhome Holdings Inc. Common stock,1.23,19962900.0,53644,Finance
IHT,InnSuites Hospitality Trust Shares of Beneficial Interest,1.03,9480979.0,15550,Finance
RDZNW,Roadzen Inc. Warrants,0.11,8766524.0,8020,Finance
CWD,CaliberCos Inc. Class A Common Stock,1.18,7710496.0,38310,Finance
PRHI,Presurance Holdings Inc. Common Stock,0.5924,7240835.0,13824,Finance
CELZ,Creative Medical Technology Holdings Inc. Common Stock,1.86,6875802.0,27461,Finance
PGYWW,Pagaya Technologies Ltd. Warrants,0.0798,6585610.0,188922,Finance
DAVEW,Dave Inc. Warrants,0.477,6467928.0,6092,Finance
RENX,RenX Enterprises Corp. Common Stock,0.139,6444178.0,3342080,Finance
FLDDW,Fold Holdings Inc. Warrant,0.125,6228912.0,55345,Finance
LMFA,LM Funding America Inc. Common Stock,0.3372,4762443.0,798156,Finance
EZRA,Reliance Global Group Inc. Common Stock,0.19,4038072.0,1000289,Finance
NCPL,Netcapital Inc. Common Stock,0.4732,3713626.0,48967,Finance
BTOG,Bit Origin Limited Class A Ordinary Shares,2.37,3500116.0,34215,Finance
SHFS,SHF Holdings Inc. Class A Common Stock,0.87,2680536.0,70710,Finance
BCGWW,Binah Capital Group Inc. Warrants,0.154,2556779.0,4,Finance
STSSW,Sharps Technology Inc. Warrant,0.0454,1316391.0,72039,Finance
BTMWW,Bitcoin Depot Inc. Warrant,0.0389,432917.0,61535,Finance
NCPLW,Netcapital Inc. Warrants,0.0248,194628.0,6106,Finance
BENFW,Beneficient Warrant,0.0106,150666.0,12443,Finance
SHFSW,SHF Holdings Inc. Warrants,0.0328,101059.0,1,Finance
LRHC,La Rosa Holdings Corp. Common Stock,0.6101,99161.0,155877,Finance
EVT,Eaton Vance Tax Advantaged Dividend Income Fund Common Shares of Beneficial Interest,24.22,0.0,139112,Finance
CIK,Credit Suisse Asset Management Income Fund Inc. Common Stock,2.543,0.0,847855,Finance
ETJ,Eaton Vance Risk-Managed Diversified Equity Income Fund Common Shares of Beneficial Interest,8.16,0.0,357252,Finance
ETY,Eaton Vance Tax-Managed Diversified Equity Income Fund Common Shares of Beneficial Interest,13.7,0.0,241332,Finance
LFAC,Leapfrog Acquisition Corporation Class A Ordinary Shares,9.9,0.0,29,Finance
EVOXW,Evolution Global Acquisition Corp Warrants,0.4085,0.0,200,Finance
BWG,BrandywineGLOBAL Global Income Opportunities Fund Inc.,7.75,0.0,100227,Finance
VGI,Virtus Global Multi-Sector Income Fund Common Shares of Beneficial Interest,7.35,0.0,53387,Finance
VHCPU,Vine Hill Capital Investment Corp. II Units,10.01,0.0,161,Finance
LFACW,Leapfrog Acquisition Corporation Warrants,0.35,0.0,400,Finance
VLT,Invesco High Income Trust II,10.19,0.0,13264,Finance
LCCC,Lakeshore Acquisition III Corp. Ordinary Shares,10.28,0.0,51,Finance
LCCCR,Lakeshore Acquisition III Corp. Rights,0.2142,0.0,401,Finance
LDP,Cohen & Steers Limited Duration Preferred and Income Fund Inc.,20.03,0.0,81752,Finance
PGP,Pimco Global StocksPlus & Income Fund Common Shares of Beneficial Interest,8.31,0.0,65916,Finance
PHK,Pimco High Income Fund,4.54,0.0,767882,Finance
VACHU,Voyager Acquisition Corp Unit,11.5,0.0,1,Finance
LATA,Galata Acquisition Corp. II Class A Ordinary Shares,10.01,0.0,1,Finance
LATAW,Galata Acquisition Corp. II Warrant,0.33,0.0,3749,Finance
AFB,AllianceBernstein National Municipal Income Fund Inc,10.62,0.0,204565,Finance
KTH,Structures Products Cp 8% CorTS Issued by Peco Energy Cap Tr II Preferred Stock,29.14,0.0,64,Finance
KTN,Structured Products Corp 8.205% CorTS 8.205% Corporate Backed Trust Securities (CorTS),25.7502,0.0,792,Finance
BTO,John Hancock Financial Opportunities Fund Common Stock,33.88,0.0,71358,Finance
VACHW,Voyager Acquisition Corp Warrants,0.13,0.0,11,Finance
FMY,First Trust Mortgage Income Fund Common Shares of Beneficial Interest,11.735,0.0,5965,Finance
CIF,MFS Intermediate High Income Fund Common Stock,1.63,0.0,42975,Finance
