symbol,name,price,marketCap,volume,industry
JPM,JP Morgan Chase & Co. Common Stock,303.0,811891959654.0,7874402,Finance
BAC,Bank of America Corporation Common Stock,51.49,365403452620.0,27461930,Finance
MS,Morgan Stanley Common Stock,200.51,316261378657.0,5817427,Finance
GS,Goldman Sachs Group Inc. (The) Common Stock,988.17,291517483210.0,2452321,Finance
WFC,Wells Fargo & Company Common Stock,75.92,232329586384.0,9433387,Finance
C,Citigroup Inc. Common Stock,125.22,213572346305.0,6834944,Finance
AXP,American Express Company Common Stock,309.7,211316499397.0,1992692,Finance
BLK,BlackRock Inc. Common Stock,1063.75,165130155799.0,624824,Finance
SCHW,Charles Schwab Corporation (The) Common Stock,90.41,157235241188.0,8077912,Finance
IBKR,Interactive Brokers Group Inc. Class A Common Stock,83.83,142205334192.0,4839113,Finance
SPGI,S&P Global Inc. Common Stock,415.73,123056080000.0,2062584,Finance
PGR,Progressive Corporation (The) Common Stock,198.97,116265426242.0,3437930,Finance
COF,Capital One Financial Corporation Common Stock,186.66,116157170875.0,3725556,Finance
CME,CME Group Inc. Class A Common Stock,289.29,104826935494.0,2443721,Finance
BNY,The Bank of New York Mellon Corporation Common Stock,138.98,95392959674.0,3011322,Finance
BX,Blackstone Inc. Common Stock,118.57,88083258716.0,4672563,Finance
PNC,PNC Financial Services Group Inc. (The) Common Stock,218.37,87689668690.0,1608821,Finance
ICE,Intercontinental Exchange Inc. Common Stock,151.49,85669487868.0,4175051,Finance
KKR,KKR & Co. Inc. Common Stock,94.76,85082439889.0,3846833,Finance
USB,U.S. Bancorp Common Stock,54.56,84693474087.0,6126688,Finance
MRSH,Marsh Common Stock,165.12,79553908005.0,2087376,Finance
MCO,Moody's Corporation Common Stock,445.37,77806139000.0,1046695,Finance
APO,Apollo Global Management Inc. (New) Common Stock,130.9,75466142452.0,3235616,Finance
AON,Aon plc Class A Ordinary Shares (Ireland),324.22,69245918405.0,946462,Finance
HOOD,Robinhood Markets Inc. Class A Common Stock,75.92,68366343927.0,16266446,Finance
TRV,The Travelers Companies Inc. Common Stock,307.23,65330829030.0,1552547,Finance
AFL,AFLAC Incorporated Common Stock,117.81,59963511540.0,2851793,Finance
TFC,Truist Financial Corporation Common Stock,47.89,59665158480.0,7088412,Finance
ALL,Allstate Corporation (The) Common Stock,214.44,55201344229.0,2193278,Finance
MET,MetLife Inc. Common Stock,84.3,54241720470.0,4190171,Finance
AJG,Arthur J. Gallagher & Co. Common Stock,207.41,53283629000.0,1351911,Finance
NDAQ,Nasdaq Inc. Common Stock,90.41,51130543547.0,1980852,Finance
COIN,Coinbase Global Inc. Class A Common Stock,193.56,50985855226.0,5674280,Finance
HBANL,Huntington Bancshares Incorporated Depositary Shares Each Representing a 1/40th Interest in a Share of 6.875% Series J Non-Cumulative Perpetual Preferred Stock,25.03,50739078593.0,17335,Finance
HBANM,Huntington Bancshares Incorporated Depositary Shares each representing a 1/1000th interest in a share of Huntington Series I Preferred Stock,22.06,44718500749.0,18284,Finance
FITB,Fifth Third Bancorp Common Stock,49.16,44554275700.0,4218805,Finance
STT,State Street Corporation Common Stock,153.69,42536325302.0,1572146,Finance
AIG,American International Group Inc. New Common Stock,78.62,41684813095.0,4013690,Finance
HBANZ,Huntington Bancshares Incorporated Depositary Shares Each Representing a 1/1000th Interest in a Share of 5.50% Series L Non-Cumulative Perpetual Preferred Stock,20.45,41454820504.0,7570,Finance
ARES,Ares Management Corporation Class A Common Stock,123.99,40897807148.0,1558648,Finance
AMP,Ameriprise Financial Inc. Common Stock,450.57,40504929138.0,796144,Finance
RKT,Rocket Companies Inc. Class A Common Stock,13.87,39244190244.0,24249108,Finance
CBRE,CBRE Group Inc Common Stock Class A,131.04,38370684512.0,2518638,Finance
HIG,The Hartford Insurance Group Inc. Common Stock,136.02,37287274136.0,1828860,Finance
PRU,Prudential Financial Inc. Common Stock,104.24,36171280000.0,1391319,Finance
HBANP,Huntington Bancshares Incorporated Depositary Shares 4.500% Series H Non-Cumulative Perpetual Preferred Stock,16.54,33528739909.0,45092,Finance
HBAN,Huntington Bancshares Incorporated Common Stock,15.85,32130019804.0,16063902,Finance
MTB,M&T Bank Corporation Common Stock,212.33,31094679590.0,1667444,Finance
NTRS,Northern Trust Corporation Common Stock,167.11,30923247284.0,972534,Finance
RJF,Raymond James Financial Inc. Common Stock,150.42,29314305974.0,2141112,Finance
CRCL,Circle Internet Group Inc. Class A Common Stock,114.88,28556414326.0,10864735,Finance
CFG,Citizens Financial Group Inc. Common Stock,62.78,26548528319.0,3028591,Finance
CINF,Cincinnati Financial Corporation Common Stock,168.37,26044606751.0,620210,Finance
WRB,W.R. Berkley Corporation Common Stock,67.47,25117511108.0,2295949,Finance
TW,Tradeweb Markets Inc. Class A Common Stock,105.69,24945590159.0,2418528,Finance
SYF,Synchrony Financial Common Stock,72.0,24218657424.0,3568022,Finance
RF,Regions Financial Corporation Common Stock,27.71,23647146998.0,7960212,Finance
FITBM,Fifth Third Bancorp Depositary Shares Representing a 1/40th Ownership Interest in a Share of 6.875% Fixed-Rate Reset Non-Cumulative Perpetual Preferred Stock Series M,25.99,23555037133.0,25069,Finance
KEY,KeyCorp Common Stock,21.49,23300010035.0,6517887,Finance
MKL,Markel Group Inc. Common Stock,1853.45,23193535800.0,56112,Finance
FITBI,Fifth Third Bancorp Depositary Shares,25.55,23156260051.0,24266,Finance
FCNCA,First Citizens BancShares Inc. Class A Common Stock,1989.48,23052053034.0,47841,Finance
LPLA,LPL Financial Holdings Inc. Common Stock,287.82,23020667053.0,1924582,Finance
AFRM,Affirm Holdings Inc. Class A Common Stock,67.18,22498485597.0,3964597,Finance
L,Loews Corporation Common Stock,109.18,22465845554.0,924491,Finance
PFG,Principal Financial Group Inc Common Stock,103.92,22448006945.0,906091,Finance
TROW,T. Rowe Price Group Inc. Common Stock,101.95,21844480482.0,1340448,Finance
FITBP,Fifth Third Bancorp Depositary Shares each representing 1/40th share of Fifth Third 6.00% Non-Cumulative Perpetual Class B Preferred Stock Series A,23.45,21253005801.0,18075,Finance
SOFI,SoFi Technologies Inc. Common Stock  ,15.65,20074899780.0,48956482,Finance
BRO,Brown & Brown Inc. Common Stock,58.52,19835227655.0,2357109,Finance
EFX,Equifax Inc. Common Stock,163.1,19420709908.0,1990812,Finance
INVH,Invitation Homes Inc. Common Stock,29.03,17245037983.0,3778572,Finance
EWBC,East West Bancorp Inc. Common Stock,123.0,16850540226.0,500683,Finance
FITBO,Fifth Third Bancorp Depositary Shares each representing a 1/1000th ownership interest in a share of Non-Cumulative Perpetual Preferred Stock Series K,18.55,16812079215.0,23183,Finance
CG,The Carlyle Group Inc. Common Stock,45.13,16245645891.0,3060330,Finance
TPG,TPG Inc. Class A Common Stock,41.75,16045040362.0,2581833,Finance
BEN,Franklin Resources Inc. Common Stock,30.86,16036002819.0,3797009,Finance
OWL,Blue Owl Capital Inc. Class A Common Stock,10.2,15902313152.0,32077801,Finance
APOS,Apollo Global Management Inc. 7.625% Fixed-Rate Resettable Junior Subordinated Notes due 2053,26.14,14887625844.0,49912,Finance
PNFP,Pinnacle Financial Partners Inc. Common stock,97.33,14707226012.0,649681,Finance
KKRS,KKR Group Finance Co. IX LLC 4.625% Subordinated Notes due 2061,16.31,14644307668.0,22239,Finance
VLYPN,Valley National Bancorp 8.250% Fixed-Rate Reset Non-Cumulative Perpetual Preferred Stock Series C,25.94,14374170539.0,5326,Finance
SLMBP,SLM Corporation Floating Rate Non-Cumulative Preferred Stock Series B,74.97,14138816835.0,1067,Finance
RGA,Reinsurance Group of America Incorporated Common Stock,215.17,14096467283.0,430506,Finance
VLYPP,Valley National Bancorp 6.25% Fixed-to-Floating Rate Non-Cumulative Perpetual Preferred Stock Series A,25.26,13997361134.0,569,Finance
CSGP,CoStar Group Inc. Common Stock,33.93,13855509410.0,5411021,Finance
VLYPO,Valley National Bancorp 5.50% Fixed-to-Floating Rate Non-Cumulative Perpetual Preferred Stock Series B,25.0002,13853397776.0,5322,Finance
APLD,Applied Digital Corporation Common Stock,48.02,13722653263.0,43074451,Finance
JLL,Jones Lang LaSalle Incorporated Common Stock,292.94,13590533861.0,409916,Finance
UNM,Unum Group Common Stock,84.49,13499494095.0,1389088,Finance
ARCC,Ares Capital Corporation Common Stock,18.74,13455748115.0,3208081,Finance
EVR,Evercore Inc. Class A Common Stock,346.26,13394196910.0,327761,Finance
TRU,TransUnion Common Stock,69.47,13393816000.0,1681321,Finance
FNF,Fidelity National Financial Inc. Common Stock,49.36,13285616174.0,1568351,Finance
ALLY,Ally Financial Inc. Common Stock,42.75,13103860901.0,2778884,Finance
CET,Central Securities Corporation Common Stock,52.97,12820074844.0,8627,Finance
AIZ,Assurant Inc. Common Stock,255.7,12669330781.0,377946,Finance
CRBG,Corebridge Financial Inc. Common Stock,27.65,12628670796.0,4699585,Finance
GL,Globe Life Inc. Common Stock,156.6,12159169573.0,575963,Finance
CNA,CNA Financial Corporation Common Stock,44.33,11992658070.0,376907,Finance
EQH,Equitable Holdings Inc. Common Stock,42.52,11970204463.0,2829565,Finance
IVZ,Invesco Ltd Common Stock,26.98,11960143050.0,4385820,Finance
HUT,Hut 8 Corp. Common Stock,105.26,11851656229.0,4450585,Finance
WBS,Webster Financial Corporation Common Stock,72.58,11759883225.0,8917647,Finance
GLXY,Galaxy Digital Inc. Class A Common Stock,29.57,11550347458.0,4186994,Finance
FHN,First Horizon Corporation Common Stock,24.1,11438289293.0,3139819,Finance
AFG,American Financial Group Inc. Common Stock,137.24,11402734031.0,312414,Finance
BMNR,BitMine Immersion Technologies Inc. Common Stock,19.61,11169401421.0,21697744,Finance
SF,Stifel Financial Corporation Common Stock,72.63,11141570482.0,1758758,Finance
SEIC,SEI Investments Company Common Stock,89.59,10775255920.0,624881,Finance
JEF,Jefferies Financial Group Inc. Common Stock,52.45,10722474502.0,1752399,Finance
HLI,Houlihan Lokey Inc. Class A Common Stock,151.55,10575962063.0,804884,Finance
ERIE,Erie Indemnity Company Class A Common Stock,224.73,10380640515.0,220702,Finance
WTFC,Wintrust Financial Corporation Common Stock,149.57,10088160865.0,309756,Finance
UMBF,UMB Financial Corporation Common Stock,130.95,9949414301.0,569645,Finance
BPOP,Popular Inc. Common Stock,149.46,9645805987.0,398032,Finance
ORI,Old Republic International Corporation Common Stock,39.65,9628083215.0,1854151,Finance
ONBPO,Old National Bancorp Depositary Shares Each Representing a 1/40th Interest in a Share of Series C Preferred Stock,24.8147,9587730083.0,10625,Finance
ONBPP,Old National Bancorp Depositary Shares Each Representing a 1/40th Interest in a Share of Series A Preferred Stock,24.69,9539549370.0,9720,Finance
RIOT,Riot Platforms Inc. Common Stock ,24.47,9245113645.0,13551751,Finance
ONB,Old National Bancorp Common Stock,23.82,9203404860.0,2884681,Finance
SSB,SouthState Bank Corporation Common Stock,93.84,9165169155.0,977683,Finance
ZION,Zions Bancorporation N.A. Common Stock,61.79,9088803372.0,1246472,Finance
SNEX,StoneX Group Inc. Common Stock,112.42,8909453180.0,412302,Finance
CIFR,Cipher Digital Inc. Common Stock,21.52,8802738719.0,26728428,Finance
RYAN,Ryan Specialty Holdings Inc. Class A Common Stock,33.31,8782495114.0,2190088,Finance
PRI,Primerica Inc. Common Stock,281.0,8762706248.0,128490,Finance
CFR,Cullen/Frost Bankers Inc. Common Stock,139.01,8729417642.0,514245,Finance
COLB,Columbia Banking System Inc. Common Stock,29.62,8574704641.0,2049513,Finance
WAL,Western Alliance Bancorporation Common Stock (DE),78.53,8574326321.0,1680562,Finance
VIRT,Virtu Financial Inc. Class A Common Stock,52.75,8180805279.0,1079442,Finance
PRH,Prudential Financial Inc. 5.950% Junior Subordinated Notes due 2062,23.07,8120640000.0,43318,Finance
AMG,Affiliated Managers Group Inc. Common Stock,302.63,7993089284.0,338147,Finance
PRS,Prudential Financial Inc. 5.625% Junior Subordinated Notes due 2058,22.52,7927040000.0,29947,Finance
CORZ,Core Scientific Inc. Common Stock,24.82,7889912947.0,14497084,Finance
BOKF,BOK Financial Corporation Common Stock,129.72,7881924703.0,292343,Finance
CORZZ,Core Scientific Inc. Tranche 2 Warrants,24.64,7832693595.0,8915,Finance
CBSH,Commerce Bancshares Inc. Common Stock,52.19,7608109876.0,1198137,Finance
JXN,Jackson Financial Inc. Class A Common Stock ,108.2,7546203853.0,585727,Finance
VOYA,Voya Financial Inc. Common Stock,82.42,7472717682.0,880076,Finance
VLY,Valley National Bancorp Common Stock,13.41,7430903120.0,4597429,Finance
GJS,Goldman Sachs Group Securities STRATS Trust for Goldman Sachs Group Securities Series 2006-2,23.4478,7316628838.0,1607,Finance
KNSL,Kinsale Capital Group Inc. Common Stock,312.03,7196291413.0,187105,Finance
TRNO,Terreno Realty Corporation Common Stock,66.36,7054546389.0,819882,Finance
PB,Prosperity Bancshares Inc. Common Stock,69.12,6971076104.0,678959,Finance
FAF,First American Corporation (New) Common Stock,67.84,6912896000.0,684415,Finance
CHYM,Chime Financial Inc. Class A Common Stock,18.12,6904066799.0,3606559,Finance
LNC,Lincoln National Corporation Common Stock,35.98,6879850828.0,1678299,Finance
THG,Hanover Insurance Group Inc,195.58,6842715801.0,279221,Finance
MORN,Morningstar Inc. Common Stock,173.37,6592917481.0,436239,Finance
STEP,StepStone Group Inc. Class A Common Stock,54.74,6522910254.0,2065956,Finance
PJT,PJT Partners Inc. Class A Common Stock,155.81,6236969284.0,430045,Finance
FNB,F.N.B. Corporation Common Stock,17.48,6222249829.0,4656959,Finance
GBCI,Glacier Bancorp Inc. Common Stock,47.8,6220818861.0,554367,Finance
OMF,OneMain Holdings Inc. Common Stock,53.75,6209788670.0,1073435,Finance
ACT,Enact Holdings Inc. Common Stock,43.4,6058672333.0,286459,Finance
CGABL,The Carlyle Group Inc. 4.625% Subordinated Notes due 2061,16.55,5986216211.0,13274,Finance
UBSI,United Bankshares Inc. Common Stock,43.09,5937741243.0,522404,Finance
PFH,Prudential Financial Inc. 4.125% Junior Subordinated Notes due 2060,16.24,5797680000.0,40653,Finance
PIPR,Piper Sandler Companies Common Stock,80.76,5737508998.0,486005,Finance
CACC,Credit Acceptance Corporation Common Stock,547.98,5731909707.0,118365,Finance
CORZW,Core Scientific Inc. Tranche 1 Warrants,17.99,5718756403.0,558592,Finance
ABCB,Ameris Bancorp Common Stock,84.77,5704385479.0,556051,Finance
MCY,Mercury General Corporation Common Stock,102.34,5668472087.0,183638,Finance
FLG,Flagstar Bank N.A. Common Stock,13.59,5664517508.0,3182872,Finance
OBDC,Blue Owl Capital Corporation Common Stock,11.18,5548694640.0,2641846,Finance
MTG,MGIC Investment Corporation Common Stock,26.17,5534700314.0,1543602,Finance
OZK,Bank OZK Common Stock,48.17,5449767478.0,993618,Finance
SIGI,Selective Insurance Group Inc. Common Stock,90.69,5429566769.0,596377,Finance
HWC,Hancock Whitney Corporation Common Stock,66.66,5409990147.0,605917,Finance
AUB,Atlantic Union Bankshares Corporation Common Stock,37.67,5391167364.0,968467,Finance
VCTR,Victory Capital Holdings Inc. Class A Common Stock,85.86,5368920761.0,466626,Finance
HOMB,Home BancShares Inc. Common Stock,26.6,5357597052.0,1634807,Finance
BGC,BGC Group Inc. Class A Common Stock,11.13,5331900370.0,2617454,Finance
WTM,White Mountains Insurance Group Ltd. Common Stock,2139.09,5297820030.0,22447,Finance
HASI,HA Sustainable Infrastructure Capital Inc. Common Stock,40.66,5222076144.0,855771,Finance
MC,Moelis & Company Class A Common Stock,65.65,5157758965.0,761438,Finance
RDN,Radian Group Inc. Common Stock,37.21,4948007043.0,1569543,Finance
HLNE,Hamilton Lane Incorporated Class A Common Stock,88.59,4941117349.0,1013353,Finance
UWMC,UWM Holdings Corporation Class A Common Stock,3.07,4915340538.0,24061586,Finance
AX,Axos Financial Inc. Common Stock,85.93,4888096686.0,309627,Finance
MIAX,Miami International Holdings Inc. Common Stock,51.44,4882020504.0,1025135,Finance
RLI,RLI Corp. Common Stock (DE),53.01,4873650926.0,848279,Finance
MKTX,MarketAxess Holdings Inc. Common Stock,136.25,4842250471.0,678905,Finance
MAIN,Main Street Capital Corporation Common Stock,51.02,4744341535.0,482217,Finance
NNI,Nelnet Inc. Common Stock,129.64,4658486742.0,108318,Finance
ASB,Associated Banc-Corp Common Stock,28.05,4654662693.0,1981103,Finance
FFIN,First Financial Bankshares Inc. Common Stock,32.19,4612245327.0,650405,Finance
EBC,Eastern Bankshares Inc. Common Stock,19.85,4588190515.0,1350703,Finance
MRP,Millrose Properties Inc. Class A Common Stock,27.55,4574620389.0,1259932,Finance
PFSI,PennyMac Financial Services Inc. Common Stock,87.02,4518502623.0,555711,Finance
HCXY,Hercules Capital Inc. 6.25% Notes due 2033,24.78,4501923425.0,1909,Finance
IBOC,International Bancshares Corporation Common Stock,71.82,4465856944.0,363394,Finance
TFSL,TFS Financial Corporation Common Stock,15.86,4447653756.0,741850,Finance
CNO,CNO Financial Group Inc. Common Stock,47.38,4422852072.0,611126,Finance
OPEN,Opendoor Technologies Inc Common Stock,4.57,4408846408.0,37664458,Finance
LMND,Lemonade Inc. Common Stock,57.05,4382626012.0,1067414,Finance
OXLCM,Oxford Lane Capital Corp. Preferred Stock Shares 8.25% Series 2031,25.2,4374720000.0,3455,Finance
OXLCP,Oxford Lane Capital Corp. 6.25% Series 2027 Term Preferred Shares,24.9499,4331302640.0,9355,Finance
TCBI,Texas Capital Bancshares Inc. Common Stock,99.0,4323422961.0,518414,Finance
OXLCZ,Oxford Lane Capital Corp. 5.00% Notes due 2027,24.8099,4306998640.0,2802,Finance
OXLCN,Oxford Lane Capital Corp. 7.125% Series 2029 Term Preferred Stock,24.8,4305280000.0,7236,Finance
SFBS,ServisFirst Bancshares Inc. Common Stock,77.57,4240195180.0,251672,Finance
OXLCL,Oxford Lane Capital Corp. 6.75% Notes due 2031,24.2701,4213289360.0,6075,Finance
OXLCO,Oxford Lane Capital Corp. Preferred Stock Shares 6.00% Series 2029,24.0099,4168118640.0,6767,Finance
SLM,SLM Corporation Common Stock,21.95,4139616240.0,1632133,Finance
FULT,Fulton Financial Corporation Common Stock,21.4,4090258740.0,1253014,Finance
FHI,Federated Hermes Inc. Common Stock,53.86,4088655491.0,698539,Finance
PDI,PIMCO Dynamic Income Fund Common Stock,16.69,4057172100.0,2082476,Finance
CLSK,CleanSpark Inc. Common Stock,15.76,4044151631.0,20583724,Finance
ENVA,Enova International Inc. Common Stock,160.91,4004228615.0,181596,Finance
UCB,United Community Banks Inc. Common Stock,33.28,3983171479.0,572964,Finance
UNMA,Unum Group 6.250% Junior Subordinated Notes due 2058,23.09,3932532712.0,9241,Finance
CATY,Cathay General Bancorp Common Stock,57.25,3837780944.0,359199,Finance
INDB,Independent Bank Corp. Common Stock,78.66,3801410473.0,298292,Finance
RNST,Renasant Corporation Common Stock,41.17,3798843180.0,816099,Finance
HGTY,Hagerty Inc. Class A Common Stock,10.95,3759730702.0,113104,Finance
BANF,BancFirst Corporation Common Stock,111.31,3738500737.0,78069,Finance
ASBA,Associated Banc-Corp 6.625% Fixed-Rate Reset Subordinated Notes due 2033,24.75,3734795171.0,8042,Finance
WSFS,WSFS Financial Corporation Common Stock,71.69,3731037658.0,308448,Finance
CNS,Cohen & Steers Inc Common Stock,72.15,3708070534.0,257163,Finance
CII,BlackRock Enhanced Large Cap Core Fund Inc. Common Stock,24.79,3687821656.0,63471,Finance
FG,F&G Annuities & Life Inc. Common Stock,27.59,3655260874.0,783924,Finance
BHF,Brighthouse Financial Inc. Common Stock,62.71,3602425177.0,622478,Finance
CVBF,CVB Financial Corporation Common Stock,20.32,3585569583.0,2202290,Finance
FULTP,Fulton Financial Corporation Depositary Shares Each Representing a 1/40th Interest in a Share of Fixed Rate Non-Cumulative Perpetual Preferred Stock Series A,18.69,3572286722.0,3938,Finance
AB,AllianceBernstein Holding L.P.  Units,38.17,3565225069.0,376272,Finance
SEZL,Sezzle Inc. Common Stock,105.45,3545969154.0,400794,Finance
GNW,Genworth Financial Inc Common Stock,9.25,3542835618.0,2317905,Finance
BULL,Webull Corporation Class A Ordinary Shares,6.61,3515321376.0,33988716,Finance
GPGI,GPGI Inc. Class A Common Stock,11.96,3466737955.0,1993203,Finance
NTRSO,Northern Trust Corporation Depositary Shares Each Representing a 1/1000th Interest in a Share of Series E Non-Cumulative Perpetual Preferred Stock,18.69,3458533252.0,30815,Finance
FIBK,First Interstate BancSystem Inc. Common Stock (DE),35.2,3419429341.0,815118,Finance
NAN,Nuveen New York Quality Municipal Income Fund Common Stock,11.25,3401052750.0,41340,Finance
GBDC,Golub Capital BDC Inc. Common Stock,12.97,3378622498.0,1004861,Finance
BKU,BankUnited Inc. Common Stock,46.33,3367343810.0,477957,Finance
WSBC,WesBanco Inc. Common Stock,34.62,3329770987.0,717297,Finance
CBU,Community Financial System Inc. Common Stock,63.16,3319369316.0,247314,Finance
FHB,First Hawaiian Inc. Common Stock,27.27,3317367494.0,1371240,Finance
MCHB,Mechanics Bancorp Class A Common Stock,14.96,3312160157.0,546159,Finance
FFBC,First Financial Bancorp. Common Stock,30.68,3219233194.0,971466,Finance
CSQ,Calamos Strategic Total Return Common Stock,20.2,3209529964.0,392954,Finance
FGN,F&G Annuities & Life Inc. 7.950% Senior Notes due 2053,25.01,3153724685.0,28852,Finance
CRVL,CorVel Corp. Common Stock,61.54,3147920973.0,292720,Finance
SFNC,Simmons First National Corporation Class A Common Stock,21.34,3095670220.0,974609,Finance
BOH,Bank of Hawaii Corporation Common Stock,78.12,3095193848.0,328995,Finance
DAVE,Dave Inc. Class A Common Stock,240.9,3086740351.0,428547,Finance
FSK,FS KKR Capital Corp. Common Stock,10.93,3061126113.0,3252234,Finance
PRK,Park National Corporation Common Stock,169.05,3059143845.0,56203,Finance
PLMR,Palomar Holdings Inc. Common stock,115.0,3047945165.0,192929,Finance
CURB,Curbline Properties Corp. Common Stock,28.69,3027923779.0,507534,Finance
NIC,Nicolet Bankshares Inc. Common Stock,142.31,3024358601.0,145580,Finance
APAM,Artisan Partners Asset Management Inc. Class A Common Stock,37.12,3008864125.0,806772,Finance
CWK,Cushman & Wakefield Ltd. Common Shares,12.82,3003732474.0,3031717,Finance
SBCF,Seacoast Banking Corporation of Florida Common Stock,30.5,2966026546.0,655215,Finance
WT,WisdomTree Inc. Common Stock,19.18,2933413501.0,1795466,Finance
PFS,Provident Financial Services Inc Common Stock,22.3,2905995220.0,1070424,Finance
BWIN,The Baldwin Insurance Group Inc. Class A Common Stock,20.37,2904102521.0,891635,Finance
HTGC,Hercules Capital Inc. Common Stock,15.47,2894724587.0,2489173,Finance
BANC,Banc of California Inc. Common Stock,18.81,2891563243.0,1975184,Finance
NMIH,NMI Holdings Inc. Common Stock,37.76,2868698604.0,494924,Finance
UE,Urban Edge Properties Common Shares of Beneficial Interest,22.38,2820327466.0,1137339,Finance
ZIONP,Zions Bancorporation N.A. Depositary Shares (Each representing 1/40th Interest in a Share of Series A Floating-Rate Non-Cumulative Perpetual Preferred Stock),19.11,2810924623.0,6218,Finance
UPST,Upstart Holdings Inc. Common stock,28.85,2761278766.0,3814622,Finance
FBK,FB Financial Corporation Common Stock,52.59,2709618867.0,325715,Finance
WAFD,WaFd Inc. Common Stock,35.45,2619346616.0,460282,Finance
GDV,Gabelli Dividend & Income Trust Common Shares of Beneficial Interest,29.03,2618171894.0,134696,Finance
TRMK,Trustmark Corporation Common Stock,44.46,2605602620.0,301490,Finance
TOWN,TowneBank Common Stock,34.59,2581013445.0,558390,Finance
NMRK,Newmark Group Inc. Class A Common Stock,14.53,2579477728.0,1250735,Finance
VAC,Marriott Vacations Worldwide Corporation Common Stock,74.63,2563022866.0,478110,Finance
CUBI,Customers Bancorp Inc Common Stock,75.69,2560220911.0,232067,Finance
FRME,First Merchants Corporation Common Stock,40.23,2535404870.0,256848,Finance
EEFT,Euronet Worldwide Inc. Common Stock,66.5,2531993751.0,725322,Finance
WSBCO,WesBanco Inc. Depositary Shares each representing 1/40th interest in a share of 7.375% Fixed-Rate Reset Non-Cumulative Perpetual Preferred Stock Series B,25.87,2488191087.0,3405,Finance
BBT,Beacon Financial Corporation Common stock,28.97,2428152011.0,569900,Finance
FBNC,First Bancorp Common Stock,58.67,2427495481.0,185499,Finance
NBTB,NBT Bancorp Inc. Common Stock,45.86,2385189240.0,290822,Finance
MFICL,MidCap Financial Investment Corporation 8.00% Notes due 2028,25.46,2375510216.0,2357,Finance
TBBK,The Bancorp Inc Common Stock,55.07,2292808556.0,380313,Finance
BUSE,First Busey Corporation Class A Common Stock,26.84,2270050974.0,440724,Finance
BGR,BlackRock Energy and Resources Trust,16.41,2224969444.0,61422,Finance
EFSC,Enterprise Financial Services Corporation Common Stock,60.69,2220392505.0,197566,Finance
BANR,Banner Corporation Common Stock,64.6,2194329118.0,183595,Finance
HTH,Hilltop Holdings Inc.,37.32,2184346952.0,302015,Finance
GCMG,GCM Grosvenor Inc. Class A Common Stock,10.65,2151821807.0,352291,Finance
BUSEP,First Busey Corporation Depositary Shares Each Representing a 1/40thInterest in a Share of 8.25% Fixed-Rate Series B Non-Cumulative Perpetual Preferred Stock $0.001 par value,25.4399,2151634493.0,12775,Finance
MBIN,Merchants Bancorp Common Stock,46.54,2137833888.0,137477,Finance
SLDE,Slide Insurance Holdings Inc. Common Stock,18.61,2131947568.0,1180632,Finance
CLBK,Columbia Financial Inc. Common Stock,20.23,2104880298.0,451519,Finance
SYBT,Stock Yards Bancorp Inc. Common Stock,71.28,2103842601.0,172896,Finance
STC,Stewart Information Services Corporation Common Stock,68.06,2070867269.0,145704,Finance
NWBI,Northwest Bancshares Inc. Common Stock,13.97,2044015674.0,902798,Finance
SFB,Stifel Financial Corporation 5.20% Senior Notes due 2047,19.9,2033250779.0,12454,Finance
UMBFO,UMB Financial Corporation Depositary Shares Each Representing a 1/400th Interest in a Share of 7.750% Fixed-Rate Reset Non-Cumulative Perpetual Preferred Stock Series B,26.7,2028632011.0,17820,Finance
HCI,HCI Group Inc. Common Stock,158.47,2022839124.0,188807,Finance
GTY,Getty Realty Corporation Common Stock,33.43,2021412746.0,440346,Finance
RVT,Royce Small-Cap Trust Inc. Common Stock,18.12,1956175676.0,89037,Finance
KYN,Kayne Anderson Energy Infrastructure Fund Inc.,14.25,1939874303.0,521438,Finance
HMN,Horace Mann Educators Corporation Common Stock,47.65,1924162846.0,264483,Finance
AGM,Federal Agricultural Mortgage Corporation Common Stock,177.01,1920381136.0,107066,Finance
