symbol,name,price,marketCap,volume,industry
LDI,loanDepot Inc. Class A Common Stock,1.25,422279874.0,1400845,Finance
CCAP,Crescent Capital BDC Inc. Common stock,11.44,421517691.0,214023,Finance
BWFG,Bankwell Financial Group Inc. Common Stock,52.77,420744709.0,45907,Finance
ZSQR,Z Squared Inc. Common Stock,8.16,419680983.0,283983,Finance
CBAN,Colony Bankcorp Inc. Common Stock,19.79,418749850.0,433012,Finance
EVN,Eaton Vance Municipal Income Trust Common Stock,10.55,418488570.0,74839,Finance
BSVN,Bank7 Corp. Common stock,43.26,411806432.0,13592,Finance
WTBA,West Bancorporation Common Stock,23.79,405098523.0,32990,Finance
RBB,RBB Bancorp Common Stock,23.76,402396699.0,48239,Finance
CBK,Commercial Bancgroup Inc. Common Stock,29.09,398569915.0,81250,Finance
SAJ,Saratoga Investment Corp 8.00% Notes due 2027,25.375,397578824.0,3831,Finance
SAZ,Saratoga Investment Corp 8.50% Notes due 2028,25.25,395620308.0,3371,Finance
ISTR,Investar Holding Corporation Common Stock,28.58,394220659.0,259820,Finance
SAY,Saratoga Investment Corp 8.125% Notes due 2027,25.115,393505110.0,1752,Finance
FRBA,First Bank Common Stock,15.62,392599375.0,123427,Finance
SAT,Saratoga Investment Corp 6.00% Notes due 2027,24.86,389509737.0,838,Finance
LEO,BNY Mellon Strategic Municipals Inc. Common Stock,6.25,389317838.0,138672,Finance
GBLI,Global Indemnity Group LLC Class A Common Stock ,27.135,388680492.0,7680,Finance
AVBC,Avidia Bancorp Inc. Common Stock,19.3,387471625.0,49149,Finance
VKI,Invesco Advantage Municipal Income Trust II Common Shares of Beneficial Interest (DE),8.72,387220494.0,55948,Finance
ATLCZ,Atlanticus Holdings Corporation 9.25% Senior Notes due 2029,25.52,386001458.0,17278,Finance
NEWT,NewtekOne Inc. Common Stock,13.29,383535060.0,107993,Finance
FMAO,Farmers & Merchants Bancorp Inc. Common Stock,27.83,383168672.0,85992,Finance
TACO,Berto Acquisition Corp. Ordinary Shares,10.42,379728057.0,28097,Finance
CZNC,Citizens & Northern Corp Common Stock,21.19,379652457.0,40313,Finance
SOR,Source Capital Inc. Cmn Shs of BI,45.37,378589194.0,6358,Finance
ATLCL,Atlanticus Holdings Corporation 6.125% Senior Notes due 2026,25.0201,378440247.0,1769,Finance
RILY,BRC Group Holdings Inc. Common Stock,10.16,377246815.0,962435,Finance
PBFS,Pioneer Bancorp Inc. Common Stock,14.97,375399711.0,9385,Finance
BOC,Boston Omaha Corporation Class A Common Stock,12.33,374886338.0,223210,Finance
PLBC,Plumas Bancorp,53.21,370774517.0,84324,Finance
ATLCP,Atlanticus Holdings Corporation 7.625% Series B Cumulative Perpetual Preferred Stock no par value per share,24.18,365553167.0,3072,Finance
PKBK,Parke Bancorp Inc. Common Stock,31.16,365536402.0,157425,Finance
SSSS,SuRo Capital Corp. Common Stock,14.0,364982912.0,466512,Finance
SAR,Saratoga Investment Corp New,22.23,361632038.0,66962,Finance
FRST,Primis Financial Corp. Common Stock,14.37,355974675.0,205190,Finance
KTF,DWS Municipal Income Trust,8.91,351953358.0,159462,Finance
MCI,Barings Corporate Investors Common Stock,17.29,350325122.0,47470,Finance
PCB,PCB Bancorp Common Stock,24.55,349462450.0,27071,Finance
PMO,Putnam Municipal Opportunities Trust Common Stock,10.28,349330509.0,23265,Finance
PPT,Putnam Premier Income Trust Common Stock,3.44,342377225.0,106239,Finance
BCML,BayCom Corp Common Stock,31.17,340043411.0,78125,Finance
USCB,USCB Financial Holdings Inc. Class A Common Stock,18.54,338612706.0,127457,Finance
FGBIP,First Guaranty Bancshares Inc. 6.75% Series A Fixed-Rate Non-Cumulative Perpetual Preferred Stock,20.55,338340296.0,5,Finance
MLP,Maui Land & Pineapple Company Inc. Common Stock,17.02,338095594.0,12121,Finance
WSBF,Waterstone Financial Inc. Common Stock (MD),18.56,335065202.0,88336,Finance
NECB,NorthEast Community Bancorp Inc. Common Stock,24.14,333503925.0,29666,Finance
GREEL,Greenidge Generation Holdings Inc. 8.50% Senior Notes due 2026,21.2366,332850087.0,50,Finance
MVBF,MVB Financial Corp. Common Stock,25.83,331912943.0,59709,Finance
CHMG,Chemung Financial Corp Common Stock,68.82,331700012.0,33587,Finance
AII,American Integrity Insurance Group Inc. Common Stock,16.86,330301175.0,123659,Finance
CION,CION Investment Corporation Common Stock,6.6,328608786.0,473770,Finance
AVBH,Avidbank Holdings Inc. Common stock,29.97,328326355.0,107685,Finance
RM,Regional Management Corp. Common Stock,35.58,327625799.0,97015,Finance
NWFL,Norwood Financial Corp. Common Stock,30.07,327483319.0,17153,Finance
FNLC,First Bancorp Inc  (ME) Common Stock,28.7,323614255.0,13974,Finance
MBI,MBIA Inc. Common Stock,6.3,320884446.0,669820,Finance
OFSSH,OFS Capital Corporation 4.95% Notes due 2028,23.9,320214064.0,106,Finance
TSBK,Timberland Bancorp Inc. Common Stock,40.66,318284569.0,24937,Finance
ISBA,Isabella Bank Corporation Common stock,43.25,317133263.0,15619,Finance
VALU,Value Line Inc. Common Stock,33.75,316819283.0,2808,Finance
EFT,Eaton Vance Floating Rate Income Trust Common Shares of Beneficial Interest,10.87,316212811.0,55347,Finance
TCPC,BlackRock TCP Capital Corp. Common Stock,3.72,312118323.0,879664,Finance
CZFS,Citizens Financial Services Inc. Common Stock,64.78,311263754.0,5298,Finance
GBAB,Guggenheim Taxable Municipal Bond & Investment Grade Debt Trust Common Shares of Beneficial Interest,13.81,309301258.0,101559,Finance
COSO,CoastalSouth Bancshares Inc. Common Stock,25.52,307146751.0,102148,Finance
CMTG,Claros Mortgage Trust Inc. Common Stock,2.18,305676906.0,524103,Finance
PMM,Putnam Managed Municipal Income Trust Common Stock,6.16,300231063.0,47017,Finance
FUND,Sprott Focus Trust Inc. Common Stock,10.075,298558087.0,4673,Finance
JMSB,John Marshall Bancorp Inc. Common Stock,21.12,298050150.0,22124,Finance
BRBS,Blue Ridge Bankshares Inc. Common Stock,3.3,296708646.0,152953,Finance
ONIT,Onity Group Inc. Common Stock,35.08,295799366.0,58944,Finance
ARDC,Ares Dynamic Credit Allocation Fund Inc. Common Shares,12.69,290790576.0,89251,Finance
FCNCN,First Citizens BancShares Inc. Depositary Shares each representing a 1/40th interest in a share of 6.625% Non-Cumulative Perpetual Preferred Stock Series E,25.09,290717178.0,14871,Finance
OCCIN,OFS Credit Company Inc. 5.25% Series E Term Preferred Stock Due 2026,24.76,287624788.0,1111,Finance
FNRN,First Northern Community Bancorp Common stock,17.47,286630395.0,65596,Finance
NODK,NI Holdings Inc. Common Stock,13.99,286535304.0,17684,Finance
FCCO,First Community Corporation Common Stock,30.45,286167882.0,153984,Finance
OIA,Invesco Municipal Income Opportunities Trust Common Stock,6.01,286109590.0,122039,Finance
OVLY,Oak Valley Bancorp (CA) Common Stock,33.76,284038342.0,99689,Finance
FVCB,FVCBankcorp Inc. Common Stock,15.75,283449474.0,202057,Finance
ACV,Virtus Diversified Income & Convertible Fund Common Shares of Beneficial Interest,27.34,283323162.0,23731,Finance
MIN,MFS Intermediate Income Trust Common Stock,2.44,280350561.0,84814,Finance
MYFW,First Western Financial Inc. Common Stock,28.35,275816243.0,56987,Finance
HRZN,Horizon Technology Finance Corporation Common Stock,4.03,275092277.0,915798,Finance
WNEB,Western New England Bancorp Inc. Common Stock,13.59,273501509.0,64011,Finance
RWAY,Runway Growth Finance Corp. Common Stock,6.32,268375931.0,455876,Finance
MMT,MFS Multimarket Income Trust Common Stock,4.49,267371889.0,66214,Finance
SCM,Stellus Capital Investment Corporation Common Stock,9.09,263130539.0,133127,Finance
FDBC,Fidelity D & D Bancorp Inc. Common Stock,45.23,262568291.0,6532,Finance
EOT,Eaton Vance Municipal Income Trust EATON VANCE NATIONAL MUNICIPAL OPPORTUNITIES TRUST,16.67,260467433.0,68530,Finance
MCR,MFS Charter Income Trust Common Stock,5.91,260089526.0,76012,Finance
OPENL,Opendoor Technologies Inc  Series A Warrants each whole warrant exercisable to purchase one share of Common Stock at an exercise price of $13.00 per warrant,0.2692,259707101.0,230467,Finance
FRAF,Franklin Financial Services Corporation Common Stock,57.59,258753713.0,25823,Finance
OSG,Octave Specialty Group Inc. Common Stock,5.74,258378018.0,330863,Finance
VPV,Invesco Pennsylvania Value Municipal Income Trust Common Stock (DE),10.795,257239927.0,35165,Finance
ATLO,Ames National Corporation Common Stock,28.79,254999364.0,78422,Finance
CPZ,Calamos Long/Short Equity & Dynamic Income Trust Common Stock,12.915,253549786.0,85477,Finance
FXNC,First National Corporation Common Stock,27.85,251790931.0,56022,Finance
CIA,Citizens Inc. Class A Common Stock ($1.00 Par),4.94,249734606.0,82554,Finance
OPRT,Oportun Financial Corporation Common Stock,5.42,247902903.0,271643,Finance
SNFCA,Security National Financial Corporation Class A Common Stock,9.42,245276886.0,23985,Finance
FCNCO,First Citizens BancShares Inc. 5.625% Non-Cumulative Perpetual Preferred Stock Series C,21.16,245180370.0,17768,Finance
ECC,Eagle Point Credit Company Common Share of Beneficial Interest,4.04,245076597.0,489343,Finance
OPENZ,Opendoor Technologies Inc  Series Z Warrants each whole warrant exercisable to purchase one share of Common Stock at an exercise price of $17.00 per warrant,0.2524,243499526.0,163152,Finance
FUNC,First United Corporation Common Stock,37.55,242074223.0,13209,Finance
HWBK,Hawthorn Bancshares Inc. Common Stock,35.1,242070134.0,8759,Finance
PNNT,PennantPark Investment Corporation Common Stock,3.7,241595548.0,1704826,Finance
CFFI,C&F Financial Corporation Common Stock,73.25,238382017.0,3582,Finance
BPRN,Princeton Bancorp Inc. Common Stock (PA),34.69,236278794.0,17271,Finance
FCNCP,First Citizens BancShares Inc. Depositary Shares,20.36,235910791.0,15254,Finance
FTF,Franklin Limited Duration Income Trust Common Shares of Beneficial Interest,5.82,235159277.0,127150,Finance
LCNB,LCNB Corporation Common Stock,16.37,233207135.0,17338,Finance
VABK,Virginia National Bankshares Corporation Common Stock,42.87,232463132.0,6850,Finance
PEBK,Peoples Bancorp of North Carolina Inc. Common Stock,42.56,232441014.0,80409,Finance
KINS,Kingstone Companies Inc. Common Stock,15.99,231612608.0,142056,Finance
LPRO,Open Lending Corporation Common Stock,1.94,229341139.0,1405856,Finance
MFIN,Medallion Financial Corp. Common Stock,9.52,227051686.0,52439,Finance
FBLA,FB Bancorp Inc. Common Stock,14.02,226584076.0,89231,Finance
NKSH,National Bankshares Inc. Common Stock,35.55,226396976.0,16989,Finance
LIEN,Chicago Atlantic BDC Inc. Common Stock,9.82,224098194.0,21042,Finance
EXOD,Exodus Movement Inc. Class A Common Stock,7.45,223595278.0,75818,Finance
FSBW,FS Bancorp Inc. Common Stock,41.21,223133276.0,13190,Finance
OVBC,Ohio Valley Banc Corp. Common Stock,47.17,222217917.0,16289,Finance
EICA,Eagle Point Income Company Inc. 5.00% Series A Term Preferred Stock due 2026,24.945,222212754.0,1127,Finance
MFM,MFS Municipal Income Trust Common Stock,5.325,219324135.0,116801,Finance
INBKZ,First Internet Bancorp 6.0% Fixed-to-Floating Rate Subordinated Notes Due 2029,24.72,215387684.0,910,Finance
CMTV,Community Bancorp. Common Stock,38.51,215319153.0,16836,Finance
BZAI,Blaize Holdings Inc. Common Stock,1.51,214872186.0,5921378,Finance
CPSS,Consumer Portfolio Services Inc. Common Stock,9.85,213730865.0,18954,Finance
EFSI,Eagle Financial Services Inc Common Stock,39.48,213680604.0,61222,Finance
OPBK,OP Bancorp Common Stock,14.18,211200309.0,22949,Finance
VTN,Invesco Trust for Investment Grade New York Municipals Common Stock,10.82,210838293.0,26986,Finance
INBK,First Internet Bancorp Common Stock,24.16,210594554.0,55030,Finance
AOMR,Angel Oak Mortgage REIT Inc. Common Stock,8.45,210528767.0,209611,Finance
MRBK,Meridian Corporation Common Stock,17.49,207960962.0,189506,Finance
FT,Franklin Universal Trust Common Stock,8.0,201055152.0,32566,Finance
RMAX,RE/MAX Holdings Inc. Class A Common Stock,9.39,199376142.0,322433,Finance
CZWI,Citizens Community Bancorp Inc. Common Stock,20.41,196836326.0,10653,Finance
HNNAZ,Hennessy Advisors Inc. 4.875% Notes due 2026,25.08,195312005.0,113,Finance
FINW,FinWise Bancorp Common Stock,13.95,191199244.0,30359,Finance
BMEZ,BlackRock Health Sciences Term Trust Common Shares of Beneficial Interest,14.15,188662205.0,118676,Finance
SLQT,SelectQuote Inc. Common Stock,1.06,186928640.0,1025798,Finance
FCAP,First Capital Inc. Common Stock,53.8,179989568.0,4497,Finance
CFBK,CF Bankshares Inc. Common Stock,27.81,178579523.0,53111,Finance
MNSBP,MainStreet Bancshares Inc. Depositary Shares,25.0,177935950.0,2409,Finance
MPV,Barings Participation Investors Common Stock,16.78,177896526.0,9785,Finance
EBMT,Eagle Bancorp Montana Inc. Common Stock,22.2,176832568.0,98250,Finance
RBKB,Rhinebeck Bancorp Inc. Common Stock,15.76,176038901.0,5154,Finance
CBFV,CB Financial Services Inc. Common Stock,34.49,174954353.0,2563,Finance
FOA,Finance of America Companies Inc. Class A Common Stock,19.46,173034194.0,118896,Finance
LARK,Landmark Bancorp Inc. Common Stock,27.94,170387173.0,7455,Finance
BCBP,BCB Bancorp Inc. (NJ) Common Stock,9.81,170332570.0,207725,Finance
BVFL,BV Financial Inc. Common Stock,19.69,170110396.0,6090,Finance
DOUG,Douglas Elliman Inc. Common Stock,1.84,167267191.0,796375,Finance
HNVR,Hanover Bancorp Inc. Common Stock,23.16,165748269.0,59580,Finance
MNSB,MainStreet Bancshares Inc. Common Stock,23.17,164911038.0,61942,Finance
ECBK,ECB Bancorp Inc. Common Stock,18.47,161685826.0,12407,Finance
FGNXP,FG Nexus Inc. 8.00% Cumulative Preferred Stock,25.7367,161139589.0,468,Finance
PIM,Putnam Master Intermediate Income Trust Common Stock,3.14,157795657.0,56916,Finance
RDZN,Roadzen Inc. Ordinary Shares,1.96,156203517.0,947877,Finance
BRR,ProCap Financial Inc. Common Stock,1.72,155786461.0,986127,Finance
RMBI,Richmond Mutual Bancorporation Inc. Common Stock,14.65,153843459.0,73297,Finance
GRX,The Gabelli Healthcare & Wellness Trust Common Shares of Beneficial Interest,8.99,153665827.0,17090,Finance
WHG,Westwood Holdings Group Inc Common Stock,16.08,152566686.0,11110,Finance
SRBK,SR Bancorp Inc. Common stock,18.29,152455710.0,110195,Finance
GNT,GAMCO Natural Resources Gold & Income Trust,8.11,149835810.0,39798,Finance
FGBI,First Guaranty Bancshares Inc. Common Stock,8.9,146531807.0,11485,Finance
WHF,WhiteHorse Finance Inc. Common Stock,6.61,142851301.0,361120,Finance
CHCI,Comstock Holding Companies Inc. Class A Common Stock,13.84,141987716.0,32758,Finance
SAMG,Silvercrest Asset Management Group Inc. Class A Common Stock,11.91,141106905.0,35542,Finance
BANX,ArrowMark Financial Corp. Common Stock,19.72,140063785.0,40642,Finance
FNWD,Finward Bancorp Common Stock,32.17,139295167.0,9298,Finance
AFBI,Affinity Bancshares Inc. Common Stock (MD),22.5,137134913.0,23224,Finance
SUIG,Sui Group Holdings Limited Common Stock,1.78,136709112.0,409126,Finance
SRG,Seritage Growth Properties Class A Common Stock,2.41,135742303.0,604877,Finance
SBFG,SB Financial Group Inc. Common Stock,21.5,134915016.0,8752,Finance
DFDV,DeFi Development Corp. Common Stock,4.44,133724830.0,447474,Finance
OXSQ,Oxford Square Capital Corp. Common Stock,1.38,129067380.0,3875130,Finance
JHS,John Hancock Income Securities Trust Common Stock,11.02,128345367.0,3893,Finance
PNBK,Patriot National Bancorp Inc. Common Stock,1.09,128259921.0,170519,Finance
HYNE,Hoyne Bancorp Inc. Common Stock,15.7,127121927.0,19988,Finance
LSBK,Lake Shore Bancorp Inc. Common Stock,15.705,123485117.0,3235,Finance
AIFC,AI Financial Corporation Common Stock,0.8753,122398898.0,1209840,Finance
GHI,Greystone Housing Impact Investors LP Beneficial Unit Certificates representing assignments of limited partnership interests,5.16,121582552.0,71302,Finance
GGT,Gabelli Multi-Media Trust Inc. (The) Common Stock,4.27,117577657.0,255748,Finance
RVSB,Riverview Bancorp Inc Common Stock,5.55,114945501.0,30812,Finance
JHI,John Hancock Investors Trust Common Stock,13.14,114903348.0,6598,Finance
GLU,Gabelli Global Utility Common Shares of Beneficial Ownership,19.235,114812003.0,9794,Finance
CXE,MFS High Income Municipal Trust Common Stock,3.625,114280927.0,96303,Finance
MGYR,Magyar Bancorp Inc. Common Stock,17.6,113744030.0,2461,Finance
BSBK,Bogota Financial Corp. Common Stock,8.5,109262400.0,10397,Finance
PROV,Provident Financial Holdings Inc. Common Stock,17.22,107688559.0,7905,Finance
UNB,Union Bankshares Inc. Common Stock,23.12,106676882.0,9028,Finance
SFBC,Sound Financial Bancorp Inc. Common Stock,41.52,106543185.0,8085,Finance
BOTJ,Bank of the James Financial Group Inc. Common Stock,22.9,104042440.0,7028,Finance
EIC,Eagle Point Income Company Inc. Common Stock,10.63,94693188.0,48786,Finance
BCIC,BCP Investment Corporation Common Stock,7.62,94316405.0,33688,Finance
CMU,MFS Municipal Income Trust Common Stock,3.325,94181669.0,17442,Finance
MGF,MFS Government Markets Income Trust Common Stock,2.85,92902570.0,68707,Finance
FNWB,First Northwest Bancorp Common Stock,9.72,92333196.0,23815,Finance
BYFC,Broadway Financial Corporation Class A Common Stock,9.665,89874342.0,2028,Finance
SSBI,Summit State Bank Common Stock,13.4,89419942.0,2403,Finance
FUSB,First US Bancshares Inc. Common Stock,15.985,88992763.0,1051,Finance
EVF,Eaton Vance Senior Income Trust Common Stock,4.97,87168124.0,34608,Finance
PFX,PhenixFIN Corporation Common Stock,44.5,86000700.0,697,Finance
GCV,Gabelli Convertible and Income Securities Fund Inc. (The) Common Stock,4.51,85870531.0,39779,Finance
PROP,Prairie Operating Co. Common Stock,0.873,85320187.0,3395291,Finance
BEEP,Mobile Infrastructure Corporation Common Stock,2.07,85284000.0,81032,Finance
BTCS,BTCS Inc. Common Stock,1.71,85115884.0,429387,Finance
AUBN,Auburn National Bancorporation Inc. Common Stock,24.175,84449464.0,4718,Finance
UBCP,United Bancorp Inc. Common Stock,14.425,83391358.0,2983,Finance
CLSKW,CleanSpark Inc. Warrant,0.3221,82653632.0,163355,Finance
AFCG,Advanced Flower Capital Inc. Common Stock,3.48,81880377.0,288405,Finance
DTF,DTF Tax-Free Income 2028 Term Fund Inc. Common Stock,11.38,79996472.0,1632,Finance
FDSB,Fifth District Bancorp Inc. Common Stock,15.16,79815217.0,2382,Finance
HNNA,Hennessy Advisors Inc. Common Stock,10.1,79814179.0,10319,Finance
GLV,Clough Global Dividend and Income Fund Common Shares of beneficial interest,6.18,78545223.0,29710,Finance
FSEA,First Seacoast Bancorp Inc. Common Stock,16.705,78374414.0,39950,Finance
CPBI,Central Plains Bancshares Inc. Common Stock,18.5,77797218.0,27306,Finance
SIEB,Siebert Financial Corp. Common Stock,1.83,74921913.0,38033,Finance
NSTS,NSTS Bancorp Inc. Common Stock,13.7,72083002.0,4889,Finance
CEV,Eaton Vance California Municipal Income Trust Shares of Beneficial Interest,10.11,71109443.0,5381,Finance
RFL,Rafael Holdings Inc. Class B Common Stock,1.33,69176146.0,21538,Finance
CXH,MFS Investment Grade Municipal Trust Common Stock,7.52,68509042.0,19548,Finance
OPHC,OptimumBank Holdings Inc. Common Stock,5.52,67721364.0,3862,Finance
ASRV,AmeriServ Financial Inc. Common Stock,3.91,66330284.0,4365,Finance
PBHC,Pathfinder Bancorp Inc. Common Stock (MD),13.56,66121448.0,1162,Finance
CLST,Catalyst Bancorp Inc. Common Stock,15.91,64465665.0,891,Finance
FLD,Fold Holdings Inc. Class A Common Stock,1.25,63479188.0,82205,Finance
AEI,Alset Inc. Common Stock (TX),1.56,60677495.0,12506,Finance
HIT,Health In Tech Inc. Class A Common Stock,0.9225,60451021.0,627321,Finance
HFBL,Home Federal Bancorp Inc. of Louisiana Common Stock,19.02,58084969.0,965,Finance
EHTH,eHealth Inc. Common Stock,1.62,51420449.0,268369,Finance
BENF,Beneficient Class A Common Stock,3.38,48042407.0,23312,Finance
PFXNZ,PhenixFIN Corporation  5.25% Notes due 2028,23.9,47892469.0,260,Finance
TCBS,Texas Community Bancshares Inc. Common Stock,16.3101,47061032.0,2586,Finance
AAME,Atlantic American Corporation Common Stock,2.2401,45691830.0,2337,Finance
ILLR,Triller Group Inc. Common Stock,0.2273,45197326.0,61908759,Finance
OFS,OFS Capital Corporation Common Stock,3.35,44883561.0,86993,Finance
FGNX,FG Nexus Inc. Common Stock ,7.14,44704125.0,207015,Finance
GECC,Great Elm Capital Corp. Common Stock,5.81,44167388.0,90325,Finance
BZAIW,Blaize Holdings Inc. Warrants,0.31,44112833.0,66229,Finance
USIO,Usio Inc. Common Stock,1.57,43325711.0,69571,Finance
MBBC,Marathon Bancorp Inc. Common Stock,13.5,39835071.0,5366,Finance
OCCI,OFS Credit Company Inc. Common Stock,3.34,38799143.0,128916,Finance
BLNE,Beeline Holdings Inc. Common Stock,1.23,37696264.0,644095,Finance
KFFB,Kentucky First Federal Bancorp Common Stock,4.66,37684092.0,648,Finance
MLCI,Mount Logan Capital Inc. Common Stock,3.32,37146710.0,21589,Finance
OPAD,Offerpad Solutions Inc. Class A Common Stock,0.6798,32166676.0,497852,Finance
GROW,U.S. Global Investors Inc. Class A Common Stock,2.58,32002826.0,59351,Finance
RAND,Rand Capital Corporation Common Stock,10.61,31509727.0,6234,Finance
BRRWW,ProCap Financial Inc. Warrant,0.3218,29146560.0,953,Finance
BCG,Binah Capital Group Inc. Common Stock,1.67,28072919.0,129542,Finance
VEEA,Veea Inc. Common Stock,0.5447,27457002.0,244053,Finance
COHN,Cohen & Company Inc.,10.84,27215500.0,27917,Finance
MBNKO,Medallion Bank Fixed-Rate Reset Non-Cumulative Perpetual Preferred Stock Series G par value $1.00 per share,25.64,25640000.0,4864,Finance
BAFN,BayFirst Financial Corp. Common Stock,6.205,25490587.0,24920,Finance
GREE,Greenidge Generation Holdings Inc. Class A Common Stock,1.29,21681184.0,268574,Finance
MDBH,MDB Capital Holdings LLC Class A common,3.8899,21155735.0,4285,Finance
FTHM,Fathom Holdings Inc. Common Stock,0.6363,20859418.0,137859,Finance
EQS,Equus Total Return Inc. Common Stock,1.44,20112042.0,7776,Finance
ICMB,Investcorp Credit Management BDC Inc. Common Stock,1.38,19916811.0,52376,Finance
GOCO,GoHealth Inc. Class A Common Stock,0.6774,19849509.0,233450,Finance
PRHI,Presurance Holdings Inc. Common Stock,0.7522,19724851.0,54857,Finance
RDZNW,Roadzen Inc. Warrants,0.23,18330005.0,129,Finance
LHAI,Linkhome Holdings Inc. Common stock,0.88,14282400.0,90470,Finance
IHT,InnSuites Hospitality Trust Shares of Beneficial Interest,1.43,13446053.0,9042,Finance
AIRE,reAlpha Tech Corp. Common Stock,2.25,12070692.0,247991,Finance
ILLRW,Triller Group Inc. Warrant,0.06,11930662.0,172210,Finance
CWD,CaliberCos Inc. Class A Common Stock,1.02,9017028.0,49831,Finance
CELZ,Creative Medical Technology Holdings Inc. Common Stock,2.3,8502336.0,52947,Finance
DAVEW,Dave Inc. Warrants,0.53,6791085.0,5550,Finance
BTM,Bitcoin Depot Inc. Class A Common Stock,0.581,6593512.0,1370785,Finance
NCPL,Netcapital Inc. Common Stock,0.82,6435277.0,140868044,Finance
FLDDW,Fold Holdings Inc. Warrant,0.11,5586169.0,111791,Finance
PGYWW,Pagaya Technologies Ltd. Warrants,0.0521,4423185.0,39308,Finance
RENX,RenX Enterprises Corp. Common Stock,1.62,4234481.0,694825,Finance
LMFA,LM Funding America Inc. Common Stock,0.238,4129843.0,635658,Finance
BCGWW,Binah Capital Group Inc. Warrants,0.18,3025824.0,792,Finance
BTOG,Bit Origin Limited Class A Ordinary Shares,1.765,2606626.0,27956,Finance
SHFS,SHF Holdings Inc. Class A Common Stock,0.44,2214572.0,114903,Finance
EZRA,Reliance Global Group Inc. Common Stock,3.82,2123018.0,282239,Finance
STSSW,Sharps Technology Inc. Warrant,0.035,1481276.0,3200,Finance
NCPLW,Netcapital Inc. Warrants,0.031,243285.0,38938,Finance
BENFW,Beneficient Warrant,0.0113,160615.0,12990,Finance
SHFSW,SHF Holdings Inc. Warrants,0.0298,149987.0,340,Finance
LRHC,La Rosa Holdings Corp. Common Stock,1.42,75970.0,1945300,Finance
BTMWW,Bitcoin Depot Inc. Warrant,0.0025,28371.0,771367,Finance
PNI,Pimco New York Municipal Income Fund II Common Shares of Beneficial Interest,6.96,0.0,74756,Finance
GLO,Clough Global Opportunities Fund Common Stock,5.82,0.0,109374,Finance
LOKVU,Live Oak Acquisition Corp. V Units,12.23,0.0,1394,Finance
GJT,Synthetic Fixed-Income Securities Inc. Floating Rate Structured Repackaged Asset-Backed Trust Securities Certificates Series 2006-3,22.9526,0.0,16,Finance
GJR,Synthetic Fixed-Income Securities Inc. STRATS Trust for Procter&Gamble Securities Series 2006-1,24.75,0.0,591,Finance
LWAC,LightWave Acquisition Corp. Class A Ordinary Shares,10.2,0.0,11512,Finance
LWACW,LightWave Acquisition Corp. Warrants,0.1807,0.0,14,Finance
GIGGW,GigCapital7 Corp. Warrant,0.365,0.0,146577,Finance
BHK,Blackrock Core Bond Trust,8.85,0.0,379597,Finance
OTGA,OTG Acquisition Corp. I Class A Ordinary Share ,10.15,0.0,65,Finance
LPAAU,Launch One Acquisition Corp. Unit,10.74,0.0,100,Finance
RDAG,Republic Digital Acquisition Company Class A Ordinary Shares,10.29,0.0,248,Finance
RCS,PIMCO Strategic Income Fund Inc.,5.39,0.0,108259,Finance
IPODW,Dune Acquisition Corporation II Warrants,0.2999,0.0,50,Finance
IPOD,Dune Acquisition Corporation II Class A Ordinary Shares,10.38,0.0,4308,Finance
ISD,PGIM High Yield Bond Fund Inc.,12.95,0.0,75256,Finance
IPFXW,Inflection Point Acquisition Corp. VI Warrant,0.65,0.0,166649,Finance
IPEXR,Inflection Point Acquisition Corp. V Rights,0.6,0.0,31053,Finance
BHV,BlackRock Virginia Municipal Bond Trust,11.33,0.0,1558,Finance
GAINI,Gladstone Investment Corporation 7.875% Notes due 2030,25.55,0.0,4322,Finance
VNMEW,Vendome Acquisition Corporation I Warrant,0.2501,0.0,5000,Finance
VNMEU,Vendome Acquisition Corporation I Unit,10.28,0.0,5200,Finance
BDCIW,BTC Development Corp. Warrant,0.4061,0.0,100,Finance
NPACW,New Providence Acquisition Corp. III Warrants,0.3,0.0,27097,Finance
NMZ,Nuveen Municipal High Income Opportunity Fund Common Stock $0.01 par value per share,10.01,0.0,677668,Finance
BCV,Bancroft Fund Ltd.,25.26,0.0,15252,Finance
NMT,Nuveen Massachusetts Quality Municipal Income Fund Common Stock,12.655,0.0,7177,Finance
GIG,GigCapital7 Corp. Class A Ordinary Share,5.15,0.0,236211,Finance
NMI,Nuveen Municipal Income Fund Inc. Common Stock,10.6999,0.0,7147,Finance
NML,Neuberger Energy Infrastructure and Income Fund Inc. Common Stock,10.39,0.0,135384,Finance
NMP,NMP Acquisition Corp. Class A Ordinary Shares,10.24,0.0,7,Finance
NMPAR,NMP Acquisition Corp. Right,0.1601,0.0,2581,Finance
NMS,Nuveen Minnesota Quality Municipal Income Fund ,12.18,0.0,1896,Finance
NMPAU,NMP Acquisition Corp. Units,10.3,0.0,1017,Finance
GHY,PGIM Global High Yield Fund Inc.,11.87,0.0,50792,Finance
GJH,Synthetic Fixed-Income Securities Inc 6.375% (STRATS) Cl A-1,9.74,0.0,13402,Finance
BACCU,Blue Acquisition Corp. Unit,10.5,0.0,2,Finance
