symbol,name,price,marketCap,volume,industry
MUZEU,Muzero Acquisition Corp Unit,9.96,0.0,8019,Finance
CICC,CION Investment Corporation 7.50% Notes due 2031,24.95,0.0,5952,Finance
ACP,abrdn Income Credit Strategies Fund Common Shares,5.25,0.0,528158,Finance
BTT,BlackRock Municipal 2030 Target Term Trust,22.67,0.0,92973,Finance
VNMEU,Vendome Acquisition Corporation I Unit,10.2,0.0,15710,Finance
VVR,Invesco Senior Income Trust Common Stock (DE),3.11,0.0,820786,Finance
NKX,Nuveen California AMT-Free Quality Municipal Income Fund,12.39,0.0,175531,Finance
ALDFW,Aldel Financial II Inc. Warrants,0.361,0.0,927,Finance
VNME,Vendome Acquisition Corporation I Class A Ordinary Shares,10.09,0.0,1,Finance
BUI,BlackRock Utility Infrastructure & Power Opportunities Trust,25.69,0.0,115181,Finance
BRW,Saba Capital Income & Opportunities Fund SBI,6.57,0.0,216379,Finance
BSL,Blackstone Senior Floating Rate 2027 Term Fund Common Shares of Beneficial Interest,12.853,0.0,31724,Finance
PFL,PIMCO Income Strategy Fund Shares of Beneficial Interest,7.74,0.0,952492,Finance
PFN,PIMCO Income Strategy Fund II,6.71,0.0,1171961,Finance
PFO,Flaherty & Crumrine Preferred and Income Opportunity Fund Incorporated,9.015,0.0,26784,Finance
ERC,Allspring Multi-Sector Income Fund Common Stock,8.87,0.0,59946,Finance
SORN,Soren Acquisition Corp. Class A Ordinary Shares,9.84,0.0,77,Finance
FPF,First Trust Intermediate Duration Preferred & Income Fund Common Shares of Beneficial Interest,17.66,0.0,167291,Finance
ADX,Adams Diversified Equity Fund Inc.,22.08,0.0,524427,Finance
EVG,Eaton Vance Short Diversified Income Fund Eaton Vance Short Duration Diversified Income Fund Common Shares of Beneficial Interest,10.472,0.0,26379,Finance
EVOX,Evolution Global Acquisition Corp Class A Ordinary Shares,9.97,0.0,42,Finance
EVOXU,Evolution Global Acquisition Corp Units,10.235,0.0,1,Finance
LPAAW,Launch One Acquisition Corp. Warrant,0.1319,0.0,300,Finance
SORNW,Soren Acquisition Corp. Warrant,0.33,0.0,11775,Finance
MXF,Mexico Fund Inc. (The) Common Stock,19.91,0.0,30829,Finance
GIGGW,GigCapital7 Corp. Warrant,0.3599,0.0,2625,Finance
GIX,GigCapital9 Corp. Class A Ordinary Share,9.82,0.0,1014182,Finance
GF,New Germany Fund Inc. (The) Common Stock,10.42,0.0,38310,Finance
GGN,GAMCO Global Gold Natural Resources & Income Trust,4.99,0.0,739162,Finance
SBI,Western Asset Intermediate Muni Fund Inc Common Stock,7.72,0.0,52596,Finance
SCD,LMP Capital and Income Fund Inc. Common Stock,14.784,0.0,24330,Finance
GECCG,Great Elm Capital Corp. 7.75% Notes Due 2030,24.14,0.0,5795,Finance
CGCT,Cartesian Growth Corporation III Class A Ordinary Shares,10.26,0.0,54405,Finance
KIO,KKR Income Opportunities Fund Common Shares,10.82,0.0,216227,Finance
HERZ,Herzfeld Credit Income Fund Inc. Common Stock,15.8199,0.0,2749,Finance
CGCTU,Cartesian Growth Corporation III Unit,10.59,0.0,285,Finance
NHS,Neuberger High Yield Strategies Fund Inc. Common Stock,6.59,0.0,640166,Finance
NIM,Nuveen Select Maturities Municipal Fund Common Stock,9.57,0.0,64880,Finance
ALOVU,Aldabra 4 Liquidity Opportunity Vehicle Inc. Units,9.98,0.0,1905,Finance
CHACR,Crane Harbor Acquistion Corp. Rights,0.74,0.0,179586,Finance
CHACU,Crane Harbor Acquisition Corp. Units,11.97,0.0,110,Finance
CHI,Calamos Convertible Opportunities and Income Fund Common Stock,11.05,0.0,206304,Finance
MXE,Mexico Equity and Income Fund Inc. (The) Common Stock,12.4,0.0,1288,Finance
CEPS,Cantor Equity Partners VI Inc. Class A Ordinary Shares,10.1299,0.0,629,Finance
CEPT,Cantor Equity Partners II Inc. Class A Ordinary Share,10.82,0.0,467849,Finance
CCD,Calamos Dynamic Convertible & Income Fund Common Stock,21.45,0.0,85034,Finance
VBF,Invesco Bond Fund Common Stock,15.0,0.0,38181,Finance
VCICW,Vine Hill Capital Investment Corp. Warrant,1.12,0.0,21150,Finance
APACU,StoneBridge Acquisition II Corporation Units,10.2,0.0,6,Finance
KKRT,KKR & Co. Inc. 6.875% Subordinated Notes due 2065,24.76,0.0,29978,Finance
CHY,Calamos Convertible and High Income Fund Common Stock,11.43,0.0,172762,Finance
BXMX,Nuveen S&P 500 Buy-Write Income Fund Common Shares of Beneficial Interest,13.64,0.0,127419,Finance
VFL,abrdn National Municipal Income Fund Common Stock,9.92,0.0,31192,Finance
PML,Pimco Municipal Income Fund II Common Shares of Beneficial Interest,7.51,0.0,297012,Finance
PMTR,Perimeter Acquisition Corp. I Class A Ordinary Shares,10.26,0.0,36668,Finance
CHW,Calamos Global Dynamic Income Fund Common Stock,7.32,0.0,214225,Finance
CICB,CION Investment Corporation 7.50% Notes due 2029,24.8,0.0,3123,Finance
PMTRU,Perimeter Acquisition Corp. I Unit,10.62,0.0,432,Finance
PMTRW,Perimeter Acquisition Corp. I Warrant,0.61,0.0,7338,Finance
PNI,Pimco New York Municipal Income Fund II Common Shares of Beneficial Interest,6.83,0.0,36956,Finance
CGCTW,Cartesian Growth Corporation III Warrant,0.8,0.0,5878,Finance
CGO,Calamos Global Total Return Fund Common Stock,11.2,0.0,24034,Finance
CEPF,Cantor Equity Partners IV Inc. Class A Ordinary Shares,10.25,0.0,15167,Finance
CEPO,Cantor Equity Partners I Inc. Class A Ordinary Shares,10.49,0.0,11379,Finance
UTG,Reaves Utility Income Fund Common Shares of Beneficial Interest,38.49,0.0,378508,Finance
CAF,Morgan Stanley China A Share Fund Inc. Common Stock,17.05,0.0,68161,Finance
HEQ,John Hancock Diversified Income Fund Common Shares of Beneficial Interest,10.757,0.0,59918,Finance
CEE,The Central and Eastern Europe Fund Inc. (The) Common Stock,17.47,0.0,37873,Finance
USA,Liberty All-Star Equity Fund Common Stock,5.61,0.0,1410350,Finance
UTF,Cohen & Steers Infrastructure Fund Inc Common Stock,25.18,0.0,331843,Finance
BBN,BlackRock Taxable Municipal Bond Trust Common Shares of Beneficial Interest,15.88,0.0,213739,Finance
BCAR,D. Boral ARC Acquisition I Corp. Class A Ordinary Shares,10.1,0.0,466257,Finance
BCARW,D. Boral ARC Acquisition I Corp. Warrant,0.65,0.0,2936,Finance
OXSQH,Oxford Square Capital Corp. 7.75% Notes due 2030,24.89,0.0,4806,Finance
MBAVW,M3-Brigade Acquisition V Corp. Warrant,0.3861,0.0,40545,Finance
AWP,abrdn Global Premier Properties Fund Common Shares of Beneficial Interest,11.37,0.0,227522,Finance
AVK,Advent Convertible and Income Fund,11.56,0.0,147991,Finance
ATIIW,Archimedes Tech SPAC Partners II Co. Warrant,0.6102,0.0,62982,Finance
OTGA,OTG Acquisition Corp. I Class A Ordinary Share ,10.06,0.0,1144,Finance
MACIW,Melar Acquisition Corp. I Warrant,0.1162,0.0,1100,Finance
LWAC,LightWave Acquisition Corp. Class A Ordinary Shares,10.15,0.0,405,Finance
PAI,Western Asset Investment Grade Income Fund Inc.,12.15,0.0,8874,Finance
MEGI,NYLI CBRE Global Infrastructure Megatrends Term Fund Common Shares,14.38,0.0,498816,Finance
PALOU,Paloma Acquisition Corp I Units,9.96,0.0,697,Finance
LPCVU,Launchpad Cadenza Acquisition Corp I Unit,10.0,0.0,1000,Finance
APXTU,Apex Treasury Corporation Units,10.18,0.0,389,Finance
APXTW,Apex Treasury Corporation Warrants,0.24,0.0,53854,Finance
BDCIW,BTC Development Corp. Warrant,0.45,0.0,398,Finance
WIA,Western Asset Inflation-Linked Income Fund,8.05,0.0,51007,Finance
BDCIU,BTC Development Corp. Unit,10.11,0.0,164,Finance
BACC,Blue Acquisition Corp. Class A Ordinary Shares,10.19,0.0,20887,Finance
AWF,Alliancebernstein Global High Income Fund,10.1,0.0,393130,Finance
WIW,Western Asset Inflation-Linked Opportunities & Income Fund,8.46,0.0,235451,Finance
WLAC,Willow Lane Acquisition Corp. Class A Ordinary Shares,11.07,0.0,226069,Finance
WLACU,Willow Lane Acquisition Corp. Unit,12.0,0.0,81,Finance
WLACW,Willow Lane Acquisition Corp. Warrants,3.2,0.0,4082,Finance
BCV,Bancroft Fund Ltd.,21.72,0.0,16758,Finance
BDCI,BTC Development Corp. Class A Ordinary Shares,9.9717,0.0,4988,Finance
OPP,RiverNorth/DoubleLine Strategic Opportunity Fund Inc. Common Stock,7.52,0.0,108161,Finance
ASG,Liberty All-Star Growth Fund Inc.,4.79,0.0,371792,Finance
ASGI,abrdn Global Infrastructure Income Fund Common Shares of Beneficial Interest,22.73,0.0,341068,Finance
XCBEU,X3 Acquisition Corp. Ltd. Unit,9.94,0.0,10517,Finance
MYN,Blackrock MuniYield New York Quality Fund Inc.Common Stock,9.9,0.0,187878,Finance
XRPN,Armada Acquisition Corp. II Class A Ordinary Shares,10.28,0.0,245981,Finance
XSLLU,Xsolla SPAC 1 Units,9.905,0.0,1179,Finance
XSLLW,Xsolla SPAC 1 Warrants,0.1399,0.0,4585,Finance
GDL,GDL Fund The Common Shares of Beneficial Interest,8.35,0.0,13003,Finance
GDO,Western Asset Global Corporate Opportunity Fund Inc. Common Stock,10.86,0.0,30594,Finance
MEVOW,M Evo Global Acquisition Corp II Warrants,0.35,0.0,97,Finance
XCBEW,X3 Acquisition Corp. Ltd. Warrant,0.27,0.0,18290,Finance
XRPNW,Armada Acquisition Corp. II Warrant,0.65,0.0,168367,Finance
OTGAU,OTG Acquisition Corp. I Unit,10.18,0.0,288,Finance
OTGAW,OTG Acquisition Corp. I Warrants,0.26,0.0,43603,Finance
OXLCG,Oxford Lane Capital Corp. 7.95% Notes due 2032,24.75,0.0,9094,Finance
MBVIU,M3-Brigade Acquisition VI Corp. Units,10.15,0.0,2145,Finance
ARCIU,Archimedes Tech SPAC Partners III Co. Units,10.03,0.0,172,Finance
MBAVU,M3-Brigade Acquisition V Corp. Units,10.8,0.0,63,Finance
NPAC,New Providence Acquisition Corp. III Class A Ordinary Shares,10.25,0.0,76303,Finance
NMT,Nuveen Massachusetts Quality Municipal Income Fund Common Stock,12.03,0.0,4982,Finance
NMZ,Nuveen Municipal High Income Opportunity Fund Common Stock $0.01 par value per share,10.28,0.0,395273,Finance
ACAAU,Averin Capital Acquisition Corp. Units,10.08,0.0,7831,Finance
NOM,Nuveen Missouri Quality Municipal Income Fund ,10.82,0.0,6447,Finance
BIT,BlackRock Multi-Sector Income Trust Common Shares of Beneficial Interest,12.4,0.0,308982,Finance
BIXIU,Bitcoin Infrastructure Acquisition Corp Ltd. Unit ,10.0,0.0,120,Finance
BGT,BlackRock Floating Rate Income Trust,10.79,0.0,120432,Finance
BGY,Blackrock Enhanced International Dividend Trust,5.33,0.0,523623,Finance
NMAI,Nuveen Multi-Asset Income Fund Common Shares of Beneficial Interest,12.31,0.0,75622,Finance
NMI,Nuveen Municipal Income Fund Inc. Common Stock,9.93,0.0,55108,Finance
NML,Neuberger Energy Infrastructure and Income Fund Inc. Common Stock,10.18,0.0,223942,Finance
NMP,NMP Acquisition Corp. Class A Ordinary Shares,10.13,0.0,3,Finance
NRUC,National Rural Utilities Cooperative Finance Corporation 5.500% Subordinated Notes due 2064 (Subordinated Deferrable Interest Notes),23.25,0.0,10377,Finance
PCAP,ProCap Acquisition Corp Class A Ordinary Shares,10.18,0.0,41,Finance
PCAPW,ProCap Acquisition Corp Warrant,0.32,0.0,18118,Finance
MLAAU,Mountain Lake Acquisition Corp. II Units,9.96,0.0,70,Finance
MLAAW,Mountain Lake Acquisition Corp. II Warrants,0.16,0.0,284337,Finance
MHF,Western Asset Municipal High Income Fund Inc. Common Stock,6.74,0.0,70905,Finance
BGB,Blackstone Strategic Credit 2027 Term Fund Common Shares of Beneficial Interest,11.41,0.0,215662,Finance
NMPAR,NMP Acquisition Corp. Right,0.199,0.0,131,Finance
PELI,Pelican Acquisition Corporation Ordinary Shares,7.95,0.0,67906,Finance
PELIR,Pelican Acquisition Corporation Right,0.68,0.0,233524,Finance
PEO,Adams Natural Resources Fund Inc. Common Stock,26.95,0.0,128462,Finance
PFD,Flaherty & Crumrine Preferred and Income Fund Incorporated,11.26,0.0,14312,Finance
CLM,Cornerstone Strategic Investment Fund Inc. Common Shares,7.26,0.0,1450302,Finance
BOE,Blackrock Enhanced Global Dividend Trust Common Shares of Beneficial Interest,10.94,0.0,156784,Finance
PCF,High Income Securities Fund Common Stock,5.52,0.0,61970,Finance
PCM,PCM Fund Inc. Common Stock,5.6,0.0,36692,Finance
PCN,Pimco Corporate & Income Strategy Fund Common Stock,11.76,0.0,460016,Finance
PCQ,PIMCO California Municipal Income Fund Common Stock,8.61,0.0,170979,Finance
BHV,BlackRock Virginia Municipal Bond Trust,10.55,0.0,7074,Finance
PDT,John Hancock Premium Dividend Fund,12.95,0.0,66090,Finance
ALCY,Alchemy Investments Acquisition Corp 1 Class A Ordinary Shares,11.83,0.0,808,Finance
ALCYW,Alchemy Investments Acquisition Corp 1 Warrants,0.1511,0.0,2080,Finance
ALDFU,Aldel Financial II Inc. Units,10.65,0.0,106,Finance
BLZR,Trailblazer Acquisition Corp. Class A Ordinary Shares,10.01,0.0,359203,Finance
BLZRW,Trailblazer Acquisition Corp. Warrant,0.4342,0.0,266,Finance
PAXS,PIMCO Access Income Fund Common Shares of Beneficial Interest,13.96,0.0,586099,Finance
MLAA,Mountain Lake Acquisition Corp. II Class A Ordinary Shares,9.81,0.0,2816,Finance
GECCI,Great Elm Capital Corp. 8.50% NOTES DUE 2029,25.23,0.0,3949,Finance
GECCO,Great Elm Capital Corp. 5.875% Notes due 2026,25.03,0.0,573,Finance
BGH,Barings Global Short Duration High Yield Fund Common Shares of Beneficial Interests,13.65,0.0,57276,Finance
ESHA,ESH Acquisition Corp. Class A Common Stock,12.05,0.0,189,Finance
NAC,Nuveen California Quality Municipal Income Fund,11.76,0.0,650742,Finance
NAD,Nuveen Quality Municipal Income Fund Common Stock,11.77,0.0,792810,Finance
ETG,Eaton Vance Tax-Advantaged Global Dividend Income Fund Common Shares of Beneficial Interest,20.3,0.0,225552,Finance
RTAC,Renatus Tactical Acquisition Corp I Class A Ordinary Shares,10.34,0.0,174122,Finance
OYSE,Oyster Enterprises II Acquisition Corp Class A Ordinary Shares,10.17,0.0,3106,Finance
OYSER,Oyster Enterprises II Acquisition Corp Rights,0.1402,0.0,600,Finance
OYSEU,Oyster Enterprises II Acquisition Corp Units,10.31,0.0,8,Finance
WDI,Western Asset Diversified Income Fund Common Shares of Beneficial Interest,13.2,0.0,213866,Finance
GAVA,Grayscale Avalanche Staking ETF Common Units of Fractional Undivided Beneficial Interest,22.7482,0.0,896,Finance
RTACU,Renatus Tactical Acquisition Corp I Unit,10.61,0.0,6148,Finance
BHK,Blackrock Core Bond Trust,9.1,0.0,289621,Finance
GSHRW,Gesher Acquisition Corp. II Warrants,0.2201,0.0,1013,Finance
MSD,Morgan Stanley Emerging Markets Debt Fund Inc. Common Stock,7.44,0.0,93775,Finance
WEA,Western Asset Bond Fund Share of Beneficial Interest,10.6,0.0,27027,Finance
WENNW,Wen Acquisition Corp Warrant,0.35,0.0,510,Finance
RTACW,Renatus Tactical Acquisition Corp I Warrant,0.58,0.0,35697,Finance
TACHU,Titan Acquisition Corp. Units,10.41,0.0,1,Finance
FFC,Flaherty & Crumrine Preferred and Income Securities Fund Incorporated,15.58,0.0,125042,Finance
FCO,abrdn Global Income Fund Inc. Common Stock,3.23,0.0,309837,Finance
FCT,First Trust Senior Floating Rate Income Fund II Common Shares of Beneficial Interest,9.71,0.0,40468,Finance
GOF,Guggenheim Strategic Opportunities Fund Common Shares of Beneficial Interest,10.85,0.0,1833067,Finance
GLQ,Clough Global Equity Fund Clough Global Equity Fund Common Shares of Beneficial Interest,7.62,0.0,37769,Finance
IIF,Morgan Stanley India Investment Fund Inc. Common Stock,21.02,0.0,60358,Finance
IDE,Voya Infrastructure Industrials and Materials Fund Common Shares of Beneficial Interest,12.39,0.0,65348,Finance
IEAG,Infinite Eagle Acquisition Corp. Class A Ordinary Shares,10.03,0.0,13341,Finance
TACOU,Berto Acquisition Corp. Unit,10.35,0.0,555,Finance
HYT,Blackrock Corporate High Yield Fund Inc. Common Stock,8.47,0.0,918964,Finance
IACOU,Idea Acquisition Corp. Units,9.89,0.0,302656,Finance
IAE,Voya Asia Pacific High Dividend Equity Income Fund ING Asia Pacific High Dividend Equity Income Fund Common Shares of Beneficial Interest,7.42,0.0,20447,Finance
IAF,abrdn Australia Equity Fund Inc. Common Stock,12.0,0.0,70829,Finance
IBAC,IB Acquisition Corp. Common Stock,10.745,0.0,364133,Finance
SAAQ,Space Asset Acquisition Corp. Class A Ordinary Shares,9.93,0.0,11726,Finance
FACTU,FACT II Acquisition Corp. Unit,10.67,0.0,24,Finance
SPXX,Nuveen S&P 500 Dynamic Overwrite Fund,16.26,0.0,64902,Finance
TACHW,Titan Acquisition Corp. Warrants,0.3,0.0,22165,Finance
SVIVU,Spring Valley Acquisition Corp. IV Units,10.17,0.0,104,Finance
SVIVW,Spring Valley Acquisition Corp. IV Warrants,0.74,0.0,2091,Finance
DSM,BNY Mellon Strategic Municipal Bond Fund Inc. Common Stock,5.91,0.0,84701,Finance
DSU,Blackrock Debt Strategies Fund Inc. Common Stock,9.63,0.0,281649,Finance
TACH,Titan Acquisition Corp. Class A Ordinary Shares,10.2801,0.0,4327,Finance
SWZ,Total Return Securities Fund Common Stock,5.97,0.0,38208,Finance
DPG,Duff & Phelps Utility and Infrastructure Fund Inc.,14.11,0.0,85261,Finance
NBB,Nuveen Taxable Municipal Income Fund Common Shares of Beneficial Interest,15.59,0.0,37775,Finance
NBH,Neuberger Municipal Fund Inc. Common Stock,10.06,0.0,142862,Finance
SZZL,Sizzle Acquisition Corp. II Class A ordinary shares,10.26,0.0,24572,Finance
SZZLR,Sizzle Acquisition Corp. II Right,0.1798,0.0,40000,Finance
RDAGW,Republic Digital Acquisition Company Warrants,0.3013,0.0,2450,Finance
IGAC,Invest Green Acquisition Corporation Class A Ordinary Shares,9.89,0.0,1502,Finance
IGACU,Invest Green Acquisition Corporation Units,10.06,0.0,101,Finance
IEAGR,Infinite Eagle Acquisition Corp. Rights,0.185,0.0,205202,Finance
IFN,Aberdeen India Fund Inc. Common Stock,11.44,0.0,262888,Finance
IGA,Voya Global Advantage and Premium Opportunity Fund Common Shares of Beneficial Interest,9.43,0.0,93086,Finance
IBACR,IB Acquisition Corp. Right,0.0932,0.0,9349,Finance
DMAAR,Drugs Made In America Acquisition Corp. Rights,0.0446,0.0,4733,Finance
HVIIR,Hennessy Capital Investment Corp. VII Rights,0.287,0.0,1101,Finance
DMIIR,Drugs Made In America Acquisition II Corp. Right,0.075,0.0,15555,Finance
DMO,Western Asset Mortgage Opportunity Fund Inc. Common Stock,10.89,0.0,55327,Finance
TDWDR,Tailwind 2.0 Acquisition Corp. Rights,0.1566,0.0,16101,Finance
TEI,Templeton Emerging Markets Income Fund Inc. Common Stock,6.17,0.0,156886,Finance
DBCA,D. Boral Acquisition I Corp. Class A Ordinary Shares,9.85,0.0,568,Finance
DBCAW,D. Boral Acquisition I Corp. Warrants,0.27,0.0,353651,Finance
DAAQ,Digital Asset Acquisition Corp. Class A Ordinary shares,10.23,0.0,22341,Finance
DAAQU,Digital Asset Acquisition Corp. Units,10.41,0.0,3461,Finance
DMII,Drugs Made In America Acquisition II Corp. Ordinary Shares,9.98,0.0,18408,Finance
HVIIU,Hennessy Capital Investment Corp. VII Unit,10.59,0.0,93,Finance
TACOW,Berto Acquisition Corp. Warrant,0.3201,0.0,797,Finance
NCA,Nuveen California Municipal Value Fund,8.96,0.0,64513,Finance
NAZ,Nuveen Arizona Quality Municipal Income Fund Common Stock,12.49,0.0,11716,Finance
TAVI,Tavia Acquisition Corp. Ordinary Shares,10.5401,0.0,4788,Finance
TAVIR,Tavia Acquisition Corp. Right,0.15,0.0,450,Finance
TAVIU,Tavia Acquisition Corp. Unit,10.64,0.0,1,Finance
TBMC,Trailblazer Merger Corporation I Class A Common Stock,10.6,0.0,11151,Finance
TBMCR,Trailblazer Merger Corporation I Rights,0.4,0.0,10345,Finance
DHF,BNY Mellon High Yield Strategies Fund Common Stock,2.37,0.0,248341,Finance
RDAGU,Republic Digital Acquisition Company Unit,10.45,0.0,100,Finance
DNMX,Dynamix Corporation III Class A Ordinary Shares,9.9101,0.0,38688,Finance
DNMXU,Dynamix Corporation III Unit,10.08,0.0,609,Finance
DNP,DNP Select Income Fund Inc. Common Stock,9.99,0.0,1121309,Finance
ADACU,American Drive Acquisition Company Units,9.9502,0.0,200,Finance
RDAG,Republic Digital Acquisition Company Class A Ordinary Shares,10.25,0.0,11762,Finance
NXJ,Nuveen New Jersey Qualified Municipal Fund ,12.19,0.0,84513,Finance
NRO,Neuberger Real Estate Securities Income Fund Inc. Common Stock,2.8,0.0,194649,Finance
MEVO,M Evo Global Acquisition Corp II Class A Ordinary Shares,9.86,0.0,186,Finance
AACIU,Armada Acquisition Corp. III Units,9.98,0.0,1571,Finance
ZKPU,Lafayette Digital Acquisition Corp. I Unit,9.93,0.0,35,Finance
GRF,Eagle Capital Growth Fund Inc. Common Stock,10.25,0.0,5823,Finance
EIM,Eaton Vance Municipal Bond Fund Common Shares of Beneficial Interest $.01 par value,9.69,0.0,92848,Finance
EDF,Virtus Stone Harbor Emerging Markets Income Fund Common Shares of Beneficial Interest,5.04,0.0,131701,Finance
EEA,The European Equity Fund Inc. Common Stock,9.9,0.0,55213,Finance
EFR,Eaton Vance Senior Floating-Rate Fund Common Shares of Beneficial Interest,10.47,0.0,157992,Finance
SSACR,SPACSphere Acquisition Corp. Rights,0.18,0.0,2400,Finance
SSACU,SPACSphere Acquisition Corp. Unit,10.03,0.0,205,Finance
SSACW,SPACSphere Acquisition Corp. Warrant,0.09,0.0,1147,Finance
EHI,Western Asset Global High Income Fund Inc Common Stock,6.12,0.0,65851,Finance
EDD,Morgan Stanley Emerging Markets Domestic Debt Fund Inc. Common Stock,5.46,0.0,274741,Finance
NMS,Nuveen Minnesota Quality Municipal Income Fund ,12.0,0.0,7354,Finance
MCGAU,Yorkville Acquisition Corp. Unit,10.21,0.0,6100,Finance
GAING,Gladstone Investment Corporation 7.125% Notes due 2031,25.28,0.0,5840,Finance
NPACU,New Providence Acquisition Corp. III Units,10.32,0.0,5758,Finance
ZKP,Lafayette Digital Acquisition Corp. I Class A Ordinary Shares,9.86,0.0,2662,Finance
NNY,Nuveen New York Municipal Value Fund Common Stock,8.5,0.0,13028,Finance
ARTC,Art Technology Acquisition Corp. Class A Ordinary Shares,9.8,0.0,252016,Finance
NRK,Nuveen New York AMT-Free Quality Municipal Income Fund ,10.15,0.0,346490,Finance
ZTR,Virtus Total Return Fund Inc.,6.55,0.0,193757,Finance
ZKPW,Lafayette Digital Acquisition Corp. I Warrant,0.2231,0.0,20,Finance
GAINI,Gladstone Investment Corporation 7.875% Notes due 2030,25.48,0.0,21406,Finance
XRPNU,Armada Acquisition Corp. II Units,10.7,0.0,23331,Finance
MEVOU,M Evo Global Acquisition Corp II Units,10.03,0.0,2136,Finance
NPACW,New Providence Acquisition Corp. III Warrants,0.2302,0.0,7310,Finance
NPCT,Nuveen Core Plus Impact Fund Common Shares of Beneficial Interest,10.02,0.0,95769,Finance
NPFD,Nuveen Variable Rate Preferred & Income Fund Common Shares,18.98,0.0,39921,Finance
NPV,Nuveen Virginia Quality Municipal Income Fund Common Stock,11.39,0.0,28993,Finance
NQP,Nuveen Pennsylvania Quality Municipal Income Fund Common Stock,11.84,0.0,108030,Finance
XSLL,Xsolla SPAC 1 Class A Ordinary Shares,9.82,0.0,663096,Finance
SVAQU,Silicon Valley Acquisition Corp. Units,10.01,0.0,10,Finance
SVAQW,Silicon Valley Acquisition Corp. Warrants,0.3175,0.0,475,Finance
SVCCU,Stellar V Capital Corp. Unit,10.55,0.0,230,Finance
SVCCW,Stellar V Capital Corp. Warrant,0.2749,0.0,1200,Finance
SVIV,Spring Valley Acquisition Corp. IV Class A Ordinary Shares,9.9,0.0,4747,Finance
ECF,Ellsworth Growth and Income Fund Ltd.,11.18,0.0,19018,Finance
HPS,John Hancock Preferred Income Fund III Preferred Income Fund III,14.17,0.0,44274,Finance
HSPT,Horizon Space Acquisition II Corp. Ordinary share,8.18,0.0,538,Finance
RIV,RiverNorth Opportunities Fund Inc. Common Stock,11.12,0.0,62574,Finance
HPF,John Hancock Pfd Income Fund II Pfd Income Fund II,15.35,0.0,79721,Finance
HPI,John Hancock Preferred Income Fund Common Shares of Beneficial Interest,15.66,0.0,52217,Finance
SVAC,Spring Valley Acquisition Corp. III Class A Ordinary Shares,10.17,0.0,68874,Finance
SVACU,Spring Valley Acquisition Corp. III Unit,10.45,0.0,5,Finance
SVACW,Spring Valley Acquisition Corp. III Warrant,1.06,0.0,99292,Finance
SVAQ,Silicon Valley Acquisition Corp. Class A Ordinary Shares,9.88,0.0,467,Finance
HIX,Western Asset High Income Fund II Inc. Common Stock,3.97,0.0,377648,Finance
HSPTR,Horizon Space Acquisition II Corp. Right,0.2111,0.0,11630,Finance
MPA,Blackrock MuniYield Pennsylvania Quality Fund Common Stock,11.03,0.0,34665,Finance
STEW,SRH Total Return Fund Inc. Common Stock,17.11,0.0,72024,Finance
STK,Columbia Seligman Premium Technology Growth Fund Inc,38.98,0.0,27409,Finance
DYOR,Insight Digital Partners II Class A Ordinary Shares,9.965,0.0,233,Finance
DYORU,Insight Digital Partners II Units,10.17,0.0,15834,Finance
EAD,Allspring Income Opportunities Fund Common Shares,6.5,0.0,175364,Finance
HTD,John Hancock Tax Advantaged Dividend Income Fund Common Shares of Beneficial Interest,24.35,0.0,73617,Finance
FAX,abrdn Asia-Pacific Income Fund Inc. Common Stock,14.82,0.0,118814,Finance
EVV,Eaton Vance Limited Duration Income Fund Common Shares of Beneficial Interest,9.25,0.0,303606,Finance
EXG,Eaton Vance Tax-Managed Global Diversified Equity Income Fund Common Shares of Beneficial Interest,8.62,0.0,997661,Finance
RWAYI,Runway Growth Finance Corp. 7.25% Notes due 2031,25.16,0.0,1367,Finance
EMD,Western Asset Emerging Markets Debt Fund Inc Common Stock,10.18,0.0,160278,Finance
EMF,Templeton Emerging Markets Fund Common Stock,17.93,0.0,91880,Finance
EMO,ClearBridge Energy Midstream Opportunity Fund Inc. Common Stock,53.3,0.0,49287,Finance
FACTW,FACT II Acquisition Corp. Warrant,0.385,0.0,2230,Finance
ALISR,Calisa Acquisition Corp Right,0.5301,0.0,51055,Finance
TWLV,Twelve Seas Investment Company III Class A Ordinary Shares,9.87,0.0,113,Finance
TWN,Taiwan Fund Inc. (The) Common Stock,66.03,0.0,22044,Finance
AGD,abrdn Global Dynamic Dividend Fund Common Shares of Beneficial Interest,11.61,0.0,118080,Finance
DAAQW,Digital Asset Acquisition Corp. Warrant,0.3669,0.0,2101,Finance
SIMAW,SIM Acquisition Corp. I Warrant,0.3,0.0,26892,Finance
FGSN,F&G Annuities & Life Inc. 7.300% Junior Subordinated Notes due 2065,20.27,0.0,29723,Finance
FGII,FG Imperii Acquisition Corp. Class A Ordinary Shares,9.9,0.0,107,Finance
FGIIU,FG Imperii Acquisition Corp. Units,9.97,0.0,3243,Finance
FGIIW,FG Imperii Acquisition Corp. Warrants,0.19,0.0,1609,Finance
JOF,Japan Smaller Capitalization Fund Inc Common Stock,10.69,0.0,56561,Finance
FLC,Flaherty & Crumrine Total Return Fund Inc Common Stock,16.73,0.0,12446,Finance
PTORW,Praetorian Acquisition Corp. Warrant,0.29,0.0,29865,Finance
PTY,Pimco Corporate & Income Opportunity Fund,11.91,0.0,1373275,Finance
IPCX,Inflection Point Acquisition Corp. III Class A Ordinary Shares,10.2,0.0,38289,Finance
IPCXR,Inflection Point Acquisition Corp. III Rights,0.34,0.0,5150,Finance
IPEXR,Inflection Point Acquisition Corp. V Rights,0.49,0.0,4261,Finance
IPEXU,Inflection Point Acquisition Corp. V Units,10.74,0.0,195,Finance
IPOD,Dune Acquisition Corporation II Class A Ordinary Shares,10.34,0.0,25005,Finance
IPODW,Dune Acquisition Corporation II Warrants,0.2235,0.0,100,Finance
ALFUW,Centurion Acquisition Corp. Warrant,0.1841,0.0,1300,Finance
TSI,TCW Strategic Income Fund Inc. Common Stock,4.64,0.0,85289,Finance
CRBD,Corebridge Financial Inc. 6.375% Junior Subordinated Notes due 2064,22.42,0.0,34577,Finance
CRF,Cornerstone Total Return Fund Inc. (The) Common Stock,7.02,0.0,1187649,Finance
