symbol,name,price,marketCap,volume,industry
EIM,Eaton Vance Municipal Bond Fund Common Shares of Beneficial Interest $.01 par value,10.01,0.0,90795,Finance
GJT,Synthetic Fixed-Income Securities Inc. Floating Rate Structured Repackaged Asset-Backed Trust Securities Certificates Series 2006-3,23.23,0.0,29,Finance
UYSC,UY Scuti Acquisition Corp. Ordinary Shares,10.31,0.0,1135,Finance
XSLLU,Xsolla SPAC 1 Units,9.92,0.0,181544,Finance
ZKP,Lafayette Digital Acquisition Corp. I Class A Ordinary Shares,9.88,0.0,133638,Finance
ZKPU,Lafayette Digital Acquisition Corp. I Unit,10.03,0.0,2612,Finance
MUZEU,Muzero Acquisition Corp Unit,10.0,0.0,114466,Finance
ZKPW,Lafayette Digital Acquisition Corp. I Warrant,0.5,0.0,6676,Finance
UTG,Reaves Utility Income Fund Common Shares of Beneficial Interest,39.43,0.0,350312,Finance
ARCIU,Archimedes Tech SPAC Partners III Co. Units,10.07,0.0,11172,Finance
HIX,Western Asset High Income Fund II Inc. Common Stock,4.25,0.0,222173,Finance
HIO,Western Asset High Income Opportunity Fund Inc. Common Stock,3.8,0.0,549653,Finance
BRW,Saba Capital Income & Opportunities Fund SBI,6.52,0.0,445860,Finance
RCG,RENN Fund Inc Common Stock,2.74,0.0,22140,Finance
XCBEU,X3 Acquisition Corp. Ltd. Unit,9.99,0.0,4707,Finance
TWLVR,Twelve Seas Investment Company III Rights,0.17,0.0,50020,Finance
TWLV,Twelve Seas Investment Company III Class A Ordinary Shares,9.93,0.0,170,Finance
PAXS,PIMCO Access Income Fund Common Shares of Beneficial Interest,15.96,0.0,119140,Finance
NAD,Nuveen Quality Municipal Income Fund Common Stock,12.2,0.0,493611,Finance
NAC,Nuveen California Quality Municipal Income Fund,11.93,0.0,559193,Finance
PCAP,ProCap Acquisition Corp Class A Ordinary Shares,10.18,0.0,21149,Finance
PCAPW,ProCap Acquisition Corp Warrant,0.34,0.0,13799,Finance
XRPNW,Armada Acquisition Corp. II Warrant,0.755,0.0,6333,Finance
TWN,Taiwan Fund Inc. (The) Common Stock,60.45,0.0,22432,Finance
TWLVU,Twelve Seas Investment Company III Units,10.3,0.0,5,Finance
EFR,Eaton Vance Senior Floating-Rate Fund Common Shares of Beneficial Interest,11.07,0.0,323560,Finance
DAAQW,Digital Asset Acquisition Corp. Warrant,0.4001,0.0,275,Finance
MXF,Mexico Fund Inc. (The) Common Stock,22.65,0.0,70674,Finance
XRPNU,Armada Acquisition Corp. II Units,10.7,0.0,8,Finance
MXE,Mexico Equity and Income Fund Inc. (The) Common Stock,14.16,0.0,1137,Finance
HFRO,Highland Opportunities and Income Fund Common Shares of Beneficial Interest,6.33,0.0,98514,Finance
XRPN,Armada Acquisition Corp. II Class A Ordinary Shares,10.25,0.0,80194,Finance
ADACU,American Drive Acquisition Company Units,9.97,0.0,268,Finance
PML,Pimco Municipal Income Fund II Common Shares of Beneficial Interest,7.81,0.0,459244,Finance
AOD,abrdn Total Dynamic Dividend Fund Common Shares of Beneficial Interest,10.26,0.0,418840,Finance
PCN,Pimco Corporate & Income Strategy Fund Common Stock,12.87,0.0,401014,Finance
PCQ,PIMCO California Municipal Income Fund Common Stock,9.14,0.0,190650,Finance
KTN,Structured Products Corp 8.205% CorTS 8.205% Corporate Backed Trust Securities (CorTS),25.76,0.0,8782,Finance
KTH,Structures Products Cp 8% CorTS Issued by Peco Energy Cap Tr II Preferred Stock,28.75,0.0,338,Finance
BDCI,BTC Development Corp. Class A Ordinary Shares,10.08,0.0,13071,Finance
CRAN,Crane Harbor Acquisition Corp. II Class A Ordinary Shares,10.0,0.0,2759,Finance
CRAQ,Cal Redwood Acquisition Corp. Class A Ordinary Shares,10.16,0.0,105,Finance
MEVOU,M Evo Global Acquisition Corp II Units,10.035,0.0,502923,Finance
BDCIW,BTC Development Corp. Warrant,0.5781,0.0,34,Finance
CRBD,Corebridge Financial Inc. 6.375% Junior Subordinated Notes due 2064,24.32,0.0,27412,Finance
CRF,Cornerstone Total Return Fund Inc. (The) Common Stock,7.68,0.0,1113895,Finance
GECCO,Great Elm Capital Corp. 5.875% Notes due 2026,25.1,0.0,4,Finance
GECCI,Great Elm Capital Corp. 8.50% NOTES DUE 2029,25.275,0.0,1273,Finance
GECCG,Great Elm Capital Corp. 7.75% Notes Due 2030,24.67,0.0,28730,Finance
RA,Brookfield Real Assets Income Fund Inc. Common Stock,13.27,0.0,173062,Finance
GDO,Western Asset Global Corporate Opportunity Fund Inc. Common Stock,11.56,0.0,28120,Finance
CRAQR,Cal Redwood Acquisition Corp. Right,0.235,0.0,11975,Finance
ALISR,Calisa Acquisition Corp Right,0.55,0.0,605,Finance
VVR,Invesco Senior Income Trust Common Stock (DE),3.29,0.0,519081,Finance
PFL,PIMCO Income Strategy Fund Shares of Beneficial Interest,8.47,0.0,247905,Finance
PFN,PIMCO Income Strategy Fund II,7.51,0.0,425580,Finance
MCGAU,Yorkville Acquisition Corp. Unit,10.275,0.0,250,Finance
PFO,Flaherty & Crumrine Preferred and Income Opportunity Fund Incorporated,9.68,0.0,47611,Finance
BIXIU,Bitcoin Infrastructure Acquisition Corp Ltd. Unit ,10.0,0.0,3651,Finance
BGB,Blackstone Strategic Credit 2027 Term Fund Common Shares of Beneficial Interest,11.63,0.0,119174,Finance
BIT,BlackRock Multi-Sector Income Trust Common Shares of Beneficial Interest,13.38,0.0,201170,Finance
FGIIU,FG Imperii Acquisition Corp. Units,9.995,0.0,1131,Finance
BGH,Barings Global Short Duration High Yield Fund Common Shares of Beneficial Interests,14.96,0.0,79668,Finance
GJP,Synthetic Fixed-Income Securities Inc. on behalf of STRATS (SM) Trust for Dominion Resources Inc. Securities Series 2005-6 Floating Rate Structured Repackaged Asset-Backed Trust Securities (STRATS) Certificates,25.02,0.0,4865,Finance
GUG,Guggenheim Active Allocation Fund Common Shares of Beneficial Interest,16.18,0.0,84086,Finance
ALDFU,Aldel Financial II Inc. Units,10.74,0.0,1022,Finance
ALDFW,Aldel Financial II Inc. Warrants,0.55,0.0,5369,Finance
MKLYU,McKinley Acquisition Corporation Units,10.2,0.0,252,Finance
EOI,Eaton Vance Enhance Equity Income Fund Eaton Vance Enhanced Equity Income Fund Shares of Beneficial Interest,20.58,0.0,56902,Finance
EOD,Allspring Global Dividend Opportunity Fund Common Shares of Beneficial Interest,6.13,0.0,166910,Finance
GHY,PGIM Global High Yield Fund Inc.,12.92,0.0,117200,Finance
ESHA,ESH Acquisition Corp. Class A Common Stock,12.1,0.0,5166,Finance
BKN,BlackRock Investment Quality Municipal Trust Inc. (The),11.53,0.0,34059,Finance
GIGGW,GigCapital7 Corp. Warrant,0.48,0.0,11555,Finance
GIG,GigCapital7 Corp. Class A Ordinary Share,10.6,0.0,857779,Finance
WLACW,Willow Lane Acquisition Corp. Warrants,3.5,0.0,5247,Finance
GOF,Guggenheim Strategic Opportunities Fund Common Shares of Beneficial Interest,12.55,0.0,1177131,Finance
WIW,Western Asset Inflation-Linked Opportunities & Income Fund,8.72,0.0,247966,Finance
WIA,Western Asset Inflation-Linked Income Fund,8.37,0.0,24073,Finance
BHV,BlackRock Virginia Municipal Bond Trust,10.795,0.0,4526,Finance
ATIIW,Archimedes Tech SPAC Partners II Co. Warrant,0.72,0.0,2091,Finance
BHK,Blackrock Core Bond Trust,9.69,0.0,446869,Finance
BGY,Blackrock Enhanced International Dividend Trust,6.18,0.0,482447,Finance
GJO,Synthetic Fixed-Income Securities Inc. on behalf of STRATS(SM) Trust for Wal-Mart Stores Inc. Securities Series 2004-5,24.8,0.0,221,Finance
ZTR,Virtus Total Return Fund Inc.,6.71,0.0,465968,Finance
AWF,Alliancebernstein Global High Income Fund,10.63,0.0,201005,Finance
GRF,Eagle Capital Growth Fund Inc. Common Stock,11.09,0.0,1623,Finance
AWP,abrdn Global Premier Properties Fund Common Shares of Beneficial Interest,12.1,0.0,291617,Finance
ERC,Allspring Multi-Sector Income Fund Common Stock,9.51,0.0,104046,Finance
MLAAU,Mountain Lake Acquisition Corp. II Units,9.99,0.0,284740,Finance
GJH,Synthetic Fixed-Income Securities Inc 6.375% (STRATS) Cl A-1,9.64,0.0,600,Finance
GIXXU,GigCapital9 Corp. Units,10.05,0.0,229459,Finance
WENNW,Wen Acquisition Corp Warrant,0.31,0.0,10000,Finance
WEA,Western Asset Bond Fund Share of Beneficial Interest,11.24,0.0,29700,Finance
WDI,Western Asset Diversified Income Fund Common Shares of Beneficial Interest,14.1,0.0,254260,Finance
WLAC,Willow Lane Acquisition Corp. Class A Ordinary Shares,11.22,0.0,146697,Finance
MMU,Western Asset Managed Municipals Fund Inc. Common Stock,10.67,0.0,88101,Finance
MMD,NYLI MacKay DefinedTerm Muni Opportunities Fund Common Shares,15.68,0.0,35264,Finance
MLCIL,Mount Logan Capital Inc. 8.00% Notes Due 2031,24.2,0.0,3959,Finance
BGT,BlackRock Floating Rate Income Trust,11.39,0.0,107461,Finance
WLACU,Willow Lane Acquisition Corp. Unit,14.4,0.0,5384,Finance
ESHAR,ESH Acquisition Corp. Right,0.18,0.0,706,Finance
VFL,abrdn National Municipal Income Fund Common Stock,10.41,0.0,28924,Finance
AOMN,Angel Oak Mortgage REIT Inc. 9.500% Senior Notes due 2029,25.37,0.0,395,Finance
ETJ,Eaton Vance Risk-Managed Diversified Equity Income Fund Common Shares of Beneficial Interest,8.82,0.0,111648,Finance
ETG,Eaton Vance Tax-Advantaged Global Dividend Income Fund Common Shares of Beneficial Interest,23.31,0.0,120548,Finance
MSD,Morgan Stanley Emerging Markets Debt Fund Inc. Common Stock,7.82,0.0,80100,Finance
EMO,ClearBridge Energy Midstream Opportunity Fund Inc. Common Stock,49.66,0.0,50084,Finance
EMF,Templeton Emerging Markets Fund Common Stock,19.95,0.0,29519,Finance
EMD,Western Asset Emerging Markets Debt Fund Inc Common Stock,11.12,0.0,163801,Finance
UTF,Cohen & Steers Infrastructure Fund Inc Common Stock,26.45,0.0,308450,Finance
PYT,PPlus Tr GSC-2 Tr Ctf Fltg Rate,23.9758,0.0,900,Finance
USA,Liberty All-Star Equity Fund Common Stock,6.04,0.0,980047,Finance
QETA,Quetta Acquisition Corporation Common Stock,11.49,0.0,498,Finance
QETAR,Quetta Acquisition Corporation Right,1.0,0.0,415,Finance
ALFUW,Centurion Acquisition Corp. Warrant,0.22,0.0,61086,Finance
PDT,John Hancock Premium Dividend Fund,13.36,0.0,106093,Finance
PELIR,Pelican Acquisition Corporation Right,0.723,0.0,15492,Finance
VBF,Invesco Bond Fund Common Stock,15.395,0.0,57572,Finance
VACHW,Voyager Acquisition Corp Warrants,0.2799,0.0,12520,Finance
AOMD,Angel Oak Mortgage REIT Inc. 9.750% Senior Notes due 2030,25.8,0.0,4978,Finance
HERZ,Herzfeld Credit Income Fund Inc. Common Stock,18.6767,0.0,8291,Finance
HEQ,John Hancock Diversified Income Fund Common Shares of Beneficial Interest,11.295,0.0,41974,Finance
PELI,Pelican Acquisition Corporation Ordinary Shares,10.35,0.0,90099,Finance
VGI,Virtus Global Multi-Sector Income Fund Common Shares of Beneficial Interest,7.98,0.0,46820,Finance
VCICW,Vine Hill Capital Investment Corp. Warrant,1.6,0.0,13132,Finance
MHF,Western Asset Municipal High Income Fund Inc. Common Stock,7.01,0.0,31749,Finance
BLZRW,Trailblazer Acquisition Corp. Warrant,0.483,0.0,21064,Finance
KFIIU,K&F Growth Acquisition Corp. II Unit,10.75,0.0,105,Finance
GSHRW,Gesher Acquisition Corp. II Warrants,0.3538,0.0,10158,Finance
ACP,abrdn Income Credit Strategies Fund Common Shares,5.68,0.0,534385,Finance
MPA,Blackrock MuniYield Pennsylvania Quality Fund Common Stock,11.49,0.0,35243,Finance
ALCY,Alchemy Investments Acquisition Corp 1 Class A Ordinary Shares,11.79,0.0,2051,Finance
ALCYW,Alchemy Investments Acquisition Corp 1 Warrants,0.1406,0.0,30297,Finance
BSL,Blackstone Senior Floating Rate 2027 Term Fund Common Shares of Beneficial Interest,13.24,0.0,79074,Finance
KIO,KKR Income Opportunities Fund Common Shares,11.79,0.0,214543,Finance
FCO,abrdn Global Income Fund Inc. Common Stock,3.07,0.0,75931,Finance
FCT,First Trust Senior Floating Rate Income Fund II Common Shares of Beneficial Interest,9.93,0.0,85020,Finance
BLZR,Trailblazer Acquisition Corp. Class A Ordinary Shares,10.09,0.0,2975,Finance
VHCPU,Vine Hill Capital Investment Corp. II Units,10.05,0.0,16202,Finance
PTY,Pimco Corporate & Income Opportunity Fund,13.09,0.0,1283571,Finance
KF,Korea Fund Inc. (The) New Common Stock,47.26,0.0,10255,Finance
VNMEW,Vendome Acquisition Corporation I Warrant,0.29,0.0,104,Finance
VNMEU,Vendome Acquisition Corporation I Unit,10.24,0.0,28,Finance
VNME,Vendome Acquisition Corporation I Class A Ordinary Shares,10.12,0.0,112,Finance
VLT,Invesco High Income Trust II,11.01,0.0,20241,Finance
GJR,Synthetic Fixed-Income Securities Inc. STRATS Trust for Procter&Gamble Securities Series 2006-1,24.8,0.0,10,Finance
GGN,GAMCO Global Gold Natural Resources & Income Trust,5.62,0.0,706669,Finance
GF,New Germany Fund Inc. (The) Common Stock,12.17,0.0,5939,Finance
LPAAW,Launch One Acquisition Corp. Warrant,0.1101,0.0,385,Finance
FACTU,FACT II Acquisition Corp. Unit,10.71,0.0,126,Finance
MEGI,NYLI CBRE Global Infrastructure Megatrends Term Fund Common Shares,14.98,0.0,235205,Finance
SPE,Special Opportunities Fund Inc Common Stock,15.052,0.0,50775,Finance
SORNU,Soren Acquisition Corp. Unit,9.99,0.0,100039,Finance
FACTW,FACT II Acquisition Corp. Warrant,0.5245,0.0,610,Finance
IIF,Morgan Stanley India Investment Fund Inc. Common Stock,24.6,0.0,94867,Finance
SPXX,Nuveen S&P 500 Dynamic Overwrite Fund,18.02,0.0,37091,Finance
JCE,Nuveen Core Equity Alpha Fund Common Shares of Beneficial Interest,15.98,0.0,52941,Finance
JFR,Nuveen Floating Rate Income Fund Common Stock,7.82,0.0,553026,Finance
FLC,Flaherty & Crumrine Total Return Fund Inc Common Stock,17.91,0.0,15454,Finance
DSU,Blackrock Debt Strategies Fund Inc. Common Stock,10.13,0.0,374460,Finance
CEPT,Cantor Equity Partners II Inc. Class A Ordinary Share,11.41,0.0,231887,Finance
CEPS,Cantor Equity Partners VI Inc. Class A Ordinary Shares,10.15,0.0,76524,Finance
CEPO,Cantor Equity Partners I Inc. Class A Ordinary Shares,10.44,0.0,192512,Finance
CEPF,Cantor Equity Partners IV Inc. Class A Ordinary Shares,10.44,0.0,75082,Finance
NVG,Nuveen AMT-Free Municipal Credit Income Fund ,13.23,0.0,407633,Finance
NUW,Nuveen AMT-Free Municipal Value Fund,14.54,0.0,54545,Finance
NUV,Nuveen Municipal Value Fund Inc. Common Stock,9.18,0.0,509098,Finance
RTACU,Renatus Tactical Acquisition Corp I Unit,11.05,0.0,470,Finance
RTACW,Renatus Tactical Acquisition Corp I Warrant,0.8,0.0,11403,Finance
FMY,First Trust Mortgage Income Fund Common Shares of Beneficial Interest,12.1461,0.0,1019,Finance
AGD,abrdn Global Dynamic Dividend Fund Common Shares of Beneficial Interest,12.36,0.0,87095,Finance
JOF,Japan Smaller Capitalization Fund Inc Common Stock,11.98,0.0,290906,Finance
CEE,The Central and Eastern Europe Fund Inc. (The) Common Stock,19.53,0.0,32143,Finance
RTAC,Renatus Tactical Acquisition Corp I Class A Ordinary Shares,10.71,0.0,30012,Finance
JLS,Nuveen Mortgage and Income Fund,18.85,0.0,14888,Finance
STEW,SRH Total Return Fund Inc. Common Stock,18.28,0.0,67152,Finance
SSACU,SPACSphere Acquisition Corp. Unit,10.04,0.0,578038,Finance
CCD,Calamos Dynamic Convertible & Income Fund Common Stock,22.89,0.0,63327,Finance
CCCXW,Churchill Capital Corp X Warrants,5.85,0.0,336822,Finance
CCCXU,Churchill Capital Corp X Unit,14.97,0.0,4830,Finance
LPCVU,Launchpad Cadenza Acquisition Corp I Unit,10.09,0.0,25187,Finance
IHD,Voya Emerging Markets High Income Dividend Equity Fund Common Shares,7.08,0.0,160466,Finance
IGR,CBRE Global Real Estate Income Fund Common Shares of Beneficial Interest,4.88,0.0,855361,Finance
IGI,Western Asset Investment Grade Opportunity Trust Inc. Common Stock,16.59,0.0,11437,Finance
IGD,Voya Global Equity Dividend and Premium Opportunity Fund,5.88,0.0,228456,Finance
OTGA,OTG Acquisition Corp. I Class A Ordinary Share ,10.065,0.0,1442,Finance
NPFD,Nuveen Variable Rate Preferred & Income Fund Common Shares,19.76,0.0,89092,Finance
NPCT,Nuveen Core Plus Impact Fund Common Shares of Beneficial Interest,10.55,0.0,120601,Finance
NPACU,New Providence Acquisition Corp. III Units,10.46,0.0,106,Finance
CCCX,Churchill Capital Corp X Class A Ordinary Shares,12.665,0.0,7129980,Finance
JGH,Nuveen Global High Income Fund Common Shares of Beneficial Interest,12.97,0.0,96179,Finance
SRV,NXG Cushing Midstream Energy Fund Common Shares of Beneficial Interest,42.63,0.0,39305,Finance
CCXIU,Churchill Capital Corp XI Units,10.31,0.0,15572,Finance
AFB,AllianceBernstein National Municipal Income Fund Inc,11.05,0.0,76775,Finance
NRUC,National Rural Utilities Cooperative Finance Corporation 5.500% Subordinated Notes due 2064 (Subordinated Deferrable Interest Notes),24.28,0.0,18356,Finance
NRO,Neuberger Real Estate Securities Income Fund Inc. Common Stock,3.05,0.0,266065,Finance
NRK,Nuveen New York AMT-Free Quality Municipal Income Fund ,10.24,0.0,469103,Finance
NQP,Nuveen Pennsylvania Quality Municipal Income Fund Common Stock,12.09,0.0,83863,Finance
IGAC,Invest Green Acquisition Corporation Class A Ordinary Shares,9.9721,0.0,238,Finance
IGA,Voya Global Advantage and Premium Opportunity Fund Common Shares of Beneficial Interest,9.98,0.0,61149,Finance
IFN,India Fund Inc. (The) Common Stock,14.23,0.0,259918,Finance
IDE,Voya Infrastructure Industrials and Materials Fund Common Shares of Beneficial Interest,13.735,0.0,63817,Finance
CICB,CION Investment Corporation 7.50% Notes due 2029,25.34,0.0,6420,Finance
DMII,Drugs Made In America Acquisition II Corp. Ordinary Shares,9.99,0.0,4716,Finance
ALOVU,Aldabra 4 Liquidity Opportunity Vehicle Inc. Units,9.99,0.0,29658,Finance
DMIIR,Drugs Made In America Acquisition II Corp. Right,0.1201,0.0,1011,Finance
DPG,Duff & Phelps Utility and Infrastructure Fund Inc.,14.04,0.0,140242,Finance
FPF,First Trust Intermediate Duration Preferred & Income Fund Common Shares of Beneficial Interest,18.89,0.0,93269,Finance
DMO,Western Asset Mortgage Opportunity Fund Inc. Common Stock,11.21,0.0,33952,Finance
DHY,Credit Suisse High Yield Credit Fund Common Stock,2.01,0.0,684291,Finance
NXJ,Nuveen New Jersey Qualified Municipal Fund ,12.56,0.0,144074,Finance
OIMAU,OneIM Acquisition Corp. Units,10.11,0.0,1395,Finance
CLM,Cornerstone Strategic Investment Fund Inc. Common Shares,8.06,0.0,1485203,Finance
CHY,Calamos Convertible and High Income Fund Common Stock,11.98,0.0,221653,Finance
CHW,Calamos Global Dynamic Income Fund Common Stock,8.2,0.0,312668,Finance
IPCX,Inflection Point Acquisition Corp. III Class A Ordinary Shares,10.17,0.0,70361,Finance
SCD,LMP Capital and Income Fund Inc. Common Stock,15.98,0.0,44399,Finance
SBI,Western Asset Intermediate Muni Fund Inc Common Stock,7.97,0.0,21048,Finance
IPCXR,Inflection Point Acquisition Corp. III Rights,0.36,0.0,6400,Finance
ONCHW,1RT Acquisition Corp. Warrant,0.6,0.0,1211,Finance
SDHI,Siddhi Acquisition Corp Class A Common stock,10.27,0.0,175004,Finance
IPEXR,Inflection Point Acquisition Corp. V Rights,0.5001,0.0,122,Finance
CIF,MFS Intermediate High Income Fund Common Stock,1.71,0.0,37114,Finance
IPEXU,Inflection Point Acquisition Corp. V Units,11.2,0.0,300,Finance
IPODW,Dune Acquisition Corporation II Warrants,0.4364,0.0,1768,Finance
IPODU,Dune Acquisition Corporation II Units,10.44,0.0,1,Finance
IPOD,Dune Acquisition Corporation II Class A Ordinary Shares,10.33,0.0,135,Finance
DMAAR,Drugs Made In America Acquisition Corp. Rights,0.1185,0.0,63608,Finance
CIK,Credit Suisse Asset Management Income Fund Inc. Common Stock,2.82,0.0,651231,Finance
DHF,BNY Mellon High Yield Strategies Fund Common Stock,2.57,0.0,638686,Finance
OPP,RiverNorth/DoubleLine Strategic Opportunity Fund Inc. Common Stock,7.95,0.0,110990,Finance
SIMAW,SIM Acquisition Corp. I Warrant,0.3601,0.0,5137,Finance
CHI,Calamos Convertible Opportunities and Income Fund Common Stock,11.5,0.0,250171,Finance
CHACR,Crane Harbor Acquistion Corp. Rights,0.7538,0.0,44465,Finance
LFAC,Leapfrog Acquisition Corporation Class A Ordinary Shares,10.01,0.0,6689,Finance
APXTW,Apex Treasury Corporation Warrants,0.23,0.0,10000,Finance
APXTU,Apex Treasury Corporation Units,10.15,0.0,8071,Finance
CGO,Calamos Global Total Return Fund Common Stock,12.48,0.0,53531,Finance
RWAYI,Runway Growth Finance Corp. 7.25% Notes due 2031,25.36,0.0,28847,Finance
BACCU,Blue Acquisition Corp. Unit,10.46,0.0,1,Finance
DSM,BNY Mellon Strategic Municipal Bond Fund Inc. Common Stock,6.27,0.0,33923,Finance
DNP,DNP Select Income Fund Inc. Common Stock,10.19,0.0,942455,Finance
DNMXW,Dynamix Corporation III Warrants,0.315,0.0,354,Finance
DNMXU,Dynamix Corporation III Unit,10.11,0.0,1113,Finance
DNMX,Dynamix Corporation III Class A Ordinary Shares,9.96,0.0,125208,Finance
OACCW,Oaktree Acquisition Corp. III Life Sciences Warrant,0.76,0.0,2000,Finance
OACCU,Oaktree Acquisition Corp. III Life Sciences Unit,10.69,0.0,369,Finance
OACC,Oaktree Acquisition Corp. III Life Sciences Class A Ordinary Share,10.64,0.0,441,Finance
BACQR,Inflection Point Acquisition Corp. IV Right,0.7601,0.0,244011,Finance
NZF,Nuveen Municipal Credit Income Fund ,12.9,0.0,512199,Finance
CGCT,Cartesian Growth Corporation III Class A Ordinary Shares,10.3,0.0,7634,Finance
PHK,Pimco High Income Fund,4.97,0.0,975101,Finance
SAAQU,Space Asset Acquisition Corp. Units,10.26,0.0,277156,Finance
PGP,Pimco Global StocksPlus & Income Fund Common Shares of Beneficial Interest,9.35,0.0,65427,Finance
IRHOU,Iron Horse Acquisitions II Corp. Units,10.03,0.0,467,Finance
ISD,PGIM High Yield Bond Fund Inc.,14.7,0.0,97008,Finance
CGCTW,Cartesian Growth Corporation III Warrant,0.86,0.0,2134,Finance
CGCTU,Cartesian Growth Corporation III Unit,10.64,0.0,1139,Finance
FFC,Flaherty & Crumrine Preferred and Income Securities Fund Incorporated,16.73,0.0,94777,Finance
FFA,First Trust Enhanced Equity Income Fund Common Shares of Beneficial Interest,22.12,0.0,44421,Finance
EAD,Allspring Income Opportunities Fund Common Shares,6.9,0.0,140183,Finance
FAX,abrdn Asia-Pacific Income Fund Inc. Common Stock,15.9,0.0,116744,Finance
NEA,Nuveen AMT-Free Quality Municipal Income Fund Common Shares of Beneficial Interest Par Value $.01,11.77,0.0,1073467,Finance
AVK,Advent Convertible and Income Fund,12.77,0.0,216231,Finance
LCCC,Lakeshore Acquisition III Corp. Ordinary Shares,10.25,0.0,9172,Finance
EVG,Eaton Vance Short Diversified Income Fund Eaton Vance Short Duration Diversified Income Fund Common Shares of Beneficial Interest,11.05,0.0,25003,Finance
ETY,Eaton Vance Tax-Managed Diversified Equity Income Fund Common Shares of Beneficial Interest,15.08,0.0,132145,Finance
LWACW,LightWave Acquisition Corp. Warrants,0.3,0.0,5,Finance
LWACU,LightWave Acquisition Corp. Units,10.2,0.0,1,Finance
EEA,The European Equity Fund Inc. Common Stock,10.91,0.0,160053,Finance
BACC,Blue Acquisition Corp. Class A Ordinary Shares,10.24,0.0,11396,Finance
EDF,Virtus Stone Harbor Emerging Markets Income Fund Common Shares of Beneficial Interest,5.17,0.0,351097,Finance
BWG,BrandywineGLOBAL Global Income Opportunities Fund Inc.,8.64,0.0,94551,Finance
HSPTR,Horizon Space Acquisition II Corp. Right,0.22,0.0,22793,Finance
HSPT,Horizon Space Acquisition II Corp. Ordinary share,10.05,0.0,455,Finance
CAPNR,Cayson Acquisition Corp Right,0.1945,0.0,167503,Finance
TLNCU,Talon Capital Corp. Units,10.29,0.0,22,Finance
PAI,Western Asset Investment Grade Income Fund Inc.,12.71,0.0,8423,Finance
LATA,Galata Acquisition Corp. II Class A Ordinary Shares,10.02,0.0,12,Finance
THW,abrdn World Healthcare Fund Shares of Beneficial Interest,12.5,0.0,106815,Finance
PNI,Pimco New York Municipal Income Fund II Common Shares of Beneficial Interest,7.12,0.0,21335,Finance
CAF,Morgan Stanley China A Share Fund Inc. Common Stock,18.16,0.0,65019,Finance
THQ,abrdn Healthcare Opportunities Fund Shares of Beneficial Interest,18.91,0.0,136708,Finance
JRI,Nuveen Real Asset Income and Growth Fund Common Shares of Beneficial Interest,12.78,0.0,179075,Finance
NFJ,Virtus Dividend Interest & Premium Strategy Fund Common Shares of Beneficial Interest,13.69,0.0,200275,Finance
JRS,Nuveen Real Estate Income Fund Common Shares of Beneficial Interest,8.07,0.0,99016,Finance
CUBWU,Lionheart Holdings Unit,10.76,0.0,399,Finance
FGSN,F&G Annuities & Life Inc. 7.300% Junior Subordinated Notes due 2065,22.2,0.0,25870,Finance
FIGXU,FIGX Capital Acquisition Corp. Units,10.19,0.0,1501,Finance
RDAGW,Republic Digital Acquisition Company Warrants,0.6399,0.0,4,Finance
BTO,John Hancock Financial Opportunities Fund Common Stock,39.4,0.0,55332,Finance
BACCR,Blue Acquisition Corp. Right ,0.26,0.0,200,Finance
CRANR,Crane Harbor Acquisition Corp. II Rights,0.2125,0.0,365,Finance
GAINI,Gladstone Investment Corporation 7.875% Notes due 2030,25.5,0.0,44605,Finance
KBON,Karbon Capital Partners Corp. Class A Ordinary Shares,10.07,0.0,2100684,Finance
MYN,Blackrock MuniYield New York Quality Fund Inc.Common Stock,10.1,0.0,158465,Finance
MACIW,Melar Acquisition Corp. I Warrant,0.1308,0.0,35,Finance
MACIU,Melar Acquisition Corp. I Unit,10.9,0.0,200,Finance
KBONU,Karbon Capital Partners Corp. Units,10.2299,0.0,2680,Finance
ADX,Adams Diversified Equity Fund Inc.,23.15,0.0,206107,Finance
TVACU,Texas Ventures Acquisition III Corp Unit,11.71,0.0,800,Finance
MBAVW,M3-Brigade Acquisition V Corp. Warrant,0.7,0.0,4634,Finance
GDL,GDL Fund The Common Shares of Beneficial Interest,8.575,0.0,1571,Finance
KCHVR,Kochav Defense Acquisition Corp. Right,0.2699,0.0,87,Finance
BTA,BlackRock Long-Term Municipal Advantage Trust Common Shares of Beneficial Interest,9.69,0.0,192048,Finance
KBONW,Karbon Capital Partners Corp. Warrant,0.6,0.0,94563,Finance
HPS,John Hancock Preferred Income Fund III Preferred Income Fund III,14.79,0.0,61696,Finance
HPI,John Hancock Preferred Income Fund Common Shares of Beneficial Interest,16.226,0.0,25749,Finance
HPF,John Hancock Pfd Income Fund II Pfd Income Fund II,16.18,0.0,28794,Finance
JPC,Nuveen Preferred & Income Opportunities Fund,8.26,0.0,933008,Finance
JQC,Nuveen Credit Strategies Income Fund Shares of Beneficial Interest,5.09,0.0,774756,Finance
PCF,High Income Securities Fund Common Stock,6.06,0.0,48782,Finance
PCM,PCM Fund Inc. Common Stock,6.14,0.0,136361,Finance
APACU,StoneBridge Acquisition II Corporation Units,10.2,0.0,269,Finance
BXMX,Nuveen S&P 500 Buy-Write Income Fund Common Shares of Beneficial Interest,14.96,0.0,157246,Finance
BTT,BlackRock Municipal 2030 Target Term Trust,22.89,0.0,95440,Finance
ECF,Ellsworth Growth and Income Fund Ltd.,12.18,0.0,45897,Finance
RCS,PIMCO Strategic Income Fund Inc.,5.91,0.0,135278,Finance
NCA,Nuveen California Municipal Value Fund,9.5,0.0,113167,Finance
NBXG,Neuberger Next Generation Connectivity Fund Inc. Common Stock,13.55,0.0,188258,Finance
NBH,Neuberger Municipal Fund Inc. Common Stock,10.6,0.0,65111,Finance
NBB,Nuveen Taxable Municipal Income Fund Common Shares of Beneficial Interest,16.01,0.0,58669,Finance
