symbol,name,price,marketCap,volume,industry
BHAVR,BHAV Acquisition Corp Rights,0.21,0.0,2100,Finance
BACCR,Blue Acquisition Corp. Right ,0.3232,0.0,3803,Finance
BACC,Blue Acquisition Corp. Class A Ordinary Shares,10.35,0.0,426,Finance
VFL,abrdn National Municipal Income Fund Common Stock,10.0,0.0,18913,Finance
VGI,Virtus Global Multi-Sector Income Fund Common Shares of Beneficial Interest,7.35,0.0,58981,Finance
BDCI,BTC Development Corp. Class A Ordinary Shares,10.04,0.0,9625,Finance
VNME,Vendome Acquisition Corporation I Class A Ordinary Shares,10.17,0.0,5204,Finance
BBN,BlackRock Taxable Municipal Bond Trust Common Shares of Beneficial Interest,15.59,0.0,367269,Finance
BCAR,D. Boral ARC Acquisition I Corp. Class A Ordinary Shares,10.7,0.0,183677,Finance
BCARU,D. Boral ARC Acquisition I Corp. Units,10.68,0.0,1000,Finance
BCARW,D. Boral ARC Acquisition I Corp. Warrant,1.76,0.0,134009,Finance
VLT,Invesco High Income Trust II,10.44,0.0,12878,Finance
KF,Korea Fund Inc. (The) New Common Stock,67.2,0.0,19044,Finance
SIMAU,SIM Acquisition Corp. I Unit,13.01,0.0,15619,Finance
SIMAW,SIM Acquisition Corp. I Warrant,0.1419,0.0,30,Finance
GAING,Gladstone Investment Corporation 7.125% Notes due 2031,25.23,0.0,14174,Finance
OXLCG,Oxford Lane Capital Corp. 7.95% Notes due 2032,25.3,0.0,10237,Finance
IRHOU,Iron Horse Acquisitions II Corp. Units,10.17,0.0,747,Finance
NCA,Nuveen California Municipal Value Fund,9.32,0.0,36340,Finance
NKX,Nuveen California AMT-Free Quality Municipal Income Fund,12.42,0.0,104963,Finance
NMAI,Nuveen Multi-Asset Income Fund Common Shares of Beneficial Interest,13.91,0.0,126737,Finance
QADRW,QDRO Acquisition Corp. Warrant,0.251,0.0,350,Finance
UTF,Cohen & Steers Infrastructure Fund Inc Common Stock,26.9,0.0,224324,Finance
NBXG,Neuberger Next Generation Connectivity Fund Inc. Common Stock,15.48,0.0,118257,Finance
BUI,BlackRock Utility Infrastructure & Power Opportunities Trust,28.1,0.0,52215,Finance
BRW,Saba Capital Income & Opportunities Fund SBI,6.75,0.0,239950,Finance
BSL,Blackstone Senior Floating Rate 2027 Term Fund Common Shares of Beneficial Interest,13.05,0.0,16271,Finance
BWG,BrandywineGLOBAL Global Income Opportunities Fund Inc.,7.79,0.0,92047,Finance
NBH,Neuberger Municipal Fund Inc. Common Stock,10.25,0.0,29340,Finance
OXSQH,Oxford Square Capital Corp. 7.75% Notes due 2030,25.02,0.0,1131,Finance
KKRT,KKR & Co. Inc. 6.875% Subordinated Notes due 2065,24.62,0.0,82186,Finance
RTACU,Renatus Tactical Acquisition Corp I Unit,10.72,0.0,150,Finance
RTACW,Renatus Tactical Acquisition Corp I Warrant,0.8111,0.0,6405,Finance
HPF,John Hancock Pfd Income Fund II Pfd Income Fund II,15.8,0.0,30196,Finance
HPI,John Hancock Preferred Income Fund Common Shares of Beneficial Interest,15.92,0.0,52415,Finance
HPS,John Hancock Preferred Income Fund III Preferred Income Fund III,14.4082,0.0,48793,Finance
HVIIR,Hennessy Capital Investment Corp. VII Rights,0.4499,0.0,4020,Finance
PML,Pimco Municipal Income Fund II Common Shares of Beneficial Interest,7.38,0.0,235759,Finance
PMTR,Perimeter Acquisition Corp. I Class A Ordinary Shares,10.4,0.0,101873,Finance
KIO,KKR Income Opportunities Fund Common Shares,11.26,0.0,59264,Finance
RTAC,Renatus Tactical Acquisition Corp I Class A Ordinary Shares,10.42,0.0,67481,Finance
VACHW,Voyager Acquisition Corp Warrants,0.16,0.0,225,Finance
BIT,BlackRock Multi-Sector Income Trust Common Shares of Beneficial Interest,12.38,0.0,312695,Finance
GECCG,Great Elm Capital Corp. 7.75% Notes Due 2030,25.01,0.0,1321,Finance
GECCI,Great Elm Capital Corp. 8.50% NOTES DUE 2029,25.45,0.0,150,Finance
GECCO,Great Elm Capital Corp. 5.875% Notes due 2026,25.23,0.0,161,Finance
UTG,Reaves Utility Income Fund Common Shares of Beneficial Interest,42.07,0.0,199795,Finance
GDO,Western Asset Global Corporate Opportunity Fund Inc. Common Stock,10.67,0.0,12558,Finance
OTGAU,OTG Acquisition Corp. I Unit,10.27,0.0,8122,Finance
OTGAW,OTG Acquisition Corp. I Warrants,0.35,0.0,260640,Finance
NHIVU,NewHold Investment Corp IV Units,10.1,0.0,315,Finance
NHS,Neuberger High Yield Strategies Fund Inc. Common Stock,6.26,0.0,191359,Finance
NIM,Nuveen Select Maturities Municipal Fund Common Stock,9.2,0.0,58808,Finance
NEWTH,NewtekOne Inc. 8.625% Fixed Rate Senior Notes due 2029,25.25,0.0,2683,Finance
GDL,GDL Fund The Common Shares of Beneficial Interest,8.477,0.0,5109,Finance
BLZR,Trailblazer Acquisition Corp. Class A Ordinary Shares,10.1,0.0,1100,Finance
BOE,Blackrock Enhanced Global Dividend Trust Common Shares of Beneficial Interest,11.86,0.0,95561,Finance
USA,Liberty All-Star Equity Fund Common Stock,5.78,0.0,877997,Finance
PMTRU,Perimeter Acquisition Corp. I Unit,10.45,0.0,132,Finance
PMTRW,Perimeter Acquisition Corp. I Warrant,0.77,0.0,964,Finance
NPAC,New Providence Acquisition Corp. III Class A Ordinary Shares,10.34,0.0,11719,Finance
VACHU,Voyager Acquisition Corp Unit,14.0,0.0,1456,Finance
BGB,Blackstone Strategic Credit 2027 Term Fund Common Shares of Beneficial Interest,11.32,0.0,54810,Finance
BGH,Barings Global Short Duration High Yield Fund Common Shares of Beneficial Interests,13.93,0.0,75611,Finance
BGT,BlackRock Floating Rate Income Trust,10.83,0.0,104192,Finance
BGY,Blackrock Enhanced International Dividend Trust,5.75,0.0,250586,Finance
BLZRW,Trailblazer Acquisition Corp. Warrant,0.4498,0.0,4126,Finance
VBF,Invesco Bond Fund Common Stock,14.92,0.0,32000,Finance
LFAC,Leapfrog Acquisition Corporation Class A Ordinary Shares,9.96,0.0,200,Finance
ATIIU,Archimedes Tech SPAC Partners II Co. Unit,13.15,0.0,9173,Finance
GRF,Eagle Capital Growth Fund Inc. Common Stock,10.1207,0.0,1290,Finance
RA,Brookfield Real Assets Income Fund Inc. Common Stock,12.82,0.0,192316,Finance
RAAQ,Real Asset Acquisition Corp. Class A Ordinary Share,11.61,0.0,546676,Finance
RAAQU,Real Asset Acquisition Corp. Unit,14.73,0.0,112,Finance
KBON,Karbon Capital Partners Corp. Class A Ordinary Shares,10.09,0.0,150013,Finance
SAAQ,Space Asset Acquisition Corp. Class A Ordinary Shares,10.32,0.0,5495,Finance
SAV,Saratoga Investment Corp 7.50% Notes due 2031,25.2001,0.0,17872,Finance
SBI,Western Asset Intermediate Muni Fund Inc Common Stock,7.75,0.0,16169,Finance
SCD,LMP Capital and Income Fund Inc. Common Stock,15.24,0.0,18407,Finance
WLIIW,Willow Lane Acquisition Corp. II Warrants,0.75,0.0,1054,Finance
AMAN,Amanat Acquisition Corp Class A Ordinary Shares,10.13,0.0,49957,Finance
ALOVU,Aldabra 4 Liquidity Opportunity Vehicle Inc. Units,10.0,0.0,3,Finance
APACU,StoneBridge Acquisition II Corporation Units,10.17,0.0,2305,Finance
ONCHW,1RT Acquisition Corp. Warrant,0.48,0.0,14596,Finance
RAAQW,Real Asset Acquisition Corp. Warrants,3.19,0.0,182161,Finance
WLII,Willow Lane Acquisition Corp. II Class A Ordinary Shares,10.2,0.0,89051,Finance
QETA,Quetta Acquisition Corporation Common Stock,11.94,0.0,48,Finance
NUV,Nuveen Municipal Value Fund Inc. Common Stock,9.02,0.0,579440,Finance
NUW,Nuveen AMT-Free Municipal Value Fund,13.87,0.0,63246,Finance
ALDFU,Aldel Financial II Inc. Units,10.78,0.0,22,Finance
ALDFW,Aldel Financial II Inc. Warrants,0.3201,0.0,600,Finance
HEQ,John Hancock Diversified Income Fund Common Shares of Beneficial Interest,11.65,0.0,58763,Finance
HERZ,Herzfeld Credit Income Fund Inc. Common Stock,17.62,0.0,3024,Finance
XSLLW,Xsolla SPAC 1 Warrants,0.25,0.0,25301,Finance
XSLL,Xsolla SPAC 1 Class A Ordinary Shares,9.9,0.0,17,Finance
QETAR,Quetta Acquisition Corporation Right,0.7001,0.0,4546,Finance
QETAU,Quetta Acquisition Corporation Unit,12.55,0.0,1229,Finance
QQQX,Nuveen NASDAQ 100 Dynamic Overwrite Fund Shares of Beneficial Interest,30.49,0.0,63143,Finance
SAAQU,Space Asset Acquisition Corp. Units,10.55,0.0,160,Finance
QSEAR,Quartzsea Acquisition Corporation Rights,0.25,0.0,125,Finance
QSEAU,Quartzsea Acquisition Corporation Units,11.0,0.0,15,Finance
QADR,QDRO Acquisition Corp. Class A Ordinary Shares,9.85,0.0,208,Finance
OACCW,Oaktree Acquisition Corp. III Life Sciences Warrant,0.87,0.0,6,Finance
GUG,Guggenheim Active Allocation Fund Common Shares of Beneficial Interest,15.95,0.0,69577,Finance
QSEA,Quartzsea Acquisition Corporation Ordinary Shares,10.46,0.0,12183,Finance
SAAQW,Space Asset Acquisition Corp. Warrants,0.75,0.0,901,Finance
AFB,AllianceBernstein National Municipal Income Fund Inc,10.9,0.0,63433,Finance
ALISR,Calisa Acquisition Corp Right,0.517,0.0,1,Finance
AACIW,Armada Acquisition Corp. III Warrant,0.26,0.0,1904,Finance
ZKPW,Lafayette Digital Acquisition Corp. I Warrant,0.31,0.0,666,Finance
ZTR,Virtus Total Return Fund Inc.,6.74,0.0,84575,Finance
NZF,Nuveen Municipal Credit Income Fund ,12.3,0.0,432633,Finance
OACC,Oaktree Acquisition Corp. III Life Sciences Class A Ordinary Share,10.7,0.0,3,Finance
OIMAU,OneIM Acquisition Corp. Units,10.14,0.0,481,Finance
GOF,Guggenheim Strategic Opportunities Fund Common Shares of Beneficial Interest,11.19,0.0,880155,Finance
JRS,Nuveen Real Estate Income Fund Common Shares of Beneficial Interest,8.14,0.0,61900,Finance
JCE,Nuveen Core Equity Alpha Fund Common Shares of Beneficial Interest,16.41,0.0,13396,Finance
ATIIW,Archimedes Tech SPAC Partners II Co. Warrant,2.25,0.0,190285,Finance
ASG,Liberty All-Star Growth Fund Inc.,5.22,0.0,127137,Finance
ASGI,abrdn Global Infrastructure Income Fund Common Shares of Beneficial Interest,24.04,0.0,84417,Finance
ARTC,Art Technology Acquisition Corp. Class A Ordinary Shares,9.89,0.0,178,Finance
NPCT,Nuveen Core Plus Impact Fund Common Shares of Beneficial Interest,9.94,0.0,112128,Finance
NPFD,Nuveen Variable Rate Preferred & Income Fund Common Shares,18.74,0.0,51380,Finance
NPV,Nuveen Virginia Quality Municipal Income Fund Common Stock,11.21,0.0,56848,Finance
OPP,RiverNorth/DoubleLine Strategic Opportunity Fund Inc. Common Stock,7.64,0.0,95566,Finance
VVR,Invesco Senior Income Trust Common Stock (DE),2.99,0.0,758654,Finance
ARCLU,ARC Group Acquisition I Corp Unit,10.06,0.0,240,Finance
WDI,Western Asset Diversified Income Fund Common Shares of Beneficial Interest,13.46,0.0,200334,Finance
WEA,Western Asset Bond Fund Share of Beneficial Interest,10.446,0.0,53438,Finance
APURU,Aperture AC Unit,10.0,0.0,3237816,Finance
APXTW,Apex Treasury Corporation Warrants,0.23,0.0,203541,Finance
NNY,Nuveen New York Municipal Value Fund Common Stock,8.38,0.0,41529,Finance
JFR,Nuveen Floating Rate Income Fund Common Stock,7.55,0.0,897762,Finance
JGH,Nuveen Global High Income Fund Common Shares of Beneficial Interest,12.56,0.0,48675,Finance
RCG,RENN Fund Inc Common Stock,2.71,0.0,6724,Finance
BTT,BlackRock Municipal 2030 Target Term Trust,22.63,0.0,25826,Finance
AWF,Alliancebernstein Global High Income Fund,10.24,0.0,925949,Finance
AWP,abrdn Global Premier Properties Fund Common Shares of Beneficial Interest,11.7,0.0,116352,Finance
JRI,Nuveen Real Asset Income and Growth Fund Common Shares of Beneficial Interest,12.82,0.0,72041,Finance
RDAGW,Republic Digital Acquisition Company Warrants,0.44,0.0,105,Finance
GF,New Germany Fund Inc. (The) Common Stock,11.84,0.0,33657,Finance
GGN,GAMCO Global Gold Natural Resources & Income Trust,5.2,0.0,292075,Finance
GIXXR,GigCapital9 Corp. Rights,0.32,0.0,100606,Finance
AVK,Advent Convertible and Income Fund,12.64,0.0,168876,Finance
ARCIU,Archimedes Tech SPAC Partners III Co. Units,10.05,0.0,8425,Finance
NRK,Nuveen New York AMT-Free Quality Municipal Income Fund ,10.28,0.0,391795,Finance
NRO,Neuberger Real Estate Securities Income Fund Inc. Common Stock,2.97,0.0,132000,Finance
NRUC,National Rural Utilities Cooperative Finance Corporation 5.500% Subordinated Notes due 2064 (Subordinated Deferrable Interest Notes),23.76,0.0,10738,Finance
NVG,Nuveen AMT-Free Municipal Credit Income Fund ,12.25,0.0,463205,Finance
WIA,Western Asset Inflation-Linked Income Fund,8.06,0.0,14184,Finance
WIW,Western Asset Inflation-Linked Opportunities & Income Fund,8.42,0.0,204815,Finance
JBK,Lehman ABS 3.50 3.50% Adjustable Corp Backed Tr Certs GS Cap I,26.22,0.0,7966,Finance
HACQ,HCM IV Acquisition Corp. Class A Ordinary Share,9.99,0.0,1538,Finance
HACQW,HCM IV Acquisition Corp. Warrants,0.57,0.0,20,Finance
GLQ,Clough Global Equity Fund Clough Global Equity Fund Common Shares of Beneficial Interest,8.41,0.0,159965,Finance
SDHIU,Siddhi Acquisition Corp Unit,10.6,0.0,104,Finance
RANG,Range Capital Acquisition Corp. Ordinary Shares,10.62,0.0,491,Finance
RANGR,Range Capital Acquisition Corp. Rights,0.29,0.0,4417,Finance
RANGU,Range Capital Acquisition Corp. Units,11.86,0.0,211,Finance
JLS,Nuveen Mortgage and Income Fund,18.413,0.0,9549,Finance
JMM,Nuveen Multi-Market Income Fund (MA),5.7163,0.0,15518,Finance
JOF,Japan Smaller Capitalization Fund Inc Common Stock,11.54,0.0,14209,Finance
JPC,Nuveen Preferred & Income Opportunities Fund,7.77,0.0,1190551,Finance
JQC,Nuveen Credit Strategies Income Fund Shares of Beneficial Interest,4.81,0.0,556269,Finance
HIX,Western Asset High Income Fund II Inc. Common Stock,3.96,0.0,417539,Finance
HFRO,Highland Opportunities and Income Fund Common Shares of Beneficial Interest,6.27,0.0,154559,Finance
HIO,Western Asset High Income Opportunity Fund Inc. Common Stock,3.62,0.0,539289,Finance
LPBBU,Launch Two Acquisition Corp. Unit,10.64,0.0,1,Finance
AOD,abrdn Total Dynamic Dividend Fund Common Shares of Beneficial Interest,10.42,0.0,476287,Finance
AOMD,Angel Oak Mortgage REIT Inc. 9.750% Senior Notes due 2030,25.0,0.0,2428,Finance
AOMN,Angel Oak Mortgage REIT Inc. 9.500% Senior Notes due 2029,25.07,0.0,3256,Finance
RWAYI,Runway Growth Finance Corp. 7.25% Notes due 2031,24.53,0.0,8976,Finance
SVAQW,Silicon Valley Acquisition Corp. Warrants,0.3099,0.0,10020,Finance
PFD,Flaherty & Crumrine Preferred and Income Fund Incorporated,11.43,0.0,31524,Finance
TACHU,Titan Acquisition Corp. Units,10.45,0.0,102,Finance
TACOU,Berto Acquisition Corp. Unit,10.75,0.0,770,Finance
PAACU,Proem Acquisition Corp I Units,10.06,0.0,57,Finance
TAVI,Tavia Acquisition Corp. Ordinary Shares,10.62,0.0,181632,Finance
TAVIR,Tavia Acquisition Corp. Right,0.15,0.0,11200,Finance
DMO,Western Asset Mortgage Opportunity Fund Inc. Common Stock,11.12,0.0,13322,Finance
DNMX,Dynamix Corporation III Class A Ordinary Shares,10.01,0.0,4204,Finance
DNMXU,Dynamix Corporation III Unit,10.14,0.0,1340,Finance
DNMXW,Dynamix Corporation III Warrants,0.3325,0.0,8075,Finance
SWZ,Total Return Securities Fund Common Stock,5.96,0.0,42824,Finance
SZZL,Sizzle Acquisition Corp. II Class A ordinary shares,10.32,0.0,12336,Finance
DHF,BNY Mellon High Yield Strategies Fund Common Stock,2.41,0.0,208793,Finance
PTOR,Praetorian Acquisition Corp. Class A Ordinary Shares,9.91,0.0,280640,Finance
TACOW,Berto Acquisition Corp. Warrant,0.67,0.0,3,Finance
EOD,Allspring Global Dividend Opportunity Fund Common Shares of Beneficial Interest,6.49,0.0,45044,Finance
EOI,Eaton Vance Enhance Equity Income Fund Eaton Vance Enhanced Equity Income Fund Shares of Beneficial Interest,19.71,0.0,73409,Finance
EMF,Templeton Emerging Markets Fund Common Stock,21.86,0.0,57741,Finance
ETJ,Eaton Vance Risk-Managed Diversified Equity Income Fund Common Shares of Beneficial Interest,8.42,0.0,109776,Finance
SVIV,Spring Valley Acquisition Corp. IV Class A Ordinary Shares,10.05,0.0,717084,Finance
SVIVU,Spring Valley Acquisition Corp. IV Units,10.25,0.0,21,Finance
DNP,DNP Select Income Fund Inc. Common Stock,10.82,0.0,688136,Finance
DPG,Duff & Phelps Utility and Infrastructure Fund Inc.,14.53,0.0,48813,Finance
SVAQ,Silicon Valley Acquisition Corp. Class A Ordinary Shares,9.95,0.0,1,Finance
DMAAR,Drugs Made In America Acquisition Corp. Rights,0.1167,0.0,31466,Finance
DMAAU,Drugs Made In America Acquisition Corp. Units,10.9,0.0,3882,Finance
PTORW,Praetorian Acquisition Corp. Warrant,0.3377,0.0,81737,Finance
PTY,Pimco Corporate & Income Opportunity Fund,11.81,0.0,719953,Finance
PYT,PPlus Tr GSC-2 Tr Ctf Fltg Rate,23.41,0.0,2,Finance
KTH,Structures Products Cp 8% CorTS Issued by Peco Energy Cap Tr II Preferred Stock,28.25,0.0,1509,Finance
KTN,Structured Products Corp 8.205% CorTS 8.205% Corporate Backed Trust Securities (CorTS),26.125,0.0,1806,Finance
DHY,Credit Suisse High Yield Credit Fund Common Stock,1.78,0.0,515153,Finance
DSM,BNY Mellon Strategic Municipal Bond Fund Inc. Common Stock,6.0,0.0,51358,Finance
DSU,Blackrock Debt Strategies Fund Inc. Common Stock,9.79,0.0,207121,Finance
MMU,Western Asset Managed Municipals Fund Inc. Common Stock,10.08,0.0,111651,Finance
ETY,Eaton Vance Tax-Managed Diversified Equity Income Fund Common Shares of Beneficial Interest,14.82,0.0,178838,Finance
SPE,Special Opportunities Fund Inc Common Stock,13.96,0.0,11866,Finance
EVG,Eaton Vance Short Diversified Income Fund Eaton Vance Short Duration Diversified Income Fund Common Shares of Beneficial Interest,10.71,0.0,31130,Finance
ETG,Eaton Vance Tax-Advantaged Global Dividend Income Fund Common Shares of Beneficial Interest,22.7,0.0,110142,Finance
IBAC,IB Acquisition Corp. Common Stock,10.79,0.0,3151,Finance
IBACR,IB Acquisition Corp. Right,0.115,0.0,111,Finance
IEAG,Infinite Eagle Acquisition Corp. Class A Ordinary Shares,10.05,0.0,2,Finance
IFN,Aberdeen India Fund Inc. Common Stock,11.41,0.0,239064,Finance
IGA,Voya Global Advantage and Premium Opportunity Fund Common Shares of Beneficial Interest,9.81,0.0,42339,Finance
IGACU,Invest Green Acquisition Corporation Units,10.22,0.0,85,Finance
IGD,Voya Global Equity Dividend and Premium Opportunity Fund,6.245,0.0,507860,Finance
TDF,Templeton Dragon Fund Inc. Common Stock,11.04,0.0,34581,Finance
EVOX,Evolution Global Acquisition Corp Class A Ordinary Shares,10.0,0.0,55166,Finance
EVV,Eaton Vance Limited Duration Income Fund Common Shares of Beneficial Interest,9.24,0.0,379694,Finance
EXG,Eaton Vance Tax-Managed Global Diversified Equity Income Fund Common Shares of Beneficial Interest,9.39,0.0,376817,Finance
PEO,Adams Natural Resources Fund Inc. Common Stock,26.38,0.0,49811,Finance
PCAP,ProCap Acquisition Corp Class A Ordinary Shares,10.25,0.0,8,Finance
PCAPW,ProCap Acquisition Corp Warrant,0.32,0.0,2985,Finance
DBCA,D. Boral Acquisition I Corp. Class A Ordinary Shares,9.93,0.0,189192,Finance
MMD,NYLI MacKay DefinedTerm Muni Opportunities Fund Common Shares,15.0,0.0,48071,Finance
SZZLR,Sizzle Acquisition Corp. II Right,0.176,0.0,600,Finance
DAAQ,Digital Asset Acquisition Corp. Class A Ordinary shares,10.31,0.0,18897,Finance
DAAQU,Digital Asset Acquisition Corp. Units,10.53,0.0,413,Finance
DAAQW,Digital Asset Acquisition Corp. Warrant,0.49,0.0,200,Finance
TAVIU,Tavia Acquisition Corp. Unit,11.35,0.0,9760,Finance
PDT,John Hancock Premium Dividend Fund,12.9,0.0,131053,Finance
DBCAW,D. Boral Acquisition I Corp. Warrants,0.405,0.0,278640,Finance
MEVOU,M Evo Global Acquisition Corp II Units,10.04,0.0,1700,Finance
MKLYU,McKinley Acquisition Corporation Units,10.2,0.0,101,Finance
SSEA,Starry Sea Acquisition Corp	Ordinary Shares,10.21,0.0,1302,Finance
EHI,Western Asset Global High Income Fund Inc Common Stock,5.92,0.0,110442,Finance
EIM,Eaton Vance Municipal Bond Fund Common Shares of Beneficial Interest $.01 par value,9.68,0.0,149102,Finance
EEA,The European Equity Fund Inc. Common Stock,10.71,0.0,24865,Finance
RREV,RRE Ventures Acquisition Corp. Class A Ordinary Shares,9.88,0.0,5835,Finance
HSPT,Horizon Space Acquisition II Corp. Ordinary share,7.52,0.0,23059,Finance
RREVU,RRE Ventures Acquisition Corp. Units,10.01,0.0,5029,Finance
SPXX,Nuveen S&P 500 Dynamic Overwrite Fund,17.92,0.0,138317,Finance
HYT,Blackrock Corporate High Yield Fund Inc. Common Stock,8.5,0.0,675590,Finance
IACO,Idea Acquisition Corp. Class A Ordinary Shares,9.91,0.0,21378,Finance
IDE,Voya Infrastructure Industrials and Materials Fund Common Shares of Beneficial Interest,13.91,0.0,21619,Finance
EMO,ClearBridge Energy Midstream Opportunity Fund Inc. Common Stock,51.91,0.0,39765,Finance
AACPU,Apogee Acquisition Corp Units,10.1,0.0,98,Finance
SRV,NXG Cushing Midstream Energy Fund Common Shares of Beneficial Interest,48.84,0.0,40170,Finance
ERC,Allspring Multi-Sector Income Fund Common Stock,8.94,0.0,92680,Finance
RNGT,Range Capital Acquisition Corp II Class A Ordinary Shares,10.07,0.0,100,Finance
XCBEW,X3 Acquisition Corp. Ltd. Warrant,0.26,0.0,500,Finance
AACI,Armada Acquisition Corp. III Class A Ordinary Share,9.95,0.0,63,Finance
AACIU,Armada Acquisition Corp. III Units,10.08,0.0,35,Finance
ACAAU,Averin Capital Acquisition Corp. Units,10.0,0.0,8,Finance
ACAA,Averin Capital Acquisition Corp. Class A Ordinary Shares,9.95,0.0,6679,Finance
ACGCU,ACP Holdings Acquisition Corp. Units,9.99,0.0,36160,Finance
ZKPU,Lafayette Digital Acquisition Corp. I Unit,9.95,0.0,84,Finance
ADX,Adams Diversified Equity Fund Inc.,24.86,0.0,172351,Finance
XRPN,Armada Acquisition Corp. II Class A Ordinary Shares,10.38,0.0,38226,Finance
XRPNW,Armada Acquisition Corp. II Warrant,0.915,0.0,35653,Finance
AGD,abrdn Global Dynamic Dividend Fund Common Shares of Beneficial Interest,12.53,0.0,63139,Finance
XCBEU,X3 Acquisition Corp. Ltd. Unit,10.044,0.0,209,Finance
ACP,abrdn Income Credit Strategies Fund Common Shares,5.27,0.0,271526,Finance
EMD,Western Asset Emerging Markets Debt Fund Inc Common Stock,10.31,0.0,177096,Finance
SSAC,SPACSphere Acquisition Corp. Class A Ordinary Shares,9.95,0.0,2094,Finance
DMII,Drugs Made In America Acquisition II Corp. Ordinary Shares,10.05,0.0,17098,Finance
SVAC,Spring Valley Acquisition Corp. III Class A Ordinary Shares,10.53,0.0,54164,Finance
SVACU,Spring Valley Acquisition Corp. III Unit,11.12,0.0,6622,Finance
SVACW,Spring Valley Acquisition Corp. III Warrant,1.77,0.0,12745,Finance
DYOR,Insight Digital Partners II Class A Ordinary Shares,10.04,0.0,1361,Finance
MLAA,Mountain Lake Acquisition Corp. II Class A Ordinary Shares,10.14,0.0,514620,Finance
MLAAU,Mountain Lake Acquisition Corp. II Units,10.3501,0.0,9395,Finance
MLAAW,Mountain Lake Acquisition Corp. II Warrants,0.65,0.0,345115,Finance
PFL,PIMCO Income Strategy Fund Shares of Beneficial Interest,7.695,0.0,181516,Finance
PGP,Pimco Global StocksPlus & Income Fund Common Shares of Beneficial Interest,8.63,0.0,30509,Finance
PHK,Pimco High Income Fund,4.52,0.0,327533,Finance
MEGI,NYLI CBRE Global Infrastructure Megatrends Term Fund Common Shares,15.32,0.0,104018,Finance
SSACW,SPACSphere Acquisition Corp. Warrant,0.0699,0.0,133586,Finance
PFN,PIMCO Income Strategy Fund II,6.83,0.0,204440,Finance
PFO,Flaherty & Crumrine Preferred and Income Opportunity Fund Incorporated,9.01,0.0,40352,Finance
MHF,Western Asset Municipal High Income Fund Inc. Common Stock,6.89,0.0,55437,Finance
MEVO,M Evo Global Acquisition Corp II Class A Ordinary Shares,9.91,0.0,1001,Finance
EDF,Virtus Stone Harbor Emerging Markets Income Fund Common Shares of Beneficial Interest,5.27,0.0,175205,Finance
MLCIL,Mount Logan Capital Inc. 8.00% Notes Due 2031,22.95,0.0,2709,Finance
MPA,Blackrock MuniYield Pennsylvania Quality Fund Common Stock,11.12,0.0,35102,Finance
EAD,Allspring Income Opportunities Fund Common Shares,6.53,0.0,105572,Finance
EFR,Eaton Vance Senior Floating-Rate Fund Common Shares of Beneficial Interest,10.5,0.0,119709,Finance
STEW,SRH Total Return Fund Inc. Common Stock,17.58,0.0,72772,Finance
STK,Columbia Seligman Premium Technology Growth Fund Inc,52.33,0.0,88016,Finance
ECF,Ellsworth Growth and Income Fund Ltd.,12.89,0.0,51923,Finance
EDD,Morgan Stanley Emerging Markets Domestic Debt Fund Inc. Common Stock,5.43,0.0,271621,Finance
MLACU,Mountain Lake Acquisition Corp. Units,10.69,0.0,4,Finance
MYX,Maywood Acquisition Corp. 2 Class A Ordinary Share,9.89,0.0,51503,Finance
MYXXR,Maywood Acquisition Corp. 2 Rights,0.1601,0.0,14134,Finance
MYXXU,Maywood Acquisition Corp. 2 Units,10.09,0.0,22,Finance
MYXXW,Maywood Acquisition Corp. 2 Warrants,0.05,0.0,7000,Finance
NAC,Nuveen California Quality Municipal Income Fund,11.73,0.0,566829,Finance
NAD,Nuveen Quality Municipal Income Fund Common Stock,11.52,0.0,671371,Finance
NAZ,Nuveen Arizona Quality Municipal Income Fund Common Stock,12.75,0.0,8212,Finance
NBB,Nuveen Taxable Municipal Income Fund Common Shares of Beneficial Interest,15.6,0.0,39298,Finance
TDWD,Tailwind 2.0 Acquisition Corp. Class A Ordinary Shares,10.0,0.0,11,Finance
CEPF,Cantor Equity Partners IV Inc. Class A Ordinary Shares,10.3,0.0,1126,Finance
ILLUU,Illumination Acquisition Corp I Units,9.995,0.0,2,Finance
FAX,abrdn Asia-Pacific Income Fund Inc. Common Stock,14.73,0.0,184970,Finance
FGII,FG Imperii Acquisition Corp. Class A Ordinary Shares,9.92,0.0,35967,Finance
CCD,Calamos Dynamic Convertible & Income Fund Common Stock,24.33,0.0,83774,Finance
TSI,TCW Strategic Income Fund Inc. Common Stock,4.51,0.0,70855,Finance
CICC,CION Investment Corporation 7.50% Notes due 2031,24.93,0.0,10045,Finance
CHI,Calamos Convertible Opportunities and Income Fund Common Stock,12.27,0.0,299231,Finance
CGCT,Cartesian Growth Corporation III Class A Ordinary Shares,10.38,0.0,66874,Finance
CGCTU,Cartesian Growth Corporation III Unit,10.9,0.0,464,Finance
FGIIU,FG Imperii Acquisition Corp. Units,10.03,0.0,2770,Finance
FGIIW,FG Imperii Acquisition Corp. Warrants,0.18,0.0,30910,Finance
IPCXR,Inflection Point Acquisition Corp. III Rights,0.36,0.0,13829,Finance
FGSN,F&G Annuities & Life Inc. 7.300% Junior Subordinated Notes due 2065,21.9,0.0,14620,Finance
FFA,First Trust Enhanced Equity Income Fund Common Shares of Beneficial Interest,22.76,0.0,50119,Finance
FFC,Flaherty & Crumrine Preferred and Income Securities Fund Incorporated,15.79,0.0,119615,Finance
FMAC,Future Money Acquisition Corporation Ordinary Shares,9.96,0.0,16019,Finance
FMACR,Future Money Acquisition Corporation Rights,0.18,0.0,25797,Finance
FMACU,Future Money Acquisition Corporation Units,10.13,0.0,92860,Finance
FLC,Flaherty & Crumrine Total Return Fund Inc Common Stock,16.73,0.0,27603,Finance
RIV,RiverNorth Opportunities Fund Inc. Common Stock,11.51,0.0,54361,Finance
IPCX,Inflection Point Acquisition Corp. III Class A Ordinary Shares,10.32,0.0,23050,Finance
TWLVR,Twelve Seas Investment Company III Rights,0.1305,0.0,35400,Finance
FPF,First Trust Intermediate Duration Preferred & Income Fund Common Shares of Beneficial Interest,17.92,0.0,76762,Finance
MBAVW,M3-Brigade Acquisition V Corp. Warrant,0.34,0.0,29773,Finance
