symbol,name,price,marketCap,volume,industry
BMRC,Bank of Marin Bancorp Common Stock,27.53,443086706.0,140530,Finance
PRAA,PRA Group Inc. Common Stock,11.35,442825267.0,531430,Finance
WTBA,West Bancorporation Common Stock,26.08,441815673.0,57863,Finance
EVN,Eaton Vance Municipal Income Trust Common Stock,11.06,438718823.0,50660,Finance
FRBA,First Bank Common Stock,17.29,434573828.0,52456,Finance
HQL,abrdn Life Sciences Investors Shares of Beneficial Interest,16.92,434499441.0,109278,Finance
BSVN,Bank7 Corp. Common stock,44.98,425213482.0,13486,Finance
TCPC,BlackRock TCP Capital Corp. Common Stock,4.92,417417902.0,1012478,Finance
MCI,Barings Corporate Investors Common Stock,20.57,416783560.0,13345,Finance
CZNC,Citizens & Northern Corp Common Stock,23.17,412469397.0,50637,Finance
CMTG,Claros Mortgage Trust Inc. Common Stock,2.93,410840979.0,470547,Finance
GCBC,Greene County Bancorp Inc. Common Stock,24.05,409495213.0,8203,Finance
ISTR,Investar Holding Corporation Common Stock,29.7,408843339.0,111262,Finance
PDLB,Ponce Financial Group Inc. Common Stock,17.03,408739159.0,92905,Finance
VKI,Invesco Advantage Municipal Income Trust II Common Shares of Beneficial Interest (DE),9.19,408091324.0,220421,Finance
GBLI,Global Indemnity Group LLC Class A Common Stock ,28.29,405224659.0,8914,Finance
LEO,BNY Mellon Strategic Municipals Inc. Common Stock,6.5,404890551.0,182750,Finance
SAZ,Saratoga Investment Corp 8.50% Notes due 2028,25.69,402514285.0,12481,Finance
SAJ,Saratoga Investment Corp 8.00% Notes due 2027,25.64,401730879.0,11876,Finance
SOR,Source Capital Inc. Cmn Shs of BI,48.05,400952408.0,5516,Finance
HPP,Hudson Pacific Properties Inc. Common Stock,7.39,400666638.0,1771710,Finance
SAY,Saratoga Investment Corp 8.125% Notes due 2027,25.56,400477428.0,17991,Finance
BOC,Boston Omaha Corporation Class A Common Stock,12.62,396942337.0,102090,Finance
BRBS,Blue Ridge Bankshares Inc. Common Stock,4.32,395231016.0,140754,Finance
ISBA,Isabella Bank Corporation Common stock,53.73,394114708.0,44092,Finance
BWFG,Bankwell Financial Group Inc. Common Stock,49.87,392848082.0,27777,Finance
SAT,Saratoga Investment Corp 6.00% Notes due 2027,24.99,391546594.0,2477,Finance
NEWT,NewtekOne Inc. Common Stock,13.49,389689610.0,159858,Finance
ATLCZ,Atlanticus Holdings Corporation 9.25% Senior Notes due 2029,25.57,386757731.0,8355,Finance
FMAO,Farmers & Merchants Bancorp Inc. Common Stock,27.53,378535958.0,19616,Finance
ATLCL,Atlanticus Holdings Corporation 6.125% Senior Notes due 2026,24.98,377833716.0,25660,Finance
SAR,Saratoga Investment Corp New,23.27,376603030.0,119330,Finance
RBB,RBB Bancorp Common Stock,22.06,376054548.0,79201,Finance
OPENL,Opendoor Technologies Inc  Series A Warrants each whole warrant exercisable to purchase one share of Common Stock at an exercise price of $13.00 per warrant,0.3901,372072745.0,634158,Finance
ATLCP,Atlanticus Holdings Corporation 7.625% Series B Cumulative Perpetual Preferred Stock no par value per share,24.56,371875977.0,6717,Finance
TACO,Berto Acquisition Corp. Ordinary Shares,10.17,370617499.0,46660,Finance
PLBC,Plumas Bancorp,52.65,366207812.0,29765,Finance
MVBF,MVB Financial Corp. Common Stock,28.72,365375668.0,54030,Finance
PBFS,Pioneer Bancorp Inc. Common Stock,14.56,365172764.0,6341,Finance
KTF,DWS Municipal Income Trust,9.22,364198648.0,136183,Finance
PPT,Putnam Premier Income Trust Common Stock,3.65,363278160.0,180205,Finance
CBAN,Colony Bankcorp Inc. Common Stock,20.75,361768614.0,195767,Finance
PMO,Putnam Municipal Opportunities Trust Common Stock,10.64,361563873.0,149083,Finance
AII,American Integrity Insurance Group Inc. Common Stock,18.18,355906297.0,100829,Finance
USCB,USCB Financial Holdings Inc. Class A Common Stock,19.55,354058027.0,46798,Finance
VALU,Value Line Inc. Common Stock,37.3,350242263.0,1354,Finance
LNKB,LINKBANCORP Inc. Common Stock,9.35,350210309.0,153749,Finance
PNNT,PennantPark Investment Corporation Common Stock,5.36,349987064.0,1763228,Finance
FRST,Primis Financial Corp. Common Stock,14.1,347485829.0,238516,Finance
OPENZ,Opendoor Technologies Inc  Series Z Warrants each whole warrant exercisable to purchase one share of Common Stock at an exercise price of $17.00 per warrant,0.363,346225087.0,579525,Finance
GBAB,Guggenheim Taxable Municipal Bond & Investment Grade Debt Trust Common Shares of Beneficial Interest,15.335,343456538.0,80029,Finance
NECB,NorthEast Community Bancorp Inc. Common Stock,24.43,342685473.0,42903,Finance
SCM,Stellus Capital Investment Corporation Common Stock,11.68,338103927.0,140110,Finance
RM,Regional Management Corp. Common Stock,34.74,337422846.0,88285,Finance
ONIT,Onity Group Inc. Common Stock,41.6,335249158.0,35791,Finance
AVBH,Avidbank Holdings Inc. Common stock,30.5,333999461.0,74004,Finance
MLP,Maui Land & Pineapple Company Inc. Common Stock,16.91,333832299.0,9720,Finance
PCB,PCB Bancorp Common Stock,23.38,333416429.0,27844,Finance
PKBK,Parke Bancorp Inc. Common Stock,28.66,332328549.0,126599,Finance
BCML,BayCom Corp Common Stock,30.44,331727906.0,26420,Finance
WSBF,Waterstone Financial Inc. Common Stock (MD),17.89,330194263.0,38131,Finance
EFT,Eaton Vance Floating Rate Income Trust Common Shares of Beneficial Interest,11.35,330176210.0,66554,Finance
RILYL,BRC Group Holdings Inc. Depositary Shares each representing 1/1000th in a share of 7.375% Series B Cumulative Perpetual Preferred Stock par value $0.0001,10.7,327388606.0,9622,Finance
FNLC,First Bancorp Inc  (ME) Common Stock,29.14,326930985.0,22099,Finance
CBK,Commercial Bancgroup Inc. Common Stock,26.5,324350566.0,55413,Finance
RWAY,Runway Growth Finance Corp. Common Stock,8.89,321231589.0,422488,Finance
EXOD,Exodus Movement Inc. Class A Common Stock,10.86,318464993.0,75319,Finance
OFSSH,OFS Capital Corporation 4.95% Notes due 2028,23.75,318204353.0,2,Finance
FSBW,FS Bancorp Inc. Common Stock,41.57,312542465.0,12239,Finance
RILYP,BRC Group Holdings Inc. Depositary Shares each representing a 1/1000th fractional interest in a share of Series A Cumulative Perpetual Preferred Stock,10.2,312090073.0,6157,Finance
GREEL,Greenidge Generation Holdings Inc. 8.50% Senior Notes due 2026,19.89,311744264.0,856,Finance
CZFS,Citizens Financial Services Inc. Common Stock,64.75,311212911.0,8629,Finance
MBI,MBIA Inc. Common Stock,6.16,311040736.0,502161,Finance
PMM,Putnam Managed Municipal Income Trust Common Stock,6.36,309978825.0,79082,Finance
ARDC,Ares Dynamic Credit Allocation Fund Inc. Common Shares,13.41,307289332.0,88361,Finance
TSBK,Timberland Bancorp Inc. Common Stock,38.95,307094498.0,16737,Finance
COSO,CoastalSouth Bancshares Inc. Common Stock,25.34,303545858.0,53704,Finance
FCNCN,First Citizens BancShares Inc. Depositary Shares each representing a 1/40th interest in a share of 6.625% Non-Cumulative Perpetual Preferred Stock Series E,24.99,303357583.0,386459,Finance
OIA,Invesco Municipal Income Opportunities Trust Common Stock,6.33,301343378.0,159374,Finance
HRZN,Horizon Technology Finance Corporation Common Stock,6.54,300613919.0,729871,Finance
BLFY,Blue Foundry Bancorp Common Stock,14.47,300414926.0,221477,Finance
CHMG,Chemung Financial Corp Common Stock,62.56,299934473.0,16605,Finance
MIN,MFS Intermediate Income Trust Common Stock,2.6,298734205.0,221295,Finance
CIA,Citizens Inc. Class A Common Stock ($1.00 Par),5.91,297254372.0,73829,Finance
JMSB,John Marshall Bancorp Inc. Common Stock,20.9,296268786.0,24556,Finance
CPZ,Calamos Long/Short Equity & Dynamic Income Trust Common Stock,15.016,294797025.0,45937,Finance
FUND,Sprott Focus Trust Inc. Common Stock,9.84,291594201.0,61899,Finance
OCCIO,OFS Credit Company Inc. 6.125% Series C Term Preferred Stock,25.07,291225906.0,4077,Finance
ACV,Virtus Diversified Income & Convertible Fund Common Shares of Beneficial Interest,27.9,289126417.0,35505,Finance
NWFL,Norwood Financial Corp. Common Stock,31.0,287190200.0,32756,Finance
OCCIN,OFS Credit Company Inc. 5.25% Series E Term Preferred Stock Due 2026,24.685,286753549.0,887,Finance
WNEB,Western New England Bancorp Inc. Common Stock,13.98,286477685.0,34757,Finance
FVCB,FVCBankcorp Inc. Common Stock,15.79,285401313.0,35784,Finance
MMT,MFS Multimarket Income Trust Common Stock,4.75,282854449.0,54615,Finance
MBCN,Middlefield Banc Corp. Common Stock,34.63,280048862.0,27019,Finance
ECC,Eagle Point Credit Company Inc. Common Stock,4.61,279654236.0,6373464,Finance
OVLY,Oak Valley Bancorp (CA) Common Stock,33.19,278405055.0,16575,Finance
MCR,MFS Charter Income Trust Common Stock,6.3,277252794.0,33332,Finance
FGBIP,First Guaranty Bancshares Inc. 6.75% Series A Fixed-Rate Non-Cumulative Perpetual Preferred Stock,18.0,276353046.0,4170,Finance
NODK,NI Holdings Inc. Common Stock,13.33,274674608.0,9717,Finance
FBLA,FB Bancorp Inc. Common Stock,13.77,273162375.0,98516,Finance
EOT,Eaton Vance Municipal Income Trust EATON VANCE NATIONAL MUNICIPAL OPPORTUNITIES TRUST,17.4575,272772058.0,25353,Finance
BKKT,Bakkt Inc. Class A Common Stock,10.62,271121793.0,769555,Finance
FDBC,Fidelity D & D Bancorp Inc. Common Stock,46.68,269216910.0,5897,Finance
FCNCO,First Citizens BancShares Inc. 5.625% Non-Cumulative Perpetual Preferred Stock Series C,22.01,267182890.0,10495,Finance
OSG,Octave Specialty Group Inc. Common Stock,6.08,266377173.0,355269,Finance
VPV,Invesco Pennsylvania Value Municipal Income Trust Common Stock (DE),10.85,258550552.0,35890,Finance
FCNCP,First Citizens BancShares Inc. Depositary Shares,21.04,255407905.0,12426,Finance
MYFW,First Western Financial Inc. Common Stock,26.0,252582486.0,12557,Finance
FXNC,First National Corporation Common Stock,27.95,251852335.0,44823,Finance
FTF,Franklin Limited Duration Income Trust Common Shares of Beneficial Interest,6.225,251523453.0,102964,Finance
FUNC,First United Corporation Common Stock,38.62,250910587.0,11413,Finance
CFFI,C&F Financial Corporation Common Stock,77.26,250185804.0,4516,Finance
LCNB,LCNB Corporation Common Stock,17.49,248124421.0,28498,Finance
DOUG,Douglas Elliman Inc. Common Stock,2.78,246916737.0,393414,Finance
ATLO,Ames National Corporation Common Stock,27.52,244712436.0,31142,Finance
BPRN,Princeton Bancorp Inc. Common Stock (PA),36.01,243530553.0,18151,Finance
SSSS,SuRo Capital Corp. Common Stock,9.69,243403992.0,161697,Finance
NKSH,National Bankshares Inc. Common Stock,38.22,243308558.0,11557,Finance
OPRT,Oportun Financial Corporation Common Stock,5.51,243150900.0,685903,Finance
HWBK,Hawthorn Bancshares Inc. Common Stock,35.04,241693516.0,3797,Finance
MFIN,Medallion Financial Corp. Common Stock,10.36,241174947.0,68524,Finance
FINW,FinWise Bancorp Common Stock,17.665,240012959.0,14908,Finance
SNFCA,Security National Financial Corporation Class A Common Stock,9.0,233870121.0,20615,Finance
MRBK,Meridian Corporation Common Stock,20.3,233804357.0,85099,Finance
LIEN,Chicago Atlantic BDC Inc. Common Stock,10.23,233454636.0,66136,Finance
VTN,Invesco Trust for Investment Grade New York Municipals Common Stock,11.93,232467729.0,26876,Finance
FCCO,First Community Corporation Common Stock,30.21,232305656.0,54138,Finance
PRHIZ,Presurance Holdings Inc. 9.75% Senior Unsecured Notes due 2028,18.9899,232111288.0,25,Finance
KINS,Kingstone Companies Inc. Common Stock,16.24,229754231.0,82283,Finance
RILY,BRC Group Holdings Inc. Common Stock,7.45,227948142.0,592969,Finance
MFM,MFS Municipal Income Trust Common Stock,5.53,227767599.0,69953,Finance
VABK,Virginia National Bankshares Corporation Common Stock,42.11,227105083.0,2853,Finance
AOMR,Angel Oak Mortgage REIT Inc. Common Stock,8.95,222980613.0,62410,Finance
FRAF,Franklin Financial Services Corporation Common Stock,49.62,222249816.0,31486,Finance
EICA,Eagle Point Income Company Inc. 5.00% Series A Term Preferred Stock due 2026,24.85,221366484.0,10717,Finance
INV,Innventure Inc. Common Stock,3.24,219498164.0,1241747,Finance
INBKZ,First Internet Bancorp 6.0% Fixed-to-Floating Rate Subordinated Notes Due 2029,24.85,216520386.0,3670,Finance
PEBK,Peoples Bancorp of North Carolina Inc. Common Stock,38.86,212153877.0,25946,Finance
ALTS,ALT5 Sigma Corporation Common Stock,1.66,209722946.0,2352083,Finance
EFSI,Eagle Financial Services Inc Common Stock,38.9,209139859.0,10407,Finance
OPBK,OP Bancorp Common Stock,14.01,208547452.0,23717,Finance
SWKH,SWK Holdings Corporation Common Stock,17.2,208049583.0,4941,Finance
CFBK,CF Bankshares Inc. Common Stock,32.48,206802596.0,75647,Finance
FT,Franklin Universal Trust Common Stock,8.19,205830212.0,73246,Finance
BRR,ProCap Financial Inc. Common Stock,2.39,203548184.0,1026575,Finance
OVBC,Ohio Valley Banc Corp. Common Stock,42.9,202101943.0,24009,Finance
MPV,Barings Participation Investors Common Stock,18.985,201273275.0,11233,Finance
BMEZ,BlackRock Health Sciences Term Trust Common Shares of Beneficial Interest,15.07,200928581.0,191551,Finance
HNNAZ,Hennessy Advisors Inc. 4.875% Notes due 2026,25.0119,194781672.0,19,Finance
UBFO,United Security Bancshares Common Stock,11.07,194564693.0,35334,Finance
MNSBP,MainStreet Bancshares Inc. Depositary Shares,25.18,194026278.0,1116,Finance
CPSS,Consumer Portfolio Services Inc. Common Stock,8.78,193783784.0,15321,Finance
LPRO,Open Lending Corporation Common Stock,1.61,190285003.0,179917,Finance
CBFV,CB Financial Services Inc. Common Stock,37.26,186705501.0,3958,Finance
CMTV,Community Bancorp. Common Stock,33.17,185904980.0,10464,Finance
INBK,First Internet Bancorp Common Stock,21.26,185091558.0,47183,Finance
SAMG,Silvercrest Asset Management Group Inc. Class A Common Stock,15.04,184066198.0,13120,Finance
GHI,Greystone Housing Impact Investors LP Beneficial Unit Certificates representing assignments of limited partnership interests,7.8,183943133.0,31904,Finance
EBMT,Eagle Bancorp Montana Inc. Common Stock,23.025,183098875.0,29347,Finance
CZWI,Citizens Community Bancorp Inc. Common Stock,18.8,181603206.0,60210,Finance
FCAP,First Capital Inc. Common Stock,53.3,178428519.0,8530,Finance
BVFL,BV Financial Inc. Common Stock,19.67,175140244.0,13640,Finance
FOA,Finance of America Companies Inc. Class A Common Stock,22.04,173925574.0,51751,Finance
MNSB,MainStreet Bancshares Inc. Common Stock,22.56,173837682.0,70971,Finance
SRG,Seritage Growth Properties Class A Common Stock,3.07,172916543.0,237788,Finance
WHG,Westwood Holdings Group Inc Common Stock,17.83,167746958.0,5818,Finance
LARK,Landmark Bancorp Inc. Common Stock,27.43,166616156.0,4209,Finance
FNWD,Finward Bancorp Common Stock,38.47,166459690.0,4915,Finance
HNVR,Hanover Bancorp Inc. Common Stock,23.1,166144209.0,7997,Finance
PIM,Putnam Master Intermediate Income Trust Common Stock,3.3,165836200.0,80039,Finance
GRX,The Gabelli Healthcare & Wellness Trust Common Shares of Beneficial Interest,9.67,165289049.0,56066,Finance
PNBK,Patriot National Bancorp Inc. Common Stock,1.43,164437154.0,72557,Finance
SLQT,SelectQuote Inc. Common Stock,0.907,159894725.0,2577498,Finance
BCIC,BCP Investment Corporation Common Stock,12.19,159460450.0,33377,Finance
ECBK,ECB Bancorp Inc. Common Stock,18.02,158519958.0,9937,Finance
GNT,GAMCO Natural Resources Gold & Income Trust,8.5,157041232.0,93241,Finance
HBT,HBT Financial Inc. Common Stock,28.5,156931260.0,25536,Finance
RMAX,RE/MAX Holdings Inc. Class A Common Stock,7.71,154634505.0,206376,Finance
OXSQ,Oxford Square Capital Corp. Common Stock,1.89,154355181.0,1445546,Finance
BZAI,Blaize Holdings Inc. Common Stock,1.26,153774268.0,1257582,Finance
WHF,WhiteHorse Finance Inc. Common Stock,6.53,151777365.0,64798,Finance
SRBK,SR Bancorp Inc. Common stock,17.65,150592801.0,47438,Finance
RMBI,Richmond Mutual Bancorporation Inc. Common Stock,14.3,149435100.0,11914,Finance
BCBP,BCB Bancorp Inc. (NJ) Common Stock,8.4,144716930.0,165392,Finance
XFLT,XAI Octagon Floating Rate & Alternative Income Trust Common Shares of Beneficial Interest,4.04,143292869.0,707013,Finance
BANX,ArrowMark Financial Corp. Common Stock,20.05,142407651.0,41219,Finance
FGBI,First Guaranty Bancshares Inc. Common Stock,9.2,141247112.0,12077,Finance
JHS,John Hancock Income Securities Trust Common Stock,11.705,136323277.0,11843,Finance
MRCC,Monroe Capital Corporation Common Stock,6.29,136281279.0,65281,Finance
RBKB,Rhinebeck Bancorp Inc. Common Stock,12.22,136200222.0,19716,Finance
SBFG,SB Financial Group Inc. Common Stock,21.22,133043013.0,22211,Finance
AFBI,Affinity Bancshares Inc. Common Stock (MD),20.63,127237629.0,2209,Finance
BEEP,Mobile Infrastructure Corporation Common Stock,3.0,126900000.0,115368,Finance
RDZN,Roadzen Inc. Ordinary Shares,1.56,124325248.0,101886,Finance
GLU,Gabelli Global Utility Common Shares of Beneficial Ownership,20.77,123974281.0,14274,Finance
JHI,John Hancock Investors Trust Common Stock,13.93,121811540.0,25382,Finance
LSBK,Lake Shore Bancorp Inc. Common Stock,15.49,121217010.0,6611,Finance
CXE,MFS High Income Municipal Trust Common Stock,3.82,120428453.0,17972,Finance
MGYR,Magyar Bancorp Inc. Common Stock,18.2,118957948.0,6739,Finance
HYNE,Hoyne Bancorp Inc. Common Stock,14.38,116433968.0,20965,Finance
CHCI,Comstock Holding Companies Inc. Class A Common Stock,11.49,115907110.0,5015,Finance
GGT,Gabelli Multi-Media Trust Inc. (The) Common Stock,4.19,115374797.0,389569,Finance
DFDV,DeFi Development Corp. Common Stock,3.87,114041775.0,1129123,Finance
SFBC,Sound Financial Bancorp Inc. Common Stock,44.37,113856482.0,5308,Finance
UNB,Union Bankshares Inc. Common Stock,24.44,111994418.0,29019,Finance
RVSB,Riverview Bancorp Inc Common Stock,5.33,110599504.0,56698,Finance
BSBK,Bogota Financial Corp. Common Stock,8.48,109974551.0,766,Finance
SIEB,Siebert Financial Corp. Common Stock,2.72,109961266.0,24424,Finance
SUIG,Sui Group Holdings Limited Common Stock,1.32,109650906.0,259760,Finance
PROP,Prairie Operating Co. Common Stock,1.73,103188635.0,1098358,Finance
PROV,Provident Financial Holdings Inc. Common Stock,15.98,101872820.0,11886,Finance
CMU,MFS Municipal Income Trust Common Stock,3.57,101121371.0,25325,Finance
AEI,Alset Inc. Common Stock (TX),2.54,99259385.0,30050,Finance
MGF,MFS Government Markets Income Trust Common Stock,3.0301,98773361.0,177384,Finance
FNWB,First Northwest Bancorp Common Stock,10.26,97081659.0,61449,Finance
IROQ,IF Bancorp Inc. Common Stock,27.91,93541091.0,23983,Finance
EVF,Eaton Vance Senior Income Trust Common Stock,5.28,92605170.0,105085,Finance
BOTJ,Bank of the James Financial Group Inc. Common Stock,20.31,92275195.0,5997,Finance
SSBI,Summit State Bank Common Stock,13.53,90287449.0,20010,Finance
FUSB,First US Bancshares Inc. Common Stock,15.52,89502102.0,1990,Finance
EIC,Eagle Point Income Company Inc. Common Stock,10.03,89348323.0,306577,Finance
AUBN,Auburn National Bancorporation Inc. Common Stock,25.0,87342475.0,2084,Finance
PFX,PhenixFIN Corporation Common Stock,43.6,87224416.0,232,Finance
GCV,Gabelli Convertible and Income Securities Fund Inc. (The) Common Stock,4.52,86060931.0,71736,Finance
BLNE,Beeline Holdings Inc. Common Stock,3.02,83820568.0,708117,Finance
PBHC,Pathfinder Bancorp Inc. Common Stock (MD),13.56,83726328.0,10548,Finance
FDSB,Fifth District Bancorp Inc. Common Stock,15.07,83227843.0,10263,Finance
UBCP,United Bancorp Inc. Common Stock,14.3,82568357.0,4351,Finance
BTCS,BTCS Inc. Common Stock,1.69,80871195.0,772280,Finance
DTF,DTF Tax-Free Income 2028 Term Fund Inc. Common Stock,11.5,80840021.0,1018,Finance
GLV,Clough Global Dividend and Income Fund Common Shares of beneficial interest,6.35,80705852.0,26421,Finance
OBTC,Osprey Bitcoin Trust Common Units of Beneficial Interest,22.1347,80582150.0,11424,Finance
MLCI,Mount Logan Capital Inc. Common Stock,6.29,80428922.0,95828,Finance
HNNA,Hennessy Advisors Inc. Common Stock,10.11,79789909.0,2464,Finance
FLD,Fold Holdings Inc. Class A Common Stock,1.61,79149299.0,288373,Finance
CLSKW,CleanSpark Inc. Warrant,0.2965,75830739.0,122361,Finance
CPBI,Central Plains Bancshares Inc. Common Stock,17.72,74651507.0,3578,Finance
CXH,MFS Investment Grade Municipal Trust Common Stock,8.12,73975189.0,5306,Finance
BYFC,Broadway Financial Corporation Class A Common Stock,8.01,73537888.0,981,Finance
CEV,Eaton Vance California Municipal Income Trust Shares of Beneficial Interest,10.4,73149180.0,38585,Finance
FGNX,FG Nexus Inc. Common Stock ,1.77,70046600.0,375225,Finance
TECTP,Tectonic Financial Inc. 9.00% Fixed-to-Floating Rate Series B Non-Cumulative Perpetual Preferred Stock,10.0,67766010.0,127062,Finance
CLST,Catalyst Bancorp Inc. Common Stock,15.9999,65818149.0,17705,Finance
NSTS,NSTS Bancorp Inc. Common Stock,12.35,64702119.0,1086,Finance
HIT,Health In Tech Inc. Class A Common Stock,1.12,63737865.0,55561,Finance
BENF,Beneficient Class A Common Stock,4.48,62397583.0,7072,Finance
RFL,Rafael Holdings Inc. Class B Common Stock,1.2,62115361.0,105924,Finance
BTM,Bitcoin Depot Inc. Class A Common Stock,0.8454,62003386.0,542981,Finance
EHTH,eHealth Inc. Common Stock,1.98,60914274.0,710073,Finance
FSEA,First Seacoast Bancorp Inc. Common Stock,12.95,60823133.0,5668,Finance
ASRV,AmeriServ Financial Inc. Common Stock,3.52,59682540.0,31627,Finance
OPHC,OptimumBank Holdings Inc. Common Stock,5.09,58707770.0,8088,Finance
HFBL,Home Federal Bancorp Inc. of Louisiana Common Stock,18.44,56947533.0,232,Finance
GOCO,GoHealth Inc. Class A Common Stock,1.98,56853720.0,26735,Finance
OFS,OFS Capital Corporation Common Stock,4.2,56271928.0,148271,Finance
AFCG,Advanced Flower Capital Inc. Common Stock,2.31,52193390.0,244451,Finance
AAME,Atlantic American Corporation Common Stock,2.54,51808959.0,6900,Finance
GECC,Great Elm Capital Corp. Common Stock,6.6,50172936.0,57743,Finance
TCBS,Texas Community Bancshares Inc. Common Stock,17.0413,49671010.0,2559,Finance
PFXNZ,PhenixFIN Corporation  5.25% Notes due 2028,23.79,47672044.0,230,Finance
OCCI,OFS Credit Company Inc. Common Stock,4.09,47511526.0,888320,Finance
BZAIW,Blaize Holdings Inc. Warrants,0.3799,46364162.0,21679,Finance
AIRE,reAlpha Tech Corp. Common Stock,0.3485,45563125.0,1431888,Finance
ICMB,Investcorp Credit Management BDC Inc. Common Stock,3.0,43259286.0,25009,Finance
OPAD,Offerpad Solutions Inc. Class A Common Stock,0.9144,43169416.0,1113875,Finance
BCG,Binah Capital Group Inc. Common Stock,2.41,40011929.0,6633,Finance
MBBC,Marathon Bancorp Inc. Common Stock,13.49,39641984.0,438,Finance
GROW,U.S. Global Investors Inc. Class A Common Stock,3.09,39516199.0,43070,Finance
KFFB,Kentucky First Federal Bancorp Common Stock,4.68,37845826.0,188,Finance
USIO,Usio Inc. Common Stock,1.34,36592504.0,44136,Finance
BRRWW,ProCap Financial Inc. Warrant,0.42,35769974.0,129373,Finance
COHN,Cohen & Company Inc.,17.12,34853975.0,13208,Finance
FTHM,Fathom Holdings Inc. Common Stock,1.07,34658326.0,71892,Finance
RAND,Rand Capital Corporation Common Stock,10.8621,32258417.0,1722,Finance
MDBH,MDB Capital Holdings LLC Class A common,3.1,31522759.0,589,Finance
BAFN,BayFirst Financial Corp. Common Stock,7.04,28934421.0,8418,Finance
VEEA,Veea Inc. Common Stock,0.5205,26108630.0,25496,Finance
MBNKO,Medallion Bank Fixed-Rate Reset Non-Cumulative Perpetual Preferred Stock Series G par value $1.00 per share,25.86,25860000.0,3406,Finance
LHAI,Linkhome Holdings Inc. Common stock,1.57,25481100.0,514709,Finance
GREE,Greenidge Generation Holdings Inc. Class A Common Stock,1.25,19748746.0,75631,Finance
EQS,Equus Total Return Inc. Common Stock,1.3507,18864816.0,1257,Finance
PGYWW,Pagaya Technologies Ltd. Warrants,0.2149,17712721.0,29197,Finance
RDZNW,Roadzen Inc. Warrants,0.1811,14432886.0,1828,Finance
RENX,RenX Enterprises Corp. Common Stock,0.14,13993400.0,3184477,Finance
IHT,InnSuites Hospitality Trust Shares of Beneficial Interest,1.22,11229897.0,5514,Finance
PRHI,Presurance Holdings Inc. Common Stock,0.7075,8647688.0,17325,Finance
CWD,CaliberCos Inc. Class A Common Stock,1.27,8298585.0,19926,Finance
DAVEW,Dave Inc. Warrants,0.5,6752041.0,1114,Finance
CELZ,Creative Medical Technology Holdings Inc. Common Stock,1.93,6744709.0,31601,Finance
VEEAW,Veea Inc. Warrant,0.1073,5382240.0,194,Finance
BTMWW,Bitcoin Depot Inc. Warrant,0.0631,4627885.0,492903,Finance
FLDDW,Fold Holdings Inc. Warrant,0.092,4522817.0,1956,Finance
NCPL,Netcapital Inc. Common Stock,0.5701,4474087.0,118375,Finance
LMFA,LM Funding America Inc. Common Stock,0.315,4448902.0,77689,Finance
BTOG,Bit Origin Limited Class A Ordinary Shares,2.91,4297610.0,93777,Finance
EZRA,Reliance Global Group Inc. Common Stock,0.209,3791503.0,22152985,Finance
SHFS,SHF Holdings Inc. Class A Common Stock,1.04,3204319.0,43740,Finance
BCGWW,Binah Capital Group Inc. Warrants,0.15,2490369.0,961,Finance
STSSW,Sharps Technology Inc. Warrant,0.0251,727785.0,4600,Finance
NCPLW,Netcapital Inc. Warrants,0.0317,248778.0,1567,Finance
LRHC,La Rosa Holdings Corp. Common Stock,1.46,237298.0,125279,Finance
BENFW,Beneficient Warrant,0.0108,150423.0,93820,Finance
SHFSW,SHF Holdings Inc. Warrants,0.0395,121703.0,551,Finance
BBN,BlackRock Taxable Municipal Bond Trust Common Shares of Beneficial Interest,16.51,0.0,192179,Finance
PEO,Adams Natural Resources Fund Inc. Common Stock,25.37,0.0,92813,Finance
BCV,Bancroft Fund Ltd.,23.59,0.0,10797,Finance
BCARW,D. Boral ARC Acquisition I Corp. Warrant,0.87,0.0,70100,Finance
AACBU,Artius II Acquisition Inc. Units,10.67,0.0,67,Finance
BCAR,D. Boral ARC Acquisition I Corp. Class A Ordinary Shares,10.15,0.0,81293,Finance
PELIU,Pelican Acquisition Corporation Unit,11.96,0.0,2102,Finance
PMTRU,Perimeter Acquisition Corp. I Unit,10.61,0.0,422,Finance
BOE,Blackrock Enhanced Global Dividend Trust Common Shares of Beneficial Interest,12.09,0.0,128278,Finance
QSEA,Quartzsea Acquisition Corporation Ordinary Shares,10.29,0.0,116,Finance
GLQ,Clough Global Equity Fund Clough Global Equity Fund Common Shares of Beneficial Interest,8.31,0.0,89089,Finance
KKRT,KKR & Co. Inc. 6.875% Subordinated Notes due 2065,25.55,0.0,14266,Finance
GLO,Clough Global Opportunities Fund Common Stock,6.02,0.0,201692,Finance
QQQX,Nuveen NASDAQ 100 Dynamic Overwrite Fund Shares of Beneficial Interest,27.86,0.0,98074,Finance
EHI,Western Asset Global High Income Fund Inc Common Stock,6.51,0.0,86435,Finance
PMTR,Perimeter Acquisition Corp. I Class A Ordinary Shares,10.38,0.0,5750,Finance
