symbol,name,price,marketCap,volume,industry
MGRD,Affiliated Managers Group Inc. 4.200% Junior Subordinated Notes due 2061,15.55,441807580.0,14715,Finance
TRC,Tejon Ranch Co Common Stock,16.38,440522983.0,205938,Finance
EVN,Eaton Vance Municipal Income Trust Common Stock,11.09,439908838.0,84845,Finance
CARE,Carter Bankshares Inc. Common Stock,19.87,438869564.0,65076,Finance
CIVB,Civista Bancshares Inc. Common Stock,22.35,431642846.0,123838,Finance
SFST,Southern First Bancshares Inc. Common Stock,52.66,431242061.0,41858,Finance
CWBC,Community West Bancshares Common Stock,22.42,429531956.0,95426,Finance
HQL,abrdn Life Sciences Investors Shares of Beneficial Interest,16.69,428593125.0,174660,Finance
COFS,ChoiceOne Financial Services Inc. Common Stock,27.68,415856902.0,60318,Finance
BMRC,Bank of Marin Bancorp Common Stock,25.8,415242899.0,109892,Finance
FRBA,First Bank Common Stock,16.52,415220338.0,37310,Finance
GBLI,Global Indemnity Group LLC Class A Common Stock ,28.8378,413071321.0,779,Finance
ONIT,Onity Group Inc. Common Stock,50.95,410599630.0,98337,Finance
VKI,Invesco Advantage Municipal Income Trust II Common Shares of Beneficial Interest (DE),9.24,410311625.0,138892,Finance
NEWT,NewtekOne Inc. Common Stock,14.0,404422130.0,339288,Finance
SOR,Source Capital Inc. Cmn Shs of BI,48.34,403372308.0,9837,Finance
LEO,BNY Mellon Strategic Municipals Inc. Common Stock,6.45,401776008.0,279894,Finance
BSVN,Bank7 Corp. Common stock,42.4,400823736.0,13054,Finance
SAJ,Saratoga Investment Corp 8.00% Notes due 2027,25.5058,399628216.0,1967,Finance
SAZ,Saratoga Investment Corp 8.50% Notes due 2028,25.4068,398077071.0,5822,Finance
SAY,Saratoga Investment Corp 8.125% Notes due 2027,25.37,397500483.0,1196,Finance
PNNT,PennantPark Investment Corporation Common Stock,6.03,393735447.0,512393,Finance
CMTG,Claros Mortgage Trust Inc. Common Stock,2.8,392612539.0,400566,Finance
BRBS,Blue Ridge Bankshares Inc. Common Stock,4.27,390656582.0,88276,Finance
BOC,Boston Omaha Corporation Class A Common Stock,12.41,390337116.0,79245,Finance
SAT,Saratoga Investment Corp 6.00% Notes due 2027,24.91,390293143.0,894,Finance
OBT,Orange County Bancorp Inc. Common Stock,28.98,387368125.0,27063,Finance
PDLB,Ponce Financial Group Inc. Common Stock,16.01,384258011.0,39237,Finance
ATLCZ,Atlanticus Holdings Corporation 9.25% Senior Notes due 2029,25.28,382371351.0,84097,Finance
MCI,Barings Corporate Investors Common Stock,18.85,381933403.0,31720,Finance
GCBC,Greene County Bancorp Inc. Common Stock,22.16,377314508.0,9670,Finance
WTBA,West Bancorporation Common Stock,22.26,377101874.0,44716,Finance
AII,American Integrity Insurance Group Inc. Common Stock,19.26,377049245.0,94637,Finance
SCM,Stellus Capital Investment Corporation Common Stock,12.99,376024829.0,102464,Finance
ATLCL,Atlanticus Holdings Corporation 6.125% Senior Notes due 2026,24.8,375111135.0,41894,Finance
RM,Regional Management Corp. Common Stock,38.4,372971712.0,34513,Finance
SAR,Saratoga Investment Corp New,23.01,372395175.0,105081,Finance
TACO,Berto Acquisition Corp. Ordinary Shares,10.19,371346344.0,9866,Finance
ATLCP,Atlanticus Holdings Corporation 7.625% Series B Cumulative Perpetual Preferred Stock no par value per share,24.435,369983286.0,54959,Finance
BWFG,Bankwell Financial Group Inc. Common Stock,46.7,367876588.0,16952,Finance
CZNC,Citizens & Northern Corp Common Stock,20.54,365650471.0,27626,Finance
RBB,RBB Bancorp Common Stock,21.35,363951251.0,29973,Finance
PMO,Putnam Municipal Opportunities Trust Common Stock,10.65,361903689.0,87197,Finance
KTF,DWS Municipal Income Trust,9.16,361828592.0,46734,Finance
MBI,MBIA Inc. Common Stock,7.12,359514617.0,1266469,Finance
ISBA,Isabella Bank Corporation Common stock,49.0,359419704.0,21868,Finance
PPT,Putnam Premier Income Trust Common Stock,3.6,358301747.0,299235,Finance
VALU,Value Line Inc. Common Stock,37.72,354186010.0,3051,Finance
USCB,USCB Financial Holdings Inc. Class A Common Stock,18.91,342467380.0,20606,Finance
FMAO,Farmers & Merchants Bancorp Inc. Common Stock,24.86,341823608.0,22321,Finance
GREEL,Greenidge Generation Holdings Inc. 8.50% Senior Notes due 2026,21.75,340896820.0,15413,Finance
GBAB,Guggenheim Taxable Municipal Bond & Investment Grade Debt Trust Common Shares of Beneficial Interest,15.2,340432956.0,122280,Finance
ECC,Eagle Point Credit Company Inc. Common Stock,5.61,340316760.0,1696411,Finance
MLP,Maui Land & Pineapple Company Inc. Common Stock,17.05,336596138.0,10959,Finance
PBFS,Pioneer Bancorp Inc. Common Stock,13.42,336580941.0,3585,Finance
EFT,Eaton Vance Floating Rate Income Trust Common Shares of Beneficial Interest,11.55,335994293.0,234375,Finance
RWAY,Runway Growth Finance Corp. Common Stock,9.26,334601183.0,257599,Finance
MVBF,MVB Financial Corp. Common Stock,26.14,328954491.0,62648,Finance
FRST,Primis Financial Corp. Common Stock,13.31,328016764.0,71009,Finance
OFSSH,OFS Capital Corporation 4.95% Notes due 2028,24.05,322223776.0,2,Finance
NECB,NorthEast Community Bancorp Inc. Common Stock,22.83,320241889.0,42162,Finance
LNKB,LINKBANCORP Inc. Common Stock,8.5,318373008.0,128254,Finance
CBAN,Colony Bankcorp Inc. Common Stock,18.07,315043800.0,71364,Finance
WSBF,Waterstone Financial Inc. Common Stock (MD),17.03,314321314.0,24861,Finance
ARDC,Ares Dynamic Credit Allocation Fund Inc. Common Shares,13.7,313934664.0,134242,Finance
PLBC,Plumas Bancorp,45.03,313206795.0,11180,Finance
BCML,BayCom Corp Common Stock,28.6,311676022.0,18272,Finance
PCB,PCB Bancorp Common Stock,21.8,310884437.0,27411,Finance
FSBW,FS Bancorp Inc. Common Stock,40.96,307956204.0,5914,Finance
PMM,Putnam Managed Municipal Income Trust Common Stock,6.27,305592332.0,65419,Finance
MIN,MFS Intermediate Income Trust Common Stock,2.63,302181138.0,229653,Finance
CPZ,Calamos Long/Short Equity & Dynamic Income Trust Common Stock,15.16,297624061.0,45746,Finance
CBK,Commercial Bancgroup Inc. Common Stock,24.25,296811367.0,22509,Finance
BRR,ProCap Financial Inc. Common Stock,3.48,296379782.0,338408,Finance
HRZN,Horizon Technology Finance Corporation Common Stock,6.66,295592725.0,752315,Finance
OIA,Invesco Municipal Income Opportunities Trust Common Stock,6.19,294678596.0,123753,Finance
FNLC,First Bancorp Inc  (ME) Common Stock,26.24,294394957.0,9110,Finance
OCCIO,OFS Credit Company Inc. 6.125% Series C Term Preferred Stock,25.08,291342071.0,5283,Finance
CZFS,Citizens Financial Services Inc. Common Stock,60.18,289247768.0,8824,Finance
AVBH,Avidbank Holdings Inc. Common stock,26.41,289210681.0,41447,Finance
PKBK,Parke Bancorp Inc. Common Stock,24.78,287337803.0,49226,Finance
RILYL,BRC Group Holdings Inc. Depositary Shares each representing 1/1000th in a share of 7.375% Series B Cumulative Perpetual Preferred Stock par value $0.0001,9.36,286388538.0,15368,Finance
OCCIN,OFS Credit Company Inc. 5.25% Series E Term Preferred Stock Due 2026,24.6,285766146.0,3730,Finance
ACV,Virtus Diversified Income & Convertible Fund Common Shares of Beneficial Interest,27.47,284670346.0,32409,Finance
MMT,MFS Multimarket Income Trust Common Stock,4.73,281663483.0,74597,Finance
COSO,CoastalSouth Bancshares Inc. Common Stock,23.44,280785908.0,355580,Finance
TSBK,Timberland Bancorp Inc. Common Stock,35.52,279925057.0,16338,Finance
MCR,MFS Charter Income Trust Common Stock,6.3,277252794.0,76779,Finance
JMSB,John Marshall Bancorp Inc. Common Stock,19.49,276281275.0,3601,Finance
RILYP,BRC Group Holdings Inc. Depositary Shares each representing a 1/1000th fractional interest in a share of Series A Cumulative Perpetual Preferred Stock,8.99,275067623.0,47251,Finance
MBCN,Middlefield Banc Corp. Common Stock,33.93,274388042.0,9370,Finance
OSG,Octave Specialty Group Inc. Common Stock,6.26,274263339.0,733207,Finance
NODK,NI Holdings Inc. Common Stock,13.3,274056435.0,6490,Finance
EOT,Eaton Vance Municipal Income Trust EATON VANCE NATIONAL MUNICIPAL OPPORTUNITIES TRUST,17.35,271092379.0,35729,Finance
FCNCO,First Citizens BancShares Inc. 5.625% Non-Cumulative Perpetual Preferred Stock Series C,21.73,270224545.0,12245,Finance
SLQT,SelectQuote Inc. Common Stock,1.53,269236768.0,1902202,Finance
INV,Innventure Inc. Common Stock,3.97,268943073.0,4135932,Finance
BZAI,Blaize Holdings Inc. Common Stock,2.2,268494754.0,1420901,Finance
FUND,Sprott Focus Trust Inc. Common Stock,9.005,266850181.0,34743,Finance
WNEB,Western New England Bancorp Inc. Common Stock,12.78,261887325.0,23004,Finance
ISTR,Investar Holding Corporation Common Stock,26.66,261546197.0,38774,Finance
CHMG,Chemung Financial Corp Common Stock,54.3,260333151.0,5314,Finance
FGBIP,First Guaranty Bancshares Inc. 6.75% Series A Fixed-Rate Non-Cumulative Perpetual Preferred Stock,16.91,259618334.0,1855,Finance
NWFL,Norwood Financial Corp. Common Stock,27.99,259304958.0,33569,Finance
MYFW,First Western Financial Inc. Common Stock,26.58,258217018.0,11800,Finance
CIA,Citizens Inc. Class A Common Stock ($1.00 Par),5.12,257519862.0,64121,Finance
LPRO,Open Lending Corporation Common Stock,2.17,256471091.0,2228155,Finance
FBLA,FB Bancorp Inc. Common Stock,12.89,255705375.0,128969,Finance
FCNCP,First Citizens BancShares Inc. Depositary Shares,20.56,255674949.0,18182,Finance
BLFY,Blue Foundry Bancorp Common Stock,12.3,255363068.0,1077011,Finance
FVCB,FVCBankcorp Inc. Common Stock,14.05,253951137.0,22789,Finance
OVLY,Oak Valley Bancorp (CA) Common Stock,30.21,253408156.0,5296,Finance
VPV,Invesco Pennsylvania Value Municipal Income Trust Common Stock (DE),10.63,253308053.0,15291,Finance
FTF,Franklin Limited Duration Income Trust Common Shares of Beneficial Interest,6.2,250513319.0,210896,Finance
FDBC,Fidelity D & D Bancorp Inc. Common Stock,42.83,247012859.0,5517,Finance
DFDV,DeFi Development Corp. Common Stock,7.8,244929454.0,1926559,Finance
FUNC,First United Corporation Common Stock,37.45,243309205.0,13842,Finance
BPRN,Princeton Bancorp Inc. Common Stock (PA),35.38,239269951.0,10563,Finance
FINW,FinWise Bancorp Common Stock,17.59,238993940.0,33041,Finance
LIEN,Chicago Atlantic BDC Inc. Common Stock,10.47,238931577.0,63555,Finance
SSSS,SuRo Capital Corp. Common Stock,9.48,238128983.0,66388,Finance
PRHIZ,Presurance Holdings Inc. 9.75% Senior Unsecured Notes due 2028,19.4,237123891.0,2035,Finance
MFIN,Medallion Financial Corp. Common Stock,10.12,235587882.0,43435,Finance
LCNB,LCNB Corporation Common Stock,16.37,232235379.0,10822,Finance
KINS,Kingstone Companies Inc. Common Stock,16.32,230886025.0,224776,Finance
FRAF,Franklin Financial Services Corporation Common Stock,51.16,229147533.0,59380,Finance
RILY,BRC Group Holdings Inc. Common Stock,7.44,227642171.0,1417119,Finance
VTN,Invesco Trust for Investment Grade New York Municipals Common Stock,11.64,226816796.0,18202,Finance
FCCO,First Community Corporation Common Stock,29.47,226615282.0,51028,Finance
FXNC,First National Corporation Common Stock,25.11,226261615.0,22524,Finance
MFM,MFS Municipal Income Trust Common Stock,5.49,226120094.0,80482,Finance
SNFCA,Security National Financial Corporation Class A Common Stock,8.7,226074450.0,13091,Finance
DOUG,Douglas Elliman Inc. Common Stock,2.53,224711994.0,366992,Finance
OPRT,Oportun Financial Corporation Common Stock,5.06,223292841.0,374839,Finance
CFFI,C&F Financial Corporation Common Stock,68.87,223017038.0,2790,Finance
ALTS,ALT5 Sigma Corporation Common Stock,1.81,221922971.0,5893250,Finance
AOMR,Angel Oak Mortgage REIT Inc. Common Stock,8.89,221485771.0,72635,Finance
FSFG,First Savings Financial Group Inc. Common Stock,31.51,221045171.0,4854,Finance
EICA,Eagle Point Income Company Inc. 5.00% Series A Term Preferred Stock due 2026,24.66,219673943.0,1589,Finance
HWBK,Hawthorn Bancshares Inc. Common Stock,31.45,216930967.0,4532,Finance
INBKZ,First Internet Bancorp 6.0% Fixed-to-Floating Rate Subordinated Notes Due 2029,24.85,216520386.0,1535,Finance
NKSH,National Bankshares Inc. Common Stock,33.63,214088614.0,7704,Finance
EFSI,Eagle Financial Services Inc Common Stock,39.7,213440936.0,16993,Finance
VABK,Virginia National Bankshares Corporation Common Stock,39.31,212004294.0,3173,Finance
SWKH,SWK Holdings Corporation Common Stock,17.41,210589723.0,1305,Finance
OPBK,OP Bancorp Common Stock,14.13,210333726.0,27696,Finance
CPSS,Consumer Portfolio Services Inc. Common Stock,9.4,207467832.0,54013,Finance
ATLO,Ames National Corporation Common Stock,23.04,204875528.0,24423,Finance
BMEZ,BlackRock Health Sciences Term Trust Common Shares of Beneficial Interest,15.32,204261836.0,299702,Finance
MRBK,Meridian Corporation Common Stock,17.7,203858971.0,86678,Finance
FT,Franklin Universal Trust Common Stock,8.07,202814385.0,37664,Finance
PEBK,Peoples Bancorp of North Carolina Inc. Common Stock,36.84,201125806.0,10070,Finance
SRG,Seritage Growth Properties Class A Common Stock,3.49,196572878.0,58973,Finance
HNNAZ,Hennessy Advisors Inc. 4.875% Notes due 2026,24.99,194611124.0,54,Finance
MNSBP,MainStreet Bancshares Inc. Depositary Shares,25.1772,194004702.0,1427,Finance
MPV,Barings Participation Investors Common Stock,18.28,193799076.0,19477,Finance
FOA,Finance of America Companies Inc. Class A Common Stock,24.36,192233530.0,96682,Finance
SAMG,Silvercrest Asset Management Group Inc. Class A Common Stock,15.33,187615347.0,18560,Finance
OVBC,Ohio Valley Banc Corp. Common Stock,39.41,185660549.0,4516,Finance
INBK,First Internet Bancorp Common Stock,21.0,182827974.0,20139,Finance
PNBK,Patriot National Bancorp Inc. Common Stock,1.56,179385987.0,138894,Finance
UBFO,United Security Bancshares Common Stock,10.01,175934289.0,29501,Finance
GHI,Greystone Housing Impact Investors LP Beneficial Unit Certificates representing assignments of limited partnership interests,7.38,174038503.0,121092,Finance
CZWI,Citizens Community Bancorp Inc. Common Stock,17.89,172812838.0,19924,Finance
CBFV,CB Financial Services Inc. Common Stock,34.35,172123831.0,1497,Finance
CFBK,CF Bankshares Inc. Common Stock,26.91,171337988.0,22437,Finance
XFLT,XAI Octagon Floating Rate & Alternative Income Trust Common Shares of Beneficial Interest,4.75,168475527.0,337814,Finance
WHG,Westwood Holdings Group Inc Common Stock,17.76,167088389.0,16971,Finance
PIM,Putnam Master Intermediate Income Trust Common Stock,3.32,166841268.0,167966,Finance
HNVR,Hanover Bancorp Inc. Common Stock,22.91,164777655.0,19694,Finance
BVFL,BV Financial Inc. Common Stock,18.5,164722650.0,8753,Finance
GRX,The Gabelli Healthcare & Wellness Trust Common Shares of Beneficial Interest,9.57,163579752.0,26413,Finance
SUIG,Sui Group Holdings Limited Common Stock,1.93,160322915.0,782163,Finance
WHF,WhiteHorse Finance Inc. Common Stock,6.85,159215153.0,124284,Finance
EBMT,Eagle Bancorp Montana Inc. Common Stock,19.97,158804975.0,64197,Finance
BCIC,BCP Investment Corporation Common Stock,12.05,157629075.0,42604,Finance
FCAP,First Capital Inc. Common Stock,47.05,157505850.0,13391,Finance
BANX,ArrowMark Financial Corp. Common Stock,22.05,156612903.0,18522,Finance
RDZN,Roadzen Inc. Ordinary Shares,1.96,155815249.0,405325,Finance
RMAX,RE/MAX Holdings Inc. Class A Common Stock,7.74,155236195.0,138100,Finance
MNSB,MainStreet Bancshares Inc. Common Stock,20.05,154496699.0,35523,Finance
LARK,Landmark Bancorp Inc. Common Stock,25.36,154042498.0,6515,Finance
ECBK,ECB Bancorp Inc. Common Stock,17.25,151746353.0,3315,Finance
FNWD,Finward Bancorp Common Stock,34.95,151228650.0,29197,Finance
OXSQ,Oxford Square Capital Corp. Common Stock,1.85,151088405.0,1465231,Finance
GNT,GAMCO Natural Resources Gold & Income Trust,8.07,149096793.0,116928,Finance
HBT,HBT Financial Inc. Common Stock,26.46,145698286.0,19389,Finance
RMBI,Richmond Mutual Bancorporation Inc. Common Stock,13.86,144837097.0,2542,Finance
MRCC,Monroe Capital Corporation Common Stock,6.55,141914527.0,75223,Finance
SRBK,SR Bancorp Inc. Common stock,16.54,141122092.0,48207,Finance
BTCS,BTCS Inc. Common Stock,2.97,139110440.0,667097,Finance
JHS,John Hancock Income Securities Trust Common Stock,11.73,136614442.0,9182,Finance
BCBP,BCB Bancorp Inc. (NJ) Common Stock,7.9,136102827.0,41267,Finance
RBKB,Rhinebeck Bancorp Inc. Common Stock,11.94,133079431.0,6345,Finance
SBFG,SB Financial Group Inc. Common Stock,21.1,132898920.0,10292,Finance
FGNX,FG Nexus Inc. Common Stock ,3.24,128220894.0,194880,Finance
SIEB,Siebert Financial Corp. Common Stock,3.1,125323502.0,21845,Finance
AFBI,Affinity Bancshares Inc. Common Stock (MD),20.15,124277180.0,3338,Finance
AEI,Alset Inc. Common Stock (TX),3.19,124107763.0,15056,Finance
JHI,John Hancock Investors Trust Common Stock,13.77,120412412.0,18026,Finance
GLU,Gabelli Global Utility Common Shares of Beneficial Ownership,19.87,118602262.0,7523,Finance
LSBK,Lake Shore Bancorp Inc. Common Stock,15.13,118399830.0,9367,Finance
CXE,MFS High Income Municipal Trust Common Stock,3.752,118284700.0,82471,Finance
PROP,Prairie Operating Co. Common Stock,1.98,118100288.0,2422908,Finance
MGYR,Magyar Bancorp Inc. Common Stock,17.98,117519995.0,274,Finance
EHTH,eHealth Inc. Common Stock,3.81,117213831.0,424267,Finance
FGBI,First Guaranty Bancshares Inc. Common Stock,7.62,116989456.0,23466,Finance
OBTC,Osprey Bitcoin Trust Common Units of Beneficial Interest,30.3,116974211.0,66427,Finance
GGT,Gabelli Multi-Media Trust Inc. (The) Common Stock,4.23,116476227.0,228188,Finance
BEEP,Mobile Infrastructure Corporation Common Stock,2.75,116325000.0,42821,Finance
HYNE,Hoyne Bancorp Inc. Common Stock,14.36,116272030.0,30425,Finance
CHCI,Comstock Holding Companies Inc. Class A Common Stock,11.46,115604480.0,12622,Finance
LHAI,Linkhome Holdings Inc. Common stock,6.95,112798500.0,213746,Finance
SFBC,Sound Financial Bancorp Inc. Common Stock,43.83,112470804.0,9504,Finance
UNB,Union Bankshares Inc. Common Stock,24.4,111811121.0,12246,Finance
FLD,Fold Holdings Inc. Class A Common Stock,2.25,110612374.0,121973,Finance
CLSKW,CleanSpark Inc. Warrant,0.43,109900881.0,132235,Finance
BSBK,Bogota Financial Corp. Common Stock,8.4,108937055.0,1080,Finance
MLCI,Mount Logan Capital Inc. Common Stock,8.33,106513977.0,51108,Finance
RVSB,Riverview Bancorp Inc Common Stock,5.01,103959384.0,37594,Finance
PROV,Provident Financial Holdings Inc. Common Stock,16.01,103652422.0,2184,Finance
CMU,MFS Municipal Income Trust Common Stock,3.56,100838118.0,17669,Finance
BTM,Bitcoin Depot Inc. Class A Common Stock,1.37,99814142.0,905817,Finance
MGF,MFS Government Markets Income Trust Common Stock,3.045,99259062.0,58647,Finance
EIC,Eagle Point Income Company Inc. Common Stock,11.04,98345512.0,294836,Finance
EVF,Eaton Vance Senior Income Trust Common Stock,5.37,94183667.0,44008,Finance
FNWB,First Northwest Bancorp Common Stock,9.82,92918313.0,76296,Finance
IROQ,IF Bancorp Inc. Common Stock,26.75,89653321.0,19898,Finance
PBHC,Pathfinder Bancorp Inc. Common Stock (MD),14.35,88604190.0,109,Finance
PFX,PhenixFIN Corporation Common Stock,43.605,87234419.0,2233,Finance
AUBN,Auburn National Bancorporation Inc. Common Stock,24.47,85490815.0,1899,Finance
HIT,Health In Tech Inc. Class A Common Stock,1.48,84225036.0,515663,Finance
BOTJ,Bank of the James Financial Group Inc. Common Stock,18.35,83370252.0,797,Finance
GCV,Gabelli Convertible and Income Securities Fund Inc. (The) Common Stock,4.36,83014526.0,37849,Finance
FDSB,Fifth District Bancorp Inc. Common Stock,14.86,82068065.0,9112,Finance
SSBI,Summit State Bank Common Stock,12.26,81812574.0,689,Finance
FUSB,First US Bancshares Inc. Common Stock,14.0,80736432.0,63976,Finance
DTF,DTF Tax-Free Income 2028 Term Fund Inc. Common Stock,11.4,80137064.0,6639,Finance
GLV,Clough Global Dividend and Income Fund Common Shares of beneficial interest,6.245,79371346.0,34905,Finance
BYFC,Broadway Financial Corporation Class A Common Stock,8.63,79229959.0,6023,Finance
UBCP,United Bancorp Inc. Common Stock,13.715,79190561.0,5369,Finance
HNNA,Hennessy Advisors Inc. Common Stock,9.71,76630514.0,11201,Finance
CXH,MFS Investment Grade Municipal Trust Common Stock,8.0698,73517855.0,15847,Finance
CPBI,Central Plains Bancshares Inc. Common Stock,17.1,72039547.0,1361,Finance
CEV,Eaton Vance California Municipal Income Trust Shares of Beneficial Interest,10.2,71742465.0,37163,Finance
BENF,Beneficient Class A Common Stock,5.06,70475842.0,23589,Finance
TECTP,Tectonic Financial Inc. 9.00% Fixed-to-Floating Rate Series B Non-Cumulative Perpetual Preferred Stock,10.26,69527926.0,1599,Finance
NSTS,NSTS Bancorp Inc. Common Stock,12.675,66404807.0,804,Finance
GOCO,GoHealth Inc. Class A Common Stock,2.31,66329340.0,62732,Finance
OFS,OFS Capital Corporation Common Stock,4.87,65248640.0,29238,Finance
RFL,Rafael Holdings Inc. Class B Common Stock,1.24,64185873.0,49257,Finance
CLST,Catalyst Bancorp Inc. Common Stock,15.55,63967413.0,1572,Finance
BRRWW,ProCap Financial Inc. Warrant,0.75,63874953.0,59046,Finance
BLNE,Beeline Holdings Inc. Common Stock,2.27,63004202.0,836804,Finance
AAME,Atlantic American Corporation Common Stock,3.0,61191684.0,8759,Finance
FSEA,First Seacoast Bancorp Inc. Common Stock,12.785,60048166.0,804,Finance
AIRE,reAlpha Tech Corp. Common Stock,0.4588,59983822.0,4190426,Finance
AFCG,Advanced Flower Capital Inc. Common Stock,2.62,59197697.0,1146270,Finance
OPAD,Offerpad Solutions Inc. Class A Common Stock,1.6,58975914.0,5118266,Finance
OCCI,OFS Credit Company Inc. Common Stock,4.96,57617890.0,329868,Finance
BZAIW,Blaize Holdings Inc. Warrants,0.4521,55175672.0,13519,Finance
HFBL,Home Federal Bancorp Inc. of Louisiana Common Stock,17.54,54168098.0,2244,Finance
GECC,Great Elm Capital Corp. Common Stock,7.06,53669838.0,37862,Finance
ISPO,Inspirato Incorporated Class A Common Stock,4.23,53422785.0,51936,Finance
ASRV,AmeriServ Financial Inc. Common Stock,3.2,52871254.0,5696,Finance
OPHC,OptimumBank Holdings Inc. Common Stock,4.32,49826634.0,27464,Finance
TCBS,Texas Community Bancshares Inc. Common Stock,16.5001,48093551.0,1318,Finance
PFXNZ,PhenixFIN Corporation  5.25% Notes due 2028,23.81,47712121.0,3691,Finance
FTHM,Fathom Holdings Inc. Common Stock,1.39,45023433.0,142678,Finance
ICMB,Investcorp Credit Management BDC Inc. Common Stock,2.755,39726444.0,13167,Finance
BCG,Binah Capital Group Inc. Common Stock,2.35,39015781.0,25088,Finance
COHN,Cohen & Company Inc.,18.43,37520955.0,23392,Finance
USIO,Usio Inc. Common Stock,1.36,37138661.0,49554,Finance
MBBC,Marathon Bancorp Inc. Common Stock,12.35,36291957.0,1327,Finance
RAND,Rand Capital Corporation Common Stock,11.79,35014107.0,2682,Finance
MDBH,MDB Capital Holdings LLC Class A common,3.43,34775508.0,3071,Finance
KFFB,Kentucky First Federal Bancorp Common Stock,4.21,34045070.0,4282,Finance
GROW,U.S. Global Investors Inc. Class A Common Stock,2.46,31459498.0,22388,Finance
PGYWW,Pagaya Technologies Ltd. Warrants,0.3361,27702400.0,9376,Finance
VEEA,Veea Inc. Common Stock,0.5432,27247278.0,96744,Finance
GREE,Greenidge Generation Holdings Inc. Class A Common Stock,1.62,25594375.0,255142,Finance
BAFN,BayFirst Financial Corp. Common Stock,6.2,25482019.0,16025,Finance
MBNKO,Medallion Bank Fixed-Rate Reset Non-Cumulative Perpetual Preferred Stock Series G par value $1.00 per share,25.11,25110000.0,32737,Finance
EQS,Equus Total Return Inc. Common Stock,1.43,19972375.0,977,Finance
RDZNW,Roadzen Inc. Warrants,0.2355,18721679.0,8978,Finance
RENX,RenX Enterprises Corp. Common Stock,0.1823,18221405.0,5477259,Finance
BTOG,Bit Origin Limited Class A Ordinary Shares,0.1903,16862582.0,2375840,Finance
IHT,InnSuites Hospitality Trust Shares of Beneficial Interest,1.31,12058333.0,14083,Finance
DAVEW,Dave Inc. Warrants,0.872,11775560.0,45175,Finance
FLDDW,Fold Holdings Inc. Warrant,0.1752,8613017.0,1893,Finance
BTMWW,Bitcoin Depot Inc. Warrant,0.1103,8036131.0,58978,Finance
PRHI,Presurance Holdings Inc. Common Stock,0.65,7944873.0,16505,Finance
CWD,CaliberCos Inc. Class A Common Stock,1.31,7378955.0,51799,Finance
LMFA,LM Funding America Inc. Common Stock,0.478,6751032.0,880468,Finance
CELZ,Creative Medical Technology Holdings Inc. Common Stock,1.82,6360296.0,610736,Finance
NCPL,Netcapital Inc. Common Stock,0.7491,5144743.0,473076,Finance
RELI,Reliance Global Group Inc. Common Stock,0.5192,5122220.0,166793,Finance
VEEAW,Veea Inc. Warrant,0.08,4012854.0,9571,Finance
SHFS,SHF Holdings Inc. Class A Common Stock,1.09,3358373.0,53095,Finance
BCGWW,Binah Capital Group Inc. Warrants,0.1488,2470446.0,181,Finance
LRHC,La Rosa Holdings Corp. Common Stock,0.6251,1015993.0,1791242,Finance
STSSW,Sharps Technology Inc. Warrant,0.0312,904657.0,48923,Finance
NCPLW,Netcapital Inc. Warrants,0.0397,272656.0,8730,Finance
BENFW,Beneficient Warrant,0.0123,171315.0,62824,Finance
SHFSW,SHF Holdings Inc. Warrants,0.0348,107221.0,1366,Finance
ISPOW,Inspirato Incorporated Warrant,0.0079,99773.0,1257,Finance
RELIW,Reliance Global Group Inc. Series A Warrants,0.0099,97669.0,1000,Finance
FFC,Flaherty & Crumrine Preferred and Income Securities Fund Incorporated,16.54,0.0,140749,Finance
VHCPU,Vine Hill Capital Investment Corp. II Units,10.05,0.0,216166,Finance
VLT,Invesco High Income Trust II,11.27,0.0,43162,Finance
KFIIU,K&F Growth Acquisition Corp. II Unit,10.46,0.0,1,Finance
CGCTW,Cartesian Growth Corporation III Warrant,0.87,0.0,1200,Finance
MMD,NYLI MacKay DefinedTerm Muni Opportunities Fund Common Shares,15.24,0.0,31785,Finance
CHW,Calamos Global Dynamic Income Fund Common Stock,7.83,0.0,194404,Finance
MMU,Western Asset Managed Municipals Fund Inc. Common Stock,10.56,0.0,183867,Finance
DSM,BNY Mellon Strategic Municipal Bond Fund Inc. Common Stock,6.18,0.0,122164,Finance
BGB,Blackstone Strategic Credit 2027 Term Fund Common Shares of Beneficial Interest,11.94,0.0,63335,Finance
BFZ,BlackRock California Municipal Income Trust,10.98,0.0,161906,Finance
HERZ,Herzfeld Credit Income Fund Inc. Common Stock,1.905,0.0,77722,Finance
HEQ,John Hancock Diversified Income Fund Common Shares of Beneficial Interest,11.06,0.0,86691,Finance
KF,Korea Fund Inc. (The) New Common Stock,40.32,0.0,11136,Finance
VGI,Virtus Global Multi-Sector Income Fund Common Shares of Beneficial Interest,7.85,0.0,84853,Finance
VFL,abrdn National Municipal Income Fund Common Stock,10.29,0.0,44871,Finance
VCICW,Vine Hill Capital Investment Corp. Warrant,1.6,0.0,7906,Finance
