symbol,name,price,marketCap,volume,industry
AMPH,Amphastar Pharmaceuticals Inc. Common Stock,17.5,771626083.0,1219639,Health Care
SLDB,Solid Biosciences Inc. Common Stock,7.72,759750498.0,1010969,Health Care
QDEL,QuidelOrtho Corporation Common Stock,11.12,758283798.0,3052915,Health Care
GYRE,Gyre Therapeutics Inc. Common Stock,7.3,708306751.0,50370,Health Care
EHAB,Enhabit Inc. Common Stock,13.79,706401107.0,3401722,Health Care
ACRS,Aclaris Therapeutics Inc. Common Stock,4.88,681558758.0,949351,Health Care
STRO,Sutro Biopharma Inc. Common Stock,40.91,677792257.0,224717,Health Care
IRWD,Ironwood Pharmaceuticals Inc. Class A Common Stock,4.09,673268831.0,1863792,Health Care
CYRX,CryoPort Inc. Common Stock,13.04,657246162.0,493787,Health Care
ZVRA,Zevra Therapeutics Inc. Common Stock,11.05,653221678.0,1122284,Health Care
AVR,Anteris Technologies Global Corp. Common Stock,6.7,651454762.0,565997,Health Care
BBOT,BridgeBio Oncology Therapeutics Inc. Common Stock  ,8.13,651316454.0,224461,Health Care
CLYM,Climb Bio Inc. Common Stock,11.17,639600042.0,310860,Health Care
CADL,Candel Therapeutics Inc. Common Stock,8.72,638916484.0,2830480,Health Care
CBLL,CeriBell Inc. Common Stock,16.75,634364224.0,1167555,Health Care
PSNL,Personalis Inc. Common Stock,6.04,632515432.0,1482632,Health Care
TLRY,Tilray Brands Inc. Common Stock ,5.41,630387266.0,2802559,Health Care
EIKN,Eikon Therapeutics Inc. Common Stock,11.53,624217539.0,407709,Health Care
TRAX,First Tracks Biotherapeutics Inc. Ordinary Shares ,17.81,621433306.0,1004581,Health Care
KYTX,Kyverna Therapeutics Inc. Common Stock,10.23,619224897.0,616840,Health Care
ARVN,Arvinas Inc. Common Stock,9.57,617432207.0,1695928,Health Care
SIBN,SI-BONE Inc. Common Stock,13.9,614400475.0,3354706,Health Care
ALT,Altimmune Inc. Common Stock,3.08,598134023.0,2436654,Health Care
PRME,Prime Medicine Inc. Common Stock,3.3,596037588.0,3057354,Health Care
CRMD,CorMedix Inc. Common Stock,7.51,589101598.0,1190650,Health Care
IMMX,Immix Biopharma Inc. Common Stock,10.66,580025812.0,921360,Health Care
CSTL,Castle Biosciences Inc. Common Stock,18.63,565047006.0,571246,Health Care
CABA,Cabaletta Bio Inc. Common Stock,3.63,552501692.0,4022498,Health Care
RIGL,Rigel Pharmaceuticals Inc. Common Stock,29.37,543406090.0,1230905,Health Care
FDMT,4D Molecular Therapeutics Inc. Common Stock,10.34,540536466.0,459025,Health Care
PROK,ProKidney Corp. Class A Ordinary Shares,1.78,537500115.0,976822,Health Care
NPCE,Neuropace Inc. Common Stock,15.8,536417094.0,259966,Health Care
AVTX,Avalo Therapeutics Inc. Common Stock,19.94,532683880.0,1708777,Health Care
TCMD,Tactile Systems Technology Inc. Common Stock,23.53,530748798.0,362637,Health Care
RGNX,REGENXBIO Inc. Common Stock,10.24,528560466.0,1024467,Health Care
TECX,Tectonic Therapeutic Inc. Common Stock,27.96,527582441.0,237596,Health Care
MDXG,MiMedx Group Inc Common Stock,3.54,527267888.0,1422400,Health Care
DNA,Ginkgo Bioworks Holdings Inc. Class A Common Stock,8.34,518209628.0,1320949,Health Care
AQST,Aquestive Therapeutics Inc. Common Stock,4.16,517023695.0,1401910,Health Care
CTNM,Contineum Therapeutics Inc. Class A Common Stock,13.66,510697910.0,126496,Health Care
AURA,Aura Biosciences Inc. Common Stock,7.93,509104240.0,478478,Health Care
CBIO,Crescent Biopharma Inc. Common Stock,18.46,508977920.0,297059,Health Care
STTK,Shattuck Labs Inc. Common Stock,6.62,507625023.0,1085587,Health Care
OCGN,Ocugen Inc. Common Stock,1.47,497627128.0,6725190,Health Care
XOMA,XOMA Royalty Corporation Common Stock,41.75,497481728.0,83694,Health Care
FBRX,Forte Biosciences Inc. Common Stock,24.29,497430465.0,262233,Health Care
OVID,Ovid Therapeutics Inc. Common Stock,2.87,496616566.0,4826779,Health Care
PRTA,Prothena Corporation plc Ordinary Shares,9.43,493691025.0,495131,Health Care
ASMB,Assembly Biosciences Inc. Common Stock,30.82,489810179.0,60760,Health Care
UPB,Upstream Bio Inc. Common Stock,8.95,487058875.0,467509,Health Care
FULC,Fulcrum Therapeutics Inc. Common Stock,6.96,463592348.0,598670,Health Care
KIDS,OrthoPediatrics Corp. Common Stock,17.72,455138094.0,172401,Health Care
ANGO,AngioDynamics Inc. Common Stock,10.9,450376174.0,304830,Health Care
LYEL,Lyell Immunopharma Inc. Common Stock,19.25,449181175.0,52804,Health Care
FLGT,Fulgent Genetics Inc. Common Stock,15.8,448729843.0,505303,Health Care
LXEO,Lexeo Therapeutics Inc. Common Stock,5.7,447567346.0,1022851,Health Care
FBIOP,Fortress Biotech Inc. 9.375% Series A Cumulative Redeemable Perpetual Preferred Stock,13.34,443142420.0,14489,Health Care
AVIR,Atea Pharmaceuticals Inc. Common Stock,5.5,440149045.0,310190,Health Care
EBS,Emergent BioSolutions Inc. Common Stock,8.5,438568516.0,606492,Health Care
BBNX,Beta Bionics Inc. Common Stock,9.82,437595845.0,496515,Health Care
NRC,NRC Health Common Stock,19.19,432479196.0,102445,Health Care
CATX,Perspective Therapeutics Inc. Common Stock,3.77,429846936.0,1329773,Health Care
LRMR,Larimar Therapeutics Inc. Common Stock,4.13,429036530.0,912380,Health Care
EOLS,Evolus Inc. Common Stock,6.5,428055882.0,769095,Health Care
ENTA,Enanta Pharmaceuticals Inc. Common Stock,14.53,421651068.0,367030,Health Care
IVVD,Invivyd Inc. Common Stock,1.49,421377756.0,1028868,Health Care
PRTC,PureTech Health plc American Depositary Shares,17.26,417146653.0,18265,Health Care
IPSC,Century Therapeutics Inc. Common Stock,2.29,413011111.0,610441,Health Care
MNPR,Monopar Therapeutics Inc. Common Stock,61.35,410970030.0,152282,Health Care
XFOR,X4 Pharmaceuticals Inc. Common Stock,4.34,409347481.0,401014,Health Care
VSTM,Verastem Inc. Common Stock,4.63,406854949.0,2272752,Health Care
BNTC,Benitec Biopharma Inc. Common Stock,11.84,406755315.0,91825,Health Care
CYH,Community Health Systems Inc. Common Stock,2.87,404430963.0,870660,Health Care
TOI,The Oncology Institute Inc. Common Stock,4.02,401931391.0,1120296,Health Care
MOBI,Mobia Medical Inc. Common Stock,12.1,400333231.0,162945,Health Care
RCKT,Rocket Pharmaceuticals Inc. Common Stock,3.64,397464518.0,1996998,Health Care
NATR,Nature's Sunshine Products Inc. Common Stock,22.43,394428657.0,84515,Health Care
DCTH,Delcath Systems Inc. Common Stock,11.34,391475477.0,639036,Health Care
VNDA,Vanda Pharmaceuticals Inc. Common Stock,6.42,386070308.0,1359381,Health Care
MYGN,Myriad Genetics Inc. Common Stock,4.07,384404215.0,1175158,Health Care
CLPT,ClearPoint Neuro Inc. Common Stock,12.64,379023242.0,952534,Health Care
IRD,Opus Genetics Inc. Common Stock,5.18,369864805.0,1659855,Health Care
YDES,YD Bio Limited Ordinary Shares,5.19,367614686.0,1307,Health Care
VMD,Viemed Healthcare Inc. Common Shares,9.36,361320626.0,190735,Health Care
PBYI,Puma Biotechnology Inc Common Stock,7.08,360368148.0,346959,Health Care
CV,CapsoVision Inc. Common Stock,7.15,356425555.0,87256,Health Care
SRZN,Surrozen Inc. Common Stock,30.66,355973975.0,84678,Health Care
NMRA,Neumora Therapeutics Inc. Common Stock,1.9,352040064.0,821931,Health Care
GLSI,Greenwich LifeSciences Inc. Common Stock,24.71,342345659.0,96482,Health Care
DMAC,DiaMedica Therapeutics Inc. Common Stock,6.32,340542740.0,185459,Health Care
SBC,SBC Medical Group Holdings Incorporated Common Stock,3.31,339529681.0,185706,Health Care
REPL,Replimune Group Inc. Common Stock,4.09,337722012.0,9625138,Health Care
CMPX,Compass Therapeutics Inc. Common Stock,1.87,336764401.0,5213568,Health Care
IMRX,Immuneering Corporation Class A Common Stock,5.18,335131636.0,536796,Health Care
CCCC,C4 Therapeutics Inc. Common Stock,3.17,333550056.0,2314889,Health Care
LCTX,Lineage Cell Therapeutics Inc. Common Stock,1.33,331566732.0,1714390,Health Care
ARMP,Armata Pharmaceuticals Inc. Common Stock,9.0,330256395.0,68674,Health Care
ABEO,Abeona Therapeutics Inc. Common Stock,5.68,323092731.0,1282340,Health Care
PALI,Palisade Bio Inc. Common Stock,1.92,321454468.0,1808475,Health Care
USNA,USANA Health Sciences Inc. Common Stock,17.36,320412392.0,130177,Health Care
SIGA,SIGA Technologies Inc. Common Stock,4.45,319172232.0,629653,Health Care
ACHV,Achieve Life Sciences Inc. Common Shares,5.99,318907528.0,2833249,Health Care
NUS,Nu Skin Enterprises Inc. Common Stock,6.55,318006057.0,652645,Health Care
AKBA,Akebia Therapeutics Inc. Common Stock,1.18,316544727.0,4573636,Health Care
RZLT,Rezolute Inc. Common Stock (NV),3.3,315802361.0,1341619,Health Care
TENX,Tenax Therapeutics Inc. Common Stock,12.17,313687835.0,511826,Health Care
ORGO,Organogenesis Holdings Inc. Class A Common Stock,2.41,310105661.0,1186079,Health Care
NAGE,Niagen Bioscience Inc. Common Stock,3.85,306630659.0,1211379,Health Care
ZNTL,Zentalis Pharmaceuticals Inc. Common Stock,4.28,304677569.0,435693,Health Care
PRLD,Prelude Therapeutics Incorporated Common Stock,4.64,301204533.0,309929,Health Care
XOMAP,XOMA Royalty Corporation 8.625% Series A Cumulative Perpetual Preferred Stock,25.27,301110497.0,2079,Health Care
ELDN,Eledon Pharmaceuticals Inc. Common Stock,3.9,301032510.0,1330327,Health Care
XOMAO,XOMA Royalty Corporation Depositary Shares Rep Series B 8.375% Cumulative Preferred Stock,25.23,300633868.0,4472,Health Care
AIRS,AirSculpt Technologies Inc. Common Stock,4.16,293470033.0,2818461,Health Care
NVCT,Nuvectis Pharma Inc. Common Stock,10.9,289128310.0,96088,Health Care
EDIT,Editas Medicine Inc. Common Stock,2.93,286865406.0,1020997,Health Care
AVXL,Anavex Life Sciences Corp. Common Stock,3.06,283575579.0,1236124,Health Care
TARA,Protara Therapeutics Inc.  Common Stock,5.15,283561575.0,419526,Health Care
TLSI,TriSalus Life Sciences Inc. Common Stock,4.56,280049459.0,110547,Health Care
SI,Shoulder Innovations Inc. Common Stock,13.37,277132678.0,36391,Health Care
TRDA,Entrada Therapeutics Inc. Common Stock,7.12,276402786.0,1239319,Health Care
ALXO,ALX Oncology Holdings Inc. Common Stock,2.03,273162722.0,595774,Health Care
SGHT,Sight Sciences Inc. Common Stock,4.93,268241014.0,307573,Health Care
OABI,OmniAb Inc. Common Stock,1.85,268199271.0,956168,Health Care
CARL,Carlsmed Inc. Common Stock,9.83,267227891.0,163566,Health Care
CHRS,Coherus Oncology Inc. Common Stock,1.71,263712111.0,3463766,Health Care
ARTV,Artiva Biotherapeutics Inc. Common Stock,10.63,262738223.0,529479,Health Care
FATE,Fate Therapeutics Inc. Common Stock,2.25,261633809.0,2130090,Health Care
NERV,Minerva Neurosciences Inc Common Stock,5.6,260896770.0,80085,Health Care
RNAC,Cartesian Therapeutics Inc. Common Stock,8.7,255619172.0,107249,Health Care
IKT,Inhibikase Therapeutics Inc. Common Stock,1.92,253502661.0,592499,Health Care
VYGR,Voyager Therapeutics Inc. Common Stock,4.15,250748341.0,477346,Health Care
FHTX,Foghorn Therapeutics Inc. Common Stock,4.24,248947029.0,183804,Health Care
LENZ,LENZ Therapeutics Inc. Common Stock,7.91,248013257.0,2346680,Health Care
ACH,Accendra Health Inc. Common Stock,3.2,244601334.0,2479540,Health Care
SGMT,Sagimet Biosciences Inc. Series A Common Stock,7.65,244448903.0,793480,Health Care
FENC,Fennec Pharmaceuticals Inc. Common Stock,7.03,244030675.0,114126,Health Care
OBIO,Orchestra BioMed Holdings Inc. Ordinary Shares,4.06,243115703.0,137930,Health Care
SENS,Senseonics Holdings Inc. Common Stock,5.76,240785078.0,818992,Health Care
ALEC,Alector Inc. Common Stock,2.16,239814404.0,437344,Health Care
NKTX,Nkarta Inc. Common Stock,3.28,233834234.0,500883,Health Care
KROS,Keros Therapeutics Inc. Common Stock,11.65,230528301.0,343518,Health Care
RXST,RxSight Inc. Common Stock,5.52,228509282.0,722224,Health Care
CNTX,Context Therapeutics Inc. Common Stock,2.48,227860359.0,308846,Health Care
ELMD,Electromed Inc. Common Stock,27.2,225088514.0,68400,Health Care
MGNX,MacroGenics Inc. Common Stock,3.52,223731439.0,9610125,Health Care
UNCY,Unicycive Therapeutics Inc. Common Stock,8.17,218139221.0,422726,Health Care
TNYA,Tenaya Therapeutics Inc. Common Stock,1.0,216998876.0,9925456,Health Care
TKNO,Alpha Teknova Inc. Common Stock,3.99,213919972.0,77556,Health Care
DTIL,Precision BioSciences Inc. Common Stock,8.2,211578425.0,203625,Health Care
LFMD,LifeMD Inc. Common Stock,4.28,206991543.0,1121072,Health Care
OSUR,OraSure Technologies Inc. Common Stock,2.97,204480202.0,835596,Health Care
UTMD,Utah Medical Products Inc. Common Stock,63.82,203268296.0,7443,Health Care
LUCD,Lucid Diagnostics Inc. Common Stock,1.04,203063560.0,914199,Health Care
CRBP,Corbus Pharmaceuticals Holdings Inc. Common Stock,11.43,202727784.0,262947,Health Care
EMBC,Embecta Corp. Common Stock,3.41,202307379.0,2834481,Health Care
HUMA,Humacyte Inc. Common Stock,0.91,202037388.0,4690174,Health Care
CRBU,Caribou Biosciences Inc. Common Stock,2.03,201336567.0,1762471,Health Care
KPTI,Karyopharm Therapeutics Inc. Common Stock,8.915,201044394.0,275591,Health Care
ANIK,Anika Therapeutics Inc. Common Stock,14.68,195326560.0,50111,Health Care
ELTX,Elicio Therapeutics Inc. Common Stock,10.55,194078581.0,197792,Health Care
WHWK,Whitehawk Therapeutics Inc. Common Stock,3.92,193853655.0,56553,Health Care
SMTI,Sanara MedTech Inc. Common Stock,20.44,187327633.0,202199,Health Care
STXS,Stereotaxis Inc. Common Stock,1.92,187156873.0,389176,Health Care
CNTN,Canton Strategic Holdings Inc. Common Stock,3.27,185266006.0,323415,Health Care
SABS,SAB Biotherapeutics Inc. Common Stock,3.62,184442754.0,837043,Health Care
KRMD,KORU Medical Systems Inc. Common Stock (DE),4.0,183732000.0,226254,Health Care
HRTX,Heron Therapeutics Inc. Common Stock,0.9642,181885595.0,2364940,Health Care
INGN,Inogen Inc Common Stock,6.68,180857767.0,474484,Health Care
PDEX,Pro-Dex Inc. Common Stock,56.5,180390884.0,39575,Health Care
ABOS,Acumen Pharmaceuticals Inc. Common Stock,2.48,179124398.0,250217,Health Care
TNXP,Tonix Pharmaceuticals Holding Corp. Common Stock,13.28,178023725.0,533012,Health Care
APYX,Apyx Medical Corporation Common Stock,4.09,171264460.0,213624,Health Care
LFCR,Lifecore Biomedical Inc. Common Stock,4.56,171042896.0,163743,Health Care
HYPR,Hyperfine Inc. Class A Common Stock,1.73,170439941.0,820017,Health Care
INFU,InfuSystems Holdings Inc. Common Stock,8.41,169728122.0,609235,Health Care
PYXS,Pyxis Oncology Inc. Common Stock,2.6,163424206.0,390053,Health Care
BDTX,Black Diamond Therapeutics Inc. Common Stock,2.83,162164020.0,669122,Health Care
IMUX,Immunic Inc. Common Stock,11.9,162096159.0,155058,Health Care
KRRO,Korro Bio Inc. Common Stock,11.22,161821247.0,118104,Health Care
IMDX,Insight Molecular Diagnostics Inc. Common Stock,4.98,160794434.0,186334,Health Care
BDSX,Biodesix Inc. Common Stock,15.75,159210135.0,42340,Health Care
PLYX,Polaryx Therapeutics Inc. Common Stock,3.28,155286014.0,181798,Health Care
HURA,TuHURA Biosciences Inc. Common Stock,2.42,153860038.0,446400,Health Care
ANTX,AN2 Therapeutics Inc. Common Stock,4.27,153700977.0,189039,Health Care
TMCI,Treace Medical Concepts Inc. Common Stock,2.295,148883480.0,939587,Health Care
GALT,Galectin Therapeutics Inc. Common Stock,2.25,148111758.0,279268,Health Care
SPRO,Spero Therapeutics Inc. Common Stock,2.54,147069792.0,350945,Health Care
ASRT,Assertio Holdings Inc. Common Stock,22.55,145722159.0,111039,Health Care
EQ,Equillium Inc. Common Stock,2.27,143524282.0,98322,Health Care
AGEN,Agenus Inc. Common Stock,3.44,142892626.0,799654,Health Care
CVRX,CVRx Inc. Common Stock,5.27,139290922.0,864435,Health Care
SNWV,SANUWAVE Health Inc. Common Stock,16.04,137915272.0,158165,Health Care
NTHI,NeOnc Technologies Holdings Inc. Common Stock,5.51,137262266.0,71897,Health Care
DERM,Journey Medical Corporation Common Stock,5.01,137005694.0,364796,Health Care
OKUR,OnKure Therapeutics Inc. Class A Common Stock,3.39,136940677.0,112991,Health Care
RANI,Rani Therapeutics Holdings Inc. Class A Common Stock,1.1,136061515.0,1111658,Health Care
RCEL,Avita Medical Inc. Common Stock,4.38,134801898.0,237591,Health Care
AARD,Aardvark Therapeutics Inc. Common Stock,6.11,133298112.0,181895,Health Care
GNLX,Genelux Corporation Common Stock,2.97,133176036.0,137128,Health Care
VTVT,vTv Therapeutics Inc. Class A Common Stock,32.11,126477918.0,24856,Health Care
FONR,Fonar Corporation Common Stock,18.86,123639880.0,34309,Health Care
VRCA,Verrica Pharmaceuticals Inc. Common Stock,7.15,122828320.0,36628,Health Care
NAKA,Nakamoto Inc. Common Stock,0.1756,121167205.0,4915030,Health Care
TTRX,Turn Therapeutics Inc. Common Stock,3.98,118556399.0,32334,Health Care
GUTS,Fractyl Health Inc. Common Stock,0.734,116448339.0,2187347,Health Care
PEPG,PepGen Inc. Common Stock,1.68,116204281.0,903411,Health Care
HSDT,Solana Company Class A Common Stock (DE),2.1,115418327.0,371224,Health Care
BMEA,Biomea Fusion Inc. Common Stock,1.58,114233115.0,585174,Health Care
LAKE,Lakeland Industries Inc. Common Stock,10.565,113290661.0,95306,Health Care
CRDF,Cardiff Oncology Inc. Common Stock,1.64,112126629.0,614887,Health Care
EDSA,Edesa Biotech Inc. Common Shares,13.27,110780096.0,454830,Health Care
KLRS,Kalaris Therapeutics Inc. Common Stock,4.79,110133074.0,163036,Health Care
CGTX,Cognition Therapeutics Inc. Common Stock,1.18,105607658.0,678640,Health Care
CYPH,Cypherpunk Technologies Inc. Common Stock,1.07,104516239.0,2332222,Health Care
ALDX,Aldeyra Therapeutics Inc. Common Stock,1.71,103149026.0,718611,Health Care
COYA,Coya Therapeutics Inc. Common Stock,4.29,100631315.0,512545,Health Care
ANIX,Anixa Biosciences Inc. Common Stock,2.95,98907181.0,109302,Health Care
QTTB,Q32 Bio Inc. Common Stock,5.81,98516771.0,644558,Health Care
VANI,Vivani Medical Inc. Common Stock (DE),1.14,98308019.0,200490,Health Care
ISPR,Ispire Technology Inc. Common Stock,1.71,98152967.0,53112,Health Care
INO,Inovio Pharmaceuticals Inc. Common Stock,1.41,97907333.0,2997273,Health Care
LONA,LeonaBio Inc. Common Stock,10.17,95532037.0,28195,Health Care
CUE,Cue Biopharma Inc. Common Stock,29.26,95251834.0,157871,Health Care
NRXP,NRX Pharmaceuticals Inc. Common Stock,2.87,94904098.0,721957,Health Care
SPAI,Safe Pro Group Inc. Common Stock,4.45,92958658.0,163056,Health Care
QTI,QT Imaging Holdings Inc. Common Stock,7.59,91402575.0,119699,Health Care
FRMM,Forum Markets Incorporated Common Stock,4.47,90799606.0,201300,Health Care
UPXI,Upexi Inc. Common Stock,1.35,90336997.0,3540457,Health Care
XGN,Exagen Inc. Common Stock,3.71,89567273.0,878281,Health Care
FTLF,FitLife Brands Inc. Common Stock,9.5,89215184.0,12905,Health Care
DOMH,Dominari Holdings Inc. Common Stock,3.91,88419884.0,281202,Health Care
STIM,Neuronetics Inc. Common Stock,1.27,88376557.0,5093180,Health Care
MXCT,MaxCyte Inc. Common Stock,0.8222,88075439.0,772495,Health Care
STEX,Streamex Corp. Common Stock,0.8979,87744311.0,1017353,Health Care
CSBR,Champions Oncology Inc. Common Stock,6.27,87070399.0,8761,Health Care
BTMD,Biote Corp. Class A Common Stock,2.2,86451708.0,315273,Health Care
PARK,Park Dental Partners Inc. Common Stock,18.96,85605424.0,66146,Health Care
SKIN,SkinHealth Systems Inc. Class A Common Stock,0.6546,84836186.0,1146231,Health Care
EXOZ,eXoZymes Inc. Common Stock,9.88,83673621.0,973,Health Care
ATRA,Atara Biotherapeutics Inc. Common Stock,9.81,83505388.0,1084612,Health Care
ACRV,Acrivon Therapeutics Inc. Common Stock,1.89,80894557.0,274879,Health Care
GOSS,Gossamer Bio Inc. Common Stock,0.3406,79937553.0,2684723,Health Care
CTOR,Citius Oncology Inc. Common Stock,0.9033,79738992.0,51743,Health Care
ANVS,Annovis Bio Inc. Common Stock,2.28,78994859.0,679295,Health Care
SPRB,Spruce Biosciences Inc. Common Stock,56.665,77746817.0,36276,Health Care
STSS,Sharps Technology Inc. Common Stock,2.0,77329142.0,247557,Health Care
PAVM,PAVmed Inc. Common Stock,6.5,77272858.0,9991,Health Care
MCRB,Seres Therapeutics Inc. Common Stock,7.96,77084115.0,24009,Health Care
GANX,Gain Therapeutics Inc. Common Stock,1.8,76777268.0,358751,Health Care
CLNN,Clene Inc. Common Stock,6.5,76558996.0,436292,Health Care
ACET,Adicet Bio Inc. Common Stock,7.95,76305698.0,63830,Health Care
XBIT,XBiotech Inc. Common Stock,2.5,76219328.0,30657,Health Care
ICCC,ImmuCell Corporation Common Stock,8.38,75812176.0,9740,Health Care
PMVP,PMV Pharmaceuticals Inc. Common Stock,1.42,75727737.0,1438852,Health Care
TCRX,TScan Therapeutics Inc. Common Stock,1.15,75153440.0,894229,Health Care
FBIO,Fortress Biotech Inc. Common Stock,2.26,75075103.0,129112,Health Care
RLYB,Rallybio Corporation Common Stock,14.03,74214140.0,87759,Health Care
PLRX,Pliant Therapeutics Inc. Common Stock,1.18,73059304.0,269376,Health Care
OM,Outset Medical Inc. Common Stock,3.84,71183005.0,186611,Health Care
LNSR,LENSAR Inc. Common Stock,5.88,71173449.0,63400,Health Care
XTNT,Xtant Medical Holdings Inc. Common Stock,0.5044,70650430.0,268979,Health Care
ACTU,Actuate Therapeutics Inc. Common stock,2.89,68506557.0,122578,Health Care
MDAI,Spectral AI Inc. Class A Common Stock,2.15,68421568.0,852245,Health Care
MNOV,Medicinova Inc Common Stock,1.38,67925319.0,28980,Health Care
CPIX,Cumberland Pharmaceuticals Inc. Common Stock,4.53,67873475.0,80311,Health Care
SERA,Sera Prognostics Inc. Class A Common Stock,1.69,66178245.0,77321,Health Care
LFVN,Lifevantage Corporation Common Stock (Delaware),5.15,64971483.0,163932,Health Care
IMA,ImageneBio Inc. Common Stock,5.72,64516624.0,11329,Health Care
SCYX,SCYNEXIS Inc. Common Stock,0.78,61965254.0,535285,Health Care
PDSB,PDS Biotechnology Corporation Common Stock,1.1,59844688.0,1804808,Health Care
LIXT,Lixte Biotechnology Holdings Inc. Common Stock,5.07,58902976.0,40473,Health Care
DCGO,DocGo Inc. Common Stock,0.595,58773156.0,1153025,Health Care
CING,Cingulate Inc. Common Stock,4.79,58680202.0,408467,Health Care
KALA,KALA BIO Inc. Common Stock,3.12,58000276.0,168918,Health Care
FLNA,Filana Therapeutics Inc. Common Stock,1.2,57969475.0,480119,Health Care
SCLX,Scilex Holding Company Common Stock,6.81,57825528.0,33140,Health Care
BYSI,BeyondSpring Inc. Ordinary Shares,1.39,57156550.0,5472,Health Care
INKT,MiNK Therapeutics Inc. Common Stock,11.41,56843468.0,29941,Health Care
DWTX,Dogwood Therapeutics Inc. Common Stock,1.7,56782640.0,92935,Health Care
IBIO,iBio Inc. Common Stock,1.61,55615133.0,396909,Health Care
ECOR,electroCore Inc. Common Stock,6.695,55539758.0,70699,Health Care
SRTS,Sensus Healthcare Inc. Common Stock,3.37,55477139.0,56839,Health Care
TIL,Instil Bio Inc. Common Stock,8.1,54934006.0,10665,Health Care
LUNG,Pulmonx Corporation Common Stock,1.29,54485992.0,311611,Health Care
DXR,Daxor Corporation Common Stock,10.5,52905720.0,410,Health Care
COCH,Envoy Medical Inc. Class A Common Stock,0.68,52279155.0,156686,Health Care
ATYR,aTyr Pharma Inc. Common Stock,0.5302,51986753.0,12306906,Health Care
ESLA,Estrella Immunopharma Inc. Common Stock,1.21,51624926.0,8871,Health Care
MGX,Metagenomi Therapeutics Inc. Common Stock,1.35,50823527.0,189560,Health Care
TLSIW,TriSalus Life Sciences Inc. Warrant,0.8,49131484.0,2680,Health Care
ELUT,Elutia Inc. Class A Common Stock,1.05,46418648.0,142122,Health Care
SDEV,Stablecoin Development Corporation Common Stock,1.74,46327550.0,131788,Health Care
XLO,Xilio Therapeutics Inc. Common Stock,7.73,46247345.0,25637,Health Care
LABT,Lakewood-Amedex Biotherapeutics Inc. Common Stock,3.22,46111579.0,224639,Health Care
TELA,TELA Bio Inc. Common Stock,1.02,45661247.0,319192,Health Care
JAGX,Jaguar Health Inc. Common Stock,3.25,45643900.0,37981,Health Care
LITS,Lite Strategy Inc. Common Stock,1.25,45452499.0,285254,Health Care
TAOX,Tao Synergies Inc. Common Stock,6.03,45055744.0,134824,Health Care
TLPH,Talphera Inc. Common Stock,0.8575,44503948.0,124241,Health Care
ATOS,Atossa Therapeutics Inc. Common Stock,5.16,44434623.0,60152,Health Care
NTRB,Nutriband Inc. Common Stock,3.65,44369338.0,8155,Health Care
TELO,Telomir Pharmaceuticals Inc. Common Stock,1.26,43320023.0,80927,Health Care
MIRA,MIRA Pharmaceuticals Inc. Common Stock,1.02,42862529.0,67808,Health Care
ATNM,Actinium Pharmaceuticals Inc. (Delaware) Common Stock,1.3,40787488.0,139071,Health Care
HYPD,Hyperion DeFi Inc. Common Stock,3.43,40185108.0,365422,Health Care
PSTV,PLUS THERAPEUTICS Inc. Common Stock ,5.85,40142864.0,92815,Health Care
ALGS,Aligos Therapeutics Inc. Common Stock,6.47,40037803.0,95043,Health Care
RNXT,RenovoRx Inc. Common Stock,0.8728,39322002.0,126691,Health Care
DARE,Dare Bioscience Inc. Common Stock,2.63,38291490.0,625326,Health Care
BEAT,Heartbeam Inc. Common Stock,0.9116,37455703.0,855208,Health Care
TVRD,Tvardi Therapeutics Inc. Common Stock,3.98,37337749.0,27444,Health Care
ARAY,Accuray Incorporated Common Stock,0.3129,37223740.0,1693225,Health Care
NMTC,NeuroOne Medical Technologies Corporation Common Stock,4.39,37090390.0,30688,Health Care
INMB,INmune Bio Inc. Common stock,1.39,36953509.0,347005,Health Care
AGPU,Axe Compute Inc. Common Stock,6.66,36891518.0,288794,Health Care
CTSO,Cytosorbents Corporation Common Stock,0.5859,36735930.0,43314,Health Care
VERU,Veru Inc. Common Stock,2.27,36434226.0,57651,Health Care
BBLGW,Bone Biologics Corp Warrants,19.9,35725674.0,121,Health Care
NXTC,NextCure Inc. Common Stock,9.78,35326299.0,3924,Health Care
POCI,Precision Optics Corporation Inc. Common stock,4.54,35111711.0,20696,Health Care
YDESW,YD Bio Limited Warrants,0.495,35061516.0,202,Health Care
PTN,Palatin Technologies Inc. Common Stock,19.705,34921181.0,5695,Health Care
CRVO,CervoMed Inc. Common Stock,3.77,34905371.0,34292,Health Care
BOLD,Boundless Bio Inc. Common Stock,1.5,33696167.0,261931,Health Care
RMTI,Rockwell Medical Inc. Common Stock,0.8432,33281356.0,204282,Health Care
NEPH,Nephros Inc. Common Stock,3.01,32678203.0,18462,Health Care
NNVC,NanoViricides Inc. Common Stock,1.5,32392500.0,305443,Health Care
BTAI,BioXcel Therapeutics Inc. Common Stock,1.19,32218757.0,344628,Health Care
APLM,Apollomics Inc. Class A Ordinary Shares,14.65,32172162.0,15987,Health Care
QCLS,Q/C Technologies Inc. Common Stock,4.06,31884922.0,811325,Health Care
RNTX,Rein Therapeutics Inc. Common Stock,1.12,31403716.0,303338,Health Care
HOWL,Werewolf Therapeutics Inc. Common Stock,0.632,30713188.0,570591,Health Care
SNTI,Senti Biosciences Holdings Inc. Common Stock,0.97,30210162.0,157061,Health Care
MYO,Myomo Inc. Common Stock,0.7782,30068600.0,608421,Health Care
MOVE,Corvex Inc. Common Stock,15.09,29893999.0,76245,Health Care
LSTA,Lisata Therapeutics Inc. Common Stock,3.26,29445269.0,18016,Health Care
