symbol,name,price,marketCap,volume,industry
CALC,CalciMedica Inc. Common Stock,0.7045,21653795.0,164582,Health Care
ATOS,Atossa Therapeutics Inc. Common Stock,2.49,21442289.0,117307,Health Care
MRKR,Marker Therapeutics Inc. Common Stock,1.28,21341603.0,58388,Health Care
RVP,Retractable Technologies Inc. Common Stock,0.69,20656640.0,13805,Health Care
CLRB,Cellectar Biosciences Inc.  Common Stock,2.52,20139366.0,13815,Health Care
DARE,Dare Bioscience Inc. Common Stock,1.34,20072533.0,1118477,Health Care
NXTC,NextCure Inc. Common Stock,5.4,19505318.0,933105,Health Care
LGVN,Longeveron Inc. Class A Common Stock,0.6022,19028287.0,251933,Health Care
NMTC,NeuroOne Medical Technologies Corporation Common Stock,2.16,18618932.0,50389,Health Care
RKTO,Rocket One Inc. Common Stock,0.8331,18596730.0,594296,Health Care
YDESW,YD Bio Limited Warrants,0.26,18416150.0,66,Health Care
QNCX,Quince Therapeutics Inc. Common Stock,18.82,18405264.0,26904,Health Care
ALLR,Allarity Therapeutics Inc. Common Stock,1.17,18089047.0,51747,Health Care
HOWL,Werewolf Therapeutics Inc. Common Stock,0.368,17883629.0,326727,Health Care
NEUP,Neuphoria Therapeutics Inc. Common Stock,3.3,17835018.0,71088,Health Care
LPCN,Lipocine Inc. Common Stock,2.15,17725144.0,31398,Health Care
SCNX,Scienture Holdings Inc. Common Stock,0.416,16902419.0,420505,Health Care
TVGN,Tevogen Bio Holdings Inc. Common Stock,3.89,16413244.0,15175,Health Care
OSRH,OSR Health Inc. Common Stock,0.4628,16252931.0,790598,Health Care
IRIX,IRIDEX Corporation Common Stock,0.9256,16111473.0,57583,Health Care
KTTA,Pasithea Therapeutics Corp. Common Stock,0.4732,15811717.0,889088,Health Care
CYCN,Cyclerion Therapeutics Inc. Common Stock,3.65,15805646.0,20261,Health Care
PASG,Passage Bio Inc. Common Stock,4.81,15429566.0,80701,Health Care
ICU,SeaStar Medical Holding Corporation Common Stock,3.85,15388458.0,36757,Health Care
HIND,Vyome Holdings Inc. Common Stock,2.19,15370576.0,6567,Health Care
TPST,Tempest Therapeutics Inc. Common Stock,0.9524,15218791.0,97479,Health Care
GTBP,GT Biopharma Inc. Common Stock,0.341,15119453.0,404646,Health Care
PTN,Palatin Technologies Inc. Common Stock,8.48,15088252.0,11338,Health Care
COSM,Cosmos Health Inc. Common Stock,0.2303,14296655.0,3735848,Health Care
MODD,Modular Medical Inc. Common Stock,2.64,14290742.0,64123,Health Care
AIXC,AIxCrypto Holdings Inc. Common Stock,0.6917,13996545.0,118680,Health Care
KALA,KALA BIO Inc. Common Stock,0.7499,13940481.0,78873,Health Care
SNTI,Senti Biosciences Holdings Inc. Common Stock,0.4338,13510594.0,161256,Health Care
NAII,Natural Alternatives International Inc. Common Stock,2.15,13491742.0,7673,Health Care
BFRI,Biofrontera Inc. Common Stock,1.05,13443511.0,187506,Health Care
CTXR,Citius Pharmaceuticals Inc. Common Stock,0.4806,13193705.0,311717,Health Care
CODX,Co-Diagnostics Inc. Common Stock,2.44,12880655.0,93971,Health Care
COCP,Cocrystal Pharma Inc. Common Stock,0.93,12822331.0,16491,Health Care
AEON,AEON Biopharma Inc. Class A Common Stock,0.289,12761896.0,562362,Health Care
INTS,Intensity Therapeutics Inc. Common stock,4.7,12703254.0,24618,Health Care
PHIO,Phio Pharmaceuticals Corp. Common Stock,1.08,12546630.0,566751,Health Care
INAB,IN8bio Inc. Common Stock,1.26,12407332.0,54603,Health Care
XCUR,Exicure Inc. Common Stock,1.89,12046741.0,530368,Health Care
LNAI,Lunai Bioworks Inc. Common Stock,2.64,11969470.0,17899,Health Care
BFRG,Bullfrog AI Holdings Inc. Common Stock,0.6414,11892615.0,146125,Health Care
KPRX,Kiora Pharmaceuticals Inc.  Common Stock,2.6,11523044.0,9637,Health Care
OABIW,OmniAb Inc. Warrant,0.0793,11496326.0,40,Health Care
MBRX,Moleculin Biotech Inc. Common Stock,2.14,11419789.0,73880,Health Care
ADGM,Adagio Medical Holdings Inc Common Stock,0.5103,11333997.0,85112,Health Care
NXL,Nexalin Technology Inc. Common Stock,0.4913,10814153.0,202601,Health Care
BIVI,BioVie Inc. Class A Common Stock,1.425,10747121.0,684271,Health Care
TOVX,Theriva Biologics Inc. Common Stock,0.229,10509421.0,360779,Health Care
BCDA,BioCardia Inc. Common Stock,0.9048,10291850.0,242908,Health Care
SINT,SiNtx Technologies Inc. Common Stock,1.57,9981479.0,10294,Health Care
FEMY,Femasys Inc. Common Stock,3.27,9873876.0,14591,Health Care
AMS,American Shared Hospital Services Common Stock,1.47,9738750.0,14333,Health Care
VTGN,Vistagen Therapeutics Inc. Common Stock,0.2311,9482600.0,540756,Health Care
HWH,HWH International Inc. Common Stock,1.21,9348944.0,4963,Health Care
TRAW,Traws Pharma Inc. Common Stock,0.6107,9299940.0,184281,Health Care
CRIS,Curis Inc. Common Stock,4.52,8809186.0,15894,Health Care
MTVA,MetaVia Inc. Common Stock,1.68,8676142.0,144580,Health Care
BOLT,Bolt Biotherapeutics Inc. Common Stock,4.475,8599012.0,20733,Health Care
ASBP,Aspire Biopharma Holdings Inc. Common Stock,6.58,8522640.0,55692,Health Care
RNAZ,TransCode Therapeutics Inc. Common Stock,8.73,8296136.0,14407,Health Care
APRE,Aprea Therapeutics Inc. Common stock,0.669,8284077.0,22856,Health Care
BRTX,BioRestorative Therapies Inc. Common Stock (NV),0.322,8203971.0,184912,Health Care
MTEX,Mannatech Incorporated Common Stock,4.2501,8201290.0,1619,Health Care
HSCS,HeartSciences Inc. Common Stock,2.57,8184679.0,14878,Health Care
CNSP,CNS Pharmaceuticals Inc. Common Stock,5.5,8037970.0,16103,Health Care
JUNS,Jupiter Neurosciences Inc. Common Stock,0.165,7956978.0,656368,Health Care
SNGX,Soligenix Inc. Common Stock,0.3584,7749210.0,357513,Health Care
LIMN,Liminatus Pharma Inc. Class A Common Stock,0.1141,7662997.0,8849848,Health Care
IMNN,Imunon Inc. Common Stock,1.77,7437749.0,15334,Health Care
NVNO,enVVeno Medical Corporation Common Stock,11.0299,7364322.0,5320,Health Care
MGRX,Mangoceuticals Inc. Common Stock,0.4211,7229201.0,224915,Health Care
WGRX,Wellgistics Health Inc. Common Stock,2.71,7173907.0,10180,Health Care
TOIIW,The Oncology Institute Inc. Warrant,0.0698,6978809.0,4,Health Care
PMCB,PharmaCyte  Biotech Inc. Common Stock,0.6233,6691530.0,77083,Health Care
ACXP,Acurx Pharmaceuticals Inc. Common Stock,1.55,6661494.0,64280,Health Care
CVKD,Cadrenal Therapeutics Inc. Common Stock,2.09,6476057.0,30808,Health Care
ACON,Aclarion Inc. Common Stock,2.63,6475718.0,19696,Health Care
XBIO,Xenetic Biosciences Inc. Common Stock,2.81,6437867.0,8856,Health Care
ERNA,Ernexa Therapeutics Inc. Common Stock,5.43,6333188.0,250193,Health Care
AIDX,20/20 Biolabs Inc. Common Stock,0.512,6272613.0,144014,Health Care
JAGX,Jaguar Health Inc. Common Stock,1.265,6211659.0,67670,Health Care
PCSA,Processa Pharmaceuticals Inc. Common Stock,2.22,6145031.0,43061,Health Care
BCAB,BioAtla Inc. Common Stock,3.7,6140350.0,18936,Health Care
PULM,Pulmatrix Inc. Common Stock,1.68,6135839.0,12768,Health Care
NDRA,ENDRA Life Sciences Inc. Common Stock,4.945,6135514.0,2000,Health Care
HCWB,HCW Biologics Inc. Common Stock,3.83,6115932.0,80437,Health Care
NTRBW,Nutriband Inc. Warrant,0.5,6077992.0,1683,Health Care
APVO,Aptevo Therapeutics Inc. Common Stock,4.755,5925229.0,26468,Health Care
ADIL,Adial Pharmaceuticals Inc Common Stock,2.73,5852085.0,38365,Health Care
CURX,Curanex Pharmaceuticals Inc Common Stock,0.2015,5715510.0,46816,Health Care
VVOS,Vivos Therapeutics Inc. Common Stock,0.4112,5713460.0,70964,Health Care
SNOA,Sonoma Pharmaceuticals Inc. Common Stock,1.17,5599387.0,14335,Health Care
VSEE,VSee Health Inc. Common Stock,0.092,5122543.0,1621914,Health Care
ENVB,Enveric Biosciences Inc. Common Stock,1.27,5116166.0,84763,Health Care
DRMA,Dermata Therapeutics Inc. Common Stock,1.27,5108122.0,16220,Health Care
BGMS,Bio Green Med Solution Inc. Common Stock,0.9,4967510.0,18266,Health Care
BMRA,Biomerica Inc. Common Stock,1.6,4944430.0,4685,Health Care
ELAB,PMGC Holdings Inc. Common Stock,1.07,4861814.0,992433,Health Care
CDIO,Cardio Diagnostics Holdings Inc. Common stock,1.63,4823934.0,23959,Health Care
LUCY,Innovative Eyewear Inc. Common Stock,0.7508,4807919.0,430158,Health Care
ALZN,Alzamend Neuro Inc. Common Stock,1.26,4793974.0,57051,Health Care
FBLG,FibroBiologics Inc. Common Stock,0.781,4748917.0,74459,Health Care
INBS,Intelligent Bio Solutions Inc. Common Stock,1.97,4711937.0,304316,Health Care
REVB,Revelation Biosciences Inc. Common Stock,1.16,4533767.0,22177,Health Care
MBIO,Mustang Bio Inc. Common Stock,0.652,4389342.0,14016,Health Care
XAIR,Beyond Air Inc. Common Stock,5.98,4308775.0,9573,Health Care
ALBT,Avalon GloboCare Corp. Common Stock,0.2862,4157720.0,508083,Health Care
ENSC,Ensysce Biosciences Inc. Common Stock,0.2697,4144083.0,265103,Health Care
NXGL,NexGel Inc Common Stock,0.4455,4109845.0,24913,Health Care
SXTP,60 Degrees Pharmaceuticals Inc. Common Stock,1.51,4015525.0,14542,Health Care
ARTL,Artelo Biosciences Inc. Common Stock,1.12,3903805.0,68355,Health Care
LIMNW,Liminatus Pharma Inc. Warrants,0.0555,3727400.0,700,Health Care
ONCO,Onconetix Inc. Common Stock,1.0,3691492.0,1094275,Health Care
GNPX,Genprex Inc. Common Stock,7.21,3640589.0,27539,Health Care
ISPC,iSpecimen Inc. Common Stock,2.32,3531873.0,107347,Health Care
LABT,Lakewood-Amedex Biotherapeutics Inc. Common Stock,1.93,3379023.0,35103,Health Care
BIAF,bioAffinity Technologies Inc. Common Stock,0.6989,3314925.0,83133,Health Care
FEED,ENvue Medical Inc. Common Stock,0.3733,3245946.0,251723,Health Care
COCHW,Envoy Medical Inc Warrant,0.0407,3129061.0,11,Health Care
GOVX,GeoVax Labs Inc. Common Stock,0.985,2849181.0,166638,Health Care
DCOY,Decoy Therapeutics Inc. Common Stock,5.305,2822090.0,20481,Health Care
SNYR,Synergy CHC Corp. Common Stock,0.1852,2759458.0,135920,Health Care
GRI,GRI Bio Inc. Common Stock,1.47,2603132.0,28842,Health Care
GCTK,GlucoTrack Inc. Common Stock,0.409,2560045.0,1910159,Health Care
TNON,Tenon Medical Inc. Common Stock,0.209,2476582.0,626332,Health Care
OGEN,Oragenics Inc. Common Stock,0.5411,2441420.0,9457,Health Care
BFRGW,Bullfrog AI Holdings Inc. Warrants,0.1249,2315852.0,60,Health Care
AMIX,Autonomix Medical Inc. Common Stock,4.23,2298167.0,24225,Health Care
XXII,22nd Century Group Inc. Common Stock,4.3199,2230485.0,4461,Health Care
HUMAW,Humacyte Inc. Warrant,0.0098,2175787.0,206,Health Care
MTNB,Matinas Biopharma Holdings Inc. Common Stock,0.3147,2016028.0,847906,Health Care
BBLG,Bone Biologics Corp Common Stock,1.12,2010691.0,11823,Health Care
IVF,INVO Fertility Inc. Common Stock,1.04,1857476.0,188785,Health Care
BEATW,Heartbeam Inc. Warrant,0.0328,1820624.0,6628,Health Care
SCLXW,Scilex Holding Company Warrant,0.21,1783166.0,35,Health Care
SHPH,Shuttle Pharmaceuticals Holdings Inc. Common Stock,3.03,1772941.0,3101781,Health Care
VIVS,VivoSim Labs Inc. Common Stock,0.5049,1764156.0,2224978,Health Care
AEMD,Aethlon Medical Inc. Common Stock,0.6016,1584350.0,65771,Health Care
VBIO,Valion Bio Inc. Common Stock,0.3611,1499020.0,1091169,Health Care
SABSW,SAB Biotherapeutics Inc. Warrant,0.0173,1322829.0,4337,Health Care
BJDX,Bluejay Diagnostics Inc. Common Stock,1.21,1252005.0,748294,Health Care
NUWE,Nuwellis Inc. Common Stock,3.0,1092885.0,61510,Health Care
PFSA,Profusa Inc. Common Stock,1.95,1033500.0,178444,Health Care
SKYAW,SkyAI Inc. Warrant,0.0244,1032661.0,721,Health Care
LUCYW,Innovative Eyewear Inc. Series A Warrants 8/16/27,0.0639,409198.0,452,Health Care
JSPRW,Japer Therapeutics Inc. Warrants,0.013,364127.0,1,Health Care
RCKTW,Rocket Pharmaceuticals Inc. Warrant,0.003,327581.0,21431,Health Care
KTTAW,Pasithea Therapeutics Corp. Warrant,0.0098,327462.0,880,Health Care
CINGW,Cingulate Inc. Warrants,0.0218,293625.0,79,Health Care
BFRIW,Biofrontera Inc. Warrants,0.0202,258628.0,96,Health Care
NXGLW,NexGel Inc Warrant,0.026,239856.0,15076,Health Care
HSCSW,HeartSciences Inc. Warrant,0.0733,233439.0,6,Health Care
TVGNW,Tevogen Bio Holdings Inc. Warrant,0.0528,222781.0,382500,Health Care
ICUCW,SeaStar Medical Holding Corporation Warrant,0.0256,102323.0,5408,Health Care
PIIIW,P3 Health Partners Inc. Warrant,0.0131,94909.0,11320,Health Care
ERNAW,Ernexa Therapeutics Inc. Warrants,0.0684,79777.0,5778,Health Care
SXTPW,60 Degrees Pharmaceuticals Inc. Warrant,0.029,77119.0,83,Health Care
CDTTW,CDT Equity Inc. Warrant,0.011,69419.0,38,Health Care
APLMW,Apollomics Inc. Warrant,0.0199,43701.0,75236,Health Care
REVBW,Revelation Biosciences Inc. Warrant,0.01,39084.0,1610,Health Care
ASBPW,Aspire Biopharma Holdings Inc. Warrant,0.021,27200.0,100,Health Care
EMIS,Emmis Acquisition Corp. Class A Ordinary Shares,10.18,0.0,6,Health Care
BKHA,Black Hawk Acquisition Corporation Class A Ordinary Shares,12.11,0.0,29,Health Care
IPEX,Inflection Point Acquisition Corp. V Class A Ordinary Shares,10.54,,34,Health Care
