symbol,name,price,marketCap,volume,industry
PACB,Pacific Biosciences of California Inc. Common Stock,1.5,465902532.0,2734648,Industrials
MTW,Manitowoc Company Inc. (The) Common Stock,12.69,455692621.0,157270,Industrials
ELMT,The Elmet Group Co. Common Stock,14.61,438005798.0,176901,Industrials
FSTR,L.B. Foster Company Common Stock,41.83,437486584.0,56498,Industrials
RLGT,Radiant Logistics Inc. Common Stock,9.31,436002810.0,80644,Industrials
ALTO,Alto Ingredients Inc. Common Stock,5.62,435466560.0,2568236,Industrials
FWRD,Forward Air Corporation Common Stock,12.79,404484338.0,506682,Industrials
ULH,Universal Logistics Holdings Inc. Common Stock,15.12,398709728.0,30161,Industrials
PCTTW,PureCycle Technologies Inc. Warrant,1.98,397420749.0,9188,Industrials
GTN,Gray Media Inc. Common Stock,3.81,391433514.0,653459,Industrials
MCFT,MasterCraft Boat Holdings Inc. Common Stock,23.8,387461382.0,98795,Industrials
CMCO,Columbus McKinnon Corporation Common Stock,13.18,380011019.0,548939,Industrials
CEPL,Capstone Energy Plus Inc. Common Stock,11.69,376777269.0,518534,Industrials
RR,Richtech Robotics Inc. Class B Common Stock,1.67,373405275.0,5499118,Industrials
GEVO,Gevo Inc. Common Stock,1.43,348078200.0,2256344,Industrials
FWDI,Forward Industries Inc. Common Stock,4.54,339045833.0,1117930,Industrials
MSB,Mesabi Trust Common Stock,25.46,334035455.0,25117,Industrials
TWIN,Twin Disc Incorporated Common Stock,22.76,328263543.0,65893,Industrials
LAB,Standard BioTools Inc. Common Stock,0.8379,327089447.0,2517821,Industrials
CHSCP,CHS Inc. 8%  Cumulative Redeemable Preferred Stock,26.64,326926160.0,19391,Industrials
LODE,Comstock Inc. Common Stock,4.3,326426261.0,688216,Industrials
CHSCO,CHS Inc. Class B Cumulative Redeemable Preferred Stock,25.84,317108558.0,6873,Industrials
CHSCL,CHS Inc Class B Cumulative Redeemable Preferred Stock Series 4,25.43,312077036.0,28676,Industrials
MASS,908 Devices Inc. Common Stock,8.16,308559147.0,248331,Industrials
CHSCN,CHS Inc Preferred Class B Series 2 Reset Rate,24.87,305204715.0,16130,Industrials
PESI,Perma-Fix Environmental Services Inc. Common Stock,14.34,304058936.0,417266,Industrials
ESOA,Energy Services of America Corporation Common Stock,16.24,303033187.0,76804,Industrials
OFLX,Omega Flex Inc. Common Stock,29.68,299599477.0,106427,Industrials
CHSCM,CHS Inc Class B Reset Rate Cumulative Redeemable Preferred Stock Series 3,24.27,297841513.0,29399,Industrials
AIRJ,AirJoule Technologies Corporation Class A Common Stock,4.01,290326358.0,847697,Industrials
PAMT,PAMT CORP Common Stock,13.59,284618591.0,12649,Industrials
POWW,Outdoor Holding Company Common Stock,2.39,277630751.0,608083,Industrials
NNBR,NN Inc. Common Stock,3.42,264308941.0,1299487,Industrials
RAIL,FreightCar America Inc. Common Stock,7.9,258928504.0,113042,Industrials
TG,Tredegar Corporation Common Stock,7.38,258424124.0,91395,Industrials
SSP,E.W. Scripps Company (The) Class A Common Stock,2.81,257229715.0,801574,Industrials
FRD,Friedman Industries Inc. Common Stock,35.0,248762185.0,267330,Industrials
GENC,Gencor Industries Inc. Common Stock,15.5,227194381.0,27535,Industrials
NAUT,Nautilus Biotechnology Inc. Common Stock,1.75,222387996.0,551069,Industrials
SND,Smart Sand Inc. Common Stock,5.06,217507546.0,254197,Industrials
AIRO,AIRO Group Holdings Inc. Common Stock,6.87,216031574.0,800623,Industrials
ALTG,Alta Equipment Group Inc. Class A Common Stock,6.62,215385275.0,117727,Industrials
CMT,Core Molding Technologies Inc Common Stock,23.6,210033604.0,22322,Industrials
FF,FutureFuel Corp.  Common shares,4.72,207035753.0,184683,Industrials
PPIH,Perma-Pipe International Holdings Inc. Common Stock,25.14,204280425.0,67168,Industrials
FORR,Forrester Research Inc. Common Stock,10.31,200137720.0,153561,Industrials
CDXS,Codexis Inc. Common Stock,2.13,193609688.0,925055,Industrials
QTRX,Quanterix Corporation Common Stock,4.08,192192402.0,565227,Industrials
QSI,Quantum-Si Incorporated Class A Common Stock,0.8662,188623853.0,1208777,Industrials
INTT,inTest Corporation Common Stock,14.81,186082570.0,170626,Industrials
OWLT,Owlet Inc. Class A Common Stock,6.38,185428027.0,219060,Industrials
CBUS,Cibus Inc. Class A Common Stock,2.39,182432605.0,1630127,Industrials
TAYD,Taylor Devices Inc. Common Stock,55.96,180141508.0,39658,Industrials
AP,Ampco-Pittsburgh Corporation Common Stock,7.98,162204584.0,114766,Industrials
SMID,Smith-Midland Corporation Common Stock,29.51,156596409.0,10143,Industrials
SAFX,XCF Global Inc. Class A Common Stock,0.4578,152247563.0,2460668,Industrials
HURC,Hurco Companies Inc. Common Stock,22.6,146364877.0,21230,Industrials
SIF,SIFCO Industries Inc. Common Stock,22.86,142969366.0,58081,Industrials
OCC,Optical Cable Corporation Common Stock,16.03,141498285.0,146932,Industrials
SHIM,Shimmick Corporation Common Stock,3.71,136144609.0,52303,Industrials
ACNT,Ascent Industries Co. Common Stock,15.01,135663607.0,29574,Industrials
BOOM,DMC Global Inc. Common Stock,6.49,132842557.0,156269,Industrials
VATE,INNOVATE Corp. Common Stock,9.51,129734146.0,143207,Industrials
WRAP,Wrap Technologies Inc. Common Stock,2.19,122066768.0,2729748,Industrials
TGEN,Tecogen Inc. Common Stock,4.01,119970988.0,207532,Industrials
BNC,CEA Industries Inc. Common Stock,2.89,119252527.0,193166,Industrials
SEER,Seer Inc. Class A Common Stock,2.16,118760150.0,142605,Industrials
AMTX,Aemetis Inc. (DE) Common Stock,1.66,116808352.0,1548619,Industrials
CODA,Coda Octopus Group Inc. Common stock,10.0,112807540.0,114550,Industrials
BAER,Bridger Aerospace Group Holdings Inc. Common Stock,1.91,110087894.0,190441,Industrials
MNTS,Momentus Inc. Class A Common Stock,5.75,108305936.0,869561,Industrials
KEQU,Kewaunee Scientific Corporation Common Stock,36.31,104224587.0,1669,Industrials
EMPD,Empery Digital Inc. Common stock,3.65,102601905.0,334130,Industrials
HOVR,New Horizon Aircraft Ltd. Class A Ordinary Share,1.73,97532705.0,405286,Industrials
RPID,Rapid Micro Biosystems Inc. Class A Common Stock,2.07,95570248.0,293137,Industrials
ARQ,Arq Inc. Common Stock,2.22,95296293.0,103083,Industrials
GEOS,Geospace Technologies Corporation Common Stock (Texas),7.29,94300546.0,92145,Industrials
ATLX,Atlas Lithium Corporation Common Stock,3.19,94075930.0,298223,Industrials
AVD,American Vanguard Corporation Common Stock ($0.10 Par Value),2.64,90405691.0,81795,Industrials
NTIC,Northern Technologies International Corporation Common Stock,8.1,76921156.0,3345,Industrials
AIRJW,AirJoule Technologies Corporation Warrant,0.99,71676582.0,2364,Industrials
CVU,CPI Aerostructures Inc. Common Stock,5.27,69614956.0,27191,Industrials
SEV,Aptera Motors Corp. Class B Common Stock,1.84,67884590.0,228318,Industrials
CIRC,Circle8 Group Inc. Common Stock,0.71,63873854.0,3184571,Industrials
LNZA,LanzaTech Global Inc. Common Stock,5.75,58012687.0,51377,Industrials
FFAI,Faraday Future Intelligent Electric Inc. Class A Common Stock,0.1583,57666106.0,30695076,Industrials
FEAM,5E Advanced Materials Inc. Common Stock,1.32,54800094.0,75472,Industrials
MIND,MIND Technology Inc. Common Stock (DE),5.53,50262474.0,102084,Industrials
FTEK,Fuel Tech Inc. Common Stock,1.6,49864398.0,138589,Industrials
VGAS,Verde Clean Fuels Inc. Class A Common Stock,1.11,49450079.0,17812,Industrials
SYPR,Sypris Solutions Inc. Common Stock,2.02,46482483.0,25178,Industrials
UAVS,AgEagle Aerial Systems Inc. Common Stock,0.7894,46256567.0,385373,Industrials
TPCS,TechPrecision Corporation Common stock,4.56,45711579.0,14054,Industrials
ETS,Elite Express Holding Inc. Class A Common Stock,0.86,41896338.0,31886,Industrials
PRPO,Precipio Inc.  Common Stock,23.2,41467030.0,100846,Industrials
PPSI,Pioneer Power Solutions Inc. Common Stock,3.47,38504043.0,56950,Industrials
SLND,Southland Holdings Inc. Common Stock,0.6763,36668230.0,27318,Industrials
DAIO,Data I/O Corporation Common Stock,3.4,34898491.0,40744,Industrials
WKHS,Workhorse Group Inc. Common Stock,2.64,28758576.0,102583,Industrials
ELSE,Electro-Sensors Inc. Common Stock,7.7,27199657.0,862,Industrials
HBIO,Harvard Bioscience Inc. Common Stock,5.93,26745379.0,17830,Industrials
CLIR,ClearSign Technologies Corporation Common Stock (DE),3.71,23400658.0,10560,Industrials
VEEE,Twin Vee PowerCats Co. Common Stock,38.51,20384498.0,24971497,Industrials
HOVRW,New Horizon Aircraft Ltd. Warrant,0.35,19732050.0,41364,Industrials
SDST,Stardust Power Inc. Common Stock,1.7,17985536.0,156677,Industrials
ASTC,Astrotech Corporation (DE) Common Stock,8.86,17800183.0,60721,Industrials
TOMZ,TOMI Environmental Solutions Inc. Common Stock,0.7398,17252480.0,106331,Industrials
SKYQ,Sky Quarry Inc. Common Stock,3.4,16301796.0,4630087,Industrials
BAERW,Bridger Aerospace Group Holdings Inc. Warrant,0.23,13256657.0,49102,Industrials
BNGO,Bionano Genomics Inc. Common Stock,1.15,13196250.0,80175,Industrials
AIRI,Air Industries Group Common Stock,2.69,13048270.0,63607,Industrials
ARTW,Art's-Way Manufacturing Co. Inc. Common Stock,2.37,12279885.0,23222,Industrials
AQMS,Aqua Metals Inc. Common Stock,2.75,9776030.0,30904,Industrials
CVR,Chicago Rivet & Machine Co. Common Stock,9.85,9516400.0,3978,Industrials
FGI,FGI Industries Ltd. Ordinary Shares,4.74,9154225.0,25676,Industrials
YHGJ,Yunhong Green CTI Ltd. Common Stock,3.2,8349581.0,12523,Industrials
NVVE,Nuvve Holding Corp. Common Stock,15.8,8289502.0,387812,Industrials
SNES,SenesTech Inc. Common Stock,1.37,7265694.0,64866,Industrials
GDC,GD Culture Group Limited Common Stock,1.46,6077219.0,668359,Industrials
KITT,Nauticus Robotics Inc. Common stock,0.8701,5951635.0,307605,Industrials
FLYE,Fly-E Group Inc. Common Stock,2.04,3330067.0,8291,Industrials
GPACW,General Purpose Acquisition Corp. Warrant,0.28,2962324.0,1,Industrials
BNCWZ,CEA Industries Inc. Warrant,0.0706,2913228.0,4865,Industrials
FRGT,Freight Technologies Inc. Ordinary Shares,4.39,2511629.0,26913,Industrials
GWAV,Greenwave Technology Solutions Inc. Common Stock,2.99,2480597.0,8990,Industrials
FCUV,Focus Universal Inc. Common Stock,3.22,2263051.0,24100,Industrials
SGLY,Singularity Future Technology Ltd. Common Stock,0.244,1779612.0,10564230,Industrials
VGASW,Verde Clean Fuels Inc. Warrant,0.0296,1318669.0,57884,Industrials
FFAIW,Faraday Future Intelligent Electric Inc. Warrant,0.0036,1311421.0,831398,Industrials
SDSTW,Stardust Power Inc. Warrant,0.1102,1165886.0,833,Industrials
BNCWW,CEA Industries Inc. Warrant,0.0185,763381.0,6,Industrials
MNTSW,Momentus Inc. Warrant,0.0106,199660.0,459382,Industrials
LNZAW,LanzaTech Global Inc. Warrant,0.019,191694.0,13264,Industrials
KITTW,Nauticus Robotics Inc. Warrant,0.0215,147064.0,94029,Industrials
FGIWW,FGI Industries Ltd. Warrant,0.039,75320.0,3147,Industrials
