symbol,name,price,marketCap,volume,industry
V,Visa Inc.,315.97,605401460417.0,8380251,Real Estate
MA,Mastercard Incorporated Common Stock,517.72,461709069651.0,3546595,Real Estate
UBER,Uber Technologies Inc. Common Stock,73.84,151971284185.0,21197458,Real Estate
WELL,Welltower Inc. Common Stock,207.68,144909245430.0,3757516,Real Estate
PLD,Prologis Inc. Common Stock,135.15,125629898850.0,4635377,Real Estate
EQIX,Equinix Inc. Common Stock REIT,944.91,92842064016.0,699449,Real Estate
AMT,American Tower Corporation (REIT) Common Stock,186.64,86990070805.0,2800902,Real Estate
SPG,Simon Property Group Inc. Common Stock,192.83,62660739825.0,2370341,Real Estate
DLR,Digital Realty Trust Inc. Common Stock,179.65,61730514515.0,2092961,Real Estate
O,Realty Income Corporation Common Stock,64.94,60552667757.0,7132034,Real Estate
PSA,Public Storage Common Stock,306.48,53789215877.0,1441393,Real Estate
EBAY,eBay Inc. Common Stock,92.91,41623680000.0,4229458,Real Estate
MSCI,MSCI Inc. Common Stock,564.41,41469484045.0,540995,Real Estate
VTR,Ventas Inc. Common Stock,86.21,40946751961.0,1734087,Real Estate
CCI,Crown Castle Inc. Common Stock,89.73,39128600222.0,2770397,Real Estate
FICO,Fair Isaac Corporation Common Stock,1441.2,34188339521.0,198005,Real Estate
FISV,Fiserv Inc. Common Stock,61.29,32776513710.0,5432718,Real Estate
IRM,Iron Mountain Incorporated (Delaware)Common Stock REIT,107.14,31695783971.0,1292582,Real Estate
VICI,VICI Properties Inc. Common Stock,29.5,31535175471.0,10246001,Real Estate
EXR,Extra Space Storage Inc Common Stock,146.29,30887330037.0,889210,Real Estate
AGNCN,AGNC Investment Corp. Depositary Shares Each Representing a 1/1000th Interest in a Share of 7.00% Series C Fixed-To-Floating Rate Cumulative Redeemable Preferred Stock,25.6,28384529152.0,16712,Real Estate
AGNCO,AGNC Investment Corp. Depositary Shares each representing a 1/1000th interest in a share of 6.50% Series E Fixed-to-Floating Cumulative Redeemable Preferred Stock,25.41,28173862725.0,35789,Real Estate
AGNCL,AGNC Investment Corp. Depositary Shares Each Representing a 1/1000th Interest in a Share of 7.75% Series G Fixed-Rate Reset Cumulative Redeemable Preferred Stock,25.22,27963196297.0,14174,Real Estate
AGNCM,AGNC Investment Corp. Depositary Shares rep 6.875% Series D Fixed-to-Floating Cumulative Redeemable Preferred Stock,24.94,27652740510.0,27369,Real Estate
AGNCP,AGNC Investment Corp. Depositary Shares Each Representing a 1/1000th Interest in a Share of 6.125% Series F Fixed-to-Floating Rate Cumulative Redeemable Preferred Stock,24.889,27596193206.0,54960,Real Estate
FIS,Fidelity National Information Services Inc. Common Stock,51.62,26553518375.0,6173433,Real Estate
AVB,AvalonBay Communities Inc. Common Stock,176.71,24754150514.0,1108068,Real Estate
EQR,Equity Residential Common Shares of Beneficial Interest,62.18,23475879175.0,2416296,Real Estate
CPAY,Corpay Inc. Common Stock,325.6,22157176378.0,904203,Real Estate
BR,Broadridge Financial Solutions Inc. Common Stock,189.01,22066674622.0,2449934,Real Estate
GPN,Global Payments Inc. Common Stock,74.8,20936619260.0,4014516,Real Estate
SBAC,SBA Communications Corporation Class A Common Stock,195.93,20727158831.0,1188500,Real Estate
CSGP,CoStar Group Inc. Common Stock,48.42,20326391634.0,5632896,Real Estate
WY,Weyerhaeuser Company Common Stock,24.45,17620259250.0,7571847,Real Estate
SUI,Sun Communities Inc. Common Stock,135.44,16684126558.0,981157,Real Estate
ESS,Essex Property Trust Inc. Common Stock,255.34,16463175702.0,650592,Real Estate
NLY,Annaly Capital Management Inc. Common Stock,22.19,15941006997.0,10830411,Real Estate
WPC,W. P. Carey Inc. REIT,72.4,15867879112.0,1058525,Real Estate
KIM,Kimco Realty Corporation (HC) Common Stock,23.2,15638346373.0,6897176,Real Estate
MAA,Mid-America Apartment Communities Inc. Common Stock,132.14,15447300783.0,885604,Real Estate
AKAM,Akamai Technologies Inc. Common Stock,102.11,14807376170.0,2883344,Real Estate
REG,Regency Centers Corporation Common Stock,78.23,14308780267.0,1292351,Real Estate
OHI,Omega Healthcare Investors Inc. Common Stock,47.75,14113467500.0,2012336,Real Estate
GLPI,Gaming and Leisure Properties Inc. Common Stock,48.95,13863709117.0,2025362,Real Estate
LAMR,Lamar Advertising Company Class A Common Stock,136.02,13782991885.0,666847,Real Estate
ELS,Equity Lifestyle Properties Inc. Common Stock,67.53,13095928870.0,2506031,Real Estate
HST,Host Hotels & Resorts Inc. Common Stock,19.16,13072558796.0,11739208,Real Estate
UDR,UDR Inc. Common Stock,37.21,12226162818.0,3590462,Real Estate
DOC,Healthpeak Properties Inc. Common Stock,17.42,12107666428.0,5853352,Real Estate
AGNC,AGNC Investment Corp. Common Stock,10.54,11686442862.0,28284799,Real Estate
CPT,Camden Property Trust Common Stock,105.11,10869236953.0,1045115,Real Estate
Z,Zillow Group Inc. Class C Capital Stock,45.25,10856751774.0,5553451,Real Estate
ZG,Zillow Group Inc. Class A Common Stock,45.14,10830359670.0,1400258,Real Estate
AMH,American Homes 4 Rent Common Shares of Beneficial Interest,29.47,10720487148.0,5322083,Real Estate
EGP,EastGroup Properties Inc. Common Stock,188.12,10033230833.0,182911,Real Estate
AHR,American Healthcare REIT Inc. Common Stock,52.19,9813209607.0,2611808,Real Estate
ADC,Agree Realty Corporation Common Stock,81.06,9729493917.0,1587217,Real Estate
CART,Maplebear Inc. Common Stock,38.85,9347895198.0,9348279,Real Estate
FRT,Federal Realty Investment Trust Common Stock,106.54,9191848556.0,702449,Real Estate
BRX,Brixmor Property Group Inc. Common Stock,29.93,9176231457.0,3708345,Real Estate
CUBE,CubeSmart Common Shares,40.08,9101923873.0,2070495,Real Estate
CTRE,CareTrust REIT Inc. Common Stock,39.89,8911614081.0,2498871,Real Estate
ARE,Alexandria Real Estate Equities Inc. Common Stock,51.18,8869512476.0,2240540,Real Estate
LINE,Lineage Inc. Common Stock,39.0,8856132714.0,1169003,Real Estate
NNN,NNN REIT Inc. Common Stock,45.45,8632747593.0,1146223,Real Estate
BXP,BXP Inc. Common Stock,52.48,8324856428.0,3778351,Real Estate
REXR,Rexford Industrial Realty Inc. Common Stock,35.66,8267551227.0,2875341,Real Estate
FR,First Industrial Realty Trust Inc. Common Stock,60.52,8020368276.0,1075163,Real Estate
AMTM,Amentum Holdings Inc. Common Stock,30.3,7391235833.0,1529997,Real Estate
STAG,Stag Industrial Inc. Common Stock,38.36,7328152660.0,993356,Real Estate
EPRT,Essential Properties Realty Trust Inc. Common Stock,34.16,7169494583.0,2089450,Real Estate
HQY,HealthEquity Inc. Common Stock,80.04,6838320331.0,692795,Real Estate
STWD,STARWOOD PROPERTY TRUST INC. Starwood Property Trust Inc.,17.89,6629707812.0,4041037,Real Estate
HR,Healthcare Realty Trust Incorporated Common Stock,18.43,6429303694.0,3469246,Real Estate
RYN,Rayonier Inc. REIT Common Stock,21.1,6378494721.0,4088323,Real Estate
RHP,Ryman Hospitality Properties Inc. (REIT),94.95,5982422643.0,522527,Real Estate
WEX,WEX Inc. common stock,161.98,5557633904.0,681323,Real Estate
LYFT,Lyft Inc. Class A Common Stock,13.76,5477960590.0,22951058,Real Estate
RITM,Rithm Capital Corp. Common Stock,9.84,5469981364.0,16748817,Real Estate
ETSY,Etsy Inc. Common Stock,55.78,5368667700.0,2503007,Real Estate
KRG,Kite Realty Group Trust Common Stock,25.81,5337310399.0,2134331,Real Estate
SBRA,Sabra Health Care REIT Inc. Common Stock,20.63,5201766142.0,2516230,Real Estate
VNO,Vornado Realty Trust Common Stock,26.99,5146085245.0,1750517,Real Estate
EXLS,ExlService Holdings Inc. Common Stock,32.23,5040246909.0,2029798,Real Estate
OUT,OUTFRONT Media Inc. Common Stock,28.13,4952291254.0,1679776,Real Estate
MAC,Macerich Company (The) Common Stock,19.22,4933211757.0,2412007,Real Estate
FRMI,Fermi Inc. Common Stock,7.98,4899922516.0,6529291,Real Estate
LAUR,Laureate Education Inc. Common Stock,34.25,4888969328.0,4398526,Real Estate
PECO,Phillips Edison & Company Inc. Common Stock,38.61,4857138000.0,916332,Real Estate
GHC,Graham Holdings Company Common Stock,1077.53,4700008068.0,19621,Real Estate
LOPE,Grand Canyon Education Inc. Common Stock,166.52,4519927960.0,188015,Real Estate
EPR,EPR Properties Common Stock,57.8,4422856636.0,939910,Real Estate
DHCNL,Diversified Healthcare Trust 6.25% Senior Notes Due 2046,18.22,4398569585.0,28240,Real Estate
DHCNI,Diversified Healthcare Trust 5.625% Senior Notes due 2042,17.64,4258549257.0,2729,Real Estate
REGCP,Regency Centers Corporation 6.25% Series A Cumulative Redeemable Preferred Stock,23.08,4221483428.0,7468,Real Estate
MMS,Maximus Inc. Common Stock,77.28,4215513953.0,691953,Real Estate
NHI,National Health Investors Inc. Common Stock,85.66,4145291613.0,329875,Real Estate
SKT,Tanger Inc. Common Stock,35.91,4111972836.0,960975,Real Estate
REGCO,Regency Centers Corporation 5.875% Series B Cumulative Redeemable Preferred Stock,22.33,4084303507.0,1207,Real Estate
RCB,Ready Capital Corporation 6.20% Senior Notes due 2026,24.84,4081889436.0,1987,Real Estate
HHH,Howard Hughes Holdings Inc. Common Stock,67.46,4023067699.0,1002704,Real Estate
JOE,St. Joe Company (The) Common Stock,69.86,4020051155.0,238827,Real Estate
CUZ,Cousins Properties Incorporated Common Stock,23.05,3871984870.0,1855093,Real Estate
IRT,Independence Realty Trust Inc. Common Stock,16.31,3870041171.0,3083769,Real Estate
FOUR,Shift4 Payments Inc. Class A Common Stock,47.24,3837745241.0,1374926,Real Estate
BNL,Broadstone Net Lease Inc. Common Stock,19.27,3688729438.0,1428170,Real Estate
CDP,COPT Defense Properties Common Shares of Beneficial Interest,32.41,3669060261.0,1628263,Real Estate
LRN,Stride Inc. Common Stock,85.31,3632524540.0,553030,Real Estate
RELY,Remitly Global Inc. Common Stock,16.92,3564272211.0,2734832,Real Estate
CVSA,Covista Inc. Common Shares,103.13,3558863977.0,332254,Real Estate
COLD,Americold Realty Trust Inc. Common Stock,12.25,3489776056.0,4932362,Real Estate
KRC,Kilroy Realty Corporation Common Stock,29.41,3485174818.0,2177436,Real Estate
MPT,Medical Properties Trust Inc. common stock,5.51,3293327000.0,4546762,Real Estate
BXMT,Blackstone Mortgage Trust Inc. Common Stock,19.24,3246531472.0,1060395,Real Estate
PAY,Paymentus Holdings Inc. Class A Common Stock,25.78,3240947936.0,577093,Real Estate
RWTO,Redwood Trust Inc. 9.00% Senior Notes Due 2029,24.9542,3224668165.0,1169,Real Estate
RWTN,Redwood Trust Inc. 9.125% Senior Notes Due 2029,24.95,3224125427.0,5899,Real Estate
BFH,Bread Financial Holdings Inc. Common Stock,72.46,3124121305.0,614527,Real Estate
WU,Western Union Company (The) Common Stock,9.71,3043646195.0,8155195,Real Estate
APLE,Apple Hospitality REIT Inc. Common Shares,12.03,2834975605.0,3740687,Real Estate
LXP,LXP Industrial Trust Common Stock (Maryland REIT),47.77,2822110010.0,700195,Real Estate
FCPT,Four Corners Property Trust Inc. Common Stock,25.67,2817155228.0,672369,Real Estate
DBRG,DigitalBridge Group Inc.,15.38,2814767532.0,4596679,Real Estate
SLG,SL Green Realty Corp Common Stock,39.14,2780160503.0,1375744,Real Estate
AKR,Acadia Realty Trust Common Stock,20.74,2717756907.0,843438,Real Estate
DX,Dynex Capital Inc. Common Stock,13.42,2710615363.0,9718024,Real Estate
NSA,National Storage Affiliates Trust Common Shares of Beneficial Interest,33.75,2602546031.0,1861899,Real Estate
MFAO,MFA Financial Inc. 9.000% Senior Notes due 2029,25.23,2590331351.0,4282,Real Estate
MFAN,MFA Financial Inc. 8.875% Senior Notes due 2029,25.15,2582117855.0,48699,Real Estate
HIW,Highwoods Properties Inc. Common Stock,21.96,2414086868.0,2420267,Real Estate
IVT,InvenTrust Properties Corp. Common Stock,31.01,2409453463.0,427124,Real Estate
ADAMM,Adamas Trust Inc. 7.875% Series E Fixed-to-Floating Rate Cumulative Redeemable Preferred Stock,25.445,2302119607.0,15970,Real Estate
ADAMI,Adamas Trust Inc. 9.125% Senior Notes Due 2029,25.3,2291660060.0,7529,Real Estate
XMTR,Xometry Inc. Class A Common Stock,43.82,2270946260.0,665846,Real Estate
PMTU,PennyMac Mortgage Investment Trust 8.50% Senior Notes due 2028,25.79,2244158217.0,3374,Real Estate
PRDO,Perdoceo Education Corporation Common Stock,34.62,2163001273.0,692856,Real Estate
ADAML,Adamas Trust Inc. 6.875% Series F Fixed-to-Floating Rate Cumulative Redeemable Preferred Stock $0.01 par value per share,23.5,2126147014.0,2964,Real Estate
ARR,ARMOUR Residential REIT Inc.,17.27,2061777568.0,6048780,Real Estate
ADAMN,Adamas Trust Inc. 8.00% Series D Fixed-to-Floating Rate Cumulative Redeemable Preferred Stock,22.59,2043815363.0,6934,Real Estate
NTST,NetSTREIT Corp. Common Stock,20.91,2029814664.0,838290,Real Estate
CIMN,Chimera Investment Corporation 9.000% Senior Notes due 2029,25.15,2025347004.0,13435,Real Estate
GNL,Global Net Lease Inc. Common Stock,9.4,2013348409.0,2190840,Real Estate
UNIT,Uniti Group Inc. Common Stock,8.24,1969963358.0,2506483,Real Estate
TIC,TIC Solutions Inc. Common Stock,8.8,1946645237.0,2429264,Real Estate
UTI,Universal Technical Institute Inc Common Stock,35.17,1935071196.0,557905,Real Estate
DRH,Diamondrock Hospitality Company Common Stock,9.48,1931106165.0,2908706,Real Estate
LTC,LTC Properties Inc. Common Stock,38.77,1880723473.0,507725,Real Estate
STRA,Strategic Education Inc. Common Stock,82.18,1867983532.0,333451,Real Estate
ADAMZ,Adamas Trust Inc. 7.000% Series G Cumulative Redeemable Preferred Stock $0.01 par value per share,19.64,1776916057.0,2296,Real Estate
SMA,SmartStop Self Storage REIT Inc. Common Stock,31.86,1763679659.0,1019032,Real Estate
VRE,Veris Residential Inc. Common Stock,18.85,1761690614.0,1117559,Real Estate
DHC,Diversified Healthcare Trust Common Shares of Beneficial Interest,7.27,1760219852.0,1676426,Real Estate
TNET,TriNet Group Inc. Common Stock,37.2,1759529719.0,429524,Real Estate
CXW,CoreCivic Inc. Common Stock,17.92,1750949366.0,943470,Real Estate
DEI,Douglas Emmett Inc. Common Stock,10.09,1689693749.0,3326280,Real Estate
FLYW,Flywire Corporation Voting Common Stock,13.56,1643530281.0,2868375,Real Estate
ABR,Arbor Realty Trust Common Stock,8.5,1641480186.0,5274670,Real Estate
PAYO,Payoneer Global Inc. Common Stock,4.71,1623880675.0,4962991,Real Estate
ALEX,Alexander & Baldwin Inc. Common Stock REIT Holding Company,20.85,1519454008.0,1761691,Real Estate
ARI,Apollo Commercial Real Estate Finance Inc,10.47,1461601352.0,1795174,Real Estate
PEB,Pebblebrook Hotel Trust Common Shares of Beneficial Interest,12.51,1423242008.0,3272815,Real Estate
ORC,Orchid Island Capital Inc. Common Stock,7.26,1384434026.0,9924458,Real Estate
CBZ,CBIZ Inc. Common Stock,27.54,1379027605.0,1888382,Real Estate
SILA,Sila Realty Trust Inc. Common Stock,24.41,1348564380.0,263988,Real Estate
LADR,Ladder Capital Corp Class A Common Stock,10.25,1304143980.0,820393,Real Estate
UMH,UMH Properties Inc. Common Stock,14.92,1268440525.0,553283,Real Estate
ALX,Alexander's Inc. Common Stock,240.32,1227383933.0,110650,Real Estate
CBL,CBL & Associates Properties Inc. Common Stock,38.21,1183588680.0,197140,Real Estate
BV,BrightView Holdings Inc. Common Stock,12.48,1175616000.0,838608,Real Estate
SCCD,Sachem Capital Corp. 6.00% Notes due 2026,24.71,1169827936.0,229,Real Estate
AAT,American Assets Trust Inc. Common Stock,19.05,1169497331.0,473532,Real Estate
RLJ,RLJ Lodging Trust Common Shares of Beneficial Interest $0.01 par value,7.68,1166726438.0,1624186,Real Estate
LINC,Lincoln Educational Services Corporation Common Stock,36.22,1154656149.0,603405,Real Estate
CIM,Chimera Investment Corporation Common Stock,13.51,1126768126.0,906216,Real Estate
JBGS,JBG SMITH Properties Common Shares ,14.88,1123974624.0,512507,Real Estate
SCCF,Sachem Capital Corp. 7.125% Notes due 2027,23.638,1119077004.0,1556,Real Estate
SCCG,Sachem Capital Corp. 8.00% Notes due 2027,23.5001,1112548502.0,4899,Real Estate
SCCE,Sachem Capital Corp. 6.00% Notes due 2027,23.4779,1111497503.0,850,Real Estate
GOODN,Gladstone Commercial Corporation 6.625% Series E Cumulative Redeemable Preferred Stock,22.77,1102227231.0,1811,Real Estate
SAFE,Safehold Inc. New Common Stock ,15.21,1091419879.0,256652,Real Estate
CSR,D/B/A Centerspace Common Stock,62.69,1051583187.0,230635,Real Estate
DEA,Easterly Government Properties Inc. Common Stock,22.56,1044950233.0,671506,Real Estate
PMT,PennyMac Mortgage Investment Trust Common Shares of Beneficial Interest,11.87,1032887089.0,1403056,Real Estate
MFA,MFA Financial Inc.,10.11,1032168945.0,1590812,Real Estate
PRSU,Pursuit Attractions and Hospitality Inc. Common Stock,36.13,1012341753.0,311121,Real Estate
LQDT,Liquidity Services Inc. Common Stock,32.57,1010122104.0,365586,Real Estate
TWO,Two Harbors Investment Corp,9.33,980052944.0,3388422,Real Estate
GOODO,Gladstone Commercial Corporation 6.00% Series G Cumulative Redeemable Preferred Stock par value $0.001 per share,19.89,962815091.0,18654,Real Estate
ESRT,Empire State Realty Trust Inc. Class A Common Stock,5.34,914421034.0,1776326,Real Estate
ACVA,ACV Auctions Inc. Class A Common Stock,5.15,896468637.0,2205586,Real Estate
PDM,Piedmont Realty Trust Inc. Class A Common Stock,7.16,893922628.0,1108840,Real Estate
EEX,Emerald Holding Inc. Common Stock,4.44,878264656.0,26551,Real Estate
BFS,Saul Centers Inc. Common Stock,34.35,841429871.0,52036,Real Estate
APEI,American Public Education Inc. Common Stock,45.86,829379476.0,235427,Real Estate
WSR,Whitestone REIT Common Shares,16.2,826526009.0,575335,Real Estate
LANDP,Gladstone Land Corporation 6.00% Series C Cumulative Redeemable Preferred Stock,19.76,818822903.0,29495,Real Estate
LANDO,Gladstone Land Corporation 6.00% Series B Cumulative Redeemable Preferred Stock,19.72,817165366.0,27226,Real Estate
PKST,Peakstone Realty Trust Common Shares,20.8,773350136.0,1571934,Real Estate
FBRT,Franklin BSP Realty Trust Inc. Common Stock,9.31,753791533.0,1387031,Real Estate
MITP,TPG Mortgage Investment Trust Inc. 9.500% Senior Notes due 2029,25.39,748826864.0,15428,Real Estate
RWT,Redwood Trust Inc. Common Stock,5.99,748686788.0,1764891,Real Estate
MITN,TPG Mortgage Investment Trust Inc. 9.500% Senior Notes due 2029,25.3101,746470374.0,8818,Real Estate
BRSP,BrightSpire Capital Inc. Class A Common Stock,5.71,734461575.0,1126899,Real Estate
PHR,Phreesia Inc. Common Stock,12.06,727061256.0,1372833,Real Estate
UDMY,Udemy Inc. Common Stock,4.86,706748539.0,1291247,Real Estate
NUTX,Nutex Health Inc. Common Stock,98.61,687148994.0,265838,Real Estate
NXRT,NexPoint Residential Trust Inc. Common Stock,26.87,682800341.0,224155,Real Estate
QNST,QuinStreet Inc. Common Stock,11.96,681647510.0,750451,Real Estate
IVR,INVESCO MORTGAGE CAPITAL INC Common Stock,8.18,681152952.0,3171944,Real Estate
TRTX,TPG RE Finance Trust Inc. Common Stock,8.29,649555091.0,865317,Real Estate
MAX,MediaAlpha Inc. Class A Common Stock,9.98,643666837.0,817557,Real Estate
CTO,CTO Realty Growth Inc. Common Stock,19.55,636539945.0,227117,Real Estate
AIV,Apartment Investment and Management Company Common Stock,4.27,614326292.0,3071731,Real Estate
UHT,Universal Health Realty Income Trust Common Stock,43.22,599662070.0,77664,Real Estate
GOOD,Gladstone Commercial Corporation Real Estate Investment Trust,12.34,597342294.0,405161,Real Estate
CASS,Cass Information Systems Inc Common Stock,44.59,583428001.0,52715,Real Estate
NHPAP,National Healthcare Properties Inc. 7.375% Series A Cumulative Redeemable Perpetual Preferred Stock,19.24,546650401.0,4754,Real Estate
FPI,Farmland Partners Inc. Common Stock,12.41,540305165.0,536927,Real Estate
BDN,Brandywine Realty Trust Common Stock,3.07,533295373.0,3760820,Real Estate
PSTL,Postal Realty Trust Inc. Class A Common Stock,19.29,529840957.0,393963,Real Estate
NHPBP,National Healthcare Properties Inc. 7.125% Series B Cumulative Redeemable Perpetual Preferred Stock,18.55,527045995.0,9113,Real Estate
OLP,One Liberty Properties Inc. Common Stock,23.26,503466468.0,92654,Real Estate
ALIT,Alight Inc. Class A Common Stock,0.9419,503448169.0,96657595,Real Estate
LAND,Gladstone Land Corporation Common Stock,11.8,488973191.0,565657,Real Estate
CHCT,Community Healthcare Trust Incorporated Common Stock,16.62,474863200.0,496944,Real Estate
XRN,Chiron Real Estate Inc. Common Stock,35.78,473542217.0,206052,Real Estate
IMXI,International Money Express Inc. Common Stock,15.8,469555950.0,901175,Real Estate
KREF,KKR Real Estate Finance Trust Inc. Common Stock,7.07,454428796.0,2235251,Real Estate
INN,Summit Hotel Properties Inc. Common Stock,4.13,449338573.0,2797909,Real Estate
PRTH,Priority Technology Holdings Inc. Common Stock,5.38,440469036.0,505176,Real Estate
ILPT,Industrial Logistics Properties Trust Common Shares of Beneficial Interest,6.13,408583681.0,253863,Real Estate
SOHOO,Sotherly Hotels Inc. 7.875% Series C Cumulative Redeemable Perpetual Preferred Stock,19.11,391573474.0,14428,Real Estate
SOHOB,Sotherly Hotels Inc. 8.0% Series B Cumulative Redeemable Perpetual Preferred Stock,18.58,380713509.0,22868,Real Estate
CLDT,Chatham Lodging Trust (REIT) Common Shares of Beneficial Interest,7.89,372834352.0,449877,Real Estate
SVC,Service Properties Trust Common Stock,2.16,363011823.0,1624514,Real Estate
FVR,FrontView REIT Inc. Common Stock,15.96,356115560.0,158898,Real Estate
GETY,Getty Images Holdings Inc. Class A Common Stock,0.8245,343993441.0,2427004,Real Estate
SOHON,Sotherly Hotels Inc. 8.25% Series D Cumulative Redeemable Perpetual Preferred Stock,16.55,339117792.0,33343,Real Estate
RMNI,Rimini Street Inc. (DE) Common Stock,3.58,328157120.0,315560,Real Estate
TCI,Transcontinental Realty Investors Inc. Common Stock,36.83,318186008.0,5739,Real Estate
SITC,SITE Centers Corp. Common Stock,6.05,317397157.0,1888236,Real Estate
RC,Ready Capital Corporation Common Stock,1.85,301325741.0,3857897,Real Estate
PINE,Alpine Income Property Trust Inc. Common Stock,19.45,293472764.0,246404,Real Estate
ACRE,Ares Commercial Real Estate Corporation Common Stock,5.06,280160420.0,577721,Real Estate
ARL,American Realty Investors Inc. Common Stock,17.3,279430344.0,4213,Real Estate
CTEV,Claritev Corporation Class A Common Stock,16.77,277589165.0,213058,Real Estate
BRT,BRT Apartments Corp. (MD) Common Stock,14.39,273703470.0,55795,Real Estate
NREF,NexPoint Real Estate Finance Inc. Common Stock,14.64,259447562.0,57634,Real Estate
REFI,Chicago Atlantic Real Estate Finance Inc. Common Stock,12.27,258654937.0,98714,Real Estate
STRS,Stratus Properties Inc. Common Stock,31.99,255751925.0,10880,Real Estate
MITT,TPG Mortgage Investment Trust Inc. Common Stock,7.77,246584501.0,498491,Real Estate
RPAY,Repay Holdings Corporation Class A Common Stock,2.81,241834875.0,1393094,Real Estate
NXDT,NexPoint Diversified Real Estate Trust Common Stock,4.7,230395922.0,114677,Real Estate
CNDT,Conduent Incorporated Common Stock ,1.38,213498660.0,1288006,Real Estate
NLOP,Net Lease Office Properties Common Shares of Beneficial Interest,14.17,209915443.0,300096,Real Estate
ADV,Advantage Solutions Inc. Class A Common Stock,0.6317,206886608.0,642314,Real Estate
SEVN,Seven Hills Realty Trust Common Stock,8.51,192299542.0,107462,Real Estate
ELME,Elme Communities Common Stock,2.15,191044448.0,1899336,Real Estate
NEN,New England Realty Associates Limited Partnership Class A Depositary Receipts Evidencing Units of Limited Partnership,62.26,175344395.0,14,Real Estate
BHR,Braemar Hotels & Resorts Inc. Common Stock,2.57,175323940.0,1524771,Real Estate
EARN,Ellington Credit Company Common Shares of Beneficial Interest,4.53,170143153.0,737706,Real Estate
NRDY,Nerdy Inc. Class A Common Stock,0.8843,166776137.0,1157827,Real Estate
ONL,Orion Properties Inc. Common Stock,2.47,139397053.0,185994,Real Estate
ACR,ACRES Commercial Realty Corp. Common Stock,19.0,138427920.0,27444,Real Estate
AXR,AMREP Corporation Common Stock,24.26,128704128.0,2533,Real Estate
OPRX,OptimizeRx Corporation Common Stock,6.84,127502060.0,526735,Real Estate
WHLRL,Wheeler Real Estate Investment Trust Inc. 7.00% Senior Subordinated Convertible Notes Due 2031,97.0,125136693.0,2,Real Estate
SUNS,Sunrise Realty Trust Inc. Common Stock,9.27,124412540.0,68869,Real Estate
RGP,Resources Connection Inc. Common Stock,3.63,121612819.0,374553,Real Estate
DHX,DHI Group Inc. Common Stock,2.53,113774110.0,268841,Real Estate
RPT,Rithm Property Trust Inc. Common stock,14.63,110768265.0,26618,Real Estate
IH,iHuman Inc. American depositary shares each representing five Class A ordinary shares,1.97,101497509.0,7412,Real Estate
STHO,Star Holdings Shares of Beneficial Interest,8.03,97072823.0,44138,Real Estate
MAYS,J. W. Mays Inc. Common Stock,47.005,94751739.0,6215,Real Estate
AMWL,American Well Corporation Class A Common Stock,5.56,92028052.0,105529,Real Estate
GPMT,Granite Point Mortgage Trust Inc. Common Stock,1.72,81809466.0,240468,Real Estate
INTG,Intergroup Corporation (The) Common Stock,37.97,81590392.0,7400,Real Estate
FSP,Franklin Street Properties Corp. Common Stock,0.72,74657045.0,573075,Real Estate
IOR,Income Opportunity Realty Investors Inc. Common Stock,18.23,74126425.0,299,Real Estate
LFT,Lument Finance Trust Inc. Common Stock,1.37,71739954.0,172924,Real Estate
CHGG,Chegg Inc. Common Stock,0.6226,68033437.0,414290,Real Estate
SELF,Global Self Storage Inc. Common Stock,5.16,58502635.0,40577,Real Estate
CLPR,Clipper Realty Inc. Common Stock,3.2,51668947.0,59970,Real Estate
SACH,Sachem Capital Corp. Common Shares,1.08,51506411.0,185138,Real Estate
LOAN,Manhattan Bridge Capital Inc,4.27,48843040.0,29951,Real Estate
WHLRD,Wheeler Real Estate Investment Trust Inc. Series D Cumulative Preferred Stock,37.56,48454992.0,210,Real Estate
HGBL,Heritage Global Inc. Common Stock,1.27,44121772.0,50081,Real Estate
SCOR,comScore Inc. Common Stock,7.29,36564191.0,11161,Real Estate
AHT,Ashford Hospitality Trust Inc Common Stock,3.23,20709248.0,59042,Real Estate
GYRO,Gyrodyne LLC Common Stock,8.775,19298928.0,3213,Real Estate
SGRP,SPAR Group Inc. Common Stock,0.7623,18257078.0,90236,Real Estate
MDRR,Medalist Diversified Inc. Common Stock,11.24,16056340.0,712,Real Estate
NOTE,FiscalNote Holdings Inc. Class A common stock,1.02,16024093.0,278914,Real Estate
WHLRP,Wheeler Real Estate Investment Trust Inc. Class B Preferred Stock,6.75,8707966.0,125,Real Estate
