symbol,name,price,marketCap,volume,industry
SQFTP,Presidio Property Trust Inc. 9.375% Series D Cumulative Redeemable Perpetual Preferred Stock $0.01 par value per share,5.88,8461902.0,2952,Real Estate
CJMB,Callan JMB Inc. Common Stock,1.75,8090297.0,240563,Real Estate
OLB,The OLB Group Inc. Common Stock,0.582,7818830.0,328261,Real Estate
MKZR,MacKenzie Realty Capital Inc. Common Stock,3.68,7236352.0,26223,Real Estate
TGL,Treasure Global Inc. Common Stock,4.17,6987773.0,33094,Real Estate
BOXL,Boxlight Corporation Class A Common Stock,1.29,5375000.0,137879,Real Estate
XHLD,TEN Holdings Inc. Common Stock,1.69,5024084.0,27833,Real Estate
SOPA,Society Pass Incorporated Common Stock,0.6569,4996069.0,191512,Real Estate
EEIQ,EpicQuest Education Group International Limited Common Stock,2.74,4053772.0,117855,Real Estate
SQFT,Presidio Property Trust Inc. Class A Common Stock,2.76,3971913.0,5975,Real Estate
PW,Power REIT (MD) Common Stock,0.86,2915108.0,21417,Real Estate
GIPR,Generation Income Properties Inc. Common Stock,0.37,2015676.0,43013,Real Estate
WHLR,Wheeler Real Estate Investment Trust Inc. Common Stock,1.55,1999607.0,85775,Real Estate
CMCT,Creative Media & Community Trust Corporation Common stock,1.98,1875119.0,111493,Real Estate
KIDZ,Classover Holdings Inc. Class B Common Stock,0.0633,1774206.0,6717949,Real Estate
UK,Ucommune International Ltd Ordinary Shares,0.5366,1137524.0,15279,Real Estate
KIDZW,Classover Holdings Inc. Warrants,0.0136,381188.0,68103,Real Estate
GIPRW,Generation Income Properties Inc Warrant,0.0408,222269.0,17705,Real Estate
SQFTW,Presidio Property Trust Inc. Series A Common Stock Purchase Warrants,0.0204,29358.0,1624,Real Estate
TWOD,Two Harbors Investments Corp 9.375% Senior Notes due 2030,25.58,0.0,11235,Real Estate
PMTW,PennyMac Mortgage Investment Trust 9.00% Senior Notes due 2030,25.17,0.0,13609,Real Estate
PMTV,PennyMac Mortgage Investment Trust 9.00% Senior Notes due 2030,25.31,0.0,5843,Real Estate
ADAMO,Adamas Trust Inc. 9.250% Senior Notes Due 2031,25.3,0.0,18758,Real Estate
ADAMH,Adamas Trust Inc. 9.875% Senior Notes Due 2030,25.75,0.0,58132,Real Estate
ADAMG,Adamas Trust Inc. 9.125% Senior Notes Due 2030,25.2566,0.0,17283,Real Estate
RWTP,Redwood Trust Inc. 9.125% Senior Notes Due 2030,24.55,0.0,2260,Real Estate
RWTQ,Redwood Trust Inc. 9.500% Senior Notes Due 2030,24.57,0.0,24294,Real Estate
RCD,Ready Capital Corporation 9.00% Senior Notes due 2029,21.21,0.0,10551,Real Estate
CIMP,Chimera Investment Corporation 8.875% Senior Notes due 2030,25.08,0.0,54228,Real Estate
CIMO,Chimera Investment Corporation 9.250% Senior Notes due 2029,25.38,0.0,8901,Real Estate
