symbol,name,price,marketCap,volume,industry
BML^G,Bank of America Corporation Depositary Shares (Each representing a 1/1200th interest in a share of Floating Rate Non-Cumulative Preferred Stock  Series 1),19.35,,5768,Uncategorized
BML^H,Bank of America Corporation Depositary Shares (Each representing a 1/1200th interest in a Share of Floating Rate Non-Cumulative Preferred Stock Series 2),19.31,,8972,Uncategorized
BML^J,Bank of America Corporation Depositary Shares (Each representing a 1/1200th interest in a Share of Floating Rate Non-Cumulative Preferred Stock Series 4),20.2,,17826,Uncategorized
BML^L,Bank of America Corporation Depositary Shares (Each representing a 1/1200th Interest in a Share of Floating Rate Non-Cumulative Preferred Stock Series 5),19.59,,8028,Uncategorized
BOH^A,Bank of Hawaii Corporation Depositary Shares Each Representing a 1/40th Interest in a Share of 4.375% Fixed Rate Non-Cumulative Perpetual Preferred Stock Series A,16.2,,1480,Uncategorized
BOH^B,Bank of Hawaii Corporation Depositary Shares Each Representing a 1/40th Interest in a Share of 8.000% Fixed Rate Non-Cumulative Perpetual Preferred Stock Series B,26.57,,10219,Uncategorized
BW^A,Babcock & Wilcox Enterprises Inc. 7.75% Series A Cumulative Perpetual Preferred Stock,21.58,,11372,Uncategorized
C^N,Citigroup Capital XIII 7.875% Fixed rate Floating Rate trust Preferred Securities (TruPS),29.41,,74736,Uncategorized
C^R,Citigroup Inc. Depositary Shares Each Representing a 1/1000th Interest in a Share of 6.250% Noncumulative Preferred Stock Series II,24.9885,,139455,Uncategorized
CDR^B,Cedar Realty Trust Inc. 7.25% Series B Cumulative Redeemable Preferred Stock,22.0,,1482,Uncategorized
CDR^C,Cedar Realty Trust Inc. 6.50% Series C Cumulative Redeemable Preferred Stock,21.4351,,5927,Uncategorized
CFG^E,Citizens Financial Group Inc. Depositary Shares Each Representing 1/40th Interest in a Share of 5.000% Fixed-Rate Non-Cumulative Perpetual Preferred Stock Series E,19.3,,20152,Uncategorized
CFG^H,Citizens Financial Group Inc. Depositary Shares Each Representing a 1/40th Interest in a Share of 7.375% Fixed-Rate Non-Cumulative Perpetual Preferred Stock Series H,26.16,,27497,Uncategorized
CFG^I,Citizens Financial Group Inc. Depositary Shares Each Representing a 1/40th Interest in a Share of 6.500% Fixed-Rate Reset Non-Cumulative Perpetual Preferred Stock Series I,25.11,,21889,Uncategorized
CFR^B,Cullen/Frost Bankers Inc. Depositary Shares each representing a 1/40th ownership interest in a share of 4.450% non-cumulative perpetual preferred stock Series B,17.1101,,8488,Uncategorized
CIM^A,Chimera Investment Corporation 8.00% Series A Cumulative Redeemable Preferred Stock,21.405,,7442,Uncategorized
CIM^B,Chimera Investment Corporation 8.00% Series B Fixed-to-Floating Rate Cumulative Redeemable Preferred Stock,24.54,,13760,Uncategorized
CIM^C,Chimera Investment Corporation 7.75% Series C Fixed-to-Floating Rate  Cumulative Redeemable  Preferred Stock,23.01,,35570,Uncategorized
CIM^D,Chimera Investment Corporation 8.00% Series D Fixed-to-Floating Rate Cumulative Redeemable Preferred Stock,24.55,,10891,Uncategorized
CLDT^A,Chatham Lodging Trust (REIT) 6.625% Series A Cumulative Redeemable Preferred Shares of Beneficial Interest,20.78,,2688,Uncategorized
CMS^B,CMS Energy Corporation Preferred Stock,78.8,,132,Uncategorized
CMS^C,CMS Energy Corporation Depositary Shares each representing a 1/1000th interest in a share of 4.200% Cumulative Redeemable Perpetual Preferred Stock Series C,17.34,,23215,Uncategorized
CNO^A,CNO Financial Group Inc. 5.125% Subordinated Debentures due 2060,17.93,,1172,Uncategorized
CODI^A,Compass Diversified Holdings 7.250% Series A Preferred Shares representing beneficial interest in Compass Diversified Holdings,21.0,,4964,Uncategorized
CODI^B,Compass Diversified Holdings 7.875% Series B Fixed-to-Floating Rate Cumulative Preferred Shares representing beneficial interests in Compass Diversified Holdings,22.5,,10691,Uncategorized
CODI^C,Compass Diversified Holdings 7.875% Series C Cumulative Preferred Shares,22.17,,17518,Uncategorized
COF^I,Capital One Financial Corporation Depositary shares each representing a 1/40th interest in a share of Fixed Rate Non-Cumulative Perpetual Preferred Stock Series I of the Issuer,19.15,,68035,Uncategorized
COF^J,Capital One Financial Corporation Depositary Shares Each Representing a 1/40th Interest in a Share of Fixed Rate Non- Cumulative Perpetual Preferred Stock Series J,18.37,,57919,Uncategorized
COF^K,Capital One Financial Corporation Depositary Shares Each Representing a 1/40th Ownership Interest in a Share of Fixed Rate Non-Cumulative Perpetual Preferred Stock Series K,17.71,,17476,Uncategorized
COF^L,Capital One Financial Corporation Depositary Shares Each Representing a 1/40th Interest in a Share of Fixed Rate Non-Cumulative Perpetual Preferred Stock Series L,16.73,,26483,Uncategorized
COF^N,Capital One Financial Corporation Depositary Shares Each Representing a 1/40th Ownership Interest in a Share of Fixed Rate Non-Cumulative Perpetual Preferred Stock Series N,16.3,,14357,Uncategorized
CRD/A,Crawford & Company,9.65,,99257,Uncategorized
CRD/B,Crawford & Company,9.36,,17318,Uncategorized
CTA^A,EIDP Inc. Preferred Stock $3.50 Series,54.3,,936,Uncategorized
CTA^B,EIDP Inc. Preferred Stock $4.50 Series,68.365,,1291,Uncategorized
CTO^A,CTO Realty Growth Inc. 6.375% Series A Cumulative Redeemable Preferred Stock,21.13,,728,Uncategorized
DBRG^H,DigitalBridge Group Inc. 7.125% Series H ,16.55,,14972,Uncategorized
DBRG^I,DigitalBridge Group Inc. 7.15% Series I ,16.5068,,30940,Uncategorized
DBRG^J,DigitalBridge Group Inc. 7.125% Series J ,16.13,,66036,Uncategorized
DCOM^,Dime Community Bancshares Inc. Fixed-Rate Non-Cumulative Perpetual Preferred Stock Series A,19.55,,1277,Uncategorized
DLR^J,Digital Realty Trust Inc. 5.250% Series J Cumulative Redeemable Preferred Stock,20.61,,14292,Uncategorized
DLR^K,Digital Realty Trust Inc. 5.850% Series K Cumulative Redeemable Preferred Stock par value $0.01 per share,22.8501,,8098,Uncategorized
DLR^L,Digital Realty Trust Inc. 5.200% Series L Cumulative Redeemable Preferred Stock,20.23,,13038,Uncategorized
DUK^A,Duke Energy Corporation Depositary Shares each representing a 1/1000th interest in a share of 5.75% Series A Cumulative Redeemable Perpetual Preferred Stock,25.02,,63436,Uncategorized
DX^C,Dynex Capital Inc. 6.900% Series C Fixed-to-Floating Rate Cumulative Redeemable Preferred Stock,25.72,,3252,Uncategorized
ECC^D,Eagle Point Credit Company Inc. 6.75% Series D Preferred Stock,18.7201,,5374,Uncategorized
ECF^A,Ellsworth Growth and Income Fund Ltd. 5.25% Series A Cumulative Preferred Shares (Liquidation Preference $25.00 per share),21.42,,629,Uncategorized
EFC^B,Ellington Financial Inc. 6.250% Series B Fixed-Rate Reset Cumulative Redeemable Preferred Stock,24.66,,1750,Uncategorized
EFC^C,Ellington Financial Inc. 8.625% Series C Fixed-Rate Reset Cumulative Redeemable Preferred Stock,25.36,,397,Uncategorized
EFC^D,Ellington Financial Inc. 7.00% Series D Cumulative Perpetual Redeemable Preferred Stock,23.17,,434,Uncategorized
EP^C,El Paso Corporation Preferred Stock,50.395,,1361,Uncategorized
EPR^C,EPR Properties 5.75% Series C Cumulative Convertible Preferred Shares,24.95,,6018,Uncategorized
EPR^E,EPR Properties Series E Cumulative Conv Pfd Shs Ser E,32.33,,3482,Uncategorized
EPR^G,EPR Properties 5.750% Series G Cumulative Redeemable Preferred Shares,20.27,,7209,Uncategorized
EQH^A,Equitable Holdings Inc. Depositary Shares,20.03,,30392,Uncategorized
EQH^C,Equitable Holdings Inc. Depositary Shares each representing a 1/1000th interest in a share of Fixed Rate Noncumulative Perpetual Preferred Stock Series C,16.5,,5121,Uncategorized
ET^I,Energy Transfer L.P. Series I Fixed Rate Perpetual Preferred Units,11.85,,38350,Uncategorized
ETI^,Entergy Texas Inc 5.375% Series A Preferred Stock Cumulative No Par Value,24.432,,13938,Uncategorized
F^B,Ford Motor Company 6.20% Notes due June 1 2059,21.32,,26121,Uncategorized
F^C,Ford Motor Company 6% Notes due December 1 2059,20.76,,36152,Uncategorized
F^D,Ford Motor Company 6.500% Notes due August 15 2062,22.22,,31137,Uncategorized
FBRT^E,Franklin BSP Realty Trust Inc. 7.50% Series E Cumulative Redeemable Preferred Stock,19.99,,31795,Uncategorized
FHN^E,First Horizon Corporation Depositary Shares each representing a 1/4000th interest in a share of Non-Cumulative Perpetual Preferred Stock Series E,24.735,,3584,Uncategorized
FHN^F,First Horizon Corporation Depositary Shares each representing 1/4000th Interest in a Share of Non-Cumulative Perpetual Preferred Stock Series F,17.96,,13689,Uncategorized
FHN^H,First Horizon Corporation Depositary Shares each representing a 1/4000th interest in a share of Non-Cumulative Perpetual Preferred Stock Series H,25.12,,34279,Uncategorized
FLG^A,Flagstar Bank N.A. Depositary shares each representing a 1/40th interest in a share of Fixed-to-Floating Rate Series A Noncumulative Perpetual Preferred Stock,22.94,,20346,Uncategorized
FLG^U,Flagstar Bank N.A. Bifurcated Option Note Unit SecuritiES,41.5,,9246,Uncategorized
FOUR^A,Shift4 Payments Inc. 6.00% Series A Mandatory Convertible Preferred Stock,55.15,,101204,Uncategorized
FRT^C,Federal Realty Investment Trust Depositary Shares each representing a 1/1000th interest in a 5.000% Series C Cumulative Redeemable Preferred Share,19.6328,,4682,Uncategorized
GAB^G,Gabelli Equity Trust Inc. (The) Series G Cumulative Preferred Stock,20.3501,,3558,Uncategorized
GAB^H,Gabelli Equity Trust Inc. (The) Pfd Ser H,20.31,,6979,Uncategorized
GAB^K,Gabelli Equity Trust Inc. (The) 5.00% Series K Cumulative Preferred Stock,20.69,,1748,Uncategorized
GAM^B,General American Investors Company Inc. Cumulative Preferred Stock,24.93,,1412,Uncategorized
GDV^H,The Gabelli Dividend & Income Trust 5.375% Series H Cumulative Preferred Shares,22.29,,4367,Uncategorized
GDV^K,The Gabelli Dividend & Income Trust 4.250% Series K Cumulative Preferred Shares,17.95,,3457,Uncategorized
GGN^B,GAMCO Global Gold Natural Reources & Income Trust 5.00% Series B Cumulative 25.00 Liquidation Preference,20.18,,4986,Uncategorized
GGT^E,Gabelli Multi-Media Trust Inc. (The) 5.125% Series E Cumulative Preferred Stock,20.4,,13658,Uncategorized
GGT^G,Gabelli Multi-Media Trust Inc. (The) 5.125% Series G Cumulative Preferred Shares,20.47,,562,Uncategorized
GL^D,Globe Life Inc. 4.25% Junior Subordinated Debentures due 2061,16.0,,6413,Uncategorized
GLP^B,Global Partners LP 9.50% Series B Fixed Rate Cumulative Redeemable Perpetual Preferred Units representing limited partner interests,25.34,,28115,Uncategorized
GLU^A,The Gabelli Global Utility and Income Trust Series A Cumulative Puttable and Callable Preferred Shares,54.0,,103,Uncategorized
GNL^A,Global Net Lease Inc. 7.25% Series A Cumulative Redeemable Preferred Stock $0.01 par value per share,22.78,,11816,Uncategorized
GNL^B,Global Net Lease Inc. 6.875% Series B Cumulative Redeemable Perpetual Preferred Stock,21.63,,4876,Uncategorized
GNL^D,Global Net Lease Inc. 7.50% Series D Cumulative Redeemable Perpetual Preferred Stock,23.6,,4697,Uncategorized
GNL^E,Global Net Lease Inc. 7.375% Series E Cumulative Redeemable Perpetual Preferred Stock,23.02,,14709,Uncategorized
GNT^A,GAMCO Natural Resources Gold & Income Tust  5.20% Series A Cumulative Preferred Shares (Liquidation Preference $25.00 per share),20.68,,946,Uncategorized
GPMT^A,Granite Point Mortgage Trust Inc. 7.00% Series A Fixed-to-Floating Rate Cumulative Redeemable Preferred Stock,19.945,,4222,Uncategorized
GPUS^D,Hyperscale Data Inc. 13.00% Series D Cumulative Redeemable Perpetual Preferred Stock,19.9,,5169,Uncategorized
GRBK^A,Green Brick Partners Inc. Depositary Shares (each representing a 1/1000th fractional interest in a share of 5.75% Series A Cumulative Perpetual Preferred Stock),23.24,,3298,Uncategorized
GS^A,Goldman Sachs Group Inc. (The) Depositary Shares each representing 1/1000th Interest in a Share of Floating Rate Non-Cumulative Preferred Stock Series A,19.28,,55986,Uncategorized
GS^C,Goldman Sachs Group Inc. (The) Depositary Share repstg 1/1000th Preferred Series C,19.4299,,10268,Uncategorized
GS^D,Goldman Sachs Group Inc. (The) Dep Shs repstg 1/1000 Pfd Ser D Fltg,19.1,,120171,Uncategorized
GUT^C,Gabelli Utility Trust (The) 5.375% Series C Cumulative Preferred Shares,22.42,,3841,Uncategorized
HEI/A,Heico Corporation,225.19,,514125,Uncategorized
HFRO^A,Highland Opportunities and Income Fund 5.375% Series A Cumulative Preferred Shares,16.52,,7984,Uncategorized
HFRO^B,Highland Opportunities and Income Fund 5.375% Series B Cumulative Preferred Shares,16.37,,9096,Uncategorized
HIG^G,The Hartford Insurance Group Inc. Depositary Shares each representing a 1/1000th interest in a share of 6.000% Non-Cumulative Preferred Stock Series G,24.98,,19928,Uncategorized
HL^B,Hecla Mining Company Preferred Stock,65.07,,1111,Uncategorized
HPE^C,Hewlett Packard Enterprise Company 7.625% Series C Mandatory Convertible Preferred Stock,81.09,,99162,Uncategorized
HPP^C,Hudson Pacific Properties Inc. 4.750% Series C Cumulative Redeemable Preferred Stock,14.5,,9007,Uncategorized
HVII,Hennessy Capital Investment Corp. VII Ordinary Shares,10.41,,70433,Uncategorized
HVT/A,Haverty Furniture Companies Inc.,23.055,,66,Uncategorized
IIPR^A,Innovative Industrial Properties Inc. 9.00% Series A Cumulative Redeemable Preferred Stock,23.84,,245506,Uncategorized
INN^E,Summit Hotel Properties Inc. 6.250% Series E Cumulative Redeemable Preferred Stock,18.795,,10977,Uncategorized
INN^F,Summit Hotel Properties Inc. 5.875% Series F Cumulative Redeemable Preferred Stock $0.01 par value per share,17.62,,11723,Uncategorized
IVR^C,INVESCO MORTGAGE CAPITAL INC 7.5% Fixed-to-Floating Series C Cumulative Redeemable Preferred Stock Liquation Preference $25.00 per Share,23.85,,17366,Uncategorized
JPM^C,J P Morgan Chase & Co Depositary Shares each representing a 1/400th interest in a share of 6.00% Non-Cumulative  Preferred Stock Series EE,25.09,,142935,Uncategorized
JPM^D,J P Morgan Chase & Co Depositary Shares each representing a 1/400th  interest in a share of 5.75% Non-Cumulative  Preferred Stock Series DD,24.34,,150987,Uncategorized
JPM^J,J P Morgan Chase & Co Depositary Shares each representing a 1/400th interest in a share of JPMorgan Chase & Co. 4.75% Non-Cumulative Preferred Stock Series GG,19.7046,,39950,Uncategorized
JPM^K,J P Morgan Chase & Co Depositary Shares each representing a 1/400th interest in a share of 4.55% Non-Cumulative Preferred Stock Series JJ,18.87,,90320,Uncategorized
JPM^L,J P Morgan Chase & Co Depositary Shares each representing a 1/400th interest in a share of 4.625% Non-Cumulative Preferred Stock Series LL,19.18,,102039,Uncategorized
JPM^M,J P Morgan Chase & Co Depositary Shares each representing a 1/400th interest in a share of 4.20% Non-Cumulative Preferred Stock Series MM,17.74,,90719,Uncategorized
JXN^A,Jackson Financial Inc. Depositary Shares each representing a 1/1000th interest in a share of Fixed-Rate Reset Noncumulative Perpetual Preferred Stock Series A,26.14,,16211,Uncategorized
KEY^I,KeyCorp Depositary Shares Each Representing a 1/40th Ownership Interest in a Share of Fixed-to-Floating Rate Perpetual Non-Cumulative Preferred Stock Series E,25.1,,12763,Uncategorized
KEY^J,KeyCorp Depositary Shares each representing a 1/40th ownership interest in a share of Fixed Rate Perpetual Non-Cumulative Preferred Stock Series F,21.21,,49305,Uncategorized
KEY^K,KeyCorp Depositary Shares each representing a 1/40th ownership interest in a share of Fixed Rate Perpetual Non-Cumulative Preferred Stock Series G,21.24,,24085,Uncategorized
KEY^L,KeyCorp Depositary Shares each representing a 1/40th ownership interest in a share of Fixed Rate Perpetual Non-Cumulative Preferred Stock Series H,25.05,,22133,Uncategorized
KIM^L,Kimco Realty Corporation Class L Depositary Shares each of which represents a one-one thousandth fractional interest in a share of 5.125% Class L Cumulative Redeemable Preferred Stock liquidation preference $25000.00 per share,19.99,,22344,Uncategorized
KIM^M,Kimco Realty Corporation Class M Depositary Shares each of which represents a one-one thousandth fractional interest in a share of 5.25% Class M Cumulative Redeemable Preferred Stock liquidation preference $25000.00 per share,20.45,,9097,Uncategorized
KIM^N,Kimco Realty Corporation Depositary Shares each representing 1/1000th interest in a share of 7.25% Class N Cumulative Convertible Perpetual Preferred Stock,60.7,,111,Uncategorized
KKR^D,KKR & Co. Inc. 6.25% Series D Mandatory Convertible Preferred Stock,43.71,,24552,Uncategorized
KREF^A,KKR Real Estate Finance Trust Inc. 6.50% Series A Cumulative Redeemable Preferred Stock,18.3,,7036,Uncategorized
LFT^A,Lument Finance Trust Inc. 7.875% Series A Cumulative Redeemable Preferred Stock,19.815,,3568,Uncategorized
LNC^D,Lincoln National Corporation Depositary Shares Each Representing a 1/1000th Interest in a Share of 9.000% Non-Cumulative Preferred Stock Series D,26.66,,21946,Uncategorized
LOB^A,Live Oak Bancshares Inc. Depositary Shares Each Representing a 1/40th Interest in a Share of 8.375% Fixed Rate Series A Non-Cumulative Perpetual Preferred Stock,25.28,,11481,Uncategorized
LXP^C,LXP Industrial Trust 6.5% Series C Cumulative Convertible Preferred Stock,46.19,,1442,Uncategorized
MAA^I,Mid-America Apartment Communities Inc. 8.50% Series I Cumulative Redeemable Preferred Stock,55.154,,118,Uncategorized
MDV^A,Modiv Industrial Inc. 7.375% Series A Cumulative Redeemable Perpetual Preferred Stock,24.91,,3679,Uncategorized
MER^K,Bank of America Corporation Income Capital Obligation Notes initially due December 15 2066,25.575,,63279,Uncategorized
MET^A,MetLife Inc. Preferred Series A Floating Rate,21.76,,25144,Uncategorized
MET^E,MetLife Inc. Depositary Shares ,22.8799,,44306,Uncategorized
MET^F,MetLife Inc. Depositary Shares each representing a 1/1000th interest in a share of 4.75% Non-Cumulative Preferred Stock Series F,19.15,,46009,Uncategorized
MFA^B,MFA Financial Inc. Preferred Series B,21.0,,8178,Uncategorized
MFA^C,MFA Financial Inc. 6.50% Series C Fixed-to-Floating Rate Cumulative Redeemable Preferred Stock,23.81,,8922,Uncategorized
MITT^A,TPG Mortgage Investment Trust Inc. 8.25% Series A Cumulative Redeemable Preferred Stock,23.04,,1781,Uncategorized
MITT^B,TPG Mortgage Investment Trust Inc. 8.00% Series B Cumulative Redeemable Preferred Stock,22.66,,7906,Uncategorized
MITT^C,TPG Mortgage Investment Trust Inc. 8.00% Series C Fixed-to-Floating Rate Cumulative Redeemable Preferred Stock $0.01 par value per share,25.365,,8174,Uncategorized
MS^A,Morgan Stanley Dep Shs repstg 1/1000 Pfd Ser A,19.44,,75032,Uncategorized
MS^E,Morgan Stanley DEPOSITARY SHARES REP 1/1000TH SHARES FIXED/FLTG PREFERRED STOCK SERIES E,25.39,,71545,Uncategorized
MS^F,Morgan Stanley Dep Shs Rpstg 1/1000th Int Prd Ser F Fxd to Flag,25.23,,445323,Uncategorized
MS^I,Morgan Stanley Depository Shares Representing 1/1000th Preferred Series 1 Fixed to Floating Non (Cum),25.15,,44321,Uncategorized
MS^K,Morgan Stanley Depositary Shares each representing 1/1000th of a share of Fixed-to-Floating Rate Non-Cumulative Preferred Stock  Series K,24.21,,31421,Uncategorized
MS^L,Morgan Stanley Depositary Shares each representing 1/1000th of a share of 4.875% Non-Cumulative Preferred Stock Series L,20.42,,35890,Uncategorized
MS^O,Morgan Stanley Depositary Shares each representing 1/1000th of a share of 4.250% Non-Cumulative Preferred Stock Series O,17.39,,74198,Uncategorized
MS^P,Morgan Stanley Depositary Shares each representing 1/1000th of a share of 6.500% Non-Cumulative Preferred Stock Series P,25.36,,128789,Uncategorized
MS^Q,Morgan Stanley Depositary Shares each representing 1/1000th of a share of 6.625% Non-Cumulative Preferred Stock Series Q,25.54,,112417,Uncategorized
MTB^H,M&T Bank Corporation Perpetual Fixed-to-Floating Rate Non-Cumulative Preferred Stock Series H,25.1601,,12351,Uncategorized
MTB^J,M&T Bank Corporation Depositary Shares each representing a 1/400th ownership interest in a share of Perpetual 7.500% Non-Cumulative Preferred Stock Series J,26.66,,28716,Uncategorized
MTB^K,M&T Bank Corporation Depositary Shares each representing a 1/400th interest in a share of Perpetual 6.350% Non-Cumulative Preferred Stock Series K,25.04,,78833,Uncategorized
NCV^A,Virtus Convertible & Income Fund 5.625% Series A Cumulative Preferred Shares,20.8,,10477,Uncategorized
NCZ^A,Virtus Convertible & Income Fund II 5.50% Series A Cumulative Preferred Shares,20.11,,48552,Uncategorized
NEE^N,NextEra Energy Capital Holdings Inc. Series N Junior Subordinated Debentures due March 1 2079,23.91,,23694,Uncategorized
NEE^S,NextEra Energy Inc. 7.299% Corporate Units,57.89,,59485,Uncategorized
NEE^T,NextEra Energy Inc. 7.234% Corporate Units,52.75,,57264,Uncategorized
NEE^U,NextEra Energy Inc. Series U Junior Subordinated Debentures due June 1 2085,25.3,,26047,Uncategorized
NEE^V,NextEra Energy Inc. 7.375% Corporate Units,51.45,,12822,Uncategorized
NEE^W,NextEra Energy Capital Holdings Inc. Series Z Junior Subordinated Debentures due April 15 2086,25.175,,43701,Uncategorized
NGL^B,NGL ENERGY PARTNERS LP 9.00% Class B Fixed-to-Floating Rate Cumulative Redeemable Perpetual Preferred Units representing limited partnership interests,25.35,,5880,Uncategorized
NGL^C,NGL ENERGY PARTNERS LP 9.625% Class C Fixed-to-Floating Rate Cumulative  Redeemable Perpetual Preferred Units representing  limited partner interests,25.5999,,1608,Uncategorized
NLY^F,Annaly Capital Management Inc 6.95% Series F,25.975,,53814,Uncategorized
NLY^G,Annaly Capital Management Inc 6.50% Series G Fixed-to-Floating Rate Cumulative Redeemable Preferred Stock,25.2167,,17806,Uncategorized
NLY^I,Annaly Capital Management Inc 6.750% Series I Fixed-to-Floating Rate Cumulative Redeemable Preferred Stock,25.64,,40362,Uncategorized
NLY^J,Annaly Capital Management Inc. 8.875% Series J Fixed-Rate Cumulative Redeemable Preferred Stock,26.15,,15581,Uncategorized
NREF^A,NexPoint Real Estate Finance Inc. 8.50% Series A Cumulative Redeemable Preferred Stock,22.9999,,3928,Uncategorized
NSA^A,National Storage Affiliates Trust 6.000% Series A Cumulative Redeemable Preferred Shares of Beneficial Interest (Liquidation Preference $25.00 per share),23.081,,12550,Uncategorized
NSA^B,National Storage Affiliates Trust 6.000% Series B Cumulative Redeemable Preferred Shares of Beneficial Interest,31.99,,740,Uncategorized
NXDT^A,NexPoint Diversified Real Estate Trust 5.50% Series A Cumulative Preferred Shares ($25.00 liquidation preference per share),13.25,,9339,Uncategorized
OAK^A,Brookfield Oaktree Holdings LLC 6.625% Series A Preferred Units,21.08,,10220,Uncategorized
OAK^B,Brookfield Oaktree Holdings LLC 6.550% Series B Preferred Units,20.76,,7933,Uncategorized
OPP^A,RiverNorth/DoubleLine Strategic Opportunity Fund Inc. 4.375% Series A Cumulative Preferred Stock,16.68,,470,Uncategorized
OPP^B,RiverNorth/DoubleLine Strategic Opportunity Fund Inc. 4.75% Series B Cumulative Preferred Stock,18.36,,2130,Uncategorized
OPP^C,RiverNorth/DoubleLine Strategic Opportunity Fund Inc. 6.00% Series C Term Preferred Stock (Liquidation Preference $10.00 per share),10.25,,1201,Uncategorized
ORCL^D,Oracle Corporation Depositary Shares each representing a 1/2000th interest in a sh of 6.50% Series D Mandatory Convertible Preferred Stock,57.0,,290712,Uncategorized
PBI^B,Pitney Bowes Inc 6.70% Notes Due 2043,20.77,,13959,Uncategorized
PCG^A,Pacific Gas & Electric Co. 6% Preferred Stock,22.51,,5504,Uncategorized
PCG^B,Pacific Gas & Electric Co. 5 1/2% Preferred Stock,20.7399,,5654,Uncategorized
PCG^C,Pacific Gas & Electric Co. 5% 1st Preferred Stock,18.49,,1545,Uncategorized
PCG^D,Pacific Gas & Electric Co. 5% 1st  Red. Preferred Stock,18.36,,7078,Uncategorized
PCG^E,Pacific Gas & Electric Co. 5% 1st A Preferred Stock,18.8,,2945,Uncategorized
PCG^G,Pacific Gas & Electric Co. 4.80% 1st Preferred Stock,17.92,,2596,Uncategorized
PCG^H,Pacific Gas & Electric Co. 4.50% 1st Preferred Stock,17.16,,4,Uncategorized
PCG^I,Pacific Gas & Electric Co. 4.36% 1st Preferred Stock,16.5101,,12,Uncategorized
PCG^X,PG&E Corp 6.000% Series A Mandatory Convertible Preferred Stock,41.14,,11328,Uncategorized
PEB^E,Pebblebrook Hotel Trust 6.375% Series E Cumulative Redeemable Preferred Shares of Beneficial Interest,19.99,,16894,Uncategorized
PEB^F,Pebblebrook Hotel Trust 6.3% Series F Cumulative Redeemable Preferred Shares of Beneficial Interest,19.96,,22071,Uncategorized
PEB^G,Pebblebrook Hotel Trust 6.375% Series G Cumulative Redeemable Preferred Shares of Beneficial Interest,19.9,,55628,Uncategorized
PEB^H,Pebblebrook Hotel Trust 5.700% Series H Cumulative Redeemable Preferred Shares of Beneficial Interest,17.94,,37295,Uncategorized
PINE^A,Alpine Income Property Trust Inc. 8.00% Series A Cumulative Redeemable Preferred Stock,25.3,,3567,Uncategorized
PMT^A,PennyMac Mortgage Investment Trust 8.125% Series A Fixed-to-Floating Rate Cumulative Redeemable Preferred Shares of Beneficial Interest,22.95,,12014,Uncategorized
PMT^B,PennyMac Mortgage Investment Trust 8.00% Series B Fixed-to-Floating Rate Cumulative Redeemable Preferred Shares of Beneficial Interest,22.88,,34048,Uncategorized
PMT^C,PennyMac Mortgage Investment Trust 6.75% Series C Cumulative Redeemable Preferred Shares of Beneficial Interest,18.28,,122597,Uncategorized
PNFP^A,Pinnacle Financial Partners Inc. Fixed-to-Floating Rate Non-Cumulative Perpetual Preferred Stock Series A,25.67,,1166,Uncategorized
PNFP^B,Pinnacle Financial Partners Inc. Fixed-to-Floating Rate Non-Cumulative Perpetual Preferred Stock Series B,26.3116,,22673,Uncategorized
PNFP^C,Pinnacle Financial Partners Inc. Fixed-to-Floating Rate Non-Cumulative Perpetual Preferred Stock Series C,25.275,,6883,Uncategorized
PSA^F,Public Storage Depositary Shares Each Representing 1/1000 of a 5.15% Cumulative Preferred Share of Beneficial Interest Series F par value $0.01 per share,20.67,,17895,Uncategorized
