symbol,name,price,marketCap,volume,industry
BRK/B,Berkshire Hathaway Inc.,482.7,1064986498782.0,4680298,Uncategorized
BRK/A,Berkshire Hathaway Inc.,723821.0,1064649489554.0,204,Uncategorized
GEV,GE Vernova Inc. Common Stock,1049.23,281949080354.0,2445835,Uncategorized
AGNCZ,AGNC Investment Corp. Depositary Shares Each Representing a 1/1000th Interest in a Share of 8.75% Series H Fixed-Rate Cumulative Redeemable Preferred Stock,25.34,29088527752.0,12790,Uncategorized
TPGXL,TPG Operating Group II L.P. 6.950% Fixed-Rate Junior Subordinated Notes due 2064,24.35,8883507621.0,4607,Uncategorized
SATA,Strive Inc. Variable Rate Series A Perpetual Preferred Stock,100.0,7308263100.0,544016,Uncategorized
CBC,Central Bancompany Inc. Class A Common Stock,26.6,6391796566.0,539913,Uncategorized
AUGO,Aura Minerals Inc. Common Shares,76.42,6383706949.0,1410549,Uncategorized
OTF,Blue Owl Technology Finance Corp. Common Stock,11.17,5167713419.0,1548595,Uncategorized
BELFB,Bel Fuse Inc. Class B Common Stock,256.72,3266173341.0,590547,Uncategorized
BELFA,Bel Fuse Inc. Class A Common Stock,230.72,2935382959.0,142972,Uncategorized
GEF,Greif Inc. Class A Common Stock,62.69,2892285086.0,161899,Uncategorized
NMFCZ,New Mountain Finance Corporation 8.250% Notes due 2028,25.16,2676041779.0,7600,Uncategorized
BTX,BlackRock Technology and Private Equity Term Trust Common Shares of Beneficial Interest,8.59,2025489135.0,631117,Uncategorized
DEC,Diversified Energy Company Common Stock,16.08,1234241159.0,691870,Uncategorized
NHP,National Healthcare Properties Inc. Class A Common Stock,14.86,1083366457.0,550584,Uncategorized
IMSR,Terrestrial Energy Inc. Common Stock  ,7.3,773327354.0,2825908,Uncategorized
NCDL,Nuveen Churchill Direct Lending Corp. Common Stock,13.28,655860223.0,214466,Uncategorized
WHFCL,WhiteHorse Finance Inc. 7.875% Notes due 2028,25.61,595255484.0,351,Uncategorized
SWKHL,SWK Holdings Corporation 9.00% Senior Notes due 2027,25.46,309272575.0,197,Uncategorized
ORBS,Eightco Holdings Inc. Common Stock,0.82,308135733.0,14044458,Uncategorized
ALCO,Alico Inc. Common Stock,40.17,297913856.0,20486,Uncategorized
PPHC,Public Policy Holding Company Inc. Common Stock,11.4,286536481.0,96032,Uncategorized
CAMP,CAMP4 Therapeutics Corporation Common Stock,4.31,223800198.0,34766,Uncategorized
PAAC,Proem Acquisition Corp I Ordinary Shares,9.91,143367970.0,7100,Uncategorized
FGMC,FG Merger II Corp. Common stock,10.33,105783311.0,61625,Uncategorized
BLUW,Blue Water Acquisition Corp. III Class A Ordinary Shares,10.28,74478600.0,2891,Uncategorized
EXYN,Exyn Technologies Inc. Common Stock,5.2,39717163.0,882971,Uncategorized
STRRP,Star Equity Holdings Inc. 10% Series A Cumulative Perpetual Preferred Stock,10.26,37919831.0,534,Uncategorized
LSH,Lakeside Holding Limited Common Stock,0.59,20312260.0,16242,Uncategorized
DFDVW,DeFi Development Corp. Warrant,0.67,19763254.0,3555,Uncategorized
LIMN,Liminatus Pharma Inc. Class A Common Stock,0.18,8077974.0,780184,Uncategorized
EXYNW,Exyn Technologies Inc. Warrant,0.81,6186712.0,629779,Uncategorized
VIVK,Vivakor Inc. Common Stock,1.35,5733125.0,80290,Uncategorized
BLUWW,Blue Water Acquisition Corp. III Warrant.,0.43,3115350.0,50000,Uncategorized
ERNAW,Ernexa Therapeutics Inc. Warrants,0.17,198277.0,274013,Uncategorized
SCPQW,Social Commerce Partners Corporation Warrant,0.273,0.0,2628,Uncategorized
IRHO,Iron Horse Acquisitions II Corp. Common Stock,9.99,0.0,15118,Uncategorized
IRHOR,Iron Horse Acquisitions Corp. II Rights,0.173,0.0,79351,Uncategorized
SCPQU,Social Commerce Partners Corporation Unit,10.06,0.0,40,Uncategorized
MCGAW,Yorkville Acquisition Corp. Warrant,0.3301,0.0,9624,Uncategorized
SAAQW,Space Asset Acquisition Corp. Warrants,0.6805,0.0,2821,Uncategorized
VHCP,Vine Hill Capital Investment Corp. II Class A Ordinary Shares,9.94,0.0,8,Uncategorized
MCAHU,Mountain Crest Acquisition 6 Corp. Units,10.05,0.0,3128,Uncategorized
EMAT,Evolution Metals & Technologies Corp. Common Stock,7.86,0.0,137819,Uncategorized
CCIIW,Cohen Circle Acquisition Corp. II Warrant,0.7551,0.0,20459,Uncategorized
MBVI,M3-Brigade Acquisition VI Corp. Class A Ordinary Shares,10.12,0.0,135,Uncategorized
NOEM,CO2 Energy Transition Corp. Common Stock,10.42,0.0,7969,Uncategorized
ALDF,Aldel Financial II Inc. Class A Ordinary Shares,10.62,0.0,503,Uncategorized
LPAA,Launch One Acquisition Corp. Class A Ordinary shares,10.75,0.0,510,Uncategorized
LPBB,Launch Two Acquisition Corp. Class A Ordinary Shares,10.66,0.0,2,Uncategorized
LPBBW,Launch Two Acquisition Corp. Warrant,0.17,0.0,11,Uncategorized
QUMS,Quantumsphere Acquisition Corp. Ordinary Shares,10.18,0.0,2,Uncategorized
ALF,Centurion Acquisition Corp. Class A Ordinary Shares,10.84,0.0,8582,Uncategorized
LPCVW,Launchpad Cadenza Acquisition Corp I Warrant,0.37,0.0,76,Uncategorized
FVAV,Fortress Value Acquisition Corp. V Class A Ordinary Shares,10.1,0.0,102,Uncategorized
QUMSU,Quantumsphere Acquisition Corp. Units,10.35,0.0,1000,Uncategorized
SCIIR,SC II Acquisition Corp. Rights,0.2224,0.0,1600,Uncategorized
NHICW,NewHold Investment Corp III Warrants,0.75,0.0,8344,Uncategorized
MCN,XAI Madison Equity Premium Income Fund Common Shares,5.79,0.0,146097,Uncategorized
CCXI,Churchill Capital Corp XI Class A Ordinary Shares,10.28,0.0,1156,Uncategorized
MACI,Melar Acquisition Corp. I Class A Ordinary Shares,10.85,0.0,868,Uncategorized
NEWTO,NewtekOne Inc. 8.50% Fixed Rate Senior Notes due 2031,25.75,0.0,2,Uncategorized
CCII,Cohen Circle Acquisition Corp. II Class A Ordinary Shares,10.22,0.0,71335,Uncategorized
CCIIU,Cohen Circle Acquisition Corp. II Unit,10.38,0.0,1,Uncategorized
MBAV,M3-Brigade Acquisition V Corp. Class A Ordinary shares,10.78,0.0,2687,Uncategorized
VACH,Voyager Acquisition Corp Class A Ordinary Shares,10.36,0.0,1864,Uncategorized
FSHP,Flag Ship Acquisition Corp. Ordinary Shares,11.15,0.0,1560,Uncategorized
FSHPR,Flag Ship Acquisition Corp. Right,0.0812,0.0,8861,Uncategorized
SCII,SC II Acquisition Corp. Class A ordinary share,10.0,0.0,252502,Uncategorized
HVMC,Highview Merger Corp. Class A Ordinary Share,10.12,0.0,157503,Uncategorized
HVMCW,Highview Merger Corp. Warrants,0.35,0.0,600,Uncategorized
CHAR,Charlton Aria Acquisition Corporation Class A Ordinary Shares,10.74,0.0,118,Uncategorized
CHARR,Charlton Aria Acquisition Corporation Rights,0.0808,0.0,693,Uncategorized
XCBE,X3 Acquisition Corp. Ltd. Class A Ordinary Shares,9.91,0.0,393,Uncategorized
IMSRW,Terrestrial Energy Inc. Warrant,3.42,0.0,17057,Uncategorized
INAC,Indigo Acquisition Corp. Ordinary Shares,10.24,0.0,991,Uncategorized
RREVU,RRE Ventures Acquisition Corp. Units,9.97,0.0,260151,Uncategorized
WSBK,Winchester Bancorp Inc. Common Stock,12.68,0.0,2038,Uncategorized
BEAGR,Bold Eagle Acquisition Corp. Right,0.221,0.0,1298,Uncategorized
BBCQW,Bleichroeder Acquisition Corp. II Warrants,1.6,0.0,5317,Uncategorized
ADAC,American Drive Acquisition Company Class A Ordinary Shares,9.93,0.0,1,Uncategorized
ADACW,American Drive Acquisition Company Warrant,0.3799,0.0,12660,Uncategorized
MLACR,Mountain Lake Acquisition Corp. Right,0.2405,0.0,223169,Uncategorized
EURKR,Eureka Acquisition Corp Right,0.3044,0.0,166,Uncategorized
FACT,FACT II Acquisition Corp. Class A Ordinary Shares,10.585,0.0,1250,Uncategorized
EURK,Eureka Acquisition Corp Class A Ordinary Share,11.5,0.0,2617,Uncategorized
ABXL,Abacus Global Management Inc. 9.875% Fixed Rate Senior Notes due 2028,25.54,0.0,5052,Uncategorized
MKLY,McKinley Acquisition Corporation Class A Ordinary Shares,10.12,0.0,60732,Uncategorized
AACI,Armada Acquisition Corp. III Class A Ordinary Share,9.94,0.0,14044,Uncategorized
AACB,Artius II Acquisition Inc. Class A Ordinary Shares,10.44,0.0,865,Uncategorized
CHPG,ChampionsGate Acquisition Corporation Class A Ordinary Share,10.32,0.0,520,Uncategorized
MKLYR,McKinley Acquisition Corporation Rights,0.1,0.0,55976,Uncategorized
AACOU,Abony Acquisition Corp. I Units,9.96,0.0,60,Uncategorized
CEPV,Cantor Equity Partners V Inc. Class A Ordinary Shares,10.265,0.0,110107,Uncategorized
SABA,Saba Capital Income & Opportunities Fund II Shares of Beneficial Interest,8.35,0.0,21746,Uncategorized
DBL,DoubleLine Opportunistic Credit Fund Common Shares of Beneficial Interest,14.29,0.0,44314,Uncategorized
MESH,Meshflow Acquisition Corp. Class A Ordinary Shares,9.99,0.0,88,Uncategorized
METCI,Ramaco Resources Inc. 8.250% Senior Notes due 2030,25.25,0.0,4945,Uncategorized
BGMS,Bio Green Med Solution Inc. Common Stock,0.996,0.0,14801,Uncategorized
IEAGU,Infinite Eagle Acquisition Corp. Unit,10.22,0.0,114,Uncategorized
BAYA,Bayview Acquisition Corp Ordinary Shares,11.99,0.0,1420,Uncategorized
EMPD,Empery Digital Inc. Common stock,5.11,0.0,249100,Uncategorized
FIGXW,FIGX Capital Acquisition Corp. Warrant,0.2745,0.0,54401,Uncategorized
AFJK,Aimei Health Technology Co. Ltd Ordinary Share,41.0,0.0,2521,Uncategorized
VSECU,VSE Corporation Tangible Equity Units,45.95,0.0,5009,Uncategorized
AEFC,Aegon Funding Company LLC 5.10% Subordinated Notes due 2049,19.5,0.0,34107,Uncategorized
IDACU,Iron Dome Acquisition I Corp. Units,10.0,0.0,5083602,Uncategorized
AFJKR,Aimei Health Technology Co. Ltd Right,0.3,0.0,1152,Uncategorized
MSDL,Morgan Stanley Direct Lending Fund Common Stock,15.24,0.0,797895,Uncategorized
WLIIU,Willow Lane Acquisition Corp. II Unit,10.1367,0.0,21,Uncategorized
BAYAR,Bayview Acquisition Corp Right,0.1,0.0,2,Uncategorized
BBCQ,Bleichroeder Acquisition Corp. II Class A Ordinary Shares,10.35,0.0,674929,Uncategorized
BBCQU,Bleichroeder Acquisition Corp. II Units,10.92,0.0,172,Uncategorized
BEAG,Bold Eagle Acquisition Corp. Class A Ordinary Shares,10.56,0.0,26881,Uncategorized
FGMCR,FG Merger II Corp. Rights,0.72,0.0,45658,Uncategorized
FGMCU,FG Merger II Corp. Unit,11.1,0.0,531,Uncategorized
FIGX,FIGX Capital Acquisition Corp. Class A Ordinary Share,10.2,0.0,5714,Uncategorized
EMISR,Emmis Acquisition Corp. Rights,0.1001,0.0,296,Uncategorized
MYXXR,Maywood Acquisition Corp. 2 Rights,0.2275,0.0,2078503,Uncategorized
MYXXW,Maywood Acquisition Corp. 2 Warrants,0.06,0.0,1590140,Uncategorized
WENN,Wen Acquisition Corp Class A Ordinary Shares,10.25,0.0,2,Uncategorized
MYX,Maywood Acquisition Corp. 2 Class A Ordinary Share,9.89,0.0,287576,Uncategorized
POLEW,Andretti Acquisition Corp. II Warrant,0.24,0.0,120,Uncategorized
CUBWW,Lionheart Holdings Warrant,0.14,0.0,295,Uncategorized
PCSC,Perceptive Capital Solutions Corp Class A Ordinary Shares,11.08,0.0,65305,Uncategorized
HSPTU,Horizon Space Acquisition II Corp. Units,10.0,0.0,27,Uncategorized
GRML,Greenland Mines Ltd. Common Stock,0.3853,0.0,2515173,Uncategorized
GPAC,General Purpose Acquisition Corp. Class A Ordinary Shares,10.01,0.0,2480,Uncategorized
GPAT,GP-Act III Acquisition Corp. Class A Ordinary Share,10.82,0.0,430,Uncategorized
KRAQ,KRAKacquisition Corp Class A Ordinary Shares,9.9,0.0,168987,Uncategorized
KRAQU,KRAKacquisition Corp Unit,10.06,0.0,1427,Uncategorized
KRAQW,KRAKacquisition Corp Warrants,0.47,0.0,6974,Uncategorized
KOYNU,CSLM Digital Asset Acquisition Corp III Units,10.25,0.0,629,Uncategorized
PCAPU,ProCap Acquisition Corp Unit,10.3201,0.0,2125,Uncategorized
KFIIR,K&F Growth Acquisition Corp. II Rights,0.14,0.0,733,Uncategorized
POLE,Andretti Acquisition Corp. II Class A Ordinary Shares,10.71,0.0,6295,Uncategorized
HCIC,Hennessy Capital Investment Corp. VIII Class A Ordinary Shares,9.88,0.0,27,Uncategorized
HCMAU,HCM III Acquisition Corp. Units,10.3201,0.0,3897,Uncategorized
SPEG,Silver Pegasus Acquisition Corp Class A Ordinary Shares,10.22,0.0,13,Uncategorized
SOCAW,Solarius Capital Acquisition Corp. Warrant,0.26,0.0,62,Uncategorized
SOCA,Solarius Capital Acquisition Corp. Class A Ordinary Share,10.2,0.0,2085,Uncategorized
KCHV,Kochav Defense Acquisition Corp. Class A Ordinary Shares,10.31,0.0,34470,Uncategorized
DYNC,Dynamix Corporation Class A Ordinary Shares,10.79,0.0,603254,Uncategorized
DYNCW,Dynamix Corporation Warrant,0.13,0.0,39047,Uncategorized
BLRK,Bluerock Acquisition Corp. Class A Ordinary Shares,9.96,0.0,1643,Uncategorized
OXLCI,Oxford Lane Capital Corp. 8.75% Notes due 2030,25.75,0.0,3909,Uncategorized
TDAC,Translational Development Acquisition Corp. Ordinary Shares,10.64,0.0,2,Uncategorized
TDACU,Translational Development Acquisition Corp. Units,10.44,0.0,4,Uncategorized
DTSQU,DT Cloud Star Acquisition Corporation Units,10.9475,0.0,17,Uncategorized
KVAC,Keen Vision Acquisition Corporation Ordinary Shares,12.46,0.0,8,Uncategorized
KVACW,Keen Vision Acquisition Corporation Warrant,0.0169,0.0,29343,Uncategorized
PACH,Pioneer Acquisition I Corp Class A Ordinary Shares,10.2,0.0,2,Uncategorized
TDACW,Translational Development Acquisition Corp. Warrants,0.1244,0.0,20457,Uncategorized
SSEA,Starry Sea Acquisition Corp	Ordinary Shares,10.19,0.0,223,Uncategorized
HACQU,HCM IV Acquisition Corp. Unit,10.07,0.0,4014,Uncategorized
KOYN,CSLM Digital Asset Acquisition Corp III Class A Ordinary Shares,10.12,0.0,4550,Uncategorized
SPKL,Spark I Acquisition Corp. Class A Ordinary Share,11.92,0.0,14838,Uncategorized
SPKLW,Spark I Acquisition Corp. Warrant,0.733,0.0,113524,Uncategorized
BLZRU,Trailblazer Acquisition Corp. Unit,10.25,0.0,212,Uncategorized
PLMK,Plum Acquisition Corp. IV Class A Ordinary Shares,10.64,0.0,9622,Uncategorized
DRDB,Roman DBDR Acquisition Corp. II Ordinary shares,10.53,0.0,8084,Uncategorized
KFII,K&F Growth Acquisition Corp. II Class A Ordinary shares,10.5,0.0,65543,Uncategorized
SPEGU,Silver Pegasus Acquisition Corp Unit,10.35,0.0,28,Uncategorized
AACBR,Artius II Acquisition Inc. Rights,0.2776,0.0,64,Uncategorized
AACIW,Armada Acquisition Corp. III Warrant,0.22,0.0,651,Uncategorized
PGAC,Pantages Capital Acquisition Corporation Class A Ordinary Shares,10.525,0.0,6902,Uncategorized
BNCWW,CEA Industries Inc. Warrant,0.0223,0.0,24256,Uncategorized
BPAC,Blueport Acquisition Ltd Class A Ordinary Shares,10.03,0.0,8,Uncategorized
CTAAR,ClearThink 1 Acquisition Corp. Rights,0.21,0.0,101500,Uncategorized
ARTCW,Art Technology Acquisition Corp. Warrants,0.35,0.0,100,Uncategorized
SVCC,Stellar V Capital Corp. Class A Ordinary Shares,10.5,0.0,4,Uncategorized
GSHR,Gesher Acquisition Corp. II Class A Ordinary Shares,10.39,0.0,11034,Uncategorized
GSRF,GSR IV Acquisition Corp. Class A ordinary share,10.13,0.0,22165,Uncategorized
GSRFR,GSR IV Acquisition Corp. Rights,2.1999,0.0,11555,Uncategorized
GSRFU,GSR IV Acquisition Corp. Units,10.42,0.0,40134,Uncategorized
GSRVU,GSR V Acquisition Corp. Units,9.995,0.0,1841010,Uncategorized
GUACU,Berto Acquisition Corp. II Unit,10.005,0.0,6150202,Uncategorized
PLMKW,Plum Acquisition Corp. IV Warrants,0.6,0.0,5020,Uncategorized
GTEN,Gores Holdings X Inc. Class A ordinary shares,10.355,0.0,28,Uncategorized
BIXI,Bitcoin Infrastructure Acquisition Corp Ltd. Class A Ordinary Shares,9.97,0.0,1011,Uncategorized
TVA,Texas Ventures Acquisition III Corp Class A Ordinary Share,10.48,0.0,5939,Uncategorized
LKSP,Lake Superior Acquisition Corp. Class A Ordinary Shares,10.12,0.0,30550,Uncategorized
LKSPR,Lake Superior Acquisition Corp. Rights,0.7884,0.0,8510,Uncategorized
ONCHU,1RT Acquisition Corp. Units,10.3,0.0,1210,Uncategorized
HLXC,Helix Acquisition Corp. III Class A Ordinary Shares,10.16,0.0,896,Uncategorized
OCCIM,OFS Credit Company Inc. 7.875% Series F Term Preferred Stock,25.7,0.0,1053,Uncategorized
LOKV,Live Oak Acquisition Corp. V Class A Ordinary Shares,10.475,0.0,221,Uncategorized
PTACU,Patriot Acquisition Corp. Units,9.93,0.0,8104914,Uncategorized
JATT,JATT II Acquisition Corp Ordinary Shares,10.52,0.0,1647,Uncategorized
GECCH,Great Elm Capital Corp. 8.125% Notes Due 2029,25.58,0.0,27,Uncategorized
DMAA,Drugs Made In America Acquisition Corp. Ordinary Shares,10.585,0.0,211,Uncategorized
BHAV,BHAV Acquisition Corp Class A Ordinary Shares,9.92,0.0,11036,Uncategorized
BHAVU,BHAV Acquisition Corp Units,10.095,0.0,214,Uncategorized
CAPN,Cayson Acquisition Corp Ordinary shares,11.0,0.0,200,Uncategorized
GCGRU,General Catalyst Global Resilience Merger Corp. Units,10.16,0.0,19590,Uncategorized
ALIS,Calisa Acquisition Corp Ordinary shares,10.05,0.0,25404,Uncategorized
CAPNU,Cayson Acquisition Corp Unit,10.91,0.0,2,Uncategorized
CAQ,Cambridge Acquisition Corp. Class A Ordinary Shares,9.86,0.0,45,Uncategorized
CAQUU,Cambridge Acquisition Corp. Unit,9.965,0.0,36,Uncategorized
NTWO,Newbury Street II Acquisition Corp Class A Ordinary Shares,10.62,0.0,101581,Uncategorized
CAIIU,Collective Acquisition Corp. II Units,9.97,0.0,11517,Uncategorized
ITHA,ITHAX Acquisition Corp III Class A Ordinary Shares,9.98,0.0,890,Uncategorized
ITHAW,ITHAX Acquisition Corp III Warrants,0.21,0.0,3500,Uncategorized
PTORU,Praetorian Acquisition Corp. Units,9.97,0.0,949,Uncategorized
TVACW,Texas Ventures Acquisition III Corp Warrants,0.55,0.0,505,Uncategorized
LKSPU,Lake Superior Acquisition Corp. Units,10.19,0.0,2,Uncategorized
LOKVW,Live Oak Acquisition Corp. V Warrants,1.775,0.0,1,Uncategorized
BLRKU,Bluerock Acquisition Corp. Unit,10.02,0.0,100,Uncategorized
ATII,Archimedes Tech SPAC Partners II Co. Ordinary Shares,10.93,0.0,790824,Uncategorized
DTSQ,DT Cloud Star Acquisition Corporation Ordinary Shares,11.25,0.0,2955,Uncategorized
ARCI,Archimedes Tech SPAC Partners III Co. Ordinary Share,9.94,0.0,28,Uncategorized
TLNC,Talon Capital Corp. Class A Ordinary Shares,10.2,0.0,14,Uncategorized
CRANU,Crane Harbor Acquisition Corp. II Units,10.22,0.0,2730,Uncategorized
LGI,Lazard Global Total Return and Income Fund Common Stock,17.58,0.0,22033,Uncategorized
ANSC,Agriculture & Natural Solutions Acquisition Corporation Class A Ordinary Shares,11.33,0.0,260146,Uncategorized
ANSCW,Agriculture & Natural Solutions Acquisition Corporation Warrant,0.21,0.0,8198,Uncategorized
ECCU,Eagle Point Credit Company Inc. 7.75% Notes due 2030,25.39,0.0,2353,Uncategorized
OIMAW,OneIM Acquisition Corp. Warrant,0.65,0.0,28251,Uncategorized
ONCH,1RT Acquisition Corp. Class A Ordinary Share,10.2,0.0,8915,Uncategorized
APAC,StoneBridge Acquisition II Corporation Class A Ordinary Shares,10.1,0.0,18300,Uncategorized
GIW,GigCapital8 Corp. Class A Ordinary Shares,10.04,0.0,39012,Uncategorized
GIWWU,GigCapital8 Corp. Units,10.33,0.0,198,Uncategorized
GIXXR,GigCapital9 Corp. Rights,0.29,0.0,382069,Uncategorized
TMTS,Spartacus Acquisition Corp. II Class A Ordinary Shares,10.01,0.0,7595,Uncategorized
TLNCW,Talon Capital Corp. Warrants,0.5356,0.0,4928,Uncategorized
GIWWR,GigCapital8 Corp. Rights,0.32,0.0,27195,Uncategorized
ABR^D,Arbor Realty Trust 6.375% Series D Cumulative Redeemable Preferred Stock Liquidation Preference $25.00 per Share,16.61,,17497,Uncategorized
ABR^E,Arbor Realty Trust 6.25% Series E Cumulative Redeemable Preferred Stock,16.505,,5050,Uncategorized
ABR^F,Arbor Realty Trust 6.25% Series F Fixed-to-Floating Rate Cumulative Redeemable Preferred Stock Liquidation Preference $25.00 per share,23.01,,9538,Uncategorized
ACP^A,abrdn Income Credit Strategies Fund 5.250% Series A Perpetual Preferred Stock,19.8199,,7260,Uncategorized
ACR^C,ACRES Commercial Realty Corp. 8.625% Fixed-to-Floating Series C Cumulative Redeemable Preferred Stock ,25.1399,,2973,Uncategorized
ACR^D,ACRES Commercial Realty Corp. 7.875% Series D Cumulative Redeemable Preferred Stock,22.17,,2465,Uncategorized
ADC^A,Agree Realty Corporation Depositary Shares each representing 1/1000th of a 4.250% Series A Cumulative Redeemable Preferred Stock,17.12,,5533,Uncategorized
AGM^D,Federal Agricultural Mortgage Corporation 5.700% Non-Cumulative Preferred Stock Series D,20.53,,5649,Uncategorized
AGM^E,Federal Agricultural Mortgage Corporation 5.750% Non-Cumulative Preferred Stock Series E,20.6,,12439,Uncategorized
AGM^F,Federal Agricultural Mortgage Corporation 5.250% Non-Cumulative Preferred Stock Series F,18.7809,,5097,Uncategorized
AGM^G,Federal Agricultural Mortgage Corporation 4.875% Non-Cumulative Preferred Stock Series G,17.52,,26221,Uncategorized
AGM^H,Federal Agricultural Mortgage Corporation 6.500% Non-Cumulative Preferred Stock Series H,23.965,,4579,Uncategorized
AHRT^A,AH Realty Trust Inc. 6.75% Series A Cumulative Redeemable Perpetual Preferred Stock,21.905,,5446,Uncategorized
AHT^D,Ashford Hospitality Trust Inc 8.45% Series D Cumulative Preferred Stock,6.19,,1756,Uncategorized
AHT^F,Ashford Hospitality Trust Inc 7.375% Series F Cumulative Preferred Stock,5.1001,,824,Uncategorized
AHT^G,Ashford Hospitality Trust Inc 7.375% Series G Cumulative Preferred Stock,5.05,,5541,Uncategorized
AHT^H,Ashford Hospitality Trust Inc 7.50% Series H Cumulative Preferred Stock,5.3699,,2869,Uncategorized
AHT^I,Ashford Hospitality Trust Inc 7.50% Series I Cumulative Preferred Stock,5.19,,6956,Uncategorized
ALB^A,Albemarle Corporation Depositary Shares each representing a 1/20th of 7.25% Series A Mandatory Convertible Preferred Stock,71.67,,132976,Uncategorized
ALL^B,Allstate Corporation (The) 5.100% Fixed-to-Floating Rate Subordinated Debentures due 2053,25.8,,31283,Uncategorized
ALL^H,Allstate Corporation (The) Depositary Shares each representing a 1/1000th interest in a share of Fixed Rate Noncumulative Perpetual Preferred Stock Series H,20.27,,53718,Uncategorized
ALL^I,Allstate Corporation (The) Depositary Shares each representing a 1/1000th interest in a share of Fixed Rate Noncumulative Perpetual Preferred Stock Series I,18.9,,24555,Uncategorized
ALL^J,Allstate Corporation (The) Depositary Shares each representing a 1/1000th interest in a share of Fixed Rate Noncumulative Perpetual Preferred Stock Series J,26.02,,26539,Uncategorized
ALTG^A,Alta Equipment Group Inc. Depositary Shares (each representing 1/1000th in a share of 10% Series A Cumulative Perpetual Preferred Stock),25.201,,264,Uncategorized
AMH^G,American Homes 4 Rent Series G cumulative redeemable perpetual preferred shares of beneficial interest,23.44,,3799,Uncategorized
AMH^H,American Homes 4 Rent Series H cumulative redeemable perpetual Preferred Shares of Beneficial Interest,24.165,,3574,Uncategorized
ANG^D,American National Group Inc. Depositary Shares each representing a 1/1000th interest in a share of 7.375% Fixed-Rate Non-Cumulative Preferred Stock Series D,24.84,,8918,Uncategorized
APO^A,Apollo Global Management Inc. 6.75% Series A Mandatory Convertible Preferred Stock,69.02,,66654,Uncategorized
ARES^B,Ares Management Corporation 6.75% Series B Mandatory Convertible Preferred Stock,41.0,,85737,Uncategorized
ARR^C,ARMOUR Residential REIT Inc. 7% Series C Cumulative Redeemable Preferred Stock (liquidation preference $25.00 per share),20.75,,7796,Uncategorized
ASB^E,Associated Banc-Corp Depositary Shares each representing a 1/40th interest in a share of 5.875% Non-Cumulative Perpetual Preferred Stock Series E,21.195,,3922,Uncategorized
ASB^F,Associated Banc-Corp Depositary Shares each representing a 1/40th interest in a share of Associated Banc-Corp 5.625% Non-Cumulative Perpetual Preferred Stock Series F,20.5,,2325,Uncategorized
AUB^A,Atlantic Union Bankshares Corporation Depositary Shares each representing a 1/400th ownership interest in a share of 6.875% Perpetual Non-Cumulative Preferred Stock Series A,24.76,,12017,Uncategorized
BA^A,Boeing Company (The) Depositary Shares each representing a 1/20th interest in a share of 6.00% Series A Mandatory Convertible Preferred Stock par value $1.00,70.76,,1452438,Uncategorized
BAC^B,Bank of America Corporation Depositary Shares each representing a 1/1000th interest in a share of 6.000% Non-Cumulative Preferred Stock Series GG,24.84,,105828,Uncategorized
BAC^E,Bank of America Corporation Depositary Sh repstg 1/1000th Perp Pfd Ser E,19.42,,19260,Uncategorized
BAC^K,Bank of America Corporation Depositary Shares each representing a 1/1000th interest in a share of 5.875% Non- Cumulative Preferred Stock Series HH,24.63,,27693,Uncategorized
BAC^L,Bank of America Corporation Non Cumulative Perpetual Conv Pfd Ser L,1196.0,,10639,Uncategorized
BAC^M,Bank of America Corporation Depositary Shares each representing a 1/1000th interest in a share of 5.375% Non-Cumulative Preferred Stock Series KK,21.76,,95315,Uncategorized
BAC^N,Bank of America Corporation Depositary shares each representing 1/1000th interest in a share of 5.000% Non-Cumulative Preferred Stock Series LL,20.24,,163893,Uncategorized
BAC^O,Bank of America Corporation Depositary shares each representing 1/1000th interest in a share of 4.375% Non-Cumulative Preferred Stock Series NN,17.36,,60192,Uncategorized
BAC^P,Bank of America Corporation Depositary Shares each representing a 1/1000th interest in a share of 4.125% Non-Cumulative Preferred Stock Series PP,16.54,,51157,Uncategorized
BAC^Q,Bank of America Corporation Depositary shares each representing 1/1000th interest in a share of 4.250% Non-Cumulative Preferred Stock Series QQ,16.85,,461036,Uncategorized
BAC^S,Bank of America Corporation Depositary shares each representing 1/1000th interest in a share of 4.750% Non-Cumulative Preferred Stock Series SS,18.95,,58322,Uncategorized
BANC^F,Banc of California Inc. Depositary Shares each representing a 1/40th interest in a share of 7.75% non-cumulative perpetual preferred stock Series F,25.49,,28459,Uncategorized
BC^C,Brunswick Corporation 6.375% Notes due 2049,24.495,,12984,Uncategorized
BCV^A,Bancroft Fund Limited 5.375% Series A Cumulative Preferred Shares,21.01,,2493,Uncategorized
BF/A,Brown Forman Corporation,27.36,,138928,Uncategorized
BF/B,Brown Forman Corporation,26.38,,2484417,Uncategorized
BFH^A,Bread Financial Holdings Inc. Depositary Shares each representing a 1/40th interest in a share of 8.625% Non-Cumulative Perpetual Preferred Stock Series A,25.235,,8881,Uncategorized
BFH^B,Bread Financial Holdings Inc. Depositary Shares each representing a 1/40th interest in a share of 8.875% Fixed Rate Reset Non-Cumulative Perpetual Preferred Stock Series B,24.83,,61017,Uncategorized
BFS^D,Saul Centers Inc. Depositary Shares each representing 1/100th of a share of 6.125% Series D Cumulative Redeemable Preferred Stock,20.9,,903,Uncategorized
