symbol,name,price,marketCap,volume,industry
BFS^E,Saul Centers Inc. Depositary shares each representing a 1/100th fractional interest in a share of 6.000% Series E Cumulative Redeemable Preferred Stock,22.625,,2146,Uncategorized
BHR^B,Braemar Hotels & Resorts Inc. 5.50% Series B Cumulative Convertible Preferred Stock par value $0.01 per share,15.145,,6533,Uncategorized
BHR^D,Braemar Hotels & Resorts Inc. 8.25% Series D Cumulative Preferred Stock  par value $0.01 per share,16.54,,2178,Uncategorized
BIO/B,Bio-Rad Laboratories Inc.,260.9,,595,Uncategorized
BK^K,The Bank Of New York Mellon Corporation  Depositary Shares each representing a 1/4000th interest in a share of Series K Noncumulative Perpetual Preferred Stock,25.56,,26028,Uncategorized
BML^G,Bank of America Corporation Depositary Shares (Each representing a 1/1200th interest in a share of Floating Rate Non-Cumulative Preferred Stock  Series 1),19.37,,16485,Uncategorized
BML^H,Bank of America Corporation Depositary Shares (Each representing a 1/1200th interest in a Share of Floating Rate Non-Cumulative Preferred Stock Series 2),19.19,,24766,Uncategorized
BML^J,Bank of America Corporation Depositary Shares (Each representing a 1/1200th interest in a Share of Floating Rate Non-Cumulative Preferred Stock Series 4),20.26,,16871,Uncategorized
BML^L,Bank of America Corporation Depositary Shares (Each representing a 1/1200th Interest in a Share of Floating Rate Non-Cumulative Preferred Stock Series 5),19.65,,6827,Uncategorized
BOH^A,Bank of Hawaii Corporation Depositary Shares Each Representing a 1/40th Interest in a Share of 4.375% Fixed Rate Non-Cumulative Perpetual Preferred Stock Series A,16.03,,4531,Uncategorized
BOH^B,Bank of Hawaii Corporation Depositary Shares Each Representing a 1/40th Interest in a Share of 8.000% Fixed Rate Non-Cumulative Perpetual Preferred Stock Series B,26.28,,10810,Uncategorized
BW^A,Babcock & Wilcox Enterprises Inc. 7.75% Series A Cumulative Perpetual Preferred Stock,22.66,,44606,Uncategorized
C^N,Citigroup Capital XIII 7.875% Fixed rate Floating Rate trust Preferred Securities (TruPS),29.08,,85610,Uncategorized
C^R,Citigroup Inc. Depositary Shares Each Representing a 1/1000th Interest in a Share of 6.250% Noncumulative Preferred Stock Series II,25.0,,156883,Uncategorized
CDR^B,Cedar Realty Trust Inc. 7.25% Series B Cumulative Redeemable Preferred Stock,20.04,,280,Uncategorized
CDR^C,Cedar Realty Trust Inc. 6.50% Series C Cumulative Redeemable Preferred Stock,19.81,,3517,Uncategorized
CFG^E,Citizens Financial Group Inc. Depositary Shares Each Representing 1/40th Interest in a Share of 5.000% Fixed-Rate Non-Cumulative Perpetual Preferred Stock Series E,19.0,,14033,Uncategorized
CFG^H,Citizens Financial Group Inc. Depositary Shares Each Representing a 1/40th Interest in a Share of 7.375% Fixed-Rate Non-Cumulative Perpetual Preferred Stock Series H,26.07,,23931,Uncategorized
CFG^I,Citizens Financial Group Inc. Depositary Shares Each Representing a 1/40th Interest in a Share of 6.500% Fixed-Rate Reset Non-Cumulative Perpetual Preferred Stock Series I,25.51,,27579,Uncategorized
CFR^B,Cullen/Frost Bankers Inc. Depositary Shares each representing a 1/40th ownership interest in a share of 4.450% non-cumulative perpetual preferred stock Series B,17.04,,19497,Uncategorized
CIM^A,Chimera Investment Corporation 8.00% Series A Cumulative Redeemable Preferred Stock,21.85,,6337,Uncategorized
CIM^B,Chimera Investment Corporation 8.00% Series B Fixed-to-Floating Rate Cumulative Redeemable Preferred Stock,24.47,,21366,Uncategorized
CIM^C,Chimera Investment Corporation 7.75% Series C Fixed-to-Floating Rate  Cumulative Redeemable  Preferred Stock,23.25,,45677,Uncategorized
CIM^D,Chimera Investment Corporation 8.00% Series D Fixed-to-Floating Rate Cumulative Redeemable Preferred Stock,24.47,,8413,Uncategorized
CLDT^A,Chatham Lodging Trust (REIT) 6.625% Series A Cumulative Redeemable Preferred Shares of Beneficial Interest,19.99,,12725,Uncategorized
CMS^B,CMS Energy Corporation Preferred Stock,78.87,,220,Uncategorized
CMS^C,CMS Energy Corporation Depositary Shares each representing a 1/1000th interest in a share of 4.200% Cumulative Redeemable Perpetual Preferred Stock Series C,16.84,,26925,Uncategorized
CNO^A,CNO Financial Group Inc. 5.125% Subordinated Debentures due 2060,17.35,,4770,Uncategorized
CODI^A,Compass Diversified Holdings 7.250% Series A Preferred Shares representing beneficial interest in Compass Diversified Holdings,20.67,,2317,Uncategorized
CODI^B,Compass Diversified Holdings 7.875% Series B Fixed-to-Floating Rate Cumulative Preferred Shares representing beneficial interests in Compass Diversified Holdings,22.25,,2337,Uncategorized
CODI^C,Compass Diversified Holdings 7.875% Series C Cumulative Preferred Shares,21.895,,7356,Uncategorized
COF^I,Capital One Financial Corporation Depositary shares each representing a 1/40th interest in a share of Fixed Rate Non-Cumulative Perpetual Preferred Stock Series I of the Issuer,18.78,,105755,Uncategorized
COF^J,Capital One Financial Corporation Depositary Shares Each Representing a 1/40th Interest in a Share of Fixed Rate Non- Cumulative Perpetual Preferred Stock Series J,18.0,,69341,Uncategorized
COF^K,Capital One Financial Corporation Depositary Shares Each Representing a 1/40th Ownership Interest in a Share of Fixed Rate Non-Cumulative Perpetual Preferred Stock Series K,17.42,,6202,Uncategorized
COF^L,Capital One Financial Corporation Depositary Shares Each Representing a 1/40th Interest in a Share of Fixed Rate Non-Cumulative Perpetual Preferred Stock Series L,16.43,,39301,Uncategorized
COF^N,Capital One Financial Corporation Depositary Shares Each Representing a 1/40th Ownership Interest in a Share of Fixed Rate Non-Cumulative Perpetual Preferred Stock Series N,16.08,,24576,Uncategorized
CRD/A,Crawford & Company,9.96,,45194,Uncategorized
CRD/B,Crawford & Company,9.49,,5719,Uncategorized
CTA^A,EIDP Inc. Preferred Stock $3.50 Series,53.97,,385,Uncategorized
CTA^B,EIDP Inc. Preferred Stock $4.50 Series,66.61,,5039,Uncategorized
CTO^A,CTO Realty Growth Inc. 6.375% Series A Cumulative Redeemable Preferred Stock,21.875,,881,Uncategorized
DBRG^H,DigitalBridge Group Inc. 7.125% Series H ,16.03,,9471,Uncategorized
DBRG^I,DigitalBridge Group Inc. 7.15% Series I ,16.28,,6944,Uncategorized
DBRG^J,DigitalBridge Group Inc. 7.125% Series J ,16.15,,2530,Uncategorized
DCOM^,Dime Community Bancshares Inc. Fixed-Rate Non-Cumulative Perpetual Preferred Stock Series A,19.01,,4604,Uncategorized
DLR^J,Digital Realty Trust Inc. 5.250% Series J Cumulative Redeemable Preferred Stock,20.2801,,7829,Uncategorized
DLR^K,Digital Realty Trust Inc. 5.850% Series K Cumulative Redeemable Preferred Stock par value $0.01 per share,22.5,,42755,Uncategorized
DLR^L,Digital Realty Trust Inc. 5.200% Series L Cumulative Redeemable Preferred Stock,20.09,,26507,Uncategorized
DUK^A,Duke Energy Corporation Depositary Shares each representing a 1/1000th interest in a share of 5.75% Series A Cumulative Redeemable Perpetual Preferred Stock,24.66,,67478,Uncategorized
DX^C,Dynex Capital Inc. 6.900% Series C Fixed-to-Floating Rate Cumulative Redeemable Preferred Stock,25.94,,5994,Uncategorized
ECC^D,Eagle Point Credit Company Inc. 6.75% Series D Preferred Stock,18.7,,3059,Uncategorized
ECF^A,Ellsworth Growth and Income Fund Ltd. 5.25% Series A Cumulative Preferred Shares (Liquidation Preference $25.00 per share),21.36,,608,Uncategorized
EFC^B,Ellington Financial Inc. 6.250% Series B Fixed-Rate Reset Cumulative Redeemable Preferred Stock,24.76,,2442,Uncategorized
EFC^C,Ellington Financial Inc. 8.625% Series C Fixed-Rate Reset Cumulative Redeemable Preferred Stock,25.58,,482,Uncategorized
EFC^D,Ellington Financial Inc. 7.00% Series D Cumulative Perpetual Redeemable Preferred Stock,23.12,,12,Uncategorized
EP^C,El Paso Corporation Preferred Stock,50.97,,2250,Uncategorized
EPR^C,EPR Properties 5.75% Series C Cumulative Convertible Preferred Shares,25.585,,3501,Uncategorized
EPR^E,EPR Properties Series E Cumulative Conv Pfd Shs Ser E,32.6,,2983,Uncategorized
EPR^G,EPR Properties 5.750% Series G Cumulative Redeemable Preferred Shares,20.555,,3141,Uncategorized
EQH^A,Equitable Holdings Inc. Depositary Shares,19.69,,45348,Uncategorized
EQH^C,Equitable Holdings Inc. Depositary Shares each representing a 1/1000th interest in a share of Fixed Rate Noncumulative Perpetual Preferred Stock Series C,16.15,,12161,Uncategorized
ET^I,Energy Transfer L.P. Series I Fixed Rate Perpetual Preferred Units,11.5401,,71275,Uncategorized
ETI^,Entergy Texas Inc 5.375% Series A Preferred Stock Cumulative No Par Value,24.12,,423,Uncategorized
F^B,Ford Motor Company 6.20% Notes due June 1 2059,21.1,,31402,Uncategorized
F^C,Ford Motor Company 6% Notes due December 1 2059,20.48,,37065,Uncategorized
F^D,Ford Motor Company 6.500% Notes due August 15 2062,22.22,,37718,Uncategorized
FBRT^E,Franklin BSP Realty Trust Inc. 7.50% Series E Cumulative Redeemable Preferred Stock,19.925,,17457,Uncategorized
FHN^E,First Horizon Corporation Depositary Shares each representing a 1/4000th interest in a share of Non-Cumulative Perpetual Preferred Stock Series E,24.53,,3358,Uncategorized
FHN^F,First Horizon Corporation Depositary Shares each representing 1/4000th Interest in a Share of Non-Cumulative Perpetual Preferred Stock Series F,17.6,,15762,Uncategorized
FHN^H,First Horizon Corporation Depositary Shares each representing a 1/4000th interest in a share of Non-Cumulative Perpetual Preferred Stock Series H,24.82,,160470,Uncategorized
FLG^A,Flagstar Bank N.A. Depositary shares each representing a 1/40th interest in a share of Fixed-to-Floating Rate Series A Noncumulative Perpetual Preferred Stock,23.21,,27932,Uncategorized
FLG^U,Flagstar Bank N.A. Bifurcated Option Note Unit SecuritiES,41.52,,6243,Uncategorized
FOUR^A,Shift4 Payments Inc. 6.00% Series A Mandatory Convertible Preferred Stock,54.85,,13048,Uncategorized
FRT^C,Federal Realty Investment Trust Depositary Shares each representing a 1/1000th interest in a 5.000% Series C Cumulative Redeemable Preferred Share,19.32,,5999,Uncategorized
GAB^G,Gabelli Equity Trust Inc. (The) Series G Cumulative Preferred Stock,20.11,,8030,Uncategorized
GAB^H,Gabelli Equity Trust Inc. (The) Pfd Ser H,20.17,,15006,Uncategorized
GAB^K,Gabelli Equity Trust Inc. (The) 5.00% Series K Cumulative Preferred Stock,20.23,,8950,Uncategorized
GAM^B,General American Investors Company Inc. Cumulative Preferred Stock,24.9,,9421,Uncategorized
GDV^H,The Gabelli Dividend & Income Trust 5.375% Series H Cumulative Preferred Shares,21.95,,7622,Uncategorized
GDV^K,The Gabelli Dividend & Income Trust 4.250% Series K Cumulative Preferred Shares,17.82,,7516,Uncategorized
GGN^B,GAMCO Global Gold Natural Reources & Income Trust 5.00% Series B Cumulative 25.00 Liquidation Preference,19.85,,197938,Uncategorized
GGT^E,Gabelli Multi-Media Trust Inc. (The) 5.125% Series E Cumulative Preferred Stock,20.37,,2831,Uncategorized
GGT^G,Gabelli Multi-Media Trust Inc. (The) 5.125% Series G Cumulative Preferred Shares,20.4101,,8958,Uncategorized
GL^D,Globe Life Inc. 4.25% Junior Subordinated Debentures due 2061,15.74,,5937,Uncategorized
GLP^B,Global Partners LP 9.50% Series B Fixed Rate Cumulative Redeemable Perpetual Preferred Units representing limited partner interests,25.46,,5569,Uncategorized
GNL^A,Global Net Lease Inc. 7.25% Series A Cumulative Redeemable Preferred Stock $0.01 par value per share,22.83,,8173,Uncategorized
GNL^B,Global Net Lease Inc. 6.875% Series B Cumulative Redeemable Perpetual Preferred Stock,21.8,,2261,Uncategorized
GNL^D,Global Net Lease Inc. 7.50% Series D Cumulative Redeemable Perpetual Preferred Stock,23.655,,1520,Uncategorized
GNL^E,Global Net Lease Inc. 7.375% Series E Cumulative Redeemable Perpetual Preferred Stock,23.245,,4659,Uncategorized
GNT^A,GAMCO Natural Resources Gold & Income Tust  5.20% Series A Cumulative Preferred Shares (Liquidation Preference $25.00 per share),20.651,,196,Uncategorized
GPMT^A,Granite Point Mortgage Trust Inc. 7.00% Series A Fixed-to-Floating Rate Cumulative Redeemable Preferred Stock,19.77,,1353,Uncategorized
GPUS^D,Hyperscale Data Inc. 13.00% Series D Cumulative Redeemable Perpetual Preferred Stock,19.74,,2758,Uncategorized
GRBK^A,Green Brick Partners Inc. Depositary Shares (each representing a 1/1000th fractional interest in a share of 5.75% Series A Cumulative Perpetual Preferred Stock),23.45,,2597,Uncategorized
GS^A,Goldman Sachs Group Inc. (The) Depositary Shares each representing 1/1000th Interest in a Share of Floating Rate Non-Cumulative Preferred Stock Series A,19.55,,46633,Uncategorized
GS^C,Goldman Sachs Group Inc. (The) Depositary Share repstg 1/1000th Preferred Series C,19.6945,,9045,Uncategorized
GS^D,Goldman Sachs Group Inc. (The) Dep Shs repstg 1/1000 Pfd Ser D Fltg,19.12,,64674,Uncategorized
GUT^C,Gabelli Utility Trust (The) 5.375% Series C Cumulative Preferred Shares,22.26,,5068,Uncategorized
HEI/A,Heico Corporation,216.35,,314500,Uncategorized
HFRO^A,Highland Opportunities and Income Fund 5.375% Series A Cumulative Preferred Shares,16.555,,11387,Uncategorized
HFRO^B,Highland Opportunities and Income Fund 5.375% Series B Cumulative Preferred Shares,16.38,,4688,Uncategorized
HIG^G,The Hartford Insurance Group Inc. Depositary Shares each representing a 1/1000th interest in a share of 6.000% Non-Cumulative Preferred Stock Series G,24.77,,27673,Uncategorized
HL^B,Hecla Mining Company Preferred Stock,73.235,,320,Uncategorized
HPE^C,Hewlett Packard Enterprise Company 7.625% Series C Mandatory Convertible Preferred Stock,86.2,,139791,Uncategorized
HPP^C,Hudson Pacific Properties Inc. 4.750% Series C Cumulative Redeemable Preferred Stock,15.015,,1807,Uncategorized
HVII,Hennessy Capital Investment Corp. VII Ordinary Shares,10.42,,9938,Uncategorized
HVT/A,Haverty Furniture Companies Inc.,23.74,,113,Uncategorized
IIPR^A,Innovative Industrial Properties Inc. 9.00% Series A Cumulative Redeemable Preferred Stock,23.72,,21682,Uncategorized
INN^E,Summit Hotel Properties Inc. 6.250% Series E Cumulative Redeemable Preferred Stock,17.9001,,2458,Uncategorized
INN^F,Summit Hotel Properties Inc. 5.875% Series F Cumulative Redeemable Preferred Stock $0.01 par value per share,17.095,,2313,Uncategorized
IVR^C,INVESCO MORTGAGE CAPITAL INC 7.5% Fixed-to-Floating Series C Cumulative Redeemable Preferred Stock Liquation Preference $25.00 per Share,23.98,,12147,Uncategorized
JPM^C,J P Morgan Chase & Co Depositary Shares each representing a 1/400th interest in a share of 6.00% Non-Cumulative  Preferred Stock Series EE,24.91,,197574,Uncategorized
JPM^D,J P Morgan Chase & Co Depositary Shares each representing a 1/400th  interest in a share of 5.75% Non-Cumulative  Preferred Stock Series DD,24.1,,101079,Uncategorized
JPM^J,J P Morgan Chase & Co Depositary Shares each representing a 1/400th interest in a share of JPMorgan Chase & Co. 4.75% Non-Cumulative Preferred Stock Series GG,19.38,,90170,Uncategorized
JPM^K,J P Morgan Chase & Co Depositary Shares each representing a 1/400th interest in a share of 4.55% Non-Cumulative Preferred Stock Series JJ,18.6,,115138,Uncategorized
JPM^L,J P Morgan Chase & Co Depositary Shares each representing a 1/400th interest in a share of 4.625% Non-Cumulative Preferred Stock Series LL,18.86,,156796,Uncategorized
JPM^M,J P Morgan Chase & Co Depositary Shares each representing a 1/400th interest in a share of 4.20% Non-Cumulative Preferred Stock Series MM,17.43,,221388,Uncategorized
JXN^A,Jackson Financial Inc. Depositary Shares each representing a 1/1000th interest in a share of Fixed-Rate Reset Noncumulative Perpetual Preferred Stock Series A,26.06,,29292,Uncategorized
KEY^I,KeyCorp Depositary Shares Each Representing a 1/40th Ownership Interest in a Share of Fixed-to-Floating Rate Perpetual Non-Cumulative Preferred Stock Series E,25.17,,27614,Uncategorized
KEY^J,KeyCorp Depositary Shares each representing a 1/40th ownership interest in a share of Fixed Rate Perpetual Non-Cumulative Preferred Stock Series F,21.24,,15164,Uncategorized
KEY^K,KeyCorp Depositary Shares each representing a 1/40th ownership interest in a share of Fixed Rate Perpetual Non-Cumulative Preferred Stock Series G,21.17,,8061,Uncategorized
KEY^L,KeyCorp Depositary Shares each representing a 1/40th ownership interest in a share of Fixed Rate Perpetual Non-Cumulative Preferred Stock Series H,24.875,,27343,Uncategorized
KIM^L,Kimco Realty Corporation Class L Depositary Shares each of which represents a one-one thousandth fractional interest in a share of 5.125% Class L Cumulative Redeemable Preferred Stock liquidation preference $25000.00 per share,19.41,,11114,Uncategorized
KIM^M,Kimco Realty Corporation Class M Depositary Shares each of which represents a one-one thousandth fractional interest in a share of 5.25% Class M Cumulative Redeemable Preferred Stock liquidation preference $25000.00 per share,20.04,,4131,Uncategorized
KIM^N,Kimco Realty Corporation Depositary Shares each representing 1/1000th interest in a share of 7.25% Class N Cumulative Convertible Perpetual Preferred Stock,59.66,,3338,Uncategorized
KKR^D,KKR & Co. Inc. 6.25% Series D Mandatory Convertible Preferred Stock,41.59,,45302,Uncategorized
KREF^A,KKR Real Estate Finance Trust Inc. 6.50% Series A Cumulative Redeemable Preferred Stock,17.9348,,12704,Uncategorized
LFT^A,Lument Finance Trust Inc. 7.875% Series A Cumulative Redeemable Preferred Stock,20.09,,14408,Uncategorized
LNC^D,Lincoln National Corporation Depositary Shares Each Representing a 1/1000th Interest in a Share of 9.000% Non-Cumulative Preferred Stock Series D,26.16,,50169,Uncategorized
LOB^A,Live Oak Bancshares Inc. Depositary Shares Each Representing a 1/40th Interest in a Share of 8.375% Fixed Rate Series A Non-Cumulative Perpetual Preferred Stock,25.2893,,8784,Uncategorized
LXP^C,LXP Industrial Trust 6.5% Series C Cumulative Convertible Preferred Stock,46.55,,2033,Uncategorized
MAA^I,Mid-America Apartment Communities Inc. 8.50% Series I Cumulative Redeemable Preferred Stock,54.7,,791,Uncategorized
MDV^A,Modiv Industrial Inc. 7.375% Series A Cumulative Redeemable Perpetual Preferred Stock,24.9915,,3431,Uncategorized
MER^K,Bank of America Corporation Income Capital Obligation Notes initially due December 15 2066,25.45,,40528,Uncategorized
MET^A,MetLife Inc. Preferred Series A Floating Rate,22.32,,48809,Uncategorized
MET^E,MetLife Inc. Depositary Shares ,22.82,,64006,Uncategorized
MET^F,MetLife Inc. Depositary Shares each representing a 1/1000th interest in a share of 4.75% Non-Cumulative Preferred Stock Series F,18.88,,73863,Uncategorized
MFA^B,MFA Financial Inc. Preferred Series B,20.6586,,12845,Uncategorized
MFA^C,MFA Financial Inc. 6.50% Series C Fixed-to-Floating Rate Cumulative Redeemable Preferred Stock,23.8,,25470,Uncategorized
MITT^A,TPG Mortgage Investment Trust Inc. 8.25% Series A Cumulative Redeemable Preferred Stock,23.0999,,785,Uncategorized
MITT^B,TPG Mortgage Investment Trust Inc. 8.00% Series B Cumulative Redeemable Preferred Stock,22.65,,1316,Uncategorized
MITT^C,TPG Mortgage Investment Trust Inc. 8.00% Series C Fixed-to-Floating Rate Cumulative Redeemable Preferred Stock $0.01 par value per share,25.35,,4630,Uncategorized
MS^A,Morgan Stanley Dep Shs repstg 1/1000 Pfd Ser A,19.76,,66822,Uncategorized
MS^E,Morgan Stanley DEPOSITARY SHARES REP 1/1000TH SHARES FIXED/FLTG PREFERRED STOCK SERIES E,25.36,,40506,Uncategorized
MS^F,Morgan Stanley Dep Shs Rpstg 1/1000th Int Prd Ser F Fxd to Flag,25.26,,31684,Uncategorized
MS^I,Morgan Stanley Depository Shares Representing 1/1000th Preferred Series 1 Fixed to Floating Non (Cum),25.0,,83103,Uncategorized
MS^K,Morgan Stanley Depositary Shares each representing 1/1000th of a share of Fixed-to-Floating Rate Non-Cumulative Preferred Stock  Series K,23.84,,37300,Uncategorized
MS^L,Morgan Stanley Depositary Shares each representing 1/1000th of a share of 4.875% Non-Cumulative Preferred Stock Series L,20.14,,25763,Uncategorized
MS^O,Morgan Stanley Depositary Shares each representing 1/1000th of a share of 4.250% Non-Cumulative Preferred Stock Series O,17.04,,322513,Uncategorized
MS^P,Morgan Stanley Depositary Shares each representing 1/1000th of a share of 6.500% Non-Cumulative Preferred Stock Series P,25.16,,26009,Uncategorized
MS^Q,Morgan Stanley Depositary Shares each representing 1/1000th of a share of 6.625% Non-Cumulative Preferred Stock Series Q,25.48,,25399,Uncategorized
MTB^H,M&T Bank Corporation Perpetual Fixed-to-Floating Rate Non-Cumulative Preferred Stock Series H,25.18,,8213,Uncategorized
MTB^J,M&T Bank Corporation Depositary Shares each representing a 1/400th ownership interest in a share of Perpetual 7.500% Non-Cumulative Preferred Stock Series J,26.41,,30042,Uncategorized
MTB^K,M&T Bank Corporation Depositary Shares each representing a 1/400th interest in a share of Perpetual 6.350% Non-Cumulative Preferred Stock Series K,24.91,,33104,Uncategorized
NCV^A,Virtus Convertible & Income Fund 5.625% Series A Cumulative Preferred Shares,20.67,,11062,Uncategorized
NCZ^A,Virtus Convertible & Income Fund II 5.50% Series A Cumulative Preferred Shares,20.01,,13406,Uncategorized
NEE^N,NextEra Energy Capital Holdings Inc. Series N Junior Subordinated Debentures due March 1 2079,23.71,,32003,Uncategorized
NEE^S,NextEra Energy Inc. 7.299% Corporate Units,56.79,,29439,Uncategorized
NEE^T,NextEra Energy Inc. 7.234% Corporate Units,52.11,,1338459,Uncategorized
NEE^U,NextEra Energy Inc. Series U Junior Subordinated Debentures due June 1 2085,25.03,,86156,Uncategorized
NEE^V,NextEra Energy Inc. 7.375% Corporate Units,49.61,,32618,Uncategorized
NEE^W,NextEra Energy Capital Holdings Inc. Series Z Junior Subordinated Debentures due April 15 2086,25.04,,6674,Uncategorized
NGL^B,NGL ENERGY PARTNERS LP 9.00% Class B Fixed-to-Floating Rate Cumulative Redeemable Perpetual Preferred Units representing limited partnership interests,25.36,,7218,Uncategorized
NGL^C,NGL ENERGY PARTNERS LP 9.625% Class C Fixed-to-Floating Rate Cumulative  Redeemable Perpetual Preferred Units representing  limited partner interests,25.44,,601,Uncategorized
NLY^F,Annaly Capital Management Inc 6.95% Series F,25.96,,22878,Uncategorized
NLY^G,Annaly Capital Management Inc 6.50% Series G Fixed-to-Floating Rate Cumulative Redeemable Preferred Stock,25.02,,24358,Uncategorized
NLY^I,Annaly Capital Management Inc 6.750% Series I Fixed-to-Floating Rate Cumulative Redeemable Preferred Stock,25.62,,30150,Uncategorized
NLY^J,Annaly Capital Management Inc. 8.875% Series J Fixed-Rate Cumulative Redeemable Preferred Stock,26.05,,26863,Uncategorized
NREF^A,NexPoint Real Estate Finance Inc. 8.50% Series A Cumulative Redeemable Preferred Stock,22.85,,119,Uncategorized
NSA^A,National Storage Affiliates Trust 6.000% Series A Cumulative Redeemable Preferred Shares of Beneficial Interest (Liquidation Preference $25.00 per share),22.9,,1766,Uncategorized
NSA^B,National Storage Affiliates Trust 6.000% Series B Cumulative Redeemable Preferred Shares of Beneficial Interest,29.76,,1758,Uncategorized
NXDT^A,NexPoint Diversified Real Estate Trust 5.50% Series A Cumulative Preferred Shares ($25.00 liquidation preference per share),13.205,,4469,Uncategorized
OAK^A,Brookfield Oaktree Holdings LLC 6.625% Series A Preferred Units,20.65,,5694,Uncategorized
OAK^B,Brookfield Oaktree Holdings LLC 6.550% Series B Preferred Units,20.6,,8574,Uncategorized
OPP^A,RiverNorth/DoubleLine Strategic Opportunity Fund Inc. 4.375% Series A Cumulative Preferred Stock,16.58,,3849,Uncategorized
OPP^B,RiverNorth/DoubleLine Strategic Opportunity Fund Inc. 4.75% Series B Cumulative Preferred Stock,18.29,,1872,Uncategorized
ORCL^D,Oracle Corporation Depositary Shares each representing a 1/2000th interest in a sh of 6.50% Series D Mandatory Convertible Preferred Stock,57.25,,878104,Uncategorized
PBI^B,Pitney Bowes Inc 6.70% Notes Due 2043,21.61,,11854,Uncategorized
PCG^A,Pacific Gas & Electric Co. 6% Preferred Stock,22.67,,5575,Uncategorized
PCG^B,Pacific Gas & Electric Co. 5 1/2% Preferred Stock,20.6,,857,Uncategorized
PCG^C,Pacific Gas & Electric Co. 5% 1st Preferred Stock,18.85,,394,Uncategorized
PCG^D,Pacific Gas & Electric Co. 5% 1st  Red. Preferred Stock,18.59,,725,Uncategorized
PCG^E,Pacific Gas & Electric Co. 5% 1st A Preferred Stock,19.2,,186,Uncategorized
PCG^G,Pacific Gas & Electric Co. 4.80% 1st Preferred Stock,18.5,,281,Uncategorized
PCG^H,Pacific Gas & Electric Co. 4.50% 1st Preferred Stock,17.31,,319,Uncategorized
PCG^I,Pacific Gas & Electric Co. 4.36% 1st Preferred Stock,16.83,,174,Uncategorized
PCG^X,PG&E Corp 6.000% Series A Mandatory Convertible Preferred Stock,40.31,,30336,Uncategorized
PEB^E,Pebblebrook Hotel Trust 6.375% Series E Cumulative Redeemable Preferred Shares of Beneficial Interest,19.88,,3821,Uncategorized
PEB^F,Pebblebrook Hotel Trust 6.3% Series F Cumulative Redeemable Preferred Shares of Beneficial Interest,19.75,,74679,Uncategorized
PEB^G,Pebblebrook Hotel Trust 6.375% Series G Cumulative Redeemable Preferred Shares of Beneficial Interest,19.79,,27728,Uncategorized
PEB^H,Pebblebrook Hotel Trust 5.700% Series H Cumulative Redeemable Preferred Shares of Beneficial Interest,17.8,,38394,Uncategorized
PINE^A,Alpine Income Property Trust Inc. 8.00% Series A Cumulative Redeemable Preferred Stock,25.23,,2353,Uncategorized
PMT^A,PennyMac Mortgage Investment Trust 8.125% Series A Fixed-to-Floating Rate Cumulative Redeemable Preferred Shares of Beneficial Interest,23.25,,4217,Uncategorized
PMT^B,PennyMac Mortgage Investment Trust 8.00% Series B Fixed-to-Floating Rate Cumulative Redeemable Preferred Shares of Beneficial Interest,23.22,,4805,Uncategorized
PMT^C,PennyMac Mortgage Investment Trust 6.75% Series C Cumulative Redeemable Preferred Shares of Beneficial Interest,18.265,,28255,Uncategorized
PNFP^A,Pinnacle Financial Partners Inc. Fixed-to-Floating Rate Non-Cumulative Perpetual Preferred Stock Series A,25.605,,3136,Uncategorized
