symbol,name,price,marketCap,volume,industry
BRK/B,Berkshire Hathaway Inc.,480.94,1061103390769.0,7781322,Uncategorized
BRK/A,Berkshire Hathaway Inc.,720702.08,1060061951218.0,555,Uncategorized
GEV,GE Vernova Inc. Common Stock,851.07,229388440926.0,4435582,Uncategorized
AGNCZ,AGNC Investment Corp. Depositary Shares Each Representing a 1/1000th Interest in a Share of 8.75% Series H Fixed-Rate Cumulative Redeemable Preferred Stock,24.95,27663828217.0,167373,Uncategorized
TPGXL,TPG Operating Group II L.P. 6.950% Fixed-Rate Junior Subordinated Notes due 2064,24.06,8777708147.0,39789,Uncategorized
SATA,Strive Inc. Variable Rate Series A Perpetual Preferred Stock,97.1,6484122924.0,125215,Uncategorized
OTF,Blue Owl Technology Finance Corp. Common Stock,12.5,5816624888.0,10379225,Uncategorized
CBC,Central Bancompany Inc. Class A Common Stock,23.41,5581948289.0,3977169,Uncategorized
AUGO,Aura Minerals Inc. Common Shares,61.07,5101452281.0,2888626,Uncategorized
GEF,Greif Inc. Class A Common Stock,62.6,2897504539.0,1063747,Uncategorized
NMFCZ,New Mountain Finance Corporation 8.250% Notes due 2028,25.2799,2688794458.0,20094,Uncategorized
BELFB,Bel Fuse Inc. Class B Common Stock,204.09,2583026920.0,243675,Uncategorized
BELFA,Bel Fuse Inc. Class A Common Stock,189.6,2399636945.0,64891,Uncategorized
BTX,BlackRock Technology and Private Equity Term Trust Common Shares of Beneficial Interest,6.38,1504379590.0,837987,Uncategorized
IMSR,Terrestrial Energy Inc. Common Stock  ,6.12,647388606.0,6606204,Uncategorized
NCDL,Nuveen Churchill Direct Lending Corp. Common Stock,13.04,644007328.0,604168,Uncategorized
WHFCL,WhiteHorse Finance Inc. 7.875% Notes due 2028,25.13,584098801.0,5353,Uncategorized
PPHC,Public Policy Holding Company Inc. Common Stock,13.0,326752127.0,609617,Uncategorized
SWKHL,SWK Holdings Corporation 9.00% Senior Notes due 2027,25.2499,306720408.0,7340,Uncategorized
ALCO,Alico Inc. Common Stock,38.47,294551172.0,93508,Uncategorized
CAMP,CAMP4 Therapeutics Corporation Common Stock,5.0,259596605.0,372850,Uncategorized
ORBS,Eightco Holdings Inc. Common Stock,0.944,186753045.0,42463272,Uncategorized
FGMC,FG Merger II Corp. Common stock,10.11,103530424.0,114637,Uncategorized
BLUW,Blue Water Acquisition Corp. III Class A Ordinary Shares,10.3,74623500.0,15,Uncategorized
STRRP,Star Equity Holdings Inc. 10% Series A Cumulative Perpetual Preferred Stock,10.12,34771338.0,10,Uncategorized
LSH,Lakeside Holding Limited Common Stock,0.98,33739008.0,551489,Uncategorized
SUIS,Canary Staked SUIS ETF Shares of Beneficial Interest,24.8063,26046615.0,306,Uncategorized
DFDVW,DeFi Development Corp. Warrant,0.684,20156221.0,2719,Uncategorized
VAVX,VanEck Avalanche ETF Common Shares of Beneficial Interest,19.8,11383753.0,1336,Uncategorized
LIMN,Liminatus Pharma Inc. Class A Common Stock,0.212,6585702.0,1627728,Uncategorized
BLUWW,Blue Water Acquisition Corp. III Warrant.,0.499,3615255.0,1700,Uncategorized
TDOG,21Shares Dogecoin ETF Common Shares of Beneficial Interest,18.8916,1649917.0,1499,Uncategorized
ERNAW,Ernexa Therapeutics Inc. Warrants,0.0351,1023321.0,1222,Uncategorized
LKSP,Lake Superior Acquisition Corp. Class A Ordinary Shares,10.02,0.0,3717,Uncategorized
GTEN,Gores Holdings X Inc. Class A ordinary shares,10.25,0.0,304,Uncategorized
PACH,Pioneer Acquisition I Corp Class A Ordinary Shares,10.1599,0.0,22,Uncategorized
GPATW,GP-Act III Acquisition Corp. Warrants,0.1501,0.0,12477,Uncategorized
PAACU,Proem Acquisition Corp I Units,10.0113,0.0,1000,Uncategorized
GPAT,GP-Act III Acquisition Corp. Class A Ordinary Share,10.82,0.0,88933,Uncategorized
GRML,Greenland Mines Ltd. Common Stock,0.4049,0.0,2772867,Uncategorized
PLMK,Plum Acquisition Corp. IV Class A Ordinary Shares,10.54,0.0,12406,Uncategorized
PLMKU,Plum Acquisition Corp. IV Unit,10.6,0.0,4,Uncategorized
XCBE,X3 Acquisition Corp. Ltd. Class A Ordinary Shares,9.8,0.0,86993,Uncategorized
LOKVW,Live Oak Acquisition Corp. V Warrants,1.5,0.0,2,Uncategorized
LPAA,Launch One Acquisition Corp. Class A Ordinary shares,10.7,0.0,2905,Uncategorized
LOKV,Live Oak Acquisition Corp. V Class A Ordinary Shares,10.33,0.0,5691,Uncategorized
MKLYR,McKinley Acquisition Corporation Rights,0.11,0.0,29,Uncategorized
CCIIW,Cohen Circle Acquisition Corp. II Warrant,0.6501,0.0,91260,Uncategorized
CCIIU,Cohen Circle Acquisition Corp. II Unit,10.35,0.0,100,Uncategorized
CCII,Cohen Circle Acquisition Corp. II Class A Ordinary Shares,10.29,0.0,29908,Uncategorized
LKSPR,Lake Superior Acquisition Corp. Rights,1.37,0.0,1425,Uncategorized
WSBK,Winchester Bancorp Inc. Common Stock,12.23,0.0,36896,Uncategorized
BGMS,Bio Green Med Solution Inc. Common Stock,0.94,0.0,33954,Uncategorized
CCXIW,Churchill Capital Corp XI Warrants,0.82,0.0,713,Uncategorized
VACH,Voyager Acquisition Corp Class A Ordinary Shares,10.5,0.0,13542,Uncategorized
CCXI,Churchill Capital Corp XI Class A Ordinary Shares,10.1574,0.0,267,Uncategorized
BGMSP,Bio Green Med Solution Inc. 6% Convertible Preferred Stock,1.44,0.0,4220,Uncategorized
ADACW,American Drive Acquisition Company Warrant,0.386,0.0,9249,Uncategorized
CHAC,Crane Harbor Acquisition Corp. Class A Ordinary Shares,8.33,0.0,308063,Uncategorized
OCCIM,OFS Credit Company Inc. 7.875% Series F Term Preferred Stock,24.65,0.0,1603,Uncategorized
GIW,GigCapital8 Corp. Class A Ordinary Shares,9.98,0.0,20208,Uncategorized
AACBR,Artius II Acquisition Inc. Rights,0.335,0.0,8216,Uncategorized
GIWWR,GigCapital8 Corp. Rights,0.292,0.0,100,Uncategorized
ANSC,Agriculture & Natural Solutions Acquisition Corporation Class A Ordinary Shares,11.28,0.0,11354,Uncategorized
ANSCW,Agriculture & Natural Solutions Acquisition Corporation Warrant,0.2099,0.0,8905,Uncategorized
BEAGR,Bold Eagle Acquisition Corp. Right,0.2804,0.0,56697,Uncategorized
LIMNW,Liminatus Pharma Inc. Warrants,0.0472,0.0,400,Uncategorized
BEAG,Bold Eagle Acquisition Corp. Class A Ordinary Shares,10.59,0.0,22040,Uncategorized
OFSSO,OFS Capital Corporation 7.50% Notes due 2028,25.82,0.0,1625,Uncategorized
MLACR,Mountain Lake Acquisition Corp. Right,0.2586,0.0,20905,Uncategorized
GPAC,General Purpose Acquisition Corp. Class A Ordinary Shares,9.9,0.0,1,Uncategorized
GPACU,General Purpose Acquisition Corp. Units,10.02,0.0,202,Uncategorized
ALF,Centurion Acquisition Corp. Class A Ordinary Shares,10.78,0.0,87723,Uncategorized
HVMC,Highview Merger Corp. Class A Ordinary Share,10.05,0.0,1192,Uncategorized
ABXL,Abacus Global Management Inc. 9.875% Fixed Rate Senior Notes due 2028,25.03,0.0,20958,Uncategorized
CEPV,Cantor Equity Partners V Inc. Class A Ordinary Shares,10.125,0.0,632,Uncategorized
PGAC,Pantages Capital Acquisition Corporation Class A Ordinary Shares,10.47,0.0,7761,Uncategorized
BAYA,Bayview Acquisition Corp Ordinary Shares,11.95,0.0,202,Uncategorized
METCI,Ramaco Resources Inc. 8.250% Senior Notes due 2030,25.1,0.0,13944,Uncategorized
MESHU,Meshflow Acquisition Corp. Units,9.96,0.0,1799,Uncategorized
BAYAR,Bayview Acquisition Corp Right,0.22,0.0,60965,Uncategorized
HLXC,Helix Acquisition Corp. III Class A Ordinary Shares,10.3,0.0,1568,Uncategorized
BBCQ,Bleichroeder Acquisition Corp. II Class A Ordinary Shares,10.04,0.0,227554,Uncategorized
BBCQU,Bleichroeder Acquisition Corp. II Units,10.35,0.0,3669,Uncategorized
BBCQW,Bleichroeder Acquisition Corp. II Warrants,0.95,0.0,107439,Uncategorized
ALIS,Calisa Acquisition Corp Ordinary shares,10.01,0.0,25,Uncategorized
HACQU,HCM IV Acquisition Corp. Unit,10.05,0.0,927,Uncategorized
ARCI,Archimedes Tech SPAC Partners III Co. Ordinary Share,9.85,0.0,418389,Uncategorized
ARCIW,Archimedes Tech SPAC Partners III Co. Warrant,0.58,0.0,62501,Uncategorized
ALISU,Calisa Acquisition Corp Units,10.51,0.0,212,Uncategorized
BPACR,Blueport Acquisition Ltd Rights,0.21,0.0,10,Uncategorized
HCICU,Hennessy Capital Investment Corp. VIII Units,10.0,0.0,15,Uncategorized
HCMAU,HCM III Acquisition Corp. Units,10.31,0.0,100,Uncategorized
IGACR,Invest Green Acquisition Corporation Rights,0.19,0.0,1262,Uncategorized
IEAGU,Infinite Eagle Acquisition Corp. Unit,10.15,0.0,2440,Uncategorized
BPAC,Blueport Acquisition Ltd Class A Ordinary Shares,10.0,0.0,11,Uncategorized
PCSC,Perceptive Capital Solutions Corp Class A Ordinary Shares,11.1,0.0,54695,Uncategorized
PCAPU,ProCap Acquisition Corp Unit,10.28,0.0,266,Uncategorized
VSECU,VSE Corporation Tangible Equity Units,47.43,0.0,144948,Uncategorized
BHAVU,BHAV Acquisition Corp Units,9.96,0.0,435518,Uncategorized
WLIIU,Willow Lane Acquisition Corp. II Unit,10.2,0.0,1101,Uncategorized
BIXIW,Bitcoin Infrastructure Acquisition Corp Ltd. Warrant,0.2632,0.0,24,Uncategorized
GSHR,Gesher Acquisition Corp. II Class A Ordinary Shares,10.31,0.0,51000,Uncategorized
MACI,Melar Acquisition Corp. I Class A Ordinary Shares,10.76,0.0,6549,Uncategorized
MCN,XAI Madison Equity Premium Income Fund Common Shares,5.75,0.0,73303,Uncategorized
VHCP,Vine Hill Capital Investment Corp. II Class A Ordinary Shares,9.9,0.0,1,Uncategorized
MCGAW,Yorkville Acquisition Corp. Warrant,0.3433,0.0,4814,Uncategorized
BIXI,Bitcoin Infrastructure Acquisition Corp Ltd. Class A Ordinary Shares,9.9199,0.0,526,Uncategorized
GSRF,GSR IV Acquisition Corp. Class A ordinary share,10.03,0.0,22783,Uncategorized
PLMKW,Plum Acquisition Corp. IV Warrants,0.56,0.0,1144,Uncategorized
VCIC,Vine Hill Capital Investment Corp. Class A Ordinary Shares,10.66,0.0,230009,Uncategorized
OIMAW,OneIM Acquisition Corp. Warrant,0.649,0.0,114,Uncategorized
OXLCI,Oxford Lane Capital Corp. 8.75% Notes due 2030,25.2,0.0,3678,Uncategorized
CAQUU,Cambridge Acquisition Corp. Unit,9.92,0.0,722,Uncategorized
OIM,OneIM Acquisition Corp. Class A Ordinary Shares,10.01,0.0,4983,Uncategorized
HSPTU,Horizon Space Acquisition II Corp. Units,7.24,0.0,5,Uncategorized
CAPN,Cayson Acquisition Corp Ordinary shares,10.87,0.0,5,Uncategorized
LPCV,Launchpad Cadenza Acquisition Corp I Class A Ordinary Share,9.91,0.0,4260,Uncategorized
BLZRU,Trailblazer Acquisition Corp. Unit,10.1801,0.0,3969,Uncategorized
LPCVW,Launchpad Cadenza Acquisition Corp I Warrant,0.2127,0.0,17218,Uncategorized
MKLY,McKinley Acquisition Corporation Class A Ordinary Shares,10.02,0.0,2613,Uncategorized
CAEP,Cantor Equity Partners III Inc. Class A Ordinary Shares,10.26,0.0,21670,Uncategorized
BLRKW,Bluerock Acquisition Corp. Warrants,0.2901,0.0,1666,Uncategorized
BLRKU,Bluerock Acquisition Corp. Unit,10.05,0.0,11,Uncategorized
ADAC,American Drive Acquisition Company Class A Ordinary Shares,9.89,0.0,1140,Uncategorized
WENN,Wen Acquisition Corp Class A Ordinary Shares,10.2,0.0,119031,Uncategorized
BNCWW,CEA Industries Inc. Warrant,0.0302,0.0,4419,Uncategorized
LPBB,Launch Two Acquisition Corp. Class A Ordinary Shares,10.57,0.0,4863,Uncategorized
GTENU,Gores Holdings X Inc. Units,10.35,0.0,10,Uncategorized
GTENW,Gores Holdings X Inc. Warrants,0.58,0.0,300,Uncategorized
PGACR,Pantages Capital Acquisition Corporation Right,0.21,0.0,360,Uncategorized
PACHU,Pioneer Acquisition I Corp Units,10.3,0.0,1450,Uncategorized
ONCHU,1RT Acquisition Corp. Units,10.29,0.0,8533,Uncategorized
ONCH,1RT Acquisition Corp. Class A Ordinary Share,10.18,0.0,7860,Uncategorized
PGACU,Pantages Capital Acquisition Corporation Unit,10.51,0.0,120,Uncategorized
SOCA,Solarius Capital Acquisition Corp. Class A Ordinary Share,10.12,0.0,4,Uncategorized
SAAQ,Space Asset Acquisition Corp. Class A Ordinary Shares,9.91,0.0,9498,Uncategorized
SABA,Saba Capital Income & Opportunities Fund II Shares of Beneficial Interest,8.06,0.0,216715,Uncategorized
SPEG,Silver Pegasus Acquisition Corp Class A Ordinary Shares,10.15,0.0,35,Uncategorized
SPKL,Spark I Acquisition Corp. Class A Ordinary Share,11.31,0.0,522,Uncategorized
SAAQW,Space Asset Acquisition Corp. Warrants,0.68,0.0,2103,Uncategorized
DRDB,Roman DBDR Acquisition Corp. II Ordinary shares,10.48,0.0,137544,Uncategorized
DRDBU,Roman DBDR Acquisition Corp. II Unit,10.53,0.0,2084,Uncategorized
DRDBW,Roman DBDR Acquisition Corp. II Warrants,0.34,0.0,5100,Uncategorized
KFII,K&F Growth Acquisition Corp. II Class A Ordinary shares,10.44,0.0,8105,Uncategorized
KFIIR,K&F Growth Acquisition Corp. II Rights,0.178,0.0,100,Uncategorized
DMAA,Drugs Made In America Acquisition Corp. Ordinary Shares,10.52,0.0,12014,Uncategorized
DMIIU,Drugs Made In America Acquisition II Corp. Unit,10.03,0.0,8206,Uncategorized
SSEA,Starry Sea Acquisition Corp	Ordinary Shares,10.12,0.0,1,Uncategorized
SSEAR,Starry Sea Acquisition Corp Rights,0.21,0.0,121,Uncategorized
KOYN,CSLM Digital Asset Acquisition Corp III Class A Ordinary Shares,10.03,0.0,3639,Uncategorized
KOYNU,CSLM Digital Asset Acquisition Corp III Units,10.145,0.0,250,Uncategorized
KRAQ,KRAKacquisition Corp Class A Ordinary Shares,9.92,0.0,17253,Uncategorized
KRAQU,KRAKacquisition Corp Unit,10.065,0.0,53805,Uncategorized
ITHA,ITHAX Acquisition Corp III Class A Ordinary Shares,9.89,0.0,72434,Uncategorized
ITHAU,ITHAX Acquisition Corp III Units,9.98,0.0,2270,Uncategorized
ITHAW,ITHAX Acquisition Corp III Warrants,0.23,0.0,1000,Uncategorized
NOEM,CO2 Energy Transition Corp. Common Stock,10.37,0.0,379,Uncategorized
NOEMW,CO2 Energy Transition Corp. Warrant,0.1,0.0,10835,Uncategorized
AFJK,Aimei Health Technology Co. Ltd Ordinary Share,27.5,0.0,4523,Uncategorized
AFJKR,Aimei Health Technology Co. Ltd Right,0.3497,0.0,134375,Uncategorized
AFJKU,Aimei Health Technology Co. Ltd Unit,27.61,0.0,101,Uncategorized
FACT,FACT II Acquisition Corp. Class A Ordinary Shares,10.485,0.0,5544,Uncategorized
EMAT,Evolution Metals & Technologies Corp. Common Stock,6.82,0.0,37504,Uncategorized
EMPD,Empery Digital Inc. Common stock,4.27,0.0,463391,Uncategorized
SCII,SC II Acquisition Corp. Class A ordinary share,10.03,0.0,15,Uncategorized
SCIIR,SC II Acquisition Corp. Rights,0.2291,0.0,64162,Uncategorized
SCIIU,SC II Acquisition Corp. Units,10.3,0.0,6736,Uncategorized
EICC,Eagle Point Income Company Inc. 8.00% Series C Term Preferred Stock due 2029,24.95,0.0,31803,Uncategorized
AACB,Artius II Acquisition Inc. Class A Ordinary Shares,10.34,0.0,12,Uncategorized
MBVI,M3-Brigade Acquisition VI Corp. Class A Ordinary Shares,10.05,0.0,917,Uncategorized
HVMCW,Highview Merger Corp. Warrants,0.2508,0.0,2600,Uncategorized
MBAV,M3-Brigade Acquisition V Corp. Class A Ordinary shares,10.67,0.0,4725,Uncategorized
SCPQW,Social Commerce Partners Corporation Warrant,0.3761,0.0,1300,Uncategorized
AACOU,Abony Acquisition Corp. I Units,9.94,0.0,1692,Uncategorized
ATII,Archimedes Tech SPAC Partners II Co. Ordinary Shares,10.44,0.0,422082,Uncategorized
NEWTO,NewtekOne Inc. 8.50% Fixed Rate Senior Notes due 2031,25.25,0.0,100,Uncategorized
SCPQ,Social Commerce Partners Corporation Class A Ordinary Shares,9.9,0.0,5,Uncategorized
SCPQU,Social Commerce Partners Corporation Unit,10.03,0.0,3824,Uncategorized
APAC,StoneBridge Acquisition II Corporation Class A Ordinary Shares,10.05,0.0,52,Uncategorized
APACR,StoneBridge Acquisition II Corporation Rights,0.1401,0.0,12,Uncategorized
DTSQ,DT Cloud Star Acquisition Corporation Ordinary Shares,11.1,0.0,654,Uncategorized
DTSQR,DT Cloud Star Acquisition Corporation Right,0.1405,0.0,2,Uncategorized
ETHM,Dynamix Corporation Class A Ordinary Shares,10.46,0.0,38674,Uncategorized
ETHMW,Dynamix Corporation Warrant,0.8,0.0,6638,Uncategorized
EURK,Eureka Acquisition Corp Class A Ordinary Share,11.16,0.0,49,Uncategorized
EURKR,Eureka Acquisition Corp Right,0.3897,0.0,4,Uncategorized
ETHB,iShares Staked Ethereum Trust ETF Shares of Fractional Undivided Beneficial Interest,27.45,0.0,315263,Uncategorized
KCHV,Kochav Defense Acquisition Corp. Class A Ordinary Shares,10.25,0.0,13845,Uncategorized
ECCU,Eagle Point Credit Company Inc. 7.75% Notes due 2030,24.755,0.0,7520,Uncategorized
NHIC,NewHold Investment Corp III Class A Ordinary Shares,10.38,0.0,104,Uncategorized
NHICW,NewHold Investment Corp III Warrants,0.3601,0.0,2000,Uncategorized
PTORU,Praetorian Acquisition Corp. Units,9.95,0.0,2648,Uncategorized
LGI,Lazard Global Total Return and Income Fund Common Stock,16.66,0.0,82343,Uncategorized
AEFC,Aegon Funding Company LLC 5.10% Subordinated Notes due 2049,19.48,0.0,137958,Uncategorized
TLNC,Talon Capital Corp. Class A Ordinary Shares,10.15,0.0,304037,Uncategorized
TLNCW,Talon Capital Corp. Warrants,0.302,0.0,192,Uncategorized
LFACU,Leapfrog Acquisition Corporation Units,10.0785,0.0,4,Uncategorized
CRANU,Crane Harbor Acquisition Corp. II Units,10.09,0.0,1745,Uncategorized
QUMS,Quantumsphere Acquisition Corp. Ordinary Shares,10.1,0.0,5271,Uncategorized
QUMSR,Quantumsphere Acquisition Corp. Rights,0.278,0.0,52,Uncategorized
QUMSU,Quantumsphere Acquisition Corp. Units,10.32,0.0,1,Uncategorized
FVAV,Fortress Value Acquisition Corp. V Class A Ordinary Shares,10.04,0.0,86449,Uncategorized
TVA,Texas Ventures Acquisition III Corp Class A Ordinary Share,10.33,0.0,252649,Uncategorized
TVACW,Texas Ventures Acquisition III Corp Warrants,0.48,0.0,4829,Uncategorized
TVAI,Thayer Ventures Acquisition Corporation II Class A Ordinary Shares,10.2,0.0,3311,Uncategorized
ARTCU,Art Technology Acquisition Corp. Units,9.9,0.0,25,Uncategorized
IMSRW,Terrestrial Energy Inc. Warrant,3.0099,0.0,14459,Uncategorized
INAC,Indigo Acquisition Corp. Ordinary Shares,10.13,0.0,154,Uncategorized
INACU,Indigo Acquisition Corp. Unit,10.27,0.0,632,Uncategorized
POLE,Andretti Acquisition Corp. II Class A Ordinary Shares,10.64,0.0,4570,Uncategorized
POLEW,Andretti Acquisition Corp. II Warrant,0.1011,0.0,574,Uncategorized
ARTCW,Art Technology Acquisition Corp. Warrants,0.3879,0.0,108367,Uncategorized
TRGSU,TRG Latin America Acquisitions Corp. Units,10.0,0.0,41787,Uncategorized
TSUI,21shares Sui ETF Common Shares of Beneficial Interest Shares,19.1694,0.0,6329,Uncategorized
GIXXR,GigCapital9 Corp. Rights,0.2505,0.0,2000,Uncategorized
GECCH,Great Elm Capital Corp. 8.125% Notes Due 2029,25.15,0.0,864,Uncategorized
FGMCR,FG Merger II Corp. Rights,0.495,0.0,1600,Uncategorized
FGMCU,FG Merger II Corp. Unit,10.69,0.0,30,Uncategorized
IRHO,Iron Horse Acquisitions II Corp. Common Stock,9.86,0.0,21979,Uncategorized
IRHOR,Iron Horse Acquisitions Corp. II Rights,0.1103,0.0,1000,Uncategorized
DBL,DoubleLine Opportunistic Credit Fund Common Shares of Beneficial Interest,14.26,0.0,99772,Uncategorized
SVCC,Stellar V Capital Corp. Class A Ordinary Shares,10.43,0.0,206,Uncategorized
MSDL,Morgan Stanley Direct Lending Fund Common Stock,14.4,0.0,1215056,Uncategorized
RANG,Range Capital Acquisition Corp. Ordinary Shares,10.5,0.0,13579,Uncategorized
FSHP,Flag Ship Acquisition Corp. Ordinary Shares,10.93,0.0,2947,Uncategorized
FSHPR,Flag Ship Acquisition Corp. Right,0.148,0.0,151,Uncategorized
RANGR,Range Capital Acquisition Corp. Rights,0.36,0.0,235,Uncategorized
ALOVW,Aldabra 4 Liquidity Opportunity Vehicle Inc. Warrants,0.35,0.0,6200,Uncategorized
ALOY,REalloys Inc. Common Stock,12.09,0.0,1589712,Uncategorized
CUBWW,Lionheart Holdings Warrant,0.142,0.0,2048,Uncategorized
KVAC,Keen Vision Acquisition Corporation Ordinary Shares,12.0,0.0,2048,Uncategorized
KVACW,Keen Vision Acquisition Corporation Warrant,0.047,0.0,6711,Uncategorized
KRAQW,KRAKacquisition Corp Warrants,0.8,0.0,6000,Uncategorized
ALOV,Aldabra 4 Liquidity Opportunity Vehicle Inc. Class A Ordinary Shares,9.83,0.0,106,Uncategorized
TDAC,Translational Development Acquisition Corp. Ordinary Shares,10.55,0.0,106,Uncategorized
TDACW,Translational Development Acquisition Corp. Warrants,0.14,0.0,49301,Uncategorized
ABR^D,Arbor Realty Trust 6.375% Series D Cumulative Redeemable Preferred Stock Liquidation Preference $25.00 per Share,17.26,,16302,Uncategorized
ABR^E,Arbor Realty Trust 6.25% Series E Cumulative Redeemable Preferred Stock,16.89,,10636,Uncategorized
ABR^F,Arbor Realty Trust 6.25% Series F Fixed-to-Floating Rate Cumulative Redeemable Preferred Stock Liquidation Preference $25.00 per share,22.15,,60512,Uncategorized
ACP^A,abrdn Income Credit Strategies Fund 5.250% Series A Perpetual Preferred Stock,20.1,,2679,Uncategorized
ACR^C,ACRES Commercial Realty Corp. 8.625% Fixed-to-Floating Series C Cumulative Redeemable Preferred Stock ,24.79,,11979,Uncategorized
ACR^D,ACRES Commercial Realty Corp. 7.875% Series D Cumulative Redeemable Preferred Stock,21.78,,3733,Uncategorized
ADC^A,Agree Realty Corporation Depositary Shares each representing 1/1000th of a 4.250% Series A Cumulative Redeemable Preferred Stock,17.2,,15676,Uncategorized
AGM^D,Federal Agricultural Mortgage Corporation 5.700% Non-Cumulative Preferred Stock Series D,21.125,,2996,Uncategorized
AGM^E,Federal Agricultural Mortgage Corporation 5.750% Non-Cumulative Preferred Stock Series E,21.34,,196,Uncategorized
AGM^F,Federal Agricultural Mortgage Corporation 5.250% Non-Cumulative Preferred Stock Series F,19.31,,11359,Uncategorized
AGM^G,Federal Agricultural Mortgage Corporation 4.875% Non-Cumulative Preferred Stock Series G,17.8,,9002,Uncategorized
AGM^H,Federal Agricultural Mortgage Corporation 6.500% Non-Cumulative Preferred Stock Series H,24.7,,816,Uncategorized
AHRT^A,AH Realty Trust Inc. 6.75% Series A Cumulative Redeemable Perpetual Preferred Stock,21.93,,4007,Uncategorized
AHT^D,Ashford Hospitality Trust Inc 8.45% Series D Cumulative Preferred Stock,8.0,,3049,Uncategorized
AHT^F,Ashford Hospitality Trust Inc 7.375% Series F Cumulative Preferred Stock,6.47,,21,Uncategorized
AHT^G,Ashford Hospitality Trust Inc 7.375% Series G Cumulative Preferred Stock,6.2501,,4076,Uncategorized
AHT^H,Ashford Hospitality Trust Inc 7.50% Series H Cumulative Preferred Stock,6.5,,1119,Uncategorized
AHT^I,Ashford Hospitality Trust Inc 7.50% Series I Cumulative Preferred Stock,6.25,,2588,Uncategorized
ALB^A,Albemarle Corporation Depositary Shares each representing a 1/20th of 7.25% Series A Mandatory Convertible Preferred Stock,63.72,,43836,Uncategorized
ALL^B,Allstate Corporation (The) 5.100% Fixed-to-Floating Rate Subordinated Debentures due 2053,25.99,,27922,Uncategorized
ALL^H,Allstate Corporation (The) Depositary Shares each representing a 1/1000th interest in a share of Fixed Rate Noncumulative Perpetual Preferred Stock Series H,20.28,,70553,Uncategorized
ALL^I,Allstate Corporation (The) Depositary Shares each representing a 1/1000th interest in a share of Fixed Rate Noncumulative Perpetual Preferred Stock Series I,18.95,,13087,Uncategorized
ALL^J,Allstate Corporation (The) Depositary Shares each representing a 1/1000th interest in a share of Fixed Rate Noncumulative Perpetual Preferred Stock Series J,26.17,,39359,Uncategorized
ALTG^A,Alta Equipment Group Inc. Depositary Shares (each representing 1/1000th in a share of 10% Series A Cumulative Perpetual Preferred Stock),24.91,,1694,Uncategorized
AMH^G,American Homes 4 Rent Series G cumulative redeemable perpetual preferred shares of beneficial interest,22.31,,11905,Uncategorized
AMH^H,American Homes 4 Rent Series H cumulative redeemable perpetual Preferred Shares of Beneficial Interest,23.38,,5023,Uncategorized
ANG^D,American National Group Inc. Depositary Shares each representing a 1/1000th interest in a share of 7.375% Fixed-Rate Non-Cumulative Preferred Stock Series D,24.01,,28631,Uncategorized
APO^A,Apollo Global Management Inc. 6.75% Series A Mandatory Convertible Preferred Stock,59.01,,156982,Uncategorized
ARES^B,Ares Management Corporation 6.75% Series B Mandatory Convertible Preferred Stock,35.94,,68846,Uncategorized
ARR^C,ARMOUR Residential REIT Inc. 7% Series C Cumulative Redeemable Preferred Stock (liquidation preference $25.00 per share),20.1301,,21534,Uncategorized
ASB^E,Associated Banc-Corp Depositary Shares each representing a 1/40th interest in a share of 5.875% Non-Cumulative Perpetual Preferred Stock Series E,20.75,,6472,Uncategorized
ASB^F,Associated Banc-Corp Depositary Shares each representing a 1/40th interest in a share of Associated Banc-Corp 5.625% Non-Cumulative Perpetual Preferred Stock Series F,20.27,,3919,Uncategorized
AUB^A,Atlantic Union Bankshares Corporation Depositary Shares each representing a 1/400th ownership interest in a share of 6.875% Perpetual Non-Cumulative Preferred Stock Series A,24.46,,7311,Uncategorized
BA^A,Boeing Company (The) Depositary Shares each representing a 1/20th interest in a share of 6.00% Series A Mandatory Convertible Preferred Stock par value $1.00,63.68,,605573,Uncategorized
BAC^B,Bank of America Corporation Depositary Shares each representing a 1/1000th interest in a share of 6.000% Non-Cumulative Preferred Stock Series GG,24.72,,92817,Uncategorized
BAC^E,Bank of America Corporation Depositary Sh repstg 1/1000th Perp Pfd Ser E,19.0,,23267,Uncategorized
BAC^K,Bank of America Corporation Depositary Shares each representing a 1/1000th interest in a share of 5.875% Non- Cumulative Preferred Stock Series HH,24.46,,66997,Uncategorized
BAC^L,Bank of America Corporation Non Cumulative Perpetual Conv Pfd Ser L,1194.99,,14284,Uncategorized
BAC^M,Bank of America Corporation Depositary Shares each representing a 1/1000th interest in a share of 5.375% Non-Cumulative Preferred Stock Series KK,21.59,,84970,Uncategorized
BAC^N,Bank of America Corporation Depositary shares each representing 1/1000th interest in a share of 5.000% Non-Cumulative Preferred Stock Series LL,20.28,,75865,Uncategorized
BAC^O,Bank of America Corporation Depositary shares each representing 1/1000th interest in a share of 4.375% Non-Cumulative Preferred Stock Series NN,17.44,,49258,Uncategorized
BAC^P,Bank of America Corporation Depositary Shares each representing a 1/1000th interest in a share of 4.125% Non-Cumulative Preferred Stock Series PP,16.6,,60933,Uncategorized
BAC^Q,Bank of America Corporation Depositary shares each representing 1/1000th interest in a share of 4.250% Non-Cumulative Preferred Stock Series QQ,16.86,,234272,Uncategorized
BAC^S,Bank of America Corporation Depositary shares each representing 1/1000th interest in a share of 4.750% Non-Cumulative Preferred Stock Series SS,19.05,,39943,Uncategorized
BANC^F,Banc of California Inc. Depositary Shares each representing a 1/40th interest in a share of 7.75% non-cumulative perpetual preferred stock Series F,24.8899,,45850,Uncategorized
