symbol,name,price,marketCap,volume,industry
BRK/A,Berkshire Hathaway Inc.,705940.0,1038348791560.0,297,Uncategorized
BRK/B,Berkshire Hathaway Inc.,469.83,1036591271437.0,5698896,Uncategorized
GEV,GE Vernova Inc. Common Stock,1118.96,300686925605.0,2282788,Uncategorized
AGNCZ,AGNC Investment Corp. Depositary Shares Each Representing a 1/1000th Interest in a Share of 8.75% Series H Fixed-Rate Cumulative Redeemable Preferred Stock,25.5,29272196436.0,156437,Uncategorized
TPGXL,TPG Operating Group II L.P. 6.950% Fixed-Rate Junior Subordinated Notes due 2064,24.75,9029437931.0,20077,Uncategorized
AUGO,Aura Minerals Inc. Common Shares,89.7,7493045188.0,758745,Uncategorized
SATA,Strive Inc. Variable Rate Series A Perpetual Preferred Stock,99.31,6868158938.0,151844,Uncategorized
CBC,Central Bancompany Inc. Class A Common Stock,27.29,6557598808.0,369456,Uncategorized
OTF,Blue Owl Technology Finance Corp. Common Stock,11.73,5416018919.0,3713228,Uncategorized
BELFB,Bel Fuse Inc. Class B Common Stock,286.89,3660424920.0,293978,Uncategorized
BELFA,Bel Fuse Inc. Class A Common Stock,254.69,3249585635.0,47444,Uncategorized
GEF,Greif Inc. Class A Common Stock,68.22,3147418864.0,188500,Uncategorized
NMFCZ,New Mountain Finance Corporation 8.250% Notes due 2028,25.23,2683487046.0,7871,Uncategorized
BTX,BlackRock Technology and Private Equity Term Trust Common Shares of Beneficial Interest,8.18,1928812703.0,607305,Uncategorized
DEC,Diversified Energy Company Common Stock,15.35,1178209067.0,797598,Uncategorized
NCDL,Nuveen Churchill Direct Lending Corp. Common Stock,14.65,723520502.0,165235,Uncategorized
IMSR,Terrestrial Energy Inc. Common Stock  ,8.62,709384210.0,9180764,Uncategorized
WHFCL,WhiteHorse Finance Inc. 7.875% Notes due 2028,25.62,595487915.0,934,Uncategorized
NHP,National Healthcare Properties Inc. Class A Common Stock,13.25,376461425.0,441118,Uncategorized
PPHC,Public Policy Holding Company Inc. Common Stock,13.4,336806039.0,55590,Uncategorized
ORBS,Eightco Holdings Inc. Common Stock,0.8428,316703409.0,13966954,Uncategorized
ALCO,Alico Inc. Common Stock,40.89,313080255.0,12651,Uncategorized
SWKHL,SWK Holdings Corporation 9.00% Senior Notes due 2027,25.362,308082131.0,1219,Uncategorized
CAMP,CAMP4 Therapeutics Corporation Common Stock,4.06,210818748.0,31850,Uncategorized
PAAC,Proem Acquisition Corp I Ordinary Shares,9.89,143078630.0,9,Uncategorized
FGMC,FG Merger II Corp. Common stock,10.18,104247252.0,100132,Uncategorized
BLUW,Blue Water Acquisition Corp. III Class A Ordinary Shares,10.26,74333700.0,6279,Uncategorized
STRRP,Star Equity Holdings Inc. 10% Series A Cumulative Perpetual Preferred Stock,10.09,37406798.0,1869,Uncategorized
LSH,Lakeside Holding Limited Common Stock,0.6001,20659978.0,54719,Uncategorized
DFDVW,DeFi Development Corp. Warrant,0.58,17108489.0,5710,Uncategorized
LIMN,Liminatus Pharma Inc. Class A Common Stock,0.205,9199915.0,664242,Uncategorized
VIVK,Vivakor Inc. Common Stock,1.74,3598391.0,208744,Uncategorized
BLUWW,Blue Water Acquisition Corp. III Warrant.,0.46,3332700.0,15544,Uncategorized
ERNAW,Ernexa Therapeutics Inc. Warrants,0.0626,73003.0,136112,Uncategorized
PGAC,Pantages Capital Acquisition Corporation Class A Ordinary Shares,10.51,0.0,15011,Uncategorized
DBL,DoubleLine Opportunistic Credit Fund Common Shares of Beneficial Interest,14.48,0.0,62548,Uncategorized
PGACR,Pantages Capital Acquisition Corporation Right,0.2,0.0,810,Uncategorized
FVAV,Fortress Value Acquisition Corp. V Class A Ordinary Shares,10.1,0.0,2113,Uncategorized
IRHO,Iron Horse Acquisitions II Corp. Common Stock,9.97,0.0,12388,Uncategorized
SPKLW,Spark I Acquisition Corp. Warrant,0.1651,0.0,20772,Uncategorized
SPKL,Spark I Acquisition Corp. Class A Ordinary Share,11.4,0.0,2017,Uncategorized
SPEGU,Silver Pegasus Acquisition Corp Unit,10.35,0.0,106,Uncategorized
SPEG,Silver Pegasus Acquisition Corp Class A Ordinary Shares,10.21,0.0,40045,Uncategorized
ARCI,Archimedes Tech SPAC Partners III Co. Ordinary Share,9.92,0.0,150350,Uncategorized
ITHA,ITHAX Acquisition Corp III Class A Ordinary Shares,9.93,0.0,73,Uncategorized
JATT,JATT II Acquisition Corp Ordinary Shares,10.51,0.0,728,Uncategorized
MSDL,Morgan Stanley Direct Lending Fund Common Stock,15.69,0.0,709851,Uncategorized
FSHP,Flag Ship Acquisition Corp. Ordinary Shares,10.97,0.0,89,Uncategorized
PLMK,Plum Acquisition Corp. IV Class A Ordinary Shares,10.6199,0.0,371,Uncategorized
APACR,StoneBridge Acquisition II Corporation Rights,0.13,0.0,30000,Uncategorized
ARTCW,Art Technology Acquisition Corp. Warrants,0.31,0.0,6200,Uncategorized
ARTCU,Art Technology Acquisition Corp. Units,9.9,0.0,26,Uncategorized
ATII,Archimedes Tech SPAC Partners II Co. Ordinary Shares,10.83,0.0,601627,Uncategorized
VSECU,VSE Corporation Tangible Equity Units,53.51,0.0,468325,Uncategorized
PCSC,Perceptive Capital Solutions Corp Class A Ordinary Shares,11.29,0.0,16890,Uncategorized
INACU,Indigo Acquisition Corp. Unit,10.34,0.0,340,Uncategorized
INAC,Indigo Acquisition Corp. Ordinary Shares,10.18,0.0,75106,Uncategorized
SCPQ,Social Commerce Partners Corporation Class A Ordinary Shares,9.92,0.0,50672,Uncategorized
SCIIR,SC II Acquisition Corp. Rights,0.23,0.0,102,Uncategorized
SCII,SC II Acquisition Corp. Class A ordinary share,10.0,0.0,1100,Uncategorized
NHIC,NewHold Investment Corp III Class A Ordinary Shares,10.57,0.0,10100,Uncategorized
SSEA,Starry Sea Acquisition Corp	Ordinary Shares,10.19,0.0,6270,Uncategorized
IMSRW,Terrestrial Energy Inc. Warrant,4.0499,0.0,116908,Uncategorized
NEWTO,NewtekOne Inc. 8.50% Fixed Rate Senior Notes due 2031,25.75,0.0,800,Uncategorized
BAYAR,Bayview Acquisition Corp Right,0.0949,0.0,2009,Uncategorized
BAYA,Bayview Acquisition Corp Ordinary Shares,11.93,0.0,7210,Uncategorized
BBCQW,Bleichroeder Acquisition Corp. II Warrants,1.39,0.0,216576,Uncategorized
BBCQU,Bleichroeder Acquisition Corp. II Units,10.85,0.0,5100,Uncategorized
EMPD,Empery Digital Inc. Common stock,5.14,0.0,282887,Uncategorized
ILLUW,Illumination Acquisition Corp I Warrant,0.3699,0.0,1000,Uncategorized
NHICW,NewHold Investment Corp III Warrants,0.8881,0.0,787,Uncategorized
BBCQ,Bleichroeder Acquisition Corp. II Class A Ordinary Shares,10.35,0.0,980447,Uncategorized
MUZEW,Muzero Acquisition Corp Warrant,0.27,0.0,14267,Uncategorized
GCGRU,General Catalyst Global Resilience Merger Corp. Units,10.0787,0.0,91,Uncategorized
FGMCU,FG Merger II Corp. Unit,10.75,0.0,23,Uncategorized
FGMCR,FG Merger II Corp. Rights,0.5799,0.0,8176,Uncategorized
VACH,Voyager Acquisition Corp Class A Ordinary Shares,13.08,0.0,1842,Uncategorized
DTSQU,DT Cloud Star Acquisition Corporation Units,10.9475,0.0,23,Uncategorized
DTSQ,DT Cloud Star Acquisition Corporation Ordinary Shares,11.22,0.0,8559,Uncategorized
WSBK,Winchester Bancorp Inc. Common Stock,12.65,0.0,32307,Uncategorized
LGI,Lazard Global Total Return and Income Fund Common Stock,17.93,0.0,84036,Uncategorized
MCN,XAI Madison Equity Premium Income Fund Common Shares,5.97,0.0,24849,Uncategorized
ANSC,Agriculture & Natural Solutions Acquisition Corporation Class A Ordinary Shares,11.34,0.0,33,Uncategorized
LKSPR,Lake Superior Acquisition Corp. Rights,1.125,0.0,60,Uncategorized
LKSP,Lake Superior Acquisition Corp. Class A Ordinary Shares,10.09,0.0,34267,Uncategorized
MKLYR,McKinley Acquisition Corporation Rights,0.12,0.0,105900,Uncategorized
AFJKR,Aimei Health Technology Co. Ltd Right,0.272,0.0,30521,Uncategorized
AFJK,Aimei Health Technology Co. Ltd Ordinary Share,45.34,0.0,1912,Uncategorized
METCI,Ramaco Resources Inc. 8.250% Senior Notes due 2030,25.18,0.0,8487,Uncategorized
DRDB,Roman DBDR Acquisition Corp. II Ordinary shares,10.52,0.0,242824,Uncategorized
WLIIU,Willow Lane Acquisition Corp. II Unit,10.12,0.0,7,Uncategorized
KVAC,Keen Vision Acquisition Corporation Ordinary Shares,12.08,0.0,4,Uncategorized
DRDBW,Roman DBDR Acquisition Corp. II Warrants,0.2026,0.0,30496,Uncategorized
MESH,Meshflow Acquisition Corp. Class A Ordinary Shares,9.95,0.0,41434,Uncategorized
LPBB,Launch Two Acquisition Corp. Class A Ordinary Shares,10.62,0.0,22812,Uncategorized
XCBE,X3 Acquisition Corp. Ltd. Class A Ordinary Shares,9.89,0.0,70,Uncategorized
MCGAW,Yorkville Acquisition Corp. Warrant,0.3434,0.0,6290,Uncategorized
LIMNW,Liminatus Pharma Inc. Warrants,0.0602,0.0,22261,Uncategorized
FACT,FACT II Acquisition Corp. Class A Ordinary Shares,10.5636,0.0,20029,Uncategorized
PTORU,Praetorian Acquisition Corp. Units,10.05,0.0,8846,Uncategorized
LOKVW,Live Oak Acquisition Corp. V Warrants,1.62,0.0,11019,Uncategorized
LOKV,Live Oak Acquisition Corp. V Class A Ordinary Shares,10.45,0.0,20663,Uncategorized
RREVU,RRE Ventures Acquisition Corp. Units,10.0,0.0,2344,Uncategorized
ADAC,American Drive Acquisition Company Class A Ordinary Shares,9.92,0.0,5100,Uncategorized
AEFC,Aegon Funding Company LLC 5.10% Subordinated Notes due 2049,19.53,0.0,30925,Uncategorized
DMAA,Drugs Made In America Acquisition Corp. Ordinary Shares,10.6,0.0,14144,Uncategorized
MACI,Melar Acquisition Corp. I Class A Ordinary Shares,10.82,0.0,8,Uncategorized
KFIIR,K&F Growth Acquisition Corp. II Rights,0.1172,0.0,525,Uncategorized
ANSCW,Agriculture & Natural Solutions Acquisition Corporation Warrant,0.19,0.0,2977,Uncategorized
ANSCU,Agriculture & Natural Solutions Acquisition Corporation Unit,11.11,0.0,1,Uncategorized
ECCU,Eagle Point Credit Company Inc. 7.75% Notes due 2030,25.33,0.0,6793,Uncategorized
SABA,Saba Capital Income & Opportunities Fund II Shares of Beneficial Interest,8.54,0.0,42886,Uncategorized
SSEAR,Starry Sea Acquisition Corp Rights,0.1802,0.0,5000,Uncategorized
CRANU,Crane Harbor Acquisition Corp. II Units,10.19,0.0,176,Uncategorized
KCHV,Kochav Defense Acquisition Corp. Class A Ordinary Shares,10.29,0.0,75103,Uncategorized
SOCA,Solarius Capital Acquisition Corp. Class A Ordinary Share,10.2,0.0,968,Uncategorized
ALF,Centurion Acquisition Corp. Class A Ordinary Shares,10.835,0.0,12594,Uncategorized
KRAQW,KRAKacquisition Corp Warrants,0.5,0.0,101885,Uncategorized
KRAQU,KRAKacquisition Corp Unit,10.035,0.0,3246,Uncategorized
KRAQ,KRAKacquisition Corp Class A Ordinary Shares,9.91,0.0,13395,Uncategorized
KOYN,CSLM Digital Asset Acquisition Corp III Class A Ordinary Shares,10.11,0.0,4,Uncategorized
KVACW,Keen Vision Acquisition Corporation Warrant,0.018,0.0,1781,Uncategorized
WENN,Wen Acquisition Corp Class A Ordinary Shares,10.23,0.0,38218,Uncategorized
ALIS,Calisa Acquisition Corp Ordinary shares,10.0554,0.0,1482,Uncategorized
MLACR,Mountain Lake Acquisition Corp. Right,0.2,0.0,27957,Uncategorized
ALDF,Aldel Financial II Inc. Class A Ordinary Shares,10.64,0.0,67815,Uncategorized
DYNCW,Dynamix Corporation Warrant,0.125,0.0,20896,Uncategorized
DYNCU,Dynamix Corporation Unit,10.89,0.0,265,Uncategorized
DYNC,Dynamix Corporation Class A Ordinary Shares,10.73,0.0,122358,Uncategorized
CAEP,Cantor Equity Partners III Inc. Class A Ordinary Shares,10.43,0.0,450649,Uncategorized
CAQUU,Cambridge Acquisition Corp. Unit,9.975,0.0,14,Uncategorized
GTENW,Gores Holdings X Inc. Warrants,0.63,0.0,301,Uncategorized
GTEN,Gores Holdings X Inc. Class A ordinary shares,10.36,0.0,121,Uncategorized
OIM,OneIM Acquisition Corp. Class A Ordinary Shares,10.03,0.0,385,Uncategorized
HACQU,HCM IV Acquisition Corp. Unit,10.05,0.0,152,Uncategorized
CCIIU,Cohen Circle Acquisition Corp. II Unit,10.4,0.0,3,Uncategorized
CCII,Cohen Circle Acquisition Corp. II Class A Ordinary Shares,10.22,0.0,2743,Uncategorized
QUMS,Quantumsphere Acquisition Corp. Ordinary Shares,10.155,0.0,1,Uncategorized
ONCH,1RT Acquisition Corp. Class A Ordinary Share,10.19,0.0,10034,Uncategorized
TDACU,Translational Development Acquisition Corp. Units,10.44,0.0,2,Uncategorized
TDAC,Translational Development Acquisition Corp. Ordinary Shares,10.64,0.0,2,Uncategorized
CAIIU,Collective Acquisition Corp. II Units,9.965,0.0,1850,Uncategorized
GSRF,GSR IV Acquisition Corp. Class A ordinary share,10.09,0.0,5771,Uncategorized
GSHR,Gesher Acquisition Corp. II Class A Ordinary Shares,10.37,0.0,50001,Uncategorized
GRML,Greenland Mines Ltd. Common Stock,0.5051,0.0,2816539,Uncategorized
ONCHU,1RT Acquisition Corp. Units,10.2866,0.0,34418,Uncategorized
CTAAR,ClearThink 1 Acquisition Corp. Rights,0.19,0.0,21489,Uncategorized
PLMKW,Plum Acquisition Corp. IV Warrants,0.4601,0.0,1754,Uncategorized
FIGX,FIGX Capital Acquisition Corp. Class A Ordinary Share,10.19,0.0,19,Uncategorized
PACH,Pioneer Acquisition I Corp Class A Ordinary Shares,10.18,0.0,7005,Uncategorized
CEPV,Cantor Equity Partners V Inc. Class A Ordinary Shares,10.25,0.0,9548,Uncategorized
OCCIM,OFS Credit Company Inc. 7.875% Series F Term Preferred Stock,25.1,0.0,2853,Uncategorized
HLXC,Helix Acquisition Corp. III Class A Ordinary Shares,10.2,0.0,289,Uncategorized
HCICU,Hennessy Capital Investment Corp. VIII Units,10.0301,0.0,79320,Uncategorized
HCICR,Hennessy Capital Investment Corp. VIII Share Rights,0.17,0.0,109200,Uncategorized
HCIC,Hennessy Capital Investment Corp. VIII Class A Ordinary Shares,9.87,0.0,76101,Uncategorized
AACBR,Artius II Acquisition Inc. Rights,0.3,0.0,654,Uncategorized
AACI,Armada Acquisition Corp. III Class A Ordinary Share,9.925,0.0,8,Uncategorized
AACIW,Armada Acquisition Corp. III Warrant,0.24,0.0,300,Uncategorized
AACO,Abony Acquisition Corp. I Class A Ordinary Share,9.91,0.0,950,Uncategorized
CCXIW,Churchill Capital Corp XI Warrants,0.72,0.0,240,Uncategorized
ABXL,Abacus Global Management Inc. 9.875% Fixed Rate Senior Notes due 2028,26.03,0.0,3290,Uncategorized
MBAV,M3-Brigade Acquisition V Corp. Class A Ordinary shares,10.7788,0.0,214,Uncategorized
MCAHU,Mountain Crest Acquisition 6 Corp. Units,10.02,0.0,33201,Uncategorized
MBVIW,M3-Brigade Acquisition VI Corp. Warrant,0.35,0.0,15535,Uncategorized
MBVI,M3-Brigade Acquisition VI Corp. Class A Ordinary Shares,10.11,0.0,13015,Uncategorized
LKSPU,Lake Superior Acquisition Corp. Units,10.18,0.0,688,Uncategorized
LPAA,Launch One Acquisition Corp. Class A Ordinary shares,10.74,0.0,31159,Uncategorized
GPATW,GP-Act III Acquisition Corp. Warrants,0.15,0.0,2700,Uncategorized
GPAT,GP-Act III Acquisition Corp. Class A Ordinary Share,10.84,0.0,151,Uncategorized
OXLCI,Oxford Lane Capital Corp. 8.75% Notes due 2030,25.75,0.0,2606,Uncategorized
GIWWU,GigCapital8 Corp. Units,10.22,0.0,110,Uncategorized
GIXXR,GigCapital9 Corp. Rights,0.261,0.0,17832,Uncategorized
GIW,GigCapital8 Corp. Class A Ordinary Shares,10.01,0.0,5862,Uncategorized
CAQ,Cambridge Acquisition Corp. Class A Ordinary Shares,9.86,0.0,157,Uncategorized
CAPN,Cayson Acquisition Corp Ordinary shares,11.05,0.0,3,Uncategorized
GSRFU,GSR IV Acquisition Corp. Units,10.27,0.0,100,Uncategorized
GIWWR,GigCapital8 Corp. Rights,0.285,0.0,27951,Uncategorized
PACHU,Pioneer Acquisition I Corp Units,10.3,0.0,100,Uncategorized
GPACU,General Purpose Acquisition Corp. Units,10.08,0.0,635,Uncategorized
GPAC,General Purpose Acquisition Corp. Class A Ordinary Shares,9.94,0.0,94321,Uncategorized
CCXI,Churchill Capital Corp XI Class A Ordinary Shares,10.22,0.0,1086,Uncategorized
CCIIW,Cohen Circle Acquisition Corp. II Warrant,0.5833,0.0,4319,Uncategorized
BEAG,Bold Eagle Acquisition Corp. Class A Ordinary Shares,10.54,0.0,767,Uncategorized
BGMS,Bio Green Med Solution Inc. Common Stock,1.0,0.0,17830,Uncategorized
BHAVU,BHAV Acquisition Corp Units,10.05,0.0,1548,Uncategorized
BHAV,BHAV Acquisition Corp Class A Ordinary Shares,9.89,0.0,24,Uncategorized
POLEW,Andretti Acquisition Corp. II Warrant,0.18,0.0,5174,Uncategorized
BEAGU,Bold Eagle Acquisition Corp. Units,10.76,0.0,6330,Uncategorized
BLZRU,Trailblazer Acquisition Corp. Unit,10.23,0.0,41,Uncategorized
TVAI,Thayer Ventures Acquisition Corporation II Class A Ordinary Shares,10.27,0.0,58404,Uncategorized
TVACW,Texas Ventures Acquisition III Corp Warrants,0.5501,0.0,8777,Uncategorized
EMAT,Evolution Metals & Technologies Corp. Common Stock,9.47,0.0,69933,Uncategorized
NOEMW,CO2 Energy Transition Corp. Warrant,0.0753,0.0,150,Uncategorized
NOEMU,CO2 Energy Transition Corp. Unit,11.84,0.0,1,Uncategorized
NOEM,CO2 Energy Transition Corp. Common Stock,10.41,0.0,76,Uncategorized
BIXI,Bitcoin Infrastructure Acquisition Corp Ltd. Class A Ordinary Shares,9.955,0.0,16774,Uncategorized
IGACR,Invest Green Acquisition Corporation Rights,0.1501,0.0,500,Uncategorized
PCAPU,ProCap Acquisition Corp Unit,10.3101,0.0,237,Uncategorized
AACB,Artius II Acquisition Inc. Class A Ordinary Shares,10.38,0.0,34,Uncategorized
GECCH,Great Elm Capital Corp. 8.125% Notes Due 2029,25.6061,0.0,3620,Uncategorized
BEAGR,Bold Eagle Acquisition Corp. Right,0.25,0.0,557,Uncategorized
IEAGU,Infinite Eagle Acquisition Corp. Unit,10.19,0.0,125,Uncategorized
HVMCW,Highview Merger Corp. Warrants,0.2775,0.0,2600,Uncategorized
HSPTU,Horizon Space Acquisition II Corp. Units,9.02,0.0,80,Uncategorized
NTWO,Newbury Street II Acquisition Corp Class A Ordinary Shares,10.59,0.0,204,Uncategorized
POLE,Andretti Acquisition Corp. II Class A Ordinary Shares,10.7,0.0,10301,Uncategorized
TMTS,Spartacus Acquisition Corp. II Class A Ordinary Shares,9.97,0.0,290,Uncategorized
TLNC,Talon Capital Corp. Class A Ordinary Shares,10.19,0.0,4462,Uncategorized
CHPG,ChampionsGate Acquisition Corporation Class A Ordinary Share,10.325,0.0,6,Uncategorized
BLRK,Bluerock Acquisition Corp. Class A Ordinary Shares,9.93,0.0,5402,Uncategorized
TVA,Texas Ventures Acquisition III Corp Class A Ordinary Share,10.525,0.0,32025,Uncategorized
CUBWW,Lionheart Holdings Warrant,0.14,0.0,2009,Uncategorized
HVMC,Highview Merger Corp. Class A Ordinary Share,10.11,0.0,5757,Uncategorized
BLRKW,Bluerock Acquisition Corp. Warrants,0.35,0.0,311,Uncategorized
BNCWW,CEA Industries Inc. Warrant,0.0251,0.0,16966,Uncategorized
CHARR,Charlton Aria Acquisition Corporation Rights,0.1,0.0,9307,Uncategorized
CHAR,Charlton Aria Acquisition Corporation Class A Ordinary Shares,10.735,0.0,426,Uncategorized
BPAC,Blueport Acquisition Ltd Class A Ordinary Shares,10.05,0.0,137,Uncategorized
ABR^D,Arbor Realty Trust 6.375% Series D Cumulative Redeemable Preferred Stock Liquidation Preference $25.00 per Share,17.01,,7400,Uncategorized
ABR^E,Arbor Realty Trust 6.25% Series E Cumulative Redeemable Preferred Stock,16.86,,2142,Uncategorized
ABR^F,Arbor Realty Trust 6.25% Series F Fixed-to-Floating Rate Cumulative Redeemable Preferred Stock Liquidation Preference $25.00 per share,23.39,,5449,Uncategorized
ACP^A,abrdn Income Credit Strategies Fund 5.250% Series A Perpetual Preferred Stock,19.97,,4104,Uncategorized
ACR^C,ACRES Commercial Realty Corp. 8.625% Fixed-to-Floating Series C Cumulative Redeemable Preferred Stock ,25.1,,4217,Uncategorized
ACR^D,ACRES Commercial Realty Corp. 7.875% Series D Cumulative Redeemable Preferred Stock,21.9,,5066,Uncategorized
ADC^A,Agree Realty Corporation Depositary Shares each representing 1/1000th of a 4.250% Series A Cumulative Redeemable Preferred Stock,17.06,,9950,Uncategorized
AGM^D,Federal Agricultural Mortgage Corporation 5.700% Non-Cumulative Preferred Stock Series D,20.56,,5911,Uncategorized
AGM^E,Federal Agricultural Mortgage Corporation 5.750% Non-Cumulative Preferred Stock Series E,21.08,,1807,Uncategorized
AGM^F,Federal Agricultural Mortgage Corporation 5.250% Non-Cumulative Preferred Stock Series F,19.09,,3300,Uncategorized
AGM^G,Federal Agricultural Mortgage Corporation 4.875% Non-Cumulative Preferred Stock Series G,17.68,,3112,Uncategorized
AGM^H,Federal Agricultural Mortgage Corporation 6.500% Non-Cumulative Preferred Stock Series H,24.245,,6713,Uncategorized
AHRT^A,AH Realty Trust Inc. 6.75% Series A Cumulative Redeemable Perpetual Preferred Stock,21.4,,2861,Uncategorized
AHT^D,Ashford Hospitality Trust Inc 8.45% Series D Cumulative Preferred Stock,7.3499,,4690,Uncategorized
AHT^F,Ashford Hospitality Trust Inc 7.375% Series F Cumulative Preferred Stock,6.0501,,1980,Uncategorized
AHT^G,Ashford Hospitality Trust Inc 7.375% Series G Cumulative Preferred Stock,5.9201,,10693,Uncategorized
AHT^H,Ashford Hospitality Trust Inc 7.50% Series H Cumulative Preferred Stock,6.15,,601,Uncategorized
AHT^I,Ashford Hospitality Trust Inc 7.50% Series I Cumulative Preferred Stock,6.0033,,14539,Uncategorized
ALB^A,Albemarle Corporation Depositary Shares each representing a 1/20th of 7.25% Series A Mandatory Convertible Preferred Stock,77.06,,16263,Uncategorized
ALL^B,Allstate Corporation (The) 5.100% Fixed-to-Floating Rate Subordinated Debentures due 2053,25.88,,13007,Uncategorized
ALL^H,Allstate Corporation (The) Depositary Shares each representing a 1/1000th interest in a share of Fixed Rate Noncumulative Perpetual Preferred Stock Series H,20.7414,,32894,Uncategorized
ALL^I,Allstate Corporation (The) Depositary Shares each representing a 1/1000th interest in a share of Fixed Rate Noncumulative Perpetual Preferred Stock Series I,19.21,,8693,Uncategorized
ALL^J,Allstate Corporation (The) Depositary Shares each representing a 1/1000th interest in a share of Fixed Rate Noncumulative Perpetual Preferred Stock Series J,26.18,,20616,Uncategorized
ALTG^A,Alta Equipment Group Inc. Depositary Shares (each representing 1/1000th in a share of 10% Series A Cumulative Perpetual Preferred Stock),25.26,,1942,Uncategorized
AMH^G,American Homes 4 Rent Series G cumulative redeemable perpetual preferred shares of beneficial interest,22.86,,5405,Uncategorized
AMH^H,American Homes 4 Rent Series H cumulative redeemable perpetual Preferred Shares of Beneficial Interest,23.73,,9465,Uncategorized
ANG^D,American National Group Inc. Depositary Shares each representing a 1/1000th interest in a share of 7.375% Fixed-Rate Non-Cumulative Preferred Stock Series D,24.78,,4666,Uncategorized
APO^A,Apollo Global Management Inc. 6.75% Series A Mandatory Convertible Preferred Stock,66.33,,37691,Uncategorized
ARES^B,Ares Management Corporation 6.75% Series B Mandatory Convertible Preferred Stock,41.15,,89351,Uncategorized
ARR^C,ARMOUR Residential REIT Inc. 7% Series C Cumulative Redeemable Preferred Stock (liquidation preference $25.00 per share),21.0,,19615,Uncategorized
ASB^E,Associated Banc-Corp Depositary Shares each representing a 1/40th interest in a share of 5.875% Non-Cumulative Perpetual Preferred Stock Series E,21.15,,4465,Uncategorized
ASB^F,Associated Banc-Corp Depositary Shares each representing a 1/40th interest in a share of Associated Banc-Corp 5.625% Non-Cumulative Perpetual Preferred Stock Series F,20.55,,2174,Uncategorized
AUB^A,Atlantic Union Bankshares Corporation Depositary Shares each representing a 1/400th ownership interest in a share of 6.875% Perpetual Non-Cumulative Preferred Stock Series A,25.0,,2149,Uncategorized
BA^A,Boeing Company (The) Depositary Shares each representing a 1/20th interest in a share of 6.00% Series A Mandatory Convertible Preferred Stock par value $1.00,73.05,,1265203,Uncategorized
BAC^B,Bank of America Corporation Depositary Shares each representing a 1/1000th interest in a share of 6.000% Non-Cumulative Preferred Stock Series GG,25.01,,87866,Uncategorized
BAC^E,Bank of America Corporation Depositary Sh repstg 1/1000th Perp Pfd Ser E,19.22,,24470,Uncategorized
BAC^K,Bank of America Corporation Depositary Shares each representing a 1/1000th interest in a share of 5.875% Non- Cumulative Preferred Stock Series HH,24.95,,66320,Uncategorized
BAC^L,Bank of America Corporation Non Cumulative Perpetual Conv Pfd Ser L,1227.45,,3216,Uncategorized
BAC^M,Bank of America Corporation Depositary Shares each representing a 1/1000th interest in a share of 5.375% Non-Cumulative Preferred Stock Series KK,22.01,,66139,Uncategorized
BAC^N,Bank of America Corporation Depositary shares each representing 1/1000th interest in a share of 5.000% Non-Cumulative Preferred Stock Series LL,20.52,,51871,Uncategorized
BAC^O,Bank of America Corporation Depositary shares each representing 1/1000th interest in a share of 4.375% Non-Cumulative Preferred Stock Series NN,17.62,,96390,Uncategorized
BAC^P,Bank of America Corporation Depositary Shares each representing a 1/1000th interest in a share of 4.125% Non-Cumulative Preferred Stock Series PP,16.78,,66620,Uncategorized
BAC^Q,Bank of America Corporation Depositary shares each representing 1/1000th interest in a share of 4.250% Non-Cumulative Preferred Stock Series QQ,17.07,,316129,Uncategorized
BAC^S,Bank of America Corporation Depositary shares each representing 1/1000th interest in a share of 4.750% Non-Cumulative Preferred Stock Series SS,19.28,,83249,Uncategorized
BANC^F,Banc of California Inc. Depositary Shares each representing a 1/40th interest in a share of 7.75% non-cumulative perpetual preferred stock Series F,25.55,,15116,Uncategorized
BC^C,Brunswick Corporation 6.375% Notes due 2049,24.56,,11731,Uncategorized
BCV^A,Bancroft Fund Limited 5.375% Series A Cumulative Preferred Shares,21.6553,,529,Uncategorized
BF/A,Brown Forman Corporation,27.55,,149577,Uncategorized
BF/B,Brown Forman Corporation,26.98,,4115903,Uncategorized
BFH^A,Bread Financial Holdings Inc. Depositary Shares each representing a 1/40th interest in a share of 8.625% Non-Cumulative Perpetual Preferred Stock Series A,25.04,,50882,Uncategorized
BFS^D,Saul Centers Inc. Depositary Shares each representing 1/100th of a share of 6.125% Series D Cumulative Redeemable Preferred Stock,20.655,,2908,Uncategorized
BFS^E,Saul Centers Inc. Depositary shares each representing a 1/100th fractional interest in a share of 6.000% Series E Cumulative Redeemable Preferred Stock,22.5,,2340,Uncategorized
BHR^B,Braemar Hotels & Resorts Inc. 5.50% Series B Cumulative Convertible Preferred Stock par value $0.01 per share,15.17,,2231,Uncategorized
BHR^D,Braemar Hotels & Resorts Inc. 8.25% Series D Cumulative Preferred Stock  par value $0.01 per share,16.5,,357,Uncategorized
BIO/B,Bio-Rad Laboratories Inc.,261.2656,,107,Uncategorized
BK^K,The Bank Of New York Mellon Corporation  Depositary Shares each representing a 1/4000th interest in a share of Series K Noncumulative Perpetual Preferred Stock,25.53,,18300,Uncategorized
